User Type,Username,Date,Text
,lliwmfhita,2011-04-24T19:56Z,i have a collection of over 250 xxx movies if you are looking for a certain one let me know if i have it i will upload it for you. I am new to uploading so bear with me.
,lliwmfhita,2011-04-24T19:58Z,if you are looking for a certain movie let me know and i will upload it i have a collection of over 250 xxx movies and many other new releases
,anakamaha,2011-04-25T07:37Z,"Thanks, love everyone"
,john_smith3088,2011-04-27T00:09Z,"Hi lliwmfhita, do you have any under age teen porn?
like 12 or 13 yr old...
I don't have any of 'em......"
,davido6666,2011-04-27T03:02Z,john you are a fucking sick person
,tpbfan32,2011-04-27T16:02Z,john...you're just beyond a pervert.
,Skunkweed666,2011-04-28T10:42Z,xD @John :P
,movie101,2011-04-30T07:32Z,john is no perv he's a fucking chester melester!!
,roope667,2011-05-01T06:44Z,"I wanna some real nasty porn.. 
these are for childrens."
,kizzck,2011-05-01T15:59Z,@john_smith3088 you sick fuck.
,doodadad,2011-05-02T06:11Z,john youre a sick perverted fuck. you need your ass beat.... seriously
,eastley9,2011-05-02T07:50Z,"John sicko, hey do you have Corporate Fantasy"
,whiteattack,2011-05-05T04:54Z,@john you are a fucking sick person. If you have those thoughs you need to die man.
,Wegner05,2011-05-05T19:36Z,lliwmfhita would you possibly by chance have Color Me Amber? Its a vintage flick starring Amber Lynn. I have yet to find it anywhere
,hom3c4ll,2011-05-06T05:00Z,"Oh man. XD
John trolled you guys pretty hard. d:"
,ectoplasma2,2011-05-16T19:52Z,Does anyone have the original animal farm? I hear it s cult :D
,starbug1979,2011-05-17T11:56Z,@lliwmfhita can you upload a list maybe??
,delviskar,2011-05-22T23:29Z,Wow you guys are kind of idiots if you believe what John actually wrote..
,philtaylor007,2011-05-23T10:15Z,john is probably law inforcement! just looking around for the peados! 
,samsat1024,2011-05-29T03:46Z,Thank you! You are the best!
,bomber9299,2011-06-07T17:04Z,A/V? 
,JihadTime,2011-06-14T00:43Z,"Hey John I have Some 12year oldporn, You can have. Only problem is it's a bit dusty after being in the cuboard all those years. Joking aside you are a sick fuck!"
,EndFED,2011-06-15T08:46Z,"@john_smith3088, you can have the cops on you even if you were joking but if you were serious you definitively need help like cutting off your balls.

@JihadTime, you can have the police on you even if you were just messing with john. I dont think you were serious but just a word of advice.
"
,Master_Shake503,2011-06-17T05:13Z,He meant he had home videos of himself proble taking a bath I know I do.
,iCondemned_88,2011-06-21T15:18Z,Funny Adult movie. Thank you. It was hot too.
,daft661,2011-06-26T23:04Z,lliwmfhita hei maybe you have devon films... not devon mitchels just devon
,patriot18386,2011-08-18T12:46Z,im looking for the parody of indiana jones if you can do that thx
,goheatbitch,2011-08-22T13:43Z,Dude Fuck! Fuck Rules!
,joeteds,2011-08-31T02:02Z,@john_smith - You sick cunt please throw yourself infront of a train you sick piece of shit. By the way I have phoned the police and with any luck your being here from them very soon. 
,wfinken,2011-09-05T01:48Z,working screens?
,kandei,2011-09-11T21:26Z,My best friend's ex goes by John Smith on Facebook. COINCIDENCE?
,fabioboss,2012-01-22T22:45Z,"seedimage seems that's not working today...
alternative screens: 
http://www.ianaz.com/5e3ac6d94.html
http://www.ianaz.com/e4d7321f1.html"
