User Type,Username,Date,Text
,takalaiton,2011-04-24T04:57Z,kiitoksia . näistä nostalgiakappaleista nousee hymy naamalle. hauskoja soitettavia ku ukkojen kaa käy kalareissuilla ;)
,ranskis,2011-04-24T04:59Z,"Kiits :) Oliskohan Eija Kantolaa, kyselee toiveikkaana..?"
,takalaiton,2011-04-24T05:02Z,"höh, unohin kysästä et jaksakko viel seedaa tuon kinnusen, siel näköjää aikas hiljasta . . ."
,aamukaste,2011-04-24T05:11Z,No nyt pitäis siihenkin bittiä olla matkalla.
,takalaiton,2011-04-24T09:42Z,"taks, hyvin tuli, jätin noi muutamat  ratiol 10 seediin ni pitas helpottaa sun osuutta"
,aamukaste,2011-04-24T10:35Z,Kiittää. Kaltaisiasi tarvittaisi enemmänkin tässä maailmassa.
