User Type,Username,Date,Text
,MikesUploadz,2011-08-22T14:55Z,"Thanks you guys for seeding. I have more movies like this, i will upload them soon. "
[S],velvet.,2011-08-22T19:37Z,"Do NOT upload movie rips to the Movies DVDR category.
Movies DVDR is only for complete DVD images."
,MikesUploadz,2011-08-22T20:51Z,@velvet. What is a complete DVD image? 
,MikesUploadz,2011-08-23T21:25Z,Please leave comments after downloading!
,MikesUploadz,2011-08-27T03:53Z,"If you want the movie ""Friday"" [1995] by Ice Cube view my other torrents! I also have Hustle & Flow!"
