Filename,Size,Unit
CD1/1. Somebody To Love Queen.mp3,11.34,M
CD1/10. You Don't Have To Say You Love Me Dusty Springfield.mp3,6.41,M
CD1/11. Delilah Tom Jones.mp3,7.74,M
CD1/12. Brown Eyed Girl Van Morrison.mp3,6.99,M
CD1/13. Albatross Fleetwood Mac.mp3,7.17,M
CD1/14. Wild World Cat Stevens.mp3,7.58,M
CD1/15. Hot Love T.Rex.mp3,11.38,M
CD1/16. Cum On Feel The Noize Slade.mp3,10.2,M
CD1/17. Paranoid Black Sabbath.mp3,6.4,M
CD1/18. All The Young Dudes Mott The Hoople.mp3,8,M
CD1/19. Life On Mars David Bowie.mp3,8.75,M
CD1/2. Brown Sugar Rolling Stones.mp3,8.72,M
CD1/20. Tubular Bells Mike Oldfield.mp3,9.76,M
CD1/3. Maggie May Rod Stewart.mp3,8.49,M
CD1/4. Rocket Man Elton John.mp3,10.76,M
CD1/5. Nights In White Satin The Moody Blues.mp3,10.08,M
CD1/6. Waterloo Sunset The Kinks.mp3,7.37,M
CD1/7. The House Of The Rising Sun The Animals.mp3,10.23,M
CD1/8. My Generation The Who.mp3,7.54,M
CD1/9. All Or Nothing Small Faces.mp3,7,M
CD2/1. I'm Not In Love 10CC.mp3,8.53,M
CD2/10. Ghost Town The Specials.mp3,8.34,M
CD2/11. Food For Thought UB40.mp3,9.49,M
CD2/12. Jealous Guy Roxy Music.mp3,10.86,M
CD2/13. Come On Eileen Dexy's Midnight Runners.mp3,7.81,M
CD2/14. Do You Really Want To Hurt Me Culture Club.mp3,10,M
CD2/15. Tainted Love Soft Cell.mp3,6.09,M
CD2/16. Gold Spandau Ballet.mp3,8.84,M
CD2/17. Rio Duran Duran.mp3,10.82,M
CD2/18. Don't You Want Me Human League.mp3,9.03,M
CD2/19. Relax Frankie Goes To Hollywood.mp3,8.93,M
CD2/2. Live & Let Die Paul Mccartney & Wings.mp3,7.14,M
CD2/20. Blue Monday New Order.mp3,17.06,M
CD2/3. The Air That I Breathe The Hollies.mp3,9.39,M
CD2/4. The Logical Song Supertramp.mp3,9.49,M
CD2/5. Love And Affection Joan Armatrading.mp3,10.13,M
CD2/6. Whatever You Want Status Quo.mp3,8.74,M
CD2/7. Oliver's Army Elvis Costello & The Attractions.mp3,6.78,M
CD2/8. It Must Be Love Madness.mp3,7.62,M
CD2/9. A Town Called Malice The Jam.mp3,6.61,M
CD3/1. Every Breath You Take The Police.mp3,9.39,M
CD3/10. Common People Pulp.mp3,13.37,M
CD3/11. Song 2 Blur.mp3,4.59,M
CD3/12. You Do Something To Me Paul Weller.mp3,8.33,M
CD3/13. Yellow Coldplay.mp3,10.26,M
CD3/14. Patience Take That.mp3,7.63,M
CD3/15. Is It Any Wonder Keane.mp3,7,M
CD3/16. Ruby Kaiser Chiefs.mp3,7.71,M
CD3/17. America Razorlight.mp3,9.5,M
CD3/18. Dakota Stereophonics.mp3,11.33,M
CD3/19. Back To Black Amy Winehouse.mp3,9.16,M
CD3/2. Enjoy The Silence Depeche Mode.mp3,9.42,M
CD3/20. The Fear Lily Allen.mp3,7.92,M
CD3/3. In Between Days The Cure.mp3,6.75,M
CD3/4. Fools Gold Stone Roses.mp3,9.59,M
CD3/5. Back To Life (However Do You Want Me) Soul II Soul.mp3,8.36,M
CD3/6. Why Annie Lennox.mp3,11.2,M
CD3/7. Fast Love George Michael.mp3,12.55,M
CD3/8. Loaded Primal Scream.mp3,9.56,M
CD3/9. Creep Radiohead.mp3,9.07,M
Ariclenes.png,106.79,K
back.jpg,998.47,K
DutchReleaseTeam NFO.txt,448,B
DutchReleaseTeam.png,105.06,K
front.jpg,925.39,K
Torrent downloaded from Demonoid.me.txt,46,B
