User Type,Username,Date,Text
,Rea1Dea1Stee1,2011-10-24T14:14Z,does this mean i wont keep getting the disc read error when trying to play the bigger games???
,ttamp,2011-10-24T15:06Z,i knew i couldnt have been the only one havin trouble lol thx sunblock
,Rea1Dea1Stee1,2011-10-26T19:16Z,still having trouble with the read disc error with this anyone help???
,ttamp,2011-11-02T02:28Z,dont work for me eder ;-(   1 red lite. i have the latest dash any help sunblock? i also have a benq spoofed as sammy with lt 2 on it it dont work eder
,KingKool,2011-11-28T23:42Z,"C4E released the iXtreme LT+ v2.0 CFW for all versions of the Hitachi-LG GDR-3120L drive (‘PHAT Hitachi’):

C4E’s iXtreme LT+ in association with Team Jungle & Team Xecuter

Official release of the iXtreme LT+ v2.0 for Hitachi drives
- Support for XGD3 ixtreme backups using LT-MAX for maximum capacity on standard DVD+R DL discs.
- Support for large capacity DVD+R DL media (no errors when burning)

About upcoming iXtreme LT+ 3.0 – released after December 6th
Originals will need to be analysed by XBC to gain disc topology data. This data replaces the need for ap25/dae.bin data and enables any ap25 challenge to be answered correctly. The topology data method is very efficient using only 24k and is very accurate. Each title will need its own topology data as there are differences between titles, even xgd3 titles and backups can be detected if the same topology data is used between titles.
Backups will remain the same layout but will need the new topology data inserted by the new abgx or re-dumped with the new XBC for xgd2/ap25 or xgd3 titles.
Non ap25 titles will remain unchanged

Thanks go to Team Jungle for their hard work and efforts in the development process.
Thanks also go to Team Xecuter for their support to this project."
