User Type,Username,Date,Text
,jersson,2011-05-23T22:06Z,This must be the best I've ever tried. thank's
,jersson,2011-05-23T22:08Z,"This must be the best I've ever tried. thank's
Install info please"
[V],Anacondaz,2011-05-24T03:50Z,"Just replace ""PCFix.exe""
into the install directory"
,pickthedog,2011-05-24T18:30Z,24/05/2011 17:11:38	Real-time file system protection	file	C:\Documents and Settings\Administrator\Desktop\lxp11305\PCFix.exe	probably a variant of Win32/Adware.PCFixCleaner application	cleaned by deleting - quarantined	
,pickthedog,2011-05-24T18:53Z,Thats a false positive from nod 32 is it ?
