User Type,Username,Date,Text
,saumarin,2011-07-27T12:30Z,"Thanks ClaudiaZ for the upload.

Cheeky1972 I haven´t found the GH from januar to september 2009 with both months included. Do you have more GH episodes from early years say 2005?  "
[V],ClaudiaZ,2011-07-27T19:50Z,"Dear saumarin, I'm afraid I started posting on December 2008, so I haven't got any episodes before that date... And I can't figure out where my 2009 episodes are :-("
,Cheeky1972,2011-07-30T08:02Z,"Saumarin....I don't have any earlier episodes...but if you would like to talk about possibly posting you the months you want...please email me and we'll discuss it to  Streaky1985@hotmail.com
Cheers"
,saumarin,2011-08-02T21:10Z,Cheeky1972..........  I have send you a email so I hope to hear from you.
