User Type,Username,Date,Text
,modoman,2011-09-16T08:56Z,"You`ve just made my wife very happy, many, many thanks."
,pinkpetal,2011-09-17T03:16Z,Oh thanks so much!
,bookluver,2011-09-18T19:32Z,"I'm hoping you can find ""I don't know how she does it"" and any other books by Allision Pearson.  Thanks so much for posting great and reliable downloads.
"
,argo81,2012-02-05T04:33Z,Includes: Earthly Joys; The Boleyn Inheritance; The Constant Princess; The Other Boleyn Girl; The Other Queen; The Queen's Fool; The Virgin's Lover; Virgin Earth.  Thanks a lot!!!
