User Type,Username,Date,Text
[V],achaevil,2011-03-29T11:18Z,please don't stop ur seeding
,msal,2011-03-29T11:37Z,"thanks i upload all your great rips 
http://cxg.de/_132702.htm"
,i_am_sid,2011-03-29T20:23Z,"@acharya
I downloaded 'whiteout' from you. Watched the video and gave +1. But today i start watching it. I found Hindi Audio out of sync and English audio is hardly audible. Over all, not watchable. Any reason???? 
From info Bourne series seems awesome. Really want these. Wont give +1 utill i watch it this time. 
But would say, thanks a lot. It takes efforts to put these up."
,rik9831,2011-03-31T20:44Z,please can u upload Taken (2008) in hindi..
,amey000joshi,2011-06-14T18:16Z,@acharya hello sir very good job done a tons of thanks to u pls upload bourne ultimatum
[V],achaevil,2011-06-21T09:07Z,"The Bourne Ultimatum-720p Dual{Hindi-Eng}BRrip.aaaevilacharya 

download link:http://thepiratebay.org/torrent/6483993/The_Bourne_Ultimatum-720p_Dual_Hindi-Eng_BRrip.aaaevilacharya

The Bourne Identity Dual Audio{Eng-Hindi}BRRip.aaaevilacharya 

download link:http://thepiratebay.org/torrent/6274898/The_Bourne_Identity_Dual_Audio_Eng-Hindi_BRRip.aaaevilacharya"
[V],achaevil,2011-06-21T18:26Z,click on QUALITY. if u like my torrent 
,i_am_sid,2011-06-21T19:37Z,Top notch quality. Thanks a lot.
,maniyar1,2011-08-22T04:44Z,Seeding Is Very Low...Please Do Something...
,maniyar1,2011-08-26T16:19Z,Ok.Don With Download. Now Seeding... Good Quality... 10/10....
,saini28,2011-09-01T06:14Z,@achaevil-- plz don't mind if i give u a advice.... plz if u can then plzz upload a little sample of the specific movie with it... it's just an advice and request....
