Filename,Size,Unit
"Beards, Beards, Beards/09 My Baby Left Me for a Man Without.mp3",14.92,M
"Beards, Beards, Beards/11 Best Beard Out.mp3",12.18,M
"Beards, Beards, Beards/06 Beards Don't Kill People, People.mp3",11.96,M
"Beards, Beards, Beards/01 Born With a Beard.mp3",10.62,M
"Beards, Beards, Beards/03 Beards Across Australia Unite.mp3",10.59,M
"Beards, Beards, Beards/10 Beard Love.mp3",9.75,M
"Beards, Beards, Beards/02 No Beard, No Good.mp3",9.13,M
"Beards, Beards, Beards/05 If Your Dad Doesn't Have a Beard,.mp3",8.43,M
"Beards, Beards, Beards/04 Baby's Got a Beard.mp3",8.22,M
"Beards, Beards, Beards/07 Weird Beard.mp3",7.44,M
"Beards, Beards, Beards/08 Shaved Off His Beard.mp3",6.52,M
"Beards, Beards, Beards/12 Beard Leave (hidden track).mp3",2.92,M
"Beards, Beards, Beards/Beards, Beards, Beards.jpg",18.68,K
The Beards/10 Big Bearded Bruce.mp3,17.11,M
The Beards/08 The Tale Of The Amish Boy (And Hi.mp3,11.68,M
The Beards/06 Beard's Gone Away (Live).mp3,9.66,M
The Beards/02 Growing A Beard.mp3,8.04,M
The Beards/01 The Beards Club.mp3,7.78,M
The Beards/12 Who Told You To Shave Off Your Be.mp3,7.06,M
The Beards/03 Beard Revolution.mp3,6.61,M
The Beards/09 It Only Takes A Fortnight To Grow.mp3,6.35,M
The Beards/11 Radio Interview #3.mp3,4.87,M
The Beards/04 Radio Interview #1.mp3,4.74,M
The Beards/05 A Wizard Needs A Beard.mp3,4.68,M
The Beards/07 Radio Interview #2.mp3,4.27,M
The Beards/The Beards.jpg,68.16,K
