Filename,Size,Unit
Muppet Show Music Album-11-Macho Man.mp3,4.75,M
Muppet Show Music Album-10-Magic Garden.mp3,4.63,M
Muppet Show Music Album-14-Coconut.mp3,4.13,M
Muppet Show Music Album-07-Jamboree.mp3,3.61,M
Muppet Show Music Album-09-Jam.mp3,3.49,M
Muppet Show Music Album-19-It Was A Very Good Year.mp3,3.48,M
Muppet Show Music Album-16-Dog Walk.mp3,3.45,M
Muppet Show Music Album-08-Henrietta's Wedding.mp3,3.41,M
Muppet Show Music Album-12-Mad About The Frog.mp3,3.34,M
Muppet Show Music Album-06-Do Wah Diddy Diddy.mp3,3.34,M
Muppet Show Music Album-15-Frog Kissing.mp3,3.19,M
Muppet Show Music Album-04-Blue Skies.mp3,3.18,M
Muppet Show Music Album-03-The Rhyming Song.mp3,3,M
Muppet Show Music Album-13-Pennsylvania 6-5000.mp3,2.7,M
Muppet Show Music Album-05-Eight Little Notes.mp3,2.68,M
Muppet Show Music Album-18-Sixty Seconds Got Together.mp3,2.33,M
Muppet Show Music Album-02-Hawaiian War Chant.mp3,2.26,M
Muppet Show Music Album-17-While My Guitar Gently Weeps.mp3,2.18,M
Muppet Show Music Album-01-The Muppet Show Theme.mp3,2.01,M
Muppet Show Music Album-20-The Muppet Show Theme.mp3,1.52,M
album front.jpg,49.43,K
album rear.jpg,47.51,K
Muppet Show Music Album-00-PLAYLIST.m3u,2.15,K
