Filename,Size,Unit
A Fork in the Road.jpg,8.55,M
A.Fork.in.the.Road.2010.PAL.Retail.NL.Subs.DMT/A_FORK_IN_THE_ROAD.ISO,4.36,G
A.Fork.in.the.Road.2010.PAL.Retail.NL.Subs.DMT.nfo,1.47,K
"DMT NFO, Read before Playing.txt",1.38,K
Torrent downloaded from AhaShare.com.txt,58,B
Torrent downloaded from Demonoid.me.txt,46,B
Torrent downloaded from Rarbg.com.txt,33,B
Torrent downloaded from silvertorrents.me.txt,29,B
Torrent Downloaded from TorrentState.com.txt,46,B
Torrent_downloaded_from_www.puretorrents.cc.txt,36,B
