User Type,Username,Date,Text
,nemosrings,2011-10-09T14:48Z,This is a mac app? :D
,nemosrings,2011-10-09T15:00Z,"If it were a mac app, they should call it Macrar lol"
,Vinnie_soprano,2011-10-09T15:29Z,wrong section
[T],nobody2007,2011-10-16T19:46Z,"Es gibt definitiv kein Winwar fĂźr den Mac.

Die Alternative dazu heiĂt am Mac ""unRarX"", welches sogar Freeware ist, und auch in einem Bundle mit Packer, Splitter etc. im Netz frei zu finden und haben ist.
Oder man sucht sich das ganze auf Macupdate.com zusammen."
