Filename,Size,Unit
Electro Doctor Vol.1/Dr._Kucho__Feat._Robert_Manos_-_Every_Word__Dj_Kone___Marc_Palacios_Remix_.mp3,10.18,M
Electro Doctor Vol.1/Armin_Van_Buuren_Feat._Nadia_Ali_-_Feels_So_Good__Armin_Van_Buuren_Club_Mix_.mp3,8.9,M
Electro Doctor Vol.1/Ellie_Goulding_-_Lights__Adrien_Mezsi_Reboot_.mp3,8.33,M
Electro Doctor Vol.1/Criminal_Vibes_-_Better_Off_Alone__Original_Mix_.mp3,8.14,M
Electro Doctor Vol.1/Adam_Lambert_-_If_I_Had_You__Johnny_Labs_Remix_.mp3,7.55,M
Electro Doctor Vol.1/Adele_-_Set_Fire_To_The_Rain__Thomas_Gold_Dub_.mp3,7.37,M
Electro Doctor Vol.1/Basslovers_United_vs._Jack_K___Dave_S_-_Forever_Is_Over_Braucht_Ihr_Mehr___By_Bodzii_Mash_Up_.mp3,7,M
Electro Doctor Vol.1/Alexandra_Stan_-_Mr._Saxobeat___Jay_Velar_Remix_.mp3,6.29,M
Electro Doctor Vol.2/Gigi Dagustino - Ill Fly With You (Goldilya Remix).mp3,18.32,M
Electro Doctor Vol.2/Hannah & Miami Calling - Take Over Now (Giuseppe Ottaviani Remix).mp3,17.24,M
Electro Doctor Vol.2/Lifework Feat. Karen Orchin - You Won't See My Tears (Club Junkies Club Mix).mp3,16.63,M
Electro Doctor Vol.2/Dr. Kucho! Feat. Robert Manos - Every Word (Dj Kone & Marc Palacios Remix).mp3,16.57,M
Electro Doctor Vol.2/Lady GaGa - The Edge Of Glory (Big Kid Progressive Big Room Mix).mp3,16.35,M
Electro Doctor Vol.2/Ricchi E Poveri - Sara Perche Ti Amo (Sergey Static Remix 2011).mp3,16.19,M
Electro Doctor Vol.2/Armin Van Buuren Feat. Nadia Ali - Feels So Good (Armin Van Buuren Club Mix).mp3,14.53,M
Electro Doctor Vol.2/Paradise - See The Light (Super Stylers 2011 Re-Work Club).mp3,14.31,M
Electro Doctor Vol.2/Tiesto & Hardwell vs. Swedish House Mafia - Save The World vs. Zero76 (Hardwell Mash Up).mp3,13.76,M
Electro Doctor Vol.2/Ellie Goulding - Lights (Adrien Mezsi Reboot).mp3,13.4,M
Electro Doctor Vol.2/Criminal Vibes - Better Off Alone (Original Mix).mp3,13.37,M
Electro Doctor Vol.2/Whitney Houston - Its Not Right But Its Ok (Dj Denis Rublev & Dj Anton Club Mix).mp3,13.19,M
Electro Doctor Vol.2/Ritmo Playaz - Everybody Loves The Sunshine (Sunloverz Remix).mp3,13,M
Electro Doctor Vol.2/Sidney Samson vs. Tara McDonald - Dynamite (Nicky Romero Remix).mp3,12.82,M
Electro Doctor Vol.2/Jose Delgado Feat. Danny Ulman - Tell Me Why (Original Mix).mp3,12.39,M
Electro Doctor Vol.2/Katherine Ellis & Addict Djs - I'm Coming Out (Bitrocka Remix).mp3,12.37,M
Electro Doctor Vol.2/Adele - Set Fire To The Rain (Thomas Gold Dub).mp3,12.19,M
Electro Doctor Vol.2/Adam Lambert - If I Had You (Johnny Labs Remix).mp3,12.19,M
Electro Doctor Vol.2/Miranda - Vamos A La Playa 2011 (Booty-B! Remix).mp3,12.02,M
Electro Doctor Vol.2/Lasgo - Here With Me (Extended Club Mix).mp3,11.69,M
Electro Doctor Vol.2/Taio Cruz - Dynamite (Goldilya Remix).mp3,11.48,M
Electro Doctor Vol.2/Basslovers United vs. Jack K & Dave S - Forever Is Over Braucht Ihr Mehr ( By Bodzii Mash Up).mp3,11.45,M
Electro Doctor Vol.2/Luciana - I'm Still Hot (Extended Mix).mp3,11.02,M
Electro Doctor Vol.2/Lmfao Feat. Natalia Kills - Champagne Showers (R3HAB Remix).mp3,10.79,M
Electro Doctor Vol.2/Alexandra Stan - Mr. Saxobeat ((Jay Velar Remix).mp3,10.3,M
Electro Doctor Vol.2/Jennifer Lopez - Waiting For Tonight 2011 (Guto Rodrigues Edit).mp3,9.58,M
Electro Doctor Vol.2/Loona - El Tiburon (Sean Finn Remix).mp3,9.56,M
Electro Doctor Vol.2/Lux - Cherry Bomb (Hoxton Whores Edit).mp3,8.96,M
Electro Doctor Vol.2/Play & Win - Ya Bb (Club Mix).mp3,8.68,M
Electro Doctor Vol.2/Snoop Dogg & David Guetta - Sweat (Crazy Disco Sound Remix).mp3,8.56,M
Electro Doctor Vol.2/Britney Spears - I Wanna Go (Edson Pride Edit).mp3,8.46,M
Electro Doctor Vol.2/Wolfgang Gartner Feat. Will.I.Am - Forever (Extended Mix).mp3,8.26,M
Electro Doctor Vol.2/Cher Lloyd - Swagger Jagger (Hygrade Mix).mp3,8.01,M
Electro Doctor Vol.2/Roxette - Listen To Your Heart (Dj Velchev Pavel Remix).mp3,7.15,M
Electro Doctor Vol.2/Stromae vs. Goman - Alors On Good Danse (Silvinhoo Bross Remix).mp3,6.26,M
Electro Doctor Vol.3/Armin Van Buuren Feat. BT - These Silent Hearts (Ralphie B Remix).mp3,21.83,M
Electro Doctor Vol.3/Armin Van Buuren - I Dont Own You(Andy Moor Remix).mp3,20.47,M
Electro Doctor Vol.3/Beyonce - Best Thing I Never Had (Hector Fonseca Club Mix).mp3,19.89,M
Electro Doctor Vol.3/Aly & Fila Feat. Jwaydan - We Control The Sunlight (Original Mix).mp3,19.57,M
Electro Doctor Vol.3/Protoculture Feat. Shannon Hurley - Sun Gone Down (Original Mix).mp3,18.4,M
Electro Doctor Vol.3/Alex Gaudino - Kissed (Original Mix).mp3,17.95,M
Electro Doctor Vol.3/Adele - Set Fire To The Rain (Moto Blanco Remix).mp3,17.65,M
Electro Doctor Vol.3/Dr. Kucho! - Hale Bopp (Original Mix).mp3,17.57,M
Electro Doctor Vol.3/Strobe - Liebe (Danny Freakazoid & Strobe Summer Of Love 2011 Mix).mp3,17.49,M
Electro Doctor Vol.3/Fast Distance & Dimension Feat. Anthya - Let Me Survive (Craving & Howe Remix).mp3,17.45,M
Electro Doctor Vol.3/Richard Durand Feat. Kash - Explode (George Acosta Remix).mp3,17.06,M
Electro Doctor Vol.3/Dj Nil - Hop Hey Hop (Original Mix).mp3,17.05,M
Electro Doctor Vol.3/Brian Black & Fatih Oz - Rhythm Of The Drum 2011 (Private Bootleg Mix).mp3,16.58,M
Electro Doctor Vol.3/Dj Sammy Feat. Jean-Baptiste Nyah - Animal (Jose Demara Mix).mp3,16.39,M
Electro Doctor Vol.3/Kings Of Tomorrow - Finally (East & Young Remix).mp3,16.21,M
Electro Doctor Vol.3/Dune vs. Alesso - Heiress Of Valentina (Jean Elan Remix).mp3,15.81,M
Electro Doctor Vol.3/Katy Perry - Last Friday Night (M.Torrez Beck Mix).mp3,15.79,M
Electro Doctor Vol.3/Ralvero & Dadz N Effect - In My Bedroom (StevenD Remix).mp3,15.45,M
Electro Doctor Vol.3/Britney Spears - Up N Down (Tulio Reis Club Mix).mp3,15.37,M
Electro Doctor Vol.3/K.S. Project - Empty Skies (Extended Mix).mp3,14.96,M
Electro Doctor Vol.3/Lux - Cherry Bomb (Hoxton Whores Dub).mp3,14.96,M
Electro Doctor Vol.3/Adele - Rolling In Deep (Flobers Brothers Remix).mp3,14.74,M
Electro Doctor Vol.3/Alexis Dante & JM Sicky Feat. Eva Menson - Alive (Soundshakerz Club Extended Mix).mp3,14.42,M
Electro Doctor Vol.3/Dj Smash - Blueberry Hill (Extended Mix).mp3,14.36,M
Electro Doctor Vol.3/Loona - El Tiburon (Sean Finn Remix).mp3,14.33,M
Electro Doctor Vol.3/Pitbull Feat. Enrique Iglesias - Come N Go(SheFF & TubaSS Booty Mix).mp3,14.24,M
Electro Doctor Vol.3/Example - Stay Awake (Pitron & Sanna Remix).mp3,14.04,M
Electro Doctor Vol.3/Ian Carey & Snoop Dogg - Last Night (Anthony Welling Mix).mp3,13.99,M
Electro Doctor Vol.3/Global Deejays - Freakin Out (Original Mix).mp3,13.63,M
Electro Doctor Vol.3/Jean Roch Feat. Flo Rida & Kat Deluna - I'm  Alright (Maxime Torres & Datamotion Club Remix).mp3,13.42,M
Electro Doctor Vol.3/Kalwi & Remi Feat. Amanda Wilson - You & I (The Winners Vocal Remix).mp3,13.39,M
Electro Doctor Vol.3/Don Omar Feat. Lucenzo - Danza Kuduro (Kirillich Feat. Oleg Petroff & Cvet Remix).mp3,13.39,M
Electro Doctor Vol.3/Example - Changed The Way You Kiss Me (The Faidox Project Remix).mp3,13.35,M
Electro Doctor Vol.3/Destiny's Child - Bug A Boo (Sunglasses Dj's & Dj Shukshin Remix).mp3,13.15,M
Electro Doctor Vol.3/Rico Bernasconi - Bollywood (Ades Vapor Remix).mp3,13.04,M
Electro Doctor Vol.3/Dj Midi Feat. MCSar & The Real McCoy - Jump (Extended Club Mix).mp3,12.99,M
Electro Doctor Vol.3/Alex Mind Feat. BBK - Glow Sticks (Original Mix).mp3,12.97,M
Electro Doctor Vol.3/Shaun Baker Feat. Jessica Jean & Discomakers - Addiction (Michael Burek Extended Remix).mp3,12.96,M
Electro Doctor Vol.3/Mike Nero - Smiling Faces 2011 (C-Energized Remix).mp3,12.87,M
Electro Doctor Vol.3/Lockhard Feat. David Posor - Haende Rauf (Neitan Remix).mp3,12.78,M
Electro Doctor Vol.3/Nicole Scherzinger - Right There Right There (Chris Lake Remix).mp3,12.76,M
Electro Doctor Vol.3/Alexia - Me & You (Peter Walley & MRG 2k11 Remix).mp3,12.43,M
Electro Doctor Vol.3/Dj Antoine vs. Timati Feat. Kalenna - Welcome To St. Tropez (LX-Tronix Remix).mp3,12.37,M
Electro Doctor Vol.3/RadioGaGA - Poker Face (Antonio Pilloni & Leo Zebra Remix).mp3,12.24,M
Electro Doctor Vol.3/Ludacris - Act A Fool (Stanislav Shik & Maluta Remix).mp3,12.17,M
Electro Doctor Vol.3/Despina Vandi - Opa Opa (Dj Adem & Dj Liman Summer Mix).mp3,12.14,M
Electro Doctor Vol.3/Sander Van Doorn - Koko (R3HAB Remix).mp3,12.12,M
Electro Doctor Vol.3/Liviu Hodor Feat. Mona - Sweet Love (Original Extended Mix).mp3,12.08,M
Electro Doctor Vol.3/Inna - Club Rocker (The Perez Brothers Remix).mp3,12.06,M
Electro Doctor Vol.3/Jeremih Feat. 50 Cent - Down On Me (Dj Dark & Shidance Remix).mp3,11.9,M
Electro Doctor Vol.3/Dj Viduta - Feel Me (Extended Mix).mp3,11.81,M
Electro Doctor Vol.3/Alex Gaudino Feat. Kelly Rowland - What a Feeling (Sunship Extended Mix).mp3,11.73,M
Electro Doctor Vol.3/Funkerman - Speed Up (Valentine Khaynus Remix).mp3,11.69,M
Electro Doctor Vol.3/Dan Balan - Freedom (Nekit Crash & Pavel Mania Mash Up).mp3,11.59,M
Electro Doctor Vol.3/Stereo Palma - Lick It (Original Mix).mp3,11.49,M
Electro Doctor Vol.3/Mike McPower vs. Mad Matt - Love Me (Gordon Max vs. Mike & Max Remix).mp3,11.44,M
Electro Doctor Vol.3/Dj Mafia - Love (Club Mix).mp3,11.42,M
Electro Doctor Vol.3/Lmfao Feat. Natalia Kills - Champagne Showers (Matt Nevin Extended Mix).mp3,11.35,M
Electro Doctor Vol.3/Coffee & Honey Feat. Alexandra - This Is My Love (System P Remix).mp3,11.18,M
Electro Doctor Vol.3/Madonna - Barbra Streisand Vogue 2011 (Robin Skouteris Mix).mp3,11.11,M
Electro Doctor Vol.3/Alexandra Stan - Mr.Saxobeat (Mike Candys Rework).mp3,10.87,M
Electro Doctor Vol.3/7th Heaven Feat. Banderas - This Is Your Life (Dj Solovey Remix).mp3,10.8,M
Electro Doctor Vol.3/Ace Of Base -  All For You (Paul Johns Summer Remix).mp3,10.79,M
Electro Doctor Vol.3/Alexis Jordan - Happiness (Sandy Resek Mix).mp3,10.65,M
Electro Doctor Vol.3/Radio Killer - Be Free (Sunrider Remix).mp3,10.61,M
Electro Doctor Vol.3/50 Cent & Dr Kucho - Beat Da Club (Andrey Zenkoff Mash Up).mp3,10.6,M
Electro Doctor Vol.3/Lenny Kravitz - Fly Away (Loud Bit Project & Alex Milano Remix).mp3,10.51,M
Electro Doctor Vol.3/Ricky Martin - Mas (Wally Bilingual Remix).mp3,10.36,M
Electro Doctor Vol.3/Dj Samuel Kimko - Baila Baila (Original Mix).mp3,10.31,M
Electro Doctor Vol.3/Neoclubber - See No Stars (Extended Mix).mp3,9.75,M
Electro Doctor Vol.3/Sak Noel - Loca People (Tomer Danan Bootleg Remix).mp3,9.67,M
Electro Doctor Vol.3/Rye Rye Feat. Robyn - Never Will Be Mine (Kat Krazy Extended Mix).mp3,9.61,M
Electro Doctor Vol.3/Bruno Mars - The Lazy Song (Justin Sane Remix).mp3,9.02,M
Electro Doctor Vol.3/Makhno Project - Morskaya (Extended Mix).mp3,9,M
Electro Doctor Vol.3/Dj Sava Feat. Andreea D & Yolo - Money Maker (Extended Mix).mp3,8.93,M
Electro Doctor Vol.3/Play & Win - Ya Bb (Club Mix).mp3,8.89,M
Electro Doctor Vol.3/Mike Candys & Jack Holiday - Ready Or Not 2011 (Exclusive Club Edition).mp3,8.75,M
Electro Doctor Vol.3/Lady Gaga - Judas (V. Project Remix).mp3,8.74,M
Electro Doctor Vol.3/Italobrothers - Cryin In The Rain (Extended Mix).mp3,8.7,M
Electro Doctor Vol.3/Britney Spears - How I Roll (2nd Adventure Mix).mp3,8.54,M
Electro Doctor Vol.3/Addiction Feat. Jessica Jean & Discomakers (Michael Burek Mix).mp3,8.45,M
Electro Doctor Vol.3/Klass - Im Free (Remady Remix).mp3,8.02,M
Electro Doctor Vol.3/Kazaky - Love (Dj Sebastien & Vengerov Remix).mp3,8.02,M
Electro Doctor Vol.3/Aruba Ice & Cheeky Bitt - Planeta Lyubov (Alex Preston Remix).mp3,7.52,M
Electro Doctor Vol.3/Desperado Feat. Play & Win - Inside I Want You (Naksi Brunner Mix).mp3,7.32,M
Electro Doctor Vol.4/Triple A - Winter Stayed (Armin Van Buurens On The Beach Mix).mp3,21.02,M
Electro Doctor Vol.4/Deborah Cox - Easy As Life (Sevag Area 2011 Reboot).mp3,20.27,M
Electro Doctor Vol.4/Dj Kratos - Mogla By Byt Lyubov (Extended Mix).mp3,19.27,M
Electro Doctor Vol.4/The Wanted - Glad You Came (Alex Gaudino & Jason Rooney Club Mix).mp3,18.3,M
Electro Doctor Vol.4/Katrina - OPM (Dave Aude Club Mix).mp3,17.9,M
Electro Doctor Vol.4/Jason Rivas Feat. Miss Lyntty - Freed From Desire  (Monica X Sex  In The House Remix).mp3,17.73,M
Electro Doctor Vol.4/Suzi Carr - Forever More (Bryan Reyes Anthem Club Mix).mp3,17.28,M
Electro Doctor Vol.4/Avi Elman & Danny J Feat. Nuwella - Whats The Point (Seamus Haji Club Mix).mp3,17.12,M
Electro Doctor Vol.4/Dalal - Taste The Night (Moto Blanco Club Mix).mp3,16.69,M
Electro Doctor Vol.4/N-Trance - Set You Free (Andrey Dubovitskiy Remix).mp3,16.69,M
Electro Doctor Vol.4/Nick Svenson vs. Alex Sayz - Galaxy Faces (Giuseppe Capurro Bootleg).mp3,16.36,M
Electro Doctor Vol.4/Matt Bukovski Feat. Tiff Lacey - Swept Away (Alexander Popov Remix).mp3,16.32,M
Electro Doctor Vol.4/Jean Claude Ades & Sam Obernik - Work Of Art (Tomcraft Remix).mp3,16.09,M
Electro Doctor Vol.4/Andridi Feat. Nils - Ya Zovu Tebya (Original Mix).mp3,16.05,M
Electro Doctor Vol.4/Andrey Subbotin - Desert Walker (Original Mix).mp3,15.98,M
Electro Doctor Vol.4/Florrie - I Took A Little Something (Loverush UK Club Mix).mp3,15.92,M
Electro Doctor Vol.4/Jason Derulo - Dont Wanna Go Home (Abe Clements Club Mix).mp3,15.62,M
Electro Doctor Vol.4/Avril Lavigne- I Love You (Happy HotDog Club Dub).mp3,15.62,M
Electro Doctor Vol.4/Avicii & Junior Jack - Jailbait Thrill Me (Promise Land Mash Up).mp3,15.56,M
Electro Doctor Vol.4/Michael Jackson - Bad (Greysound & DVj Electra Remix).mp3,15.39,M
Electro Doctor Vol.4/StereoCreator & Tony Harmless - Be The Same (Original Mix).mp3,15.38,M
Electro Doctor Vol.4/Gabry Ponte Feat. Zhana - Skyride (Cahill Club Mix).mp3,15.35,M
Electro Doctor Vol.4/David Morales & Jonathan Mendelsohn - You Just Dont Love Me (Club Mix).mp3,15.27,M
Electro Doctor Vol.4/Beyonce - Best Thing I Never Had (Gareth Wyn Club Mix).mp3,15.26,M
Electro Doctor Vol.4/Mary Jess - Glorious (7th Heaven Club Mix).mp3,15.23,M
Electro Doctor Vol.4/Tommy Vee & Mauro Ferrucci Feat. Ce Ce Rogers - Stay (Chriss Ortega & Steve Forest Extended Vocal Mix).mp3,15.22,M
Electro Doctor Vol.4/Duchess Feat. Scorcher - All The Boyz (Rude Dogz Club Mix).mp3,15.14,M
Electro Doctor Vol.4/Alexis Dante & JM Sicky Feat. Eva Menson - Alive (Club Mix).mp3,15.11,M
Electro Doctor Vol.4/Beyonce - Run The World (Girls) (The Nycer Remode Mix).mp3,15.03,M
Electro Doctor Vol.4/J786 - Outta Control (Dave Aude Club Dub).mp3,14.96,M
Electro Doctor Vol.4/Drilla - Wrong Name (Extended Mix).mp3,14.94,M
Electro Doctor Vol.4/Eric Prydz - Call On Me 2k11 (Mike Sound Mix).mp3,14.56,M
Electro Doctor Vol.4/Alex Gaudino - Destination Calabria (BeatCode Project Mix).mp3,14.33,M
Electro Doctor Vol.4/Robert Miles - Children (Cat Skillz Remix).mp3,14.23,M
Electro Doctor Vol.4/Ian Carey Feat. Michelle Shellers - Keep On Rising (Max Fonaroff Summer Mix).mp3,14.13,M
Electro Doctor Vol.4/Inner Smile - Know Me Better (Gilad Markovich Remix).mp3,13.98,M
Electro Doctor Vol.4/Bruno Mars- Just The Way You Are (Sound Freak Bootleg).mp3,13.95,M
Electro Doctor Vol.4/Yves LaRock - Rise Up (AD Mens Remix).mp3,13.87,M
Electro Doctor Vol.4/Dream Dance Alliance - Moving On (Aboutblank & KLC Remix).mp3,13.79,M
Electro Doctor Vol.4/Age Pee - Ass Up (Gordon & Doyle Summer Bootleg Mix).mp3,13.76,M
Electro Doctor Vol.4/Tiesto - I Will Be Here (Stas Rich Remix).mp3,13.4,M
Electro Doctor Vol.4/Edward Maya vs. Black Eyed Peas - Boom Love (Dj Viduta Mash Up).mp3,13.4,M
Electro Doctor Vol.4/Roger Sanchez - Lost (Weekend Vibes Remix).mp3,13.12,M
Electro Doctor Vol.4/Deepside Deejays - Never Be Alone (Dj Krecer Mash Up 2011).mp3,12.87,M
Electro Doctor Vol.4/Ava Rocks - Still Rave About You (Michael Mind Project Remix).mp3,12.77,M
Electro Doctor Vol.4/Belmond & Parker vs. Whitney - With Somebody On The Move 2k11 (Splash Bootleg Mix).mp3,12.76,M
Electro Doctor Vol.4/Naya Marie Feat. Henny-M - Can You Hear My Voice (Mondo Remix).mp3,12.75,M
Electro Doctor Vol.4/Inna - Sun Is Up (Coskun Karadag Remix).mp3,12.62,M
Electro Doctor Vol.4/Tony Ray - Habibi (Hakan Gokan Remix).mp3,12.59,M
Electro Doctor Vol.4/Lady Gaga - Edge Of Glory (Electro Banger Remix).mp3,12.55,M
Electro Doctor Vol.4/Catwork Remix Engineers Feat. Irene Cara - What a Feeling (Extended Mix).mp3,12.54,M
Electro Doctor Vol.4/Duran Duran - What Happens Tomorrow (Dj Gorodnev & Dj Paulbass Future Mix 2011).mp3,12.26,M
Electro Doctor Vol.4/Duck Sauce - Barbra Streisand (Dima Ostrovsky Remix 2011).mp3,12.14,M
Electro Doctor Vol.4/Britney Spears - Burning Up (Nick Remix).mp3,12.14,M
Electro Doctor Vol.4/Michael Mind Project Feat. Sean Kingston - Ready Or Not (Club Mix).mp3,12.1,M
Electro Doctor Vol.4/Marius - Rain (Dj Nejtrino & Dj Stranger Remix).mp3,11.97,M
Electro Doctor Vol.4/Opium Project - Ya Begu (Dj Pomeha & Dj A-Newman Extended Mix).mp3,11.96,M
Electro Doctor Vol.4/Shakira Feat. Pitbull - Rabiosa (Flobers Brothers Club Mix).mp3,11.8,M
Electro Doctor Vol.4/Coffee & Honey Feat. Alexandra - This Is My Love (System P Remix).mp3,11.19,M
Electro Doctor Vol.4/Dj Antonio & Beyonce & Jay-Z - Crazy In Love (Larin Mash Up).mp3,11.09,M
Electro Doctor Vol.4/Dj Sandro Escobar & Katrin Queen - Hey Ladies (Extended Mix).mp3,10.9,M
Electro Doctor Vol.4/Dim Chris Feat. Amanda Wilson - You Found Me (Extended Mix).mp3,10.82,M
Electro Doctor Vol.4/Inna - No Limit (Dave Ramone Bootleg).mp3,10.64,M
Electro Doctor Vol.4/Dj Cvetkoff & Olya Milaxa - Belaya Noch (Dj Zidane Remix).mp3,10.54,M
Electro Doctor Vol.4/Volodya Aspirin - Kosmonavt (Greysound & Van Rayne Remix).mp3,10.03,M
Electro Doctor Vol.4/Lee Cabrera - Shake It (Total Warz Sexy Promo Mix).mp3,9.83,M
Electro Doctor Vol.4/Jack Holiday Feat. Allison - Missing You (Original Mix).mp3,9.36,M
Electro Doctor Vol.4/David Guetta Feat. JD Davis - The World Is Mine (Dj Pitchugin Mash Up).mp3,8.9,M
Electro Doctor Vol.4/Andreea Banica - Sexy (Dj Speak One Reworked Feat. Ceva Devis Mix).mp3,8.81,M
Electro Doctor Vol.4/Jessica Mauboy Feat. Jay Sean - What Happened To Us (OFM Remix).mp3,8.58,M
Electro Doctor Vol.4/Dj Sanny J Feat. Ice Mc - Kill It Tonight (Club Mix).mp3,8.38,M
Electro Doctor Vol.4/Antonia - Marionette (Speak One Rework).mp3,8.23,M
Electro Doctor Vol.4/Milk Inc - Shadow (Extended Mix).mp3,7.75,M
Electro Doctor Vol.4/Linnea Schossow - Someone Like You (Original Mix).mp3,7.38,M
Electro Doctor Vol.4/Desperado Feat. Play & Win - Inside I Want You (Malibu Breeze Mix).mp3,7.21,M
Electro Doctor Vol.5/Jessica Sutta - Show Me (Ralphi Rosario Club Mix).mp3,18.83,M
Electro Doctor Vol.5/Lady Gaga - The Edge Of Glory (Dj Santos Fringe Love Remix).mp3,17.49,M
Electro Doctor Vol.5/Rene Amesz & Baggi Begovic Feat. Marie Claire - Smells Like Teen Spirit (Hed Kandi XS Presents Marie Claire Remix).mp3,16.8,M
Electro Doctor Vol.5/Oh My! - Kicking And Screaming (7th Heaven Club Mix).mp3,16.59,M
Electro Doctor Vol.5/Rihanna -Love The Way You Lie (Squire vs. Offbeat Remix).mp3,16.55,M
Electro Doctor Vol.5/Eminem & Rihanna - Love The Way You Lie ( eSQUIRE & OFFBeat Remix).mp3,16.55,M
Electro Doctor Vol.5/Britney Spears - I Wanna Go (Henriq Moraes Power Base Mix).mp3,16.41,M
Electro Doctor Vol.5/ATB vs. Nero - Apollo Promises (Original Mix).mp3,16.19,M
Electro Doctor Vol.5/Liam Keegan Feat. Alexis Salgado - Never Knew (Peter Barona Club Mix).mp3,16.1,M
Electro Doctor Vol.5/Dave Aude Feat. Amanda - Escape (Dave Aude Club Mix).mp3,16.03,M
Electro Doctor Vol.5/David Guetta & Sia - Titanium (George M Extended Mix).mp3,15.92,M
Electro Doctor Vol.5/Dj Shevtsov Feat. Polina Griffith - Doubting The Feelings (Original Mix).mp3,15.3,M
Electro Doctor Vol.5/Fatboy Slim - Right Here Right Now (Tristan Garner Private Remix).mp3,14.94,M
Electro Doctor Vol.5/Dj Solovey - Get Ready (Original Mix).mp3,14.74,M
Electro Doctor Vol.5/Ola - All Over The World (Cahill Club Mix).mp3,14.58,M
Electro Doctor Vol.5/2-4 Grooves Feat. Kevin Kelly - Twilight (Club Mix).mp3,14.58,M
Electro Doctor Vol.5/Leona Lewis - Collide (Cahill Club Mix).mp3,14.56,M
Electro Doctor Vol.5/HouseMaxx Project - Let The Music Play 2011 (Club Mix).mp3,14.55,M
Electro Doctor Vol.5/Black Cards - Dr. Jekyll & Mr. Fame (WaWa Club Mix).mp3,14.36,M
Electro Doctor Vol.5/Templecloud - One Big Family (Digital Dog Club Mix).mp3,14.28,M
Electro Doctor Vol.5/Howie D - 100 (Ron Reeser & Dan Saenz Club Mix).mp3,14.15,M
Electro Doctor Vol.5/Mario Chris Feat. Helena Panayi - Keep Me Hanging On (Original Club Mix).mp3,14.11,M
Electro Doctor Vol.5/Lavika - Vechnyj Raj (Dj Melloffon Extended Mix).mp3,13.86,M
Electro Doctor Vol.5/Fonzerelli - Moonlight Party 2011 (Original Born Again Mix).mp3,13.8,M
Electro Doctor Vol.5/2FM - Rasputin (Extended Mix).mp3,13.53,M
Electro Doctor Vol.5/Dj Sandro Escobar & Katrin Queen - Hey Man (Bulat Mugalov Remix).mp3,13.38,M
Electro Doctor Vol.5/Moguai - Optinuum (Nishin Verdiano Remix).mp3,13.37,M
Electro Doctor Vol.5/Pitbull Feat. Ne-Yo & Nayer - Give Me Everything (Dj Dmitex & Dj Spart Remix).mp3,13.32,M
Electro Doctor Vol.5/Mann Feat. Snoop Dogg - The Mack (DNA Sundance Extended Mix).mp3,13.31,M
Electro Doctor Vol.5/Richi E Poveri - Sara Perche Ti Amo (Sergey Static Remix 2011).mp3,12.93,M
Electro Doctor Vol.5/Madonna - Holiday 2k11 (Jason Parker Bootleg Club Mix).mp3,12.81,M
Electro Doctor Vol.5/Dacav5 - Dirty Style (Wideboys Extended Mix).mp3,12.76,M
Electro Doctor Vol.5/Medina - For Altid (Svenstrup & Vendelboe Remix).mp3,12.69,M
Electro Doctor Vol.5/Edward Maya & Vika Jigulina - Desert Rain (Ser Twister Remix).mp3,12.6,M
Electro Doctor Vol.5/Tom Boxer & Morena Feat. J Warner - Deep In Love (Original Club Mix).mp3,12.26,M
Electro Doctor Vol.5/Nastya Lyubimova - Na Vstrechu Mechtam (Extended Mix).mp3,11.7,M
Electro Doctor Vol.5/Amari - By My Side (Extended Mix).mp3,11.58,M
Electro Doctor Vol.5/Agnes - Release Me (Rayto Feat. Rob Cachill Remix).mp3,11.5,M
Electro Doctor Vol.5/Beyonce - Best Thing I Never Had (Billionaire Extended Mix).mp3,10.83,M
Electro Doctor Vol.5/Black Eyed Peas - Don't Stop The Party (Itamar Carmel House Remix).mp3,10.73,M
Electro Doctor Vol.5/Pitbull Feat. Marc Anthony - Rain Over Me (Dany Lorence Bootleg).mp3,10.72,M
Electro Doctor Vol.5/Dev - In The Dark (Barletta Remix).mp3,10.28,M
Electro Doctor Vol.5/E.Motion Feat. Danii - Closer To Pleasure (Nylson Wash Mix).mp3,10.27,M
Electro Doctor Vol.5/Andreea Banica Feat. Play & Win - Sexy (2Teamdjs Remix 2011).mp3,9.61,M
Electro Doctor Vol.5/Dj Slon & Katya - Ya Ne Dam (Dj Dima Love Remix).mp3,9.53,M
Electro Doctor Vol.5/Black Eyed Peas - Everything Wonderful (Prod. by David Guetta).mp3,9.42,M
Electro Doctor Vol.5/Taryn Manning - Turn It Up (Sex Ray Vision Remix).mp3,8.15,M
Electro Doctor Vol.5/Katya Bazhenova - Spasibo Tebe Leto (Vengerov & Fedoroff Remix).mp3,8.07,M
Electro Doctor Vol.5/T-Killah Feat. Olga Buzova - Ne Zabyvaj (Jimpsy Remix).mp3,7.97,M
Electro Doctor Vol.5/Darren Hayes - Out Of Talk (Hall & Oates Mix).mp3,7.28,M
Electro Doctor Vol.6/In The Screen Feat. Craig David vs. Rony Seikaly - Fly Away (Erick Morillo & Jose Nunez Mix).mp3,18.16,M
Electro Doctor Vol.6/Phil Collins - In The Air Tonight (Vicenzzo & Silco Private Bootleg).mp3,17.45,M
Electro Doctor Vol.6/Tiff Lacey - Wilderness (Loverush UK Club Mix).mp3,16.01,M
Electro Doctor Vol.6/Keo Nazari - Acceptable 2 U (Mike Rizzo Funk Generation Club Mix).mp3,15.94,M
Electro Doctor Vol.6/John Galea - Do It My Way (Club Junkies Club Mix).mp3,15.44,M
Electro Doctor Vol.6/John Dahlback - Defection (Original Club Mix).mp3,15.25,M
Electro Doctor Vol.6/Mayra Veronica - Freak Like Me (Dave Aude Club Mix).mp3,15.25,M
Electro Doctor Vol.6/Jennifer Lopez - Papi (Mixin Marc & Tony Svejda Club Mix).mp3,15.11,M
Electro Doctor Vol.6/Erasure - When I Start Too (Steve Smart & WestFunk Dub Mix).mp3,14.58,M
Electro Doctor Vol.6/Wynter Gordon - Buy My Love (Crazibiza Remix).mp3,14.47,M
Electro Doctor Vol.6/Nicola Roberts - Lucky Day (Digital Dog Electro Club Mix).mp3,14.38,M
Electro Doctor Vol.6/Andrea Carnell - At Last (Jupiter Ace Club Mix).mp3,14.09,M
Electro Doctor Vol.6/Electro Banger - Express (Original Mix).mp3,13.94,M
Electro Doctor Vol.6/Yinon Yahel & Emmi - Jump (Roi Tochner Club Mix).mp3,13.64,M
Electro Doctor Vol.6/David Guetta Feat. Jennifer Hudson – Night Of Your Life (Matt Nevin Extended Mix).mp3,13.08,M
Electro Doctor Vol.6/Barracuda - I Will Love Again (Cat Skillz Remix).mp3,13.08,M
Electro Doctor Vol.6/Pitbull Feat. Marc Anthony - Rain Over Me (Slava Zusman Orienatal Bootleg).mp3,12.92,M
Electro Doctor Vol.6/Massmann vs. Ippytraxx Feat. Fab - Another Day In Paradise (Bigroom Club Mix).mp3,12.88,M
Electro Doctor Vol.6/Vivo Feat. Orel - Feel (Club Mix).mp3,12.67,M
Electro Doctor Vol.6/Lady GaGa - You And I (Alessio Silvestro Remix).mp3,12.54,M
Electro Doctor Vol.6/Beenie Man Feat. Akon - Girls (Housewave Remix).mp3,12.53,M
Electro Doctor Vol.6/Alex Saidac - Shine (Jorg Schmid Remix).mp3,12.38,M
Electro Doctor Vol.6/Nelly Furtado & Timbaland -Promiscuous (Anton Pavlovsky Remix).mp3,12.34,M
Electro Doctor Vol.6/Laidback Luke Feat. Example - Natural Disaster (Benny Benassi Remix).mp3,12.26,M
Electro Doctor Vol.6/Brisby & Jingles Feat. Miloud - Relax (Selecta Remix).mp3,12.09,M
Electro Doctor Vol.6/Dj Masterhouse Feat. Dj Lady Nalan - Tancuj (Dj System Remix).mp3,11.87,M
Electro Doctor Vol.6/Narcotic Thrust - I Like It ( Dj Gorodnev & Dj Paulbass Euro Mix 2011).mp3,11.74,M
Electro Doctor Vol.6/Don Omar - Taboo (Victor Magan Remix).mp3,11.66,M
Electro Doctor Vol.6/Mike Candys & Evelyn Feat. Patrick Miller - One Night In Ibiza (Horny Club Mix).mp3,11.61,M
Electro Doctor Vol.6/Jay Z Feat. Rihanna - Run This Town (Cometa & Older Grand Remix).mp3,11.5,M
Electro Doctor Vol.6/Anya - Beautiful World (Da Brozz Extended Mix).mp3,11.4,M
Electro Doctor Vol.6/Don Omar Feat. Lucenzo - Danza Kuduro (Hanter Reworks Remix 2011).mp3,11.26,M
Electro Doctor Vol.6/Dj Deka Feat. Linda - Almodom (Summer Club Mix).mp3,11.15,M
Electro Doctor Vol.6/Sak Noel & Katrin Queen - Loca People (Slava Zusman International Mix).mp3,10.85,M
