Filename,Size,Unit
Electro Doctor Vol.6/Manian - Ravers Fantasy (Cat Skillz Remix).mp3,10.81,M
Electro Doctor Vol.6/Alisiya & Pavel Esenin & Hi-Fi - Angely Vechny (Dj Alex Leader Remix).mp3,9.93,M
Electro Doctor Vol.6/Nicole Scherzinger - Wet (Linuxis1994 Remix).mp3,9.83,M
Electro Doctor Vol.6/Jaykay Feat. Flo Rida - What The Girls Like (David May Mix).mp3,9.42,M
Electro Doctor Vol.6/Natalia Kills & Will.I.Am - Free (Moto Blanco Mix).mp3,9.12,M
Electro Doctor Vol.6/Dj Solovey Feat. Leila - Vsyo Vperedi (Sergey Clash Remix).mp3,9.08,M
Electro Doctor Vol.6/Housemaxx Project - Let The Music Play (Scotty Mix).mp3,8.47,M
Electro Doctor Vol.6/Maroon 5 Feat. Christina Aguilera - Move Like Jagger (Linuxis1994 Remix).mp3,8.46,M
Electro Doctor Vol.6/Shalaine Mezzo - Don't Wanna Play Games (Lenny B Mix).mp3,8.44,M
Electro Doctor Vol.6/Chris Parker - Space (Original Mix).mp3,8.39,M
Electro Doctor Vol.6/Emin - Falling (Raduga Remix).mp3,8.34,M
Electro Doctor Vol.6/Vintazh - Derevya (Dj ModerNator Mix).mp3,8.32,M
Electro Doctor Vol.6/Tamerlan & Alena Omargalieva - Ty Tolko Moj (Dj Melnikoff Remix).mp3,8.22,M
Electro Doctor Vol.6/Tim De Ville Feat. Alessa - Love Is An Ocean (Original Mix).mp3,7.85,M
Electro Doctor Vol.6/David Guetta Feat. Nicki Minaj - Turn Me On (Original Mix).mp3,7.75,M
Electro Doctor Vol.6/Laurent Wery Feat. Swiftkid & Dev - Hey Hey Hey (Pop Another Bottleg).mp3,7.15,M
Electro Doctor Vol.7/The Blizzard & Omnia - My Inner Island (Yuri Kane Remix).mp3,19.81,M
Electro Doctor Vol.7/Cerf Mitiska & Jaren - Down To You (Original Mix).mp3,18.58,M
Electro Doctor Vol.7/Fedde Le Grand - So Much Love (Original Club Mix).mp3,17.98,M
Electro Doctor Vol.7/Blue Tente Feat. Aelyn - Youre Not Mine (Balearic Mix).mp3,17.04,M
Electro Doctor Vol.7/Coldplay - Every Teardrop (eSQUIRE vs. OFFBeat Remix).mp3,16.76,M
Electro Doctor Vol.7/Che Jose Feat. Sharon Muscat - Leave Me Lonely (Loverush UK! Club Mix).mp3,16.55,M
Electro Doctor Vol.7/Black Eyed Peas - Rock That Body (Dj Performance & Dj Tenere Remix).mp3,16.3,M
Electro Doctor Vol.7/Roman Frolov vs. Eugen Feat. Misty - Vechno (House Massive Remix).mp3,16.25,M
Electro Doctor Vol.7/Shakira Feat. Pitbull - Rabiosa (Alessandro Vinai Bootleg).mp3,15.69,M
Electro Doctor Vol.7/Taio Cruz - Higher (V.Reznikov & Denis First & P.Portnov & Seemc Remix).mp3,14.4,M
Electro Doctor Vol.7/Jay Sean - Hit The Lights (LX-Tronix Remix).mp3,14.26,M
Electro Doctor Vol.7/Depeche Mode - Enjoy The Silence (Bisweed Bootleg).mp3,13.81,M
Electro Doctor Vol.7/Jay Frog vs. Spankox - I Won't Let You Into The Club (Niko Pavlidis Mash Up).mp3,13.69,M
Electro Doctor Vol.7/Oksi - Bezumnaya (Makhno Project Extended Mix).mp3,13.55,M
Electro Doctor Vol.7/Alex Megane - One Million Feelings (Gimbal & Sinan Remix).mp3,13.54,M
Electro Doctor Vol.7/Gigi D'Agostino - L'amour Toujours (Dj Chrys Remix 2011).mp3,13.39,M
Electro Doctor Vol.7/Denis Drozdov & Slava Inside - Tancuj (Extended Mix).mp3,13.26,M
Electro Doctor Vol.7/Wildboyz - Dominoes (Chuckie Extended Mix).mp3,12.85,M
Electro Doctor Vol.7/Sak Noel - Loca People (Constantin & Oscar Inglese & Ricky One Bootleg Mix).mp3,12.83,M
Electro Doctor Vol.7/Masters Of South - Future Shock 2k11 (Maxxis Exclusive Remix).mp3,12.78,M
Electro Doctor Vol.7/MMDance - Otdyhaem (Dj Alfred Extended Mix).mp3,12.35,M
Electro Doctor Vol.7/Jean Roch Feat. Kat DeLuna & Flo Rida - I'm Alright (Steve Smart & Westfunk Extended Mix).mp3,12.12,M
Electro Doctor Vol.7/Dj Viduta - Sand Of Love (Original Mix).mp3,12.09,M
Electro Doctor Vol.7/Eric Prydz - Call On Me 2011 (Jason Parker Bootleg Club Mix).mp3,11.76,M
Electro Doctor Vol.7/Nick Carter - I'm Taking Off  (Roma Pafos Remix).mp3,11.76,M
Electro Doctor Vol.7/Andreea Banica - Love In Brasil (Liraz Lev Remix).mp3,11.69,M
Electro Doctor Vol.7/Dan Balan - Chica Bomb (Dj Markell & Allex Franko Remix).mp3,11.61,M
Electro Doctor Vol.7/David Guetta - The Alphabeat (Original Mix).mp3,10.5,M
Electro Doctor Vol.7/David Guetta - The Future (Original Mix).mp3,10.04,M
Electro Doctor Vol.7/Ik Production & Vega Feat. Yaniv Gezz - Dead To Hold You (Club Mix).mp3,9.75,M
Electro Doctor Vol.7/Swedish House Mafia vs. Dada Life - The One Fuckin Dada (Matt Parell Pres. Nevermind Bootleg Vocal Remix).mp3,9.68,M
Electro Doctor Vol.7/Shizzlematic & South Freak - Military Zone (Mike Noize Mix).mp3,8.42,M
Electro Doctor Vol.7/Britney Spears - Seal It With A Kiss (Peter Thomas Remix).mp3,8.38,M
Electro Doctor Vol.7/Victoria Aitken - Weekend Lover (Bimbo Jones Mix).mp3,7.33,M
Electro Doctor Vol.7/Invisible Djs & InVersiya - Dzhonni - Loca People (Idi Na Russia Version).mp3,7.13,M
Electro Doctor Vol.8/Nic Chagall Feat. Jonathan Mendelsohn - This Moment (Mitomi Tokoto Remix).mp3,21.63,M
Electro Doctor Vol.8/Adele - Someone Like You (Pacheco Club Mix).mp3,21.13,M
Electro Doctor Vol.8/Green Velvet vs. RHCP vs. Axwell vs. Otherside - Flash In The Air (Jordan McKnight Bootleg Mix 2011).mp3,20.11,M
Electro Doctor Vol.8/Benya Feat. Emma Lock - Loved To Be (Museartic Remix).mp3,19.61,M
Electro Doctor Vol.8/Eamon - Fuck It (Chris Wittig 2k11 Remix).mp3,17.62,M
Electro Doctor Vol.8/MYNC & Ron Carroll & Dan Castro - Don’t Be Afraid (Mitomi Tokoto Remix).mp3,17.61,M
Electro Doctor Vol.8/Skylar Grey - Invisible (Fred Falke Remix).mp3,17.34,M
Electro Doctor Vol.8/Astrix vs. Morgan Page - The Longest Reunion (Roman Shark Private Mash Up).mp3,16.89,M
Electro Doctor Vol.8/Lady Gaga - You And I (Brian Cua Club Bootleg).mp3,16.46,M
Electro Doctor Vol.8/Fragma Feat. Plastic Funk - What Love Can Do (Club Mix).mp3,15.68,M
Electro Doctor Vol.8/David Guetta & Avicii - Sunshine (Paramond Bootleg).mp3,15.03,M
Electro Doctor Vol.8/Jay Sean & Lil Wayne - Hit The Lights (Funk3d Club Mix).mp3,14.68,M
Electro Doctor Vol.8/Housemaxx Project - Let The Music Play 2011 (Club Mix).mp3,14.57,M
Electro Doctor Vol.8/Tito Torres & Max Urban - When The Sun Goes Down (Progressive Mix).mp3,14.53,M
Electro Doctor Vol.8/Cover Drive - Lick Ya Down (Wideboys Club Mix).mp3,14.45,M
Electro Doctor Vol.8/Kaskade & EDX vs. Alex Gaudino - Don't Stop Kissing (Kaskade Mash Up).mp3,14.37,M
Electro Doctor Vol.8/Tune Brothers vs. Daft Punk - Technologic (Tune Brothers Bootleg).mp3,14.24,M
Electro Doctor Vol.8/Alex Lamb Feat. Easton Davis - So Good (Andy Harding Remix).mp3,13.93,M
Electro Doctor Vol.8/JamX & Vace - Shout 2011 (D.Mand Bigroom Mix).mp3,13.67,M
Electro Doctor Vol.8/Consuelo Costin - Feel So Alive (Tony Moran & Warren Rigg Club Mix).mp3,13.56,M
Electro Doctor Vol.8/Jean Roch Feat. Flo-Rida & Kat DeLuna - I'm Alright (Maxime Torres & Datamotion Club Mix).mp3,13.41,M
Electro Doctor Vol.8/Marlena Feat. Tiwest - Tokom Kasaniya (Spirit Tag Remix).mp3,13.36,M
Electro Doctor Vol.8/Nelly Furtado - Say It Right 2011 (Dj Freeon Club Mix).mp3,12.92,M
Electro Doctor Vol.8/Kristina Korban - This Is Your Night (Automatic Panic Remix).mp3,12.87,M
Electro Doctor Vol.8/Kid Massive & Mark Le Sal - Don't Cry (Extended Mix).mp3,12.64,M
Electro Doctor Vol.8/Nadia Ali - When It Rains (Original Mix).mp3,12.4,M
Electro Doctor Vol.8/Mike Candys Feat. Nadia Ali - When It Rains (Original Mix).mp3,12.4,M
Electro Doctor Vol.8/Rene Rodrigezz & Sivana Reese Feat. Mc Yankoo - Rock'N'Roll (PH Electro Remix).mp3,12,M
Electro Doctor Vol.8/David Guetta & Afrojack - Lunar (Unover Remix).mp3,11.96,M
Electro Doctor Vol.8/Mika - Relax Take It Easy 2011 (DJ Solovey Remix).mp3,11.85,M
Electro Doctor Vol.8/Mattafix - Big City Life 2011 (Dj Andrey Keyton & Dj Vitalik Vitamin Remix).mp3,11.84,M
Electro Doctor Vol.8/Radio Killer - Lonely Heart (Dj Mili Extended Mix).mp3,11.74,M
Electro Doctor Vol.8/Rihanna - S&M (Tony Sanger Remix).mp3,11.71,M
Electro Doctor Vol.8/Black Eyed Peas - Dont Stop The Party (Dj Nejtrino & Dj Stranger Remix).mp3,11.1,M
Electro Doctor Vol.8/Porter Robinson vs. Spencer & Hill vs. Mstrkrft - Secret Name (Superseb Mash Up).mp3,11.02,M
Electro Doctor Vol.8/Avicii & David Guetta - Where Them Levels At (Djs From Mars Mash Up).mp3,10.9,M
Electro Doctor Vol.8/Housekatze - Rock And Pop Song (Shaun Baker Remix).mp3,10.36,M
Electro Doctor Vol.8/Loona  -  Vamos A La Playa (Mike Candys Hypnotic Bootleg).mp3,9.9,M
Electro Doctor Vol.8/Dev - Bass Down Low (Aier Sauft Remix).mp3,9.86,M
Electro Doctor Vol.8/Flo Rida - Good Feeling (Original Mix).mp3,9.57,M
Electro Doctor Vol.8/Tiesto - Work Hard Play Hard (3LAU & Sex Ray Vision Remix).mp3,8.95,M
Electro Doctor Vol.8/Seventeen - Tancuj Dazhe Esli Eto Konec Sveta (Dj Melnikoff Remix).mp3,8.81,M
Electro Doctor Vol.8/David Guetta - Toy Story (Original Mix).mp3,8.73,M
Electro Doctor Vol.8/Aruba Ice & Cheeky Bitt - Videli Noch (Dj XM Electro Remix).mp3,8.19,M
Electro Doctor Vol.8/Dj Viduta - Sand Of Love (Bubblehead Rework).mp3,6.25,M
Electro Doctor Vol.9/Beyonce - Best Thing I Never Had (Edson Pride Epic Club Mix).mp3,22.36,M
Electro Doctor Vol.9/Paul Goodyear & Caroline Lund - Outlaw Feat. Caroline Lund (Wayne G & Andy Allder Anthem Mix).mp3,21.49,M
Electro Doctor Vol.9/Joe Jonas - Love Slayer (Ralphi Rosario Club Mix).mp3,20.53,M
Electro Doctor Vol.9/Lady GaGa - You And I (Danny Verde Vocal Mix).mp3,19.2,M
Electro Doctor Vol.9/Beat Service Feat. Cathy Burton - When Tomorrow Never Comes (Original Mix).mp3,18.08,M
Electro Doctor Vol.9/Deborah Cox - If It Wasn't For Love (Mixin Marc & Tony Svejda Original Mix).mp3,17.96,M
Electro Doctor Vol.9/J Latif - Anonymous (Moto Blanco Club Mix).mp3,16.62,M
Electro Doctor Vol.9/Gigi D'Agostino - Wellfare (Gordon & Doyle Bootleg Mix).mp3,16.37,M
Electro Doctor Vol.9/Cortex Feat. Linda Newman & Maxx Loud - Stand Up (Thomas Oldani Remix).mp3,15.98,M
Electro Doctor Vol.9/Jls Feat. Dev - She Makes Me Wanna (Mantrastic Club Mix).mp3,15.89,M
Electro Doctor Vol.9/House Massive & Stilet - My Music (Club Mix).mp3,15.89,M
Electro Doctor Vol.9/Rihanna - Cheers (2nd Adventure Club Mix).mp3,15.69,M
Electro Doctor Vol.9/Dirty South & Pierce Fulton vs. Diddy Dirty Money & Skylar Gray - Rolling Home (Sub Divizion Mix).mp3,15.07,M
Electro Doctor Vol.9/Anjiro Rijo - Once Upon A Time (Original Mix).mp3,14.98,M
Electro Doctor Vol.9/Jenny Silver - Something In Your Eyes (Club Junkies Club Mix).mp3,14.94,M
Electro Doctor Vol.9/Jus Jack Feat. Black Dogs - One Day At A Time (Hard Rock Sofa Club Mix).mp3,14.82,M
Electro Doctor Vol.9/Wiz Khalifa - No Sleep (Dj Kue Remix).mp3,14.38,M
Electro Doctor Vol.9/Britney Spears Feat. Madonna - Me Against The Music (Alexey Union & Dj Morricone Remix).mp3,14.2,M
Electro Doctor Vol.9/Dev - Lightspeed (Matt Nevin Extended Mix).mp3,14.03,M
Electro Doctor Vol.9/Dj Lex - Goodbye Summer (Extended Mix).mp3,13.82,M
Electro Doctor Vol.9/Nicola Roberts - Lucky Day (The Thin Red Men Extended Mix).mp3,13.71,M
Electro Doctor Vol.9/Stellar Project Feat. Emelie Norenberg - Strong (Club Mix).mp3,13.67,M
Electro Doctor Vol.9/Maroon 5 Feat. Christina Aguilera - Moves Like Jagger (Funk3d Pop Extended Mix).mp3,13.56,M
Electro Doctor Vol.9/Mayra Veronica - Freak Like Me (Dave Aude Dub Mix).mp3,13.55,M
Electro Doctor Vol.9/Al Bano & Romina Power - Felicita (Dj Chrys Extended Club Mix 2011).mp3,13.53,M
Electro Doctor Vol.9/Martin Villeneuve - Late Night Sax (Sebastian Krieg Remix).mp3,13.53,M
Electro Doctor Vol.9/Jason Derulo - Don't Wanna Go Home (Total Warz Remix).mp3,13.46,M
Electro Doctor Vol.9/Chris Montana & Ely Yabu - Rehab (Original Mix).mp3,12.94,M
Electro Doctor Vol.9/Maurizio Gubellini Feat. Melanie - Leave Me Alone (Weekend Vibes Remix).mp3,12.76,M
Electro Doctor Vol.9/Lil Wayne - How To Love (Smash Mode Extended Mix).mp3,12.66,M
Electro Doctor Vol.9/Robert Miles - Children (Dj Half & Dj Juzz Remix).mp3,12,M
Electro Doctor Vol.9/Dada Life - Fight Club Is Closed (Geometry Remix).mp3,11.88,M
Electro Doctor Vol.9/Spankers - Sex On The Beach (Dj Andy Wait Remix).mp3,11.88,M
Electro Doctor Vol.9/David Guetta vs. Calvin Harris - You Used To Hold Me (Dj Oli Geir Mix).mp3,11.86,M
Electro Doctor Vol.9/Tom Boxer & Morena Feat. J Warner - Deep In Love (Dj Gladiator Remix).mp3,11.32,M
Electro Doctor Vol.9/Leonid Rudenko & Jake & Cooper - Beautiful Eyes (Dj Max Maikon Mash Up).mp3,11.31,M
Electro Doctor Vol.9/Chistopher S vs. Dj Rebel - Never Clap Your Hands (Dj Max Maikon Mash Up).mp3,11.08,M
Electro Doctor Vol.9/Gino Binelli - Girls Girls Girls (Club Mix).mp3,11.04,M
Electro Doctor Vol.9/Don Omar & The Perez Brothers vs. Mark Pride - Danza Kuduro (Dj Max Maikon Mash Up).mp3,10.74,M
Electro Doctor Vol.9/Mike Candys & Jack Holiday Feat. David Deen - Around The World (Original Mix).mp3,10.56,M
Electro Doctor Vol.9/PH Electro vs. Christopher S & Mike Candys - Baby Im Englishman In New-York (Dj Max Maikon Mash Up).mp3,10.45,M
Electro Doctor Vol.9/Jennifer Lopez Feat. Lil Wayne - I'm Into You (Dj Ilsur Energy Remix).mp3,10.02,M
Electro Doctor Vol.9/Wynter Gordon - Buy My Love (Mikael Wills & Justin Sane Remix).mp3,9.83,M
Electro Doctor Vol.9/Yuliya Savicheva - Serdcebienie (Gennady Adamenko Remix).mp3,8.34,M
Electro Doctor Vol.9/Anastasiya Prihodko & David Kalandadze - Mezhdu Nami Nebo (Dj Iksiy Remix).mp3,7.82,M
