User Type,Username,Date,Text
,padde_no1,2011-01-14T07:21Z,tack har v채ntat p책 denna!!!! 
,Andysekandysek,2011-01-14T11:44Z,Mind Over Mutant?
,sexpanther,2011-01-14T18:45Z,"I can't tell if it's Mind Over Mutant or not.  No seeders?  I'm stuck around 58%...  If I can get to 100 I'll seed for awhile.  

(and figure out what exactly it is)"
,padde_no1,2011-01-17T07:06Z,seed pleas I'm stuck around 70%... If I can get to 100 I'll seed for awhile. 
,squish0601,2011-02-02T15:55Z,"Hi guys, excuse me for my stupidity.
But how come most of the wii files are like in little seperate folders all over like this one.
Arte there some steps that i must make to combine them or something? "
