Filename,Size,Unit
"Extras/Earth Charter, GAIA and MAITREYA/Benjamin Creme's Maitreya Debunked (full video).flv",47.5,M
"Extras/Earth Charter, GAIA and MAITREYA/Dr. Kusamita P. Pederson  Earth Charter Initiative, Healing the Earth With Care and Concern.flv",13.06,M
"Extras/Earth Charter, GAIA and MAITREYA/Earth Charter and the New Gaia World Order.flv",3.05,M
"Extras/Earth Charter, GAIA and MAITREYA/Illuminati's new eye in the sky is named gaia.flv",7.34,M
"Extras/Earth Charter, GAIA and MAITREYA/MAITREYA Star CNN Commercial LOOK FOR HIS RETURN!!!! 2ND COMING!!.flv",2.21,M
"Extras/Earth Charter, GAIA and MAITREYA/Maurice Strong thoughts on the Earth Charter.flv",29,M
"Extras/Earth Charter, GAIA and MAITREYA/The Earth Charter - Our New Ten Commandments {Earth Worship}.flv",15.23,M
"Extras/Earth Charter, GAIA and MAITREYA/THE NWO GAIA-MOVEMENT LIVING EARTH GREEN DROP-BOX SCAM.flv",5.33,M
Extras/Aaron Russo's Last Message To Humanity.flv,3.08,M
Extras/Agenda 21 For Dummies.flv,9.79,M
"Extras/AMERICA, Freedom to Fascism (clip).flv",13.33,M
Extras/Are You Ready  (a film about the endtimes).flv,34.89,M
Extras/Babies To Be Given Anti-Obesity Drugs In The Womb In The UK.flv,3.71,M
Extras/Be Still And Know That I Am God.mp4,61.99,M
Extras/Bill Gates wants a Billion Dead! Vaccines and Health Care will do the Job!.flv,20.76,M
Extras/Child Indoctrination of the Homosexual Agenda.flv,15.32,M
Extras/Christians are being persecuted worldwide.flv,11.21,M
Extras/CIA Veteran says Bin Laden is a diversion and not capable of 9 11 attacks.flv,8.31,M
Extras/Corruption widespread in UK - PressTV 110616.flv,5.52,M
Extras/David Rockefellers Speech for Population control.flv,8.11,M
Extras/Devils Face in WTC on 9 11 =1.flv,849.03,K
Extras/Dozens of Tent Cities Crop Up in the US.flv,2.07,M
Extras/Eisenhower warns us of the military industrial complex.2.flv,8.04,M
Extras/Elderly woman slammed hard by police at Walmart A.flv,13.69,M
"Extras/Feds to limit gardening  (Monsanto, seeds, Ron Paul).flv",3.8,M
Extras/Food police target organic foods in California! F.flv,38.64,M
Extras/Forbidden Archeology - Secret Discoveries of Early Man - Bullet Version.flv,30.25,M
"Extras/FRAUD, Corruption, CIA, Nazis, EU   Illuminati Whistleblower's Sudden Death  - YouTube.flv",35.76,M
Extras/Fukushima Worldwide Radiation F.flv,48.09,M
Extras/Galilee Prophecy update 2010 End Times news. Fishing at the sea of Galilee banned fish are dieing  ked; }.flv,7.21,M
Extras/Genetically Modified Corn Linked to Organ Failure 6.flv,7.67,M
Extras/Giants of the old World `e p c.flv,42.1,M
Extras/Greek riots- Fierce street battles rage in Athens  - YouTube=UL.flv,26.1,M
Extras/Homosexuals Brainwashing Public School Children Part 2.flv,12.68,M
Extras/How 2012 Enlightenment Will Lead to Genocide (full video).flv,47.03,M
Extras/hr 2749 the food safety enhancement act of 2009 F =.flv,5.24,M
Extras/Israel sacrifice temple mount 2010 passover  Prophey update.flv,8.11,M
Extras/John Stockwell  The Third World War  - YouTube.flv,18.55,M
"Extras/Miami Police Shot Protester, then laugh about it..flv",5.64,M
Extras/Mind Blowing speech by Robert Welch in 1958 Quoting NWO plans to destroy America!.flv,19.9,M
Extras/MUST SEE DOCUMENTARY  Food Inc. (monsanto gm patent seeds pesticides factory soy corn wheat).flv,14.4,M
Extras/new world order is here! NAU.flv,9.23,M
Extras/Oil Prices to Skyrocket 2011   Financial Collapse   Dollar Dead by 2012   Lindsey Williams.flv,40.57,M
Extras/Organic Farms and Gardens Destroyed by HR 875  The Food Safety Modernization Act. Glenn Beck p.flv,22.65,M
"Extras/Over 2,000,000 Americans Dead due to GMO Foods   the Grovernment is Covering It Up. a.flv",13.84,M
Extras/Paluxy River Glen Rose Texas.mp4,15.83,M
Extras/Police beat down an old man... e=related.flv,4.15,M
Extras/POLICE STATE UK - Britain To Launch American-Style National Crime Agency!!.flv,1.75,M
Extras/RACE OF GIANTS found in India 0 b.flv,5.82,M
"Extras/Reptilian Barack Obama AMAZING capture in 720p HD, MUST SEE!.flv",52.14,M
Extras/Sen Rockefeller  Let's Depopulate!!! Kill the Elders and Poison the children!!!!!   }.flv,9.61,M
Extras/That's My King Dr. S.M. Lockridge - [OFFICIAL] Z.flv,24.81,M
Extras/The 2012 Deception Presentation (full video).flv,80.49,M
Extras/The Antichrist Commercial On CNN And The History Channel!!!!!!.flv,1.85,M
Extras/The Conspiracy Hub Torrent ~ 2012  Time For Change11 ht=1.flv,11.02,M
Extras/The Conspiracy Hub Torrent ~ Power Grab  How Obama's Green Policies Will Steal Your Freedom And Bankrupt America - Christopher Horner.flv,29.48,M
"Extras/The End of Small Farms  HR 2749, HR 875, HR 759, NAIS   Monsanto - Shelly Roche.flv",7.61,M
"Extras/The End of the Internet  Cybersecurity Act gives Obama power to shut down internet, ignore laws.flv",8.58,M
Extras/The Killing of Allen Kephart  How the Police Lost the Trust of a Law-and-Order Town.flv,43.46,M
"Extras/TN Police Taped Extortion, Blackmail, Racketeering, Armed Robbery, Bribery, Terroristic Threats 2 d  ; }.flv",32.67,M
"Extras/Weather weapons, HAARP admitted by Secretary of Defense!.flv",6.85,M
Extras/WOW! THIS IS AMAZING PROPHECY!!.flv,6.68,M
Extras/Zombie Americans have forgotten why 4th of July is a holiday!!!.flv,78.13,M
Extras/Â» Oil Baron Al Gore Exposed As Carbon Scammer Alex Jones' Infowars  There's a war on for your mind!.flv,20.34,M
"The Holy Spirit/(MUST SEE) Illuminati Satanic 2012+ UFO event, Bill Cooper and silenced NWO researchers.flv",55.34,M
The Holy Spirit/Are you witnessing for Christ  - YouTubep ph.mp4,1.82,M
The Holy Spirit/Breathe by Michael W. Smith  - YouTube.flv,31.23,M
The Holy Spirit/Britt Nicole You  - YouTube.flv,8.89,M
The Holy Spirit/Casting Crowns - Does Anybody Hear Her  - YouTube.flv,19.81,M
The Holy Spirit/Casting Crowns - Prayer For A Friend  - YouTubeted.flv,5.77,M
The Holy Spirit/Chris Tomlin - I Will Rise  - YouTubef.mp4,75.7,M
The Holy Spirit/Here I am to Worship (worship video w  lyrics)  - YouTube.flv,10.03,M
"The Holy Spirit/Here I am To Worship, Michael W. Smith  - YouTube.flv",14.04,M
The Holy Spirit/Hidden Message in Genesis. WOW! =related.flv,8.22,M
The Holy Spirit/I Believe  from Creation Calls by Brian Doerksen t=UL.mp4,17.81,M
The Holy Spirit/I can only Imagine - Instrumental version - with lyrics.flv,6.69,M
The Holy Spirit/Indescribable Chris Tomlin  - YouTube@n@.flv,10.86,M
The Holy Spirit/Jeremy Camp-In your Presence  - YouTube.flv,12.47,M
The Holy Spirit/Love Letter From God ult.jpg.flv,9.87,M
The Holy Spirit/Mark Lowry and his atheist encounter.flv,7.6,M
The Holy Spirit/Matthew West - The Motions  - YouTubel.flv,25.54,M
The Holy Spirit/SUNDAY IS NOT THE SABBATH!! Coming Soon.flv,93.3,M
The Holy Spirit/The Afters - Lift Me Up - Lyrics  - YouTube.mp4,42.19,M
The Holy Spirit/The Old Rugged Cross - Alan Jackson  - YouTube.flv,7.56,M
The Holy Spirit/Watch This Video If You Believe in GOD    FireFlight-Wrapped in your arms Pass This if you are Greatful of GOD!.flv,15.64,M
Description.txt,617,B
KeithThompson_AquariusAgeOfEvil.jpg,94.44,K
KeithThompson_AquariusAgeOfEvil.mp4,667.77,M
POtHS - Why We Do What We Do.txt,7.9,K
Torrent downloaded from Ahashare.com.txt,47,B
Torrent downloaded from Conspiracyhub.com.txt,47,B
Torrent downloaded from Demonoid.com.txt,47,B
