User Type,Username,Date,Text
,jerrytown,2011-06-18T13:53Z,Thanks McLuv.  I think you had to good of a friday night it should be 6-17 :-)  party on my friend 
,mpcteck,2011-06-18T16:45Z,"When I opened it in Utorrent, it says 6-17. So just a mistake on the title here"
,phish2525,2011-06-18T18:47Z,You're the man...thanks!
,jerrytown,2011-06-18T22:31Z,that's right phish2525 .  I should have said that in my silly comment above :-\
,McLuv,2011-06-19T11:46Z,"Sorry all...yes, file name is incorrect, files are correct.  Thanks for your support and understanding."
