User Type,Username,Date,Text
[V],xtrancex,2011-02-18T20:40Z,"have a gr8 weekend everybody it starts right here !

fuck you people that put my work on direct download sites use my tag TZUK you bunch of leeching good for nothing cunts !!! :D"
[V],ICM369,2011-02-18T21:24Z,seed until you bleed peeps
[V],oneanight,2011-02-18T23:59Z,All I can say is I'm loving it and seeding on..:)
[V],xtrancex,2011-02-21T05:58Z,:)) tyvm
,nomerecy,2011-02-23T16:24Z,"heyyyyyyyyyy broooo ho ya doing 

am back again :P"
