User Type,Username,Date,Text
[V],ua3,2011-05-03T05:10Z,"Inazuma Eleven - 127 will be last episode of almighty Inazuma Eleven :( 

And then they will bang on with - Inazuma Go , aired on May 4 :)"
,NarutoNamikaze,2011-05-06T19:57Z,Yeah... Now you can upload your whole converted work of The entire Season 6... Ep 127 is already out as you know.. Thanks for your awesome work. :D
[V],ua3,2011-05-08T04:43Z,"Sorry just started with the conversion :( , Episode 127 will be out in Season 6.

And Thanks for supporting and waiting :)"
[V],ua3,2011-05-15T14:33Z,"Season 6 will take more time as by mistake few files got deleted , no eta. Sorry but soon it will come :D"
[V],ua3,2011-06-09T15:01Z,Season 6 - http://thepiratebay.org/torrent/6457381
