User Type,Username,Date,Text
,pix611,2011-06-25T15:23Z,"thanks for the UP,
Thanks to those who seed."
,PetreBabanu,2011-07-16T22:51Z,[img]http://img15.imageshack.us/img15/9139/upload1.gif[/img]
,doomy242,2011-08-09T16:59Z,Vielen Dank
,Itchianus,2011-12-16T21:50Z,"Huge thank you to the people still seeding this. Lost my 18 year old discs, among other things, in a fire, and absolutely worship Beethoven. I will pay for them again when I'm in a position to, just need to have access to this wonderful noise again right now. Thank you again. Will seed permanently."
,wertham,2012-04-26T01:41Z,Many thanks for Karajan's Beethoven!
