Filename,Size,Unit
"Phelps - Vatican Assassins; Wounded in the House of my Friends, 2nd ed. (2004).pdf",55.2,M
"Foye - Romish Rites, Offices, and Legends, or Authorised Superstitions and Idolatries of the Church of Rome (1856).pdf",39.64,M
"Lea - Studies in Church History; the Rise of the Temporal Power, Benefit of Clergy, Excommunication, the Early Church and Slavery (1883).pdf",18.67,M
Tyler - The Worship of the Blessed Virgin Mary in the Church of Rome Contrary to Holy Scripture (1846).pdf,14.98,M
"Mendham - The Literary Policy of the Church of Rome Exhibited, in the Account of Her Damnatory Catalogues or Indexes (1830).pdf",12.15,M
Norwich - Absolute Monarchs; a History of the Papacy (2011).epub,9.64,M
Hittel - The Spirit of the Papacy (1895).pdf,7.19,M
"Pollard - The Vatican and Italian Fascism, 1929-32; a study in Conflict (1985).pdf",7.15,M
Chapman - The Condemnation of Pope Honorius (1907).pdf,5.86,M
Chiniquy - Papal Idolatry; an Exposure (1889).pdf,5.34,M
O’Shea - A Cross Too Heavy; Pope Pius XII and the Jews of Europe (2011).pdf,4.23,M
"Horne - Popery, the Enemy and the Falsifier of Scripture (1845).pdf",3.12,M
Mendham - The Spiritual Venality of Rome (1836).pdf,2.68,M
Berry - Render unto Rome; the Secret Life of Money in the Catholic Church (2011).epub,2.36,M
"Monson - Nuns Behaving Badly; Tales of Music, Magic, Art, and Arson in the Convents of Italy (2010).pdf",2.23,M
Vargas - Taming a Brood of Vipers; Conflict and Change in Fourteenth-Century Dominican Convents (2011).pdf,1.87,M
Lehmann - Behind the Dictators; a Factual Analysis of the Relationship of Nazi-Fascism and Roman Catholicism (1942).pdf,1.41,M
Hammer - The Vatican Connection; the Billion-Dollar Counterfeit Stock Deal between the Mafia and the Church (1982).pdf,1.27,M
Gallagher - Vatican Secret Diplomacy; Joseph P. Hurley and Pope Pius XII (2008).pdf,1.17,M
Follain - City of Secrets; the Startling Truth behind the Vatican Murders (2003).pdf,1.16,M
MacGrail - The Curse of Rome; a Frank Confession of a Catholic Priest and a Complete Expose of the Immoral Tyranny (1907).pdf,951.76,K
Budde (ed.) - The Church as Counterculture (2000).CHM,586.8,K
Hibbert - The Borgias (2008).epub,339.49,K
