Filename,Size,Unit
Cocktails and Dreams/16-Turnstiles.mp3,22.79,M
Apathy and Exhaustion/04 - Your Gravest Words.mp3,8.49,M
"Cocktails and Dreams/04-Hey, What Time is 'Pensacola Wings of Gold' on Anyway.mp3",8.05,M
Apathy and Exhaustion/06 - Brick Wall Views.mp3,7.75,M
Apathy and Exhaustion/08 - I'll Take What's in the Box Monty.mp3,7.67,M
Cocktails and Dreams/07-Overheated.mp3,7.48,M
"Oh! Calcutta!/06 Are You There Margaret It's Me, God.mp3",6.8,M
The Greatest Story Ever Told/06. Fireflies.mp3,6.71,M
Apathy and Exhaustion/05 - Boatless Booze Cruise Party.mp3,6.67,M
Apathy and Exhaustion/03 - Navigating the Windward Passage.mp3,6.66,M
The Greatest Story Ever Told/13. The Disaster March.mp3,6.59,M
Apathy and Exhaustion/07 - The Corpses of Our Motivations.mp3,6.34,M
Cocktails and Dreams/12-Nebraska.mp3,6.04,M
Cocktails and Dreams/05-There's No Place Like a Stranger's Floor.mp3,6.02,M
Cocktails and Dreams/03-100 Resolutions.mp3,6,M
Oh! Calcutta!/04 Recovering The Opposable Thumb.mp3,5.78,M
Oh! Calcutta!/10 Key To The City.mp3,5.73,M
Buttsweat and Tears/02 The Slowest Drink At The Saddest Bar On The Snowiest Day In The Greatest City.mp3,5.68,M
Oh! Calcutta!/08 Lose Your Illusion 1.mp3,5.66,M
The Greatest Story Ever Told/10. The Revisionist.mp3,5.63,M
Cocktails and Dreams/14-Joyce Carol Oates is a Boring Old Biddy.mp3,5.49,M
A Guided Tour Of Chicago/10 Eighteen Inches.mp3,5.46,M
Cocktails and Dreams/13-Another Boring Story.mp3,5.45,M
The Greatest Story Ever Told/12. A Wishful Puppeteer.mp3,5.44,M
Oh! Calcutta!/03 Great Lakes-Great Escapes.mp3,5.33,M
Cocktails and Dreams/02-Quincentuple Your Money.mp3,5.32,M
The Greatest Story Ever Told/02. The Raw and Searing Flesh.mp3,5.25,M
Apathy and Exhaustion/02 - The First Eviction Notice.mp3,5.23,M
"Apathy and Exhaustion/09 - Right as Rain, Pt. 2.mp3",5.22,M
Buttsweat and Tears/01 Spit Shining Shit.mp3,5.17,M
Apathy and Exhaustion/11 - Abracadaver.mp3,5.14,M
Apathy and Exhaustion/01 - Porno and Snuff Films.mp3,5.09,M
"Present Day Memories Split/04-Hey, What Time is 'Pensecola- Wings of Gold' on Anyway.mp3",5,M
Cocktails and Dreams/09-A Boring Story.mp3,4.97,M
Buttsweat and Tears/03 Them Angels Been Talkin'.mp3,4.96,M
Oh! Calcutta!/12 Warped Summer Extravaganza (Major Excellent).mp3,4.96,M
The Greatest Story Ever Told/08. Chapter 13; The Hero Appears.mp3,4.89,M
Oh! Calcutta!/07 Jumping The Shark.mp3,4.87,M
Apathy and Exhaustion/10 - 3am QVC Shopping Spree Hangover.mp3,4.81,M
Buttsweat and Tears/05 The Redness In The West.mp3,4.67,M
Oh! Calcutta!/05 Beyond The Embarrassing Style.mp3,4.55,M
The Greatest Story Ever Told/11. The Ramblin' Boys of Pleasure.mp3,4.52,M
Cocktails and Dreams/11-A Toast.mp3,4.27,M
Oh! Calcutta!/02 Cut It Up.mp3,4.19,M
The Greatest Story Ever Told/04. Drunk Mouth Kitchen Smile.mp3,4.17,M
Cocktails and Dreams/15-The Old Timer's 2x4.mp3,4.17,M
Oh! Calcutta!/11 Old Dogs Never Die.mp3,4.12,M
Present Day Memories Split/02-100 Resolutions.mp3,4.06,M
Oh! Calcutta!/09 Requiem Revisited.mp3,4.03,M
Buttsweat and Tears/04 Demons.mp3,3.96,M
Present Day Memories Split/03-There's No Place Like a Stranger's Floor.mp3,3.93,M
Present Day Memories Split/01-Quincentuple Your Money.mp3,3.89,M
Oh! Calcutta!/01 The Devil's Takin' Names.mp3,3.87,M
The Greatest Story Ever Told/05. Alert the Audience!.mp3,3.82,M
Present Day Memories Split/09 - The Chinkees - Present Day Memories.mp3,3.66,M
Ghost Stories/08 Light Breathing (Me and Martha Plimpton in a Fancy Elevator).mp3,3.48,M
Ghost Stories/04 Asa Phelps Is Dead.mp3,3.36,M
Cocktails and Dreams/01-Intransit.mp3,3.36,M
Ghost Stories/09 Ghost Stories.mp3,3.04,M
Cocktails and Dreams/08-Necrotism Decanting the Insalubrious (Cyborg Midnight) Part 7.mp3,2.96,M
The Greatest Story Ever Told/09. Hesitation Station.mp3,2.95,M
"A Guided Tour Of Chicago/06 The Northside, The L&L And Any Number Of Crappy Apartments.mp3",2.94,M
Ghost Stories/03 Turnstyles.mp3,2.93,M
A Guided Tour Of Chicago/01 An Evening Of Extraordinary Circumstance.mp3,2.71,M
Cocktails and Dreams/06-Presenting The Dancing Machine (The Robot With the Monkey Head).mp3,2.65,M
The Greatest Story Ever Told/03. On with the Show.mp3,2.6,M
Ghost Stories/06 The Old-Timer S 2Ã¢âÅ,4.mp3,2.59,M
Ghost Stories/10 106 South.mp3,2.56,M
A Guided Tour Of Chicago/03 A Guided Tour Of Chicago.mp3,2.5,M
The Greatest Story Ever Told/07. The March of the Elephants.mp3,2.49,M
Cocktails and Dreams/10-Faintly Falling Ashes.mp3,2.38,M
Ghost Stories/07 Here Comes the Neighborhood.mp3,2.3,M
Ghost Stories/02 Chicago Is Burning.mp3,2.09,M
Present Day Memories Split/06 -The Chinkees - 1980's Drowning Me.mp3,2.09,M
Present Day Memories Split/07 - The Chinkees - Heart + Me.mp3,2.08,M
A Guided Tour Of Chicago/07 Smokestacks.mp3,2.05,M
A Guided Tour Of Chicago/08 Detention.mp3,1.97,M
A Guided Tour Of Chicago/05 Someday We're All Gonna Weigh 400 Lbs..mp3,1.83,M
Present Day Memories Split/05-Clouding Up My Storm.mp3,1.8,M
Ghost Stories/05 All the Week.mp3,1.8,M
Present Day Memories Split/08 - The Chinkees - Run for Help.mp3,1.65,M
A Guided Tour Of Chicago/04 Take One Down And Pass It Around.mp3,1.63,M
A Guided Tour Of Chicago/02 Kevin Costner's Casino.mp3,1.61,M
A Guided Tour Of Chicago/09 Uptown Free Radio.mp3,1.59,M
Ghost Stories/01 Sixteen Hours.mp3,1.37,M
Ghost Stories/11 Minute.mp3,1.36,M
The Greatest Story Ever Told/14. Outro.mp3,689.45,K
The Greatest Story Ever Told/01. Intro.mp3,671.45,K
