Filename,Size,Unit
CD1/01-La revoltosa- Preludio.mp3,8.37,M
CD1/02-La verbena de la Paloma- Seguidillas.mp3,4.72,M
CD1/03-La Gran Vía- Chotis de Eliseo Madrileño.mp3,6.56,M
"CD1/04-Agua, azucarillos y aguardiente- Coro de Barquilleros.mp3",3.46,M
CD1/05-El ultimo romantico- Bella enamorada.mp3,6.52,M
CD1/06-La dolores- Jota.mp3,11.8,M
CD1/07-La boda de Luis Alfonso- Intermedio.mp3,8.11,M
CD1/08-Bohemios- Coro de bohemios.mp3,4.61,M
CD1/09-El Huesped del Sevillano- Raquel.mp3,5.19,M
CD1/10-La dolorosa- Relato de Rafael.mp3,5.19,M
CD1/11-La del soto del Parral- Romanza de German.mp3,8.06,M
CD1/12-Doña Francisquita- Fandango.mp3,3.56,M
CD1/13-La alegria de la huerta- Jota.mp3,6.44,M
CD2/01-La boda de Luis Alfonso - Intermedio.mp3,5.3,M
CD2/02-Luisa Fernanda- Mazurca de las sombrillas.mp3,6.98,M
CD2/03-La tabernera del Puerto- No puede ser.mp3,4.51,M
CD2/04-La del manojo de Rosas- No corte mas que una rosa.mp3,6.25,M
CD2/05-La del manojo de Rosas- hace tiempo que vengo al taller.mp3,4.88,M
CD2/06-La rosa del azafran- cancion del sembrador.mp3,6.45,M
CD2/07-La bruja- jota.mp3,7.32,M
CD2/08-El tambor de granaderos- Jota.mp3,8.3,M
CD2/09-La cancion del olvido- cancion de una ronda.mp3,6.11,M
CD2/10-Katiuska- vivia sola.mp3,5.98,M
CD2/11-Molinos de viento- Serenata.mp3,4.4,M
CD2/12-La tabernera del puerto- todos lo saben.mp3,8.46,M
CD2/13-Cádiz - jota.mp3,6.27,M
CD3/01-La verbena de la Paloma-Preludio.mp3,6.74,M
CD3/02-La Gran Vía- El tango de menegilda.mp3,6.22,M
CD3/03-Doña Francisquita- Por el humo se sabe donde esta el fuego.mp3,6.41,M
CD3/04-La del manojo de rosas- Madrileña bonita.mp3,4.68,M
CD3/05-Black el payaso- deja la guadaña segador.mp3,4.44,M
CD3/06-Bohemios- preludio.mp3,8.21,M
CD3/07-Luisa Fernanda- coro de vareadores.mp3,6.92,M
CD3/08-Don Manolito- ensalada madrileña.mp3,5.64,M
CD3/09-La revoltosa- dúo de Felipe y Mari Pepa.mp3,9.63,M
CD3/10-Doña Francisquita- Escena y coro de románticos.mp3,16.52,M
CD3/11-Katiuska- noche hermosa.mp3,4.24,M
CD3/12-La dolorosa- dúo de Dolores y Rafael.mp3,9.86,M
CD3/13-La cancion del olvido- la cancion del olvido.mp3,3.49,M
CD3/14-La isla de las perlas- no me quiere.mp3,4.04,M
CD3/15-La tabernera del puerto- en un país de fabula.mp3,10.47,M
"CD3/16-Agua, azucarillos y aguardiente- preludio.mp3",4.15,M
CD4/01-Maruxa- preludio acto II.mp3,8.55,M
CD4/02-El huesped del sevillano - Canto a la espada.mp3,4.77,M
"CD4/03-El caserio - Sasibill, mi caserio.mp3",7.11,M
CD4/04-El rey que rabió - yo que siempre de los hombres me burle.mp3,7.62,M
CD4/05-El huesped del sevillano - coro de lagarteranas.mp3,4.42,M
CD4/06-La rosa del azafran- dúo de Sagrario y Juan Pedro.mp3,6.74,M
CD4/07-El barberillo de lavapies- preludio.mp3,12.29,M
CD4/08-La parranda - cancion del platero.mp3,5.68,M
CD4/09-La del soto del parral - ronda de los enamorados.mp3,6.65,M
CD4/10-Las golondrinas - pantomima.mp3,14.49,M
CD4/11-La rosa del azafran- la monda de la rosa.mp3,3.73,M
CD4/12-Los claveles- tenga muy buenas tardes.mp3,5.53,M
CD4/13-Gigantes y Cabezudos- coro de repatriados.mp3,5.6,M
CD4/14-La generala- canción del Arlequín.mp3,7.99,M
CD4/15-El rey que rabió- coro de doctores.mp3,5.54,M
