User Type,Username,Date,Text
[M],BigDadE,2011-06-06T10:17Z,Thanks m8 & cheers on being the #1 Top 100 E-Book!
,dmax15,2011-06-08T21:32Z,wow da best
,nadanone,2011-06-19T10:24Z,"Landed a job with your UP, many thanks and good wishes for you and yours. Thanks man!"
,javaidrana1,2011-06-23T14:00Z,"Hi Mantesh! Thank you for all the great books uploads. Can you upload some books that teach watercolor painting?. Or DVDs if it is possible for you.
Thanks once again"
,babuuu,2011-07-04T22:32Z,"Hey mantesh U r great, But this book fails to open I dont know why? Can some one help"
,lpirate1,2011-07-14T07:07Z,Download FREE Textbook Torrents at LibraryPirate.com !
,OrlandoMagic17,2011-07-22T01:13Z,"Can anyone find me Ebook of Jump Higher exercises ba Doctor Larry Van Such??? Please, I really need it..."
,Memz78,2011-07-26T03:44Z,"Thank you sooooo much for the books you upload, I love your uploads...xx"
,slow-moo,2011-08-10T10:00Z,Thank u 
,mikelogik,2011-09-15T07:27Z,"love your torrents. however, this one does not open up for me. any suggestions?"
,MysticalGamer,2011-11-14T16:07Z,"Got it and its working just fine. :)

To those that can't open the PDF inside, either re-download the torrent or try updating your acrobat reader. It's free anyways! :P"
,Kunal1564,2012-01-18T20:45Z,Good. Thank you
