User Type,Username,Date,Text
,pulkit007,2011-08-20T23:08Z,"lol u r so amateur..
advertising your own torrent by saying mine Fake.. hahaha


everyone  has downloaded from this torrent and everyone knows that this woks.."
,Bammer09,2011-09-01T10:00Z,cool nice torrent. nice nice. cool nice torrent haha it works thanks nice cool haha nice torrent it works :DDDD
,garoz32,2011-09-02T02:06Z,"can't wait to finish downloading, only at 80.5 % finished"
,jareehDr0,2011-09-04T07:47Z,why don't you seeeeeed? If you won't seed then don't ever upload torrents please...
,pulkit007,2011-09-16T08:18Z,"Mate I Seeded for 10 days. but its up to other people who r downloading. They should also seed. i cant continue downloading for months. Try and Understand.
there r many other torrents of mine which people r also seeding.
See my current torrent ""modern combat"" i am seeding at 100kb/s"
,need2ask,2011-12-24T15:06Z,stuck at 97.4%........Help!!!!!!!
,nemonai,2012-01-25T21:22Z,"stuck at 97.4%

SEEDS PLZ PLZ PLZ :'( :'( :'("
,drs180,2012-01-29T13:41Z,Please seed stuck at 99.7.
,drs180,2012-01-29T13:46Z,"can you seed just for a couple of minutes it;s stuck at 99.7 , i will seed for months then . Just let it finish , because everyone i.s stuck at 99.7."
,drs180,2012-01-29T19:10Z,are you going to seed or what?
,jorocuva,2012-02-13T04:02Z,"When i start the game it does not start, I get a black screen (sorry for my bad english)"
,winzen,2012-03-20T12:45Z,"doesnt work black screen with sound, you can navigate controls but its all invisible!"
,terwin,2012-03-31T03:55Z,doesn't work... black screen on my ipad 2... same as other two users below...
