Filename,Size,Unit
BEST OLD HIP HOP/11-Lil Wayne - Inkredible Remix (Freestyle).mp3,11.63,M
BEST OLD HIP HOP/07-Lil Wayne Ft. Lil B - Grove St. Party (Freestyle).mp3,9.79,M
"BEST OLD HIP HOP/Dj Khaled Ft Lil Wayne, Drake, Rick Ross-Im On One (Cdq-Dirty)Djleak.Com.mp3",7.06,M
"BEST OLD HIP HOP/Young Jeezy Ft Kanye West, Trae, Lil Wayne, Ludacris & Rick Ross - I Put On (Remix).mp3",6.61,M
BEST OLD HIP HOP/YC ft. Future - Racks On Racks.mp3,6.51,M
BEST OLD HIP HOP/Lil Wayne ft  Kanye West - Lollipop Remix.mp3,6.02,M
BEST OLD HIP HOP/Lil Wayne ft. Brisco - I'm in da hood.mp3,6.01,M
BEST OLD HIP HOP/Gucci Mane ft. Plies - Wasted.mp3,5.92,M
BEST OLD HIP HOP/08-Lil Wayne - Racks (Freestyle).mp3,5.72,M
BEST OLD HIP HOP/Lil' Twist feat. Lil' Wayne - The Leak.mp3,5.71,M
BEST OLD HIP HOP/Birdman-I Run This (Remix) (ft. Lil Wayne) (Dirty)-RGF.mp3,5.62,M
BEST OLD HIP HOP/Young Jeezy ft Lil Wayne - Ballin Full - HipHopEarly t4819.mp3,5.61,M
BEST OLD HIP HOP/Ron Browz Ft Jim Jones & Juelz Santana - Pop Champagne (Remix) - HotNewHipHop.com.mp3,5.04,M
BEST OLD HIP HOP/Big Sean Ft. Chris Brown - My Last (Dirty).mp3,4.93,M
"BEST OLD HIP HOP/09-Lil Wayne-My Weezy feat. Shanell, Lil Twist & Tyga-MF.mp3",4.77,M
BEST OLD HIP HOP/Bubba Sparx × Heat It Up.mp3,4.06,M
BEST OLD HIP HOP/Lil Wayne - New Orleans Maniac ft. Young Money.mp3,3.56,M
