User Type,Username,Date,Text
,roer4227,2011-09-04T20:29Z,Crack ?
,steve171,2011-09-04T21:07Z,This is just the original programme with no crack but thought it would come in handy and maybe someone out there will be able to crack it.
[H],BigNoise,2011-09-05T11:47Z,"no, it's just another unseeded torrent.
you may read about how the torrent principle works, before dumping anything here."
,greasemonkey,2011-10-26T15:03Z,"anybody out there sorted this yet, any ideas on any other garage software??"
,fabysyx,2011-12-06T21:04Z,Need Crack :)
,nickcuga2011,2012-01-24T00:32Z,Why dont you tell us? So we dont need to do all the crap!!!!!
