User Type,Username,Date,Text
,randyandi,2011-01-18T23:54Z,"That's it!
Thanx!"
[V],Lindoff41,2011-01-20T09:04Z,Now have you the whole seeding. Now is it better speed.
,vincemcsweeney,2011-01-27T18:17Z,this is going to take ages to down load. any suggestions to speeding this up??
,vincemcsweeney,2011-01-27T18:17Z,this is going to take ages to download. any ideas to speed this up??
,vincemcsweeney,2011-01-27T18:22Z,it's gonna take ages to download this any suggestions to speeding it up??
,downunderman,2011-02-12T10:14Z,"need a couple more seeders for this one, just way too many leechers with this one :-/"
,roaduser,2011-03-01T15:42Z,shitty 128k quality
