User Type,Username,Date,Text
[T],nobody2007,2011-07-20T11:09Z,"How stupid must somebody be, to download a 29GB torrent without having to disclose any contents?!"
,lostinlodos,2011-07-25T16:58Z,"Trusted or not!
How ignorant must someone be to not recognise one of the largest draws on the 'interwebs'. 

MHRC is a collection of VA tracks; covers of songs by hard/heavy/industrial etc bands. 

Each album has multiple tracks. This is a collection of albums. 

To find individual items; check the 444 individual posts for them. 

And individual tracks ARE listed under files."
,snakebite1811,2011-08-06T18:16Z,download does not work.
,SwimclubOphelia,2011-08-09T11:59Z,This one is working: http://thepiratebay.org/torrent/6551466/Metal-Hard_Rock_Covers_1-444
