Filename,Size,Unit
Dear Love_ A Beautiful Discord/09 Texas Is South.mp3,10.23,M
Dear Love_ A Beautiful Discord/05 Rosemary Had An Accident.mp3,9.01,M
Dear Love_ A Beautiful Discord/10 Modeify The Pronunciation.mp3,7.9,M
Dear Love_ A Beautiful Discord/04 And The Sentence Trails Off.mp3,7.18,M
"Dear Love_ A Beautiful Discord/08 Who Speaks Spanish, Colon Quesadilla.mp3",6.94,M
"Dear Love_ A Beautiful Discord/07 Swords, Dragons & Diet Coke.mp3",6.93,M
Dear Love_ A Beautiful Discord/03 Dogs Can Grow Beards All Over.mp3,6.1,M
Dear Love_ A Beautiful Discord/11 Salvation.mp3,6.1,M
Dear Love_ A Beautiful Discord/02 Gauntlet Of Solitude.mp3,4.79,M
Dear Love_ A Beautiful Discord/01 The Ascent.mp3,2.03,M
Dear Love_ A Beautiful Discord/06 Redemption.mp3,1.55,M
Patterns Of The Horizon/04 Rosemary Had An Accident.mp3,6.45,M
Patterns Of The Horizon/08 Modeify The Prenounciation.mp3,5.15,M
Patterns Of The Horizon/03 And The Sentence Trails Off....mp3,4.95,M
Patterns Of The Horizon/07 Who Speaks Spanish_ Colon Quesadilla.mp3,4.92,M
"Patterns Of The Horizon/06 Swords, Dragons, And Diet Coke.mp3",4.86,M
Patterns Of The Horizon/02 The Gauntlet Of Solitude.mp3,3.33,M
Patterns Of The Horizon/09 III - Salvation.mp3,2.32,M
Patterns Of The Horizon/01 The Ascent.mp3,1.19,M
Patterns Of The Horizon/05 II - Redemption.mp3,598.08,K
Plagues/07 This Song Is Called.mp3,10.13,M
Plagues/01 Goats On A Boat.mp3,10.02,M
Plagues/10 Nickels Is Money Too.mp3,9.45,M
Plagues/03 HTMLl Rulez D00d.mp3,9,M
Plagues/09 The Scorpion Deathlock.mp3,8.8,M
"Plagues/04 Hey John, What's Your Name Again_.mp3",8.64,M
"Plagues/02 Number Three, Never Forget.mp3",8.45,M
Plagues/06 You Can't Spell Crap Without _C_ [Feat. Craig Owens Of Chiodos].mp3,8.03,M
"Plagues/08 Reptar, King Of The Ozone.mp3",7.24,M
Plagues/05 Don't Dink And Drance.mp3,6.83,M
With Roots Above And Branches Below/09 Gimme Half.mp3,6.92,M
With Roots Above And Branches Below/05 Big Wiggly Style.mp3,6.68,M
With Roots Above And Branches Below/04 Dez Moines.mp3,6.43,M
With Roots Above And Branches Below/06 Danger_ Wildman.mp3,6.38,M
With Roots Above And Branches Below/07 Ben Has A Kid.mp3,6.26,M
With Roots Above And Branches Below/08 Wapakalypse.mp3,5.92,M
With Roots Above And Branches Below/08 Wapakalypse 1.mp3,5.92,M
With Roots Above And Branches Below/03 Assistant To The Reginal Manager.mp3,5.74,M
With Roots Above And Branches Below/11 Lord Xenu.mp3,5.45,M
With Roots Above And Branches Below/01 Sassafras.mp3,5.19,M
With Roots Above And Branches Below/02 I Hate Buffering.mp3,4.92,M
With Roots Above And Branches Below/10 Louder Than Thunder.mp3,4.18,M
