User Type,Username,Date,Text
,__NeXuS__,2011-07-12T23:06Z,"My first torrent, but I'll try to bring better things in the future."
,reichert,2011-07-13T09:46Z,"
poor quality and microscopic small (200 X 160) images...

Can't you find something bigger? like 1600 X 1200.. 
"
,__NeXuS__,2011-07-14T00:25Z,"I was actually working on getting another torrent up at the time, so this was just rushed. I didn't follow a procedure to grab the pics. For most of them I just grabbed thumbnails, but for a few small albums, I got the actual full-sized pictures. Even the thumbnails are okay-sized images though."
