User Type,Username,Date,Text
,netrek,2011-06-07T07:17Z,plz seed!
,norhuma,2011-07-08T01:18Z,"I'm downloading, and it's going a bit slow so far, but that's okay, I can be patient. Let me say this much though... original uploader/person who put together this collection: I love you. This made my day. I hope Mr. Bach himself comes down from heaven and gives you a blowjob!"
,asjet,2011-09-26T20:47Z,"Hello, thanks for uploading.
I have continued with part 2. please seed"
,taburedka,2011-11-12T13:39Z,Goldberg Variations performed by Vladimir Feltsman is the best thing I ever heard.
