User Type,Username,Date,Text
,Bjellesau,2010-12-02T19:28Z,"Thanks for reuploading this gem. 

Is it possible for you to seed ""Jimmy Carl Black and The X-Tra Combo - Mercedes Benz"", at least 6 people are stuck at 72.4 %.

Would have loved to thear one of the Indian of the group's own albums.

Thanks in advance.

Tusen takk for Grandmothers nyopplastinger. Har Eating the Astoria i 192 kbs MP3 format. Et fantastisk album men 192 kbs MP3 er skrot. SĂÂĽ millioner takk. Har du flere Zappa relaterte CD'r, let them flow!!"
,Let it rock,2010-12-02T21:27Z,I got to reupload it.I do it tomorrow.
