User Type,Username,Date,Text
,tank_123,2011-02-01T12:30Z,"One just can't thank you enough malestrom!!

Can you please try to find and upload some children's books in Spanish. I will really appreciate it."
,tank_123,2011-02-01T12:31Z,Please keep the nature journals coming. Thanks a gazillion. 
,solilosci,2011-02-02T11:55Z,"U always upload great material. I have been downloading ur uploads since quite a year now. It have helped me a lot in my studies. Thanks a tonne. And this upload is great. 
If u can plz also upload other nature and AAAS publications(like nature nanotech, immunology, medicine etc and AAAS science express, biosens bioelectron, Genome medicine etc). Watever u can get.

If not of current year even collection from last couple of years would be great to get. "
,ioannisarc,2011-02-03T20:53Z,Thank you very much.
,Crackovia,2011-02-06T10:04Z,Wow thanks a lot Mr. Maelstrom! Any chance we'll be seeing some Time Magazine issues in the future?
