Filename,Size,Unit
The Mentalist s01e23 Red John's footsteps DivX SweSub DollarMannen.avi,400.22,M
The Mentalist s01e21 Miss red DivX SweSub DollarMannen.avi,399.5,M
The Mentalist s01e22 Blood red DivX SweSub DollarMannen.avi,399,M
The Mentalist s01e20 Red sauce DivX SweSub DollarMannen.avi,396.53,M
The Mentalist s01e19 A dozen red roses DivX SweSub DollarMannen.avi,387.77,M
The Mentalist s01e18 Russet potatoes DivX SweSub DollarMannen.avi,387.44,M
The Mentalist s01e17 Carnelian inc. DivX SweSub DollarMannen.avi,387.1,M
FiLMFiX.jpeg.jpg,105.15,K
Filmfix.se.txt,769,B
