User Type,Username,Date,Text
,Marcel7,2011-08-24T20:46Z,"Tackar! : )
Noen som kan legga ut «The Quiet American» med swe hardsub?.."
,pierce97,2011-08-25T02:35Z,Quality? anyone?
,cotelelus,2011-08-27T02:21Z,Low Quality
,qui-gon-gin,2011-08-28T21:23Z,no shit it's a cam.
,qui-gon-gin,2011-08-28T21:24Z,Stop complaining it's free what else could you ask for.
,bromsen1,2011-09-30T01:12Z,Texten skapades på: http://swesub.nu/title/tt0458339/
,Ebithril,2011-10-07T18:19Z,"Crappy quality, sicne the guy recording can't seem to keep focus...
The subtitels are - so far, only watched 5 minutes - very well. No google translate here...
So yea, it's a crappy cam with good sub."
