User Type,Username,Date,Text
,mark.taiwan,2011-02-02T15:46Z,Thanks for the siterip man
,Gkeo,2011-02-03T12:07Z,"Thanks for the Siterip!
Keep Uploading these man! You Rock!"
,Gkeo,2011-02-03T12:08Z,"Thanks for the siterip!
Keep uploading this stuff It rulz!"
,megamanrulesall,2011-02-05T07:15Z,"Looking good (as well as the other torrents you have done.)

I am curious. With the other archive site thingies (which I think you mentioned on a chan site), are you thinking of putting together compilations for the other ones? Artdecade, clubstripes, tailheat & sexyfur? Just curious is all. Keep up the good work. ^o~"
,Z47N60,2011-02-05T07:48Z,this is relevant to my interests :3
,Vfdn,2011-02-06T02:10Z,"@megamanrulesall (not sure if you use the @ thing on TPB or if it's just YouTube but I am addressing you so what the hey)

I have a reliable source of HB content meaning I have a folder on my HDD of all HB content kept up to date and thus I can post a siterip secure in the knowledge that it is a complete siterip. With other furry paysites I haven't yet secured access to someone with content, so I rely on other people leaking it through TFA (the site that uses TOR and runs on the chan software). As soon as I find a reliable source of ClubStripes/SexyFur etc. content or get enough donations through my blog to pay for a subscription I will start posting siterips of them."
,dog10dog,2011-02-06T04:49Z,I love you!! Thanks for this. I would give you a BJ for this.
,MasakiKudo,2011-03-08T03:13Z,Thanks for the rip :3 Very nice
,Vfdn,2011-06-11T13:13Z,"Everyone thinking of getting my torrent get the newer version instead:
https://thepiratebay.org/torrent/6460873/HardBlush_Siterip_(10.06.11)
If you are seeding this torrent please stop and start seeding the newer version. Your help so far has been great, thanks guys "
