User Type,Username,Date,Text
,ajtongurizi,2011-04-17T12:17Z,did someone play the game its on english or ..
,marciofao,2011-05-05T17:45Z,"O jogo está com a entrada em francês, e o video do início ao invés de tocar música fica um som de ruido muito irritante.
no meu PS2 trancou no carregamento do memory card, antes de iniciar o jogo.

........................

The game is on the entry into French, and the beginning of the video instead of playing music is a very annoying noise sound.
locked on my PS2 memory card to load before starting the game."
,RodrigoP2P,2011-05-06T16:16Z,Todo Gta Q É Patch São Defeituoso
,ArturVGT2,2011-06-17T02:50Z,Nem percam tempo. Um lixooooooooooo!
