Filename,Size,Unit
CD1/01. Mona Lisa.mp3,8.9,M
CD1/02. Fascination.mp3,7.4,M
CD1/03. In Love Again.mp3,5.61,M
CD1/04. Aura Lee (Love Me Tender).mp3,6.11,M
CD1/05. Memories Are Made of This.mp3,5.17,M
CD1/06. September Song.mp3,8.8,M
CD1/07. Hawaiian Wedding Song.mp3,9.62,M
CD1/08. Always.mp3,6.49,M
CD1/09. I Love You Truly.mp3,4.95,M
CD1/10. It's Impossible.mp3,5.35,M
CD1/11. This Guy's in Love With You.mp3,8.66,M
CD1/12. Because of You.mp3,6.67,M
CD2/01. Moon River.mp3,6.77,M
CD2/02. Guantanamera.mp3,7.73,M
CD2/03. Call Me Irresponsible.mp3,7.46,M
CD2/04. Strangers in the Night.mp3,7.96,M
CD2/05. Everybody Loves Somebody.mp3,7.44,M
CD2/06. Music Box Dancer.mp3,7.45,M
CD2/07. Raindrops Keep Falling on My Head.mp3,5.65,M
CD2/08. Scarborough Fayre.mp3,5.73,M
CD2/09. Summer of '42.mp3,9.54,M
CD2/10. Don't Cry for Me Argentina.mp3,10.21,M
CD2/11. Taste of Soul.mp3,11.46,M
CD2/12. Feelings.mp3,9.06,M
CD3/01. Easy to Love.mp3,9.49,M
CD3/02. That's Amore.mp3,7.02,M
CD3/03. People Will Say We're in Love.mp3,11.1,M
CD3/04. Love Is a Many Splendored Thing.mp3,10.31,M
CD3/05. Till There Was You.mp3,6.13,M
CD3/06. When I Fall in Love.mp3,8.86,M
CD3/07. With a Song in My Heart.mp3,9.3,M
CD3/08. Melody of Love.mp3,5.84,M
CD3/09. Yesterday.mp3,10.42,M
CD3/10. Close to You.mp3,10.49,M
CD3/11. Come Back to Paradise.mp3,6.94,M
CD3/12. I've Got You Under My Skin.mp3,7.48,M
