Filename,Size,Unit
A New Era Of Corruption/11 Dehumanization.mp3,10.81,M
A New Era Of Corruption/10 Necromechanical.mp3,9.98,M
A New Era Of Corruption/05 End Of Flesh.mp3,9.31,M
A New Era Of Corruption/09 Murder Sermon.mp3,9.14,M
A New Era Of Corruption/01 Devolver.mp3,9.12,M
A New Era Of Corruption/04 Reprogrammed To Hate.mp3,8.62,M
A New Era Of Corruption/06 Unnerving.mp3,8.37,M
A New Era Of Corruption/08 Prayer Of Mockery.mp3,8.21,M
A New Era Of Corruption/02 Breeding Violence.mp3,7.62,M
A New Era Of Corruption/03 The Darkest Day Of Man.mp3,6.87,M
A New Era Of Corruption/07 A Future Corrupt.mp3,6.77,M
The Somatic Defilement/02 the somatic defilement.mp3,8.84,M
The Somatic Defilement/10 Articulo Mortis.mp3,6.64,M
The Somatic Defilement/05 fairy fay.mp3,5.94,M
The Somatic Defilement/04 Prostatic Flluid Asphyxiation.mp3,5.92,M
The Somatic Defilement/06 ear to ear.mp3,5.83,M
The Somatic Defilement/03 devirgination studies.mp3,5.37,M
The Somatic Defilement/07 alone in the morgue.mp3,4.87,M
The Somatic Defilement/09 Vicer Exciser.mp3,4.75,M
The Somatic Defilement/08 festering fiesta.mp3,4.21,M
The Somatic Defilement/01 necrotizing.mp3,928.74,K
This Is Exile/11 Messiahbolical.mp3,12.38,M
This Is Exile/03 Possession.mp3,7.88,M
This Is Exile/01 Father Of Lies.mp3,6.58,M
This Is Exile/09 Eternal Refuge.mp3,6.1,M
This Is Exile/02 This Is Exile.mp3,6.09,M
This Is Exile/04 To All That Are Dead.mp3,6.03,M
This Is Exile/08 Daemon (The Procreated).mp3,5.48,M
This Is Exile/06 Somatically Incorrect.mp3,5.27,M
This Is Exile/05 Exalt.mp3,5.17,M
This Is Exile/07 Death Becomes Him.mp3,5.15,M
This Is Exile/10 Of Legions.mp3,4.12,M
Whitechapel-Demo I-2006/Whitechapel - Fairy Fay.mp3,8.22,M
Whitechapel-Demo I-2006/Whitechapel - Articulo Mortis.mp3,8.17,M
Whitechapel-Demo I-2006/Whitechapel - Prostatic Fluid.mp3,8.08,M
Whitechapel-Demo I-2006/Whitechapel - Ear to Ear.mp3,8.06,M
Whitechapel-Demo I-2006/Whitechapel - Festering Fiesta (New Version).mp3,5.58,M
Whitechapel-Demo I-2006/Whitechapel - Festering Fiesta.mp3,5.47,M
Whitechapel-Demo I-2006/Cover.jpg,15.89,K
Whitechapel-Demo II-2004/Whitechapel - Alone in the Morque.mp3,8.13,M
Whitechapel-Demo II-2004/Whitechapel - Articulo Mortis.mp3,8.05,M
Whitechapel-Demo II-2004/Whitechapel - Ear To Ear.mp3,8,M
Whitechapel-Demo II-2004/Whitechapel - Fairy Fay.mp3,7.86,M
Whitechapel-Demo II-2004/Whitechapel - Devirgination Studies.mp3,7.85,M
Whitechapel-Demo II-2004/Whitechapel - Festering Fiesta.mp3,5.22,M
