User Type,Username,Date,Text
[V],gnice06,2011-04-05T00:28Z,"The Monkey Ass Troll is back....

How pathetic..."
[V],gnice06,2011-04-05T01:16Z,"The monkey ass queen keeps showing up to perform.

Perform for me monkey ass queen.

Maybe I'll throw you a banana..."
[V],gnice06,2011-04-05T22:56Z,Perform MONKEY!!!!
[V],gnice06,2011-04-06T02:37Z,Troll Monkey want a banana?
[V],gnice06,2011-04-06T22:11Z,I COMMAND you to perform monkey!
[V],gnice06,2011-04-07T14:25Z,"This clown LIVES on thepiratebay...

This shit is TOO FUNNY..."
[V],gnice06,2011-05-08T06:34Z,I know what it feels like inside of your grandmother.
[V],gnice06,2011-05-08T15:35Z,"I'm working the shit out of you, AREN'T I MONKEY????

""Negative ratings""?  

BWAAAAAAAAAAAAAH HA HA HA HA HA HA HA HA HA HA HA HA HA HA HA HA HA HA HA HA HA!!!!!

BITCH monkey being dragged around on a string for the whole world to see…

Once again I've dragged you to this torrent just to SPIT in your fucking face.  And you came along willingly because you have no dignity.

Sorry to ruin your day, but you have work to do SLAVE!

KEEP TYPING BITCH!!!!!!!

p.s. Make sure to check these EVERYDAY monkey..."
[V],gnice06,2011-05-11T00:25Z,"This TROLL MONKEY has NO LIFE and can be found daily in The Pirate BAY porn section.


""Negative ratings""? 

BWAAAAAAAAAAAAAH HA HA HA HA HA HA HA HA HA HA HA HA HA HA HA HA HA HA HA HA HA!!!!!

Keep waisting your time DUMBASS!

I OWN YOU MONKEY!

Keep typing MONKEY, you have work to do!

MOVE ASSHOLE!  NOW!!!!

World, this is how you work the shit out of a MONKEY."
[V],gnice06,2011-05-11T15:02Z,"Proof of OWNERSHIP!


BWAAAAAAAAAAAAAH HA HA HA HA HA HA HA HA HA HA HA HA HA HA HA HA HA HA HA HA HA HA HA HA HA HA HA HA HA HA HA HA HA HA HA HA HA HA HA HA HA HA HA HA HA HA HA HA HA HA HA HA HA HA HA HA HA HA HA HA HA HA HA HA HA HA HA HA HA HA HA HA HA HA HA HA HA HA HA HA HA HA HA HA HA HA HA HA HA HA HA HA HA HA HA HA HA HA HA HA HA HA HA HA HA!!!!!


Jump MONKEY jump..."
[V],gnice06,2011-05-12T04:41Z,"You wish you were having fun DUMBASS...

Stop fooling yourself.  

You don't believe that LIE yourself MONKEY.

You're very PISSED OFF. It's in your posts DUMBASS.

You're having fun alright...

I think I'll ** SPIT ** in your fucking face once again.


BWAAAAAAAAAAAAAH HA HA HA HA HA HA HA HA HA HA HA HA HA HA HA HA HA HA HA HA HA!!!!!"
[V],gnice06,2011-05-13T16:50Z,"Is that all you've got MONKEY?

You bore me MONKEY.

By the way, there's a very NASTY comment about your grandmother that you haven't found.

I'm sure you will spend hours searching for it.  GOOD LUCK!


You make this TOO EASY! :))


BWAAAAAAAAAAAAAAAAAAAAAAAAAAAH HA HA HA HA HA HA HA HA HA HA HA HA HA HA HA HA HA HA HA HA!!!!!"
