User Type,Username,Date,Text
,wragthji,2011-02-13T11:32Z,"kalispera file. xilia signomi pou grafo asxeto sxolio stin tainia sou, alla de brisko akri me tipota. de mporo na bro enan odigo gia  na kano upload sto Pirate Bay. ena apo ta themata, einai oti de brisko to announce url. ipotithetai oti tha mou to egrafe stin korifi tis selidas tou upload, alla de to bgazei.

an ksereis kanenan aksiopisto odigo me sostes plirofories, i an mporeis na me boithiseis esi, please. i diefthinsi mou einai foibosnikolo papaki hotmail teleia com"
,fraxios,2011-04-05T15:32Z,vasika den xero kai pola  allaa ti fes na peis otan les odigo?
,fraxios,2011-08-26T17:51Z,"Ο διαμοιρασμός αρχείων θα ξεκινήσει ξανά στις 30/08/11.
Καλές διακοπές
Sharing files will begin again on 30/08/11.
Happy holidays"
