User Type,Username,Date,Text
,jormm14,2011-05-22T22:52Z,"i just uploaded the 220-702 nuggets from professer messer and you can find it at this link: http://thepiratebay.org/torrent/6414050/Professor_Messer_CompTIA_A__220-702_nuggets

enjoy!"
,jormm14,2011-05-23T01:19Z,"just uploaded Professor Messer's N+ 
it can be found here: http://thepiratebay.org/torrent/6414253/Professor_Messer_CompTIA_Network__N10-004"
,anthonyisme,2011-09-28T19:21Z,"I just wondered if any one thought of doing this!!

this is so helpful.
thanks!! "
,bluemax1965,2011-11-30T06:10Z,"Brilliant, thank you for all the effort you put into this."
