User Type,Username,Date,Text
,Shaubbie,2011-01-18T05:15Z,"Thank god it's back, I've had withdrawal symptoms. Thanks eztv always great quality uploads"
,louwmari,2011-01-18T06:12Z,thank you!! glad to have you back.
,PlusPete,2011-01-18T10:14Z,Thanks
,neezer,2011-01-18T11:51Z,Cheers for the Upload dude.
,CUDA121,2011-01-18T12:39Z,"Am I the only one with the end of the episode being out of sync :-/ Brilliant episode apart from that, I'm downloading the 720p version in hopes that that is in sync from beginning to end"
,dfro,2011-01-18T17:54Z,thanx eztv great upload as always 
,xogarchangelagen,2011-01-18T20:14Z,"CUDA121 is right, but thanks anyway!"
,starbuck1983,2011-01-19T00:35Z,"Forget what i said !
My mistake !

I forgot i paused the torrent this morning because ĂÂ  had to leave and couldn't let the computer running.

Now, i though it was finished and wanted to see it, but it is only finished at somthing like 85%
That's why i had problems watching it

please forgive my poor english and my mistake here.

As i said, eztv is the best label of quality here on the pirate bay. it has always been and will always be. ;)

Thanks again"
,Suchalamename,2011-01-19T00:41Z,thank you sooooooooooo much man 
,zortha_123,2011-01-19T04:51Z,Hey is this the right one? There are two eztv uploads!
,zortha_123,2011-01-19T08:40Z,Seed please=) 0 kb/s
,Rachel-2100,2011-01-19T22:35Z,tyvm!
,harri1990,2011-01-19T22:50Z,Get CTU 720p one low res is bad
,Rachel-2100,2011-01-20T02:50Z,CUDA121 it's like that for me too.. kinda annoying that it is out of sync in that scene :(
,iamvelvetelvis,2011-01-21T11:28Z,"V 9
A 5

Audio is off like a Godzilla movie"
[V],matimike,2011-02-15T12:02Z,a/v 10 thanks
,fossil44,2011-08-06T01:03Z,thanks for the series up eztv im still seeding but my quota has been slowed to buggary im on 25 k/s flat out a/v 10 / 10 as usuall thanks again 
,freecut1,2012-05-10T17:44Z,"Works great, as always. Thanks eztv!"
