User Type,Username,Date,Text
,BoonesFerry,2011-09-22T11:06Z,"
Series Finale
S01E13 The Benefit of Full Disclosure.
Not scheduled to air. 
Several articles I've read say that the 13th and final episode is only available on iTunes ($2.99).
I'm an unemployed broke ass bitch who is hoping someone will upload a torrent.
Cheers!
"
,BoonesFerry,2011-09-22T11:13Z,p.s. It is out there but not as a torrent. found it on rls. 
,dukeford57,2011-09-23T19:43Z,"S/O Please upload ep 13 ""The Benefit Of Full Disclosure"" "
