Filename,Size,Unit
ChattChitto RG.nfo,12.58,K
Eyes Open/01 You're All I Have.mp3,10.43,M
Eyes Open/02 Hands Open.mp3,7.53,M
Eyes Open/03 Chasing Cars.mp3,10.22,M
Eyes Open/04 Shut Your Eyes.mp3,7.52,M
Eyes Open/05 It's Beginning to Get to Me.mp3,10.52,M
Eyes Open/06 You Could Be Happy.mp3,7.02,M
Eyes Open/07 Make This Go on Forever.mp3,13.25,M
Eyes Open/08 Set the Fire to the Third Bar.mp3,7.77,M
Eyes Open/09 Headlights on Dark Roads.mp3,8.04,M
Eyes Open/10 Open Your Eyes.mp3,13.01,M
Eyes Open/11 The Finish Line.mp3,7.94,M
Eyes Open/12 - [-].mp3,8.97,M
Eyes Open/13 In My Arms [-].mp3,10.55,M
Eyes Open/14 Warmer Climate [-].mp3,9.46,M
Snow Patrol - Eyes Open [ChattChitto RG].png,43.84,K
www.ChattChitto.com.nfo,7.9,K
