Filename,Size,Unit
CD1/01 Hungarian dance no.5 in g minor (orch. by Martin Schmeling).mp3,5.33,M
"CD1/02 The art of fugue bwv 1080 - contrapunctus ix, a 4, alla duodecima.mp3",16.53,M
CD1/03 Preludes in d minor op.28 no.24.mp3,5.17,M
CD1/04 Pavane pour une infante defunte.mp3,17.69,M
"CD1/05 Voi che sapete, from le Nozze di Figaro k.492.mp3",5.61,M
CD1/06 Preludes in g major op.28 no.3.mp3,2.29,M
"CD1/07 Badinerie, from orchestral suite no.2 bwv 1067.mp3",3.34,M
"CD1/08 Pie Jesu, from requiem op.48.mp3",9.35,M
"CD1/09 Ce qu'a vu le vent d'ouest, from Preludes i.mp3",8.51,M
CD1/10 Candide - Overture.mp3,9.82,M
"CD1/11 Lacrimosa, requiem k.626.mp3",9.61,M
CD1/12 Standchen op.17 no.2.mp3,5.82,M
"CD1/13 Danse Sacrale (l'elue), from le Sacre du Printemps.mp3",10.92,M
"CD1/14 cancion del amor dolido, from el amor brujo.mp3",3.54,M
"CD1/15 O paradiso dall'onde uscito, from l'Africaine (sung in italian).mp3",8.39,M
CD1/16 Violin concerto in g minor rv 325 - 2. largo.mp3,4.47,M
"CD1/17 E lucevan le stelle, from Tosca.mp3",7.79,M
"CD2/01 Les Toreadors, from Carmen Suite No.2.mp3",4.82,M
CD2/02 Boogie Woogie Etude.mp3,4.94,M
CD2/03 Di quella pira.mp3,8.64,M
CD2/04 Evening Bells (arr. Serge Jaroff).mp3,6.39,M
"CD2/05 Danza del trigo, from Estancia.mp3",8.54,M
CD2/06 String Quartet no.4.mp3,6.23,M
"CD2/07 Der Lindenbaum, from Winterreise D 911.mp3",10.65,M
CD2/08 Cello Solo No.1 in G major BWV 1007 - 1. Prelude.mp3,6.42,M
"CD2/09 Sanctus, from M.mp3",5.78,M
CD2/10 Symphony No.88 in G major Hob. I-88 - 4. Finale (Allegro con spirito).mp3,8.31,M
CD2/11 Il segreto per esse.mp3,6.2,M
CD2/12 Vespers.mp3,4.98,M
CD2/13 Piano Sonata No.26 in E flat major 'Les adieux' Op.81a - 3. Das Wiedersehen (Le Retour).mp3,13.64,M
"CD2/14 The Old Castle, from Pictures at an Exhibition.mp3",10.39,M
"CD2/15 Prelude in C major BWV 846, from The Well-Tempered Clavier I.mp3",6.33,M
CD2/16 Canon in D major.mp3,7.29,M
CD2/17 Piano Sonata No.16 in B flat major K.570 - 3. Allegretto.mp3,9.08,M
CD2/18 String Quartet no.15.mp3,11,M
CD2/19 Violin Concerto No.2 in E major BWV 1042.mp3,5.64,M
CD3/01 Auf den Flugeln des Gesanges Op.34 No.2 (arr. for violin and piano).mp3,5.51,M
CD3/02 Etude in C sharp minor Op.2 No.1.mp3,6.18,M
"CD3/03 It Ain't Necessarily So, from Porgy and Bess (arr. by Jascha Heifetz).mp3",5.7,M
"CD3/04 Der Leiermann, from Winterreise D 911.mp3",8.17,M
"CD3/05 Fruhling, from Vier letzte Lieder.mp3",9.28,M
"CD3/06 Morning mood, from Peer Gynt Op.23.mp3",9.67,M
"CD3/07 O Fortuna, from Carmina Burana.mp3",6.01,M
CD3/08 Coriolan Overture Op.62.mp3,20.6,M
CD3/09 Fur Elise.mp3,7.27,M
"CD3/10 O Had I Jubal's Lyre, from Joshua HWV 64.mp3",5.82,M
CD3/11 Symphony No.8 in G major Op.88 - 3. Allegretto grazioso - Molto vivace.mp3,15.18,M
CD3/12 Violin Sonata in G major Op.30 No.3 - 3. Allegro vivace.mp3,7.68,M
CD3/13 Symphony No.5 in C minor Op.67 - 1. Allegro con brio.mp3,16.83,M
"CD3/14 Traumerei, from Kinderszenen Op.15.mp3",7.68,M
CD3/15 String Quartet No.1 in.mp3,9.79,M
"CD3/16 I Am Easily Assimilated, from Can.mp3",9.79,M
"CD4/01 Dance of the Sugar-Plum Fairy, from The Nutcracker Suite Op.71a.mp3",4.6,M
CD4/02 Symphony No.1 in D major 'Classical' Op.25 - 4. Finale (Molto Vivace).mp3,9.63,M
"CD4/03 Le cygne, from Le Carnaval des Animaux (arr. by Paul Vidal.mp3",9,M
CD4/04 Symphony No.5 in D minor 'Reformation' Op.107 - 2. Allegro vivace.mp3,12.19,M
CD4/05 Double Concerto in A minor Op.102 - 2.mp3,17.35,M
CD4/06 A spotless Rose.mp3,8.33,M
CD4/07 String Quartet in G minor Op..mp3,9.03,M
"CD4/08 Marche au supplice, from Symphonie fantastique Op.14.mp3",10.97,M
"CD4/09 Hopak, from Sorochintsy Fair (arr. by Segei Rachmaninov).mp3",4.18,M
CD4/10 Dardanus - Tambourins I & II.mp3,4.29,M
CD4/11 Liebesfreud.mp3,7.03,M
CD4/12 Symphony No.5 in E minor Op.64 - 3. Valse (Allegro moderato).mp3,12.64,M
"CD4/13 E strano ... Sempre libera, from La traviata.mp3",19.37,M
CD4/14 Etude-Caprice in E major Op.18 No.5.mp3,4.4,M
CD4/15 12 Etude d'execution transcendante No.2 S.139.mp3,5.3,M
CD4/16 Con che soavita.mp3,10.61,M
CD4/17 Swan Lake Op.20 - Scene (Moderato).mp3,5.92,M
CD4/18 Sonata in E major K.135.mp3,9.72,M
"CD5/01 Una furtiva lagrima, from L'elisir d'amore.mp3",9.73,M
CD5/02 Nocturne in F sharp Op.15 No.2.mp3,7.85,M
CD5/03Violin Sonata in E minor K.304 - 2. Tempo di minuetto.mp3,10.9,M
"CD5/04 Deh vieni, non tardar, from Le nozze di Figaro K.492.mp3",7.03,M
CD5/05 2 Concert Etudes S.145 No.2 - Gnomenreigen.mp3,7.01,M
"CD5/06 Violin Concerto in E major 'La Primavera' RV 269 - 1. Allegro, from Le quatt.mp3",7.69,M
CD5/07 Polonaise in A flat major 'Heroic' Op.53.mp3,16.26,M
"CD5/08 Mondscheinmusik, from Capriccio Op.85.mp3",8.46,M
"CD5/09 Largo al factotum, from Il barbiere di Siviglia.mp3",10.76,M
"CD5/10 Toccata, from Organ Symphony No.5 Op.42 No.1.mp3",12.53,M
CD5/11 Wie Todesahnung... O du mein holder Abendstern.mp3,12.66,M
"CD5/12 Dona nobis pacem, from Mass in B minor BWV 232.mp3",7.82,M
CD5/13 Prelude in G sharp minor Op.32 No.12.mp3,5,M
CD5/14 Karelia Suite Op.11 - 1. Intermezzo.mp3,7.61,M
CD5/15 Chant du Menestrel Op.71.mp3,9.57,M
CD5/16 Fruhlingsfahrt Op.45 No.2.mp3,7.32,M
CD5/17 Violin Sonata in F major 'Spring' Op.24 - 3. Scherzo (Allegro molto).mp3,3.35,M
CD5/18 Lachen und Weinen D 777.mp3,3.96,M
CD6/01 Recuerdos de la Alhambra.mp3,11.92,M
"CD6/02 Alleluia, from Exsultate, jubilate K.165.mp3",6.12,M
"CD6/03 Va pensiero, sull'ali dorate, from Nabucco.mp3",11.26,M
CD6/04 Ave Maria (arr. by Carlo Sabatini).mp3,4.78,M
CD6/05 Cavatina (arr. by John Williams).mp3,8.28,M
CD6/06 Symphony No.40 in G minor K.550 - 4. Finale (Allegro assai).mp3,11.21,M
CD6/07 Lo spazzocamino (arr. by Kurt Gaebel).mp3,6.48,M
"CD6/08The Vagabond, from Songs of Travel.mp3",7.3,M
CD6/09 Lohengrin - Prelude to Act 3.mp3,7.1,M
"CD6/10 Nanni, from Ayre.mp3",7.55,M
"CD6/11 Questa o quella, from Rigoletto.mp3",4.39,M
CD6/12 Cello Suite No.5 in C minor BWV 1011 - 3. Courante.mp3,5.26,M
CD6/13 Piano Etude No.10 'Der Zauberlehring'.mp3,5.17,M
CD6/14 Organ Concerto No.4 in F major HWV 292 - 1. Allegro.mp3,10.31,M
CD6/15 Zartliche Liebe WoO 123.mp3,5.01,M
"CD6/16 Wachet auf, ruft uns die Stimme BWV 645, from 'Schubler' Chorales.mp3",9.86,M
CD6/17 Prelude No.1 in E minor.mp3,11.3,M
CD6/18 Chanson de la nuit (1958).mp3,9.1,M
"CD6/19 Scherzo, from The 'F.A.E. sonate'.mp3",12.85,M
CD6/20 Impromptus in A flat major D 899.mp3,18.3,M
