User Type,Username,Date,Text
[V],mkvGOD,2011-05-03T07:39Z,"Follow me on Facebook for updates, requests, and comments

Search ""mkvGOD Torrents"" in Facebook"
,staticghost,2011-05-25T04:07Z,"If only this is seeded properly, this is better than those 480p copies with twice the file size... been trying to download this for 2 damn weeks and i am still at 60%...

please seed!"
,Jeep1997,2011-06-20T19:34Z,it took me 4hrs to download.thanks for the upload MkvGOD.
,pirate_n7,2011-06-25T15:12Z,Thanks! Please also upload season 2 once it's available! +1
,inspiratieloos,2011-06-26T13:07Z,"good torrent, good speed"
,P4rthen0n,2011-07-02T11:19Z,This is a good torrent for people with small screen sizes. For larger screen sizes the image quality is a bit low.
,HM268,2011-08-14T07:25Z,Hey...Can U plz upload SATC Complete Seasons 1-5 ?
,H4LFB4CKS,2011-08-24T10:13Z,WARNING!!! GAY HOMOEROTIC CONTENT!!!
,module409,2011-11-18T07:47Z,"Hey H4LFB4CKS, ""warning!!! Gay Homoerotic content"". I'm gay and the heteroerotic stuff is slammed into my face, 24/7  365 days of the year. Gays don't make a big deal about it. Straights are just being themselves. Why can't you show the same courtesy? Since by comparison, straight people are almost never subjected to anything visually gay/bi, all like you can just deal with it. The whole world is at your feet. It's sad so many don't want us having even 10% of it.  Self centered as hell. Equality isn't in the vocabulary of those like you. Mom and Dad must be soooo proud. Sorry about the rant. Eventually, St8 people's king shit attitude gets irritating. Obviously, this isn't aimed just at you.  "
,SAKUJO5124,2012-03-14T08:02Z,H4lfB4cks...No shit. Did you notice the title of the show? Who cares anyway? Why does it bother you? Are you scared you might be hiding in the closet? ;)   DICKHEAD
,crystal_fan_01,2012-06-05T01:29Z,"thx, love mkv files!"
