User Type,Username,Date,Text
,prank0007,2010-12-10T11:26Z,a Huge thnks buddy!!!
,prank0007,2010-12-10T11:30Z,comedy worth seeing.gr8 fun movie
[V],twentyforty,2010-12-10T12:42Z,"@prank0007: I like that movie because it's not just plain-fun type of comedy, but gives me that special warm-around-my-heart feeling. I watch it three times so far and even endured till the end on crappy first cam we have... Great movie, solid ""eight"" in my book."
,prank0007,2010-12-10T14:13Z,Yeah Spot-On!!!..........cheers:)
,dkhere,2010-12-10T16:13Z,Downloading because i liked the above comments...
,captainscot,2011-01-22T19:37Z,New to this. Can anyone tell me the difference between VIP and Trusted.
,MaximilianKohler,2011-03-30T05:58Z,"ehh size is nice of course, but quality isn't that great
a/v: 9/7"
,god...,2011-04-05T20:30Z,"this is a damn funny movie
thnks"
