User Type,Username,Date,Text
,marioplaza,2011-01-05T20:38Z,schimbati numele arhivei si dati re-ceck si continuati download-ul
,heinsler,2011-01-08T16:43Z,Nu pot sa intru pe forum si nu pot deschide arhiva.
,heinsler,2011-01-08T21:57Z,"Ok, am reusit. Merci pt asta si pt celelalte filme cu Scooby doo."
,marioplaza,2011-01-27T10:10Z,"Un tracker de torrente nou cu filme de desene animate dublate in romana, jocuri de PC, XBOX360, PS3, PS2, PSX, WII, carti si multe altele exclusiv pentru copii digitalfotoart.dyndns.org"
,ISTETU,2011-02-19T19:49Z,PAROLA dfa.3xforum.ro
,edelberg,2011-05-09T09:11Z,"nu gasesc pass la corpul omenesc(marius_cozma79@yahoo.com).
va rog sint disperat. astept pe m.a.i.l!"
