User Type,Username,Date,Text
,the-dude1982,2011-10-12T14:35Z,"LOL
Fuck the Hardyz,one fatt & the other one the ass sniffer."
,Chris8481,2011-10-18T14:56Z,"@the-dude1982 if you feel that way abowt them, dont watch it you fagot arse bitch"
,the-dude1982,2011-10-18T17:37Z,"LOL @Chris8481.
Another typical Hardyz drag queen fan.
IF you think that Drugs are cool & acting like an ass is cool like your boyz,then you're moron motherfucker.
& yeah FAGGOT who cant spell yet you whore ""fagot"" proves that you're typical dumb Hardyz fan :)"
,GenocidalDreams,2011-10-30T14:13Z,"Really? Flaming a torrent because you're not a fan of the Hardy's? 

If you don't like them, I understand, but there is no point in commenting on this.

Regarding your last post, you don't have to think drugs and acting like an ass are cool to like them. 

I've been Straightedge for 16 years, and I think Jeff is one of the most amazing wrestlers to date. Am I going to get pissed off and call you a faggot for disagreeing? No. I'm more mature than that.

Aside from all of that, awesome torrent. Will seed. (:"
