User Type,Username,Date,Text
,tanssit2,2011-10-02T18:17Z,infected with virus called Exp/MS04-028
,Viktor6665,2011-10-02T19:06Z,"nope... i have nod32 antivirus and its totally safe
if u charge someone at least show proof!"
,Fantasm,2011-10-02T20:39Z,More importantly this should NOT be in Porn... There's not even a nude or partial nude... No skin whatsoever... 
,Viktor6665,2011-10-03T23:41Z,"lol, wat do u think what category is this then?"
,Glenn1963,2011-10-04T02:50Z,"Non-nude pictures are, traditionally on TPB, posted in Other Pictures, http://thepiratebay.org/browse/603"
