User Type,Username,Date,Text
[V],verovenlo,2011-06-11T14:50Z,thanks i love john wayne movies
[T],ajaxen94,2011-06-11T15:02Z,@verovenlo you're welcome there'll be a few more to come my husband also loves John Wayne Movies and i think he was rather dishy when he was young
[V],verovenlo,2011-06-11T22:08Z,sounds good to me cant wait to download the new movies awesome job
,moviemasterT3,2012-02-24T12:40Z,"please seed, I'm stuck at 91.2% :)"
,moviemasterT3,2012-02-25T02:22Z,"please seed, I'm stuck at 96.7% :("
