Filename,Size,Unit
Approaching Normal/01 Weight of the World.mp3,7.19,M
Approaching Normal/02 Say It.mp3,7.09,M
Approaching Normal/03 Dirt Room.mp3,8.15,M
Approaching Normal/04 Been Down.mp3,7.89,M
Approaching Normal/05 My Never.mp3,5.96,M
Approaching Normal/06 Should Be Loved.mp3,8.02,M
Approaching Normal/07 Kangaroo Cry.mp3,9.05,M
Approaching Normal/08 Picking Up Pieces.mp3,7.9,M
Approaching Normal/09 Jump Rope.mp3,5.36,M
Approaching Normal/10 Blue Skies.mp3,7.01,M
Approaching Normal/11 Blue Does.mp3,5.54,M
Approaching Normal/12 The End.mp3,8.75,M
Approaching Normal/AlbumArt_{4AFB5C62-23E2-4EDB-8BE7-4CF6D6417AF7}_Large.jpg,6.79,K
Approaching Normal/AlbumArt_{4AFB5C62-23E2-4EDB-8BE7-4CF6D6417AF7}_Small.jpg,1.95,K
Approaching Normal/AlbumArtSmall.jpg,1.95,K
Approaching Normal/Folder.jpg,8.72,K
Consent To Treatment/01 Retarded Disfigured Clown.mp3,1,M
Consent To Treatment/02 Independently Happy.mp3,4.63,M
Consent To Treatment/03 James.mp3,4.24,M
Consent To Treatment/04 HRSA.mp3,4.09,M
Consent To Treatment/05 Breakfast After Ten.mp3,7.26,M
Consent To Treatment/06 Balance Beam.mp3,3.66,M
Consent To Treatment/07 Holler.mp3,7.75,M
Consent To Treatment/08 Schizophrenia.mp3,4.49,M
Consent To Treatment/09 Drop.mp3,4.21,M
Consent To Treatment/10 Conversation Via Radio.mp3,3.77,M
Consent To Treatment/11 Angel.mp3,4.88,M
Consent To Treatment/12 Libby I'm Listening.mp3,3.24,M
Consent To Treatment/13 Amnesia.mp3,3.68,M
Consent To Treatment/14 The Answer.mp3,5.39,M
Consent To Treatment/AlbumArt_{4B337CD1-F0D9-4461-9A1E-BDC67264669A}_Large.jpg,9.63,K
Consent To Treatment/AlbumArt_{4B337CD1-F0D9-4461-9A1E-BDC67264669A}_Small.jpg,2.13,K
Consent To Treatment/AlbumArtSmall.jpg,2.13,K
Consent To Treatment/Folder.jpg,9.63,K
Foiled/01 You Make Me Smile.mp3,5.99,M
Foiled/02 She's My Ride Home.mp3,6.46,M
Foiled/03 Into The Ocean.mp3,5.49,M
Foiled/04 What If We Could.mp3,5.57,M
Foiled/05 Hate Me.mp3,8.71,M
Foiled/06 Let It Go.mp3,5.58,M
Foiled/07 Congratulations.mp3,5.54,M
Foiled/08 Overweight.mp3,6.06,M
Foiled/09  X Amount Of Words.mp3,5.84,M
Foiled/10 Drilled A Wire Through My Cheek.mp3,6.24,M
Foiled/11 Sound Of Pulling Heaven Down.mp3,6.48,M
Foiled/12 Everlasting Friend.mp3,5.63,M
Foiled/13 18th Floor Balcony.mp3,15.4,M
History For Sale/01 Ugly Side.mp3,6.05,M
History For Sale/02 Clumsy Card House.mp3,4.65,M
History For Sale/03 Razorblade.mp3,4.6,M
History For Sale/04 Calling You.mp3,5.98,M
History For Sale/05 Chameleon Boy.mp3,8.06,M
History For Sale/06 Sexual Powertrip (One Big Lie) Bla Bla.mp3,4.23,M
History For Sale/07 A Quiet Mind.mp3,5.77,M
"History For Sale/08 3 Weeks, She Sleeps.mp3",2.55,M
History For Sale/09 Inner Glow.mp3,6.13,M
History For Sale/10 Somebody.mp3,4.77,M
History For Sale/11 Come In Closer.mp3,7.5,M
History For Sale/12 Amazing.mp3,4.65,M
History For Sale/AlbumArt_{557A0379-09BB-40FF-B510-86DAB5A7C3DF}_Large.jpg,6.17,K
History For Sale/AlbumArt_{557A0379-09BB-40FF-B510-86DAB5A7C3DF}_Small.jpg,1.79,K
History For Sale/AlbumArtSmall.jpg,1.79,K
History For Sale/Folder.jpg,6.17,K
The Answers/01 The Answer.mp3,5.39,M
The Answers/02 Two A.M. Lovesick.mp3,2.87,M
The Answers/03 The 21st.mp3,5.7,M
The Answers/04 Breakfast After Ten.mp3,7.26,M
The Answers/05 Italian Radio.mp3,5.92,M
The Answers/06 For My Brother.mp3,4.42,M
The Answers/07 Sweet and Somber Pigeon Wings.mp3,4.73,M
The Answers/08 Weaknesses.mp3,3.78,M
The Answers/09 Blue Sunshine.mp3,4.24,M
The Answers/10 Mr. Blue's Menu.mp3,3.12,M
The Answers/11 Darkest Side of Houston's Finest Day.mp3,6.43,M
The Answers/12 Tomorrow.mp3,5.19,M
The Answers/13 Black Orchid.mp3,5.65,M
The Answers/AlbumArt_{1AE89E42-793B-4C05-9AB9-5F948C161916}_Large.jpg,10.14,K
The Answers/AlbumArt_{1AE89E42-793B-4C05-9AB9-5F948C161916}_Small.jpg,2.52,K
The Answers/AlbumArtSmall.jpg,2.52,K
The Answers/Folder.jpg,10.14,K
