User Type,Username,Date,Text
,thalittleboy,2011-05-19T09:48Z,I´ll wait for a moment to post the torrent on acb-team because there are not enough seeders.
,joshua1964,2011-05-19T18:18Z,The next is 'Biutiful.2011'
,joshua1964,2011-05-19T23:17Z,"Sorry for slowly upload,this is for the next upload .I think 2 hours."
,joshua1964,2011-05-20T17:39Z,"The next is drive angry  ,I have problems."
,agent000,2011-05-24T17:09Z,"can you upload a korean movie named ""The Foul King""?? no decent torrents available now!!"
,agent000,2011-05-24T17:28Z,but keep it below 2GB pls....
