Filename,Size,Unit
S07E27 Act Of Faith.avi,175.17,M
S07E06 Beta Delta Gamma.avi,175.05,M
S07E24 Apex.avi,175.05,M
S07E02 Bang! You're Dead.avi,175.05,M
"S07E30 What Frightened You, Fred.avi",175.04,M
S07E14 Bad Actor.avi,175.04,M
S07E26 Ten O'Clock Tiger.avi,175.04,M
S07E13 The Silk Petticoat.avi,175.04,M
S07E39 The Sorcerer's Apprentice.avi,175.04,M
S07E29 The Matched Pearl.avi,175.04,M
S07E01 The Hatbox.avi,175.03,M
S07E32 Victim Four.avi,175.03,M
S07E20 The Test.avi,175.03,M
S07E17 The Faith Of Aaron Menefee.avi,175.02,M
S07E15 The Door Without A Key.avi,175.02,M
S07E12 A Jury Of Her Peers.avi,175.02,M
S07E11 The Right Kind Of Medicine.avi,175.02,M
S07E18 The Woman Who Wanted To Live.avi,175.02,M
S07E16 The Case Of M.J.H..avi,175.02,M
S07E37 The Big Kick.avi,175.01,M
S07E28 The Kerry Blue.avi,175.01,M
S07E19 Strange Miracle.avi,174.94,M
S07E35 The Children Of Alda Nuova.avi,174.93,M
S07E10 Services Rendered.avi,174.93,M
S07E07 You Can't Be A Little Girl All Your Life.avi,174.92,M
S07E03 Maria.avi,174.9,M
S07E38 Where Beauty Lies.avi,174.88,M
S07E36 First Class Honeymoon.avi,174.88,M
S07E05 Keep Me Company.avi,174.87,M
S07E34 The Twelve Hour Caper.avi,174.87,M
S07E31 Most Likely To Succeed.avi,174.86,M
S07E22 The Big Score.avi,174.86,M
S07E23 Profit-Sharing Plan.avi,174.85,M
S07E21 Burglar Proof.avi,174.84,M
S07E25 The Last Remains.avi,174.82,M
S07E33 The Opportunity.avi,174.8,M
S07E09 I Spy.avi,174.8,M
S07E04 Cop For A Day.avi,174.78,M
S07E08 The Old Pro.avi,174.78,M
Torrent downloaded from Demonoid.com.txt,47,B
