User Type,Username,Date,Text
,Ninja_Cat,2011-01-28T12:35Z,thanks!
[T],CheckOutEr,2011-01-29T17:11Z,"Hi, hellboy! I just wanted to know that can you crack Xilisoft Blu-ray Creator Express? http://burnworld.com/software/blu-ray/burning.htm This is the best blu-ray burning software and there are no any cracks on TPB for it. Xilisoft Blu-Ray Creator 2 link: http://www.xilivideo.com/products.html Anyway thank you. :)"
[T],CheckOutEr,2011-01-29T19:00Z,"I mean, to find crack or serial/licence for it, not to crack it by yourself if you can't. :)"
,TheEnraNoj,2011-02-26T13:50Z,"Thanx !  , great imtoo tool
Can download any program from imtoo and juse crack  reg ."
,akhnaten,2011-04-22T21:46Z,"THANK YOU! After downloading several other versions of this with non-working keys, this one works with no problem at all! Installed on Windows 7 64bit.  Fantastic! Thanks again =)"
