User Type,Username,Date,Text
,xeusoi16,2011-06-05T17:49Z,"fake? doesn't play in vlc, wmp or media player classic..."
,vaikou15,2011-06-06T08:33Z,i think it is fake...fake
,Kanariepiet,2011-06-06T17:50Z,"Prima torrent, geen fake (misschien doet een groene skull er toch iets toe?) En genoeg snelheid hier...het is zelf een zeer acceptabele TS:

Audio 7
Video 7

Just fine torrent, no fake (green skull does matter). very acceptable TS."
,ivokiller,2011-06-12T15:50Z,is dit cam of normaal ?
,Bolle46,2011-06-21T06:53Z,het einde staat hier niet op!
,Bolle46,2011-06-21T06:54Z,"cam versie, maar best te doen"
