User Type,Username,Date,Text
,gogrrrt,2011-04-10T22:57Z,Thanks! Definitely buying this on Tuesday.
,gogrrrt,2011-04-10T22:58Z,Thank you based god. New favorite album.
,gogrrrt,2011-04-10T23:07Z,"It's ""Slow Motion"", not ""Slow Montion"""
,coltron0,2011-04-10T23:48Z,"Someone else's mistake on the ""Slow Montion"", didn't notice until it was too late. Actually might be my favorite track on the album."
,alejandro70,2011-08-09T16:39Z,GRACIAS !!!!!!!!!!!!!!!!!!!!!!!!!!!!!!!!!!!!!!!!!!!!!!!!!!!!
