Filename,Size,Unit
Merlin S04E07 The Secret Sharer FoV eng  NL subs/merlin.4x07.the_secret_sharer.720p_hdtv_x264-fov.mkv,1.13,G
INFO TBS/poster.jpg,44.43,K
Merlin S04E07 The Secret Sharer FoV eng  NL subs/Merlin.2008.S04E07.720p.HDTV.x264-FoV eng.srt,32.59,K
Merlin S04E07 The Secret Sharer FoV eng  NL subs/Merlin.2008.S04E07.720p.HDTV.x264-FoV nl.srt,31.68,K
INFO TBS/www.black-Sam org     Kom eens Langs !.jpg,13.1,K
INFO TBS/Merlin S04E07 NLsubs Eng Subs TBS B-SAM.txt,903,B
INFO TBS/Torrent_downloaded_from_Demonoid.com.txt,563,B
INFO TBS/Black-Sam.txt,128,B
INFO TBS/Torrent_downloaded_from_AhaShare.com.txt,61,B
INFO TBS/Torrent Downloaded from SilverTorrents.me.txt,41,B
INFO TBS/Torrent Downloaded from Solotorrents.com.txt,40,B
INFO TBS/Torrent Downloaded from  Movie-Torrentz.txt,39,B
