Filename,Size,Unit
CD1/12. Seek And You Shall Find.mp3,8.22,M
CD1/9. I Hear A Symphony.mp3,7.46,M
CD1/11. There's No Love Left.mp3,6.94,M
CD1/2. Stop! In The Name Of Love.mp3,6.88,M
CD1/16. Tell Me It's Just A Rumor (Baby).mp3,6.84,M
CD1/21. Little Miss Sweetness.mp3,6.81,M
CD1/01.Nowhere To Run.mp3,6.55,M
CD1/13. Got To Have You Back.mp3,6.45,M
CD1/18. It's Out Of The Question.mp3,6.43,M
CD1/5. I Guess I'll Always Love You.mp3,6.41,M
CD1/24. Behind A Painted Smile.mp3,6.4,M
CD1/3. This Old Heart Of Mine (Is Weak For You).mp3,6.38,M
CD1/8. Put Yourself In My Place.mp3,6.32,M
CD1/22. Good Things.mp3,6.23,M
CD1/7. Who Could Ever Doubt My Love.mp3,6.22,M
CD1/25. Take Me In Your Arms (Rock Me A Little While).mp3,6.22,M
CD1/26. All Because I Love You.mp3,6,M
CD1/19. Why When Love Is Gone.mp3,5.98,M
CD1/6. Baby Don't You Do It.mp3,5.91,M
CD1/23. Catching Up On Time.mp3,5.83,M
CD1/20. Save Me From This Misery.mp3,5.76,M
CD1/4. Take Some Time Out For Love.mp3,5.65,M
CD1/14. That's The Way Love Is.mp3,5.4,M
CD1/10. Just Ain't Enough Love.mp3,5.28,M
CD1/17. One Too Many Heartaches.mp3,5.24,M
CD1/15. Whispers (Gettin Louder).mp3,5.04,M
CD2/21. Tell Me It's Just A Rumor (Baby).mp3,7.77,M
CD2/2. It Moves Me To Tears.mp3,7.41,M
CD2/23. My Love Is Your Love (Forever).mp3,7.26,M
CD2/18. I Can't Go On Sharing Your Love.mp3,7.22,M
CD2/3. What Becomes Of The Brokenhearted (Smile).mp3,7.06,M
CD2/14. Born To Love You.mp3,6.89,M
CD2/4. Greetings (This Is Uncle Sam).mp3,6.88,M
CD2/1. Ain't That Real Satisfaction.mp3,6.86,M
CD2/5. Leaving Here.mp3,6.85,M
CD2/17. I Can't Help It (I Love You).mp3,6.85,M
CD2/10. Trouble.mp3,6.77,M
CD2/8. Sure Is A Lotta Woman.mp3,6.75,M
CD2/6. How Sweet It Is (To Be Loved By You).mp3,6.74,M
CD2/13. My Love Is Your Love (Forever).mp3,6.71,M
CD2/24. Greetings (This Is Uncle Sam).mp3,6.55,M
CD2/22. I Guess I'll Always Love You.mp3,6.46,M
CD2/19. This Old Heart Of Mine (Is Weak For You).mp3,6.36,M
CD2/12. No Good Without You.mp3,6.31,M
CD2/16. Share A Little Love With Me (Somebody).mp3,6.22,M
CD2/7. A Weakspot In My Heart.mp3,6.19,M
CD2/20. I Guess I'll Always Love You.mp3,6.12,M
CD2/25. Take Me In Your Arms (Rock Me A Little While).mp3,6.05,M
CD2/26. All Because I Love You.mp3,5.97,M
CD2/15. Sad Souvenirs.mp3,5.95,M
CD2/9. You've Got So Much To Shout About.mp3,5.81,M
CD2/11. Nevermore.mp3,4.81,M
front.jpg,261.79,K
