Filename,Size,Unit
Grimm S01E06 The Three Bad Wolves (Web DL)/Grimm.S01E06.The.Three.Bad.Wolves.720p.WEB-DL.DD5.1.H.264-ECI.mkv,1.36,G
Grimm S01E06 The Three Bad Wolves (Web DL)/Grimm.S01E06.720p.WEB-DL.DD5.1.H.264-ECI NEG subs.srt,51.23,K
Grimm S01E06 The Three Bad Wolves (Web DL)/Grimm.S01E06.The.Three.Bad.Wolves.720p.WEB-DL.DD5.1.H.264-EC I.srt,40.88,K
INFO TBS/poster.jpg,42.77,K
INFO TBS/www.black-Sam org     Kom eens Langs !.jpg,13.1,K
INFO TBS/GRIMM S01E06 NL ENG Subs HD (WEB-DL) TBS.txt,2.55,K
INFO TBS/Torrent_downloaded_from_Demonoid.com.txt,563,B
INFO TBS/Black-Sam.txt,128,B
INFO TBS/Torrent_downloaded_from_AhaShare.com.txt,61,B
INFO TBS/Torrent Downloaded from SilverTorrents.me.txt,41,B
INFO TBS/Torrent Downloaded from  Movie-Torrentz.txt,39,B
