Filename,Size,Unit
Marshall Tucker Band-Greatest Hits-03-In My Own Way.mp3,13.09,M
Marshall Tucker Band-Greatest Hits-08-I Should Have Never Started Lovin' You.mp3,11.88,M
Marshall Tucker Band-Greatest Hits-01-Take The Highway.mp3,11.12,M
Marshall Tucker Band-Greatest Hits-14-Desert Skies.mp3,10.9,M
Marshall Tucker Band-Greatest Hits-09-24 Hours At A Time.mp3,9.11,M
Marshall Tucker Band-Greatest Hits-06-Ramblin'.mp3,8.5,M
Marshall Tucker Band-Greatest Hits-04-Fire On The Mountain.mp3,7.07,M
Marshall Tucker Band-Greatest Hits-12-Too Stubborn.mp3,6.92,M
Marshall Tucker Band-Greatest Hits-02-Blue Ridge Mountain Sky.mp3,6.65,M
Marshall Tucker Band-Greatest Hits-13-This Ol' Cowboy (Single Version).mp3,6.48,M
Marshall Tucker Band-Greatest Hits-05-Heard It In A Love Song (Single Version).mp3,5.92,M
Marshall Tucker Band-Greatest Hits-11-Can't You See (Single Version).mp3,5.87,M
Marshall Tucker Band-Greatest Hits-07-Searchin' For A Rainbow (Single Version).mp3,5.36,M
Marshall Tucker Band-Greatest Hits-10-Long Hard Ride (Single Version).mp3,5.05,M
Marshall Tucker Band.jpg,25.09,K
