Filename,Size,Unit
ChattChitto RG.nfo,12.38,K
Sam's Town/01 Sam's Town.mp3,9.38,M
Sam's Town/02 Enterlude.mp3,1.91,M
Sam's Town/03 When You Were Young.mp3,8.41,M
Sam's Town/04 Bling (Confession of a King).mp3,9.47,M
Sam's Town/05 For Reasons Unknown.mp3,8.09,M
Sam's Town/06 Read My Mind.mp3,9.41,M
Sam's Town/07 Uncle Jonny.mp3,10.13,M
Sam's Town/08 Bones.mp3,8.66,M
Sam's Town/09 My List.mp3,9.47,M
Sam's Town/10 This River Is Wild.mp3,10.6,M
Sam's Town/11 Why Do I Keep Counting-.mp3,10.08,M
Sam's Town/12 Exitlude.mp3,5.79,M
Sam's Town/13 Where the White Boys Dance.mp3,7.88,M
The Killers - Sam's Town [ChattChitto RG] Cover.png,196.01,K
www.ChattChitto.com.nfo,7.9,K
