User Type,Username,Date,Text
,RebourneD,2011-08-12T21:58Z,"@torrentfeeder1234:
Yo Mr.shithead, All of my torrents include the name of the source providers, its not because i will get highlighted, its because i want to credit them for high quality sources..."
,yrrag,2011-08-14T10:32Z,Why doesnt fxg team upload new videos.
,RebourneD,2011-08-15T11:33Z,"@torrentfeeder1234: you still dont get it, i do not try to take credit fropm them you idiot.... i try to GIVE THEM the credit for the wonderful sources i use to encode in small sizes you Dope!
Well i guess its true, Never Argue with idiots, so i am going to stop arguing with you!"
,RebourneD,2011-08-15T11:34Z,"And if you don't like my torrent that doesnt mean you should bookmark it, open everyday and give it a -1..."
,summer1967love,2012-01-07T04:24Z,"...the fuck...thanks for the up, cousin."
