User Type,Username,Date,Text
[S],velvet.,2011-12-06T03:07Z,"You really ought to consider upgrading to a modern bit torrent client such as uTorrent or Vuze.
The old BitComet crap that you are using has been obsolete for years.


The exact same movie file you just uploaded has already been available for more than four months from this torrent:
https://thepiratebay.org/torrent/6508224/Anuvahood_%282011%29_LIMITED_DVDRip_XviD-TWiZTED
It has more than 250 seeders.


You ought to read this: http://www.urbandictionary.com/define.php?term=Torrent%20Whore"
