User Type,Username,Date,Text
[T],PeteSapai,2011-03-20T13:08Z,Let me be the first to say thanks: thanks!
,BabyNo1,2011-08-15T22:26Z,thanks!
,Xeginy,2011-09-04T20:40Z,"Great download, all the episodes work fine. Thanks!"
,papa11,2011-10-13T14:48Z,"Thanks great torrent!
Request Season 2 dvdrip"
,PBR-Streetgang,2012-04-17T09:19Z,"great upload, thanks for going to the trouble mate."
,PBR-Streetgang,2012-04-17T09:20Z,"great torrent, thank for the up."
,patrizier,2012-04-28T16:00Z,Just started Downloading it. Thank You.
