User Type,Username,Date,Text
,stthedevil007,2011-08-16T06:23Z,thanks dude......il do my bit
,bryentheartist,2011-08-16T06:32Z,thanks alot
,bossplayahawk,2011-08-16T22:57Z,thanks a million great show great torrent
,HonNee,2011-08-17T00:16Z,EZtv you are awesome!!!!!
,hurka79,2011-08-22T19:01Z,THX!
,anadrvodelic,2011-08-23T00:20Z,....anyone knows will it be second season.....???
,hurka79,2011-08-24T21:57Z,Great show! I wait next season! 
,MusicLoverAndGleek,2011-09-03T10:52Z,"Thank you, I can't wait till September 4th for the next season to start. (: you're awesome eztv."
,MusicLoverAndGleek,2011-09-03T10:55Z,Dammit I meant it starts in the summer of 2012 xD
