Filename,Size,Unit
Bold Conceptions/01 A Moment's Notice.m4a,4.43,M
Bold Conceptions/02 Nardis.m4a,7.71,M
Bold Conceptions/03 The Night We Called it a Day.m4a,4.41,M
Bold Conceptions/04 Trilogy.m4a,9.34,M
Bold Conceptions/05 Quest.m4a,5.84,M
Bold Conceptions/06 My Love (from Candide).m4a,7.33,M
Bold Conceptions/07 Fly Me to the Moon (aka in Other.m4a,6.62,M
Bold Conceptions/08 Birks' Works.m4a,6.18,M
Bold Conceptions/09 Softly as in a Morning Sunrise.m4a,5.14,M
Bold Conceptions/10 Ghost Riders in the Sky.m4a,4.95,M
Straight Up/01 Nightcrawler.m4a,6.6,M
Straight Up/02 Ambrosia.m4a,9.1,M
Straight Up/03 James.m4a,6.86,M
Straight Up/04 The Jody Grind.m4a,10.03,M
Straight Up/05 Lost April.m4a,7.84,M
Straight Up/06 Three Mice Blind.m4a,10.27,M
Straight Up/07 Hockney.m4a,8.62,M
Straight Up/08 Shooting Stars.m4a,8.86,M
Straight Up/09 Quiet Now.m4a,8.04,M
Take It From The Top/01 Billy Boy.m4a,7.03,M
Take It From The Top/02 Straighten Up And Fly Right.m4a,9.51,M
Take It From The Top/03 Downtown.m4a,7.71,M
Take It From The Top/04 Tenderly.m4a,9.1,M
Take It From The Top/05 Nardis.m4a,8.53,M
Take It From The Top/06 Poinciana.m4a,9.72,M
Take It From The Top/07 Caravan.m4a,7.66,M
Take It From The Top/08 Soul Eyes.m4a,11.28,M
Take It From The Top/09 Django.m4a,8.65,M
