Filename,Size,Unit
ChattChitto RG.nfo,12.55,K
Hail to the Thief/01 2 + 2 = 5 (The Lukewarm).mp3,7.6,M
Hail to the Thief/02 Sit Down. Stand Up. (Snakes & Ladders).mp3,9.91,M
Hail to the Thief/03 Sail to the Moon (Brush the Cobwebs out of the Sky).mp3,9.85,M
Hail to the Thief/04 Backdrifts (Honeymoon Is Over).mp3,12.3,M
Hail to the Thief/05 Go to Sleep (Little Man Being Erased).mp3,7.68,M
Hail to the Thief/06 Where I End and You Begin (The Sky Is Failling In).mp3,10.27,M
Hail to the Thief/07 We Suck Young Blood (Your Time Is Up).mp3,11.31,M
Hail to the Thief/08 The Gloaming (Softly Open Our Mouths in the Cold).mp3,8.08,M
Hail to the Thief/09 There There (The Boney King of Nowhere).mp3,12.34,M
Hail to the Thief/10 I Will (No Man's Land).mp3,4.56,M
Hail to the Thief/11 A Punchup at a Wedding (No No No No No No No No).mp3,11.34,M
"Hail to the Thief/12 Myxomatosis (Judge, Jury & Executioner).mp3",8.87,M
Hail to the Thief/13 Scatterbrain (As Dead as Leaves).mp3,7.69,M
Hail to the Thief/14 A Wolf at the Door (It Girl. Rag Doll).mp3,7.68,M
Radiohead - Hail to the Thief [ChattChitto RG] Cover.png,443.83,K
www.ChattChitto.com.nfo,7.9,K
