User Type,Username,Date,Text
,vinaykannam1437,2011-04-22T16:24Z,please add reps
,kalinga28,2011-04-25T08:34Z,Hey bro we really apreciate your effort .But there is 0 seed wih a large number of leechs so it stucks at 60% .You know you are the first to do such torrents and if there is no seed then your effort can go in vein.so if you kindly seed those to 8-10 then it will be great .Thank you for this stuff.Quality is nice(1st 2 minute of stucked download) .And wish you a great life .
,topak,2011-04-27T03:46Z,"Hi,

Would you kindly seed a bit for us?
I am stuck at 61.4%. I have downloaded only 723 mb out of 1.15 GB and uploaded 17 GB !!.

Pl. help me to complete this one. My children love it.

Also can you share some Hindi episodes of Chota Bheem cartoon series appearing on pogoTV ??

Thanks a lot."
,vinaykannam1437,2011-04-27T07:04Z,K I WILL TRY
,raghun,2011-04-29T19:31Z,"there are 12 peers now with 61.4 %  !!!!,please seed"
,raghun,2011-04-29T19:37Z,"To the creator of this torrent: Please seed, (if there is a problem ,pl inform, a large no. of peers are waiting ."
,kalinga28,2011-05-04T22:25Z,Thnk you for the significant amount of seeds .If you can upoad other tv shows like ninja hatori or kochikame then it wil be a great help but it is up to your valuable time .All the very best for vinayji for these awesome stuffs.
,casanova9,2011-10-09T08:03Z,can any one mention what are the  names of all theses episodes plz help folks
,vinay7,2011-10-13T07:49Z,"there are no names dude 

i am the uploader of this torrent"
