Filename,Size,Unit
Blubberella.2011.HQ.DVDRip.h.264.AC3.NL.Subs.MQ.DMT/Blubberella.2011.HQ.DVDRip.h.264.AC3.NL.Subs.MQ.DMT.avi,696.3,M
Blubberella.2011.PAL.Retail.DD5.1.Ger.NL.Subs.DMT.nfo,3.5,K
"DMT NFO, Read before Playing.txt",1.38,K
Torrent downloaded from AhaShare.com.txt,58,B
Torrent downloaded from Demonoid.me.txt,46,B
Torrent downloaded from Rarbg.com.txt,33,B
Torrent downloaded from silvertorrents.me.txt,29,B
Torrent Downloaded from TorrentState.com.txt,46,B
Torrent_downloaded_from_www.puretorrents.cc.txt,36,B
