User Type,Username,Date,Text
,fasurvivor,2011-01-05T05:38Z,"another request is Avatar 3xDVD9 collector`s edition. I have a link but it takes long time to download from there. If you can upload, I must quite from there 
thanks for twilight"
[T],Torrent4nu,2011-01-05T17:28Z,NLUPPER kan je vandaag of morgen season 2 uploaden van Two and a half men 
,aienment,2011-02-19T16:58Z,Mighty supreme upload mate. Thnx a lot.
,Panreus,2011-04-09T14:30Z,"super weak speed! :( only 2 kb/s

seed please, great movie, very eager to watch, will stay on seed for several weeks after"
