User Type,Username,Date,Text
,200miles,2011-10-18T10:29Z,How about seeding?
,TurnToAshes,2011-10-18T12:08Z,Password for the .rar file?
,N3CR0S1S,2011-10-18T12:24Z,"Yea this torrent is a bag of fail. First of its a Rar file which is kinda pointless compressing an avi because its just wasting space after decompression, and furthermore you have yet to post a password for the Rar file so its worthless to anyone because i dont think anyone wants to take the time to crack it. :/ !!DONT DOWNLOAD!!"
,Ceasar89,2011-10-18T15:47Z,The password is hdmovies. Sorry I forgot to mention it.
,Ceasar89,2011-10-18T15:50Z,I mean it is HDTV-Shows.net sorry again.
,rainbow_,2011-10-18T17:50Z,"This torrent is a .rar archive with a password. Use this one instead (same uploader):
http://thepiratebay.org/torrent/6753498/House_md_season_8_episode_3

The copy is great and the timing is great though. Thanks!"
,Anathematic11,2011-10-20T07:54Z,"Heya,

You posted this up for free; I don't care if it's 12x14 pixels. A lot of people seem to miss the point of torrents. Ceasar you are part of something great my friend! Thank you so very much for this torrent. May your days be nothing short of ecstacy. No troll...

Thanks so much! Good episode haha"
