Filename,Size,Unit
SuperPLAY- bitpop/01 Introduction.mp3,3.79,M
SuperPLAY- bitpop/02 LAST NINJA- WASTELANDS.mp3,5.77,M
SuperPLAY- bitpop/03 Trap.mp3,8.8,M
SuperPLAY- bitpop/04 WIZBALL 2000.mp3,6.59,M
SuperPLAY- bitpop/05 OCEAN LOADER 1.mp3,4.4,M
SuperPLAY- bitpop/06 Aztec Challenge.mp3,2.84,M
SuperPLAY- bitpop/07 Glider Rider.mp3,3.1,M
SuperPLAY- bitpop/08 Ocean Loader 4.mp3,3.43,M
SuperPLAY- bitpop/09 INSECTS IN SPACE.mp3,4.49,M
SuperPLAY- bitpop/10 WARRIORS.mp3,6.41,M
SuperPLAY- bitpop/11 Comic Bakery.mp3,5.19,M
SuperPLAY- bitpop/12 Monty On The Run.mp3,6.26,M
