User Type,Username,Date,Text
,Thief_,2012-05-02T03:03Z,"The movie ""ALIEN_III_1992_BluRay_1080p_QEBS5_AAC51_MP4-FASM"" has audio lagging by about 0.5 seconds but other files are A+++.

-PrateBay Rules-"
PPY FEET and my child she loved.
i cant belive whay  nobody not converted in FASM FOR PS3.Is the best movie for children, and for us.
I just hope is not just my request , i belive is a lot of people how want to see this movie in the best quality ( FASM - PS3 ) And i hope sombody it will encode for PS3 SOON.          "
