User Type,Username,Date,Text
,xxxchromaticxxx,2011-04-09T14:34Z,oh for fucks sake can someone just release a HDRIP in 1280 pixel width of this movie?
,simon200,2011-04-09T15:47Z,"@xxxchromaticxxx STFU!!!
be thankfull for this FREE torrent
Or UL it yourself
fu8cking hate ungreatfull tools like you 
cheers sadbawang"
,xxxchromaticxxx,2011-04-09T18:23Z,"@simon200: SUCK MY DICK U CUNT, ITS ABOUT FUCKIGN TIME THEY UPLOADED A COPY!"
,simon200,2011-04-09T21:05Z,"I'M SURE YOUR LOVELY BUT LIKE I TOLD GEORGE MICHAEL I'M NOT INTO IT, SO I GUESS LIKE ALL SATURDAY NIGHTS YOUR SUCKING YOUR OWN TOOL"
,xxxchromaticxxx,2011-04-12T16:07Z,FUCK YOU CUNT lol
