User Type,Username,Date,Text
,Taz1982,2011-10-29T02:26Z,"cheers Bone, but what a crap game lol"
,.HTC.DuDE,2011-10-30T20:20Z,Does this work for HTC Desire HD? It would be VERY APPRICIATED if you could tell me before I download (No disrespect @.BONE. but nearly all of your other Android uploads say what models they work on but this doesnt? FIX THIS PLEASE)
,ferdie82x,2011-10-31T00:13Z,the driver games are always bat controll sucks etz. 
[V],.BONE.,2011-11-02T06:17Z,should work on any phone 
[V],.BONE.,2011-11-02T06:17Z,i cant edit anything after its uploaded sorry
,ashley_au,2011-11-02T10:38Z,Works on SE Xperia PLAY. Terrible game however.
,Dexified,2012-01-06T08:06Z,"How do I get this on my phone, I am new to the android torrents"
,ImHumf,2012-03-31T14:53Z,"Ahhh i love driver, gotta check this out. Thanks again BONE for all your uploads!"
