User Type,Username,Date,Text
,dennon49,2011-03-06T08:08Z,"thanks!

on another upload I was asking about Rosemary/ATK Petites.

dying for her ATK sets. "
,ekarth22,2011-03-06T11:50Z,"Recently you uploaded ATK_Exotics_-_Jazmyne, I thouroughly enjoyed her Latin booty, thanks very much and please continue that trend of latina-booties in future please !"
,mybabymary,2011-04-10T15:53Z,"Rochie you are a fucking ass, if you dont like it stay away disgrace for the human race"
[V],nilsm,2011-04-26T17:38Z,"I couldn't agree more, mybabymary.

Rochie(or was it Rookie?): Get the F... out of here.

Thanx for the UL, bestev1234, I like nothing more than to see the pink in the black. (sigh)"
