User Type,Username,Date,Text
[V],GunningHawk90,2011-10-27T07:34Z,"And thank you, for this :)"
[T],MrDowntown,2011-10-27T07:46Z,Gotta love the Turtles :)
,MOURGOLYKOS,2011-10-27T08:11Z,THANKS A LOT! I AM THE ONE TRUE SHREDDER
,new52,2011-10-27T21:10Z,Thanks MrD!
,muckymucks,2011-11-13T04:35Z,The pages are too small. Look at the file size. There's gotta be a better version.
,azure7,2012-01-12T02:41Z,hey are you not going to upload the next few issues or the Raph one shot? really enjoying this 
