User Type,Username,Date,Text
,40_Thieves,2011-01-25T19:08Z,This is real by the way. If someone could confirm I'd be grateful
,elturbo9077,2011-01-25T19:55Z,thanks alot hey can u upload top gear s01 e10 in 720p and being human s03e01 in 720p also becuase they are not here 
,40_Thieves,2011-01-25T20:52Z,"You can get episode 10 of top gear here 

http://thepiratebay.org/torrent/6126228/Top.Gear.US.S01.720p.HDTV.x264-FL

Will try for Being Human"
,elturbo9077,2011-01-26T05:49Z,thanks for the link please try to find it have a nice day greets from somewhere
,dude9999,2011-01-26T22:10Z,"You are a star mate. I asked for E4 and you have delivered. many thanks!

w00t!"
,40_Thieves,2011-01-27T02:13Z,You're welcome
