User Type,Username,Date,Text
[V],neil1966hardy,2011-10-22T16:35Z,"This technique works fine for me. Hope it works for you. Please show your appreciation both by seeding this torrent and also uploading your ebooks to tpb when you have managed to remove the drm!

Take care
Neil"
,hekitzi,2011-10-27T17:01Z,"It works very well!
Hint: to access The Plugins menu, go to ""Preferences"" and pick ""Change Calibre behavior"""
,PrincessPink,2011-11-02T16:34Z,How very useful. Thank you.
,PrincessPink,2011-11-02T19:26Z,Virus free and works.
,JimboZog,2011-12-16T05:03Z,Has anyone released a crack for the newest DRM (I think  it was released in November).?
,Lucybabe,2012-02-05T17:14Z,"Many thanks.  This technique works a treat on kindle and google books alike.

Will seed forever!"
,MrPokerFace,2012-02-12T23:00Z,what is the 10 digit PID? to MobileDRM
,minhhale,2012-02-20T14:21Z,Big thanks for the detailed plugin guide - works GREAT for me!
