User Type,Username,Date,Text
,kleftisaa,2011-05-28T07:30Z,"Hello asiourd. Thankyou very much for the quality ups. My parents are grateful as am I. We have enjoyed the show very much. (1821 included).
All the best to you.
Yiasou"
,Vaserkas,2011-05-29T17:02Z,"Bravo Congratulations Fantastic Uploads .
Thanks to you my friend we were able and fortunate to Watch and follow the show from the beginning to end.

Μπράβο Συγχαρητήρια Fantastic Uploads.
Χάρη σε εσενα φίλε μου είχαμε την ευκαιρία και την τύχη να δουμε ΤΟ ΝΗΣΙ από την αρχή μέχρι το τέλος.

All the best to You 
Για Σου

Thank You 
Ευχαριστω "
,ImbaDaimon,2011-06-28T01:28Z,"Euxaristo kai apo emena, to ithela poli kai to epsaxna poli.

Mono kalitera tha itan (tora pou teliose i sira) na kanate 1 torrent me ola ta episodia mazi, gia na dievkolinete ton kosmo alla kai esas sto seeding :D

ty again.., gratz... ;)"
,alexaRad17,2012-03-07T22:23Z,english subtitles maybe???? anyone??? please.......
