User Type,Username,Date,Text
,Albertfll2,2011-01-27T23:20Z,"Kan iemand ook de source online zetten zodat het ook voor andere kaarten aangepast kan worden?
Bij voorbaat dank!"
,RobbieWII,2011-01-28T00:17Z,ik heb een andere RFID reader dan de touchatag is dat niet mogelijk?
,clownfishrule,2011-02-01T22:10Z,"- Dit proces duur ongeveer een tot twee uur.
- Als dit correct verlopen is heb je een dumpfile

Waar word deze dumpfile weggeschreven of opgeslagen?

Kan iemand mij meschien helpen?

Bedankt"
,Onanon,2011-02-03T14:21Z,"De dumpfile wordt opgeslagen in dezelfde directory als waar mfocGUI.exe staat.

NB: Je hebt nfc-mfclassic.exe nodig om de dumpfile via je kaartlezer naar je kaart te schrijven.

Ik adviseer je deze torrent te gebruiken:

http://thepiratebay.org/torrent/6132011/OV_saldo_compleet_met_schrijven_en_reparatie_kit_%28enige_echt_wer
"
,clownfishrule,2011-02-04T18:49Z,"Ok, das Cool Onanon!

Nu probeer ik de file nfc-mfclassic.exe te openen direct vanuit de map waar deze inzit.

Dan gaat er een soort van dos schermpje open en dat gaat binnen een seconde weer dicht. 

Heb het met beide torrents geprobeerd.

Is er een ander programma nodig om dit bestand te openen?

Heb overigens een touchatag....
Bedankt!
"
,AbarthCorse,2011-02-06T06:05Z,"Heren Ontwikkelaars,

Gaarne ook een editie voor Mac op .dmg. 
Dan kan het feest ook op een ander platform beginnen."
,juicy_mokro,2011-02-11T14:37Z,"http://computer-software.marktplaats.nl/usb-sticks-en-toebehoren/416703698-touchatag-ik-heb-ze-weer-op-voorraad-op-op.html

Het duurde even maar ik heb ze weer op voorraad! De Touchatag Starter Pack! Nieuw in doos! 
Ophalen of verzenden is geen enkel probleem!
Betalingen kunnen via internetbankieren of paypal worden gedaan.
Wees er snel bij want OP=OP !"
,uglydoll,2011-02-13T23:02Z,dit is heel leuk allemaal maar WERKT HET OOK . kan iemand een filmpje of iets laten zien dat het echt werkt
,dylan036,2011-03-15T22:46Z,"Torrent werkt goed (Y)
Heb mijn ov-chipkaart reader van http://ovchipkaartreaders.nl/ daar staan meerdere shops bij dus kun je de goedkoopste kiezen"
