Filename,Size,Unit
Babe Ruth Elusive.mp3,6.84,M
Bobby Goldsboro  Too many people.mp3,6.58,M
7 miles per hour band playing your game.mp3,5.93,M
Jerry Washington Don t waste my time.mp3,5.16,M
Geno Washington Im so in love with you.mp3,4.95,M
Kenny Smith  Lord what s happening to your people.mp3,4.84,M
Collins Collins Top of the stairs.mp3,4.82,M
Bobby Rich there s a girl somewhere for me.mp3,4.72,M
Gene Anderson Do you love me baby.mp3,4.62,M
Hank Hodge One  Way Love.mp3,4.47,M
Kim Tolliver I Dont Know Which Foot to Dance On.mp3,4.43,M
Cecil Washington  I don t like to lose.mp3,4.25,M
Cajun Hart  Got to find a way.mp3,4.17,M
Jesse Davis  Theres Room For Me..mp3,4.15,M
Hank Jjacobs Elijah rockin  with soul.mp3,4.14,M
Bill Brandon and Lorraine Johnson  Full time groover.mp3,4.13,M
Bobby Paris  I Walked Away.mp3,4.12,M
Billy Arnell  Tough girl.mp3,4.05,M
Art Freeman Slipping around with you.mp3,4,M
harry starr - another time another place.mp3,4,M
Jimmy Delphs  Dancing a hole in the world.mp3,3.99,M
Del Larks Job opening.mp3,3.99,M
Curtis Liggins indications.mp3,3.99,M
Kenny Shepard  What difference does it make.mp3,3.96,M
Buster and Eddie I can`t be still.mp3,3.94,M
George Kirby  What can i do.mp3,3.93,M
Johnny Howard The chase is on.mp3,3.92,M
JT Rhythm  All I want is you.mp3,3.91,M
John Harris and the Soul Sayers Hangin  in.mp3,3.9,M
Del Larks Out of the in crowd.mp3,3.89,M
Jackey Beavers I need my baby.mp3,3.87,M
Bits  n  Pieces  Keep on running away.mp3,3.84,M
Carlena  Just brothers.mp3,3.83,M
Diplomats  Cards on the table.mp3,3.81,M
admirations - heaven is in your arms.mp3,3.81,M
"Jack Montgomery  Baby,baby take a chance on me.mp3",3.78,M
cold hearted blues the soul city.mp3,3.74,M
Eddie Spencer If this is love (i d rather be lonely).mp3,3.72,M
James Bell and Highlighters  Amazing love.mp3,3.69,M
Jack Montgomery  Dearly beloved.mp3,3.68,M
Carl Holmes and the Commanders  Soul dance no.3.mp3,3.67,M
Fascinators In other words.mp3,3.61,M
Bob Kuban The Cheater.mp3,3.6,M
Gracie Dumas Song of a woman.mp3,3.59,M
Ambers  Potion of love.mp3,3.58,M
Bernard Smith and Jokers Wild - Gotta be a reason.mp3,3.57,M
Bobby Ttreetop  Wait till i get to know ya.mp3,3.56,M
Constellations  I didn t know how to.mp3,3.55,M
Clarence Townsend I found a new love.mp3,3.55,M
Gerri Hall  Who can I run to.mp3,3.53,M
Fred and the Turbins  Bernadine.mp3,3.52,M
johnny rodger Make a change.mp3,3.5,M
Allan Sisters Im in with the downtown crowd ..mp3,3.49,M
jimmy burns - i really love you.mp3,3.48,M
Imperial C s  Someone tell her.mp3,3.48,M
Johnny Sayles I cant get enough [of your love].mp3,3.48,M
Carl Spencer Cover girl.mp3,3.46,M
joseph webster - my love is so strong..mp3,3.46,M
Billie Davis  Just walk my shoes.mp3,3.44,M
Brice Coefield Ain t that right.mp3,3.43,M
Arthur Freeman  You got me uptight.mp3,3.42,M
International GTOs I love my baby.mp3,3.39,M
Bobby Hutton  Lend A Hand.MP3,3.39,M
Gene Toones  What more do you want.mp3,3.38,M
Ernest Mosley Stubborn heart.mp3,3.38,M
Kelly garett  Loves the only answer.mp3,3.38,M
Herb Ward  Strange change.mp3,3.37,M
Johnny Robinson Gone but not forgotten.mp3,3.37,M
Billy Woods Let me make you happy.mp3,3.34,M
Audrey Winters Thank you baby.mp3,3.34,M
Cesars  Girl i miss you.mp3,3.33,M
Jay d. martin By yourself.mp3,3.31,M
Executive Four  I gotta good thing going.mp3,3.3,M
harold burrage fifty fifty.mp3,3.26,M
Andre Brasseur The Kid.mp3,3.23,M
Bobby Sheen Dr Love.mp3,3.22,M
Arthur Alexander  Keep her guessing.mp3,3.22,M
Elbie Parker Please keep away from me.mp3,3.2,M
Joy Lovejoy In orbit.mp3,3.2,M
Ambassadors I need someone.mp3,3.19,M
Carstairs IIt Really Hurts Me Girl.mp3,3.14,M
Joyce Kennedy Im a good girl.mp3,3.14,M
Betty Turner The winds kept laughing.mp3,3.14,M
A touch of velvet - a sting of brass.mp3,3.13,M
george lemons - fascinating girl.mp3,3.13,M
Benny Spellman  Fortune teller.mp3,3.11,M
Charades  The key to my happiness.mp3,3.1,M
Ernie Washington Lonesome shack.mp3,3.07,M
Al Wiliams Ii am nothing.mp3,3.01,M
Arcades  Theres got to be a loser.mp3,2.95,M
Fabulous Moonlighters For granted.mp3,2.93,M
Garland Green It rained forty days   nights.mp3,2.93,M
James Carr  A losing game.mp3,2.92,M
Curtis Lee  Is she in your town.mp3,2.9,M
Garland Green Girl i love you.mp3,2.9,M
John Leach Put that woman down.mp3,2.88,M
5 of a kind   the other side.mp3,2.87,M
7th Avenue Aviators You Should O' Held On.mp3,2.83,M
jesse johnson - left out.mp3,2.81,M
Danny Moore  Somebody new.mp3,2.78,M
Bobby Patterson Till you give in.mp3,2.78,M
Billy Prophet  What can i do.mp3,2.78,M
Danny Wagner I lost a True Love.mp3,2.74,M
Bob Fred I ll be on my way.mp3,2.74,M
Clarence Hill  Alot of lovin goin round.mp3,2.73,M
Don Gardner Cheatin Kind.mp3,2.69,M
Billy Thompson Black eyed girl.mp3,2.67,M
August and Deneen We go together.mp3,2.63,M
Headlines He s looking for love.mp3,2.61,M
Carl Underwood Ain t you lying.mp3,2.59,M
Billy Harner What about the music.mp3,2.38,M
Karmello Brooks  Tell me baby.mp3,2.19,M
Cindy Scott  I love you baby.mp3,2.17,M
Betty Everett  Bye bye baby.mp3,2.14,M
Danny Monday  Baby without you.mp3,1.89,M
Eddie Whitehead - Just Your Fool.mp3,1.86,M
Jay Traynor - Up and over.mp3,1.78,M
Charles Sheffield  It s your voodoo working.mp3,1.6,M
Kenny Wells  Isnt it just a shame.mp3,1.23,M
Arabians  You Upset Me Baby.mp3,1.18,M
Karen Striblin We're not too young.mp3,1.13,M
JD Bryant I Wont Be Coming back.mp3,1.13,M
Brooks Brothers  Looking for a woman.mp3,1.06,M
Joseph Webster  My Love Is So Strong.mp3,1.06,M
Dennis Edwards I Didnt Have Too But I Did.mp3,1023.59,K
Herman Lewis Whos Kissing You Tonite.mp3,1005.34,K
Jimmy Andrews  Big city playboy.mp3,864.75,K
Damon Fox Packing Up.mp3,808.49,K
Executive Four  I 'll make it up.mp3,806.28,K
Honey and the Bees   Two Can Play the Same Game.mp3,803.18,K
Honey & The Bees  Dynamite Exploded.mp3,683.13,K
Gwen Owens - Just Say Youre Wanted (And Needed).mp3,631.87,K
Jesse Davis Gonna Hang on in there Girl.mp3,621.84,K
Ernestine Eady  Lets Talk It Over.mp3,599.55,K
Esther Grant Lets Make The Most Out Of Love.mp3,489.84,K
