Filename,Size,Unit
300511_265522140158347_100001016907492_799940_1065371383_n.jpg,160.12,K
300511_265522143491680_100001016907492_799941_1856398715_n.jpg,164.24,K
bezshechera.jpg,44.91,K
Prti Bee Gee-01-Aj Get Haj.mp3,2.05,M
Prti Bee Gee-02-Jojkara Darknes.mp3,3.29,M
Prti Bee Gee-03-Sajmon Seez.mp3,4.38,M
Prti Bee Gee-04-Drozica.mp3,4.24,M
Prti Bee Gee-05-Kad Sijes Iglom.mp3,3.76,M
Prti Bee Gee-06-Dil Korektan.mp3,3.45,M
Prti Bee Gee-07-Panduri Znaju vs.Bdat Dzutim.mp3,4.99,M
Prti Bee Gee-08-Ombre.mp3,3.61,M
Prti Bee Gee-09-Zurka RMX.mp3,4.96,M
Prti Bee Gee-10-Hip Hop Hurej.mp3,4.72,M
Prti Bee Gee-11-Slatka Navika(Skit).mp3,860.36,K
Prti Bee Gee-12-Ramo Moj Druze.mp3,4.11,M
Prti Bee Gee-13-Mnogo Jak Je Tshi.mp3,5.16,M
Prti Bee Gee-14-Str8 No More.mp3,4.92,M
Prti Bee Gee-15-Moja Gudra.mp3,4.64,M
Prti Bee Gee-16-Volim Te Ni Ja Tebe.mp3,4.21,M
