User Type,Username,Date,Text
,RichDaWicked,2011-05-29T16:37Z,Hi Thx. for the upload. I just want to ask if there is a playable version on Minecraft for a android phone. I just got Galaxy S2. Just wondering thanks)
,trencej,2011-05-30T00:29Z,"There will be soon.

Its coming out on the android powered Xperia Play First, Then standard android and iOS devices later. No date set yet however, although 11/11/11 seems likely."
,wtfminecraft,2011-06-13T13:51Z,actually you can download minebuild
,maginoth,2011-06-21T21:48Z,when i try to run the ¨portable_minecraft¨ the screen shows like a second and after that its pops away... can you help me??
,X_captain_squirrel_X,2011-07-06T00:08Z,"thnx for the upload! can anyone tell me how to remove the ""unliscensed copy"" text at the top of the screen though?"
