User Type,Username,Date,Text
[V],merzedes,2011-02-14T20:19Z,I am leaving you again for some days so i will upload some big files and hope the pc is alive when i`m away :-) Cheerz 
,laatmeerin,2011-02-15T00:05Z,8 movies! You are the best merzedes :)
,fatmick,2011-02-15T01:35Z,"Awesome, thanks Merzedes :)"
[V],YoCkNeR-BeNzO,2011-02-17T11:49Z,"@ merzedes & femdom fans

is there any video where mistress facesits slave till she cums hard, The cum should be real, not piss (Orgasmic face sitting)

It is very hard to find

I hope merzedes has already uploaded such video, but i am not aware which torrent contains orgasmic facesitting.

BTW, me and my girlfriend do this often, I love eating her cum."
