User Type,Username,Date,Text
,yerisan710,2011-09-25T01:46Z,"audio....??????


thx..........."
,johnasabo,2011-09-25T06:24Z,Read at the top.All listed.
,Jester647,2011-09-25T12:23Z,Superb!!!
,johnasabo,2011-09-25T19:08Z,"This is what we do seed.
See the torrents.
Ask me for the links to my other accounts.
Keep plugging away."
,ROBBIEcool,2011-10-01T15:40Z,"29 GIG FOR 4 MOVIES BRO, ARE U FRIKIN SERIOUS?"
,johnasabo,2011-10-02T04:38Z,"Am I not seeding mint dvd 9's?
People said they love dvd 9's so I provide them.
That's gratitude for you."
,mukaas,2011-10-30T06:47Z,"i have just switched over to d'l'ing movies with the menu and extras...love it!!! thx for including the extras. when you have time, would you pls up the change up (unrated), the jacket, brooklyn's finest, crossing over, the machinist, tropic thunder (unrated), revolver, lucky number slevin and fight club? with untouched menu and extras. i apologize for such a big request but i cannot find those movies with menu and extras on any torrent sites. i realize that you cannot fulfill the whole request all at once but if you could do 1 or so every now and then it would be greatly appreciated. thx again for your hard work. regards. "
