User Type,Username,Date,Text
,tuIIerusk,2011-03-17T22:49Z,Fantastisk! Håper du fortsette å laste opp norske serier i laaaang tid! Tusen takk!
,assamj,2011-03-18T00:41Z,"Herlig. Har ikke tv akkurat nå, dårlig med internett og, men skal dele så mye som mulig!"
,Myrviss2,2011-03-19T11:17Z,Bra noen legger ut norske nye serier!
,af1,2011-03-19T21:39Z,Helt konge.
,eterna111,2011-11-23T22:16Z,Takk for at du legger ut norske ting! Jeg bor på Bali og har (stort sett) ikke mulighet til å streame norsk TV pga. for dårlig Internett-hastighet her. Veldig bra innsats med koding og deling. Kjør på!
