User Type,Username,Date,Text
,The4given1,2011-08-02T20:44Z,This doesn't work buddy. Just shows up as 9.1.3 still. Any ideas for a fix ?
,haleboo,2011-08-03T16:43Z,"The4given1, you have to download the Logic Pro 9.1.4 update from the Apple support website, then apply this crack."
,a7x38783,2011-08-04T19:50Z,Downloaded and cracked within 2 minutes! Thank you so much! Now I can finally run Logic in Lion!
,greenative,2011-08-07T18:23Z,hey.. I'm using mac os x lion and i cant find the ProApps folder... in the Volume/Library/Application Support... how could I do?!!??!
,diskosimpa,2011-08-09T16:51Z,"yeah, i can't find the right folder either. what's up with that?"
,bAqhi,2011-08-09T23:52Z,@greenative Have you tried to search for the folder?
,btb101,2011-08-10T01:58Z,"awesome dude...
worked first time... with 9.1.5 update...

well impressed.."
,Darsha5000,2011-08-13T04:37Z,So you say first you need to download the logic pro 9.1.4 update from the apple support website correct.? yet you need a valid serial number to receive the download. is it safe to use the serial number that are provided?
,bAqhi,2011-08-13T16:26Z,"@Darsha5000 Just use the Apple Software Updater, to update logic to the newest version"
,modlang,2011-08-22T23:15Z,"THANK YOU!!!! After following your instructions, and then running Apple's 9.1.3 update, Logic fired up and is working again with the new Lion OS.

THANK YOU, THANK YOU THANK YOU. This fix is brilliant in it's simplicity."
,Niall2k11,2011-08-23T13:17Z,"This is amazing thank u so much to uploader!!
To find library go to finder, press cmd shift G and type in~/Library and then copy and paste it!"
,Niall2k11,2011-08-23T13:17Z,sry type:~/Library
,the_srenkzdor,2011-08-23T20:05Z,is it also work on logic 9.1.5 up dater??
,the_srenkzdor,2011-08-23T20:20Z,"is it also work with 9.1.5? answer plzzzz
thx"
,jujico,2011-08-23T20:39Z,"I can find the ""application support"" folder, but I can't find the ""ProApps"" folder...

An idea ?

Help !"
,dmauld,2011-08-25T00:35Z,yes this works with 9.1.5 and with lion.
,northernmonkiz,2011-09-01T12:30Z,has anyone got a working serial pls????
,jujico,2011-09-04T19:35Z,"Where is the ""ProApps"" folder ???

Please !!!"
,satoru44,2011-09-05T01:12Z,"PerfectWork!!

Thanks bAqhi:)"
,Dark_Fragor,2011-09-09T15:54Z,"this works
thanks!
(worked on 9.1.5 for me !)"
,Mcx09,2011-09-22T20:01Z,I did everything correctly but when I try to run logic it still tells me it can't run on my OS (which is lion). It says the version of logic I have installed is 9.0.0 when it should be 9.1.4
,fuglypirahna,2011-09-26T06:44Z,excellent... works with 9.1.5 update. @bAqhi is a hero
,fredgv,2011-09-28T02:34Z,"for people who can't find the folder:

The ProApps folder is found in the Macintosh HD not USER path.

here: Macintosh HD/Library/Application Support/ProApps
not: USER/Library/Application Support/ProApps"
,spacedisc,2011-09-29T15:47Z,"man maybe im dum, but I dont have any idea what do u mean by overwriting. I have Lion, i downloaded your crack, pastetd in ProApps, and what to do after?! I had logic before, but i deleted it becuase it was bad crack.

So how and what I should do ?"
,boxtyman,2011-10-04T16:54Z,"Worked for me on 9,1,5 haven't tried in Lion yet. Thanks a lot man."
,boxtyman,2011-10-05T10:51Z,Works in Lion too. Great stuff!!
,Rolfro,2011-10-13T19:53Z,"Perfect, Mate.....
 TY A lot!!!!!

 Worked like a charm....
 15 sec, Max time to get Logic working again....."
,Sweet_Laddio,2011-10-30T23:49Z,Hey I followed the path of Macintosh HD/Library/Application Support/ProApps to get to the pro apps folder but there's an internal plug ins folder there. I have tried running the updater by deleting and having the contents of this folder? A little help please?
,evilXpixie,2011-11-28T16:11Z,Worked awesome for so lion after 9.1.5 update :) thanks! 
,evilXpixie,2011-11-28T16:13Z,Worked awesome on os lion! Did 9.1.5 update then overwrote files as directed... Works great!! No serial no needed! :)
,rumorco,2012-02-03T04:33Z,"Worked like a charm!

How to crack Logic Pro 9:

1. Open Library/Application Support/ProApps (You can do this by right-clicking on Applications in finder and then start going to your directory by clicking Library)

2. Copy & Replace!

3. Your done!"
,rumorco,2012-02-03T04:36Z,Forgot to post link: https://thepiratebay.se/torrent/6573503/Apple_Logic_9.1.4_crack
,Sdraer,2012-03-05T12:03Z,Awesome! Thanks! Works great with Logic 9.1.6 in OS X Lion 10.7.2
,beedoola,2012-03-14T05:25Z,"works with new update 9.1.6 from apple site!!

running lion 10.7.3.

Brilliant!!!"
,d4funky1,2012-03-29T20:52Z,"I'm gonna try this on 9.1.7 update lion 10.7.3 - worked for 9.1.6

I'll let you know in a couple of mins"
,d4funky1,2012-03-29T21:09Z,successfully updated to 9.1.7 on lion 10.7.3 using this - thanks again
,Knucklez415,2012-05-08T05:56Z,"i downloaded Logic Pro 9 but crack says 9.1.4, any help please"
