User Type,Username,Date,Text
,vilden09,2011-07-19T15:17Z,Jag lägger upp disc 2 inom kort...
,vilden09,2011-07-19T17:09Z,"Har gjort om torrenten,den nya heter ""Inte för vinnings skull"" Med Disc 1. "
,rutan006,2011-10-02T12:10Z,"vilden09:- Ursäkta ordvalen men dom kommer från hjärtat.
Du är en stor djävla skitstövel.
Du skriver att du seedar till 150%, men du har bara seedat 97,6%
Inte enda har fått ner den här filmen på 2 mån.
Och allt har stått still sedan den 30 augusti. 2011
Gå och häng dig."
