User Type,Username,Date,Text
,HideousX,2011-06-30T01:49Z,"http://www.imdb.com/title/tt1846444/

This movie is so bad it pissed me off after only 5 min so i stoped it deleated and empty it from recyclyng bin to make sure

Thanks anyway .BONE."
,Kryptonite888,2011-06-30T02:25Z,Compressed into crap bah i mostly just go to Veetle watch it there or go to this blog called ωωω▪iloveveetle▪blogspot▪c◎m 720p HQ is the best!!!!
,yerisan710,2011-06-30T02:54Z,"that so bad film--------------$2


que pelicula tan mala----------$2"
