User Type,Username,Date,Text
,ramikaz,2011-09-05T23:29Z,Thanks and ignore the LIES from the same handful of jews and queers that flame every upload about Islam.    The fact that others don't do the same to the jew and pedophile PORN they troll on here shows who are the intolerant a-holes.  
,emmemmess,2011-09-06T15:30Z,"Catholic Bishops flouted Irish law and were encouraged by the Vatican not to tell police about suspected paedophile priests
http://www.dailymail.co.uk/news/article-2016947/Irish-PM-Enda-Kenny-attacks-narcissism-Vatican-paedophile-priests-cover-up.html

A diocese run by Bishop John Magee suppressed evidence of child rape and molestation
http://www.dailymail.co.uk/news/article-2016947/Irish-PM-Enda-Kenny-attacks-narcissism-Vatican-paedophile-priests-cover-up.html"
,emmemmess,2011-09-06T15:30Z,"Irish Prime Minister Enda Kenny attacks narcissism Vatican paedophile priests cover-up

Irish Prime Minister Enda Kenny denounced what he called 'the dysfunction, disconnection, elitism - and the narcissism - that dominate the culture of the Vatican to this day'.

The astonishing attack was the first time that Ireland's Parliament has publicly castigated the Vatican instead of local church leaders during the country's 17 years of paedophile-priest scandals.

The controversial revelations have eroded Catholic authority in a nation where the church still owns most schools and several hospitals, and state-run broadcasters still toll a twice-daily call to Catholic prayer.

A confidential 1997 Vatican letter instructed Irish bishops to handle child-abuse cases strictly under terms of canon law.

It warned bishops that their 1996 child-protection policy, particularly its emphasis on the need to start reporting all suspected crimes to police, violated canon law.

Read more: http://www.dailymail.co.uk/news/article-2016947/Irish-PM-Enda-Kenny-attacks-narcissism-Vatican-paedophile-priests-cover-up.html"
,emmemmess,2011-09-06T15:31Z,"Vatican denies sex abuse cover-up 
THE Vatican has acknowledged ""grave failures"" handling a child sex abuse scandal involving Irish priests. Vatican denies sex abuse cover-up 
15 hours ago
http://www.couriermail.com.au/vatican-denies-sex-abuse-cover-up/story-fn6sb9br-1226128939149

Vatican admits 'grave failures' in scandal 
THE Vatican overnight acknowledged ""grave failures"" over the handling of a child sex abuse scandal involving priests in southern Ireland that sparked outrage in the Dublin government. Vatican admits 'grave failures' in abuse scandal 
15 hours ago
http://www.heraldsun.com.au/news/world/vatican-admits-grave-failures-in-ireland-abuse-scandal/story-e6frf7lf-1226128982920"
,captain-under,2011-09-06T18:13Z,"Religion is passed on from parents to children 
Kind of like the aids virus 
Very few people choose their  Religion
Who would choose as a adult to believe  the crazy shit  that all Religions preach as truth
Remember this crap was written in the bronze age"
,qwertzo99,2011-09-07T18:14Z,"^^^
Jews and other zionists are at their work I see. The more hatred and lies you publish the more people tries to find out about islam. So go on ahead!
Numbers can't lie -- religion with biggest number of converts!"
