User Type,Username,Date,Text
[V],NLUPPER002,2011-07-22T17:00Z,Originele vertaler bij deze in ere hersteld
,jafr,2011-07-22T20:38Z,bedankt
[T],ErikB44,2011-07-23T10:39Z,"Respect voor jou NLUPPER!
Jij laat mensen in hun waarde,
die de ondertiteling gemaakt hebben,
en er veel werk aan besteed hebben.
Zo ben ik ook!

Dank je daarvoor!"
,charlotte7,2011-07-23T13:28Z,super dankje wel
[V],NLUPPER002,2011-07-23T14:01Z,"Graag gedaan Erik.
Ja ik weet wat een werk het is en zag na jouw plaatsing anderen met de eer op de NL privĂŠ site's ervandoor gaan.
Vandaar mijn comment direct na plaatsing."
,Ronzelf,2011-07-25T07:18Z,Bedankt Nlupper en Erikb jullie zijn te gek
