User Type,Username,Date,Text
[V],CrilleKex,2011-08-22T13:33Z,"Jag provar att få till beskrivningen bättre här i stället:


År 1984 friges Freddie Jackson från sitt fyra år långa fängelsestraff. Han mål är att ta över som härskare över Londons under värld. I denna explosiva och adrenalinfyllda  actionserie får vi följa honom och hans kumpaner under tio år av kriminalitet, sex och  extravagant våld.


Medverkande: Tom Hardy, Brian Cox, Charlotte Riley m.fl.



Detta är alla 4 avsnitten i miniserien. De är joinade till en enda fil.  Total speltid är  c:a 3 timmar.




http://www.imdb.com/title/tt1366321/"
,brewhead,2011-12-12T08:42Z,goddamn you scene swedes and your goddamn hard coded subs....its nearly 2012...you might try separate sub files by now 
