User Type,Username,Date,Text
,shookz,2011-08-20T13:12Z,WTF DVD RIP?
,dashingguyof2k,2011-08-20T19:57Z,Com'on why there is no upload of Movie 'Not a love story' yet?! please some1 upload it soon and with a good print would be highly appritiated!
,ishadhawanisha,2011-08-23T09:11Z,"yaar koe dvd rip bhi upload kr do plz.jaise hangover 2, kung fu panda2, cars 2, delhi belly, and zindagi na milege dobara"
,jeans5050,2011-08-23T23:49Z,please upload Delhi belly dvd rip pleaseeeeeeeeeeee
,shookz,2011-08-25T10:54Z,Why cant i find this movie with subtitles. NOWEHRE subtitles to be found for Aarakshan.
,renison7,2011-09-13T15:44Z,"real good quality but not a dvd rip, -1 for that. Change the title. And the other thick heads over here do you even know what a dvdrip is? The needs to come out on dvd for a dvd rip, grow up?"
,shookz,2011-09-16T21:49Z,"why the hell isnt ther any subtitles on the whole internet for this movie, WTF!!!!!!!!!!!!!!!!!!!!!!!!!!!!!!!!!!!!!!!!!!!!!!!!!!"
