User Type,Username,Date,Text
,Acid_Crow,2011-07-05T02:35Z,TY
,pemoma,2011-07-05T03:07Z,"Why am I not getting ANY speed on this torrent?
I get 16kb/s then it goes back to something like 5!

I just hope this is better encoded than the IMMERSE releases.

Will seed if I ever get the full ep.
thank you"
,pemoma,2011-07-05T06:41Z,"Ok, don't know what the problem was.
Something with my IP I guess...
Rebooted my pc and I am now downloading at regular speed. "
,zeth006,2011-07-09T21:39Z,Thanks. Show's not too bad at all. :)
