User Type,Username,Date,Text
,sinner77,2011-07-05T23:07Z,"Boss ur choice of movies r gud..........if u can maybe up them in say 400mb u will get many more people coming to d/l.

Jodi paro to size take choto koro.With m y speeds a 10gb file will take me a month to d/l......."
[V],DownTYU,2011-07-05T23:15Z,When YIFY is back from vacation ask him...he'll do it for sure...:)
,sinner77,2011-07-06T09:44Z,"Yes i know YIFY will !!! But there is a lack of qlty u/l who do gud movies like ur list in small size.
It was a sugg ..................so i guess u will continue with this size of u/l"
