Filename,Size,Unit
Acoustique live/05 selfish blues (accoutique).mp3,19.3,M
Acoustique live/04 rude awakening (accoustique).mp3,17.69,M
Acoustique live/01 sunset motel (accoustique).mp3,16.64,M
Acoustique live/06 turned black (accoustique).mp3,16.52,M
Acoustique live/02 epitomize (accoustique).mp3,10.89,M
Acoustique live/03 end's eve (accoustique).mp3,10.62,M
Ecce Lex/01 Rude Awakening.mp3,10.27,M
Ecce Lex/06 Sunset Motel.mp3,9.78,M
Ecce Lex/03 Stillborn Prophet.mp3,9.75,M
Ecce Lex/05 Lab Of Their Will.mp3,9.28,M
Ecce Lex/08 Seeking An Exit.mp3,9.12,M
Ecce Lex/12 Unwillingly And Slow.mp3,7.29,M
Ecce Lex/10 Feed The Living.mp3,6.62,M
Ecce Lex/02 What's Up With Your Cryo Tubes.mp3,4.76,M
Ecce Lex/11 Turned Black.mp3,4.13,M
Ecce Lex/04 End's Eve.mp3,3.74,M
Ecce Lex/07 Pull The Pin.mp3,2.9,M
Ecce Lex/09 Ecce Lex.mp3,674.7,K
