User Type,Username,Date,Text
,bhutan_6,2011-08-31T02:37Z,"Hello, can you please upload these gamecube games: Star wars: Rogue Squadron II (Rogue leader), Prince of Persia: Sands of time, Soul Calibur II, Viewtiful Zoe 1 & 2. Thx again. "
,unfairy,2011-09-06T13:29Z,"If I come across them, I'll keep that in mind."
,bhutan_6,2011-09-06T19:56Z,Thx unfairy.
,unfairy,2011-09-11T20:41Z,"I gotta lay off the Seeding, I've been getting letters for my increased activity. This should be self-sufficient. However, if y'all need more Seeders, request it and I'll just re-upload."
,fairyboi88,2012-05-03T02:55Z,please seed
