User Type,Username,Date,Text
[T],CODYBOSS1969,2011-05-18T16:06Z,"Sorry ! Mislabeled. It should be:

Sneakers [1992] 720p BRRip XviD AC3 - CODY


http://www.imdb.com/title/tt0105435/


Only the year was wrong labeled !!!


Anyway....ENJOY !!"
[T],CODYBOSS1969,2011-05-18T16:14Z,"I can't correct it right now; EDIT FUNCTION TEMPORARILY DISABALED !

You can rename the file after download !!

Thanks for your understanding !!"
[T],CODYBOSS1969,2011-05-18T16:22Z,"I can't correct it right now; EDIT FUNCTION TEMPORARILY DISABLED !

Only the  year was wrongly labeled !!! [1996->->1992]


http://www.imdb.com/title/tt0105435/


You can rename the file after download !!

Thanks for your understanding !!"
,jenchai,2011-08-25T21:16Z,Thanks for the upload !!!
