User Type,Username,Date,Text
[T],thetorrentlord,2011-05-21T01:30Z,I'm going to hire a secretary to type my thanks if this goes on much longer. thanks once again.
,RSObelix,2011-05-23T21:29Z,Pardon me? Complete? I was looking for 7x24 but it's not in here. Lack of completeness...
,RSObelix,2011-05-23T21:32Z,"Sorry, I failed, it's 2x22.

Sorry!"
,sasse72,2011-09-28T12:04Z,swesub? ingen som har swesub till hela S7?
,sasse72,2011-11-02T13:22Z,Ingen som kan lägga upp S7 med swesub? den har ju släpts på dvd nu för en vecka sedan....pliiisssss
