User Type,Username,Date,Text
,sadhevneo,2011-08-10T19:01Z,ready ka bhi bluray nikal doo mere bhaiiii....
,badboy420,2011-08-11T19:18Z,"Plz Sam...Upload Vinnaithandi Varuvaya 720p 4.35 Gb version...


All the releases on the net has watermarks....

Expecting ur HQ release "
,jitesh502,2012-01-20T06:09Z,thanx sam
,Ari2702,2012-06-09T08:04Z,"Sam vai,plssss SEED this torrent,,i'm stucked at 98.4% from last 2 days,,,,,,,plssssssssss help me by seeeeeeeeeeeeeeddddddding it...........plsssssssss......... :("
