User Type,Username,Date,Text
,rakz2cul,2011-03-18T14:20Z,"why are you decreasing the video Bit-rate compare to your previous releases
quality getting compromised a little, hope you get back to your previous settings... those were far better than this"
[V],grey.shadow,2011-03-19T23:27Z,"I actually agree with you, I had a few requests to make them smaller (lower bitrate) but as you say compromised my standards, they gone back up to 3000 Kbps, same as my x264, let others do the small stuff."
,Dragon8000,2011-04-27T01:08Z,"Thanks.. and good video Bit-rate! = good quality
please continue.."
