User Type,Username,Date,Text
[V],malestrom_HH,2011-01-11T13:34Z,"Amateur Photographer – 15 January 2011
PDF | 92 pages | English 

Amateur Photographer is the world's oldest weekly magazine for photography enthusiasts. With its unique weekly format, it is the first for news and digital and film equipment tests. Regular features on reader portfolios, darkroom, digital, black & white and photographer profiles ensure all areas of photography are covered."
,ioannisarc,2011-01-11T17:32Z,Thank you veery much.
,vidiation,2011-01-16T00:38Z,"Many thanks, m_HH!  You rock!"
