Filename,Size,Unit
CSI S01E22 Strip Strangler DVDrip V3nDetta.avi,512.89,M
CSI S01E14 Table Stakes DVDrip V3nDetta.avi,512.68,M
CSI S01E12 Boom DVDrip V3nDetta.avi,512.68,M
CSI S01E18 Gentle Gentile DVDrip V3nDetta.avi,512.54,M
CSI S01E19 Sounds Of Silence DVDrip V3nDetta.avi,512.52,M
CSi S01E16 Face Lift DVDrip V3nDetta.avi,510.55,M
"CSI S01E10 Sex, Lies, and Larvae DVDrip V3nDetta.avi",509.52,M
CSI S01E11 Fahrenheit 932 DVDrip V3nDetta.avi,508.08,M
CSI S01E09 Unfriendly Skies DVDrip V3nDetta.avi,506.56,M
CSI S01E07 Blood Drops DVDrip V3nDetta.avi,505.99,M
CSI S01E08  Anonymous DVDrip V3nDetta.avi,504.18,M
CSI S01E21 Evaluation Day DVDrip V3nDetta.avi,501.63,M
CSI S01E17 $35K OBO DVDrip V3nDetta.avi,497.57,M
CSI S01E13 To Halve And To Hold DVDrip V3nDetta.avi,495.44,M
CSI S01E02 I-15 Murders DVDrip V3nDetta.avi,492.87,M
CSI S01E20 Justice Is Served DVDrip V3nDetta.avi,491.94,M
CSI S01E15 Too Tough To Die DVDrip V3nDetta.avi,489.91,M
CSI S01E00 PILOT DVDrip V3nDetta.avi,463.95,M
CSI S01E05 Friends And Lovers DVDrip V3nDetta.avi,462.33,M
CSI S01E06 Who Are You DVDrip V3nDetta.avi,461.39,M
CSI S01E04 Pledging Mr. Johnson DVDrip V3nDetta.avi,456.63,M
CSI S01E03 Crate and Burial DVDrip V3nDetta.avi,456.09,M
CSI S01E01 Cool Change DVDrip V3nDetta.avi,455.99,M
CSI Season 1 Character Profiles.avi,197.07,M
CSI Theme Song Music Video.avi,29.7,M
CSI Season 1 Featurette People LIe...But the Evidence Never Does.avi,4.29,M
readme.txt,402,B
