Filename,Size,Unit
Gullivers Travels[2010]-R5-x264-StyLishSaLH.mp4,216.61,M
Gullivers Travels[2010]-R5-x264-StyLishSaLH.jpg,68.42,K
Thanks.txt,552,B
Torrent downloaded from Ahashare.com.txt,66,B
Torrent downloaded from ExtraTorrent.com.txt,51,B
Torrent downloaded from thepiratebay.org.txt,51,B
Torrent downloaded from Demonoid.com.txt,47,B
Torrent downloaded from Darkbay.com.txt,46,B
Torrent downloaded from Sceneunderground.org.txt,44,B
Torrent downloaded from h33t.com.txt,43,B
Torrent downloaded from 1337x.org.txt,24,B
