User Type,Username,Date,Text
,krikrik,2011-08-02T13:24Z,"Seed, seed, seed please! Almoust 1 hour, and I have 0,00% downloaded..."
,Nobody86,2011-08-02T14:01Z,"same here. After Rose downloaded without problems, this... zeros"
,gabrielmaja,2011-08-02T14:13Z,"please uploade again,something wrong with this one, not possible to download"
,Ingo08,2011-08-02T16:31Z,"This one doesn't work for sure.Can't be downloaded,can you please try again:) !?"
,kidkodak10,2011-08-02T16:55Z,Can you please try to upload this one again? I'm unable to download at all:(
,janneiso,2011-08-02T18:22Z,"i have uploaded 14,4 %. very slow but its working. can somebody help me to play this files, i have not the program for that. i have W7, thanks"
,janneiso,2011-08-02T18:24Z,"i have uploaded 14,4 %. very slow but its working. can somebody help me to play this files, i have not the program for that. i think the file name is R00. i have W7, thanks"
,paramount71,2011-08-02T19:58Z,What the hell is going on???!!!!!! SEED!!!!!!!!!
,Nobody86,2011-08-02T20:51Z,"50 Kb/s download, at 28.7%

And I don't even f... like this season, why do I try to donwload it? :)"
,krilsig,2011-08-02T21:27Z,"http://www.vidxden.com/iulkpji2avy6/the.bachelorette.s07e11.hdtv.xvid-2hd.r.flv.html

you can watch it here bosos"
