User Type,Username,Date,Text
,jorge56,2011-02-14T05:33Z,Thank you omao. Great upload again
,shingabo,2011-02-24T07:04Z,"SEED
SEEEED! 

Dejen que otras personas puedan bajar esta pelicula completa y no quedarse en 90%"
,choconet01,2011-03-31T15:40Z,"No sean chivas. las 3 películas quedan en 99.8 o algo así, no sean gachos"
,choconet01,2011-03-31T15:41Z,Dejen de fregar y no dejen las descargas a 99.8
,suplicio,2012-02-11T03:25Z,"Please SEED - it's just 99.41% since days ago!!!
Just 40MB left

Por favor, compartan. La descarga está en 99.41% hace muchos dias, solo faltan 40Mb"
,alter.mann,2012-03-02T05:43Z,"Can someone seed this and the other 2 movies at least for a couple of days, please?"
