Filename,Size,Unit
CD.01/Aayega Aanewala @ SongsDL.com.mp3,10.7,M
CD.01/O Varsha Ke Pehle Badal @ SongsDL.com.mp3,8.53,M
CD.01/Mere Piya Gaye Rangoon @ SongsDL.com.mp3,8.01,M
CD.01/Haath Seene Pe Jo Rakh Do @ SongsDL.com.mp3,7.41,M
CD.01/Dheere Dheere Aa Re Badal @ SongsDL.com.mp3,5.94,M
CD.01/Jiya Beqarar Hai @ SongsDL.com.mp3,5.91,M
CD.01/Dil Ki Lagi Ne Humko @ SongsDL.com.mp3,5.62,M
CD.01/Ek Bangla Bane Nyara @ SongsDL.com.mp3,5.4,M
CD.01/Piya Milan Ko Jana @ SongsDL.com.mp3,5.28,M
CD.01/Dil Jalta Hai To Jalne De @ SongsDL.com.mp3,5.01,M
CD.01/Mera Sundar Sapna Beet Gaya @ SongsDL.com.mp3,4.96,M
CD.01/Balam Aaye Baso @ SongsDL.com.mp3,4.92,M
CD.01/Main Kya Janu Kya Jaadoo Hai @ SongsDL.com.mp3,4.79,M
CD.01/Panchhi  Bawra Chand Se Preet Lagaye @ SongsDL.com.mp3,4.75,M
CD.01/Chanda Des Piya Ke Jaa @ SongsDL.com.mp3,4.59,M
CD.01/Main Ban Ki Chidiya Banke @ SongsDL.com.mp3,4.56,M
CD.01/Ummeed Bhara Panchhi @ SongsDL.com.mp3,4.55,M
CD.01/Afsana Likh Rahi Hoon @ SongsDL.com.mp3,4.49,M
CD.01/Ankhiyan Milake @ SongsDL.com.mp3,4.43,M
CD.01/Teri Gathri Mein Laga Chor @ SongsDL.com.mp3,4.4,M
CD.01/Na Jane Kidhar Aaj Meri Nao @ SongsDL.com.mp3,4.39,M
CD.01/Tere Nainon Ne Chori Kiya @ SongsDL.com.mp3,4.03,M
CD.02/Aankhon Mein Kya Ji @ SongsDL.com.mp3,9,M
CD.02/Aaja Re Pardesi @ SongsDL.com.mp3,8.43,M
CD.02/Haal Kaisa Hai Janab Ka @ SongsDL.com.mp3,6.75,M
CD.02/Jalte Hain Jiske Liye @ SongsDL.com.mp3,6.39,M
CD.02/Tu Pyar Ka Sagar Hai @ SongsDL.com.mp3,6.2,M
CD.02/Dil Deke Dekho Dil Deke Dekho @ SongsDL.com.mp3,6.08,M
CD.02/Do Ghadi Woh Paas Jo Baithe @ SongsDL.com.mp3,6.05,M
CD.02/Pyar Par Bas To Nahi Hai @ SongsDL.com.mp3,5.95,M
CD.02/Sur Na Saje @ SongsDL.com.mp3,5.72,M
CD.02/Bholi Surat Dil Ke Khote @ SongsDL.com.mp3,5.44,M
CD.02/Jayen To Jayen Kahan @ SongsDL.com.mp3,5.25,M
CD.02/Jeevan Ke Safar Mein Rahi @ SongsDL.com.mp3,5.25,M
CD.02/Jaane Kya Tune Kahi @ SongsDL.com.mp3,4.91,M
CD.02/Mera Qarar Leja @ SongsDL.com.mp3,4.89,M
CD.02/Jhoole Mein Pawan Ki Aai Bahar @ SongsDL.com.mp3,4.87,M
CD.02/Eena Meena Deeka @ SongsDL.com.mp3,4.84,M
CD.02/Maan Mera Ehsan Are Nadaan @ SongsDL.com.mp3,4.82,M
CD.02/Piya Piya Piya Mora Jiya Pukare @ SongsDL.com.mp3,4.65,M
CD.02/Babuji Dheere Chalna @ SongsDL.com.mp3,4.64,M
CD.02/Gore Gore O Banke Chhore @ SongsDL.com.mp3,4.4,M
CD.03/Leke Pahla Pahla Pyar @ SongsDL.com.mp3,9.89,M
CD.03/Adha Hai Chandrama @ SongsDL.com.mp3,9.66,M
CD.03/Nain Se Nain @ SongsDL.com.mp3,9.59,M
CD.03/Sab Kuchh Seekha Hum Ne @ SongsDL.com.mp3,6.95,M
CD.03/Awara Hoon @ SongsDL.com.mp3,6.78,M
CD.03/Sari Sari Raat Teri Yaad Sataye @ SongsDL.com.mp3,6.73,M
CD.03/Yeh Raat Yeh Chand @ SongsDL.com.mp3,6.49,M
CD.03/Pyar Hua Iqrar Hua @ SongsDL.com.mp3,6.48,M
CD.03/Waqt Ne Kiya Kya Haseen Sitam @ SongsDL.com.mp3,6.45,M
CD.03/Mana Janab Ne Pukara Nahin @ SongsDL.com.mp3,6.37,M
CD.03/Mera Naam Chin Chin Chu @ SongsDL.com.mp3,6.36,M
CD.03/Mang Ke Saath Tumhara @ SongsDL.com.mp3,6.06,M
CD.03/Kitna Haseen Hai Mausam @ SongsDL.com.mp3,5.87,M
CD.03/Nagari Nagari Dware Dware @ SongsDL.com.mp3,5.65,M
CD.03/Man Dole Mera Tan Dole @ SongsDL.com.mp3,5.62,M
CD.03/Tumhen Yaad Hoga Kabhi Hum Mile The @ SongsDL.com.mp3,5.44,M
CD.03/Piya Piya Na Lage Mora Jiya @ SongsDL.com.mp3,4.89,M
CD.03/Jaag Dard-E-Ishq Jaag @ SongsDL.com.mp3,4.88,M
CD.03/Is Bewafa Jahan Mein @ SongsDL.com.mp3,4.53,M
CD.03/Aye Malik Tere Bande Hum @ SongsDL.com.mp3,4.31,M
CD.04/Dil Ke Jharokhe Mein @ SongsDL.com.mp3,10.6,M
CD.04/Bahut Shukriya Badi Meherbani @ SongsDL.com.mp3,10.01,M
CD.04/Ni Sultana Re @ SongsDL.com.mp3,8.96,M
CD.04/Dil Pukare Aare Aare @ SongsDL.com.mp3,8.95,M
CD.04/Gaata Rahe Mera Dil @ SongsDL.com.mp3,7.79,M
CD.04/Ohre Taal Mile Nadi Ke Jal Mein @ SongsDL.com.mp3,6.66,M
CD.04/Na Tum Humein Jano @ SongsDL.com.mp3,6.45,M
CD.04/Pyar Kiya To Darna Kya @ SongsDL.com.mp3,6.37,M
CD.04/Bhanwara Bada Nadan Re @ SongsDL.com.mp3,6.22,M
CD.04/Yeh Mera Prem Patra @ SongsDL.com.mp3,6.17,M
CD.04/Zindagi Bhar Nahi Bhoolegi @ SongsDL.com.mp3,5.87,M
CD.04/Jo Wada Kiya Woh Nibhana Padega @ SongsDL.com.mp3,5.31,M
CD.04/Jhoomka Gira Re @ SongsDL.com.mp3,5.22,M
CD.04/Ghar Aaj Ghir Aaye Badra @ SongsDL.com.mp3,5.03,M
CD.04/Husnwale Tera Jawab Nahin @ SongsDL.com.mp3,4.95,M
CD.04/Tujhko Mera Pyar Pukare @ SongsDL.com.mp3,4.88,M
CD.04/Pardesiyon Se Na Akhiyan Milana @ SongsDL.com.mp3,4.63,M
CD.04/Mere Samnewali Khidki Mein @ SongsDL.com.mp3,4.56,M
CD.05/Diwana Hua Badal @ SongsDL.com.mp3,11.97,M
CD.05/Bindiya Chamkegi @ SongsDL.com.mp3,11.1,M
CD.05/Naina Lad Jaihen @ SongsDL.com.mp3,10.18,M
CD.05/Sawan Ka Mahina @ SongsDL.com.mp3,9.81,M
CD.05/Kahin Deep Jale Kahin Dil @ SongsDL.com.mp3,9.62,M
CD.05/O Mere Sona Re @ SongsDL.com.mp3,9.56,M
CD.05/Likha Hai Teri Aankhon Mein @ SongsDL.com.mp3,7.92,M
CD.05/Chand Si Mehbooba Ho Meri @ SongsDL.com.mp3,7.87,M
CD.05/Abhi Na Jao Chhod Kar @ SongsDL.com.mp3,7.43,M
CD.05/Roop Tera Mastana @ SongsDL.com.mp3,7.23,M
CD.05/Aap Ki Nazron Ne Samjha @ SongsDL.com.mp3,6.96,M
CD.05/Aye Gulbadan @ SongsDL.com.mp3,6.68,M
CD.05/Main Hoon Jhoom Jhoom Jhumroo @ SongsDL.com.mp3,6.57,M
CD.05/Mera Naam Raju @ SongsDL.com.mp3,6.46,M
CD.05/Chaudhvin Ka Chand Ho @ SongsDL.com.mp3,6.33,M
CD.05/Teri Pyari Pyari Soorat Ko @ SongsDL.com.mp3,6.29,M
CD.05/O Jogi Jab Se Tu Aaya Mere Dwar @ SongsDL.com.mp3,5.39,M
CD.05/Kasme Wade Pyar Wafa @ SongsDL.com.mp3,5.18,M
CD.06/Dil Dhundta Hai @ SongsDL.com.mp3,14.15,M
CD.06/Ho Pardesia @ SongsDL.com.mp3,10.35,M
CD.06/Parbat Ke Is Paar @ SongsDL.com.mp3,10.21,M
CD.06/Chura Liya Hai Tumne Jo Dil Ko @ SongsDL.com.mp3,9.98,M
CD.06/Chabi Kho Jaye @ SongsDL.com.mp3,9.83,M
CD.06/Chingari Koi Bhadke @ SongsDL.com.mp3,9.11,M
CD.06/Achha To Hum Chalte Hain @ SongsDL.com.mp3,8.33,M
CD.06/Kabhi Kabhi Mere Dil Mein @ SongsDL.com.mp3,8.19,M
CD.06/Haye Haye Yeh Majboori @ SongsDL.com.mp3,7.68,M
CD.06/Jeena Yahan Marna Yahan @ SongsDL.com.mp3,7.11,M
CD.06/Inhi Logon Ne @ SongsDL.com.mp3,6.33,M
CD.06/Do Deewane Shaher Mein @ SongsDL.com.mp3,6.18,M
CD.06/Khaike Pan Banaras Wala @ SongsDL.com.mp3,5.65,M
CD.06/Bahon Mein Chale Aao @ SongsDL.com.mp3,5.6,M
CD.06/Kya Khoob Lagti Ho @ SongsDL.com.mp3,5.55,M
CD.06/Maine Tere Liye @ SongsDL.com.mp3,4.43,M
CD.07/Teri Rab Ne Bana Di Jodi @ SongsDL.com.mp3,11.81,M
CD.07/Piya Tu Ab To Aaja @ SongsDL.com.mp3,11.38,M
CD.07/Bachna Ae Haseeno Lo Mein Aa Gaya @ SongsDL.com.mp3,9.88,M
CD.07/Mohabbat Badi Kaam Ki Cheez Hai @ SongsDL.com.mp3,9.77,M
CD.07/Ni Main Yaar Manana Ni @ SongsDL.com.mp3,8.81,M
CD.07/Yari Hai Imaan Mera @ SongsDL.com.mp3,8.69,M
CD.07/Mere Naina Sawan Bhadon @ SongsDL.com.mp3,8.52,M
CD.07/Satyam Shivam Sundaram @ SongsDL.com.mp3,8.01,M
CD.07/Meet Na Mila Re Mann Ka @ SongsDL.com.mp3,7.97,M
CD.07/Jab Deep Jale Aana @ SongsDL.com.mp3,7.35,M
CD.07/O Saathi Re @ SongsDL.com.mp3,6.88,M
CD.07/Pyar Diwana Hota Hai @ SongsDL.com.mp3,6.75,M
CD.07/Tum Aa Gaye Ho Noor Aa Gaya @ SongsDL.com.mp3,6.31,M
CD.07/Ek Pyar Ka Nagma Hai @ SongsDL.com.mp3,6.03,M
CD.07/Koi Jab Tumhara Hriday Tod De @ SongsDL.com.mp3,5.05,M
CD.07/Musafir Hoon Yaro @ SongsDL.com.mp3,4.45,M
CD.08/Om Shanti Om @ SongsDL.com.mp3,17.78,M
CD.08/Jab Hum Jawan Honge @ SongsDL.com.mp3,13.51,M
CD.08/Dil Deewana @ SongsDL.com.mp3,11.71,M
CD.08/Pag Ghunghroo Bandh @ SongsDL.com.mp3,11.66,M
CD.08/De De Pyar De @ SongsDL.com.mp3,11.06,M
CD.08/Mera Kuchh Samaan @ SongsDL.com.mp3,10.92,M
CD.08/Dekha Ek Khwab @ SongsDL.com.mp3,10.19,M
CD.08/Mere Hathon Mein Nau Nau Churiyan @ SongsDL.com.mp3,9.51,M
CD.08/Hum Bane Tum Bane @ SongsDL.com.mp3,8.76,M
CD.08/Dil Cheez Kya Hai @ SongsDL.com.mp3,8.47,M
CD.08/Hamein Tumse Pyar Kitna @ SongsDL.com.mp3,8.16,M
CD.08/Dekho Maine Dekha Hai Ek Sapna @ SongsDL.com.mp3,7.81,M
CD.08/Sun Sahiba Sun @ SongsDL.com.mp3,7.31,M
CD.09/Saudagar Sauda Kar @ SongsDL.com.mp3,15.18,M
CD.09/Awaara Bhanware @ SongsDL.com.mp3,13.5,M
CD.09/Didi Tera Devar Deewana @ SongsDL.com.mp3,12.92,M
CD.09/Kabhi Main Kahoon @ SongsDL.com.mp3,12.78,M
CD.09/Jooma Chumma De De @ SongsDL.com.mp3,12.75,M
CD.09/Tu Mere Samne @ SongsDL.com.mp3,11.97,M
CD.09/Yaara Seeli Seeli @ SongsDL.com.mp3,10.03,M
CD.09/Pyar Ko Ho Jane Do @ SongsDL.com.mp3,9.87,M
CD.09/Dil To Pagal Hai @ SongsDL.com.mp3,9.8,M
CD.09/Tujhe Dekha To @ SongsDL.com.mp3,9.47,M
CD.09/Ek Ladki Ko Dekha @ SongsDL.com.mp3,9.18,M
CD.09/Hum Yahan @ SongsDL.com.mp3,8.63,M
CD.09/Pehla Nasha @ SongsDL.com.mp3,8.46,M
CD.09/Payalay Chumun Chunmun @ SongsDL.com.mp3,7.61,M
CD.10/Panchhi Nadiyan Pawan Ke Jhonke @ SongsDL.com.mp3,18.6,M
CD.10/Humko Humise Chura Lo @ SongsDL.com.mp3,15.51,M
CD.10/Kaho Naa Pyar Hai @ SongsDL.com.mp3,13.39,M
CD.10/Tu Hi Meri Shab Hai @ SongsDL.com.mp3,12.74,M
CD.10/Maula Mere Maula @ SongsDL.com.mp3,10.84,M
CD.10/Teri Ore @ SongsDL.com.mp3,10.81,M
CD.10/Saathiya @ SongsDL.com.mp3,10.8,M
CD.10/Jaadu Hai Nasha Hai @ SongsDL.com.mp3,10.23,M
CD.10/Jiya Dhadak Dhadak Jaye @ SongsDL.com.mp3,9.93,M
CD.10/Sharara Sharara @ SongsDL.com.mp3,9.26,M
CD.10/Bheege Honth @ SongsDL.com.mp3,8.06,M
CD.10/Say Na Say Na @ SongsDL.com.mp3,6.44,M
