User Type,Username,Date,Text
,mentallyours,2011-11-06T13:39Z,fastest download thanx!
,zeggy557,2011-11-08T02:39Z,i wonder whose f'n idea was to cut the walk-ins...
,Bytemania,2011-11-11T12:54Z,Leben wins
,Dangler84,2011-11-11T21:28Z,y thanks for the spoiler
,AdlerSKS,2011-11-16T15:33Z,"great f´n idea to cut almost everything, congrats for it. Next time you should try to cut everything, so there will be just the beginning theme and the end credits. This would be just perfect!"
,onesickfreak,2011-11-20T18:10Z,spoiler alert....  thanks bytemania....  hope you choke on a dick
