User Type,Username,Date,Text
,bbrerry,2011-04-08T23:10Z,Can anyone upload the audiobook for this? Would be much appreciated.
,phoenix689,2011-04-17T04:23Z,hi thanks nice epub fully compatable wid ibooks
,phoenix689,2011-04-17T04:28Z,can u also upload epubs for for other three books hyperspace parallel worlds physics of impossible
,Eddiehjjjfcfjfc,2011-04-18T18:34Z,"@phoenix689:

Just download and install Calibre and you can convert them to anything you want.  It's quick, easy, and free."
,phoenix689,2011-04-19T11:56Z,@Eddiehjjjfcfjfc thank u
,Nergalsyn,2011-04-19T23:18Z,thanks for uploading and sharing this torrent
,ODBC,2011-04-23T11:42Z,Thank you for sharing.
,drtime91,2011-06-07T02:51Z,GReAT job THANKS!
,rakeshjain2000,2011-09-04T20:39Z,thanks
