User Type,Username,Date,Text
,cowidster,2011-07-27T04:22Z,"No seeder, no commente, OMG!!!"
,gauravkaushik,2011-07-27T05:32Z,and also now working on 6.07 build 5
,mrbadness,2011-07-27T06:09Z,don't you think we  have enough of these fucking download managers on here. there are a million of um
,prakharya,2011-07-27T06:20Z,"cowdister.......dude i was out of town.....nwi willl seed.....
@gaurav yes it is :O"
,prakharya,2011-07-27T06:42Z,mrbadness....arse it is a crack///
,cowidster,2011-07-28T14:59Z,"It is good I assure. I've downloade it yesterday from other trackers from other torrent site, just the same crack as it is. (Yesterday there was no seeder here in TPB). The advantage of this kind of crack is that you can update your IDM to the latest version every time, and then run the crack again. This will save your time to download the new master and crack repeatedly every 2-3 weeks."
