User Type,Username,Date,Text
,HWifey,2011-06-13T11:42Z,"I've been looking for this for a while, there aren't any good Lo-Pro torrents out there, they are almost all dead, I will help you keep this 1 alive, its awesome, and has that track from the EP not on their last album, can't wait for their fabled acoustic release, hope you get that 1 up."
,mjabba,2011-06-18T16:06Z,"I downloaded this on a whim and very pleased I did... listening to the latest album and it's great stuff.

Cheers"
,abbysecured,2011-07-05T20:26Z,Please somebody seed this torrent heavily.
,HMD3,2011-08-30T01:56Z,"I have now uploaded the acoustic torrent of these guys, they released it under another name.

http://thepiratebay.org/torrent/6635326"
