User Type,Username,Date,Text
,ekarth22,2011-03-19T21:51Z,"i can never resist model with thick waists wearing pearls!

thanks a ton for this upload."
,ekarth22,2011-03-21T03:19Z,"@zakimar1
For the record, I don't mind fucking femine shemales such a Vaniity. At the same time I also love normal girl with normal (thick) waist, milfs, grannies, latinas, asians etc. as long as they've big booty.

Since you've a history of disrespecting other people's sexual preferences, So I don't care what u think about it. just STFU."
