Filename,Size,Unit
1.2.3.4. (Plain White Ts).mp3,7.58,M
10 Minutes UK Radio (Inna).mp3,5.77,M
145.jpeg,30.96,K
6 Foot 7 Foot Clean Mix (Lil Wayne Fe. Corey Gunz).mp3,9.45,M
Amnesia Radio (Skepta).mp3,6.93,M
Beautiful Dangerous (Slash Fe. Fergie).mp3,10.63,M
Born This Way (Lady Gaga).mp3,9.95,M
Bright Lights Bigger City (Cee-Lo Green).mp3,8.33,M
Cmon Catch Em By Surprise (Tiesto Vs Diplo Fe. Busta Rhymes).mp3,8.03,M
E.T. MHC Radio (Katy Perry).mp3,7.99,M
Everyone (Cheryl Cole Fe. Dizzee Rascal).mp3,9.16,M
Go Hard No Boobies (Fugative Fe. Wiley & Mz Bratt).mp3,7.8,M
Heart On My Sleeve Stonebridge Radio (Olly Murs).mp3,6.54,M
Hello UK Radio (Martin Solveig Fe. Dragonette).mp3,6.27,M
Hey Nah Neh Nah Radio (Milk & Sugar Vs Vaya Con Dios).mp3,5.47,M
Hold It Against Me Alias Radio (Britney Spears).mp3,9.19,M
Hold On To Your Misery Bellatrax Radio (Cocknbullkid).mp3,8.34,M
Hollywood Tonight (Michael Jackson).mp3,8.63,M
Inside Of You (The Maine).mp3,8.74,M
Just Cant Get Enough (Black Eyed Peas).mp3,8.38,M
Let It Go Joker Remix (Devlin Fe. Labrinth).mp3,8.96,M
Life Goes On (Noah And The Whale).mp3,8.56,M
Live Your Life Bill Hurr Radio (Erick Morillo & Eddie Thornieck).mp3,9.36,M
Morning Star (N-Dubz).mp3,7.18,M
Mr. Medicine (Eliza Doolittle).mp3,7.91,M
My Boy (Duffy).mp3,7.92,M
On My Own Steve Smart & Westfunk Extd Radio (Yasmin).mp3,8.73,M
Only A Mother Could (Cherry Ghost).mp3,7.88,M
Rocketeer Purple Crush Mix (Far East Movement Fe. Ryan Tedder).mp3,8.23,M
S & M Dave Aude Radio (Rihanna).mp3,8.79,M
Set Me Free Radio Edit (Blame Fe. Jocelyn Brown).mp3,7.23,M
Shake Me Down (Cage The Elephant).mp3,7.92,M
Shes Got Nothing On But The Radio (Roxette).mp3,8.11,M
Sunday Seamus Haji Radio (Hurts).mp3,9.31,M
Thats The Truth 7th Heaven Radio (McFly).mp3,8.66,M
Tik Tok Original (Bob Sinclar Fe. Sean Paul).mp3,9.55,M
Uberlin (R.E.M.).mp3,9.59,M
Whip My Hair DC Remix (Willow Smith Fe. Tinie Tempah).mp3,9.23,M
Who Dat Girl Original (Flo-Rida Fe. Akon).mp3,7.64,M
Wonderman Dirty Duvall Radio (Tinie Tempah Fe. Ellie Goulding).mp3,8.01,M
Writings On The Wall (Plan B).mp3,8.39,M
Yeah Yeah (Cheryl Cole Fe. Travie McCoy).mp3,7.36,M
