Filename,Size,Unit
Big.Momma.s.House.3.2011.PAL.Retail.DVD9.Multi.DMT/Big.Momma.s.House.3.2011.PAL.Retail.DVD9.Multi.DMT.ISO,7.41,G
"DMT NFO, Read before Playing.txt",1.38,K
Big.Momma.s.House.3.2011.PAL.Retail.DVD9.Multi.DMT.nfo,1.01,K
Torrent downloaded from AhaShare.com.txt,58,B
Torrent downloaded from Demonoid.me.txt,46,B
Torrent Downloaded from TorrentState.com.txt,46,B
Torrent_downloaded_from_www.puretorrents.cc.txt,36,B
Torrent downloaded from Rarbg.com.txt,33,B
Torrent downloaded from silvertorrents.me.txt,29,B
