User Type,Username,Date,Text
,thegr8luiz,2011-08-08T00:11Z,Thank you very much for your time and effort to share this with us.
,BasilBrush,2011-08-08T02:07Z,The torrents are available at MVGroup but they will only be released one per day to help the people with slow connections. Once an episode is started I'll cross post it here. In other words if you want the torrent quicker then get them from MVGroup.
,BasilBrush,2011-08-08T13:46Z,"Here's part 2
http://thepiratebay.org/torrent/6590678"
,volver04,2011-10-20T16:45Z,What you're doing here is nothing short of magnificent. 
