User Type,Username,Date,Text
[T],KickAssTorrents,2011-03-15T21:25Z,"Next: Narnia: The Voyage of the Dawn Treader {2010} 720p BRRip x264 - 800Mb

IMDB   http://www.imdb.com/title/tt0980970/"
,rakiem,2011-03-16T03:07Z,"+1

awesome :)

thanks :)"
,torz02,2011-03-16T13:19Z,ur the best uploader..
,billylopez,2011-03-16T14:59Z,"thank you so much!!!
when will you be doing *season of the witch*??????"
,loutenant,2011-03-16T20:43Z,"Thanx KickAss, so perfect on my HTC-EVO...."
,r.a.7182,2011-03-17T09:28Z,"please upload the lord of the rings trilogy...........
thanks for this............:P"
,athiest09,2011-03-21T01:04Z,please upload the lord of the rings trilogy...........
,Muzikants,2011-03-25T04:12Z,please upload the lord of the rings trilogy...........
,MaximilianKohler,2011-03-31T08:53Z,a/v:9/8.5
,gesswot,2011-06-28T16:59Z,"dude your rip is mind blowing. thanks so much, u are my best uploader."
,searcherno,2012-02-22T17:48Z,"Thanks, your effort is appreciated."
