User Type,Username,Date,Text
[T],Arrrrrrrrrr,2011-01-24T03:06Z,"@zakimar: Yeah it's not the name I would have chosen either. :^p
I think it's supposed to mean that it's closer to Mary Shelley's original work than other Frankensteins; the 1992 one with Robert de Niro also tried to do this (and didn't seem to succeed going by the ratings.)"
[T],Arrrrrrrrrr,2011-01-24T12:49Z,"TPB shows zero seeders, probably as I have the ""Initial Seed"" flag set, but I'll be seeding this for several days so disregard the zero."
,simmering,2011-09-16T18:36Z,"TY for the movie! I have been looking for this for YEARS! I think if Frankenstein was for real, this would be him!"
,kidrockbc,2011-12-03T18:19Z,thanks very much been looking for this one for ages
,toronjadeoro,2012-03-16T23:18Z,"I loved this version as a kid!  And it's still great witha star-studded cast.  Thank you so much.  Hope it's still seeding, because I'm about to leech."
