User Type,Username,Date,Text
,OnkelDolf,2011-07-13T16:10Z,"I seriously recommend these series, loved it since I was a kid. I will try to seed it as long as I can.

In The Netherlands, these series were broadcast on the public television channel TROS with the title ""Het Luchtruim Overwonnen""."
,petestorey,2011-11-02T15:20Z,"Thanks, been trying to find this for years and you just can't get copies any more!"
,Vicious_Pork,2011-12-20T17:18Z,"Just made an account on TPB to thank you.
Was looking for almost a quarter of century for this.
Gr8"
,trollsmeh,2012-06-10T12:38Z,"I watched my dad's copies of this over and over as a kid and am so looking forward to seeing them again.

Thanks so much."
