User Type,Username,Date,Text
,MrFurious,2011-07-13T17:55Z,"Pirate bay won't let me put links :( but if you want to download it directly, find a Binary translator and here's the link!

01101000 01110100 01110100 01110000 00111010 00101111 00101111 01110111 01110111 01110111 00101110 01101101 01100101 01100100 01101001 01100001 01100110 01101001 01110010 01100101 00101110 01100011 01101111 01101101 00101111 00111111 01110010 00110110 01100110 01100101 01100100 01110000 01100010 01101000 01110000 01110111 00110010 01100010 00110010 01100110 01110100"
,Seaphire,2011-07-13T19:37Z,Thanks so much! Clever putting the link in binary lol
,MrFurious,2011-07-13T21:39Z,"Haha. Man for some reason it won't let me seed my own torrent WHY!!!!!!?!?!?!?!

Just use the download link in the binary ;)"
,Dvdr_,2011-07-22T01:08Z,Do you have the first cd from this band?
,sixteenmistakes,2012-02-12T18:43Z,Thanks for uploading! Will seed.
