Filename,Size,Unit
Arts/Back.jpg,4,M
Arts/Front.jpg,3.52,M
Disc One/01 We Shall Dance.mp3,9.33,M
Disc One/02 My Reason.mp3,10.22,M
Disc One/03 Forever And Ever.mp3,9.5,M
Disc One/04 Goodbye My Love Goodbye.mp3,10.11,M
Disc One/05 Rain And Tears.mp3,8.56,M
Disc One/06 Someday Somewhere.mp3,8.17,M
Disc One/07 My Only Fascination.mp3,9.65,M
Disc One/08 From Souvenirs To Souvenirs.mp3,7.08,M
Disc One/09 When Forever Has Gone.mp3,8.08,M
Disc One/10 Happy To Be On An Island In The Sun.mp3,8.43,M
Disc One/11 My Friend The Wind.mp3,10.02,M
Disc One/12 Lovely Lady Of Arcadia.mp3,8.95,M
Disc One/13 Velvet Mornings.mp3,9.48,M
Disc One/14 Perdoname.mp3,7.89,M
Disc One/15 Such A Funny Nigh.mp3,11.52,M
Disc One/16 It's Five O'Clock.mp3,9.11,M
Disc One/17 I Want To Live.mp3,9.98,M
Disc One/18 Marie Jolie.mp3,11.73,M
Disc One/19 Spring Summer Winter And Fall.mp3,12.38,M
Disc One/20 No Way Out.mp3,8.83,M
Disc One/21 With You.mp3,8.7,M
Disc One/22 Auf Wiederseh'n.mp3,9.2,M
Disc One/folder.jpg,1.08,M
Disc Two/01 Kyrila.mp3,9.65,M
Disc Two/02 Mourir Aupres De Mon Amour.mp3,11.05,M
Disc Two/03 Life In The City.mp3,9.38,M
"Disc Two/04 Loin Des Yeux, Loin Du Coeur.mp3",8.38,M
Disc Two/05 Lost In Love.mp3,8.92,M
Disc Two/06 Race To The End.mp3,9.69,M
Disc Two/07 Lament.mp3,8.45,M
Disc Two/08 Follow Me.mp3,18.17,M
Disc Two/09 Island Of Love.mp3,9.74,M
Disc Two/10 Summer In Her Eyes.mp3,10.96,M
Disc Two/11 Ave Maria.mp3,13.61,M
Disc Two/12 Quand Je T'aime.mp3,9.87,M
Disc Two/13 Time.mp3,11.01,M
Disc Two/14 On Ecrit Sur Les Murs.mp3,9.43,M
Disc Two/15 Eleni.mp3,9.92,M
Disc Two/16 La Mer.mp3,17.53,M
Disc Two/17 Santa Lucia.mp3,9.08,M
Disc Two/18 Bella Notte.mp3,8.55,M
Disc Two/19 Love Is.mp3,8.95,M
Disc Two/folder.jpg,1.08,M
