User Type,Username,Date,Text
,ali-2010,2010-12-01T04:41Z,"Thank you from all my heart
You are the best
We want more
We can not live without you
Because your Work is fun and entertaining
No one like you
I wish to you the highest levels
Deserve more than that
keep With - HDTV 720p
Is there a better from : D"
,DAUNTLESS10000,2010-12-10T23:27Z,I agree with ali-2010 ... Awesome torrents dude!! Keep up the good work
,ali-2010,2010-12-11T13:40Z,"Thank you DAUNTLESS10000
and i wait for New Episode
And name
A London Carol 
I think it's excellent
Please     Please      Please
I wait impatiently"
