User Type,Username,Date,Text
,gyaaaaah,2010-12-02T07:33Z,Need some seeders please... stuck at 62%
,Espeo7002,2011-01-29T20:55Z,"""Fixed from VOCALOID - System
* Some ReWire bugs (Fixed in POCALOID)""
Sorry to break it to you but there are still ReWire bugs in the system. So close...

Anyway when the hell is the LenRin Append going to become a torrent on here? I had to go searching for hours to find Gachapin (who also I can't find on this site) but no matter where I search for LenRin append (legal or Pocaloid) I only find the original program's torrent."
