User Type,Username,Date,Text
,starshine99,2011-05-20T11:36Z,"Wow!!!  Fantastic, thank you so very much."
,rstrelov,2011-06-25T19:05Z,thx man!
,wetal1961,2012-01-12T14:47Z,thank you man
,bourgeot,2012-04-25T05:59Z,Thank you! Will seed forever. Amen.
,Enolena,2012-06-07T16:05Z,"Thank you so much for this torrent.  With Mr Bradbury's passing 2 days ago, these will be cherished all the more."
,unclemuzza,2012-06-08T02:44Z,Thanks for this. The images of Mars that Ray Bradbury weaved in my mind will be with me always. Rest well and thank you for your creations.
