Filename,Size,Unit
My.Son.My.Son.What.Have.Ye.Done.2011.PAL.DMT/My.Son.My.Son.What.Have.Ye.Done.2011.PAL.DMT.iso,3.87,G
"DMT NFO, Read before Playing.txt",1.38,K
My.Son.My.Son.What.Have.Ye.Done.2011.PAL.DMT.nfo,1.08,K
Torrent downloaded from AhaShare.com.txt,58,B
Torrent downloaded from Demonoid.me.txt,46,B
Torrent Downloaded from TorrentState.com.txt,46,B
Torrent_downloaded_from_www.puretorrents.cc.txt,36,B
Torrent downloaded from Rarbg.com.txt,33,B
Torrent downloaded from silvertorrents.me.txt,29,B
