User Type,Username,Date,Text
,abhikrit,2011-08-06T06:22Z,thanks man.. i knew you'd be quick :)
,abhikrit,2011-08-06T22:26Z,"some old faggot putting up the minuses here, asshole."
,bryentheartist,2011-08-06T22:58Z,too bad its mkv not all of us have mkv players. but (and that's a big but) it can be converted to xvid :)
,ilang16,2011-08-07T19:59Z,"""too bad its mkv not all of us have mkv players. but (and that's a big but) it can be converted to xvid :) ""

Download VLC Player, it will download faser than Sleepers, and you can watch it soon as its finished without converting it"
,karanhellman,2012-04-13T18:08Z,"dtyu man
i have a request to make to u
as u uploaded this awesome flick....... its an urgent one can u upload..i mean u should upload fr the sake of other ppl and yourself !! ...
PEARL HARBOR 2001 720p dts audio bluray
after u put it up ill make sure its seeded properly fr life ! pls i cant get this movie in any torrent site and i dont wat to use file sharing sites its a humble request frm a needy person !!! "
