Filename,Size,Unit
La Vita E Bella Soundtrack selections/Barcarolle - La vita e bella soundtrack.mp3,3.17,M
La Vita E Bella Soundtrack selections/La Vita E Bella (main theme music).mp3,2.42,M
Subtitles - La vita e bella 720p DivX HD (moviesbyrizzo)/English/La vita e bella 720p DivX HD (moviesbyrizzo).srt,98.41,K
Subtitles - La vita e bella 720p DivX HD (moviesbyrizzo)/Russian/La vita e bella 720p DivX HD (moviesbyrizzo).srt,124.88,K
La vita e bella 720p DivX HD (moviesbyrizzo).avi,3.3,G
Life is beautiful (La vita e bella).jpg,81.95,K
