User Type,Username,Date,Text
,JBNyen,2011-01-10T02:05Z,A/V?
,richardpa,2011-01-10T19:07Z,"Proper Disney Channel TV Rip and a fast download... 
A/9 
V/7.5 
Has Disney Channel watermark in the left hand corner and has been copied in a 4:3 format. It‘s been cropped too... 
Great movie for the kidz... 
Many Thanx to TvTeam and OPEN for the decent rip and Thanx to all the seeders for a quick download...:)"
,Kjeller77,2011-05-05T00:05Z,"Not a DVD-Rip, but a Tv-copy.
oki movie for kids.

Only thing is that they have made king Arthur to a Queen"
,angrybird0,2011-11-11T08:56Z,"Well, this torrent is good yet I don't think I will rate 1 up for its video quality..its A/V is not bad however not excellent.. just ""Just""... hmmm.. well..
But don't get discourage because it's not what you thinking..""worst""?? no! just normal.."
,sharrinn,2011-11-19T17:06Z,thank u x
