User Type,Username,Date,Text
,V_tom,2011-03-07T19:46Z,Det rasistfria alternativet...
,Oglomite,2011-03-07T21:49Z,Heders!
,SkeletalBat,2011-03-12T00:58Z,"Men herregud ditt jävla offer. Hur kan du lyckas särskriva ""uppladdat""?

Tillbaka till skolan med dig, din efterblivna jude."
[T],droidip,2011-03-14T17:21Z,Tack för Upp laddet då.
,jobbigbarndom,2011-03-22T13:20Z,"Jo men visst. Det är judarna som är de obildade här i världen och rasisterna som sitter på de tunga utbildningarna. Det minns man ju i plugget att visst var det så... 

Piloten har dött, kan vi få in en bandymålvakt..."
