Filename,Size,Unit
MILFs Valentina & Brooke Blowing Logan.flv,12.76,M
Brooklyn Swinger Ginger Blows Logan.flv,12.74,M
Logan Fucks Blonde Housewife Chastity.flv,12.67,M
Tattooed Hottie Indigo Sucking Cock.flv,12.63,M
Lesbo Housewives Vixen & Chastity.flv,12.47,M
Logan Fucks Cute Coed Naomi St Claire.flv,12.35,M
Angel Fucking In Thigh High Boots.flv,12.26,M
Mature Latina Sandie Swallows A Cock.flv,12.15,M
Cougar Cleo Swallows Some Cock.flv,12.13,M
Rena & Lily's Swinging Threesome.flv,11.9,M
