User Type,Username,Date,Text
,pranay147258369,2011-06-09T17:28Z,nice game thanks for uploading
,maangaster,2011-06-10T09:19Z,"hey uploader, what's the difference between version 1.5.1?"
,D0MiNiC,2011-06-21T17:14Z,soulonsoul85 Just put any number and activate. Downloaded and working for me . Thanks uploader.. I will kiss ur BONES for uploading it. lolz
,santario73,2011-07-08T06:24Z,"just asking? is angrybird.exe the crack, coz its thesame size as the exe in the install folder?"
,nimmy69,2011-07-30T03:34Z,not working for me need key to activate
,TheSH3RIFF,2011-07-30T16:34Z,"This is Perfect! Thank you! It was simple and easy!

For those who don't understand, jut simply do the Following: 
1) Just install the Demo version of Angry Birds (v.1.5.2).
2) Replace the original .exe file in the installed directory with the given crack (Angry Birds.exe).
3) Run the Game for the first time and Click on the bottom to Register, then for the 'Key' just type in Anything, i.e. ""BlahBlah"". It would say 'Registration Successful.'

And that's it! You're registered, and when ever there's an update, it will 'keep' you registered so it's okay to update. The same steps and conditions apply to Angry Birds Rio.

Thanks .BONE. ! Rated Quality up! :D"
,javeedcare,2011-10-11T15:09Z,somebody give me the activation code PLZ
