Filename,Size,Unit
Rundskop.2011.PAL.Retail.DD5.1.NL.Subs.DMT/Rundskop.2011.PAL.Retail.DD5.1.NL.Subs.DMT.iso,4.36,G
"DMT NFO, Read before Playing.txt",1.38,K
Rundskop.2011.PAL.Retail.DD5.1.NL.Subs.DMT.nfo,1.13,K
Torrent downloaded from AhaShare.com.txt,58,B
Torrent downloaded from Demonoid.me.txt,46,B
Torrent Downloaded from TorrentState.com.txt,46,B
Torrent_downloaded_from_www.puretorrents.cc.txt,36,B
Torrent downloaded from Rarbg.com.txt,33,B
Torrent downloaded from silvertorrents.me.txt,29,B
