User Type,Username,Date,Text
,krw86,2011-02-05T18:15Z,req if posalbe justflight air show pilot ??
,aberiyo,2011-02-05T23:08Z,please TAXI2GATE TORREON FS2004
,aberiyo,2011-02-05T23:10Z,please TAXI2GATE TORREON (MMTC) FS2004
,ShockerStalin,2011-02-06T19:34Z,"Thanks for the upload!

Req:  Aerosoft Dangerous Airports 1
         UK2000 VFR Airfields Vol 3"
,noneofyourbusiness1981,2011-02-21T17:21Z,Req: TURBINE SOUND STUDIOS - TSS CRJ-200 GE-CF34 SOUNDPACK FOR FSX
,noneofyourbusiness1981,2011-02-21T17:23Z,Req:   TURBINE SOUND STUDIOS - AIRBUS 380 GP7000 SOUNDPACK FSX
,dkchamp1,2011-02-24T22:28Z,"Request: TAXI2GATE MMTJ FSX
              TAXI2GATE MMMX FSX"
,olufsen01,2011-02-25T11:14Z,REQUESTING aerosoft maldives x
,jungonas,2011-04-08T12:03Z,"anyone got FSX-TAXI2GATE MMPR ?

thx!"
