User Type,Username,Date,Text
[V],neil1966hardy,2011-10-26T15:10Z,Very many thanks.  I have been looking forward to this!
[V],Kuthumi,2011-10-26T15:13Z,Click my blue username above to find rare films and other quality rips with 720 p.
,peilass,2011-12-04T15:04Z,Thank you so much -- really looking forward to watching this.
,peilass,2011-12-04T18:22Z,"And it's perfect, audio and video 10/10 - thank you again Kuthumi, your uploads are always terrific."
,yasmin54,2012-01-09T21:19Z,"Thanks a lot, i love your movie collection."
,nosing_glass,2012-01-17T14:42Z,"sounds very interesting, downloading it right now. thank you very much, mate."
,Asher_jk,2012-02-01T06:52Z,Thanks Kuthumi :) Yours was the smallest I could find and it worth a watch.. will check out you the other uploads.. +1 thanks once more.
,pirateradiorocks2,2012-03-10T05:24Z,"Cool, thanks very much for all your uploads!!"
