User Type,Username,Date,Text
,Rawkstar4life27,2011-06-28T18:15Z,Thank you for uploading this!  Stoked!
,tomatose,2011-07-07T02:20Z,"Pretty great album, have been a fan forever, and looked forward to this album for over a year!
Thanks TAKU and soupucia!

Audio is perfect by the way!"
,Brazell,2011-07-11T13:16Z,"Thank you! It's downloading super fast, love it!"
,Kaya1992,2011-07-22T03:29Z,nice thank you 
,Sonow21,2011-08-14T04:24Z,Haven't listened to these guys in a while. Will be looking forward to listening to this. Thanks! :D
,Christofer_Lynch,2011-09-08T23:58Z,Where can you find the bonus disc or the iTunes deluxe songs?
