User Type,Username,Date,Text
,frienlyfire78mm,2011-04-11T11:29Z,The Changer is the crack replace in install directory. I use this program now there is also one listed on the pirate bay which is where i got it from.
,punk420,2011-04-11T12:16Z,samples??
,frienlyfire78mm,2011-04-11T12:47Z,"@punk420 - Judging from your name you'll like it. Lots of girls, rock groups, cool randomness, a little bit of everything. Please comment so others will download."
,frienlyfire78mm,2011-04-11T16:06Z,Thats the crack you fucking noobs
,frienlyfire78mm,2011-04-12T07:47Z,Sorry I was in a bad mood then
,GregyPooh,2011-05-06T22:05Z,hence the name friendlyfire
,Zulwarn,2012-03-21T16:22Z,"@frienlyfire78mm 
lol a lot of girls? I don't need them I am straight. xD"
