User Type,Username,Date,Text
,boondocksaint78,2011-07-17T07:04Z,Thanks again for the update. And Go Team USA!
,frosticle,2011-07-17T08:56Z,"Thanks for keeping up with this. It is really a great thing you are doing for all of us simulator players.  :) And also, thank you for the Pure Sim cracked version. That was awesome. It was the first Wolverine Studio game I have seen cracked. That was really cool. :)"
,inuyashabr1986,2011-07-17T15:32Z,Yes Thanks!!!
,RandPC,2011-07-17T18:22Z,"Thanks for doing these, text sims don't get a lot of attention here but it's definitely appreciated."
,metrosdepot,2011-07-20T23:31Z,Seed please!
,quadsas,2011-07-24T11:59Z,"I just wish you would crack Bowl Bound College Football, that game is NUTS"
,quadsas,2011-07-24T12:02Z,"Or any other Grey Dog Software game - they are great, but way overpriced"
,Scotchtape4,2011-07-28T18:26Z,"Thank you very much for uploading and keeping us updated as well. Props for the clean torrent and helpful attitude

AVG tested and clean 7-27-11 good torrent"
,ah6228,2011-07-31T20:48Z,Thanks for the torrent but I'm unable to download it. The connection is always refused. Anyone could help me?
,inuyashabr1986,2011-08-05T23:06Z,"There are a new patch  12.3.22, when the new crack will be avalibe??? hope is soon, Keep the good work"
,willyjinkens,2011-08-06T14:21Z,Out Of The Park 12.3.22 - http://thepiratebay.org/torrent/6586805
