User Type,Username,Date,Text
[V],les-stefs79,2011-08-04T11:49Z,Troupe D'elite Dans L'enfer Des Favelas TRUEFRENCH DVDRip Xvid Ac3-FwD
,scardom,2011-08-05T05:48Z,salut tout dabors merci pour c'est nombreux films !! je cherche un vieux film d'horreur 1986   April fool's day la version en francais c'est Week-end de terreur !! si j'amais tu me trouve sa laisse moi savoir sa fais longtemps que je le cherche merci !!!
,jo4130,2011-08-05T14:59Z,Tjs pas de news pour very bad trip 2?
[V],les-stefs79,2011-08-06T09:09Z,"Pas dispo en bonne qualitĂŠ jo ..
Soyons patient ;)"
