Filename,Size,Unit
CD1/07 Stand for the Fire Demon (alternate mix).flac,34.29,M
CD1/18 Creature with the Atom Brain (alternate take).flac,25.21,M
CD1/02 Night of the Vampire (alternate mix).flac,24.38,M
CD1/06 If You Have Ghosts (alternate mix).flac,22.51,M
CD1/14 Two Head Dog (Red Temple Prayer) (alternate mix).flac,20.1,M
CD1/08 Two Headed Dog (Red Temple Prayer) (alternate mix).flac,20.06,M
CD1/05 Mine Mine Mind (alternate mix).flac,18.5,M
CD1/01 It's a Cold Night for Alligators (alternate mix).flac,18.05,M
"CD1/03 Don't Shake Me Lucifer (alternate take, mix 1).flac",16.49,M
"CD1/09 I Think Up Demons (alternate take, mix 1).flac",16.31,M
CD1/15 White Faces (alternate mix).flac,15.77,M
CD1/19 White Faces (alternate mix).flac,15.7,M
CD1/16 White Faces (alternate mix).flac,15.7,M
CD1/17 White Faces (alternate mix).flac,15.64,M
CD1/04 Click Your Fingers Applauding the Play (alternate mix).flac,14.93,M
CD1/11 I Walked with a Zombie (extended alternate mix 1 - more backing vocals).flac,9.95,M
CD1/12 I Walked with a Zombie (extended alternate mix 2 - alternate backing vocals).flac,9.81,M
"CD1/13 I Think Up Demons (alternate take, mix 2 - alternate backing vocals).flac",8.32,M
CD1/10 White Faces (alternate mix - doubled vocals).flac,7.76,M
CD1/CD1.md5,1.62,K
CD2/13 Bloody Hammer (full-length alternate mix used for single).flac,31.78,M
CD2/14 It's a Cold Night for Alligators (alternate take).flac,29.34,M
CD2/15 Alien I Creator (alternate take).flac,28.82,M
CD2/11 Night of the Vampire (alternate mix).flac,25.79,M
CD2/05 The Wind and More (alternate mix).flac,24.12,M
CD2/08 Two Headed Dog (Red Temple Prayer) (alternate mix).flac,20.95,M
CD2/12 If You Have Ghosts (alternate mix).flac,20.05,M
CD2/04 I Walked with a Zombie (extended alternate mix 3).flac,19.33,M
CD2/03 Mine Mine Mind (alternate mix).flac,19.16,M
"CD2/09 Don't Shake Me Lucifer (alternate take, mix 4).flac",17.47,M
CD2/16 White Faces (alternate take).flac,17.21,M
CD2/10 I Think Up Demons (alternate mix).flac,16.95,M
"CD2/01 Don't Shake Me Lucifer (alternate take, mix 2).flac",16.75,M
"CD2/02 Don't Shake Me Lucifer (alternate take, mix 3).flac",16.49,M
CD2/07 Click Your Fingers Applauding the Play (alternate mix).flac,15.7,M
CD2/06 Click Your Fingers Applauding the Play (alternate mix).flac,15.46,M
CD2/CD2.md5,1.33,K
Roky CD Club - updated.doc,159.5,K
Roky Erickson - The Evil One Alternate Takes & Mixes.m3u,4.47,K
info.txt,2.69,K
Torrent downloaded from Demonoid.me.txt,46,B
