User Type,Username,Date,Text
,andrewam,2011-04-21T16:38Z,please comment feed back pleae peeps
,sh0tgunfacelift,2011-04-21T23:13Z,why not download for yourself then comment? anyway not a big fan of the band but ill download and comment for you.
,sh0tgunfacelift,2011-04-21T23:39Z,"Its brokencyde thats for sure 128kbps rip ...

so much autotune and screaming to make up for there lack of talent I guess."
,sh0tgunfacelift,2011-04-22T00:54Z,ps brokencyde suck cock and wish they were half as good as slayer these 13 year old sounding bitches are going no where hollywood undead already got this style of music down theres no room for these gay bitches.
,DryGoatAir,2011-05-19T00:17Z,"@ sh0tgunfacelift: If you don't like it, don't download this torrent. And Hollywood Undead is something completely different. You can't really compare them with Brokencyde.

As for the quality: it's only 128kbps, but I haven't been able to find a higher quality anywhere. So this'll do. Thanks for the up!"
