Filename,Size,Unit
The Shawshank Redemption [1994] 480p BRrip x264 SmartGuy Silver RG.mp4,401.72,M
Sample - The Shawshank Redemption [1994] 480p BRrip x264 SmartGuy Silver RG.mp4,2.07,M
Subtitles/Vietnamese.srt,142.6,K
Subtitles/English.srt,137.08,K
SilverRG NFO Read it.nfo,8.45,K
READ THIS!!.txt,188,B
Links/Torrent downloaded from Sceneunderground.org.txt,55,B
Links/Torrent downloaded from Silvertorrents.me.txt,52,B
Links/Torrent downloaded from ExtraTorrent.com.txt,51,B
Links/Torrent downloaded from thepiratebay.org.txt,51,B
Links/Torrent downloaded from Puretorrents.cc.txt,50,B
Links/Torrent downloaded from Kickasstorrents.com.txt,43,B
Links/Torrent downloaded from h33t.com.txt,43,B
Links/Torrent downloaded from Limetorrents.com.txt,40,B
Links/Torrent downloaded from 1337x.org.txt,24,B
