User Type,Username,Date,Text
,tegrant,2011-09-14T04:07Z,Sounds awesome.
,SharifaM,2011-10-02T11:42Z,"It's broken.  Sound works, but video is all glitchy."
,apsum41,2011-11-21T06:18Z,You're glitchy. Try VLC or get a faster computer. Plays perfectly for me.
,TrexWarrior,2012-01-27T00:23Z,"I just uploaded an iTunes rip of this to TPB. Check it out 320 kbs.

http://thepiratebay.org/torrent/6987839/Patton_Oswalt__The_Finest_Hour_iTunes_Rip_320Kbs"
,monster.x,2012-04-21T18:01Z,its a hdtv rip from showtime (with visible logo). perfect quality though. thanks a lot.
,tran001,2012-04-23T05:02Z,Thank you so much man!
