User Type,Username,Date,Text
[T],droidip,2011-02-11T22:54Z,"Please note that this is v1.0, its not Lyrica 2 from App Store."
,pratiek,2011-02-12T00:24Z,DRIOD IP iSpeak Translator PLZZZZZZ!!!!!
[T],droidip,2011-02-12T01:04Z,"@pratiek you comment this everywhere, I think its your twentieth time you ask me for that app.  if you really want it so much you should go and buy it. It looks a lot unpopular for me."
,umaisupa,2011-02-12T03:19Z,"Hi Droidip,

wanna say thanx for your time and effort.

Is there a chance you could share Screenrecycler?

greetings and keep up the good work!"
,pratiek,2011-02-12T06:05Z,Alright im sorry :(
,cezzione,2011-02-12T11:50Z,"awesome nice app, thx!"
,SFR7.5000127,2011-02-12T14:31Z,I have to say thanks for all the flawless working apps you uploaded.
,noob327,2011-02-13T00:19Z,"GREAT job, what about Sentinel 3: Homeworld???"
,drtime91,2011-10-02T16:44Z,hey can you get growl voice?
