Filename,Size,Unit
20 grandes Exitos/01 Lagrimas Lloro.mp3,2.98,M
20 grandes Exitos/03 Vengo  a verte.mp3,3.24,M
20 grandes Exitos/05 Brindo.mp3,2.14,M
20 grandes Exitos/06 Senor de las canas.mp3,2.31,M
20 grandes Exitos/07 Vida Mia.mp3,2.73,M
20 grandes Exitos/09 Olvidame.mp3,3.29,M
20 grandes Exitos/10 Hoy Soy Feliz.mp3,2.73,M
20 grandes Exitos/11 Busca otro Amor.mp3,2.72,M
20 grandes Exitos/12 Esta Tristeza Mia.mp3,3.22,M
20 grandes Exitos/13 Cuando te Fuiste.mp3,2.11,M
20 grandes Exitos/14 Donde caigo.mp3,2.7,M
20 grandes Exitos/15 Amor de los Dos.mp3,2.45,M
20 grandes Exitos/16 Mi Castigo.mp3,2.08,M
20 grandes Exitos/17 Deja de Quererme.mp3,2.15,M
20 grandes Exitos/18 Que Sacrificio.mp3,2.67,M
20 grandes Exitos/19 Ni el Dinero ni nada.mp3,3.34,M
20 grandes Exitos/20 Por tu Culpa.mp3,3.16,M
De Todo Corazon/01 Noches Eternas.mp3,2.12,M
De Todo Corazon/02 Partiendome El Alma.mp3,3.73,M
De Todo Corazon/03 Quiero Olvidarte.mp3,2.52,M
De Todo Corazon/04 Que Manera De Perder.mp3,3.35,M
De Todo Corazon/05 Ya Esta Relampagueando.mp3,3.44,M
De Todo Corazon/06 Una Noche Me Embriague.mp3,2.53,M
De Todo Corazon/07 El Dia Que Te Perdi.mp3,4.02,M
De Todo Corazon/08 Despues De Tanto.mp3,2.98,M
De Todo Corazon/09 Besando La Cruz.mp3,3.04,M
De Todo Corazon/10 Me Voy Lejos.mp3,2.12,M
EL CORRIDO DE LOS PEREZ/01 INTRO.mp3,4.23,M
EL CORRIDO DE LOS PEREZ/Ahora Vengo a Verte.mp3,3.19,M
EL CORRIDO DE LOS PEREZ/Busca otro Amor.mp3,2.68,M
EL CORRIDO DE LOS PEREZ/Como Paloma Herrante.mp3,3,M
EL CORRIDO DE LOS PEREZ/Corazoncito Tirano.mp3,2.39,M
EL CORRIDO DE LOS PEREZ/Corrido de Mario Leyva.mp3,3.21,M
EL CORRIDO DE LOS PEREZ/Cuando te Fuiste.mp3,2.08,M
EL CORRIDO DE LOS PEREZ/Donde Caigo.mp3,2.66,M
EL CORRIDO DE LOS PEREZ/El Caballo Afamado.mp3,2.47,M
EL CORRIDO DE LOS PEREZ/El Caminante.mp3,3.68,M
EL CORRIDO DE LOS PEREZ/El Corrido de los Perez.mp3,3.76,M
EL CORRIDO DE LOS PEREZ/El Señor de las Canas.mp3,2.24,M
EL CORRIDO DE LOS PEREZ/Esta Tristeza Mia.mp3,3.19,M
EL CORRIDO DE LOS PEREZ/Hazla Regresar.mp3,3.22,M
EL CORRIDO DE LOS PEREZ/Imposible Olvidarte.mp3,2.29,M
EL CORRIDO DE LOS PEREZ/La Lampara.mp3,2.52,M
EL CORRIDO DE LOS PEREZ/Lágrimas Lloro.mp3,2.98,M
EL CORRIDO DE LOS PEREZ/Me Persigue tu Sombra.mp3,2.12,M
EL CORRIDO DE LOS PEREZ/Mi Cruz de Dolor.mp3,2.93,M
EL CORRIDO DE LOS PEREZ/Siempre Hace Frio.mp3,2.66,M
EL CORRIDO DE LOS PEREZ/Sin Sangre en las Venas.mp3,2.87,M
EL CORRIDO DE LOS PEREZ/Te Llegará mi Olvido.mp3,2.06,M
EL CORRIDO DE LOS PEREZ/Tierra Mala.mp3,2.8,M
EL CORRIDO DE LOS PEREZ/Una Noche Me Enbriague.mp3,2.49,M
EL CORRIDO DE LOS PEREZ/Vino Maldito.mp3,2.41,M
Mas Impactante/01 Paloma Errante.mp3,3.04,M
Mas Impactante/03 El Senor De Las Canas.mp3,2.31,M
Mas Impactante/04 Vino Maldito.mp3,2.48,M
Mas Impactante/06 Conchita.mp3,3.02,M
Mas Impactante/07 ME PERSIGUE TU SOMBRA.mp3,2.14,M
Mas Impactante/08 Morena La Causa Fuiste.mp3,2.47,M
Mas Impactante/09 Corazoncito Tirano.mp3,2.44,M
Mas Impactante/10 Si Acaso Vuelves.mp3,2.49,M
