User Type,Username,Date,Text
,stedavis320,2011-02-22T01:22Z,I am new to this so excuse me for my ignorance but I have downloaded this torrent and everything is fine but I am unable to locate the user name........I found the serial number but was unable to find were the user name was located.  Thanks for the torrent:)  What do I need to do?  
,stedavis320,2011-02-22T02:12Z,Never mind I figured it out:)  THANK YOU!
,wportgoon,2011-02-24T12:03Z,im having the same difficulties as stedavis320 please help
,Monniker,2011-08-07T19:41Z,Works great. Thanks!
,klanen4ever,2011-12-29T09:42Z,"Why do i get green writing on my converted video on the left side of the screen. something about audio etc. Is it some kind of watermark. is there something  that i can do, so this green writing goes away?"
