User Type,Username,Date,Text
[T],dipty,2011-05-04T09:26Z,very nice work MSBHATTI kip it up
,msbhatti,2011-05-04T09:30Z,"Thanks Dipty and dipty extratorrent par torrent upload nahin ho raha koi problem hai kia plz check kar k batado gi

kuun k mein kar extratorrent par bhi upload kar raha hoon but ho nahin raha"
,nadeemm,2011-05-04T13:01Z,Guzaarish and Tanu weds Manu has out now on Bluray.. please upload
,herildesai,2011-05-04T16:17Z,Dear Nadeem Tanu Weds Manu Available on Bluray on DDR torrentz. Search on torrent as Bluray DDR.
[V],wolfinvi,2011-05-21T14:02Z,TELL ME YOUR USER NAME BHATTI & SEED IT IN EXD AS I M STUCK AT 73 % 
