User Type,Username,Date,Text
,wishUluck,2011-01-01T13:20Z,Thank you sailo for all your fantastic work here in thepiratebay! May the New Year bring you all you ever wished for!
,bert2006,2011-01-02T01:37Z,no screen shots?
,bert2006,2011-01-02T18:29Z,"very very slow dl

very good quality though..

v9 a10"
,UncleDaddy,2011-01-03T18:44Z,Nice to see Milla Jovovich's cup B tits =P Thanks sailo
,ireallyamabum,2011-01-06T22:12Z,Seriously! wtf! is that two fingers growing out of her chest? or b; shes a mother of 31 kids...im confused..
,ireallyamabum,2011-01-06T22:45Z,"Seriously! Wtf!? SHe got two fingers growing out of her chest! That or, more realistic, shes a mother of 32 kids.. im confused"
