Filename,Size,Unit
Reggae Max/17 Once a Year Beenie Man.mp3,9.35,M
Reggae Max/19 If a Girl a Say Beenie Man.mp3,8.98,M
Reggae Max/05 Romie Beenie Man.mp3,8.94,M
Reggae Max/04 Girls Dem Sugar Beenie Man.mp3,8.93,M
Reggae Max/16 Bury Yu Dead Beenie Man.mp3,8.84,M
Reggae Max/12 Modelling Beenie Man.mp3,8.76,M
Reggae Max/08 Nobody's Perfect Beenie Man.mp3,8.67,M
Reggae Max/11 Music a de Beat Beenie Man.mp3,8.64,M
Reggae Max/03 Girls I See Beenie Man.mp3,8.61,M
Reggae Max/07 Damel Ship Beenie Man.mp3,8.59,M
Reggae Max/15 Veteran Beenie Man.mp3,8.54,M
Reggae Max/20 Gal You a Shuffle Beenie Man.mp3,8.54,M
Reggae Max/01 Yaw Yaw Beenie Man.mp3,8.28,M
Reggae Max/10 Miss Angela Beenie Man.mp3,8.21,M
Reggae Max/13 Mobster Beenie Man.mp3,8.15,M
Reggae Max/09 Press Button Beenie Man.mp3,7.93,M
Reggae Max/14 Matie Beenie Man.mp3,7.6,M
Reggae Max/06 New Suzuki Beenie Man.mp3,6.56,M
Reggae Max/18 Wicked Slam Beenie Man.mp3,6.43,M
Reggae Max/02 Ole Dawg Beenie Man.mp3,6.34,M
Reggae Max/MB28679W595.jpg,68.58,K
"Reggae Max/$(KGrHqJ,!lgE453EudRLBOP0BCOJzQ~~0_12.jpg",53.34,K
Reggae Max/mvstcdxx.lst,42.17,K
