User Type,Username,Date,Text
,piratgold,2011-07-29T17:38Z,"Hi everyone

I am a hindu from India, and i want to bring something into the attention of international community

I am very sad  for all those who lost someone in the shootout

The killing done by Anders Breivik is very bad method and its sad, but what he said about hindus being killed is very true.

We hindus were always targets of muslims.. crores of hindus have been killed by moslesm. We are a peaceloving community and we dont know why they are eliminating us..We are suffering from islam since centuries. We are butchered since islam entered india thousands of years ago. But nobody does anything to stop it.. we have suffered more than jews or anyone in this world have suffered. Even two weeks ago a bomb blast was done by jehadis in mumai killing innocent hindus.
Our crime is we are the most peaceful race in the world... and we welcome everybody to our home. Thats our crime.. They bomb blast our temples, and kills people who comes to pray there..

And now this political party named Indian National Congress rules the contry as an alliance called UPA, and they are doing everything politcally to suppress hindus too...
Its funny that hindus were once the ancient inhabitants of india, and we welomed everybody who came here, but now we live like slaves or refugees here... hindus are killed/converted or hindu women are raped everyday. But no justice comes for us ever

If international community doesnt intervene, and throw Congress led UPA out of power, peaceloving hindu race will be wiped off from earth for ever... we are facing extinction. We have always stood for humanity and the world knows our contribution to the humanity and that we have always embraced peace. India never invaded any country.. Hindus never forcibly convert anybody...

I request UN or any organization to come to india save hindus.. to stop hindu genocide led by indian national congress(INC) and jehadis and missionaries. The leaders of INC - rahul gundhi, sonia gundhi, chidambaram, digvijaysingh etc gets crores of rupees from pakistani spy agency ISI for helping in eliminating hindus

milions of kashmiri hindus were killed and thrown out of kashmir, before moslems took over there with the help of pakistan's spy agency ISI.. Many stilllive as refugees, but nobody did anything about it. We hindus never gets justice..


We have always done our best for the world, and its time for the rest of humanity to save us from extinction. Please help us..
Please come to india and study how moslems are eliminating hindus since centuries.. UN and other organizations must study on Hindu killing done by others.. Please save us

Let peace prevail.."
,ZCB932,2011-09-29T02:03Z,"Fuck India! You post the same comment everywhere! GOOD FOR FUCKING YOU! You learned how to Ctrl+C and Ctrl+V. Now try writing something on your own, and not using some piece of shit someone else wrote! Stop copy and pasting and actually do shit in your life if you think it is important!


"
