User Type,Username,Date,Text
,thavox,2011-10-01T07:36Z,http://www.imdb.com/title/tt1847645/
,thavox,2011-10-01T07:39Z,"Short flic, dvd extra to original Megamind movie.

plot:

Megamind getting rid of all his evil weapons of destruction in a sort of yard sale; it seems like a good idea until a button in a box gets pushed and an unused ""unspeakable evil"" gets activated and focuses on destroying the protector of Metrocity – who at this time happens to be Megamind himself."
,michaelrwatson,2012-01-15T01:18Z,"Hey playXD: Why almost 600MB for a 15min short..?

That's a data rate of almost 5 GIGABYTES for a 2 hr movie....

Get a clue please. Thanks."
