User Type,Username,Date,Text
[V],.BONE.,2011-10-28T04:37Z,its Spanish IGUANA has put wrong info
,Manderz,2011-11-30T00:27Z,"The download was fast and the a/v quality seems to be great, but I can't get it to play the subs in DivX. Can someone please help?"
,durex034,2012-01-10T20:08Z,Thanks ;)
,8max,2012-01-10T22:54Z,Thank you .BONE. for uploading
,razzell2,2012-02-25T16:55Z,"info say english but, its not in english.
waiting for an english dubbed version.
good movie i hear"
,Magickallife,2012-03-17T08:45Z,waiting on english speaking copy
,kingsa1,2012-03-22T02:27Z,when is silent house 2012 gonna be put up without needing a missing codac or having to fill out umpteen freakin surveys it the only movie you can't get online downloaded 50-60 files all fake crap
,Xedilian,2012-05-21T21:42Z,"don't download this torrent unless you can understand the spanish language.
There are no english subs."
,blsthala,2012-06-02T13:17Z,Below average waste of time guys
