User Type,Username,Date,Text
,bham99,2011-03-26T10:47Z,is this real?
,somedude.1001,2011-03-26T12:00Z,"its real, just finished watching it

v 10 a 10
movies full of silly cgi, completely disregard physics, over the top actions"
,intobearzz,2011-03-27T07:40Z,"well duh and another duh SOMEDUDE! thats why we call it FANTASY, SCI-FI DREAM flicks. not trying to mock ya comment. mealy just trying to educate ya on what FANTASY flicks r about.  "
,somedude.1001,2011-03-27T09:16Z,"educate me? lol, you think youre really smart being able to make the connection between what I said and the films genre, seriously are you 10?"
