User Type,Username,Date,Text
,iNjeCTi0N,2011-09-13T09:47Z,Seed Plz PEople If u Love ur Family Plz Seeeeeeeed
,iNjeCTi0N,2011-09-17T10:33Z,KHUDA KE LIYE   Seeeeeeeeeed
,bausaab,2011-09-18T11:02Z,"Khuda K Liye Seed kar mere Bhai
Agar seed karna nhi hota to upload kyon karta hai yar 
Plzzzzzzzzzzzzzzzz Khuda k liye seed karo"
[T],HaUnTiNg.SuMMeR,2011-09-18T15:37Z,guys could u wait for just 24 hrs.. duw  to system crash unaBLE 2 SEED. will seed torrent shortly. thnx for ur support n love. 
,bausaab,2011-09-18T19:43Z,"Thanxxx 
but i still waiting last 4 days .....
plzzzzzzzz seed soon "
[T],HaUnTiNg.SuMMeR,2011-09-19T20:45Z,Seeding Now on full swing ! enjoy n thanx for ur support !
