User Type,Username,Date,Text
,bvrsknr,2011-06-19T00:54Z,"looks good,but can't get it to work
when I choose a video file to convert,ALL dialog boxes gray-out
only options available are delete(clip)
and add"
,ilocano1968,2011-07-22T23:36Z,nice stuff I install this and update to 6.6.0 build 0623 after it make sure to block from internet...now I'm enjoying the latest version try it
,realgrimm,2011-08-02T14:20Z,invalid serial is all I'm gettin 
,realgrimm,2011-08-02T15:52Z,"I take it back my bad I had to take out a registry code in the regedit on the re-install, Serial works

just make sure you clean your regedit and turn off the updater"
