Filename,Size,Unit
Dream House 2011 RC BRRip LiNE XviD-FTW.avi,700.53,M
Dream House 2011 RC BRRip LiNE XviD-FTW.sample.avi,15.04,M
Release.nfo,2.76,K
Thanks/Torrent Uploaded by Boobsman.txt,527,B
Thanks/Torrent downloaded from Demonoid.me.txt,46,B
Thanks/Torrent downloaded from KAT.ph.txt,41,B
Thanks/Torrent downloaded from Limetorrents.com.txt,51,B
Thanks/Torrent downloaded from SilverTorrents.me.txt,41,B
Thanks/Torrent downloaded from h33t.com.txt,44,B
Thanks/Torrent downloaded from sceneunderground.org.txt,77,B
Torrent downloaded from www.KAT.ph.txt,41,B
