Filename,Size,Unit
Album Artwork/The Beatles - 1.jpg,21.47,K
Album Artwork/The Beatles - A Hard Day's Night.png,393.4,K
Album Artwork/The Beatles - Abbey Road.png,729.4,K
Album Artwork/The Beatles - Beatles For Sale.png,762.74,K
Album Artwork/The Beatles - Help!.png,189.66,K
Album Artwork/The Beatles - Let It Be.png,492.19,K
Album Artwork/The Beatles - Magical Mystery Tour.png,943.13,K
"Album Artwork/The Beatles - Past Masters, Vols. 1 & 2.png",43.95,K
Album Artwork/The Beatles - Please Please Me.png,743.68,K
Album Artwork/The Beatles - Revolver.png,389.57,K
Album Artwork/The Beatles - Rubber Soul.png,707.83,K
Album Artwork/The Beatles - Sgt. Pepper's Lonely Hearts Club Band.png,876.03,K
Album Artwork/The Beatles - The Beatles (White Album).png,13.65,K
Album Artwork/The Beatles - The Beatles 1962–1966 (The Red Album).png,589.92,K
Album Artwork/The Beatles - The Beatles 1967–1970 (The Blue Album).png,633.58,K
Album Artwork/The Beatles - With The Beatles.png,177.39,K
Album Artwork/The Beatles - Yellow Submarine.png,481.08,K
Compilation Albums/1/1-01 Love Me Do.mp3,5.4,M
Compilation Albums/1/1-02 From Me To You.mp3,4.47,M
Compilation Albums/1/1-03 She Loves You.mp3,5.41,M
Compilation Albums/1/1-04 I Want To Hold Your Hand.mp3,5.59,M
Compilation Albums/1/1-05 Can't Buy Me Love.mp3,5.04,M
Compilation Albums/1/1-06 A Hard Day's Night.mp3,5.86,M
Compilation Albums/1/1-07 I Feel Fine.mp3,5.33,M
Compilation Albums/1/1-08 Eight Days A Week.mp3,6.27,M
Compilation Albums/1/1-09 Ticket To Ride.mp3,7.28,M
Compilation Albums/1/1-10 Help!.mp3,5.33,M
Compilation Albums/1/1-11 Yesterday.mp3,4.81,M
Compilation Albums/1/1-12 Day Tripper.mp3,6.46,M
Compilation Albums/1/1-13 We Can Work It Out.mp3,5.19,M
Compilation Albums/1/1-14 Paperback Writer.mp3,5.32,M
Compilation Albums/1/1-15 Yellow Submarine.mp3,6.06,M
Compilation Albums/1/1-16 Eleanor Rigby.mp3,4.84,M
Compilation Albums/1/1-17 Penny Lane.mp3,6.93,M
Compilation Albums/1/1-18 All You Need Is Love.mp3,8.74,M
"Compilation Albums/1/1-19 Hello, Goodbye.mp3",7.97,M
Compilation Albums/1/1-20 Lady Madonna.mp3,5.25,M
Compilation Albums/1/1-21 Hey Jude.mp3,16.42,M
Compilation Albums/1/1-22 Get Back.mp3,7.35,M
Compilation Albums/1/1-23 The Ballad Of John And Yoko.mp3,6.89,M
Compilation Albums/1/1-24 Something.mp3,6.96,M
Compilation Albums/1/1-25 Come Together.mp3,9.9,M
Compilation Albums/1/1-26 Let It Be.mp3,8.84,M
Compilation Albums/1/1-27 The Long And Winding Road.mp3,8.4,M
"Compilation Albums/Past Masters, Vols. 1 & 2/14-01 Love Me Do (Original Single Version).mp3",5.57,M
"Compilation Albums/Past Masters, Vols. 1 & 2/14-02 From Me To You.mp3",4.51,M
"Compilation Albums/Past Masters, Vols. 1 & 2/14-03 Thank You Girl.mp3",4.76,M
"Compilation Albums/Past Masters, Vols. 1 & 2/14-04 She Loves You.mp3",5.44,M
"Compilation Albums/Past Masters, Vols. 1 & 2/14-05 I'll Get You.mp3",4.87,M
"Compilation Albums/Past Masters, Vols. 1 & 2/14-06 I Want To Hold Your Hand.mp3",5.63,M
"Compilation Albums/Past Masters, Vols. 1 & 2/14-07 This Boy.mp3",5.24,M
"Compilation Albums/Past Masters, Vols. 1 & 2/14-08 Komm, Gib Mir Deine Hand.mp3",5.61,M
"Compilation Albums/Past Masters, Vols. 1 & 2/14-09 Sie Liebt Dich.mp3",5.36,M
"Compilation Albums/Past Masters, Vols. 1 & 2/14-10 Long Tall Sally.mp3",4.73,M
"Compilation Albums/Past Masters, Vols. 1 & 2/14-11 I Call Your Name.mp3",4.96,M
"Compilation Albums/Past Masters, Vols. 1 & 2/14-12 Slow Down.mp3",6.79,M
"Compilation Albums/Past Masters, Vols. 1 & 2/14-13 Matchbox.mp3",4.57,M
"Compilation Albums/Past Masters, Vols. 1 & 2/14-14 I Feel Fine.mp3",5.37,M
"Compilation Albums/Past Masters, Vols. 1 & 2/14-15 She's A Woman.mp3",7.02,M
"Compilation Albums/Past Masters, Vols. 1 & 2/14-16 Bad Boy.mp3",5.41,M
"Compilation Albums/Past Masters, Vols. 1 & 2/14-17 Yes It Is.mp3",6.24,M
"Compilation Albums/Past Masters, Vols. 1 & 2/14-18 I'm Down.mp3",5.84,M
"Compilation Albums/Past Masters, Vols. 1 & 2/14-19 Day Tripper.mp3",6.46,M
"Compilation Albums/Past Masters, Vols. 1 & 2/14-20 We Can Work It Out.mp3",5.21,M
"Compilation Albums/Past Masters, Vols. 1 & 2/14-21 Paperback Writer.mp3",5.33,M
"Compilation Albums/Past Masters, Vols. 1 & 2/14-22 Rain.mp3",6.96,M
"Compilation Albums/Past Masters, Vols. 1 & 2/14-23 Lady Madonna.mp3",5.29,M
"Compilation Albums/Past Masters, Vols. 1 & 2/14-24 The Inner Light.mp3",6,M
"Compilation Albums/Past Masters, Vols. 1 & 2/14-25 Hey Jude.mp3",16.45,M
"Compilation Albums/Past Masters, Vols. 1 & 2/14-26 Revolution.mp3",7.85,M
"Compilation Albums/Past Masters, Vols. 1 & 2/14-27 Get Back.mp3",7.33,M
"Compilation Albums/Past Masters, Vols. 1 & 2/14-28 Don't Let Me Down.mp3",8.27,M
"Compilation Albums/Past Masters, Vols. 1 & 2/14-29 The Ballad Of John And Yoko.mp3",6.91,M
"Compilation Albums/Past Masters, Vols. 1 & 2/14-30 Old Brown Shoe.mp3",7.62,M
"Compilation Albums/Past Masters, Vols. 1 & 2/14-31 Across The Universe.mp3",8.79,M
"Compilation Albums/Past Masters, Vols. 1 & 2/14-32 Let It Be.mp3",8.88,M
"Compilation Albums/Past Masters, Vols. 1 & 2/14-33 You Know My Name (Look Up The.mp3",9.88,M
Compilation Albums/The Beatles 1962–1966 (The Red Album)/1-01 Love Me Do (Mono Version).mp3,5.53,M
Compilation Albums/The Beatles 1962–1966 (The Red Album)/1-02 Please Please Me (Mono Version).mp3,4.77,M
Compilation Albums/The Beatles 1962–1966 (The Red Album)/1-03 From Me To You (Mono Version).mp3,4.64,M
Compilation Albums/The Beatles 1962–1966 (The Red Album)/1-04 She Loves You (Mono Version).mp3,5.59,M
Compilation Albums/The Beatles 1962–1966 (The Red Album)/1-05 I Want To Hold Your Hand.mp3,5.74,M
Compilation Albums/The Beatles 1962–1966 (The Red Album)/1-06 All My Loving.mp3,5.07,M
Compilation Albums/The Beatles 1962–1966 (The Red Album)/1-07 Can't Buy Me Love.mp3,5.22,M
Compilation Albums/The Beatles 1962–1966 (The Red Album)/1-08 A Hard Day's Night.mp3,6.04,M
Compilation Albums/The Beatles 1962–1966 (The Red Album)/1-10 Eight Days A Week.mp3,6.42,M
Compilation Albums/The Beatles 1962–1966 (The Red Album)/1-11 I Feel Fine.mp3,5.5,M
Compilation Albums/The Beatles 1962–1966 (The Red Album)/1-12 Ticket To Ride.mp3,7.44,M
Compilation Albums/The Beatles 1962–1966 (The Red Album)/1-13 Yesterday.mp3,4.86,M
Compilation Albums/The Beatles 1962–1966 (The Red Album)/2-01 Help!.mp3,5.46,M
Compilation Albums/The Beatles 1962–1966 (The Red Album)/2-02 You've Got To Hide Your Love Away.mp3,5.15,M
Compilation Albums/The Beatles 1962–1966 (The Red Album)/2-03 We Can Work It Out.mp3,5.34,M
Compilation Albums/The Beatles 1962–1966 (The Red Album)/2-04 Day Tripper.mp3,6.62,M
Compilation Albums/The Beatles 1962–1966 (The Red Album)/2-05 Drive My Car.mp3,5.81,M
Compilation Albums/The Beatles 1962–1966 (The Red Album)/2-06 Norwegian Wood (This Bird Has F.mp3,4.92,M
Compilation Albums/The Beatles 1962–1966 (The Red Album)/2-07 Nowhere Man.mp3,6.41,M
Compilation Albums/The Beatles 1962–1966 (The Red Album)/2-08 Michelle.mp3,6.34,M
Compilation Albums/The Beatles 1962–1966 (The Red Album)/2-09 In My Life.mp3,5.76,M
Compilation Albums/The Beatles 1962–1966 (The Red Album)/2-10 Girl.mp3,5.93,M
Compilation Albums/The Beatles 1962–1966 (The Red Album)/2-11 Paperback Writer.mp3,5.45,M
Compilation Albums/The Beatles 1962–1966 (The Red Album)/2-12 Eleanor Rigby.mp3,5.03,M
Compilation Albums/The Beatles 1962–1966 (The Red Album)/2-13 Yellow Submarine.mp3,6.15,M
Compilation Albums/The Beatles 1967–1970 (The Blue Album)/1-01 Strawberry Fields Forever.mp3,9.62,M
Compilation Albums/The Beatles 1967–1970 (The Blue Album)/1-02 Penny Lane.mp3,7.09,M
Compilation Albums/The Beatles 1967–1970 (The Blue Album)/1-03 Sgt. Pepper's Lonely Hearts Club Band.mp3,4.83,M
Compilation Albums/The Beatles 1967–1970 (The Blue Album)/1-04 With A Little Help From My Friends.mp3,6.43,M
Compilation Albums/The Beatles 1967–1970 (The Blue Album)/1-05 Lucy In The Sky With Diamonds.mp3,8.16,M
Compilation Albums/The Beatles 1967–1970 (The Blue Album)/1-06 A Day In The Life.mp3,11.9,M
Compilation Albums/The Beatles 1967–1970 (The Blue Album)/1-07 All You Need Is Love.mp3,8.89,M
Compilation Albums/The Beatles 1967–1970 (The Blue Album)/1-08 I Am The Walrus.mp3,10.68,M
"Compilation Albums/The Beatles 1967–1970 (The Blue Album)/1-09 Hello, Goodbye.mp3",8.17,M
Compilation Albums/The Beatles 1967–1970 (The Blue Album)/1-10 The Fool On The Hill.mp3,7.04,M
Compilation Albums/The Beatles 1967–1970 (The Blue Album)/1-11 Magical Mystery Tour.mp3,6.62,M
Compilation Albums/The Beatles 1967–1970 (The Blue Album)/1-12 Lady Madonna.mp3,5.47,M
Compilation Albums/The Beatles 1967–1970 (The Blue Album)/1-13 Hey Jude.mp3,16.62,M
Compilation Albums/The Beatles 1967–1970 (The Blue Album)/1-14 Revolution.mp3,7.92,M
Compilation Albums/The Beatles 1967–1970 (The Blue Album)/2-01 Back In The U.S.S.R..mp3,6.49,M
Compilation Albums/The Beatles 1967–1970 (The Blue Album)/2-02 While My Guitar Gently Weeps.mp3,11.11,M
"Compilation Albums/The Beatles 1967–1970 (The Blue Album)/2-03 Ob-La-Di, Ob-La-Da.mp3",7.47,M
Compilation Albums/The Beatles 1967–1970 (The Blue Album)/2-04 Get Back.mp3,7.52,M
Compilation Albums/The Beatles 1967–1970 (The Blue Album)/2-05 Don't Let Me Down.mp3,8.4,M
Compilation Albums/The Beatles 1967–1970 (The Blue Album)/2-06 The Ballad Of John And Yoko.mp3,7.07,M
Compilation Albums/The Beatles 1967–1970 (The Blue Album)/2-07 Old Brown Shoe.mp3,7.84,M
Compilation Albums/The Beatles 1967–1970 (The Blue Album)/2-08 Here Comes The Sun.mp3,7.31,M
Compilation Albums/The Beatles 1967–1970 (The Blue Album)/2-09 Come Together.mp3,10.07,M
Compilation Albums/The Beatles 1967–1970 (The Blue Album)/2-10 Something.mp3,7.18,M
Compilation Albums/The Beatles 1967–1970 (The Blue Album)/2-11 Octopus's Garden.mp3,6.74,M
Compilation Albums/The Beatles 1967–1970 (The Blue Album)/2-12 Let It Be.mp3,9.03,M
Compilation Albums/The Beatles 1967–1970 (The Blue Album)/2-13 Across The Universe.mp3,8.93,M
Compilation Albums/The Beatles 1967–1970 (The Blue Album)/2-14 The Long and Winding Road.mp3,8.49,M
Studio Albums/A Hard Day's Night/3-01 A Hard Day's Night.mp3,6,M
Studio Albums/A Hard Day's Night/3-02 I Should Have Known Better.mp3,6.38,M
Studio Albums/A Hard Day's Night/3-03 If I Fell.mp3,5.48,M
Studio Albums/A Hard Day's Night/3-04 I'm Happy Just To Dance With Yo.mp3,4.59,M
Studio Albums/A Hard Day's Night/3-05 And I Love Her.mp3,5.87,M
Studio Albums/A Hard Day's Night/3-06 Tell Me Why.mp3,5.06,M
Studio Albums/A Hard Day's Night/3-07 Can't Buy Me Love.mp3,5.19,M
Studio Albums/A Hard Day's Night/3-08 Any Time At All.mp3,5.16,M
Studio Albums/A Hard Day's Night/3-09 I'll Cry Instead.mp3,4.2,M
Studio Albums/A Hard Day's Night/3-10 Things We Said Today.mp3,6.08,M
Studio Albums/A Hard Day's Night/3-11 When I Get Home.mp3,5.37,M
Studio Albums/A Hard Day's Night/3-12 You Can't Do That.mp3,6.06,M
Studio Albums/A Hard Day's Night/3-13 I'll Be Back.mp3,5.58,M
Studio Albums/Abbey Road/12-01 Come Together.mp3,10.08,M
Studio Albums/Abbey Road/12-02 Something.mp3,7.16,M
Studio Albums/Abbey Road/12-03 Maxwell's Silver Hammer.mp3,8.14,M
Studio Albums/Abbey Road/12-04 Oh! Darling.mp3,8.11,M
Studio Albums/Abbey Road/12-05 Octopus's Garden.mp3,6.72,M
Studio Albums/Abbey Road/12-06 I Want You (She's So Heavy).mp3,18.03,M
Studio Albums/Abbey Road/12-07 Here Comes The Sun.mp3,7.29,M
Studio Albums/Abbey Road/12-08 Because.mp3,6.53,M
Studio Albums/Abbey Road/12-09 You Never Give Me Your Money.mp3,9.48,M
Studio Albums/Abbey Road/12-10 Sun King.mp3,5.79,M
Studio Albums/Abbey Road/12-11 Mean Mr. Mustard.mp3,2.74,M
Studio Albums/Abbey Road/12-12 Polythene Pam.mp3,2.98,M
Studio Albums/Abbey Road/12-13 She Came In Through The Bathro.mp3,4.73,M
Studio Albums/Abbey Road/12-14 Golden Slumbers.mp3,3.71,M
Studio Albums/Abbey Road/12-15 Carry That Weight.mp3,3.89,M
Studio Albums/Abbey Road/12-16 The End.mp3,5.61,M
Studio Albums/Abbey Road/12-17 Her Majesty.mp3,1.12,M
Studio Albums/Beatles For Sale/4-01 No Reply.mp3,5.3,M
Studio Albums/Beatles For Sale/4-02 I'm A Loser.mp3,5.87,M
Studio Albums/Beatles For Sale/4-03 Baby's In Black.mp3,4.9,M
Studio Albums/Beatles For Sale/4-04 Rock And Roll Music.mp3,5.92,M
Studio Albums/Beatles For Sale/4-05 I'll Follow The Sun.mp3,4.3,M
Studio Albums/Beatles For Sale/4-06 Mr. Moonlight.mp3,6.2,M
Studio Albums/Beatles For Sale/4-07 Kansas City _ Hey-Hey-Hey-Hey!.mp3,6.18,M
Studio Albums/Beatles For Sale/4-08 Eight Days A Week.mp3,6.39,M
Studio Albums/Beatles For Sale/4-09 Words Of Love.mp3,4.89,M
Studio Albums/Beatles For Sale/4-10 Honey Don't.mp3,6.92,M
Studio Albums/Beatles For Sale/4-11 Every Little Thing.mp3,4.87,M
Studio Albums/Beatles For Sale/4-12 I Don't Want To Spoil The Party.mp3,6.04,M
Studio Albums/Beatles For Sale/4-13 What You're Doing.mp3,5.87,M
Studio Albums/Beatles For Sale/4-14 Everybody's Trying To Be My Baby.mp3,5.64,M
Studio Albums/Help!/5-01 Help!.mp3,5.37,M
Studio Albums/Help!/5-02 The Night Before.mp3,5.99,M
Studio Albums/Help!/5-03 You've Got To Hide Your Love Aw.mp3,5,M
Studio Albums/Help!/5-04 I Need You.mp3,5.75,M
Studio Albums/Help!/5-05 Another Girl.mp3,4.86,M
Studio Albums/Help!/5-06 You're Going To Lose That Girl.mp3,5.37,M
Studio Albums/Help!/5-07 Ticket To Ride.mp3,7.32,M
Studio Albums/Help!/5-08 Act Naturally.mp3,5.82,M
Studio Albums/Help!/5-09 It's Only Love.mp3,4.52,M
Studio Albums/Help!/5-10 You Like Me Too Much.mp3,6.06,M
Studio Albums/Help!/5-11 Tell Me What You See.mp3,6.11,M
Studio Albums/Help!/5-12 I've Just Seen A Face.mp3,4.85,M
Studio Albums/Help!/5-13 Yesterday.mp3,4.87,M
Studio Albums/Help!/5-14 Dizzy Miss Lizzy.mp3,6.74,M
Studio Albums/Let It Be/13-01 Two Of Us.mp3,8.36,M
Studio Albums/Let It Be/13-02 Dig A Pony.mp3,9.1,M
Studio Albums/Let It Be/13-03 Across The Universe.mp3,8.83,M
Studio Albums/Let It Be/13-04 I Me Mine.mp3,5.68,M
Studio Albums/Let It Be/13-05 Dig It.mp3,2.06,M
Studio Albums/Let It Be/13-06 Let It Be.mp3,9.4,M
Studio Albums/Let It Be/13-07 Maggie Mae.mp3,1.66,M
Studio Albums/Let It Be/13-08 I've Got A Feeling.mp3,8.43,M
Studio Albums/Let It Be/13-09 One After 909.mp3,6.77,M
Studio Albums/Let It Be/13-10 The Long And Winding Road.mp3,8.45,M
Studio Albums/Let It Be/13-11 For You Blue.mp3,5.94,M
Studio Albums/Let It Be/13-12 Get Back.mp3,7.28,M
Studio Albums/Magical Mystery Tour/9-01 Magical Mystery Tour.mp3,6.88,M
Studio Albums/Magical Mystery Tour/9-02 The Fool On The Hill.mp3,7.27,M
Studio Albums/Magical Mystery Tour/9-03 Flying.mp3,5.6,M
Studio Albums/Magical Mystery Tour/9-04 Blue Jay Way.mp3,9.4,M
Studio Albums/Magical Mystery Tour/9-05 Your Mother Should Know.mp3,6.09,M
Studio Albums/Magical Mystery Tour/9-06 I Am The Walrus.mp3,10.96,M
"Studio Albums/Magical Mystery Tour/9-07 Hello, Goodbye.mp3",8.4,M
Studio Albums/Magical Mystery Tour/9-08 Strawberry Fields Forever.mp3,9.87,M
Studio Albums/Magical Mystery Tour/9-09 Penny Lane.mp3,7.33,M
"Studio Albums/Magical Mystery Tour/9-10 Baby, You're A Rich Man.mp3",7.35,M
Studio Albums/Magical Mystery Tour/9-11 All You Need Is Love.mp3,9.15,M
Studio Albums/Please Please Me/1-01 I Saw Her Standing There.mp3,6.79,M
Studio Albums/Please Please Me/1-02 Misery.mp3,4.33,M
Studio Albums/Please Please Me/1-03 Anna (Go To Him).mp3,6.95,M
Studio Albums/Please Please Me/1-04 Chains.mp3,5.72,M
Studio Albums/Please Please Me/1-05 Boys.mp3,5.77,M
Studio Albums/Please Please Me/1-06 Ask Me Why.mp3,5.78,M
Studio Albums/Please Please Me/1-07 Please Please Me.mp3,4.8,M
Studio Albums/Please Please Me/1-08 Love Me Do.mp3,5.59,M
Studio Albums/Please Please Me/1-09 P.S. I Love You.mp3,4.93,M
Studio Albums/Please Please Me/1-10 Baby It's You.mp3,6.31,M
Studio Albums/Please Please Me/1-11 Do You Want To Know A Secret.mp3,4.65,M
Studio Albums/Please Please Me/1-12 A Taste Of Honey.mp3,4.9,M
Studio Albums/Please Please Me/1-13 There's A Place.mp3,4.4,M
Studio Albums/Please Please Me/1-14 Twist And Shout.mp3,6.03,M
Studio Albums/Revolver/7-01 Taxman.mp3,6.22,M
Studio Albums/Revolver/7-02 Eleanor Rigby.mp3,5.03,M
Studio Albums/Revolver/7-03 I'm Only Sleeping.mp3,7.08,M
Studio Albums/Revolver/7-04 Love You To.mp3,7.06,M
"Studio Albums/Revolver/7-05 Here, There And Everywhere.mp3",5.73,M
Studio Albums/Revolver/7-06 Yellow Submarine.mp3,6.26,M
Studio Albums/Revolver/7-07 She Said She Said.mp3,6.16,M
Studio Albums/Revolver/7-08 Good Day Sunshine.mp3,5.14,M
Studio Albums/Revolver/7-09 And Your Bird Can Sing.mp3,4.8,M
Studio Albums/Revolver/7-10 For No One.mp3,4.77,M
Studio Albums/Revolver/7-11 Doctor Robert.mp3,5.32,M
Studio Albums/Revolver/7-12 I Want To Tell You.mp3,5.85,M
Studio Albums/Revolver/7-13 Got To Get You Into My Life.mp3,5.9,M
Studio Albums/Revolver/7-14 Tomorrow Never Knows.mp3,6.98,M
Studio Albums/Rubber Soul/6-01 Drive My Car.mp3,5.81,M
Studio Albums/Rubber Soul/6-02 Norwegian Wood (This Bird Has F.mp3,4.92,M
Studio Albums/Rubber Soul/6-03 You Won't See Me.mp3,7.79,M
Studio Albums/Rubber Soul/6-04 Nowhere Man.mp3,6.41,M
Studio Albums/Rubber Soul/6-05 Think For Yourself.mp3,5.45,M
Studio Albums/Rubber Soul/6-06 The Word.mp3,6.39,M
Studio Albums/Rubber Soul/6-07 Michelle.mp3,6.36,M
Studio Albums/Rubber Soul/6-08 What Goes On.mp3,6.6,M
Studio Albums/Rubber Soul/6-09 Girl.mp3,5.96,M
Studio Albums/Rubber Soul/6-10 I'm Looking Through You.mp3,5.75,M
Studio Albums/Rubber Soul/6-11 In My Life.mp3,5.75,M
Studio Albums/Rubber Soul/6-12 Wait.mp3,5.31,M
Studio Albums/Rubber Soul/6-13 If I Needed Someone.mp3,5.59,M
Studio Albums/Rubber Soul/6-14 Run For Your Life.mp3,5.47,M
Studio Albums/Sgt. Pepper's Lonely Hearts Club Band/8-01 Sgt. Pepper's Lonely Hearts Clu.mp3,4.93,M
Studio Albums/Sgt. Pepper's Lonely Hearts Club Band/8-02 With A Little Help From My Frie.mp3,6.54,M
Studio Albums/Sgt. Pepper's Lonely Hearts Club Band/8-03 Lucy In The Sky With Diamonds.mp3,8.23,M
Studio Albums/Sgt. Pepper's Lonely Hearts Club Band/8-04 Getting Better.mp3,6.69,M
Studio Albums/Sgt. Pepper's Lonely Hearts Club Band/8-05 Fixing A Hole.mp3,6.26,M
Studio Albums/Sgt. Pepper's Lonely Hearts Club Band/8-06 She's Leaving Home.mp3,8.49,M
Studio Albums/Sgt. Pepper's Lonely Hearts Club Band/8-07 Being For The Benefit Of Mr. Ki.mp3,6.29,M
Studio Albums/Sgt. Pepper's Lonely Hearts Club Band/8-08 Within You Without You.mp3,11.9,M
Studio Albums/Sgt. Pepper's Lonely Hearts Club Band/8-09 When I'm Sixty-Four.mp3,6.29,M
Studio Albums/Sgt. Pepper's Lonely Hearts Club Band/8-10 Lovely Rita.mp3,6.46,M
Studio Albums/Sgt. Pepper's Lonely Hearts Club Band/8-11 Good Morning Good Morning.mp3,6.43,M
Studio Albums/Sgt. Pepper's Lonely Hearts Club Band/8-12 Sgt. Pepper's Lonely Hearts Clu.mp3,3.29,M
Studio Albums/Sgt. Pepper's Lonely Hearts Club Band/8-13 A Day In The Life.mp3,13.07,M
Studio Albums/The Beatles (White Album)/10-01 Back In The U.S.S.R..mp3,6.22,M
Studio Albums/The Beatles (White Album)/10-02 Dear Prudence.mp3,9.02,M
Studio Albums/The Beatles (White Album)/10-03 Glass Onion.mp3,5.28,M
"Studio Albums/The Beatles (White Album)/10-04 Ob-La-Di, Ob-La-Da.mp3",7.23,M
Studio Albums/The Beatles (White Album)/10-05 Wild Honey Pie.mp3,2.05,M
Studio Albums/The Beatles (White Album)/10-06 The Continuing Story Of Bungalow Bill.mp3,7.43,M
Studio Albums/The Beatles (White Album)/10-07 While My Guitar Gently Weeps.mp3,10.9,M
Studio Albums/The Beatles (White Album)/10-08 Happiness Is A Warm Gun.mp3,6.3,M
Studio Albums/The Beatles (White Album)/10-09 Martha My Dear.mp3,5.69,M
Studio Albums/The Beatles (White Album)/10-10 I'm So Tired.mp3,4.74,M
Studio Albums/The Beatles (White Album)/10-11 Blackbird.mp3,5.3,M
Studio Albums/The Beatles (White Album)/10-12 Piggies.mp3,4.77,M
Studio Albums/The Beatles (White Album)/10-13 Rocky Raccoon.mp3,8.15,M
Studio Albums/The Beatles (White Album)/10-14 Don't Pass Me By.mp3,8.82,M
Studio Albums/The Beatles (White Album)/10-15 Why Don't We Do It In The Road.mp3,3.88,M
Studio Albums/The Beatles (White Album)/10-16 I Will.mp3,4.07,M
Studio Albums/The Beatles (White Album)/10-17 Julia.mp3,6.69,M
Studio Albums/The Beatles (White Album)/10-18 Birthday.mp3,6.21,M
Studio Albums/The Beatles (White Album)/10-19 Yer Blues.mp3,9.2,M
Studio Albums/The Beatles (White Album)/10-20 Mother Nature's Son.mp3,6.44,M
Studio Albums/The Beatles (White Album)/10-21 Everybody's Got Something To Hide Except Me And My Monkey.mp3,5.55,M
Studio Albums/The Beatles (White Album)/10-22 Sexy Sadie.mp3,7.47,M
Studio Albums/The Beatles (White Album)/10-23 Helter Skelter.mp3,10.32,M
"Studio Albums/The Beatles (White Album)/10-24 Long, Long, Long.mp3",7.13,M
Studio Albums/The Beatles (White Album)/10-25 Revolution 1.mp3,9.78,M
Studio Albums/The Beatles (White Album)/10-26 Honey Pie.mp3,6.17,M
Studio Albums/The Beatles (White Album)/10-27 Savoy Truffle.mp3,6.68,M
Studio Albums/The Beatles (White Album)/10-28 Cry Baby Cry.mp3,6.97,M
Studio Albums/The Beatles (White Album)/10-29 Revolution 9.mp3,19.18,M
Studio Albums/The Beatles (White Album)/10-30 Good Night.mp3,7.34,M
Studio Albums/With The Beatles/2-01 It Won't Be Long.mp3,5.13,M
Studio Albums/With The Beatles/2-02 All I've Got To Do.mp3,4.75,M
Studio Albums/With The Beatles/2-03 All My Loving.mp3,4.95,M
Studio Albums/With The Beatles/2-04 Don't Bother Me.mp3,5.73,M
Studio Albums/With The Beatles/2-05 Little Child.mp3,4.14,M
Studio Albums/With The Beatles/2-06 Till There Was You.mp3,5.17,M
Studio Albums/With The Beatles/2-07 Please Mister Postman.mp3,5.96,M
Studio Albums/With The Beatles/2-08 Roll Over Beethoven.mp3,6.39,M
Studio Albums/With The Beatles/2-09 Hold Me Tight.mp3,5.87,M
Studio Albums/With The Beatles/2-10 You Really Got A Hold On Me.mp3,6.99,M
Studio Albums/With The Beatles/2-11 I Wanna Be Your Man.mp3,4.64,M
Studio Albums/With The Beatles/2-12 Devil In Her Heart.mp3,5.65,M
Studio Albums/With The Beatles/2-13 Not A Second Time.mp3,4.92,M
Studio Albums/With The Beatles/2-14 Money (That's What I Want).mp3,6.47,M
Studio Albums/Yellow Submarine/11-01 Yellow Submarine.mp3,6.24,M
Studio Albums/Yellow Submarine/11-02 Only A Northern Song.mp3,7.99,M
Studio Albums/Yellow Submarine/11-03 All Together Now.mp3,5.18,M
Studio Albums/Yellow Submarine/11-04 Hey Bulldog.mp3,7.49,M
Studio Albums/Yellow Submarine/11-05 It's All Too Much.mp3,14.88,M
Studio Albums/Yellow Submarine/11-06 All You Need Is Love.mp3,9.01,M
Studio Albums/Yellow Submarine/11-07 Pepperland.mp3,5.56,M
Studio Albums/Yellow Submarine/11-08 Sea Of Time.mp3,7.06,M
Studio Albums/Yellow Submarine/11-09 Sea Of Holes.mp3,5.4,M
Studio Albums/Yellow Submarine/11-10 Sea Of Monsters.mp3,8.46,M
Studio Albums/Yellow Submarine/11-11 March Of The Meanies.mp3,5.51,M
Studio Albums/Yellow Submarine/11-12 Pepperland Laid Waste.mp3,5.26,M
Studio Albums/Yellow Submarine/11-13 Yellow Submarine In Pepperland.mp3,5.23,M
The Beatles.png,86.87,K
