User Type,Username,Date,Text
,Blaster63,2011-06-24T23:46Z,"Fyfan vilken skitfilm,inte ens värt att kalla B film"
,CeAxayacatl,2011-06-25T02:52Z,Dude we need spanish subtitles please! :)
,bander49,2011-06-25T03:30Z,Når amerikanere prøver og lage film om viking guder men ikke engang klarer og uttale navnene riktig på disse er filmen dømt til å mislykkes
,DarkWolfDK,2011-07-30T18:08Z,"DO NOT DOWNLOAD.
This is NOT the Movie ""Thor"".
This movie is a low budget crap movie.
Waste of time!
Odin is played by a wrestler that should never have started acting.
Please remove this CRAP!

But to be fair to uploader.
Quality and sound are good thou."
