User Type,Username,Date,Text
,Jeanrt,2011-08-23T16:56Z,Thank you very much F1 :)
[V],bigbluesea,2011-08-23T17:57Z,"Good going F1

I searched for this book and couldn't find it. :)"
,Jeanrt,2011-08-23T18:10Z,"Thank you also Bigbluesea for your help :)
What I'm realy looking is something more like in that choice of books on that link:
http://www.amazon.com/PreFab-Now-James-Grayson-Trulove/dp/0061149888/ref=pd_sim_b_4
F1 and BigBluesea: Have a wonderful day both of you!"
[V],_F1_,2011-08-23T19:57Z,"Hey there BBS ...
Glad to have your comment partner.

@Jeanrt: Consider us both same as long as you're in need. Me or BBS doesn't really matter. However; I'll try for your mentioned. Meanwhile I'm gonna post few more on prefab. Keep an eye ..."
,Jeanrt,2011-08-23T20:38Z,WOW you are wonderful friend!!! So nice from you. Thank you so much. 
