User Type,Username,Date,Text
,mmosakuji,2011-08-21T18:02Z,Anyone confirm if this is real?
[V],neil1966hardy,2011-08-22T19:04Z,Many thanks my friend!
,Delia_XX,2011-08-22T20:31Z,"Thanks!
V:8
A:10"
,xShadyImagex,2011-08-23T08:58Z,"So, how's the movie? Has anyone watched it yet? I just watched the trailer for it on youtube... Looks interesting.. I kinda want some opinions before I download it though... Ty"
,ashen77,2011-08-23T10:10Z,"^^ errr, form you own ones maybe? Its OK, your allowed."
,camo12345,2011-08-30T05:59Z,"It's got that black guy in (whose name I dont know), but I've seen him in loads of movies and he's cool so i'll download and let everyone know if the film is good or not :)"
