Filename,Size,Unit
Will There Be Enough Water (Live from The Roxy).mp3,6.98,M
Their Oral History and Future Plans.mp3,6.13,M
60 Feet Tall (@ Sesiones).mp3,5.56,M
I Can't Hear You (Live from Third Man Records).mp3,4.99,M
Old Mary (Live from Third Man Records).mp3,3.9,M
Hang You From The Heavens (Live from Third Man Records) .mp3,3.43,M
Hustle and Cuss (Live from Third Man Records).mp3,3.37,M
Blue Blood Blues (Live from Third Man Records).mp3,3.16,M
Die By The Drop (Live from Third Man Records).mp3,3.14,M
The Difference Between Us (Live from Third Man Records).mp3,3.13,M
I'm Mad (Live from Third Man Records).mp3,2.73,M
Jawbreaker (Live at Third Man Records).mp3,2.55,M
Looking At The Invisible Man (Live from Third Man Records).mp3,2.49,M
Gasoline  (Live at Third Man Records).mp3,2.43,M
No Horse (Live from Third Man Records).mp3,2.43,M
Intro.mp3,2.08,M
Album Art.jpg,142.84,K
