Filename,Size,Unit
Aux dernières nouvelles/01 Je recherche.wma,3.43,M
Aux dernières nouvelles/02 L'angle droit.wma,3.24,M
Aux dernières nouvelles/03 Je ne t'aime plus.wma,3.06,M
Aux dernières nouvelles/04 Aux dernières nouvelles.wma,3.38,M
Aux dernières nouvelles/05 Mon ange.wma,3,M
Aux dernières nouvelles/06 Camarades.wma,3.08,M
Aux dernières nouvelles/07 Avant de dormir.wma,2.67,M
Aux dernières nouvelles/08 Entre autre.wma,2.47,M
Aux dernières nouvelles/09 Aide moi.wma,3.63,M
Aux dernières nouvelles/10 Entre Parenthèses.wma,2.67,M
Aux dernières nouvelles/11 Ne change rien.wma,3.41,M
