Filename,Size,Unit
01. EDDY GRANT  -  Baby Come Back  (1985).VOB,184,M
02. OPUS  -  Live is Life  (1985).VOB,273.38,M
"_____padding_file_0_if you see this file, please update to BitComet 0.85 or above____",128,K
HISTORY OF POP AND ROCK MUSIC.doc,665.5,K
"_____padding_file_1_if you see this file, please update to BitComet 0.85 or above____",102.5,K
Torrent downloaded from Demonoid.me.txt,46,B
"_____padding_file_2_if you see this file, please update to BitComet 0.85 or above____",255.96,K
info 342.txt,1.65,K
