User Type,Username,Date,Text
,Tamar81,2011-01-21T13:08Z,Ik heb echt veel respect voor jullie werk maar die TS en cams mogen van mij wel geschrapt worden...word steeds meer beetje zonde van de moeite
,Flazhp0intX,2011-01-21T15:36Z,"Daar sluit ik mij bij aan, Tamar81."
,wiedeler,2011-01-22T00:09Z,"ik weet niet waar jullie twee het over hebben dit is gewoon goede shizzle wil je nieuwe film in hd kwaliteit kijken koop je toch lekker een kaartje voor de bios en maar klagen en klagen

A:7,5
V:7,5

keep up the good work thanks"
,123neerhalen,2011-01-23T12:54Z,Opbouwende kritiek word tegenwoordig niet meer gewaardeerd
,zottereu,2011-02-04T13:34Z,"Kennelijk is het woordje cam erg moeizaam te typen. Gebeurd erg vaak bij jullie luitjes en werkelijk zonde van je tijd om deze bagger op het internet te strooien, geheel met de andere kritiek eens.

Beeld  - 1
Geluid - 3

En ja, een kaartje voor de bios koop ik ook nog geregeld.
Evengoed complimenten voor de ondertiteling.
En nogmaals, schrijf gewoon het woordje CAM er bij als het zo is, wel zo netjes. En geen TS Shizzle of meer van deze nonsens."
,zottereu,2011-02-04T13:37Z,"Kennelijk is het woordje cam erg moeizaam te typen. Gebeurd erg vaak bij jullie luitjes en werkelijk zonde van je tijd om deze bagger op het internet te strooien, geheel met de andere kritiek eens.

Beeld  - 1
Geluid - 3

En ja, een kaartje voor de bios koop ik ook nog geregeld."
,j3ll3,2011-02-16T20:46Z,thanks for the download :) you guys are to good
