Filename,Size,Unit
A Wonderful World/01 Exactly Like You.mp3,5.17,M
A Wonderful World/02 La Vie En Rose.mp3,5.61,M
A Wonderful World/03 I'm Confessin' (That I Love You).mp3,7.69,M
A Wonderful World/04 You Can Depend On Me.mp3,4.81,M
A Wonderful World/05 What A Wonderful World.mp3,5.13,M
A Wonderful World/06 That's My Home.mp3,4.68,M
A Wonderful World/07 A Kiss To Build A Dream On.mp3,5.18,M
A Wonderful World/08 I Wonder.mp3,6.12,M
A Wonderful World/09 Dream A Little Dream Of Me.mp3,5.98,M
A Wonderful World/10 You Can't Lose A Broken Heart.mp3,5.25,M
A Wonderful World/11 That Lucky Old Sun (Just Rolls Ar.mp3,6.85,M
A Wonderful World/12 If We Never Meet Again.mp3,5.97,M
Absolute Torch and Twang/01 Luck In My Eyes.mp3,9.64,M
Absolute Torch and Twang/02 Three Days.mp3,7.56,M
Absolute Torch and Twang/03 Trail Of Broken Hearts.mp3,7.87,M
Absolute Torch and Twang/04 Big Boned Gal.mp3,7.24,M
Absolute Torch and Twang/05 Didn't I.mp3,8.42,M
Absolute Torch and Twang/06 Walflower Waltz.mp3,10.08,M
Absolute Torch and Twang/07 Full Moon Full Of Love.mp3,6.5,M
Absolute Torch and Twang/08 Pullin' Back The Reins.mp3,10.09,M
Absolute Torch and Twang/09 Big Big Love.mp3,5.72,M
Absolute Torch and Twang/10 It's Me.mp3,5.37,M
Absolute Torch and Twang/11 Walkin' In And Out Of Your Arm.mp3,7.09,M
Absolute Torch and Twang/12 Nowhere To Stand.mp3,10.2,M
All You Can Eat/01 If I Were You.mp3,9.12,M
All You Can Eat/02 Maybe.mp3,9.59,M
All You Can Eat/03 You're OK.mp3,7.02,M
All You Can Eat/04 Sexuality.mp3,7.82,M
All You Can Eat/05 Get Some.mp3,8.3,M
All You Can Eat/06 Acquiesce.mp3,8.07,M
All You Can Eat/07 This.mp3,9.26,M
All You Can Eat/08 World Of Love.mp3,8.59,M
All You Can Eat/09 Infinite And Unforeseen.mp3,6.77,M
All You Can Eat/10 I Want It All.mp3,8.4,M
Angel With A Lariat/01 Turn Me Round.mp3,6.3,M
Angel With A Lariat/02 High Time For a Detour.mp3,8,M
Angel With A Lariat/03 Diet of Strange Places.mp3,7.12,M
Angel With A Lariat/04 Got the Bull By the Horns.mp3,5.47,M
Angel With A Lariat/05 Watch Your Step Polka.mp3,4.1,M
Angel With A Lariat/06 Rose Garden.mp3,6.48,M
Angel With A Lariat/07 Tune Into My Wave.mp3,7.49,M
Angel With A Lariat/08 Angel With a Lariat.mp3,5.74,M
Angel With A Lariat/09 Pay Dirt.mp3,4.22,M
Angel With A Lariat/10 Three Cigarettes In An Ashtray.mp3,4.48,M
Drag/01 Don't Smoke In Bed.mp3,6.18,M
Drag/02 The Air That I Breathe.mp3,10.98,M
Drag/03 Smoke Dreams.mp3,7.01,M
Drag/04 My Last Cigarette.mp3,7.62,M
Drag/05 The Joker.mp3,8.77,M
Drag/06 Theme From ''The Valley Of The Do.mp3,5.59,M
Drag/07 Your Smoke Screen.mp3,4.6,M
Drag/08 My Old Addiction.mp3,12.3,M
Drag/09 Till The Heart Caves In.mp3,6.43,M
Drag/10 Smoke Rings.mp3,6.65,M
Drag/11 Hain't It Funny.mp3,11.74,M
Drag/12 Love Is Like A Cigarette.mp3,8.74,M
Even Cowgirls Get the Blues/01 Just Keep Me Moving.mp3,7.25,M
Even Cowgirls Get the Blues/02 Much Finer Place.mp3,1.62,M
Even Cowgirls Get the Blues/03 Or Was I.mp3,5.79,M
Even Cowgirls Get the Blues/04 Hush Sweet Lover.mp3,7.57,M
Even Cowgirls Get the Blues/05 Myth.mp3,7.62,M
Even Cowgirls Get the Blues/06 Apogee.mp3,1.17,M
Even Cowgirls Get the Blues/07 Virtual Vortex.mp3,1.38,M
Even Cowgirls Get the Blues/08 Lifted By Love.mp3,5.63,M
Even Cowgirls Get the Blues/09 Overture.mp3,3.83,M
Even Cowgirls Get the Blues/10 Kundalini Yoga Waltz.mp3,2.08,M
Even Cowgirls Get the Blues/11 In Perfect Dreams.mp3,5.79,M
Even Cowgirls Get the Blues/12 Curious Soul Astray.mp3,6.77,M
Even Cowgirls Get the Blues/13 Ride Of Bonanza Jellybean.mp3,3.29,M
Even Cowgirls Get the Blues/14 Don't Be A Lemming Polka.mp3,4.26,M
Even Cowgirls Get the Blues/15 Sweet Little Cherokee.mp3,5.17,M
Even Cowgirls Get the Blues/16 Cowgirl Pride.mp3,3.29,M
Hymns Of The 49th Parallel/01 After the Gold Rush.mp3,9.34,M
Hymns Of The 49th Parallel/02 Simple.mp3,6.28,M
Hymns Of The 49th Parallel/03 Helpless.mp3,9.76,M
Hymns Of The 49th Parallel/04 A Case of You.mp3,11.89,M
Hymns Of The 49th Parallel/05 The Valley.mp3,12.64,M
Hymns Of The 49th Parallel/06 Hallelujah.mp3,11.51,M
Hymns Of The 49th Parallel/07 One Day I Walk.mp3,7.84,M
Hymns Of The 49th Parallel/08 Fallen.mp3,6.74,M
Hymns Of The 49th Parallel/09 Jericho.mp3,8.61,M
Hymns Of The 49th Parallel/10 Bird on a Wire.mp3,10.27,M
Hymns Of The 49th Parallel/11 Love Is Everything.mp3,13.11,M
Hymns Of The 49th Parallel/12 Help Me.mp3,8.48,M
Ingenue/01 Save Me.mp3,7.42,M
Ingenue/02 The Mind Of Love.mp3,6.9,M
Ingenue/03 Miss Chatelaine.mp3,6.99,M
Ingenue/04 Wash Me Clean.mp3,5.35,M
Ingenue/05 So It Shall Be.mp3,8.04,M
Ingenue/06 Still Thrives This Love.mp3,6.47,M
Ingenue/07 Season Of Hollow Soul.mp3,8.96,M
Ingenue/08 Outside Myself.mp3,8.96,M
Ingenue/09 Tears Of Love's Recall.mp3,6.49,M
Ingenue/10 Constant Craving.mp3,9.16,M
Invincible Summer/01 Consequences Of Falling.mp3,7.13,M
Invincible Summer/02 Summer Fling.mp3,7.85,M
Invincible Summer/03 Suddenly.mp3,6.52,M
Invincible Summer/04 It's Happening With You.mp3,5.19,M
Invincible Summer/05 Extraordinary Thing.mp3,6.61,M
Invincible Summer/06 Love's Great Ocean.mp3,10.45,M
Invincible Summer/07 Simple.mp3,5.05,M
Invincible Summer/08 What Better Said.mp3,6.97,M
Invincible Summer/09 When We Collide.mp3,8.06,M
Invincible Summer/10 Curiosity.mp3,6.79,M
Invincible Summer/11 Only Love.mp3,7.13,M
Reintarnation/12 Friday Dance Promenade.mp3,3.2,M
Reintarnation/15 Pine and Stew.mp3,4.46,M
Reintarnation/16 Hanky Panky.mp3,2.73,M
Reintarnation/19 Changed My Mind.mp3,3.79,M
Shadowland/01 Western Stars.mp3,4.18,M
Shadowland/02 Lock Stock & Teardrops.mp3,4.81,M
Shadowland/03 Sugar Moon.mp3,3.37,M
Shadowland/04 I Wish I Didn't Love You So.mp3,4.3,M
Shadowland/05 (Waltz Me) Once Again Around the.mp3,3.59,M
Shadowland/06 Black Coffee.mp3,4.54,M
Shadowland/07 Shadowland.mp3,3.42,M
Shadowland/08 Don't Let the Stars Get in Your E.mp3,3.25,M
Shadowland/09 Tears Don't Care Who Cries Them.mp3,4.21,M
Shadowland/10 I'm Down to My Last Cigarette.mp3,3.84,M
Shadowland/11 Busy Being Blue.mp3,5.07,M
Shadowland/12 Honky Tonk Angels' Medley.mp3,4.05,M
Sing It Loud/01 I Confess.mp3,8.83,M
Sing It Loud/02 A Sleep With No Dreaming.mp3,6.39,M
Sing It Loud/03 The Water's Edge.mp3,7.18,M
Sing It Loud/04 Perfect Word.mp3,9.02,M
Sing It Loud/05 Sugar Buzz.mp3,10.57,M
Sing It Loud/06 Sing It Loud.mp3,9.86,M
Sing It Loud/07 Inglewood.mp3,6.25,M
Sing It Loud/08 Habit Of Mind.mp3,8.29,M
Sing It Loud/09 Heaven.mp3,7.47,M
Sing It Loud/10 Sorrow Nevermore.mp3,6.84,M
Sing It Loud/11 Reminiscing.mp3,7.36,M
Sing It Loud/12 I Am The Winner.mp3,4.48,M
Sing It Loud/13 Hollywood Kids.mp3,7.09,M
Sing It Loud/14 Hungry Bird.mp3,8.09,M
Watershed/01 I Dream of Spring.mp3,9.2,M
Watershed/02 Je Fails La Planche.mp3,6.56,M
Watershed/03 Coming Home.mp3,7.87,M
Watershed/04 Once In a While.mp3,7.93,M
Watershed/05 Thread.mp3,8.33,M
Watershed/06 Close Your Eyes.mp3,10.17,M
Watershed/07 Sunday.mp3,9.81,M
Watershed/08 Flame of the Uninspired.mp3,8.02,M
Watershed/09 Upstream.mp3,8.29,M
Watershed/10 Shadow And the Frame.mp3,7.17,M
Watershed/11 Jealous Dog.mp3,5.82,M
Watershed/12 I Dream of Spring (Live).mp3,8.62,M
Watershed/13 Wash Me Clean (Live).mp3,9.58,M
Watershed/14 The Valley (Live).mp3,14.57,M
Watershed/15 Hallelujah (Live).mp3,12.26,M
