User Type,Username,Date,Text
,0742sheff,2011-07-27T06:21Z,"One of the better cam jobs i have seen

A: 4  (the constant flapping noise is irritating)
V: 7  Pretty good actually. Better than most cam jobs. "
,BrigadierGeneral,2011-08-01T15:06Z,"Excellent job Froggie, havent checked it yet, but Erdna vid with better audio allready makes this the best TS up to date on Captain America :D"
,jbornot,2011-08-04T06:13Z,"Great quality, awesome work. Thanks a lot"
,illanius,2011-08-06T00:49Z,I just made an account to say wtf ? something must be wrong with your head!
,murrayzmint,2011-09-08T12:17Z,"Fast download (for my broadband, at least).
Checked through the movie and...
Sound is fine and in sync.
Picture is good.

Thank you froggie100. :-)"
