User Type,Username,Date,Text
,chengisao,2011-10-11T18:30Z,thank you (as always!)
[T],shemyaza,2011-10-12T01:49Z,"Enjoy NZ, It's all yours. Well done..."
,seedbag,2011-10-12T10:34Z,"@shemyaza wish that were true bro, but wales and the wobbilies are both very good teams and AB are onto there 3rd 5/8 . Hard luck to the Bokkee getting Bryce Lawrence but u guys did have plenty of opportunity, need more attacking rugby in currie cup and super rugby teams to get that clinical execution."
[T],shemyaza,2011-10-14T23:23Z,"I hope the ABs kick the living snot out of Pocunt...

What? Me, bitter?

BOKKE!!!"
