User Type,Username,Date,Text
,SoftWarez,2011-07-29T16:20Z,thanks :)
,jiakai_ln,2011-07-31T07:16Z,i got a error while sync
,Th3_Raging_Bull,2011-08-07T08:57Z,"Me too, coundnt be sync'd to ipod :/"
,TPB_helper,2011-08-07T18:25Z,"@jiakai_ln @Th3_Raging_Bull 
you need AppSync installed on your iDevice for your firmware"
,ahmadfarooq90,2011-08-10T07:28Z,"Hi ! Cn somone help, my ipod touch 2g's wifi isnt working, but i have jail broke it, is there any way i can install appsync or installous in it through my pc so i cud install these games??? plz help."
,Lufcdom,2011-09-01T15:48Z,Works Fine With Iphone :)
,buyitpc,2011-09-06T09:09Z,"Downloaded, but doesn't work in my iPhone... did I miss a step?"
,ithelpstodream,2011-10-17T18:13Z,@ all who are having problems. Your iDevice has to be jailbroken..
,wwestuntguy,2011-12-12T20:57Z,Guys you have to be jailbroken and have appsync
