Filename,Size,Unit
Mixtape/15 Reality Czech.mp3,10.83,M
"Mixtape/08 No Cat Can Fuck With ft. Reef The Lost Cause, Chase & Traen.mp3",8.81,M
Happy As Larry EP/07 Never Afraid ft. Chase.mp3,8.66,M
Mixtape/03 We Aint Famous.mp3,8.35,M
Mixtape/02 Save Your Breath.mp3,8.31,M
Happy As Larry EP/06 Walk Away ft. Kimberley Hale.mp3,7.36,M
Mixtape/05 Body Disposal.mp3,7.33,M
Mixtape/10 Never Be Love.mp3,7.33,M
Mixtape/01 You Know I'm A Monster.mp3,7.25,M
Happy As Larry EP/02 Do Ya Feel.mp3,7.03,M
Happy As Larry EP/04 Cheap Wine.mp3,6.99,M
Mixtape/07 Get Ya' Happy Face On.mp3,6.97,M
Mixtape/12 Circus Freaks.mp3,6.9,M
Mixtape/06 Secrets.mp3,6.87,M
Happy As Larry EP/01 Slamstonian.mp3,6.64,M
Happy As Larry EP/05 Got Pulled Over.mp3,6.48,M
Mixtape/11 Blood Pressure.mp3,5.88,M
Mixtape/04 Just One Thing ft. Chase & Hunter.mp3,5.72,M
Mixtape/14 Your Soul Is Mine.mp3,5.58,M
Happy As Larry EP/03 Johny Player ft. Eager.mp3,5.04,M
Mixtape/13 Natural Born Illa.mp3,4.44,M
Mixtape/09 Never Back Down.mp3,4.32,M
Mixtape/16 All In Check.mp3,2.04,M
Mixtape/Art.jpg,75.25,K
Happy As Larry EP/Art.jpg,45.33,K
Happy As Larry EP/Folder.jpg,24.6,K
Mixtape/Folder.jpg,23.56,K
Happy As Larry EP/AlbumArtSmall.jpg,8.16,K
Mixtape/AlbumArtSmall.jpg,6.76,K
desktop.ini,44,B
Mixtape/desktop.ini,43,B
Happy As Larry EP/desktop.ini,43,B
