User Type,Username,Date,Text
[T],liluser,2010-12-16T18:15Z,loads of people stuck on 31.1 %
,braduz,2010-12-16T20:35Z,im trying my best to seed!!
,braduz,2010-12-16T23:29Z,tadaaaaaa
,SilverKat08,2010-12-25T02:43Z,What are the chances of getting a 2.0 update for the game?
,braduz,2010-12-26T13:04Z,http://www.landwirtschafts-simulator.de/fs2011Update.php    theres the 2.1 update
,CDObs,2011-02-12T18:26Z,were can i find the mods folder braduz?
,braduz,2011-02-14T04:07Z,my games then farming simulator should be a folder called mods jsut extract them into there if thats what u mean? 
,galskap20,2011-07-15T18:55Z,you find it on Dokuments/My games/farming simulator 2011/mods folder try it! :-)
,mihailoaleksica97,2012-01-30T23:04Z,whether viruses ????
