User Type,Username,Date,Text
,Sirbyronjoseph,2011-02-02T14:16Z,Thank you! I live in Canada and can't watch this. :)
,Ladyday,2011-02-02T18:59Z,I was hoping you'd upload RPDR again! Blessings from the UK!!xx
,GhettoDiva,2011-08-25T19:31Z,Blessing from Oman...I could have never watched this show if it wasn't coz of torrents! LOVVEEE!
,GhettoDiva,2011-08-25T19:32Z,"Blessing from Oman! :D Loves,Hugs and Kisses!"
,MStarx,2011-09-16T02:10Z,"This is the Casting Extravaganza AND Episode 2.. The Queen Who Mopped X-Mas.

I was trying to sort them all out using imdb.com and an episode was missing. Cos E01 is E01+E02 :)"
