User Type,Username,Date,Text
[V],GoodFilms,2010-12-26T22:25Z,NOTE that that quality is much better than the previous HDTV torrents...
[T],insinuendo,2010-12-26T23:23Z,Goodjob Goodfilms!
,thegr8luiz,2011-06-28T02:21Z,Thank you very much for your time and effort to share this with us.
,dsorc,2011-07-06T18:49Z,"Video quality is great.
The first half has the Russian audio stream as default. (minor annoyance)

The season was dreadful."
,netsurfz,2011-07-28T16:11Z,"Got to say that this is the best quality rip for True Blood Season 2.

Thanks!"
,deonlr,2011-09-03T12:23Z,"Excellent Video, but beware the English audio is only in stereo."
,deonlr,2011-09-03T12:37Z,"Excellent video, but beware the English audio is only in stereo"
,alabugho,2011-12-05T16:25Z,"What the hell, its in russian??  Is there a way to change that?"
,alabugho,2011-12-05T16:45Z,"I couldn't change the audio track in windows media player so I had to download VLC.  All better, thanks!"
,Great_Stillness,2011-12-10T17:56Z,Cheers dude.
,bona73,2012-06-27T00:40Z,"need help... took day and a half to up:) now VLC can't open and stops working, media player has no sound and Vuze player is in Russian?...has anybody had this problems/."
,bona73,2012-06-28T12:31Z,figured it out in the vuze audio.... a9 / v9
