User Type,Username,Date,Text
[V],merzedes,2011-05-27T17:11Z,"There is enough inf in the description to not download if you not like it.....anybody dont have to dowload all my torrents so i will upload some more from this site ,so deside to download if you want it and don`t complain after :-) Cheerz "
,jack_williams,2011-05-27T19:13Z,WOW another Naked Kombat torrent!! PERFECT ... I really appreciate it & Thank u ALOT! :D
,car1990,2011-05-27T19:14Z,"Any Boundgods movies?

thanks"
[V],merzedes,2011-05-27T21:17Z,"""car1990"" I have found some from 'BoundGods' is there any spesial you want because i cant upload from all the site on the WWW. Cheerz :-) Or send me one mail and i give you a site you can find them :-)"
,java01,2011-05-28T02:56Z,merzedes whats the site?!
,fatmick,2011-05-28T04:29Z,Thanks Merzedes. Good to see your uploading lots of variety. Don't listen to the complainers :)
,justaptjeff,2011-05-28T07:11Z,Great clip. More bi or gay bdsm would be apprieciated. Keep up the good work!
,jack_williams,2011-06-04T23:33Z,please upload some more NAKED KOMBAT! please
