Filename,Size,Unit
Gregg Rolie-1985 Gregg Rolie/02. Close My Eyes.mp3,10.4,M
Gregg Rolie-1985 Gregg Rolie/10. Deep Blue Sea.mp3,9.97,M
Gregg Rolie-1985 Gregg Rolie/08. Marianne.mp3,9.45,M
Gregg Rolie-1985 Gregg Rolie/01. Young Love.mp3,9.43,M
Gregg Rolie-1985 Gregg Rolie/07. Zap Me.mp3,9.35,M
Gregg Rolie-1985 Gregg Rolie/05. Over And Over.mp3,9.25,M
Gregg Rolie-1985 Gregg Rolie/03. I Wanna Go Back.mp3,9.21,M
Gregg Rolie-1985 Gregg Rolie/09. It's Only Make Believe.mp3,9.09,M
Gregg Rolie-1985 Gregg Rolie/04. Let Me Out.mp3,8.18,M
Gregg Rolie-1985 Gregg Rolie/06. Don't Talk.mp3,7.2,M
Gregg Rolie-1985 Gregg Rolie/11.jpg,21.33,K
Gregg Rolie-1985 Gregg Rolie/AlbumArt_{3259FE15-DC3A-4FB8-9E0E-24CE668D569A}_Large.jpg,6.69,K
Gregg Rolie-1985 Gregg Rolie/Folder.jpg,6.69,K
Gregg Rolie-1985 Gregg Rolie/AlbumArt_{3259FE15-DC3A-4FB8-9E0E-24CE668D569A}_Small.jpg,1.96,K
Gregg Rolie-1985 Gregg Rolie/AlbumArtSmall.jpg,1.96,K
Gregg Rolie-1985 Gregg Rolie/desktop.ini,311,B
Gregg Rolie-1987 Gringo/07. Fire at Night.mp3,15.98,M
Gregg Rolie-1987 Gringo/09. I Will Get to You.mp3,11.8,M
"Gregg Rolie-1987 Gringo/06. Too Late, Too Late.mp3",10.43,M
Gregg Rolie-1987 Gringo/05. One of These Days.mp3,9.92,M
Gregg Rolie-1987 Gringo/01. The Hands of Time.mp3,9.7,M
Gregg Rolie-1987 Gringo/08. You Make It Hard on Me.mp3,9.39,M
Gregg Rolie-1987 Gringo/03. Talk Talk.mp3,8.91,M
Gregg Rolie-1987 Gringo/04. I Couldn't Lie to You.mp3,8.61,M
Gregg Rolie-1987 Gringo/02. Don't Wanna Be Alone Tonight.mp3,6.16,M
Gregg Rolie-1987 Gringo/10.jpg,30.69,K
Gregg Rolie-1997 Rough Tracks/09. They Want It All.mp3,8.15,M
Gregg Rolie-1997 Rough Tracks/03. Still Loving You.mp3,7.85,M
Gregg Rolie-1997 Rough Tracks/05. From Night To Night.mp3,7.48,M
Gregg Rolie-1997 Rough Tracks/01. Every Beat Of My Heart.mp3,7.15,M
Gregg Rolie-1997 Rough Tracks/04. Don't You Want Somebody.mp3,6.9,M
Gregg Rolie-1997 Rough Tracks/06. Mystified.mp3,6.33,M
Gregg Rolie-1997 Rough Tracks/02. Walk Away.mp3,6.22,M
Gregg Rolie-1997 Rough Tracks/08. Make Up Your Mind.mp3,6.12,M
Gregg Rolie-1997 Rough Tracks/07. Hearts On Fire.mp3,6.08,M
Gregg Rolie-1997 Rough Tracks/10. Jailhouse Rock.mp3,5.36,M
Gregg Rolie-1997 Rough Tracks/11.png,318.5,K
Gregg Rolie-2001 Roots/08. That's The Way It Goes.mp3,14.91,M
Gregg Rolie-2001 Roots/12. Orient Express.mp3,12.78,M
Gregg Rolie-2001 Roots/05. Ordinary Man.mp3,12.66,M
Gregg Rolie-2001 Roots/10. Breakin' My Heart.mp3,11.7,M
Gregg Rolie-2001 Roots/03. Love Is Everything.mp3,11.5,M
Gregg Rolie-2001 Roots/11. Let It Slide.mp3,11.34,M
Gregg Rolie-2001 Roots/09. Con Todo Mi Corazon.mp3,11.12,M
Gregg Rolie-2001 Roots/04. In My Skin.mp3,10.59,M
Gregg Rolie-2001 Roots/01. Give It To Me.mp3,10.2,M
Gregg Rolie-2001 Roots/07. Domingo.mp3,9.17,M
Gregg Rolie-2001 Roots/02. Down To Rio.mp3,9.01,M
Gregg Rolie-2001 Roots/06. Going Home.mp3,7.77,M
Gregg Rolie-2001 Roots/13.png,329.2,K
03.10.png,180.35,K
