User Type,Username,Date,Text
,mrsillyx11,2010-12-15T00:15Z,Take this crap off of here
,JessterKing654,2010-12-15T00:21Z,"yes, take this down please, the only thing that people could use this for is for malicious activities."
,TheAlbatross,2010-12-18T11:02Z,"@theherkman
Downloading now, I'll look for your pass and steal your account."
,Neuroceze,2011-01-14T20:42Z,"Gnosis, i like your style, Casual hackers
But not to fuck around with :)"
,Bitmaster,2011-02-13T21:08Z,"They pissed 4chan off. You just don't do that. They may suit themselves. Also, no salt? Really?"
,Cgoff87,2011-02-25T22:19Z,"Wow, you guys really ripped that site a new one!
It's people like you that drive the force that satisfies peoples needs for innovation, and continues to improve cyberspace where we never thought possible.

Keep it up!"
,Blaze-Viper,2011-06-15T15:06Z,"Well played, Gnosis, well played."
,JohnShit,2011-07-02T12:16Z,"HERP TAEK THIS DOWN NOW DERPA HERP IT'S GOt My passw0rd11!!!!1

Shut the fuck up, idiots. This is legendary."
,JohnShit,2011-07-02T12:16Z,"Also, Gnosis is LulzSec, apparently..."
