User Type,Username,Date,Text
,kviende,2011-05-11T15:48Z,채r det bara danska p책 denna?
[M],Ubehage,2011-05-11T16:23Z,Ja. Sorry...
,heavydiamond,2011-05-11T16:31Z,"thanks m8  ,r the menus intact/retail"
[M],Ubehage,2011-05-11T17:46Z,"Untouched.

Always untouched an uncompressed shit from me.
Except, I do try to remove Copyright-warnings and other shit."
,heavydiamond,2011-05-11T22:50Z,ok calm down i thought so jus checkin son thanks again good job
,Bunkerking1979,2011-05-14T16:24Z,"Slow download, been downloading for 24 hours now, 4,5% :( Only 1 person seeding. My ratio on this one so far is 1.77.... More seeders please."
,gregersamsa,2011-05-25T11:47Z,"Could you seed Team America Collector's Edition just a little bit more? We're like six people stuck on 95% :)


Pretty please with sugar on top?"
