User Type,Username,Date,Text
,ekarth22,2011-06-20T02:49Z,"Omg its Sunny LEONE!
+1 rep even before clicking on the screenshot link :D"
,burnashes,2011-06-20T08:55Z,sunny leone is like super hot.and not like the americans with silicone implants and fake bodies.
,Robin5555,2011-06-22T01:59Z,"Awesome up ! many thanks,also to ekarth i really missed it !"
,Ram2808,2011-09-14T14:44Z,"@burnashes
Sorry to dissapoint you. Sunny Leone has gotten implants. She's not all natural."
,zaik017,2012-01-22T12:29Z,"Do you have ""Virtual Vivid Girl Sunny Leone Interactive DVD""? If yes please Upload it!"
,u.duwadi,2012-04-17T08:42Z,Please seed...........it's very very slow! 2.5 kbps maximum!
