User Type,Username,Date,Text
[T],dekeisha,2011-09-25T13:14Z,"i'm a first time uploader please if there are any mistakes i've made.I had downloaded this some time ago from thepiratebay and it works great for me,so i just decided to share.enjoy and seed."
,keywest33,2011-09-25T21:06Z,"why why ?? upload this as its a 4 times use ""TRIAL"" are you doing this for ""MONEY""???????? Its ""USELESS"" to anyone and available ""direct from site""


COMMERCIAL  SCAM ???"
,keywest33,2011-09-25T21:13Z,"PLEASE IGNORE MY PREVIOUS COMMENTS .
  PROG IS FINE   -------SOOOOO SORRY "
[T],dekeisha,2011-09-26T01:02Z,"well thanks anyway,I included the patch so just install close the program and patch.you're done."
,willwowtf,2011-09-26T01:34Z,Thanks
,stusas,2011-09-26T02:03Z,Works for me win 7 64  Thanks !!
,MPGH5574,2011-09-26T14:02Z,is it all in 4.55 mb?
[T],dekeisha,2011-09-26T19:35Z,"yes it is.just download and check it,it's clean."
,2r1b,2011-10-10T16:43Z,Thanks a lot dekeisha. Such a program I thought existed only in my frustrated head!!!! This comes from somebody that has been suffering from severe computer crashes. This program is magical. I used it on 2 Windows 7 x64 installations (Ultimate & Home Premium) and so far is working great. Great upload.
[T],dekeisha,2011-11-06T03:47Z,thanks for keepin it alive.
