User Type,Username,Date,Text
,hawaiianna,2011-06-17T06:21Z,"thanks for this, was suprised no one posted it but you came through!"
,Superstarz,2011-06-22T21:24Z,Thanks!
,Mitchayy,2011-07-14T13:51Z,Well done. This girl is a future star in my opinion. Good quality upload. =]
,BakedUp,2011-07-15T13:45Z,"thanks so much~~~!
Will seed for AS LONG AS I CAN^^

you just made my day bro. Thank you."
,hacky02,2011-07-26T19:09Z,thanks soupucia king torrent!
,xxXdareaperXxx,2011-09-18T14:20Z,Thanks for this ! Nice one ! :D
,indiemusicshare,2012-03-05T07:58Z,THX!  Can you upload Caroline County's Heaven Knows and Emusome's Cold Wind (remastered)?  Thanks!
