User Type,Username,Date,Text
[S],velvet.,2011-12-06T03:08Z,"You really ought to consider upgrading to a modern bit torrent client such as uTorrent or Vuze.
The old BitComet crap that you are using has been obsolete for years.


The exact same movie file you just uploaded has already been available for more than four months from this torrent:
https://thepiratebay.org/torrent/6473585/Sucker_Punch_%282011%29_DVDRip_XviD-MAX
It has more than 2400 seeders. 


You ought to read this:  http://www.urbandictionary.com/define.php?term=Torrent%20Whore"
