User Type,Username,Date,Text
[T],MitZep,2011-02-15T17:23Z,"Comment on quality and pls seed........
sample included......."
[T],MitZep,2011-02-15T18:04Z,Note: This includes subs for only non english parts....
,r-0987,2011-02-16T12:41Z,Thanks! Quality Is Awesome!!!
[T],MitZep,2011-02-16T13:38Z,"@all i have request.....
for some unknown  reason my account has been closed on demonoid so nw  i cant upload there...
so i desperately need an invite to it....
pls if anyone has an invite pls mail it to me at guy_guy35@yahoo.in.....  "
,himansu_007,2011-02-16T15:45Z,will send
[T],MitZep,2011-02-16T16:20Z,"@himasnsu thanx a lot...
the Gesture is appreciated ... :)"
,m.manish,2011-02-16T16:49Z,"hey man wud u be doin ""127 hours"" n ""megamind""
their bluray's are out...."
[T],MitZep,2011-02-16T17:22Z,@manish yes i would....
,jbwckz,2011-02-17T04:26Z,hey isnt this suppose to be mini series of 4hrs 30mins..it has got 3 parts..details showin 2hrs 45mins
[T],MitZep,2011-02-17T10:35Z,"@jbwckz
yes it is a mini series of 5 hr 30 min
but it also has a theatrical movie which is 2hr 45min and that has been uploaded here..... :)"
