User Type,Username,Date,Text
,Boglin,2011-08-23T02:08Z,"Everybody should read this book. It really can change your life.

Many thanks for your uploads, really appreciated !"
,jazbunyss,2011-09-09T13:59Z,i haven't read it yet but hop it will be nice 
,Robsond76,2011-10-12T14:12Z,"@boglin

It really can change your life. I`ve been telling everyone that this book is what made me the way I am today.

Coincidentally, there are free documentaries on Warren Buffet`s life throughout the internet, and Warren says himself that this book changed his life to the path of success."
,DaisyW46,2011-12-18T06:50Z,Thank you! I've been looking all over for this. :)
,therightjustice,2012-03-13T21:29Z,You are AWESOME!!
