User Type,Username,Date,Text
,MotherFuckingNigga,2011-04-04T21:36Z,Everyone leeching to hell come on help us all out im sat at upload speed 118kbps which is relatively slow but my download speed is 0.8kbps and im on 63 percent fucking seed guys dont just hit and run!
,MotherFuckingNigga,2011-04-04T21:37Z,At least im fucking seeding!
,EMIRhaso,2011-04-09T22:05Z,shit there is a virus parts
[T],N1kolas_Tankaner,2011-06-17T20:36Z,"EMIRhaso : Hej, there is no virus in the game without antivirus thinks when crack does change in the system file for the game.
So you dont need to worry :D."
