User Type,Username,Date,Text
,UR-Djavu,2011-03-06T09:30Z,"take a GOOD LOOK at WHO put it here and what they put up before ?!!!

Hurtful comment from ignorance only leads to mistrust - hiest, this joker, kimm_23f, owes you an aoplogy in SPADES I do suspect !!! HAH.

Thanks for all you done so far champ - quite impressive hiest..."
,imbackagain0101,2011-03-06T10:10Z,many tnx
,cocoboco17,2011-03-06T20:29Z,"Good work BUT face the reality, it is so blurred that is more like a good cam source. I give V4 regarding my expectation for PPVRIP."
