User Type,Username,Date,Text
,deadleopard45,2011-02-18T06:19Z,"Baby, baby, baby, no!"
,ariehaan,2011-02-19T21:47Z,subs: http://www.addic7ed.com/serie/CSI%3A_Crime_Scene_Investigation/11/15/Targets_of_Obsession
,Allu00,2011-04-04T21:04Z,is this the one where JB gets shot?
,Allu00,2011-04-05T11:27Z,oh yes it is. thanks for this.
,luckyu90,2011-09-09T15:05Z,yeah he got shot in this episode. his acting's not so bad
,tizrmonky,2012-05-04T03:56Z,`alloonluckyu90=selfish fuckwads-------eztv as always thank you much apreciated
