User Type,Username,Date,Text
[V],err0001,2011-10-10T10:16Z,"Private sites have reported this as a repeat of S02E03.

According to tvrage, epguides and wikipedia, S02E06 does not air until Oct 23."
,GeekinTexas,2011-10-10T15:41Z,"Fake, repeat episode. This is S02E03 ""Scream a Little Dream""."
[M],Agricola,2011-10-11T01:40Z,"Your status has been removed. 
Contact WTC-SWE"
,capitanqueso,2011-10-14T23:30Z,FAKE!! Download the sample & you'll see 
,mokabear,2011-10-15T08:50Z,"This is definitely not the right episode...  This video is S02E03.  Confirmed.
And I'm not happy about it...  Sorry TvTeam, if this was an honest mistake then I'll give you the benefit of the doubt."
