Filename,Size,Unit
Fidatevi/08 Indecision.mp3,4.75,M
Fidatevi/14 The Rays of the Sun 1.mp3,4.14,M
Fidatevi/10 Imperfect World.mp3,3.58,M
Fidatevi/05 The Ship.mp3,3.36,M
Fidatevi/06 Strangers 1.mp3,3.32,M
Fidatevi/04 Even Pace.mp3,3.18,M
Fidatevi/09 No Expectations.mp3,3.09,M
Fidatevi/13 Water and Waves.mp3,2.77,M
Fidatevi/07 Truth and Beauty.mp3,2.54,M
Fidatevi/02 The True Heart of Love 1.mp3,2.49,M
Fidatevi/11 Responsibility.mp3,2.49,M
Fidatevi/12 Take Action.mp3,2.46,M
Fidatevi/01 Patience.mp3,2.3,M
Fidatevi/03 Fidatevi.mp3,2.18,M
The Brain That Wouldn't Die/14 My Brain Hurts.mp3,3.9,M
The Brain That Wouldn't Die/04 Veronica Hates Me.mp3,3.35,M
The Brain That Wouldn't Die/11 Don't Turn Out The Lights.mp3,3.01,M
The Brain That Wouldn't Die/09 Teenage Freakshow.mp3,2.96,M
The Brain That Wouldn't Die/12 This Ain't Hawaii.mp3,2.7,M
The Brain That Wouldn't Die/07 Science Of Myth.mp3,2.69,M
The Brain That Wouldn't Die/03 Guest List.mp3,2.64,M
The Brain That Wouldn't Die/08 What We Hate.mp3,2.6,M
The Brain That Wouldn't Die/05 Cool Kids.mp3,2.56,M
The Brain That Wouldn't Die/01 Making You Cry.mp3,2.16,M
The Brain That Wouldn't Die/13 I Wanna Be With You Tonight.mp3,2.14,M
The Brain That Wouldn't Die/02 Slogans.mp3,1.95,M
The Brain That Wouldn't Die/06 Cindy's On Methadone.mp3,1.84,M
The Brain That Wouldn't Die/10 Kamala's Too Nice.mp3,1.61,M
These Ones Are Bitter/13 In A Bad Place.mp3,4.28,M
These Ones Are Bitter/07 Blue Is The Ocean.mp3,3.97,M
These Ones Are Bitter/14 Only In November.mp3,3.85,M
These Ones Are Bitter/06 The First Day Of Spring.mp3,3.48,M
These Ones Are Bitter/11 Give It Time.mp3,3.42,M
These Ones Are Bitter/08 Affected By You.mp3,3.24,M
These Ones Are Bitter/04 Happy Saturday.mp3,3.01,M
These Ones Are Bitter/01 Let Freedom Ring.mp3,2.78,M
These Ones Are Bitter/05 Sour All Over.mp3,2.72,M
These Ones Are Bitter/09 Jeanette.mp3,2.65,M
These Ones Are Bitter/03 Got My Number.mp3,2.64,M
These Ones Are Bitter/10 Addition By Subtraction.mp3,2.36,M
These Ones Are Bitter/02 In A Few Days.mp3,2.17,M
These Ones Are Bitter/12 Summer's Always Gone Too Soon.mp3,2,M
