Filename,Size,Unit
CD1/1. In The Summertime-Shaggy Feat. Rayvon.mp3,8.61,M
CD1/10. OK Fred-Errol Dunkley.mp3,8.83,M
CD1/11. Black And White-Greyhound.mp3,6.44,M
CD1/12. Return Of Django-The Upsetters.mp3,5.71,M
CD1/13. I Chase The Devil-Max Romeo.mp3,7.84,M
CD1/14. Love Of The Common People-Nicky Thomas.mp3,5.33,M
CD1/15. Montego Bay-Freddie Notes & The Rudies.mp3,5.48,M
CD1/16. Good Thing Going (We've Got A Good Thing Going)-Sugar Minott.mp3,8.14,M
CD1/17. Cherry Oh Baby-Eric Donaldson.mp3,6.95,M
CD1/18. Three Ring Circus-Barry Biggs.mp3,9.22,M
CD1/19. You're Everything To Me-Boris Gardiner.mp3,8.32,M
CD1/2. Compliments On Your Kiss-Brian & Tony Gold Feat. Red Dragon.mp3,9.64,M
CD1/20. Love Has Found It's Way-Dennis Brown.mp3,10.19,M
CD1/21. Wild World-Jimmy Cliff.mp3,8.83,M
CD1/22. Everything Is Great-Inner Circle Feat. Jacob Miller.mp3,13.86,M
CD1/3. Now That We've Found Love-Third World.mp3,8.83,M
CD1/4. Israelites-Desmond Dekker & The Aces.mp3,5.92,M
"CD1/5. Young, Gifted And Black-Bob & Marcia.mp3",7.18,M
CD1/6. Amigo-Black Slate.mp3,9.29,M
CD1/7. Double Barrel-Dave & Ansel Collins.mp3,6.29,M
"CD1/8. Rudy, A Message To You-Dandy Livingstone.mp3",6.24,M
CD1/9. Liquidator-Harry J Allstars.mp3,6.55,M
CD1/front.jpg,1.29,M
CD2/1. Food For Thought-UB40.mp3,9.55,M
CD2/10. Wet Dream-Max Romeo.mp3,6.38,M
CD2/11. Money In My Pocket-Dennis Brown.mp3,5.74,M
CD2/12. Just When I Needed You Most-Barbara Jones.mp3,7.8,M
CD2/13. Stir It Up-Johnny Nash.mp3,6.9,M
CD2/14. Hurt So Good-Susan Cadogan.mp3,7.07,M
CD2/15. I Want To Wake Up With You-Boris Gardiner.mp3,9.14,M
CD2/16. Killing Me Softly With Her Song-John Holt.mp3,8.97,M
CD2/17. Red Red Wine-Tony Tribe.mp3,6.69,M
CD2/18. Everything I Own-Ken Boothe.mp3,8.55,M
CD2/19. Sideshow-Barry Biggs.mp3,7.78,M
CD2/2. I Don't Wanna Dance-Eddy Grant.mp3,8.37,M
CD2/20. Night Nurse-Gregory Isaacs.mp3,9.41,M
CD2/21. Silly Games-Janet Kay.mp3,9.09,M
CD2/3. She Don't Let Nobody-Chaka Demus & Pliers.mp3,9.42,M
CD2/4. Don't Turn Around-Aswad.mp3,7.57,M
CD2/5. I Can See Clearly Now-Johnny Nash.mp3,6.36,M
CD2/6. You Can Get It If You Really Want-Desmond Dekker.mp3,5.99,M
"CD2/7. Wonderful World, Beautiful People-Jimmy Cliff.mp3",7.13,M
CD2/8. Help Me Make It Through The Night-John Holt.mp3,7.05,M
CD2/9. Suzanne Beware Of The Devil-Dandy Livingstone.mp3,5.96,M
CD3/1. Uptown Top Ranking-Althea & Donna.mp3,8.77,M
"CD3/10. Boops (Here To Go)-Shinehead, Sly & Robbie.mp3",8.27,M
CD3/11. Give Me Hope Jo'Anna-Eddy Grant.mp3,8.54,M
CD3/12. Sweets For My Sweet-C.J. Lewis.mp3,7.34,M
CD3/13. My Jamaican Guy-Grace Jones.mp3,13.78,M
CD3/14. Mr. Loverman-Shabba Ranks Feat. Chevelle Franklin.mp3,8.3,M
CD3/15. Tease Me-Chaka Demus & Pliers [Goldfinger Remix].mp3,9.23,M
CD3/16. Shy Guy-Diana King.mp3,9.77,M
CD3/17. Baby I Love Your Way-Big Mountain.mp3,10.02,M
CD3/18. Twist And Shout-Chaka Demus & Pliers Feat. Jack Radics & The Taxi Gang.mp3,9.09,M
CD3/19. Boom Shack-A-Lak-Apache Indian.mp3,10.35,M
CD3/2. Girlie Girlie-Sophia George.mp3,6.83,M
CD3/20. It Wasn't Me-Ricardo Ducent Feat. Shaggy.mp3,8.68,M
CD3/21. Here Comes The Hotstepper-Ini Kamoze.mp3,9.56,M
CD3/3. Let Your Yeah Be Yeah-The Pioneers.mp3,7.01,M
CD3/4. Shine-Aswad.mp3,8.33,M
CD3/5. Sweat (A La La La La Song)-Inner Circle.mp3,8.62,M
CD3/6. Pass The Dutchie-Musical Youth.mp3,7.51,M
CD3/7. My Boy Lollipop-Millie.mp3,4.44,M
CD3/8. Some Guys Have All The Luck-Maxi Priest.mp3,8.03,M
"CD3/9. You Don't Love Me (No, No, No)-Dawn Penn.mp3",10.4,M
CD3/back.jpg,1.58,M
