User Type,Username,Date,Text
,squish0601,2011-02-01T09:05Z,"Hi guys, excuse me for my stupidity.
But how come most of the wii files are like in little seperate folders all over like this one.
Arte there some steps that i must make to combine them or something? "
,c0mputer,2011-02-01T19:51Z,"squish0601:  u need to use winrar 

download and install winrar 

open winrar and locate the folder where you have this game click any file from those split rar files and click extract (to desktop )

this what winrar will do it will merge all the lifes located in same folder and extract them in to the destination folder( say desktop)
u will get one iso file 
if you have softmoded wii  all you need is a wbfs manager ...keep reading to follow "
,MrSan.,2012-06-05T19:46Z,I have a copy of this game and the disc doesn't works on my 4.0U Wii. But I don't know if the files are exactly the same of this torrent.
