User Type,Username,Date,Text
,alx36,2011-01-16T21:41Z,thx :)
,aduke,2011-01-17T16:09Z,thnx man ur osssummm!! ٩(̃-̮̮̃-)۶
,fu_2k4,2011-01-17T19:45Z,"Hey, love your work oldskoolscouse but I have to point out that track 10 is the album version only and doesnt include Tinie Tempah in it x"
[V],oldskoolscouse,2011-01-18T13:19Z,"@fu_2k4,
yea your right, but it was the only one i could find on itunes :o( sorry."
,akalucifer,2011-01-18T15:30Z,Great! thanx from Gran Canaria!
,fu_2k4,2011-01-18T21:28Z,"yeah, i think the Tinie Tempah version is released sometime in Feb, the only way of getting it now would be to rip it from youtube at sub 320bit quality. Thanks for the upload anyway :D"
,asifcool88,2011-01-21T20:47Z,thnx alot
,POLICEX,2011-01-23T12:46Z,thank you kind sir
