Filename,Size,Unit
Game of Thrones.s01e01.Winter Is Coming.avi,550.21,M
Game of Thrones.s01e02.The Kingsroad.avi,550.33,M
Game of Thrones.s01e03.Lord Snow.avi,550.26,M
Game of Thrones.s01e04.Cripples Bastards and Broken Things.avi,550.29,M
Game of Thrones.s01e05.The Wolf and the Lion.avi,550.32,M
Game of Thrones.s01e06.A Golden Crown.avi,550.2,M
Game of Thrones.s01e07.You Win or You Die.avi,549.87,M
Game of Thrones.s01e08.The Pointy End.avi,550.4,M
Game of Thrones.s01e09.Baelor.avi,550.32,M
Game of Thrones.s01e10.Fire and Blood.avi,550.23,M
Torrent downloaded from Demonoid.me.txt,46,B
