User Type,Username,Date,Text
,klaartje-voorhees,2011-05-25T05:28Z,"Ik heb mij al SUF gezocht naar deze film seg...

tjah, nu ik erraan denk had ik ook een verzoekje kunnen indienen bij je (zo lees ik) dOh..

Nou jij brengt die dan lekker doodgewoon deze primeur voor het eerst op de pirate byay en heeft alle andere uploaders het Nakijken.

Dit verdiend toch nu en dan een bedankt berichtje van formaat dunkt mij.

De film, de omschrijving, het voorwoordje van je is nog steeds zoals we gewoon zijn van je en gewoonweg nog steeds ongeevenaard hier op the bay.

Goed bezig, en ik zou zo zegge hou vooral deze tendens aan NLtopper met een kapitale NL

Als ik kon gaf ik je een +10, maar ik geef je alvast een +1 van mij..

...Klaartje tikt met trots een +1 aan..

doeg,
klaar,
"
