User Type,Username,Date,Text
,merkeren12,2011-01-21T21:21Z,"thank You, Hope this works :)"
,Talyn57,2011-01-22T04:30Z,"I assure you, it does. I paid the $45 to get this, because I had gotten all of VC's other presets & plug-ins from Pirate Bay. So, Please, Enjoy!!!"
,Aciaeiig,2011-01-22T16:28Z,"Cool, im glad you paid for it like i did"
,o6o6,2011-01-24T16:39Z,"Thanks for sharing Talyn57
you are the best "
,d2h4l,2011-02-24T17:31Z,how to install into after effects cs5 x64?
,aditya58,2011-02-28T11:25Z,SEED !!!!!!!!!!!
,aogm,2011-04-30T21:29Z,THIS IS GREAT!! Thanks Bro...
,shiranavs,2011-10-20T05:25Z,Thank u for diz.
,sdgdg,2012-05-13T07:54Z,goto after-effects-tools(.)blogspot(.)com for more downloads... :)
