User Type,Username,Date,Text
[V],totomas1,2011-09-23T13:03Z,"Tusen tack, Belsebub_666."
,Belsebub_666,2011-09-23T14:43Z,"Ledsen för den sega hastigheten, mitt mobila bredband funkar som en skadeskjuten brevduva idag. 

Men den som väntar på nått gott väntar alltid för länge.  :)"
,Zorro49,2011-09-23T14:57Z,Du var snabbare jag sitter nu och rippar den :)
,Gasoler,2011-09-23T15:58Z,"Årets mest efterlängtade uppladdning!

Gasoler bugar djupt och ödmjukt"
,Mr.Speed328,2011-09-23T18:46Z,"Jag bugar så djupt så att jag får ryggskott och pungbrock!!
SuperTACK!"
,Zandman,2011-09-23T19:42Z,"ojoj denna har jag VERKLIGEN sett fram emot, tackar belsebub_666!!!"
,cmanc2000,2011-09-23T21:01Z,Tusen tack!
[V],CrilleKex,2011-09-23T23:54Z,Denna har jag verkligen sett fram emot! Tackar och bockar Belsebub_666!
,bww-ponken,2011-09-24T01:20Z,Tackar och bugar..
,putrik74,2011-09-24T13:18Z,Tack
,FanPIX,2011-09-25T19:16Z,"Tackar, bockar o Bug(g)ar! :)"
,stevebull09,2011-09-26T23:07Z,Tackar som f-n Belsebub. Lee Child tillhör helt klart en av favvisarna och att det sen är mr. Roosmann som läser gör inte saken sämre. Keep up the good work
,Solbrud,2011-09-28T14:56Z,Tack Belsebub!
,maaril,2011-10-03T01:05Z,Mumma! Bugar och bockar för denna finfina stund av njutning!
,relyssen1,2011-10-08T08:02Z,O FY FAN VAD JAG BLIR GLAD TACK SOM FAN.
