User Type,Username,Date,Text
,DarkKingBlaze,2010-12-26T19:54Z,Seed people Seed. I will seed when finished.
,ARGENTVS_1,2010-12-28T00:08Z,"To muchs leechers!, malditos sanguijuelas!!!."
,DarkKingBlaze,2010-12-28T02:25Z,Ive seeded about 35.8GB the last 2 days and still the leechers are more than the seeders. Come on people seed. there are people after you who would like to watch as well
,floorman1,2011-01-01T23:13Z,thanx
,tins47,2011-01-05T13:21Z,"the quality is not too good for watching on a big screen, but thanks anyways !"
,LaVarious,2011-01-06T07:12Z,Thanks for uploading and for everyone who is seeding. A=9 V=8.5/9 (Depending on screen resolution)
,nyyankees10706,2011-01-21T07:45Z,how is this season 10 and season 10 aint started
,mandarp,2011-01-24T17:29Z,how is it for viewing on a PC
,mandarp,2011-01-24T17:30Z,"how is it for viewing on a PC with 17"" monitor"
,par1515,2011-02-04T15:49Z,man one hundred thanks but you can upload episode 12 plsssssssss!!!??
,par1515,2011-02-04T16:00Z,why delete my comment??
,par1515,2011-02-04T16:01Z,wrong target sorry
,imunionjack,2011-02-14T16:10Z,Ta muchly. Just a shame the end of a brill series!!
,da_300_squirrels,2011-05-21T19:56Z,seed you darn leechtards SEEEEEEEED!!!!!!!
,ToniMilk69,2011-12-23T20:47Z,where are episodes 12 to 21?
