Filename,Size,Unit
Jagmohan-Aankhen Bani Deewani.mp3,1.71,M
Jagmohan-Aankhon Mein Chupa Lo.mp3,2.79,M
Jagmohan-Deewana Tumhara.mp3,2.47,M
Jagmohan-Ek Baar Muskura Do.mp3,2.6,M
Jagmohan-Jal Rahe Hai Armaan.mp3,2.52,M
Jagmohan-Mat Kar Singar.mp3,2.59,M
Jagmohan-Mujhe Khamosh Rahene Do.mp3,2.97,M
Jagmohan-Mujhe Na Sapne Se.mp3,2.76,M
Jagmohan-Niras Mein Aas Prabhu Mera.mp3,2.93,M
Jagmohan-O Varsha Ke Pahele.mp3,5.54,M
Jagmohan-Prem Ki Rut Chali Gayi.mp3,3.11,M
Jagmohan-Pyaari Tum Kitni Sundar Ho.mp3,3.02,M
Jagmohan-Sapno Mein Mujhko.mp3,2.47,M
Jagmohan-Tu Mere Samne Na Aaya Karo.mp3,2.9,M
Jagmohan-Ulfat Ki Saza Do.mp3,2.76,M
Jagmohan-Us Raag Ko.mp3,2.75,M
Jagmohan-Yeh Chaand Nahin.mp3,3.36,M
Jagmohan-Yeh Man Ke Tum Se.mp3,3.02,M
Jagmohan-Yeh Na Bata Sakunga Mein.mp3,3.19,M
Magmohan-Chand Hai Maheman.mp3,2.88,M
