Filename,Size,Unit
50 Cent/8 Mile/02 Love Me.mp3,4.14,M
50 Cent/8 Mile/05 Places to Go.mp3,3.9,M
50 Cent/8 Mile/11 Wanksta.mp3,3.35,M
Compilations/Relapse_ Refill/23 Forever.mp3,8.55,M
Compilations/Relapse_ Refill/28 Music Box.mp3,7.34,M
Compilations/Relapse_ Refill/27 Taking My Ball.mp3,7.29,M
Compilations/Relapse_ Refill/26 Elevator.mp3,7.07,M
Compilations/Relapse_ Refill/29 Drop The Bomb On 'Em.mp3,6.96,M
Compilations/Relapse_ Refill/24 Hell Breaks Loose.mp3,5.95,M
Compilations/Relapse_ Refill/25 Buffalo Bill.mp3,5.78,M
D12/8 Mile/06 Rap Game.mp3,5.41,M
Eminem/8 Mile/03 8 Mile.mp3,5.52,M
Eminem/8 Mile/12 Wasting My Time.mp3,3.34,M
Eminem/8 Mile/16 Rabbit Run.mp3,2.94,M
Eminem/Curtain Call_ The Hits/05 Stan (Feat. Dido).mp3,15.5,M
Eminem/Curtain Call_ The Hits/17 Stan (Live) (Feat. Elton John).mp3,14.58,M
Eminem/Curtain Call_ The Hits/14 Cleanin' Out My Closet.mp3,11.48,M
Eminem/Curtain Call_ The Hits/03 The Way I Am.mp3,11.18,M
Eminem/Curtain Call_ The Hits/11 The Real Slim Shady.mp3,10.93,M
Eminem/Curtain Call_ The Hits/16 When I'm Gone.mp3,10.79,M
Eminem/Curtain Call_ The Hits/07 Shake That (Feat. Nate Dogg).mp3,10.54,M
Eminem/Curtain Call_ The Hits/04 My Name Is.mp3,10.33,M
Eminem/Curtain Call_ The Hits/02 FACK.mp3,7.92,M
Eminem/Curtain Call_ The Hits/13 Guilty Conscience (Feat. Dr. Dre).mp3,7.71,M
Eminem/Curtain Call_ The Hits/01 Intro (Curtain Call).mp3,1.37,M
Eminem/Eminem Is Back/09 Macosa (Demo Version).mp3,7.18,M
Eminem/Eminem Is Back/06 Rush Ya Clique.mp3,6.38,M
Eminem/Eminem Is Back/01 Hellbound.mp3,5.96,M
Eminem/Eminem Is Back/10 Nuttin' To Do (Clean Radio Versio.mp3,5.7,M
Eminem/Eminem Is Back/02 Nuttin' To Do.mp3,5.68,M
Eminem/Eminem Is Back/08 Rock City.mp3,5.08,M
Eminem/Eminem Is Back/03 She's The One.mp3,5.07,M
Eminem/Eminem Is Back/11 Scary Movies Instrumental.mp3,4.98,M
Eminem/Eminem Is Back/04 ThreeSixFive.mp3,4.5,M
Eminem/Eminem Is Back/07 Hustlers & Hardcore.mp3,3.08,M
Eminem/Encore/20 Encore feat. Dr. Dre & 50 Cent.mp3,10.84,M
Eminem/Encore/04 Yellow Brick Road.mp3,10.74,M
Eminem/Encore/06 Mosh.mp3,9.92,M
Eminem/Encore/10 Rain Man.mp3,9.75,M
"Eminem/Encore/15 Spend Some Time feat. Obie Trice,.mp3",9.64,M
Eminem/Encore/08 My 1st Single.mp3,9.43,M
Eminem/Encore/11 Big Weenie.mp3,8.34,M
Eminem/Encore/18 One Shot 2 Shot feat. D-12.mp3,8.33,M
Eminem/Encore/14 Ass Like That.mp3,8.29,M
Eminem/Encore/02 Evil Deeds.mp3,8.12,M
Eminem/Encore/07 Puke.mp3,7.77,M
Eminem/Encore/17 Crazy in Love.mp3,7.68,M
Eminem/Encore/03 Never Enough feat. 50 Cent & Nate.mp3,5.07,M
Eminem/Encore/12 Em Calls Paul (Skit).mp3,2.37,M
Eminem/Encore/09 Paul (Skit).mp3,1.16,M
Eminem/Encore/19 Final Thought (Skit).mp3,1.12,M
Eminem/Fuckin Crazy/09 Fuck Off.mp3,8.6,M
Eminem/Fuckin Crazy/12 Bus A Rhyme.mp3,6.94,M
Eminem/Fuckin Crazy/03 Green and Gold.mp3,6.55,M
Eminem/Fuckin Crazy/16 The Show Down.mp3,6.48,M
Eminem/Fuckin Crazy/11 The Anthem.mp3,6.28,M
Eminem/Fuckin Crazy/08 Get You Mad.mp3,6.03,M
Eminem/Fuckin Crazy/15 15 - 5 Star Generals - Eminem.mp3,5.99,M
Eminem/Fuckin Crazy/13 Flyest Material.mp3,5.98,M
Eminem/Fuckin Crazy/14 My Name Is (Rock Star Remix).mp3,5.83,M
Eminem/Fuckin Crazy/04 Nuttin To Do.mp3,5.71,M
Eminem/Fuckin Crazy/01 Fucking Crazy.mp3,5.3,M
Eminem/Fuckin Crazy/02 Forget About Dr. Dre.mp3,5.13,M
Eminem/Fuckin Crazy/05 Watch Dees.mp3,5.04,M
Eminem/Fuckin Crazy/10 Hustlers And Hardcore.mp3,4.35,M
Eminem/Fuckin Crazy/06 Three Verses.mp3,4.34,M
Eminem/Recovery (Deluxe Edition)/20 Not Afraid.m4v,52.23,M
Eminem/Recovery (Deluxe Edition)/13 So Bad.mp3,12.48,M
Eminem/Recovery (Deluxe Edition)/16 You're Never Over.mp3,11.73,M
Eminem/Recovery (Deluxe Edition)/01 Cold Wind Blows.mp3,11.65,M
Eminem/Recovery (Deluxe Edition)/02 Talkin' 2 Myself (feat. Kobe).mp3,11.53,M
Eminem/Recovery (Deluxe Edition)/18 Ridaz.mp3,11.51,M
Eminem/Recovery (Deluxe Edition)/09 No Love (feat. Lil Wayne).mp3,11.49,M
Eminem/Recovery (Deluxe Edition)/06 Going Through Changes.mp3,11.47,M
Eminem/Recovery (Deluxe Edition)/14 Almost Famous.mp3,11.22,M
Eminem/Recovery (Deluxe Edition)/11 Cinderella Man.mp3,10.71,M
Eminem/Recovery (Deluxe Edition)/10 Space Bound.mp3,10.7,M
Eminem/Recovery (Deluxe Edition)/08 Seduction.mp3,10.57,M
Eminem/Recovery (Deluxe Edition)/19 Session One (feat. Slaughterhouse.mp3,10.3,M
Eminem/Recovery (Deluxe Edition)/04 Won't Back Down (feat. P!nk).mp3,10.21,M
Eminem/Recovery (Deluxe Edition)/15 Love the Way You Lie (feat. Rihan.mp3,10.12,M
Eminem/Recovery (Deluxe Edition)/07 Not Afraid.mp3,9.53,M
Eminem/Recovery (Deluxe Edition)/12 25 to Life.mp3,9.28,M
Eminem/Recovery (Deluxe Edition)/05 W.T.P..mp3,9.15,M
Eminem/Recovery (Deluxe Edition)/03 On Fire.mp3,8.21,M
Eminem/Recovery (Deluxe Edition)/17 Untitled.mp3,7.49,M
Eminem/Relapse/21 My Darling.mp3,7.78,M
Eminem/Relapse/22 Careful What You Wish For.mp3,5.64,M
Eminem/Relapse/16 DÃ©jÃ, Vu.mp3,4.77,M
Eminem/Relapse_ Refill/Beautiful.mp3,6.35,M
Eminem/Relapse_ Refill/Underground.mp3,6.02,M
Eminem/Relapse_ Refill/Stay Wide Awake.mp3,5.24,M
Eminem/Relapse_ Refill/3 A.M..mp3,5.24,M
Eminem/Relapse_ Refill/My Mom.mp3,5.24,M
Eminem/Relapse_ Refill/Crack a Bottle.mp3,4.9,M
Eminem/Relapse_ Refill/Bagpipes from Baghdad.mp3,4.68,M
Eminem/Relapse_ Refill/Old Time's Sake.mp3,4.6,M
Eminem/Relapse_ Refill/We Made You.mp3,4.47,M
Eminem/Relapse_ Refill/Hello.mp3,4.14,M
Eminem/Relapse_ Refill/Same Song & Dance.mp3,4.12,M
Eminem/Relapse_ Refill/Must Be the Ganja.mp3,4.06,M
Eminem/Relapse_ Refill/Medicine Ball.mp3,3.98,M
Eminem/Relapse_ Refill/Insane.mp3,3.12,M
Eminem/Relapse_ Refill/Dr. West (Skit).mp3,1.72,M
Eminem/Relapse_ Refill/Steve Berman (Skit).mp3,1.72,M
Eminem/Relapse_ Refill/Mr. Mathers (Skit).mp3,1,M
Eminem/Relapse_ Refill/Tonya (Skit).mp3,1,M
Eminem/Relapse_ Refill/Paul (Skit).mp3,667.71,K
Eminem/The Eminem Show/13 Superman.mp3,10.72,M
Eminem/The Eminem Show/02 White America.mp3,9.93,M
Eminem/The Eminem Show/05 Square Dance.mp3,9.9,M
Eminem/The Eminem Show/14 Hailies song.mp3,9.81,M
Eminem/The Eminem Show/17 Say what u say.mp3,9.48,M
Eminem/The Eminem Show/04 Cleanin out my closet.mp3,9.12,M
Eminem/The Eminem Show/18 Till i collapse.mp3,9.11,M
Eminem/The Eminem Show/09 Drips.mp3,8.74,M
Eminem/The Eminem Show/08 Say goodbye Hollywood.mp3,8.35,M
Eminem/The Eminem Show/16 When the music stops.mp3,8.24,M
Eminem/The Eminem Show/19 My Dads gone crazy.mp3,8.18,M
Eminem/The Eminem Show/03 Business.mp3,7.71,M
Eminem/The Eminem Show/07 Soldier.mp3,6.93,M
Eminem/The Eminem Show/06 The kiss.mp3,2.34,M
Eminem/The Eminem Show/20 Curtains close.mp3,1.91,M
Eminem/The Eminem Show/15 Steve Berman.mp3,1.04,M
Eminem/The Eminem Show/11 Paul Rosenberg.mp3,738.34,K
Eminem/The Marshall Mathers LP/03 Stan.mp3,15.45,M
Eminem/The Marshall Mathers LP/16 Kim.mp3,14.45,M
Eminem/The Marshall Mathers LP/17 Under The Influence.mp3,12.33,M
Eminem/The Marshall Mathers LP/11 Marshall Mathers.mp3,12.28,M
Eminem/The Marshall Mathers LP/18 Criminal.mp3,12.2,M
Eminem/The Marshall Mathers LP/10 I'm Back.mp3,11.86,M
Eminem/The Marshall Mathers LP/13 Drug Ballad.mp3,11.49,M
Eminem/The Marshall Mathers LP/15 Bitch Please II.mp3,11.03,M
Eminem/The Marshall Mathers LP/02 Kill You.mp3,10.12,M
Eminem/The Marshall Mathers LP/14 Amityville.mp3,9.75,M
Eminem/The Marshall Mathers LP/05 Who Knew.mp3,8.72,M
Eminem/The Marshall Mathers LP/09 Remember Me_.mp3,8.37,M
Eminem/The Marshall Mathers LP/12 Ken Kaniff (Skit).mp3,2.39,M
Eminem/The Marshall Mathers LP/06 Steve Berman (Skit).mp3,2.08,M
Eminem/The Marshall Mathers LP/01 Public Service Announcement 2000.mp3,1.02,M
Eminem/The Re-Up/16 Smack That (Remix).mp3,7.21,M
Eminem/The Re-Up/21 Cry Now (Shady Remix).mp3,7.15,M
Eminem/The Re-Up/05 Everything Is Shady.mp3,6.24,M
Eminem/The Re-Up/14 There He Is.mp3,6.13,M
Eminem/The Re-Up/22 No Apologies.mp3,5.99,M
Eminem/The Re-Up/07 You Don't Know.mp3,5.97,M
Eminem/The Re-Up/12 By My Side.mp3,5.72,M
Eminem/The Re-Up/11 Talkin' All That.mp3,5.69,M
Eminem/The Re-Up/02 We're Back.mp3,5.55,M
Eminem/The Re-Up/08 Jimmy Crack Corn.mp3,5.44,M
Eminem/The Re-Up/15 Tryin' Ta Win.mp3,5.4,M
Eminem/The Re-Up/18 Get Low.mp3,4.64,M
Eminem/The Re-Up/13 We Ride For Shady.mp3,4.38,M
Eminem/The Re-Up/19 Ski Mask Way (Eminem Remix).mp3,4.28,M
Eminem/The Re-Up/20 Shake That (Remix).mp3,4.18,M
Eminem/The Re-Up/06 The Re-Up.mp3,4.14,M
Eminem/The Re-Up/10 Whatever You Want.mp3,3.94,M
Eminem/The Re-Up/03 Pistol Pistol (Remix).mp3,3.41,M
Eminem/The Re-Up/04 Murder.mp3,3.06,M
Eminem/The Re-Up/17 Public Enemy #1.mp3,2.69,M
Eminem/The Re-Up/09 Trapped.mp3,1.41,M
Eminem/The Re-Up/01 Shady Narcotics.mp3,1.37,M
Freeway/8 Mile/07 8 Miles and Runnin'.mp3,3.8,M
Gang Starr/8 Mile/15 Battle.mp3,2.71,M
Macy Gray/8 Mile/09 Time of My Life.mp3,4,M
Nas/8 Mile/10 U Wanna Be Me.mp3,3.53,M
Obie Trice/8 Mile/04 Adrenaline Rush.mp3,3.54,M
Rakim/8 Mile/13 R.A.K.I.M..mp3,4.03,M
T.I_/No Mercy/All She Wrote (Feat. Eminem).mp3,7.33,M
Xzibit/8 Mile/08 Spit Shine.mp3,3.36,M
Young Zee/8 Mile/14 That's My N---- Fo' Real.mp3,4.4,M
