Filename,Size,Unit
.directory,67,B
Busca de Deus/1 Busca de Deus.mp3,4.89,M
Busca de Deus/10 Alta contemplacao.mp3,6.01,M
Busca de Deus/11 Ruah.mp3,4.88,M
Busca de Deus/12 Tentacao.mp3,5.65,M
Busca de Deus/13 Caminhar e cantar.mp3,5.4,M
Busca de Deus/14 Hoje.mp3,4.7,M
Busca de Deus/2 Verdade.mp3,3.42,M
Busca de Deus/3 Busco a tua voz.mp3,5.76,M
Busca de Deus/4 Tranquila.mp3,5.04,M
Busca de Deus/5 Anjo.mp3,4.62,M
Busca de Deus/6 O pefeito louvor.mp3,4.99,M
Busca de Deus/7 Quero.mp3,3.8,M
Busca de Deus/8 Lampada de fogo.mp3,5.11,M
Busca de Deus/9 Astro amado.mp3,5.59,M
Et Verbum/01 Et Verbum.mp3,4.07,M
Et Verbum/02 Maior Riqueza.mp3,3.97,M
Et Verbum/03  As misericórdias do Senhor.mp3,4.12,M
Et Verbum/04 Belo infante.mp3,4.17,M
Et Verbum/05 Busca-te em Mim.mp3,5.55,M
Et Verbum/06 Hóstia Santa.mp3,4.72,M
Et Verbum/07  Prisioneiro do amor.mp3,5.28,M
Et Verbum/08 Amor ao Sofrimento.mp3,4.88,M
Et Verbum/09 Alegria no coração.mp3,5.9,M
Et Verbum/10 Qadohôs.mp3,3.13,M
Et Verbum/11 Hino a divina providência.mp3,4.92,M
Et Verbum/12  Espera no Senhor.mp3,4.41,M
Et Verbum/13  Saudades de Deus.mp3,4.74,M
Melhores Momentos/01 Regaco acolhedor.mp3,2.14,M
Melhores Momentos/02 Passarinho.mp3,4.07,M
Melhores Momentos/03 Como um deserto.mp3,2.98,M
Melhores Momentos/04 Minha vocacao e o amor.mp3,2.49,M
Melhores Momentos/05 Cumpra-se.mp3,3.97,M
Melhores Momentos/06 Falanges Evangelicas.mp3,4.33,M
Melhores Momentos/07 Pentecostes.mp3,2.81,M
Melhores Momentos/08 Chama viva de amor.mp3,3.39,M
Melhores Momentos/09 Vagalume.mp3,2.43,M
Melhores Momentos/10 Trindade que adoro.mp3,4.96,M
Melhores Momentos/11 Formosura.mp3,2.25,M
Melhores Momentos/12 Raio de sol.mp3,4.33,M
Melhores Momentos/13 Viver de Amor.mp3,3.47,M
Melhores Momentos/14 Faz do meu nada amor.mp3,4.38,M
Melhores Momentos/15 Graozinho de Ouro.mp3,2.5,M
Melhores Momentos/16 Porque te Amor.mp3,3.14,M
Melhores Momentos/17 Que livro vou abrir.mp3,2.72,M
Melhores Momentos/18 Onde estas.mp3,2.54,M
Melhores Momentos/19 Es tu quem eu amo.mp3,4.13,M
Melhores Momentos/20 O amado.mp3,3.85,M
O Santo Rosário/CD 1/01 Faixa 1.mp3,2.1,M
O Santo Rosário/CD 1/02 Faixa 2.mp3,3.3,M
O Santo Rosário/CD 1/03 Faixa 3.mp3,1.19,M
O Santo Rosário/CD 1/04 Faixa 4.mp3,3.86,M
O Santo Rosário/CD 1/05 Faixa 5.mp3,715,K
O Santo Rosário/CD 1/06 Faixa 6.mp3,4.1,M
O Santo Rosário/CD 1/07 Faixa 7.mp3,399.08,K
O Santo Rosário/CD 1/08 Faixa 8.mp3,3.99,M
O Santo Rosário/CD 1/09 Faixa 9.mp3,290.1,K
O Santo Rosário/CD 1/10 Faixa 10.mp3,4.2,M
O Santo Rosário/CD 1/11 Faixa 11.mp3,613.37,K
O Santo Rosário/CD 1/12 Faixa 12.mp3,4.1,M
O Santo Rosário/CD 1/13 Faixa 13.mp3,1.38,M
O Santo Rosário/CD 1/14 Faixa 14.mp3,512.96,K
O Santo Rosário/CD 1/15 Faixa 15.mp3,3.89,M
O Santo Rosário/CD 1/16 Faixa 16.mp3,727.25,K
O Santo Rosário/CD 1/17 Faixa 17.mp3,4.16,M
O Santo Rosário/CD 1/18 Faixa 18.mp3,303.17,K
O Santo Rosário/CD 1/19 Faixa 19.mp3,3.95,M
O Santo Rosário/CD 1/20 Faixa 20.mp3,340.31,K
O Santo Rosário/CD 1/21 Faixa 21.mp3,4.23,M
O Santo Rosário/CD 1/22 Faixa 22.mp3,769.7,K
O Santo Rosário/CD 1/23 Faixa 23.mp3,4.26,M
O Santo Rosário/CD 1/24 Faixa 24.mp3,3.08,M
O Santo Rosário/CD 2/01 Faixa 1.mp3,580.31,K
O Santo Rosário/CD 2/02 Faixa 2.mp3,3.89,M
O Santo Rosário/CD 2/03 Faixa 3.mp3,335.82,K
O Santo Rosário/CD 2/04 Faixa 4.mp3,3.98,M
O Santo Rosário/CD 2/05 Faixa 5.mp3,1.28,M
O Santo Rosário/CD 2/06 Faixa 6.mp3,4.44,M
O Santo Rosário/CD 2/07 Faixa 7.mp3,4.11,M
O Santo Rosário/CD 2/08 Faixa 8.mp3,837.86,K
O Santo Rosário/CD 2/09 Faixa 9.mp3,4.21,M
O Santo Rosário/CD 2/10 Faixa 10.mp3,3.72,M
O Santo Rosário/CD 2/11 Faixa 11.mp3,472.15,K
O Santo Rosário/CD 2/12 Faixa 12.mp3,3.89,M
O Santo Rosário/CD 2/13 Faixa 13.mp3,534.59,K
O Santo Rosário/CD 2/14 Faixa 14.mp3,4,M
O Santo Rosário/CD 2/15 Faixa 15.mp3,608.88,K
O Santo Rosário/CD 2/16 Faixa 16.mp3,3.99,M
O Santo Rosário/CD 2/17 Faixa 17.mp3,445.21,K
O Santo Rosário/CD 2/18 Faixa 18.mp3,4.17,M
O Santo Rosário/CD 2/19Faixa 19.mp3,356.23,K
O Santo Rosário/CD 2/20 Faixa 20.mp3,4.12,M
O Santo Rosário/CD 2/21 Faixa 21.mp3,1.59,M
Passos no Silêncio/01-Esposo Adorado.mp3,2.65,M
Passos no Silêncio/02-Shema Yisrael.mp3,3.12,M
Passos no Silêncio/03-Divina Mestra.mp3,3.23,M
Passos no Silêncio/04-Meu Canto de Hoje.mp3,3.72,M
Passos no Silêncio/05-Anúncio da Natividade.mp3,3.51,M
Passos no Silêncio/06-Jesus Verbo de Deus.mp3,3.5,M
Passos no Silêncio/07-O Êxtase de Santa Teresa.mp3,2.45,M
Passos no Silêncio/08-A Rosa Desfolhada.mp3,5.13,M
Passos no Silêncio/09-Viva o Amor.mp3,1.93,M
Passos no Silêncio/10-A Sagrada Face.mp3,6.02,M
Passos no Silêncio/11-Solidão.mp3,4.03,M
Passos no Silêncio/12-Divino Diálogo.mp3,3.53,M
Passos no Silêncio/13-Vivo Sem Viver em Mim.mp3,3.8,M
Só Deus Basta/01 Eleva o Pensamento.mp3,3.27,M
Só Deus Basta/02 Quem nos Separará.mp3,3.66,M
Só Deus Basta/03 A Senhora.mp3,3.03,M
Só Deus Basta/04 Jesus Só.mp3,2.86,M
Só Deus Basta/05 Celeste Legião.mp3,3.48,M
Só Deus Basta/06 Fonte Selada.mp3,2.95,M
Só Deus Basta/07 Santa Cruz.mp3,2.56,M
Só Deus Basta/08 Débil Ave.mp3,2.81,M
Só Deus Basta/09 Cântico Espiritual II.mp3,3.5,M
Só Deus Basta/10 Obra Viva.mp3,3.03,M
Só Deus Basta/11 Quem Como Deus-.mp3,2.81,M
Só Deus Basta/12 Bendito Seja Aquele.mp3,2.14,M
Só Deus Basta/13 Subida do Monte.mp3,3.75,M
Só Deus Basta/14 Virgem Santa.mp3,2.9,M
Só Deus Basta/15 Para a Pátria.mp3,3.94,M
Terço da Misericórdia Meditado (Beata Catharina Emmerich)/09 Terço com meditações de Beata Catharina Emmerich.wma,1.89,M
Terço da Misericórdia Meditado (Beata Catharina Emmerich)/10 Terço com meditações de Beata Catharina Emmerich.wma,1.7,M
Terço da Misericórdia Meditado (Beata Catharina Emmerich)/11 Terço com meditações de Beata Catharina Emmerich.wma,1.56,M
Terço da Misericórdia Meditado (Beata Catharina Emmerich)/12 Terço com meditações de Beata Catharina Emmerich.wma,1.98,M
Terço da Misericórdia Meditado (Beata Catharina Emmerich)/13 Terço com meditações de Beata Catharina Emmerich.wma,1.66,M
Terço da Misericórdia Meditado (Beata Catharina Emmerich)/14 Terço com meditações de Beata Catharina Emmerich.wma,2.66,M
Terço da Misericórdia Meditado (Santa Faustina)/02 Terço com meditações de Santa Faustina.wma,1.9,M
Terço da Misericórdia Meditado (Santa Faustina)/03 Terço com meditações de Santa Faustina.wma,2.51,M
Terço da Misericórdia Meditado (Santa Faustina)/04 Terço com meditações de Santa Faustina.wma,2.31,M
Terço da Misericórdia Meditado (Santa Faustina)/05 Terço com meditações de Santa Faustina.wma,2.42,M
Terço da Misericórdia Meditado (Santa Faustina)/06 Terço com meditações de Santa Faustina.wma,1.52,M
Terço da Misericórdia Meditado (Santa Faustina)/07 Terço com meditações de Santa Faustina.wma,2.6,M
Uma Noite Escura/.directory,67,B
Uma Noite Escura/Kelly Patricia - 1 - Noite Escura (Parte 1).mp3,9.1,M
Uma Noite Escura/Kelly Patricia - 10 - Anjo do menino Jesus.mp3,6.64,M
Uma Noite Escura/Kelly Patricia - 11 - Anjo da Ressurreição.mp3,8.94,M
Uma Noite Escura/Kelly Patricia - 12 - Fornalha Ardente.mp3,7.8,M
Uma Noite Escura/Kelly Patricia - 13 - Cântico Espiritual.mp3,8.62,M
Uma Noite Escura/Kelly Patricia - 14 - Chama Saborosa.mp3,8.3,M
Uma Noite Escura/Kelly Patricia - 2 - Noite Escura (Parte 2).mp3,10.78,M
Uma Noite Escura/Kelly Patricia - 3 - A Vitória.mp3,5.33,M
Uma Noite Escura/Kelly Patricia - 4 - Meu Anjo da Guarda.mp3,8.11,M
Uma Noite Escura/Kelly Patricia - 5 - Tarde te amei.mp3,9.32,M
Uma Noite Escura/Kelly Patricia - 6 - Tu És Digno.mp3,10.14,M
Uma Noite Escura/Kelly Patricia - 7 - Via Sacra.mp3,7.83,M
Uma Noite Escura/Kelly Patricia - 8 - Exaltação da Santíssima Virgem.mp3,9.47,M
Uma Noite Escura/Kelly Patricia - 9 - A Castidade.mp3,6.81,M
Verbi Sponsa/01 A voz do meu Amado.mp3,8.03,M
Verbi Sponsa/02 Dialogo de amor.mp3,3.95,M
Verbi Sponsa/03 O Amado.mp3,8.49,M
Verbi Sponsa/04 Cristalina fonte.mp3,8.08,M
Verbi Sponsa/05 Formosa e bela.mp3,10.04,M
Verbi Sponsa/06 Minha vinha.mp3,6.55,M
Verbi Sponsa/07 Beija-me.mp3,4.66,M
Verbi Sponsa/08 Doce cacador.mp3,5.16,M
"Verbi Sponsa/09 Jesus, meu tudo.mp3",6.6,M
Verbi Sponsa/10 Chama.mp3,9.3,M
Verbi Sponsa/11 Belissimo Esposo.mp3,11.57,M
Verbi Sponsa/12 Esposa das esposas.mp3,8.18,M
Verbi Sponsa/13 Amada de Deus.mp3,4.97,M
Viver de Fé/.directory,47,B
Viver de Fé/01 Ideal de amor.mp3,3.65,M
Viver de Fé/02 Quem será ela.mp3,2.29,M
Viver de Fé/03 Sede perfeitos.mp3,3.45,M
Viver de Fé/04 Viver de fé.mp3,2.86,M
Viver de Fé/05 Não vos preocupeis.mp3,3.53,M
Viver de Fé/06 Flor celeste.mp3,3.33,M
Viver de Fé/07 Hóstia branca.mp3,2.72,M
Viver de Fé/08 Anjo da guarda.mp3,2.44,M
Viver de Fé/09 Alma livre.mp3,3.21,M
Viver de Fé/10 Quem tem Jesus tem tudo.mp3,2.74,M
Viver de Fé/11 O cego de Jericó.mp3,3.33,M
Viver de Fé/12 Sumo mistério.mp3,3.14,M
Viver de Fé/13 Que será ver-Te Senhor-.mp3,3.45,M
Viver de Fé/14 Deus fez Maria.mp3,3.13,M
Viver de Fé/15 Tempos bélicos.mp3,3.38,M
