Filename,Size,Unit
CD1/1-19 I Will Survive.mp3,8.11,M
CD1/1-17 Cuba.mp3,7.13,M
"CD1/1-14 Nein, Mann! (Original Mix).mp3",6.97,M
CD1/1-07 Oh O O O Oh Ooh (7 Nation Army.mp3,6.81,M
CD1/1-01 Waar Is Da Feestje.mp3,6.77,M
CD1/1-20 Bésame Mucho.mp3,6.6,M
CD1/1-16 Loca People (Radio Edit).mp3,6.55,M
CD1/1-06 Mijn Nr. 1.mp3,6.43,M
CD1/1-09 Tringeling.mp3,6.42,M
CD1/1-05 Mag Ik Je Kussen_.mp3,6.39,M
CD1/1-02 Agadu.mp3,6.14,M
CD1/1-11 Barbra Streisand.mp3,5.88,M
CD1/1-10 Lieve Marina.mp3,5.84,M
CD1/1-03 _O Sarracino.mp3,5.83,M
"CD1/1-18 Que Si, Que No.mp3",5.83,M
CD1/1-13 Fjèstje Bouwn.mp3,5.82,M
CD1/1-21 Leo.mp3,5.81,M
CD1/1-08 Played-A-Live (The Bongo Song).mp3,5.69,M
CD1/1-22 Met Marlous Onder De Douche.mp3,5.66,M
CD1/1-04 Far l'amore.mp3,5.53,M
CD1/1-12 Runaway.mp3,5.02,M
CD1/1-15 Meisjes Met IJsjes (Radio Edit).mp3,3.96,M
CD2/2-20 Meisjes Met Rode Haren.mp3,8.67,M
CD2/2-18 Met De Wijven Niks As Last.mp3,8.16,M
CD2/2-03 The Final Countdown.mp3,7.68,M
CD2/2-13 Laat Het Gras Maar Groeien.mp3,7.52,M
CD2/2-05 Club Can't Handle Me (feat. Dav.mp3,7.07,M
CD2/2-06 Give Me Everything (feat. Ne-Yo.mp3,6.91,M
CD2/2-08 Take On Me.mp3,6.86,M
CD2/2-09 Sometimes.mp3,6.6,M
CD2/2-11 Put the Light On the Lady.mp3,6.5,M
CD2/2-17 Per Spoor (Kedeng Kedeng).mp3,6.49,M
CD2/2-02 Always Look On the Bright Side.mp3,6.44,M
CD2/2-21 Zak Es Lekker Door.mp3,6.17,M
CD2/2-10 Mr. Saxobeat.mp3,5.88,M
CD2/2-07 Walk On Water (H2O Radio Mix).mp3,5.81,M
CD2/2-16 Vonken & Vuur.mp3,5.64,M
CD2/2-14 Deze Nacht Mag Eeuwig Duren.mp3,5.61,M
CD2/2-12 Cherie Is In da House.mp3,5.34,M
CD2/2-19 De Marie Louise.mp3,5.26,M
CD2/2-15 Shout Shout.mp3,5.02,M
CD2/2-04 One (Radio Edit).mp3,4.99,M
CD2/2-01 You'll Never Walk Alone (Stereo).mp3,4.84,M
CD2/2-22 De Dikke Nek Can-Can.mp3,4.62,M
Ariclenes.png,106.79,K
DutchReleaseTeam.png,105.06,K
DutchReleaseTeam NFO.txt,467,B
Torrent downloaded from Demonoid.me.txt,46,B
