User Type,Username,Date,Text
,one_seedin_sucka,2011-04-21T01:28Z,"thank you for this. I thought i had all the albums, but apparently im missing a couple and one of the dvd's. Thanx very much"
,ToxicInsanity,2011-04-21T04:59Z,"good job, naming is all correct, and very fast. Seeding 1 mb/s for as long as i can."
,xXHadoukenXx,2011-08-06T20:06Z,Thanks a lot for this!
,noel_lee,2011-10-25T20:43Z,"holy ghosh!! i love this and i dont mind getting freak :-0
thanks. +1"
,smickersote,2012-04-29T06:13Z,really really very good stuff
,zzxhunter,2012-05-07T01:10Z,"Am i the only one who has some tracks ""clipped"" in the end? And some tracks having strange silence in the end? Is it a grab problem or a decoder bug? Please confirm someone.  "
