User Type,Username,Date,Text
,muckymucks,2011-08-28T05:56Z,"Thanks for the upload! New Ninja Turtles series, everybody!"
,MOURGOLYKOS,2011-09-21T20:34Z,@MrDowntown please upload Teenage Mutant Ninja Turtles #2 [IDW] !! It released today!! please do it!
,MOURGOLYKOS,2011-09-22T10:32Z,Teenage Mutant Ninja Turtles #2 [IDW]  RELEASEAD YESTERDAY AND NO ONE HAS UPLOOAD IT YET . DEAR MRDWONTOWN PLEASE DO IT! PLEASE!
,JoeEDangerously,2011-09-26T19:48Z,"Why can't I find #2 ANYWHERE? Is there some problem? It's still not up anywhere. Anywhere. If someone has it, please upload. I can't do it myself. I don't have a scanner. I can't buy comics for a while. Can someone please upload it?"
,Nintendogamernl,2011-10-18T07:39Z,Is this the first Ninja Turtles?
