User Type,Username,Date,Text
,Ashleynin,2011-09-29T18:14Z,"Awesome,,,Glad you did that in a style (:"
,jone1,2011-09-29T21:02Z,"Blu-ray rip in my ass .
Picture quality is like a VHS-rip."
[V],GoodFilms,2011-09-29T23:22Z,...said the guy who hasn't even downloaded it.
,GEORGIAN,2011-10-01T02:52Z,Bad quality and Rusian language...
,GEORGIAN,2011-10-01T02:53Z,"Bad quality and Rusian language...




"
[V],GoodFilms,2011-10-01T11:53Z,Have you read the description?! It's English.
,Suomisisu,2012-02-12T23:45Z,"Reviewers are a bunch of fuckwits. I wish this was DTS but that's ok. I also wish it was 1080p but none-the-less it still looked brilliant on my 42"" LED tv. Thanks a fuck-ton uploader! Don't listen to these faggot naysayers."
