User Type,Username,Date,Text
,carnaval93,2011-05-15T03:21Z,"Thanks for the upload..but on another note,do you know how I can delete the the HD files from before from my computer please.I really need help on this.Thanks in advance"
[T],DBaum23,2011-05-15T04:05Z,Possibly when downloading the files did not finish before playing?  Or did your pc get turned off while downloading?  Might of caused a bad sector on your hard drive?  Also try deleting on reboot verses while windows is running.
,carnaval93,2011-05-16T21:00Z,"It finish downloading and the PC didn't go off while downloading at all.Everytime I tried deleting it or opening the file,the windows stopped working and crashed.I also tried deleting it in safety mode but still doesn't work.How do I delete during reboot??"
[T],DBaum23,2011-05-16T22:49Z,http://www.geeksaresexy.net/2007/06/04/how-to-delete-an-undeletable-file/
,carnaval93,2011-05-17T16:56Z,Thank you so much for the help...it finally worked!!!
