Filename,Size,Unit
"Herz - Joystick Nation; How Videogames Ate our Quarters, Won Our Hearts, and Rewired our Minds (1997).pdf",50.61,M
"Grover & Peschek (eds.) - Voices of Dissent; Critical Readings in American Politics, 8th ed. (2010).pdf",34.2,M
"Morris - Off with their Heads; Traitors, Crooks & Obstructionists in American Politics, Media & Business (2003).pdf",32.32,M
Davis - Prisoners of the American Dream; Politics and Economy in the History of the US Working Class (1986).pdf,15.22,M
Thomson - Culture Wars and Enduring American Dilemmas (2010).pdf,13.4,M
Faludi - Backlash; the Undeclared War against American Women (1991).pdf,9.44,M
"Anderson - Under Surge, Under Siege; the Odyssey of Bay St. Louis and Katrina (2010).pdf",8.3,M
Hurley - One Nation under Israel (1999).pdf,5.81,M
McNeil & Osborne - The Other Hollywood; the Uncensored Oral History of the Porn Film Industry (2005).pdf,5.22,M
"Phillips - American Theocracy; the Peril and Politics of Radical Religion, Oil, and Borrowed Money in the 21st Century (2006).pdf",4.37,M
Safina - A Sea in Flames; the Deepwater Horizon Oil Blowout (2011).pdf,3.69,M
"Berger - Ads, Fads, and Consumer Culture; Advertising’s Impact on American Character and Society (2011).pdf",3.54,M
"Abbott - Sin in the Second City; Madams, Ministers, Playboys, and the Battle for America's Soul (2007).pdf",3.4,M
Glick - War at Home; Covert Action against U.S. Activists and What We Can Do About It (1999).pdf,3.08,M
Kakel - The American West and the Nazi East; a Comparative and Interpretive Perspective (2011).pdf,3.04,M
Pierce - Idiot America; How Stupidity Became a Virtue in the Land of the Free (2009).epub,2.92,M
Catalano - Tragedy in the Gulf; a Call for a New Engineering Ethic (2011).pdf,2.46,M
Franken - Lies and the Lying Liars Who Tell Them (2003).epub,2.42,M
Olds & Schwartz - The Lonely American; Drifting Apart in the Twenty-First Century (2009).pdf,2.01,M
Huffington - Third World America; How Our Politicians are Abandoning the Middle Class and Betraying the American Dream (2010).epub,2,M
Patter & Marshall (eds.) - The Wire; Urban Decay and American Television (2009).pdf,1.96,M
Ehrenreich - Bait and Switch; the (Futile) Pursuit of the American Dream (2005).pdf,1.66,M
McClelland & Tobin - American Dream Dying; the Changing Economic Lot of the Least Advantaged (2010).pdf,1.62,M
Wawro - Quicksand; America's Pursuit of Power in the Middle East (2010).epub,1.31,M
"Jacobson & Burton (eds.) - Modern Polygamy in the United States; Historical, Cultural, and Legal Issues (2011).pdf",1.3,M
"Juarez - Brotherhood of Corruption; a Cop Breaks the Silence on Police Abuse, Brutality, and Racial Profiling (2004).pdf",1.02,M
Shenkman - Just How Stupid Are We; Facing the Truth about the American Voter (2008).djvu,1,M
Dahl - How Democratic is the American Constitution (2001).pdf,931.56,K
"Frank - The Wrecking Crew; How Conservatives Ruined Government, Enriched Themselves, and Beggared the Nation (2008).epub",504.07,K
Mamet - The Secret Knowledge; on the Dismantling of American Culture (2011).epub,372.45,K
