User Type,Username,Date,Text
,sell-out,2011-06-01T11:09Z,"scenebalance can you explain why you dont seed your movies,many people including myself cannot download most of your movie files,stop wasting our bandwidth and time and sort it out "
,billylopez,2011-06-01T12:00Z,"beware of this guys torrents as he never finishes uploading the full file!
D/L at own risk!!!!!"
,soccerguy421,2011-06-02T00:36Z,"Your torrents are a fucking waste' just stop you don't seed shit' it just makes me mad when i spend and hour on a download that will never be finshed'

SO PLEASE JUST STOP OR LEARN HOW TO FUCKING SEED..."
