User Type,Username,Date,Text
,gerardpipi,2011-08-31T21:36Z,hebben jullie geen opvoeding gehad???? een bedankje is lastig zeker??? de andere 2 disc s zet ik er volgend jaar ofzo wel op.
,orbyon,2011-09-01T11:48Z,"He bedankt. goed bezig met die series en subs. Ben momenteel De hoofdprijs aan het downloaden, en dvd3 zou je die nog even kunnen seeden.? Zit op 87 % zou geweldig zijn"
,gerardpipi,2011-09-02T09:55Z,"dan zal ik hem opnieuw moeten uploaden, zal er mee bezig gaan."
,orbyon,2011-09-04T15:24Z,"Zou geweldig zijn...dan seed ik hem wel door.
"
[H],Eppo,2011-09-26T17:41Z,en wie is hier dan 'de originele poster?'
,gerardpipi,2011-09-28T17:32Z,"@33po

dat is pinda die zit op spotnet"
