Filename,Size,Unit
Cold Chisel/04 One Long Day.mp3,11.86,M
Cold Chisel/07 Darskarzine.mp3,7.67,M
Cold Chisel/08 Just How Many Times.mp3,7.45,M
Cold Chisel/06 Rosaline.mp3,7.06,M
Cold Chisel/02 Khe Sanh.mp3,6.84,M
Cold Chisel/09 Teenage Love Affair.mp3,6.64,M
Cold Chisel/03 Home And Broken Hearted.mp3,6.13,M
Cold Chisel/05 Northbound.mp3,5.26,M
Cold Chisel/01 Juliet.mp3,4.97,M
Cold Chisel/10 Drinkin' In Port Lincoln.mp3,4.72,M
Cold Chisel/12 On The Road.mp3,4.51,M
Cold Chisel/11 H-Hour Hotel.mp3,4.31,M
Last Stand/14 Wild Thing.mp3,14.84,M
Last Stand/10 Bow River.mp3,8.21,M
Last Stand/15 Goodbye (Astrid Goodbye).mp3,7.33,M
Last Stand/16 Don't Let Go.mp3,7.13,M
Last Stand/12 Saturday Night.mp3,6.91,M
Last Stand/11 Flame Trees.mp3,6.87,M
Last Stand/06 Tomorrow.mp3,6.58,M
Last Stand/02 Khe Sanh.mp3,5.95,M
Last Stand/13 Star Hotel.mp3,5.78,M
Last Stand/05 Cheap Wine.mp3,5.63,M
Last Stand/04 Janelle.mp3,5.59,M
Last Stand/07 Rising Sun.mp3,5.23,M
Last Stand/09 You Got Nothing I Want.mp3,5.09,M
Last Stand/08 Choir Girl.mp3,5.01,M
Last Stand/01 Standing On The Outside.mp3,4.43,M
Last Stand/03 Twentieth Century.mp3,3.39,M
Standing On The Outside_ The Songs Of Co/2-10 Houndog.mp3,6.97,M
Standing On The Outside_ The Songs Of Co/2-06 Water Into Wine [Live Version].mp3,6.67,M
Standing On The Outside_ The Songs Of Co/2-03 Forever Now.mp3,6.14,M
Standing On The Outside_ The Songs Of Co/2-16 Flame Trees.mp3,6.11,M
Standing On The Outside_ The Songs Of Co/2-12 When The War Is Over.mp3,6.09,M
Standing On The Outside_ The Songs Of Co/2-08 Bow River.mp3,6.04,M
Standing On The Outside_ The Songs Of Co/2-09 Saturday Night.mp3,6.04,M
Standing On The Outside_ The Songs Of Co/2-07 Khe Sanh.mp3,5.77,M
Standing On The Outside_ The Songs Of Co/2-05 My Baby.mp3,5.61,M
Standing On The Outside_ The Songs Of Co/2-17 Janelle.mp3,5.04,M
Standing On The Outside_ The Songs Of Co/2-01 Rising Sun.mp3,4.79,M
Standing On The Outside_ The Songs Of Co/2-18 Shipping Steel.mp3,4.76,M
Standing On The Outside_ The Songs Of Co/2-14 Cheap Wine.mp3,4.75,M
Standing On The Outside_ The Songs Of Co/2-13 You Got Nothing I Want.mp3,4.55,M
Standing On The Outside_ The Songs Of Co/2-11 Choir Girl.mp3,4.52,M
Standing On The Outside_ The Songs Of Co/2-04 No Sense.mp3,4.16,M
Standing On The Outside_ The Songs Of Co/2-02 Standing On The Outside.mp3,4.04,M
Standing On The Outside_ The Songs Of Co/2-15 Four Walls.mp3,3.34,M
The Last Wave Of Summer/14 The Last Wave Of Summer.mp3,8.2,M
The Last Wave Of Summer/10 Red Sand.mp3,7.64,M
The Last Wave Of Summer/05 Bal-A-Versailles.mp3,7.2,M
The Last Wave Of Summer/13 Water Into Wine.mp3,6.04,M
The Last Wave Of Summer/07 He Can't Believe It's Over With Y.mp3,5.94,M
The Last Wave Of Summer/09 Never Stop Loving You.mp3,5.88,M
The Last Wave Of Summer/04 Way Down.mp3,5.72,M
The Last Wave Of Summer/03 Baby's On Fire.mp3,5.45,M
The Last Wave Of Summer/02 The Things I Love In You.mp3,5.4,M
The Last Wave Of Summer/12 So Hard.mp3,5.31,M
The Last Wave Of Summer/15 Once Around The Sun.mp3,5.3,M
The Last Wave Of Summer/01 Mr. Crown Prosecutor.mp3,4.93,M
The Last Wave Of Summer/08 Angel In My Room.mp3,4.89,M
The Last Wave Of Summer/11 Pretty Little Thing.mp3,4.52,M
The Last Wave Of Summer/06 Yakuza Girls.mp3,3.6,M
Twentieth Century/10 Sing To Me.mp3,6.58,M
Twentieth Century/04 Saturday Night.mp3,6.44,M
Twentieth Century/11 The Game.mp3,6.33,M
Twentieth Century/01 Build This Love.mp3,6.29,M
Twentieth Century/07 Flame Trees.mp3,6.22,M
Twentieth Century/14 Nothing But You.mp3,5.81,M
Twentieth Century/15 Yesterdays.mp3,5.51,M
Twentieth Century/08 Only One.mp3,5.48,M
Twentieth Century/13 Temptation.mp3,4.72,M
Twentieth Century/12 Janelle.mp3,4.7,M
Twentieth Century/06 No Sense.mp3,4.4,M
Twentieth Century/02 Twentieth Century.mp3,3.74,M
Twentieth Century/05 Painted Doll.mp3,3.25,M
Twentieth Century/09 Hold Me Tight.mp3,2.52,M
Twentieth Century/03 Ghost Town.mp3,2.42,M
Breakfast At Sweethearts/01 Conversations.mp3,7.13,M
Breakfast At Sweethearts/10 The Door.mp3,6.84,M
Breakfast At Sweethearts/09 Breakfast At Sweethearts.mp3,6.07,M
Breakfast At Sweethearts/03 Dresden.mp3,6.02,M
Breakfast At Sweethearts/07 I'm Gonna Roll Ya.mp3,5.69,M
Breakfast At Sweethearts/06 Shipping Steel.mp3,5.66,M
Breakfast At Sweethearts/02 Merry-Go-Round.mp3,5.3,M
Breakfast At Sweethearts/08 Showtime.mp3,5.23,M
Breakfast At Sweethearts/04 Goodbye (Astrid Goodbye).mp3,4.47,M
Breakfast At Sweethearts/12 Mona And The Preacher.mp3,3.88,M
Breakfast At Sweethearts/13 Metho Blues.mp3,3.67,M
Breakfast At Sweethearts/05 Plaza.mp3,2.99,M
Breakfast At Sweethearts/11 It Ain't Wrong.mp3,2.58,M
Circus Animals/10 Letter To Alan.mp3,9.16,M
Circus Animals/05 Houndog.mp3,7.03,M
Circus Animals/06 Wild Colonial Boy.mp3,6.73,M
Circus Animals/02 Bow River.mp3,6.59,M
Circus Animals/08 Numbers Fall.mp3,6.45,M
Circus Animals/09 When The War Is Over.mp3,6.28,M
Circus Animals/03 Forever Now.mp3,6.04,M
Circus Animals/13 F-111.mp3,5.73,M
Circus Animals/04 Taipan.mp3,5.54,M
Circus Animals/12 Notion For You.mp3,5.41,M
Circus Animals/07 No Good For You.mp3,4.79,M
Circus Animals/01 You Got Nothing I Want.mp3,4.67,M
Circus Animals/11 Suicide Sal.mp3,3.98,M
East/13 Pay Day In A Pub.mp3,6.95,M
East/05 My Baby.mp3,6.38,M
East/02 Never Before.mp3,6.17,M
East/10 Star Hotel.mp3,5.66,M
East/08 Best Kept Lies.mp3,5.18,M
East/06 Tomorrow.mp3,5.08,M
East/09 Ita.mp3,5,M
East/12 My Turn To Cry.mp3,4.77,M
East/01 Standing On The Outside.mp3,4.76,M
East/04 Rising Sun.mp3,4.71,M
East/03 Choirgirl.mp3,4.66,M
East/07 Cheap Wine.mp3,4.47,M
East/15 The Party's Over.mp3,4.11,M
East/14 Hands Out Of My Pocket.mp3,3.94,M
East/11 Four Walls.mp3,3.27,M
Chisel CD1/14 Water into Wine.mp3,6.76,M
Chisel CD1/11 Forever Now.mp3,6.14,M
Chisel CD1/05 When the War Is Over.mp3,6.09,M
Chisel CD1/16 Flame Trees.mp3,6.09,M
Chisel CD1/17 Saturday Night.mp3,6.03,M
Chisel CD1/15 Bow River.mp3,6.01,M
Chisel CD1/20 Khe Sanh.mp3,5.8,M
Chisel CD1/06 Breakfast at Sweethearts.mp3,5.79,M
Chisel CD1/04 Star Hotel.mp3,5.72,M
Chisel CD1/07 My Baby.mp3,5.59,M
Chisel CD1/10 Way Down.mp3,5.46,M
Chisel CD1/13 Merry-Go-Round.mp3,5.17,M
Chisel CD1/02 Rising Sun.mp3,4.78,M
Chisel CD1/12 Cheap Wine.mp3,4.72,M
Chisel CD1/03 The Things I Love in You.mp3,4.62,M
Chisel CD1/08 You Got Nothing I Want.mp3,4.54,M
Chisel CD1/19 Choir Girl.mp3,4.51,M
Chisel CD1/01 Standing on the Outside.mp3,4.04,M
Chisel CD1/18 Goodbye (Astrid Goodbye).mp3,3.98,M
Chisel CD1/09 Yakuza Girls.mp3,3.39,M
Chisel CD2/15 One Long Day.mp3,10.13,M
Chisel CD2/13 Georgia.mp3,9.97,M
Chisel CD2/10 Knockin' On Heaven's Door.mp3,8.59,M
Chisel CD2/16 The Last Wave Of Summer.mp3,7.39,M
Chisel CD2/14 Wild Thing.mp3,6.95,M
Chisel CD2/07 Conversations.mp3,6.27,M
Chisel CD2/08 Never Before.mp3,5.74,M
Chisel CD2/12 Best Kept Lies.mp3,5.26,M
Chisel CD2/09 Ita.mp3,4.93,M
Chisel CD2/06 Shipping Steel.mp3,4.69,M
Chisel CD2/02 Home And Broken Hearted.mp3,4.68,M
Chisel CD2/03 My Turn To Cry.mp3,4.6,M
Chisel CD2/04 No Sense.mp3,4.13,M
Chisel CD2/05 Four Walls.mp3,3.34,M
Chisel CD2/01 Twentieth Century.mp3,3.16,M
Chisel CD2/11 Hold Me Tight.mp3,2.38,M
Swingshift CD1/09 One Long Day.mp3,13.95,M
Swingshift CD1/01 Conversations.mp3,7.29,M
Swingshift CD1/02 Shipping Steel.mp3,6.11,M
Swingshift CD1/03 Breakfast At Sweethearts.mp3,5.58,M
Swingshift CD1/06 Khe Sanh.mp3,5.44,M
Swingshift CD1/04 Rising Sun.mp3,4.98,M
Swingshift CD1/05 Choir Girl.mp3,4.8,M
Swingshift CD1/07 My Turn To Cry.mp3,4.42,M
Swingshift CD1/08 Four Walls.mp3,3.58,M
Swingshift CD2/01 Knockin' On Heavens Door.mp3,8.89,M
Swingshift CD2/08 Goodbye.mp3,8.65,M
Swingshift CD2/02 My Baby.mp3,6.49,M
Swingshift CD2/03 Star Hotel.mp3,6.3,M
Swingshift CD2/04 Don't Let Go.mp3,6.2,M
Swingshift CD2/05 Long As I Can See The Light.mp3,6.17,M
Swingshift CD2/07 Cheap Wine.mp3,5.08,M
Swingshift CD2/06 The Party's Over.mp3,5.04,M
