User Type,Username,Date,Text
,ende1967,2011-01-10T16:47Z,help!!! link werkt niet
[T],Hornigold,2011-01-10T21:04Z,"@ende1967; probeer de magnet link (rechts van de torrent link), die werkt wel. Er ging iets verkeerd bij het uploaden. Of zoek even bij de andere torrent sites, die doen het wel prima."
,donsonata,2011-03-21T10:15Z,"Aub seeden....ik zit vast op 84,9%"
,donsonata,2011-03-21T11:33Z,"Hornigold kan je deze torrent nog een keer aanzetten.
Ik zit vast op 84,9%.
De rest heb ik allemaal al binnen van Dexter alleen deze mis ik nog.
Alvast dank."
,glammaniac,2011-09-01T18:34Z,"Hi, Hornigold! The Download link is not working, as you know, and neither is the Magnet Link. Could you please please fix this? Thank you very much for all this!!"
,1diamante,2012-05-26T08:52Z,Could anyone PLEASE seed this? PLEASE AND THANK YOU SO MUCH
