User Type,Username,Date,Text
,Kashass81,2011-07-11T03:40Z,"Last year Sam - a vibrant, good looking 24 year-old man - was playing soccer when he suffered a series of massive strokes that left him fighting for his life.

Doctors believed that if Sam survived he would be unable to walk or talk.

Australian Story shows how the love and persistence of Sam's fiance and family has led to an amazing medical discovery and ongoing battle with health professionals."
,babybluetits24,2011-07-22T16:20Z,http://en.wikipedia.org/wiki/Australian_Story
,Kashass81,2011-07-26T09:26Z,Hey! Thanks for the Wiki link! I'm loving the Australian Story :D
