Filename,Size,Unit
I Loves You Porgy.mp3,9.15,M
Little Girl Blue.mp3,8.92,M
Ive Got a Crush on You.mp3,8.53,M
Time and Again.mp3,7.59,M
Oh Bess Oh Wheres My Bess.mp3,7.5,M
Who Can I Turn To (When Nobody Needs Me).mp3,7.08,M
Ballad to the East.mp3,6.19,M
Im a Fool to Want You.mp3,6.05,M
Once upon a Summertime.mp3,6.01,M
I Got It Bad (And That Aint Good).mp3,5.46,M
Summertime.mp3,4.54,M
Sophisticated Lady.mp3,4.22,M
Evry Time We Say Goodbye.mp3,3.5,M
A Child Is Born.mp3,3.42,M
album.jpg,15.34,K
