User Type,Username,Date,Text
,Tirill,2011-10-16T11:07Z,"Takker og bukker :) 
Kommer episode 5 også? 
Tangerudbakken får man aldri nok av!! :D"
,fibas,2011-10-16T12:22Z,"hei, har du flere episoder? Flere av dag 2 og? Konge mann;)"
,bigtee92,2011-10-26T22:37Z,Kan du få lagt ut I kveld med ylvis?
,simonandcathyseyes,2011-11-02T21:31Z,"Hey! det er faen meg kult att du leger ut tangerud!!! tusen takk før dem seneste episoderne!!! :D 
lurte på om du oxo har episode 5 6 7 og 8 ?? det koster liksom 70 shhpenn i uka før og se dem på tv norge.no, jævla con artists ass!!! 

håper du har em!!! keep seeding folkens !!! "
