User Type,Username,Date,Text
,goku_dbz,2011-06-01T18:45Z,thank you someuser11 for all these awesome uploads.btw do you happen to have games like condemned 2 and the darkness for the ps3.if so can u up them
,Worldsocold12,2011-06-05T00:40Z,I install the game but it doesn't allow me to run the update. Is anyone else having this trouble?
,runtimmy,2011-06-05T16:01Z,thanks from the PP from Trinidad
,cegmp99,2011-06-23T18:10Z,"sorry but what do you mean by""Put pkg files in the root of a memory stick."" Specifically the root part. I have the multiman and it doesn't appear there. Help will much be appreciated. "
,cegmp99,2011-06-23T18:24Z,Forget what I posted earlier. Got it to install. unfortunately it does not install the update. error 80029567. But thanks anyway.
,fallingstar1,2011-08-28T18:15Z,"kmeaw cfw 3.55
multiman
Extract the files
Put pkg files in the root of a memory stick means dont put them in any folder, insert the memory stick or flash drive having fat 32 format in the PS3, install Package file"" (first the game then the update), 
after this it will work like charm"
