User Type,Username,Date,Text
,valter_henrique,2011-08-19T15:02Z,"Thank you so much, works like a charm dude, great work!"
,CarlesNeo,2011-08-19T15:39Z,@valter_henrique - no problem !!!!!!
,aphr0dite,2011-08-21T13:40Z,Works great! Thanks :)
,Tatletz,2011-08-30T08:21Z,"Thank you for the torrent CarlesNeo!
Do we need to block it with the firewall?"
,CarlesNeo,2011-08-30T10:58Z,@Tatlez - I dont know ! (sorry buddy !) (but I think not !)
,yesterdays_pirate,2011-10-05T00:27Z,"Works like a charm, thanks."
,JohnJo,2011-10-27T08:41Z,"Thanks, it works perfectly. I actually only used your license generator with the current 2.5 version of Revo Uninstaller Pro which I downloaded from their website."
,carlsneo.,2011-12-19T07:25Z,"Hey Guys I have lost my ID ""CarlesNeo""....
I have made this new id....
I will upload from this id from now.....

but the contact address is the same i.e - carles.l.h.skywalker@gmail.com
========================

Thank You !
Keep Rockin'"
,jjacobslooksee,2011-12-19T21:18Z,"Hey, Charles Neo, I have been able to successfully download and register Uninstaller Pro on both a 32 bit Computer w/ Vista OS and a 64 bit computer with Windows 7.  I had been using the free version and found it to be more thorough than the standard Windows programs and features uninstaller.  So far I like the Pro version even better.  Thank you so much--very good torrent.  And may the force be with YOU as well.  "
