Filename,Size,Unit
One.in.the.Gun.2011.PAL.Retail.DD5.1.NL.Subs.DMT/ONE_IN_THE_GUN.ISO,3.76,G
One In The Gun.jpg,5.03,M
"DMT NFO, Read before Playing.txt",1.38,K
One.in.the.Gun.2011.PAL.Retail.DD5.1.NL.Subs.DMT.nfo,1.02,K
Torrent downloaded from AhaShare.com.txt,58,B
Torrent downloaded from Demonoid.me.txt,46,B
Torrent Downloaded from TorrentState.com.txt,46,B
Torrent_downloaded_from_www.puretorrents.cc.txt,36,B
Torrent downloaded from Rarbg.com.txt,33,B
Torrent downloaded from silvertorrents.me.txt,29,B
