User Type,Username,Date,Text
,bi0sh0ck,2011-03-24T14:15Z,"Woohoo,,thnx for the upload HR"
,rakz2cul,2011-03-26T21:08Z,quality wise this one much better http://thepiratebay.org/torrent/6273551/Season_Of_The_Witch_2011_720p_BRRip_x264_%28mkv%29_%5BTorrent-Force%5D
[V],HolyRoses,2011-03-26T21:43Z,you are comparing this to season of the witch?
,rakz2cul,2011-03-26T22:05Z,"oops previous one wrong link,this one correct http://thepiratebay.org/torrent/6273380/London_Boulevard_2010_720p_BDRip_x264_%28mkv%29_%5BTorrent-Force%5D"
[V],HolyRoses,2011-03-26T22:09Z,might as well just download the scene release.  this is encoded for a specific purpose.
[V],HolyRoses,2011-03-27T03:34Z,regarding the red frame.  its in the 720p AMIABLE as well.
,EiNST3iN,2011-03-27T18:00Z,Resolution?
