User Type,Username,Date,Text
[T],qwersd,2011-01-16T11:32Z,Ty...
,AS_WE_FELL,2011-01-16T21:44Z,"Great work

Can you up Blade 1-3 please"
,Ataractic,2011-01-17T05:56Z,"Good film, good print. Thanks a lot."
,jeffsinco,2011-01-17T14:38Z,"thanks men,,, can u upload gulivers travel if you have one"
,athiest09,2011-01-17T15:38Z,can u pls upload LOST TV serial for ipod?
,venugopal_6684,2011-01-21T15:53Z,THANK YOU
,SwtKelly1220,2011-02-27T19:37Z,"Awesome upload, keep up the great work, I love ur uploads they are always great."
