Filename,Size,Unit
back.jpg,455.63,K
Body Language/01 Slow Kylie Minogue.mp3,5.03,M
Body Language/02 Still Standing Kylie Minogue.mp3,6.34,M
Body Language/03 Secret (Take You Home) Kylie Minogue.mp3,6.14,M
Body Language/04 Promises Kylie Minogue.mp3,6.09,M
Body Language/05 Sweet Music Kylie Minogue.mp3,6.75,M
Body Language/06 Red Blooded Woman Kylie Minogue.mp3,8.02,M
Body Language/07 Chocolate Kylie Minogue.mp3,9.62,M
Body Language/08 Obsession Kylie Minogue.mp3,6.6,M
Body Language/09 I Feel For You Kylie Minogue.mp3,7.22,M
Body Language/10 Someday Kylie Minogue.mp3,6.86,M
Body Language/11 Loving Days Kylie Minogue.mp3,7.6,M
Body Language/12 After Dark Kylie Minogue.mp3,6.59,M
Body Language/AlbumArt_{D65CDFDD-80AC-498D-8A01-F450A8083561}_Large.jpg,7.22,K
Body Language/AlbumArt_{D65CDFDD-80AC-498D-8A01-F450A8083561}_Small.jpg,2.33,K
Body Language/AlbumArtSmall.jpg,2.33,K
Body Language/Folder.jpg,7.22,K
front.jpg,275.25,K
