User Type,Username,Date,Text
[T],MitZep,2011-04-11T16:31Z,"Comment on quality and pls seed........
sample included.......
Note: Not Taking Requests"
,B.KITZ,2011-04-11T17:19Z,Awesome up as always ...... Thanks ........
,messi_10,2011-04-12T10:52Z,"Hey! Would it be possible for you to tell me what exactly should I use to rip a DVD into something that's high on quality but low on size? I mean, somewhat like your uploads. :)"
[T],MitZep,2011-04-12T12:00Z,"@messi i use megui..
the trick is using a good source and getting the settings right... try out various settings and choose what yu feel is the best...
there are various tutorials also search google to find them ... :)"
,ThaGoatMan,2011-04-12T13:56Z,Hey Mitzip is the movie any good?
[T],MitZep,2011-04-12T14:15Z,"@goatman its a decent drama film..
albeit a little slow.. "
,x5x5x7,2011-04-13T17:02Z,"+1
thanks"
,messi_10,2011-04-13T19:27Z,Thanks for the help!
