User Type,Username,Date,Text
[V],BLACKTROY,2011-08-28T06:24Z,look  folk something is not right with my pc. here is the serial [  KEFZBGAG ]  go and download from the site. you must type in the serial. no copy and paste
[V],BLACKTROY,2011-08-28T06:26Z,"here is the serial { KEFZBGAG } you must type it in. no copy and paste
my pc  keep losing connection"
,gustavo44,2011-08-28T07:57Z,"KEFZBGAG

The license key you have entered is used by other Adguard application

any way thank you."
,TheMercO,2011-08-28T15:02Z,thanks man for all your work 
,shekhar3,2011-11-01T20:28Z,"serials, not working"
