Filename,Size,Unit
Long Live the Kane/02 Raw [Remix].mp3,5.3,M
Long Live the Kane/09 Mister Cee's Master Plan.mp3,5,M
Long Live the Kane/06 Ain't No Half Steppin'.mp3,4.94,M
Long Live the Kane/04 The Day You're Mine.mp3,4.79,M
Long Live the Kane/07 I'll Take You There.mp3,4.57,M
Long Live the Kane/01 Long Live the Kane.mp3,4.54,M
Long Live the Kane/03 Set It Off.mp3,3.8,M
Long Live the Kane/08 Just Rhymin' With Biz.mp3,3.75,M
Long Live the Kane/05 On the Bugged Tip.mp3,3.06,M
Long Live the Kane/10 Word to the Mother (Land).mp3,2.87,M
