User Type,Username,Date,Text
,ModiDody,2011-07-24T01:30Z,Great Music And Many Thanks To The Uploader ^_^
,alejandro70,2011-07-31T03:50Z,GRACIAS   !!!!!!!!!!!!!!!!!!!!!!!!!!!!!!!!!!!!!!!!!!!!!!!!!!!!!!!!!!!!!!!!!!!!!!!
,kellyjfrog19,2011-11-07T02:39Z,Do you have the mp3 for this? If not can you get it? Please??!!(:
,Viisbyax,2012-03-31T22:00Z,"I don't appreciate you putting your site name in all the tags, and lol at your account/purchase information being in it."
,AllHope1sGone,2012-06-07T10:55Z,Thanks for the upload.  Amazing music.
