User Type,Username,Date,Text
,mgf2308,2011-08-11T15:01Z,"I took these from the original tapes. I think one of the stories has a momentary dropout, a second, maybe two, but these are hard to come by these days so hopefully it won't detract too much from the enjoyment of what I think are the finest recordings of these great stories."
,wendun,2011-08-11T16:43Z,"Thanks.  I have the Robert Powell readings, all the stories in book form and all the film/tv versions still available.  Wonderful ghost stories."
,wendun,2011-08-11T17:11Z,mgf doesn't seem to be seeding but neil1966hardy also has the Argos recordings for anyone interested. 
,mgf2308,2011-08-11T17:19Z,"Seems to be seeding here, but I'll happily take it down. "
,rosie1966,2011-08-13T21:53Z,"Already uploaded:

http://thepiratebay.org/torrent/6543512/M_R_James_read_by_Michael_Hordern"
