Filename,Size,Unit
Grimm S01E09 Of Mouse & Man (Web DL)/Grimm.S01E09.Of.House.And.Man.720p.WEB-DL.DD5.1.H.264-ECI.mkv,1.32,G
Grimm S01E09 Of Mouse & Man (Web DL)/Grimm.S01E09.Of.House.And.Man.720p.WEB-DL.DD5.1.H.264-ECI eng.srt,45.75,K
Grimm S01E09 Of Mouse & Man (Web DL)/Grimm.S01E09.720p.WEB-DL.DD5.1.H.264-ECI nl.srt,34.37,K
INFO TBS/www.black-Sam org     Kom eens Langs !.jpg,13.1,K
INFO TBS/GRIMM S01E09 NL ENG Subs HD (WEB-DL) TBS.txt,2.86,K
INFO TBS/Torrent_downloaded_from_Demonoid.com.txt,563,B
INFO TBS/Black-Sam.txt,128,B
INFO TBS/Torrent_downloaded_from_AhaShare.com.txt,61,B
INFO TBS/Torrent Downloaded from SilverTorrents.me.txt,41,B
INFO TBS/Torrent Downloaded from  Movie-Torrentz.txt,39,B
