User Type,Username,Date,Text
,goosegladwell,2011-05-10T20:49Z,Thank you!  Been waiting for this torrent all week.  Love this show...
,xy6qv,2011-05-13T01:12Z,"No, I'm pretty sure this is episode 4 (I'm like 99% certain I got it from here anyway).

Episode 5 came out on Tuesday, and no one has u/led a torrent for that yet.  Please do.  Always happy to seed."
,dmc_,2011-05-16T06:47Z,"This is confirmed Episode 4. Norm Macdonald is a genius.

Opening line: ""See you in hell Osama Bin Laden"" ROFL"
