User Type,Username,Date,Text
,rockyims,2011-09-29T13:05Z,Wow!man!superb!Thanks!
,romeoluv2539,2011-09-29T15:07Z,Awesome and she is super hott and sexy...beautiful tits and all
,hoebywan,2011-09-29T20:41Z,Yeah nice model but not desi
,mnamna,2011-09-30T12:17Z,Does Desi mean she can speak Spanish?
,hoebywan,2011-10-02T18:45Z,"No it doesn't, if you don't know you don't need to."
,0167,2012-01-06T03:51Z,This ain't an indian girl. That girls gotta be spanish.
,davidrox2,2012-01-17T14:20Z,"fuck off 0167...

keep ur damn doubts to yourself..

don't ruin it for everyone else, asshole"
,kurzavas7,2012-05-11T10:24Z,This is bulgarian girl. And she is |was| a paid companion. Those pictures are taken on a resort called Golden sands on the Black sea. 
