Filename,Size,Unit
"DMT NFO, Read before Playing.txt",1.38,K
No Strings Attached.jpg,6.13,M
No.Strings.Attached.2011.PAL.MultiSubs.DMT/No Strings Attached_DVD5.iso,4.34,G
No.Strings.Attached.2011.PAL.MultiSubs.DMT.nfo,1.11,K
Torrent downloaded from AhaShare.com.txt,58,B
Torrent downloaded from Demonoid.me.txt,46,B
Torrent downloaded from Rarbg.com.txt,33,B
Torrent downloaded from silvertorrents.me.txt,29,B
Torrent Downloaded from TorrentState.com.txt,46,B
Torrent_downloaded_from_www.puretorrents.cc.txt,36,B
