Filename,Size,Unit
Odd and Rude songs/Great_Luke_Ski-Fanboy_Christmas.mp3,9.07,M
Odd and Rude songs/Santa Looked A Lot Like Daddy (Brad Paisley).mp3,7.75,M
Odd and Rude songs/BlizzardChristmasMP32004.mp3,7.73,M
Odd and Rude songs/20  Happy New Year (The Countdown Version).mp3,7.08,M
Odd and Rude songs/Christmas in Heaven.mp3,6.29,M
Odd and Rude songs/SAVAGE - 12 Days of WarCraft.mp3,6.19,M
Odd and Rude songs/Triumph_the_Insult_Comic_Dog-Christmas_Special.mp3,5.55,M
Odd and Rude songs/08 North Pole Comedy Club.mp3,5.5,M
Odd and Rude songs/12  In Excelsius Deo (Gloria Party Anthem).mp3,5.47,M
Odd and Rude songs/Eazy E -- Merry Mother Fuckin' Christmas.mp3,5.39,M
Odd and Rude songs/02 A Red And Green Christmas.mp3,5.19,M
Odd and Rude songs/05 The Man With The Bag.mp3,5.05,M
Odd and Rude songs/21 Christmas Canon Rock.wma,4.65,M
Odd and Rude songs/Christmas - Carol of the Bells (techno remix).mp3,4.51,M
Odd and Rude songs/02 - What If Eminem Did Jingle Bells- - Bob Rivers - White Trash Chistmas (1).mp3,4.31,M
Odd and Rude songs/11 The Christmas Queen.mp3,4.2,M
Odd and Rude songs/03 The Christmas Party Sing-Along.mp3,4.11,M
Odd and Rude songs/Techno - Christmas Rave Mix (1).mp3,3.97,M
Odd and Rude songs/Jimmy Buffett- Ho Ho Ho and a Bottle of Rum.mp3,3.84,M
Odd and Rude songs/01-Aquaclaus.mp3,3.83,M
Odd and Rude songs/the 12 drugs of christmas.mp3,3.83,M
Odd and Rude songs/Nuttin' for Christmas (Barry Gordon).mp3,3.83,M
Odd and Rude songs/Cledus_T_Judd-Christ-mas.mp3,3.81,M
Odd and Rude songs/Brian May & Bad News - Cashing In On Christmas.mp3,3.79,M
Odd and Rude songs/Pouges - Christmas in the Drunk Tank.mp3,3.74,M
Odd and Rude songs/Bob Rivers - Rum Pa Pum Pum.mp3,3.7,M
Odd and Rude songs/The Night Santa Went Crazy EG.mp3,3.68,M
Odd and Rude songs/Muppets' Xmas Carol Finale - It Feels Like Christmas.mp3,3.67,M
Odd and Rude songs/Family Guy Christmas.mp3,3.5,M
Odd and Rude songs/Bob Rivers Comedy Corp - The Twelve Pains of Christmas.mp3,3.38,M
Odd and Rude songs/Destinys Child  -  Eight Days of Christmas.mp3,3.22,M
Odd and Rude songs/I Farted On Santa's Lap.wma,3.22,M
Odd and Rude songs/Simple Plan - My Christmas List.mp3,3.17,M
Odd and Rude songs/Bob_Rivers_Comedy_Corp-Be_Claus_I_Got_High.mp3,3.16,M
Odd and Rude songs/Bob_Rivers_Comedy_Corp-I_Am_Santa_Claus.mp3,3.09,M
Odd and Rude songs/Ray_Stevens-Santa_Claus_is_Watching_You.mp3,3.05,M
Odd and Rude songs/christmas songs - bob rivers twisted christmas.mp3,3.04,M
Odd and Rude songs/Jeff_Foxworthy-Twas_the_Night_After_Christmas.mp3,3.01,M
Odd and Rude songs/Whigfield - Last Christmas(Dance).mp3,2.98,M
Odd and Rude songs/Muppets Muppet Christmas Carol - Marley and Marley.mp3,2.93,M
Odd and Rude songs/Christmas Chech N Chong - Santa Song.mp3,2.92,M
Odd and Rude songs/La Pandilla - Mi burrito Sabanero.mp3,2.91,M
Odd and Rude songs/Hava Nagila (Techno Remix).mp3,2.84,M
Odd and Rude songs/South_Park-Merry_Fucking_Christmas.mp3,2.84,M
Odd and Rude songs/Phish - A Christmas without weed.mp3,2.82,M
Odd and Rude songs/Red_Peters-Holy_Shit_It's_Christmas.mp3,2.8,M
Odd and Rude songs/Bob_Rivers_Comedy_Corp-I_Came_Upon_a_Roadkill_Deer.MP3,2.78,M
Odd and Rude songs/Acoustix-You're_a_Mean_One_Mr_Grinch.mp3,2.73,M
Odd and Rude songs/[Comedy]-Real_Slim_Santa.mp3,2.72,M
Odd and Rude songs/Bob_Rivers_Comedy_Corp-I_Love_to_Choke_My_Chicken_with_My_Hand.mp3,2.71,M
Odd and Rude songs/Bob_Rivers_Comedy_Corp-Who_Put_the_Stump_in_My_Rump.mp3,2.71,M
Odd and Rude songs/South_Park-Oh_Holy_Night.mp3,2.69,M
Odd and Rude songs/Bob_Rivers_Comedy_Corp-Most_Fattening_Time_of_the_Year.mp3,2.63,M
Odd and Rude songs/rodneyrude-heysantaclaus.mp3,2.57,M
Odd and Rude songs/Muppets Christmas Carol - One More Sleep 'Til Christmas.mp3,2.56,M
Odd and Rude songs/Johnny Cash Here Was a Man (1) (1) (1).mp3,2.56,M
Odd and Rude songs/Arrogant_Worms-Christmas_Hangover.mp3,2.54,M
Odd and Rude songs/Rap - Snoop Doggy Dog and Nate Dogg Twas The Night Before Christmas.mp3,2.46,M
Odd and Rude songs/Muppet_Christmas_Carol-It_Feels_Like_Christmas.mp3,2.45,M
Odd and Rude songs/CHRIS~22.MP3,2.43,M
Odd and Rude songs/Bob_Rivers_Comedy_Corp-Sled_Zeppelin.mp3,2.42,M
Odd and Rude songs/Larry the Cable Guy - Christmas Carols Old and New.mp3,2.4,M
Odd and Rude songs/Bob_Rivers_Comedy_Corp-Jingle_Hells_Bells.mp3,2.4,M
Odd and Rude songs/Bob_Rivers_Comedy_Corp-Yellow_Snow.mp3,2.27,M
Odd and Rude songs/Muppets - Muppet Christmas Carol - Scrooge.mp3,2.25,M
Odd and Rude songs/Dr_Dirty_and_the_Pixies-Fa_La_La_La_La.mp3,2.24,M
Odd and Rude songs/Christmas - Frosty The Pervert.mp3,2.23,M
"Odd and Rude songs/Muppets Christmas Carol, It Feels Like Christmas.mp3",2.22,M
Odd and Rude songs/Ray Stevens - The Annual Office Christmas Party.mp3,2.22,M
Odd and Rude songs/Yoopers-Grandpa_Got_Run_Over_By_a_Beer_Truck.mp3,2.2,M
Odd and Rude songs/Jeff_Foxworthy-Twelve_Redneck_Days_of_Christmas.MP3,2.16,M
Odd and Rude songs/Here's Your Sign Christmas.mp3,2.12,M
Odd and Rude songs/Arrogant_Worms-Santa_Got_Arrested.mp3,2.1,M
Odd and Rude songs/Ray_Stevens-Redneck_Christmas.mp3,2.08,M
Odd and Rude songs/Muppets - Muppet Christmas Carol - Thankful Heart.mp3,2.08,M
Odd and Rude songs/South_Park-Oh_Holy_Night_(Cattle_Prod).mp3,2.07,M
Odd and Rude songs/South_Park-Christmas_Time_in_Hell.mp3,2.07,M
Odd and Rude songs/South_Park-Most_Offensive_Song_Ever.mp3,2.07,M
Odd and Rude songs/Ray Stevens -  Xerox Christmas Letter.mp3,2.06,M
Odd and Rude songs/South_Park-Dreidel_Dreidel_Dreidel.mp3,2.06,M
Odd and Rude songs/[Comedy]-Jingle_Bell_Cock.mp3,2.04,M
Odd and Rude songs/Arrogant_Worms-Christmas_in_Ignace.mp3,1.97,M
Odd and Rude songs/Snowball - Jimmy Fallon.mp3,1.91,M
Odd and Rude songs/I_Want_A_Boob_Job_For_Christmas.mp3,1.86,M
Odd and Rude songs/Wreck The Malls.mp3,1.86,M
Odd and Rude songs/Arrogant_Worms-Dad_Threw_Up_on_Christmas_Day.mp3,1.84,M
Odd and Rude songs/Bob_Rivers_Comedy_Corp-Police Stop My Car.mp3,1.81,M
Odd and Rude songs/Sean_Morey-Repo_Man_is_Coming_to_Town.mp3,1.8,M
Odd and Rude songs/[Comedy]-Walking_'Round_Women's_Underwear.mp3,1.77,M
Odd and Rude songs/Bob_Rivers_Comedy_Corp-Little_Hooters_Girl.mp3,1.77,M
Odd and Rude songs/Bob and Tom - An Armenian Christmas.mp3,1.73,M
Odd and Rude songs/AD-DC - Mistress For Christmas.mp3,1.6,M
Odd and Rude songs/Bob_Rivers_Comedy_Corp-Christmas_Party_Song.mp3,1.59,M
Odd and Rude songs/Stompin Tom Connors - Newfie Christmas.mp3,1.57,M
Odd and Rude songs/Twelve_Redneck_Days_of_Christmas(Live).mp3,1.52,M
Odd and Rude songs/Bob_Rivers_Comedy_Corp-Carol_of_the_Bartenders.mp3,1.52,M
Odd and Rude songs/Dr_Dirty_and_the_Pixies-Jingle_Balls.mp3,1.46,M
Odd and Rude songs/Sean Morey - Horny Porny Christmas.mp3,1.45,M
Odd and Rude songs/Bob_Rivers_Comedy_Corp-O_Come_All_Ye_Grateful_Deadheads.mp3,1.4,M
Odd and Rude songs/Christmas - Chevy Chase - Asskiss Remark.wav,1.35,M
Odd and Rude songs/Muppets - Muppet Christmas Carol - We Need A Little Christmas (1).mp3,1.34,M
Odd and Rude songs/Dr_Dirty_and_the_Pixies-Winter_Wonderland.mp3,1.33,M
Odd and Rude songs/Dr_Dirty_and_the_Pixies-Leroy_the_Big_Lipped_Nigger.mp3,1.33,M
Odd and Rude songs/Camp Kill Yourself (CKY) - Shitty Christmas.mp3,1.31,M
Odd and Rude songs/Grinch Soundtrack - Cindy Lou Who - Where Are You Christmas.mp3,1.27,M
Odd and Rude songs/a music box of christmas carols - 13- joy to the world.mp3,1.26,M
Odd and Rude songs/Bob and Tom - The Real 12 Days of Christmas.mp3,1.24,M
"Odd and Rude songs/Comedy - Star Wars Parody - Yoda, Vader and Jabba Sings Christmas Songs.mp3",1.23,M
Odd and Rude songs/Comedy Dr.mp3,1.22,M
Odd and Rude songs/Comedy - Bob & Tom - Bill Clinton Christmas Songs.mp3,1.18,M
Odd and Rude songs/Dr_Dirty_and_the_Pixies-Santa's_Whore.mp3,1.07,M
Odd and Rude songs/comedy - grab your balls like michael jackson.mp3,1.05,M
Odd and Rude songs/Dr_Dirty-Silent_Night.mp3,1.03,M
Odd and Rude songs/Dr_Dirty-Joy_to_the_Girls.mp3,990.23,K
Odd and Rude songs/Dr_Dirty-Rum_Pum_Pum.MP3,980.9,K
Odd and Rude songs/11-twisted_sister-we_wish_you_a_twisted_christmas_(bonus).mp3,932.61,K
Odd and Rude songs/how bill gates stole christmas.mp3,932.55,K
Odd and Rude songs/Christmas Songs - Funny - Dirty Sleigh Ride.mp3,930,K
Odd and Rude songs/Bevis & Butthead- Sounds like Ozzy.mp3,911.8,K
Odd and Rude songs/Bob_Rivers_Comedy_Corp-Hark_the_Hair_Lipped_Angels_Sing.mp3,895.63,K
Odd and Rude songs/Dr_Dirty-Silent_Fart.mp3,856.4,K
Odd and Rude songs/Dr_Dirty_and_the_Pixies-I'll_Be_Stoned_for_Christmas.mp3,802.13,K
Odd and Rude songs/Dr_Dirty-Santa_Claus_is_Coming_to_Town.mp3,780.13,K
Odd and Rude songs/Bob_Rivers_Comedy_Corp-We_Wish_You_Weren't_Living_with_Us.mp3,770.98,K
Odd and Rude songs/comedy - South Park - It's Hard To Be A Jew On Christmas.mp3,736.62,K
Odd and Rude songs/Dr_Dirty-Sleigh_Ride.mp3,708.7,K
The Small one.wma,17.52,M
Alleluya - A New Work.mp3,13.89,M
River.mp3,13.37,M
Hail to the Lord's Anointed.mp3,13.02,M
Silver Bells-White Christmas-Winter Wonderland-.mp3,12.59,M
Noel in G.mp3,11.93,M
Oh Happy Day.mp3,11.77,M
Snowbound.mp3,11.64,M
Snow.mp3,11.61,M
If Every Day Could Be Christmas.mp3,11.58,M
Wish You Were Here.mp3,11.55,M
Christmas Waltz-Deck the Halls.mp3,11.44,M
The First Noel (jazz).mp3,11.32,M
Seeds of Love.mp3,11.24,M
"Jesu, The Very Thought is Sweet.mp3",11.03,M
The Donkey And The Angel.mp3,10.96,M
I'll Be There.mp3,10.86,M
Overture.mp3,10.64,M
It's Christmas everywhere.mp3,10.61,M
Of the Father's Heart Begotten.mp3,10.55,M
Can't let go.mp3,10.52,M
Miss you most.mp3,10.49,M
Jesus oh what a wonderful child.mp3,10.35,M
Lo! He Comes.mp3,10.23,M
Love On Layaway.mp3,10.18,M
Hark The Herald Angels Sing jazz.mp3,10.17,M
Christmas Eve.mp3,9.92,M
I'll Be Home For Christmas jazz.mp3,9.82,M
My Only Wish (This Year).mp3,9.79,M
On Christmas Day.mp3,9.78,M
I Have A Dream.mp3,9.75,M
Christmas Time Is Here.mp3,9.72,M
Merry Christmas Happy Holidays.mp3,9.69,M
Christmas Time.mp3,9.65,M
Make it happen.mp3,9.6,M
God Bless The Master.mp3,9.57,M
Nutcracker Suit Pt 1.mp3,9.45,M
Noel Suisse.mp3,9.45,M
Merry Little Stroll.mp3,9.41,M
Christmas Is Cancelled.mp3,9.34,M
Christmas Day.mp3,9.33,M
I Don't Wanna Spend Wanna Spend One More Christmas Without You.mp3,9.29,M
Masters in this Hall.mp3,9.24,M
Holiday Celebrate.mp3,9.19,M
Come To The Manger.mp3,9.07,M
Have Yourself A Merry Little Christmas jazz.mp3,9.02,M
Moonlight Sonata.mp3,8.82,M
Dream A Dream.mp3,8.81,M
If It's Over.mp3,8.77,M
Wonderful Christmas Time.mp3,8.74,M
Christmas Wish.mp3,8.73,M
Love Is The Gift.mp3,8.7,M
Over the Rainbow.mp3,8.7,M
When You Wish Upon A Star.mp3,8.69,M
Kerst Stille Nacht.mp3,8.67,M
Santa's Little Helper.mp3,8.64,M
Auld Lang Syne.mp3,8.61,M
Jesus Born On This Day.mp3,8.59,M
What Christmas Means to Me.mp3,8.56,M
Een Heel Gelukkig Kerstfeest.mp3,8.55,M
Carol of the Bells.mp3,8.51,M
Sleigh Ride jazz.mp3,8.48,M
Christmas Concerto.mp3,8.45,M
Proper Crimbo.mp3,8.39,M
"Ivy Variations, The.mp3",8.36,M
Christmas Bop.mp3,8.31,M
Ik Droom Van Een Kerstfeest.mp3,8.26,M
Bells Never Had A Sweeter Sound.mp3,8.22,M
Count Your Blessings Instead Of Sheep.mp3,8.22,M
First Snowfall-Let It Snow.mp3,8.21,M
Repentir (O divin Redempteur).wma,8.2,M
Christmas Time (Don't Let The Bells End).mp3,8.19,M
Lord of the Dance - Simple Gifts.mp3,8.15,M
Wounderous Birth.mp3,8.15,M
Wintersong.mp3,8.13,M
Emmanuel.mp3,8.1,M
"Baby Jesus, Hush! Now Sleep.mp3",8.09,M
Christmas Forever.mp3,8.03,M
Here is Santa Claus.mp3,8.01,M
On This Day The Earth Shall Ring.mp3,7.9,M
Night of Silence.wma,7.65,M
"O Come, O Come Emmanuel.mp3",7.62,M
Cantique de Noel.wma,7.51,M
Pie Jesu.mp3,7.51,M
Only For Christmas.mp3,7.48,M
Merry Christmas Tree.mp3,7.45,M
Amazing Grace.mp3,7.38,M
Snoopy's Christmas.mp3,7.38,M
Romance.mp3,7.34,M
Kerstmis is een feest voor iedereen.mp3,7.31,M
All I Want For Christmas is My Two Front Teeth.mp3,7.3,M
O Little Town Of Bethlehem.mp3,7.22,M
Sleigh Bells.mp3,7.22,M
Lets Pretend.mp3,7.21,M
Eenzame kerst.mp3,7.19,M
Winter.mp3,7.14,M
Christmas Swing.mp3,7.05,M
The Infant King.mp3,7.02,M
Winter Weather.mp3,7.01,M
Hallelujah.mp3,6.98,M
Personent Hodie.mp3,6.9,M
Oh My Lord What A Morning.mp3,6.89,M
Mary's Boy Child.mp3,6.82,M
"Tomorrow Children, Somethin's Happening.mp3",6.82,M
"Stille nacht, Heilige nacht.mp3",6.81,M
This is When We Celebrate.mp3,6.75,M
The Little Boy That Christmas Forgot.mp3,6.7,M
No Place like Home for the Holidays.mp3,6.67,M
Christmas in New Orleans.mp3,6.66,M
Christmas Dreaming.mp3,6.64,M
"It's Christmas Time - Sleep Well, Little Children.mp3",6.63,M
Good Moring Blues (I Want To See Santa Claus).mp3,6.59,M
O Quickly Come.mp3,6.52,M
Santa Cluas Blues.mp3,6.5,M
The Singing Snowman.mp3,6.47,M
Handel's Largo.mp3,6.45,M
Christmas Bells at Eventide.mp3,6.44,M
Come Ye Sheperds.mp3,6.43,M
On Chritmas Night.mp3,6.41,M
Run Run Rudolph.mp3,6.4,M
Under the Mistletoe.mp3,6.34,M
Eleanor Rigby.mp3,6.33,M
Children's Christmas.mp3,6.33,M
"Zat You, Santa Claus.mp3",6.33,M
Snowflake Snowdrop.mp3,6.32,M
"Coventry and Sussex Carols, The.wma",6.28,M
Rejoice Greatly (from Messiah).wma,6.25,M
"Christmas Tree, The.mp3",6.25,M
Soflty Falls the Snow.mp3,6.24,M
Santa's Party.mp3,6.18,M
Let There be Peace on Earth.mp3,6.11,M
Christmas Dragnet-Stan Freberg 1954- (Merry Christmas Childr.mp3,6.09,M
Patapan.mp3,6.09,M
Christmas Island.mp3,6.08,M
Season of Joy.mp3,6.06,M
Santa Clause is on His Way.mp3,6.05,M
Countdown to Christmas.mp3,6.03,M
Oh Du fröhliche.mp3,6.03,M
Come Leave Your Sheep.mp3,6.02,M
Little Christmas Bells.mp3,6.01,M
I Told Santa Claus to Bring Me You.mp3,6,M
Rockin' Robin.mp3,5.97,M
Jingle Bells (2).mp3,5.91,M
O Denneboom.mp3,5.91,M
Frosty.mp3,5.9,M
Tomorrow Comes.mp3,5.81,M
Lights Are Burning On The Christmas Tree.mp3,5.69,M
From Heaven High.mp3,5.68,M
The Night Before Christmas.mp3,5.66,M
It's Beginning To Look A Lot Like Christmas.mp3,5.53,M
Thee Three Kings (ft. MaxOne & DJ Promote).mp3,5.51,M
Sailing.mp3,5.5,M
The Magic Christmas Tree.mp3,5.49,M
"Lo, There a Rose is Blooming.mp3",5.47,M
Hey Santa Claus.mp3,5.4,M
Christmas is Here.mp3,5.34,M
Christmas Dream.mp3,5.3,M
Ma-O-Tzur.mp3,5.3,M
Playing in the Snow.mp3,5.28,M
Christmas Waltz.mp3,5.1,M
The Christmas Overture (A Christmas Celebration from The Wor.mp3,5.07,M
Christmas Instrumental Overture (Christmas Song selection Pa.mp3,4.99,M
Ring Little Bell.mp3,4.93,M
"Mary's Baby, Josephs Lad.mp3",4.87,M
Here we go Round the Chritsmas Tree.mp3,4.85,M
"Fum, Fum, Fum.mp3",4.77,M
This New Year (Together with Cliff Richard).mp3,4.72,M
"Jesu, Joy of Man's Desiriing.mp3",4.6,M
"Candlelight Carol (Angels are Singing, The Christ Child Is b.mp3",4.33,M
Little Jack Frost Got Lost.mp3,4.33,M
Here We Come Awassailing.mp3,4.3,M
Concerto in E Flat Major Largo -Instrumental (Carol's I'm Dr.mp3,4.24,M
Venete (O Come All ye Faithful)(Together With Cliff Richard).mp3,4.21,M
"Thy Little Ones, Dear Lord, Are We.mp3",4.18,M
O Christmas You Season Of Childlike Delight.mp3,4.16,M
Faith of Our Fathers.wma,4.03,M
Mele Kalikimaka.wma,4.02,M
Tennessee Christmas (A Country Christmas).mp3,3.92,M
Instrumental Sonata in F Maj allegro.mp3,3.87,M
Christmas on the Moon (Christmas Songs for Little Children 1.mp3,3.81,M
L'Encouragement Op34 in E Maj Andantino (Rudolph The Red Nos.mp3,3.8,M
The Power Of Love.mp3,3.78,M
This Gift.mp3,3.78,M
Christmas in Killarney.wma,3.78,M
What Child is This (Greensleves) (Christmas Songs Selection .mp3,3.76,M
The Saviour Is Born.mp3,3.76,M
"O Little Town,Twinkle Twinkle (Together with Cliff Richard).mp3",3.76,M
Alleluiah.mp3,3.75,M
I Watch you Sleeping.mp3,3.7,M
In Bethlehem Slowly.mp3,3.68,M
Christmas Wrapping.mp3,3.68,M
Christmas never Comes (Together with Cliff Richard).mp3,3.66,M
See Amid The Winter Snow.mp3,3.58,M
God Bless The Child.mp3,3.58,M
Christmas Alphabet (Candles) (Together With Cliff Richard).mp3,3.55,M
All Through the Night.mp3,3.52,M
Have Yourself A Merry Little Christmas.mp3,3.5,M
Where is Christmas.mp3,3.5,M
A Spaceman Came Travelling.mp3,3.49,M
Christmas Through Your Eyes.mp3,3.46,M
Rocking.mp3,3.45,M
"You Green And Glittering Tree, Good Day.mp3",3.41,M
All My Heart This Night Rejoices.mp3,3.41,M
Runaway Snowman -Story-(The Night Before Christmas Songs).mp3,3.39,M
Scarlet Ribbons (Together with Cliff Richard).mp3,3.38,M
Saviour's Day.mp3,3.36,M
Merry Christmas Baby.mp3,3.32,M
December Will Be Magic.mp3,3.32,M
The Trumpet Shall Sound.mp3,3.32,M
The Coldest Night Of The Year (Incredible Phat).mp3,3.3,M
Following a Star (Christmas Song selection Part 4).mp3,3.25,M
Hard Candy Christmas (A Country Christmas).mp3,3.24,M
It's Snowing Slowly.mp3,3.21,M
The Millenium Prayer.mp3,3.2,M
Santa's List.mp3,3.2,M
Lord Jesus Turned Round To Us.mp3,3.2,M
I Wish It Could Be Christmas Everyday.mp3,3.19,M
Let's Make a Baby King (Christmas Song Selection Part 4).mp3,3.19,M
I Want to Come Home For Christmas.mp3,3.18,M
Following the Star.mp3,3.17,M
That's What Christmas Means To Me.mp3,3.17,M
The First Christmastide (Christmas Song selection Part 4).mp3,3.16,M
Marys Song.mp3,3.16,M
"Make We Merry - St. George Parish Choir, Belfast; Palestrina Choir, Dublin.mp3",3.16,M
"El Rorro (The Babe) - St. George Parish Choir, Belfast; Palestrina Choir, Dublin.mp3",3.15,M
Fairytale Of New York.mp3,3.15,M
I Believe In Santa Claus.mp3,3.15,M
Must Be Santa (Rudolph The Red Nosed Reindeer).mp3,3.14,M
The Most Beautiful Day Of The year (Christmas moods).mp3,3.14,M
First Christmastide.mp3,3.14,M
Come to Us.mp3,3.14,M
A Christmas to Remember.mp3,3.13,M
"Sleep, Holy Child - St. George Parish Choir, Belfast; Palestrina Choir, Dublin.mp3",3.12,M
Christmas In Dixie (A Country Christmas).mp3,3.07,M
Last Christmas.mp3,3.07,M
Stay Another Day.mp3,3.06,M
I Believe In Christmas.mp3,3.06,M
Twinkle Twinkle Little Town.mp3,3.06,M
Watching the Flame.mp3,3.06,M
Happy New Year.mp3,3.05,M
O Holy Night.mp3,3.04,M
We Should Be Together.mp3,3.04,M
I Won't Be Home For Christmas.mp3,3.04,M
Sleep Children.mp3,3.04,M
The Christmas Sun.mp3,3.04,M
The Very Best Time Of The Year (Christmas Song Selection Par.mp3,3.03,M
In the Bleak Mid-Winter.mp3,3.03,M
Mary's Boy Child-O my Lord.mp3,3.03,M
I Think When I read The Sweet story Of old (The Salvation Ar.mp3,3.01,M
Father Christmas Eyes.mp3,2.99,M
Christmas is Quiet.mp3,2.98,M
Surfin Santa (Australia Way).mp3,2.96,M
When Christmas Morn Is Dawning.mp3,2.96,M
Thank God It's Christmas.mp3,2.95,M
While By My Sheep I Watched At Night.mp3,2.95,M
"Before The Marvel Of This Night - St. George Parish Choir, Belfast; Palestrina Choir, Dublin.mp3",2.94,M
That Christmas Feeling.mp3,2.94,M
All Alone On Christmas.mp3,2.94,M
It Was A Silent Night.mp3,2.92,M
A Child This Day Is Born.mp3,2.9,M
"Verbum Patris Umanatur,O, O.mp3",2.9,M
The Song of Angels.mp3,2.9,M
I'm Dreaming Of A White Christmas (Together with Cliff Richa.mp3,2.89,M
Step Into Christmas.mp3,2.88,M
Endless Christmas.mp3,2.88,M
A New Star.mp3,2.88,M
Once in Royal David's City.mp3,2.88,M
I'm Sending A Letter to Santa Claus-Arthur Askey 1940- (Merr.mp3,2.88,M
Save a Child.mp3,2.87,M
Santa Claus Got Stuck In My Chimney.mp3,2.87,M
Sleep Children Sleep (Christmas Song Selection pt 4).mp3,2.86,M
Angels from the Realms Of Glory.mp3,2.86,M
Silver and Gold (Christmas Moods).mp3,2.86,M
Light A Candle In The Chapel.mp3,2.85,M
Little Town.mp3,2.85,M
Dreaming of Christmas.mp3,2.85,M
O Come All Ye Faithful.mp3,2.85,M
Do You Hear What I Hear (Carol's I'm Dreaming of a Merry Chr.mp3,2.84,M
A Christmas Letter.mp3,2.84,M
Kings Song.mp3,2.83,M
Nelo Star.mp3,2.83,M
The Most Wonderfull Birthday of all.mp3,2.83,M
Cyber Santa.mp3,2.83,M
Mistletoe and Wine.mp3,2.82,M
Driving Home For Christmas.mp3,2.81,M
Christmas in Hawaii (Christmas Songs for Little Children 199.mp3,2.79,M
A Winter's Tale.mp3,2.76,M
"The Three Little Dwarfs (Hard Rock, Coco and Joe).mp3",2.76,M
The Happiest Christmas Of All-Eric Morcombe & Ernie Wise 196.mp3,2.76,M
Nativity Carol.mp3,2.75,M
It's Christmas Time Again.mp3,2.75,M
Christmas In My Home Town (Christmas Song Selection Part 4).mp3,2.75,M
Shepherd's Pie Carol.mp3,2.74,M
"O Chiristmas, You Season Of Childlike Delight.mp3",2.72,M
All I Want For Christmas You.mp3,2.72,M
Wishin' On A Star.mp3,2.7,M
Twelve Days Of Christmas.mp3,2.7,M
"No Small Wonder - St. George Parish Choir, Belfast; Palestrina Choir, Dublin.mp3",2.69,M
Ave Maria.mp3,2.69,M
The Christmas Blues.mp3,2.69,M
Christmas In Virginia.mp3,2.68,M
Shephards Left Their Flocks A-Straying.mp3,2.67,M
The Christmas Tree With Its Candles Gleaming.mp3,2.67,M
Christmas.mp3,2.67,M
Cool Yule.mp3,2.67,M
Christmas Time's A'Commin (A Country Christmas).mp3,2.66,M
He's A Chubby Little Fellow.mp3,2.66,M
Wonderful Words (The Salvation Army Junior Singers Christmas.mp3,2.65,M
Can You Stop The Cavalry.mp3,2.65,M
Rockin' Little Christmas (A Country Christmas).mp3,2.63,M
Happy Christmas Little Friend.mp3,2.63,M
Feliz Navidad (Carol's I'm Dreaming of a Merry Christmas).mp3,2.62,M
Someday At Christmas Time.mp3,2.62,M
The Little Fir Tree-Peter Brough & Archie Andrews 1953-(Merr.mp3,2.61,M
He'll Be Coming Down The Chimney (Like He Always Did Before).mp3,2.61,M
I Only want you For Christmas (A Country Christmas).mp3,2.59,M
Lullaby.mp3,2.58,M
Carol of Thanks.mp3,2.57,M
Ring out Selstice Bells.mp3,2.57,M
Christmas Spirits.mp3,2.57,M
You Don't Have To Be A Santa Claus.mp3,2.57,M
Merry Christmas Everybody.mp3,2.56,M
Come Running You Shepherds.mp3,2.55,M
Early Christmas Morning.mp3,2.55,M
O Christmas Bush.mp3,2.55,M
A Baby In The Cradle.mp3,2.54,M
Love is a Christmas Rose (Christmas Moods).mp3,2.54,M
Angels We Have Heard on High.mp3,2.53,M
If It Doesn't Snow On Christmas.mp3,2.53,M
You're All I Want For Christmas.mp3,2.53,M
Merry Christmas Everyone.mp3,2.53,M
It Was On A Starry Night-Castleford Salvation Army Citadel S.mp3,2.52,M
2000 Miles.mp3,2.52,M
I'm not Dreaming Of a White Christmas (Gilbert O'Sullivan).mp3,2.52,M
How Do I wrap My Heart Up For Christmas (A Country Christmas.mp3,2.51,M
(Everybody's Waitin' For) The Man With The Bag.mp3,2.5,M
"The Night Before Christmas (In Texas, That Is).mp3",2.5,M
You Make It Feel Like Christmas.mp3,2.5,M
How far Is it To Bethlehem (The Salvation Army Junior Singer.mp3,2.5,M
I'd Be Home On Christmas Day.mp3,2.5,M
Snowy White Snow And Jingle Bells-Dorothy Squires 1949- (Mer.mp3,2.49,M
An Old Fashioned Tree.mp3,2.49,M
Born on Christmas Day.mp3,2.49,M
Sleigh Ride In July.mp3,2.48,M
Country Boys Carol.mp3,2.48,M
The Bells At St Marys.mp3,2.48,M
Another Rock And Roll Christmas.mp3,2.47,M
I Want A Hippopotamus For Christmas-Terry Hall & Lennie The .mp3,2.47,M
Up on the Housetop (Christmas Songs Selection Part1).mp3,2.47,M
Whispering Hope.mp3,2.46,M
Aussie Twelve Days Of Christmas.mp3,2.46,M
"Freddie, The Little Fir Tree.mp3",2.46,M
I Wish My Mom Would Marry Santa Claus.mp3,2.45,M
In The Christmas Mood.mp3,2.45,M
There's A Train Out For Dreamland.mp3,2.45,M
A Folk Song.mp3,2.44,M
Rise Up Shepherd and Follow-Castleford Salvation Army Citade.mp3,2.44,M
Everywhere It Is Christmas.mp3,2.44,M
I Believe In Father Christmas.mp3,2.44,M
Lonely This Christmas(1).mp3,2.44,M
"Merry Texas Christmas, You All.mp3",2.43,M
"Santa, Santa, Santa.mp3",2.43,M
Walking In The Air.mp3,2.43,M
Angels we Have Heard on High (Christmas song selection Part .mp3,2.43,M
So This is Christmas (war is Over).mp3,2.43,M
Go Tell It On The Mountain.mp3,2.42,M
Christmas Makes The Town.mp3,2.42,M
Santa's Elves.mp3,2.41,M
If We Make It Through December (A Country Christmas).mp3,2.4,M
Shinning Star.mp3,2.36,M
We Three Kings.mp3,2.35,M
Merry Christmas Waltz.mp3,2.35,M
Till Santa's Gone-I Just Can't Wait- (A Country Christmas).mp3,2.33,M
"Little Snowman, Little Snowgirl-Mandy Miller 1952- (Merry Ch.mp3",2.33,M
Postage Stamp Gardens.mp3,2.33,M
"Light Of The World - St. George Parish Choir, Belfast; Palestrina Choir, Dublin.mp3",2.32,M
A Cradle In Bethlehem.mp3,2.32,M
Wombling Merry Christmas.mp3,2.31,M
Where Did My Snowman Go.mp3,2.31,M
Poppy The Puppy.mp3,2.29,M
Go There.mp3,2.28,M
Merry Christmas Darling (Christmas moods).mp3,2.27,M
Natividad  (Christmas song selection Part 4).mp3,2.27,M
Its Christmas Time.mp3,2.26,M
Christmas Roses.mp3,2.26,M
"Above, On The Mountains.mp3",2.26,M
Imagine - Lennon.mp3,2.25,M
Shepherds Dream (Christmas in Australia).mp3,2.25,M
Mister Santa (Christmas moods).mp3,2.25,M
Wellcome to World.mp3,2.25,M
When People Build Walls.mp3,2.24,M
Look Out The Window (The Winter Song).mp3,2.24,M
A Night To Remember.mp3,2.23,M
Christmas Wishes.mp3,2.23,M
Crown of Roses (Christmas song selection Part 4).mp3,2.23,M
When The Crimson Sun Set (In Excelsius) (Christmas song sele.mp3,2.23,M
When A Child Is Born.mp3,2.23,M
Six White Boomers.mp3,2.23,M
Christmas is Coming.mp3,2.23,M
I Want a Rock 'N' Roll Guitar.mp3,2.23,M
Three Wise men (Christmas Song selection Part 4).mp3,2.23,M
"Sing Lullaby! Lullaby Baby - St. George Parish Choir, Belfast; Palestrina Choir, Dublin.mp3",2.22,M
Huron Carol.mp3,2.22,M
The Christmas Song (Merry Christmas To You).mp3,2.22,M
Feed The World (Do They Know It's Christmas).mp3,2.2,M
What are you doing New Year's Eve.mp3,2.2,M
Good Old Wally King.mp3,2.2,M
Silent Night.mp3,2.2,M
3 Wise Men.mp3,2.2,M
Jingle Bells-Sleigh Ride through the Snow.mp3,2.19,M
Christmas Bush for His Adorning.wma,2.19,M
Adeste Fideles.mp3,2.19,M
Merry Bloody Xmas.mp3,2.18,M
Santa Got Lost In Texas (Christmas Song Selection part 4).mp3,2.18,M
Christmas Comes But Once a Year.mp3,2.18,M
Sound The Battle cry (The Salvation Army Junior Singers Chri.mp3,2.17,M
Theres Nothing More Like Christmas.mp3,2.17,M
Christmas Picnic.mp3,2.17,M
The Little Christmas Tree.mp3,2.17,M
If I Were A Carpenter.mp3,2.16,M
Light Of The Stable.mp3,2.16,M
