Filename,Size,Unit
He's The Aussie Santa.mp3,2.16,M
Merry Christmas To you (Christmas Moods).mp3,2.16,M
David Song (Who'll Come With Me).mp3,2.16,M
Carol Of The Birds (Aus).mp3,2.14,M
Three Kings From Persian Lands Afar-Ely Cathedral Choir-(o C.mp3,2.13,M
"The Happy Reindeer-Dancer, Prancer & Nervous 1959- (Merry Ch.mp3",2.13,M
Stars are Shining (The Salvation Army Junior Singers Christm.mp3,2.13,M
Mistletoe And Holly.mp3,2.12,M
A Quite Heart.mp3,2.12,M
Peace On Earth-The Little Drummer Boy.mp3,2.12,M
The Seven Joys Of Mary.mp3,2.12,M
Nevin_ The Rosary.mp3,2.12,M
Everyone's A Child At Christmas.mp3,2.12,M
Candy Cane and Sugary Plum.mp3,2.11,M
White Christmas.mp3,2.11,M
Sleep Tight Tonight (Christmas Songs for Little Children 199.mp3,2.1,M
The Little Drummer Boy.mp3,2.1,M
Silver Bells.mp3,2.09,M
It's a Lovely Day for Snowmen (Christmas Songs for Little Ch.mp3,2.09,M
"Don Oiche Úd I mBeithil - St. George Parish Choir, Belfast; Palestrina Choir, Dublin.mp3",2.08,M
Christmas in the Scrub.mp3,2.07,M
Jolly Old Saint Nicholas.mp3,2.07,M
Good Christian Men Rejoice (The Salvation Army junior Singer.mp3,2.06,M
Snowflakes-Mandy Miller 1959- (Merry Christmas Children Ever.mp3,2.06,M
Santa looked A Lot like Daddy (A Country Christmas).mp3,2.06,M
Ryebuck Santa.mp3,2.06,M
"Wiggly, Wiggly Christmas.mp3",2.06,M
The Night Before Christmas (Christmas Songs for Little Child.mp3,2.05,M
Star of Hope (Christmas moods).mp3,2.05,M
A Virgin Most Pure.mp3,2.05,M
Boogie Woogie Santa Claus.mp3,2.04,M
Walking in a Winter Wonderland (Christmas moods).mp3,2.03,M
We Need A Little Christmas (A Country Christmas).mp3,2.03,M
Sans Day Carol (The First Tree In The Greenwood Was The Holl.mp3,2.03,M
Stop The Cavalry.mp3,2.02,M
"O Come, Little Children.mp3",2,M
"Round, Round The Christmas Tree.mp3",2,M
Santa Claus Is Comin' To Town.mp3,2,M
Santa Never Made It Into Darwin.mp3,1.99,M
Wonderful White World Of Winter (Christmas song selection Pa.mp3,1.98,M
Listen.mp3,1.96,M
In Dulce Jublie.mp3,1.96,M
"Ring, Little Bells.mp3",1.96,M
When Santa Claus gets Your Letter (Christmas Moods).mp3,1.96,M
An Old Christmas Card.mp3,1.95,M
Our Christmas Song.mp3,1.95,M
"Christmas Child (Loo, Loo, Loo).mp3",1.95,M
The Little Laplander-Max Bygraves 1955  (Merry Christmas Chi.mp3,1.95,M
A Happy Christmas Time.mp3,1.95,M
C-H-R-I-S-T-M-A-S.mp3,1.95,M
Please Come Home For Christmas.mp3,1.94,M
Dear Father Christmas.mp3,1.94,M
Lippai.mp3,1.94,M
Santa Baby.mp3,1.94,M
Santa Claus is coming to Town.mp3,1.94,M
Never Do A Tango With An Eskimo -Alma Cogan 1955-(Merry Chri.mp3,1.93,M
Mary and Joseph's Lullaby.mp3,1.93,M
Santas Moving To The South Pole.mp3,1.93,M
You Can See Old Santa Claus (When You Find Him In Your Heart).mp3,1.93,M
Brightest And Best Of The Sons Of the Morning-Castleford Sal.mp3,1.92,M
Dear Nightingale Awake.mp3,1.92,M
What A Merry Christmas This Could Be (Christmas Song Selecti.mp3,1.92,M
Merry Christmas Everywhere.mp3,1.92,M
Jesus Christ The Apple Tree.mp3,1.92,M
Star Carol.mp3,1.91,M
As With Gladness Men Of Old.mp3,1.91,M
Blue Christmas.mp3,1.91,M
The Happy Christmas Comes Once More.mp3,1.9,M
Country Christmas (Christmas Song Selction Part 4).mp3,1.89,M
Snowcoach-Russ Conway 1959- (Merry Christmas Children Everyw.mp3,1.89,M
A Winter Boy.mp3,1.88,M
The Lord's Prayer.mp3,1.88,M
Reindeer Express.mp3,1.88,M
10 Little Angels.mp3,1.87,M
Cowboy Carol.mp3,1.87,M
Christmas Cheer.mp3,1.87,M
Christmas is a Birthday.mp3,1.86,M
Snowmans Land-Zack Laurence 1961- (Merry Christmas Children .mp3,1.85,M
Jeff's Christmas Tune.mp3,1.84,M
December Town.mp3,1.84,M
Innkeepers Song.mp3,1.84,M
Suzy Snowflake.mp3,1.83,M
The Little Boy That Santa Forgot.mp3,1.83,M
The Virgin Mary Had A Baby Boy.mp3,1.83,M
Snow for Johnny.mp3,1.82,M
Don't Cry Mr Snowman (Christmas Songs for Little Children 19.mp3,1.81,M
Good King Wenceslas.mp3,1.81,M
"Let It Snow, Let It Snow, Let It Snow.mp3",1.8,M
Roses in December.mp3,1.8,M
The Angels And The Shepherds.mp3,1.8,M
Carol of the Children.mp3,1.79,M
Lighten Up It's Christmas.mp3,1.79,M
"It's A Christmas Party, On The Goodship Feathersword.mp3",1.79,M
Camel Boogie Woogie.mp3,1.78,M
Aussie Jingle Bells.mp3,1.78,M
For Christmas.mp3,1.77,M
Deck the Halls (Disney).mp3,1.77,M
Cool Rockin Santa.mp3,1.77,M
This Time of Year.mp3,1.77,M
Christmas can't be far Away.mp3,1.77,M
Winter Wonderland by Disney.mp3,1.77,M
Christmas Bells (Christmas Song Selection pt 4).mp3,1.76,M
A House With Love in it.mp3,1.76,M
Sing We Now Of Christmas.mp3,1.76,M
"Still, Still, Still.mp3",1.74,M
Hark the Herald Angel Sing.mp3,1.74,M
Coventry Carol.mp3,1.74,M
"Most Wonderful Time Of The Year, The.mp3",1.73,M
I Could Spend Christmas With You-Tommy Roe- (A Rock N Roll C.mp3,1.73,M
C'mon Its An Aussie Christmas.mp3,1.72,M
Christmas Song Medley.mp3,1.72,M
Greensleeves (What Child Is This).mp3,1.72,M
Everybody Wants to be Santa for Christmas.mp3,1.71,M
Pretty Paper.mp3,1.71,M
"Christmas Children, The.mp3",1.7,M
Go Santa Go.mp3,1.69,M
I'll Be Home For Christmas.mp3,1.69,M
The First Noël.mp3,1.68,M
A New Baby For Christmas.mp3,1.68,M
Wonderful Sleigh.mp3,1.67,M
The Magic of Christmas (Christmas songs for Little Children .mp3,1.67,M
Senor Santa Claus.mp3,1.67,M
Father Christmas Showed Me How To Yodel.mp3,1.67,M
"When The Red, Red Robin.mp3",1.67,M
Happy holliday-Come To Holliday Inn.mp3,1.66,M
Sweet Chiming Bells- Castleford Salvation Army Citadel Songs.mp3,1.66,M
Santa Santa (Christmas Songs for Little Children 1994 Vol 3).mp3,1.66,M
Gaudete.mp3,1.65,M
Rocking carol (The Salvation Army junior Singers Christmas).mp3,1.65,M
Christmas Time For Teddies (Christmas Songs for Little Child.mp3,1.64,M
Chrismas Where the Gum Trees Grow.mp3,1.63,M
The Merry Christmas Polka.mp3,1.62,M
Christmas Time..mp3,1.62,M
Swinging Shepherd Blues.mp3,1.62,M
Love Came Down At Christmas-Castleford Salvation Army Citade.mp3,1.6,M
"Colours of Christmas, The (Christmas Songs for Little Childre.mp3",1.59,M
We Wish you a Merry Christmas.mp3,1.58,M
Daylight Saving Christmas.mp3,1.58,M
Christmas With The Family.mp3,1.58,M
Winter Wonderland.mp3,1.58,M
Waiting for the Child to Come.mp3,1.58,M
Pookie Doodles Christmas Party (Christmas Songs for Little C.mp3,1.57,M
A Christmas Carol.mp3,1.57,M
The North Wind (Christmas Day).mp3,1.57,M
Santas' Ho Ho Ho Down.mp3,1.57,M
With Christmas Near.mp3,1.56,M
Bring a Torch Jeanette Isabella.mp3,1.56,M
Mrs Santa Claus.mp3,1.56,M
A Holly Jolly Christmas.mp3,1.56,M
A Little Star.mp3,1.55,M
Hail Blessed Virgin Mary.mp3,1.55,M
While Shepherds Watched There Flocks.mp3,1.55,M
What is Christmas to you.mp3,1.55,M
Unto Us a Son is Born.mp3,1.55,M
A Starry Night.mp3,1.54,M
Riding on a Sleigh with Santa (Christmas Songs for Little Ch.mp3,1.53,M
We Wish You A Ripper Christmas.mp3,1.53,M
Santa of the Southern Cross.mp3,1.53,M
Big Red.mp3,1.52,M
Boombah The Snowman.mp3,1.51,M
God Rest Ye Merry Gentlemen.mp3,1.51,M
March Of The Kings (Christmas song selection Part 4).mp3,1.51,M
Here Comes Christmas.mp3,1.51,M
Silver Sleigh.mp3,1.51,M
Il Est Ne (Christ Is Born) -Castleford Salvation Army Citade.mp3,1.5,M
I Heard the Bells on Christmas Day.mp3,1.5,M
Henry's Christmas Dance.mp3,1.49,M
Rudolph the Red-Nosed Reindeer.mp3,1.49,M
Gloucestershire Wassail (Christmas song selection Part 4).mp3,1.49,M
Cherry Tree Carol-Marlborough Cathedral Choir- (O Come All Y.mp3,1.49,M
It Came Upon A Midnight Clear.mp3,1.49,M
The Twilight Is Falling.mp3,1.48,M
Deck The Sheds (With Boughs Of Wattle).mp3,1.48,M
I Believe.mp3,1.48,M
Australians Let Us Barbecue -2.mp3,1.48,M
Virgin Mary Had A Baby.mp3,1.47,M
Deck The Shed With Bits Of Wattle.mp3,1.47,M
Santas' Workshop Song (Christmas Songs for Little Children 1.mp3,1.47,M
The Jolly Little Snowman (Christmas Songs for Little Childre.mp3,1.46,M
Dear Santa (Christmas Songs for Little Children 1994 Vol 4).mp3,1.46,M
Make it Snow (Christmas Songs for Little Children 1994 Vol 3.mp3,1.46,M
My Favourite Time Of The Year.mp3,1.45,M
Sussex Carol.mp3,1.45,M
The (Aussie) Colours of Christmas (Christmas in Australia).mp3,1.43,M
Rockin' Around The Christmas Tree.mp3,1.43,M
Let's Clap Hands For Santa Claus.mp3,1.42,M
Australians Let Us Barbecue.mp3,1.42,M
Ding Dong Merrily On High.mp3,1.41,M
Buon Natale.mp3,1.4,M
Mr Santa.mp3,1.4,M
"Carolling, Carolling.mp3",1.4,M
What Does Santa Do (Christmas Songs for Little Children 1994.mp3,1.39,M
Barry The Elf.mp3,1.39,M
Mary Had a Baby.mp3,1.39,M
Carol of The Birds.mp3,1.38,M
Santa Leave your Sleigh Behind (Christmas Songs for Little C.mp3,1.38,M
Little Jesus Sweetly Sleep.mp3,1.38,M
Little Saint Nick.mp3,1.37,M
It's Christmas (Christmas Songs for Little Children 1994 Vol.mp3,1.35,M
Tomorrow Shall Be My Dancing Day (Op 75 2).mp3,1.35,M
Wags Is Bouncing Around The Christmas Tree.mp3,1.34,M
Infant Hol-y Infant Lowly.mp3,1.34,M
Christmas Where the Gum Trees Grow.mp3,1.34,M
Three Aussie Kings.mp3,1.34,M
A Reindeer on the Roof.mp3,1.33,M
A Baby Boy Called Jesus.mp3,1.33,M
O Tannenbaum.mp3,1.33,M
Good Old Country Christmas.mp3,1.33,M
Here Comes Santa (Christmas Songs for Little Children 1994 V.mp3,1.32,M
Frosty the Snowman.mp3,1.32,M
Report of the Stockman.mp3,1.32,M
I Want a Puppy for Christmas (Christmas Songs for Little Chi.mp3,1.31,M
Snowing In Copenhagen.mp3,1.31,M
Sleigh Ride.mp3,1.31,M
I'm a Little Christmas Cracker (Christmas Songs for Little C.mp3,1.3,M
Reindeer's Christmas Song (Christmas Songs for Little Childr.mp3,1.3,M
I Want a Teddy for Christmas (Christmas Songs for Little Chi.mp3,1.29,M
Away In A Manger.mp3,1.29,M
Jingle Bells.mp3,1.29,M
Come And Join The Celebration.mp3,1.29,M
Babhooska.mp3,1.29,M
March of the Toys.mp3,1.28,M
The Happiest Christmas Tree.mp3,1.27,M
Happy Xmas.mp3,1.26,M
The Thee Drovers.mp3,1.26,M
Ding Dong Ding (Christmas Songs for Little Children 1994 Vol.mp3,1.25,M
Boomerang of Flowers.mp3,1.24,M
O Christmas Tree.mp3,1.24,M
It's Teddies First Christmas (Christmas Songs for Little Chi.mp3,1.23,M
The Holly And The Ivy (Ozy).mp3,1.23,M
Merry Christmas (Sun Gleams Bright).mp3,1.21,M
Santa Of The Desert.mp3,1.21,M
I Saw Three Ships.mp3,1.2,M
Snowbells (Christmas Songs for Little Children 1994 Vol 1).mp3,1.2,M
In the Winter Darkness.mp3,1.19,M
Joy To The World.mp3,1.19,M
The Fairy on the Chistmas Tree (Christmas Songs for Little C.mp3,1.19,M
There Shines a Silver Star (Slim Whitman).mp3,1.17,M
A Merry Christmas Day.mp3,1.16,M
Teddies Love Christmas (Christmas Songs for Little Children .mp3,1.15,M
Off We Go to Bethlehem.mp3,1.14,M
Let's Start The New Year Right.mp3,1.13,M
Little Donkey.mp3,1.12,M
Over The River And Through The Woods.mp3,1.1,M
Here Comes Christmas Bob.mp3,1.09,M
We Wish You A Merry Christmas (aussie style).mp3,1.07,M
Calypso Carol.mp3,1.06,M
Lonely Little Christmas Tree (Christmas Songs for Little Chi.mp3,1.06,M
No Beer (The First Noel).mp3,1.05,M
Child in a Manger.mp3,1.04,M
I Saw Mummy Kissing Santa Claus.mp3,1.02,M
I Wonder As I Wander.mp3,1,M
Holly And The Ivy.mp3,1,M
Ring Christmas Bells.mp3,1023.35,K
Richard Buchanski.mp3,1015.35,K
Christmas Greeting.mp3,997.39,K
Galloping Through the Snow (Christmas Songs for Little Child.mp3,995.6,K
We Are Santa'S Elves.mp3,965.56,K
Oh Christmas Time (Is Cricket Time).mp3,960.11,K
Dame Get Up & Bake Your Pies.mp3,955.76,K
It's Christmas Day Today (Christmas Songs for Little Childre.mp3,936.82,K
Christmas Lullaby.mp3,929.53,K
We'll Follow That Star To Bethlehem (Christmas Songs for Lit.mp3,897.64,K
The Snore.mp3,870.46,K
Deck The Halls.mp3,862.02,K
Jolly Old Saint Nicholas [1].mp3,846.78,K
Crazy Family Christmas.mp3,837.8,K
Snowy the Snowflake (Christmas Songs for Little Children 199.mp3,816.82,K
The Five Days of Christmas.mp3,809.84,K
Christmas Came Early.mp3,801.88,K
Now Light 1000 Christmas Lights.mp3,785.66,K
Do Wop Christmas (Jive Bunny & The Master Mixers Christmas P.mp3,770.25,K
The Loch Ness Monster Mystery Solved.mp3,765.56,K
Mans Best Friend.mp3,752.91,K
Wisemen Still Seek Him.mp3,718.16,K
born to be.mp3,705.33,K
Santa Dad.mp3,704.33,K
The Santa Secret.mp3,646.38,K
Our Christmas Party.mp3,645.97,K
The Loneliest Lonely.mp3,607.64,K
Thirty-Two Feet And Eight Little Tails.mp3,607.19,K
Love Came Down At Christmas.mp3,581.07,K
Oh Christmas Tree.mp3,533.55,K
A Lesson On Christmas.mp3,491.27,K
The Holly's Come Down.mp3,447.6,K
Christmas Eve Trip.mp3,408.41,K
God Gave.mp3,390.23,K
We Three Ozy Kings.mp3,332.9,K
A Son Is Born.mp3,286.78,K
RIP Christmas Cracker.mp3,239.84,K
Little Jack Horner.mp3,221.48,K
Shepherds.mp3,186.38,K
If You See Santa.mp3,182.29,K
Pirate Food Poem.mp3,175.35,K
Christmas Eve With You.mp3,157.66,K
Breebop Poem.mp3,135.76,K
Wags Ate The Rags.mp3,127.6,K
With A Shiny Red Nose.mp3,125.15,K
Shepherds Song.mp3,105.08,K
More Than A Child.mp3,101.08,K
Peace And Joy To Everyone.mp3,85.56,K
Our Savior Has Come.mp3,55.45,K
"Oh, What a Wonder.mp3",45.19,K
Come the Winter Snow.mp3,45.1,K
Mary Song.mp3,38.06,K
For The Wonder of God's Love.mp3,36.64,K
Christis Christmas.mp3,35.21,K
On This Holly Night.mp3,22.66,K
Retro Christmas.mp3,8.4,K
