User Type,Username,Date,Text
,GearCloud,2011-09-28T12:44Z,"To get support of TPB Register Here:

https://forum.suprbay.org/member.php?action=register&referrer=250574"
,RobFuse,2011-09-28T20:51Z,This is the real deal. Good job GearCloud. 320 kbps too. You sir are a god. I'll still be supporting LIGHTS by buying the album when it comes out.
,GearCloud,2011-09-29T13:34Z,Thanks for Appreciation. :-/
,allieswasteland,2011-11-02T14:50Z,Lightening fast download! Great quality! Thanks GearCloud :)
