Filename,Size,Unit
Whisper of Consciousness Volume 4.png,382.47,K
WOC04_001. Marco V - Unprepared (Recharged Original Mix) _Piggy1205.mp3,15.29,M
WOC04_002. Kyau & Albert - A Night Like This (Original Mix) _Piggy1205.mp3,14.25,M
WOC04_003. Orjan Nilsen - The Mule (Album Mix) _Piggy1205.mp3,6.62,M
WOC04_004. Southern Fraiz feat. Irena Love - Afterclouds (Original Vocal Mix) _Piggy1205.mp3,18.89,M
WOC04_005. Protoculture feat. Shannon Hurley - Sun Gone Down (Alex M.O.R.P.H. & Chriss Ortega Remix) _Piggy1205.mp3,17.22,M
WOC04_006. Mark Sherry feat. Sharone - Silent Tears (Outburst Vocal Mix) _Piggy1205.mp3,16.14,M
WOC04_007. Jonas Stenberg - I Will Find You (Paul Ercossa Remix) _Piggy1205.mp3,17.5,M
WOC04_008. Josh Gabriel Pres Winter Kills - Hot As Hades (John O'Callaghan Deep Dream Remix) _Piggy1205.mp3,21.5,M
WOC04_009. Philippe El Sisi feat. Josie - Over You (Heatbeat Remix) _Piggy1205.mp3,15.62,M
WOC04_010. Setrise feat. Yana Kay - Weapon (DJ Feel Remix) _Piggy1205.mp3,17.61,M
WOC04_011. Sied Van Riel feat. Nicola McKenna - Stealing Time (Simmons & Blanc Remix) _Piggy1205.mp3,17.1,M
WOC04_012. Stoneface & Terminal - Time To Wait _Piggy1205.mp3,12.93,M
WOC04_013. Susana feat. A Force - Running On Your Love (Sam Stroke & Isaac Fisherman Remix) _Piggy1205.mp3,15.28,M
WOC04_014. Maurice Delgado feat. Perky - Survive (Original mix) _Piggy1205.mp3,17.21,M
WOC04_015. Tiesto feat. JES - Everything (Cosmic Gate remix) _Piggy1205.mp3,20.56,M
WOC04_016. Smart Apes feat. Kate Miles - Smile _Piggy1205.mp3,20.6,M
WOC04_017. Sophie Sugar - All For You (Original Mix) _Piggy1205.mp3,17.66,M
WOC04_018. Menno De Jong feat. Ellie Lawson - Place In The Sun (Original Mix) _Piggy1205.mp3,14.33,M
WOC04_019. Tenishia feat. Aneym - Man In Denial (David Forbes Remix) _Piggy1205.mp3,18.54,M
WOC04_020. Timmy & Tommy feat. Leila - Perfect Motion _Piggy1205.mp3,19.21,M
WOC04_021. Max Graham feat. Neev Kennedy - So Caught Up (Original Mix) _Piggy1205.mp3,14.39,M
WOC04_022. Temple One - Zebra (Nuera Remix) _Piggy1205.mp3,13.63,M
WOC04_023. Kostya Veter feat. Madelin Zero - Envy _Piggy1205.mp3,17.62,M
WOC04_024. Rory Gallagher & Mike Lane - Skyline Cafe _Piggy1205.mp3,20.56,M
WOC04_025. Tiddey feat. Lyck - Keep Waiting (CJ Stone Remix) _Piggy1205.mp3,14.82,M
