Filename,Size,Unit
CD1/12. Sitting On Top Of The Wor_[plixid.com].mp3,9.07,M
CD1/06. Only When I Dream_[plixid.com].mp3,8.94,M
CD1/02. No One Makes It On Her Ow_[plixid.com].mp3,8.59,M
CD1/04. Speak To Me_[plixid.com].mp3,8.55,M
CD1/11. Happy On The Outside_[plixid.com].mp3,8.39,M
CD1/03. She's Got Nothing On (But_[plixid.com].mp3,8.22,M
CD1/09. In My Own Way_[plixid.com].mp3,8.12,M
CD1/10. After All_[plixid.com].mp3,7.55,M
CD1/07. Dream On_[plixid.com].mp3,7.3,M
CD1/08. Big Black Cadillac_[plixid.com].mp3,7.18,M
CD1/05. I'm Glad You Called_[plixid.com].mp3,6.5,M
CD1/01. Way Out_[plixid.com].mp3,6.41,M
CD2/15. She's Got Nothing On (But The Radio) (Adrian Lux Remix Original Version)_[plixid.com].mp3,12.84,M
CD2/13. Speak To Me (Bassflow Remake)_[plixid.com].mp3,8.39,M
"CD2/04. Speak To Me (Demo July 13, 2010)_[plixid.com].mp3",8.23,M
"CD2/06. Only When I Dream (Demo August 7, 2009)_[plixid.com].mp3",8.23,M
CD2/14. She's Got Nothing On (But The Radio) (Adam Rickfors Radio Edit)_[plixid.com].mp3,8.04,M
"CD2/10. After All (Demo July 27, 2010)_[plixid.com].mp3",7.82,M
"CD2/02. No One Makes It On Her Own (Demo July 26, 2010)_[plixid.com].mp3",7.65,M
"CD2/08. Big Black Cadillac (Demo July 2, 2010)_[plixid.com].mp3",7.06,M
"CD2/11. Happy On The Outside (Demo August 17, 2005)_[plixid.com].mp3",6.85,M
"CD2/09. In My Own Way (Demo August 7, 2009)_[plixid.com].mp3",6.7,M
"CD2/07. Dream On (Demo January 25, 2010)_[plixid.com].mp3",6.69,M
"CD2/12. Sitting On Top Of The World (Demo July 13, 2010)_[plixid.com].mp3",6.39,M
"CD2/05. I'm Glad You Called (Demo November 19, 2009)_[plixid.com].mp3",6.2,M
"CD2/03. She's Got Nothing On (But the Radio) (Demo August 7, 2009)_[plixid.com].mp3",5.83,M
"CD2/01. Way Out (Demo January 25, 2010)_[plixid.com].mp3",5.51,M
cover_[plixid.com].jpg,85.88,K
