User Type,Username,Date,Text
[V],mkvGOD,2011-04-03T02:34Z,"Follow me on Facebook for updates, requests, and comments

http://on.fb.me/MkvGODTorrents"
,paddymad1,2011-04-04T06:26Z,"Hey brilliant job there..but when can you do the UK version of Shameless..The US one aint great..also Peep Show, Cheers, Frasier, Little Britain, Extras and very importantly Sopranos..theres not one mkv rip of the whole Sopranos series."
,kulkakari,2011-04-04T06:34Z,You're awesome! Thank you so much! :)
,iforparry,2011-11-16T16:14Z,U Rock mkvGOD!!!
