Filename,Size,Unit
CD1/1. Adele  Chasing Pavements.mp3,7.88,M
CD1/10. Taio Cruz Little Lion Man (Originally by Mumford & Sons).mp3,7.08,M
CD1/11. Calvin Harris Ready For The Weekend.mp3,8.38,M
CD1/12. Keane Dirrtylicious (Bootilicious Originally by Destiny's Child Dirrty originally by Christina Aguilera).mp3,6.52,M
CD1/13. N-Dubz The Man Who Can’t Be Moved  Breakeven (Originally by The Script).mp3,6.52,M
CD1/14. McFly  I Kissed A Girl (Originally by Katy Perry).mp3,7.38,M
CD1/15. Kelly Clarkson Since U Been Gone.mp3,7.41,M
CD1/16. Paloma Faith Sexy Chick (Originally by David Guetta feat. Akon).mp3,9.49,M
CD1/17. Kylie Minogue Wonderful Life (Originally by Hurts).mp3,7.82,M
CD1/18. U2 Beautiful Day.mp3,11.61,M
CD1/19. Oasis Songbird.mp3,4.94,M
CD1/2. Arctic Monkeys Love Machine (Originally by Girls Aloud).mp3,7.66,M
CD1/20. Elbow One Day Like This.mp3,8.61,M
CD1/3. Kings Of Leon Fans.mp3,8.3,M
CD1/4. Lady Gaga Poker Face.mp3,9.33,M
CD1/5. Plan B Pass Out (Originally by Tinie Tempah).mp3,11.06,M
CD1/6. Rihanna Hate That I Love You.mp3,8.7,M
CD1/7. Dizzee Rascal That’s Not My Name (Originally by The Ting Tings).mp3,9.25,M
CD1/8. Black Eyed Peas Boom Boom Pow.mp3,7.89,M
CD1/9. Jason Derulo She Said (Originally by Plan B).mp3,7.92,M
CD2/1. Foo Fighters Times Like These.mp3,7.86,M
CD2/10. Pendulum Violet Hill (Originally by Coldplay).mp3,11.55,M
CD2/11. Kasabian LSF.mp3,8.76,M
CD2/12. Paramore Love’s Not A Competition (But I’m Winning) (Originally by Kaiser Chiefs).mp3,5.66,M
CD2/13. P!nk  Family Portrait.mp3,11.1,M
CD2/14. Jamelia Numb (Originally by Linkin Park).mp3,7.44,M
CD2/15. The Ting Tings Standing In The Way Of Control Originally by The Gossip).mp3,8.52,M
CD2/16. Mark Ronson Stop Me.mp3,9.03,M
CD2/17. Travie McCoy Billionaire.mp3,8.26,M
CD2/18. Jamie Cullum Frontin’ (Originally by Pharrell Williams).mp3,12.85,M
CD2/19. Will Young Hey Ya! (Originally by Outkast).mp3,11,M
CD2/2. Mumford & Sons The Cave.mp3,8.08,M
CD2/20. Leona Lewis Run (Originally by Snow Patrol).mp3,11.87,M
CD2/3. Amy Winehouse Valerie (Originally by The Zutons).mp3,8.84,M
CD2/4. Tinie Tempah Frisky.mp3,9.78,M
CD2/5. Lily Allen Smile.mp3,7.6,M
CD2/6. The Script Lose Yourself (Originally by Eminem).mp3,9.65,M
CD2/7. Paolo Nutini Rehab (Originally by Amy Winehouse).mp3,8.4,M
CD2/8. Biffy Clyro Many Of Horror.mp3,9.27,M
CD2/9. Florence & The Machine Halo (Originally by Beyonce).mp3,8.63,M
atomicbytes.nfo,5.06,K
back.jpg,754.29,K
cd1.jpg,232.91,K
cd2.jpg,241.98,K
front.jpg,1.24,M
tynetorrents nfo.nfo,4.47,K
visit us at WWW.Blackstarbt.net.nfo,9.62,K
