User Type,Username,Date,Text
,Kingman_Arizona,2011-10-24T10:14Z,"The Playboy Club was canceled on October 4, 2011 after airing three episodes.[9][10][11] It was the first cancellation of the 2011–2012 television season.[9] NBC continued to film the series until October 10, 2011, hoping to sell the series to another network.[12] Both Playboy magnate Hugh Hefner and show creator Chad Hodge have expressed the hope that the series will be picked up by Bravo.[13][14]

When production wrapped on October 10, 2011, Chad Hodge and Laura Benanti both confirmed that they had finished seven episodes including the pilot.[2] Benanti further stated that the seventh episode has two endings, one of which is more final to the series.[3]
"
,Kingman_Arizona,2011-10-24T10:15Z,"The Playboy Club was canceled on October 4, 2011 after airing three episodes.[9][10][11] It was the first cancellation of the 2011–2012 television season.[9] NBC continued to film the series until October 10, 2011, hoping to sell the series to another network.[12] Both Playboy magnate Hugh Hefner and show creator Chad Hodge have expressed the hope that the series will be picked up by Bravo.[13][14]

The Playboy Club - When production wrapped on October 10, 2011, Chad Hodge and Laura Benanti both confirmed that they had finished seven episodes including the pilot.[2] Benanti further stated that the seventh episode has two endings, one of which is more final to the series.[3]
"
,highlander777,2011-10-24T23:42Z,"Thanks Kingman_Arizona. I was wondering what happened to this TV series. 

Looked up the Wiki too. I actually didn't think a show portraying the 1960s would attract the 18-48yo male demographic. It's just too long ago. Kind of makes you wonder how long ""Pan Am"" will last."
,BSorensen,2011-12-08T12:38Z,"Damn, I kinda liked this show. Not so realistic though; the girls are all too skinny, and their eyebrows too perfect :)) Very 21st century, not 60s at all. As for Pan Am, I doubt that'll last...it's too boring and out there"
,realawesomedude,2012-03-08T01:56Z, ONLY 3 EPSISODES WHAT WRONG WITH THIS WORLD ??!!!!!
