User Type,Username,Date,Text
,scottyell,2011-05-14T14:10Z,trojan fuck you
,cesar3dg,2011-05-18T20:00Z,"no trojan, go troll somewere else"
,In_Da_Club,2011-05-25T22:33Z,"It does have trojan... lol @ cesar, enjoy the virus"
,ThePirateOfLand,2011-07-13T02:05Z,If this had trojan in it i wouldn't use it myself.
,thpirate4105,2011-08-18T02:51Z,yes this is a virus checked the report and came up severe also i put it on a usb to see if it would try to acces my computer lght flashed this IS  a trojan. 
,Brudkista,2011-09-22T13:56Z,Trojan
