User Type,Username,Date,Text
,st3v3g0,2011-03-11T13:44Z,if u are the first to dl this can u comment and tell me if u were able to dl it fine
,st3v3g0,2011-03-16T04:55Z,i have had a few people dl this they have not said any thing so it must be ok
,st3v3g0,2011-05-12T23:29Z,even tho it may say there are no seeders there is one me u can dl it  today friday the 31th 2011  Australian time from 7am till 8pm mine est time
,st3v3g0,2011-05-12T23:31Z,ill be on at other times as well
,zimpleguy,2011-08-19T09:45Z,Are you still seeding this st3v3g0 ??? If you are once I'm done downloading I'll seed as well. 
,st3v3g01,2011-12-21T01:10Z,"@zimpleguy
this is st3v3g0 my old account is not woking for some reson or another so i will be using one of these 2 accounts st3v3g011 or st3v3g01 I'm still up loading but i will stop this one eventually and up load anther one with moor songs from this artist when i do ill put a message on here letting very one know"
