User Type,Username,Date,Text
,sopiebaba,2011-03-23T17:40Z,"Thanks a million.
I've been looking for this movie for over 12 years.
God Bless you , brother...."
[V],GoodFilms,2011-03-23T18:28Z,You're welcome :)
,PaulieD,2011-03-30T10:31Z,"What's with the minuses? Some people just don't like free movies in excellent quality, I guess."
[V],GoodFilms,2011-03-30T15:28Z,It's because a certain someone has a personal vendetta against me. Ignore it :)
,eurolite,2011-10-18T07:57Z,"Was told about this in English class. Now I must watch.

Thanks for the excellent quality!"
