User Type,Username,Date,Text
,sektor115,2011-03-04T19:22Z,"salut. un mix postat de tine, anume Kyau & Albert-Euphonic Sessions february , este unul din cele mai bune din ultimul timp dar se aude foarte prost. crezi ca ai posibilitatea sa-l repostezi la o calitate mai buna ? merci."
,robynet22,2011-03-04T19:30Z,"e cam tot ce pot sa fac pt tine
http://www.online-tech-tips.com/software-reviews/change-bitrate-on-mp3-files-tutorial/"
,sektor115,2011-03-04T20:19Z,"too complicated :))) ti-am spus ca sunt un retardat de 44 de ani :))) partea proasta ca eu ascult pe boxe Hi-Fi de 300 de watti , daca ascultam pe 10 sau 20  W nu sesizam diferenta. merci mult oricum. post scriptum - astept si chillout de calitate. esti genial. "
,sektor115,2011-03-04T21:09Z,"hai sa-ti spun . cu riscul sa te plictisesc sau sa te enervez. sunt dependent de dopamina, un drog secretat de creier care se ""produce"" cand fumez, beau vin, ma vad cu fosta prietena  sau ascult muzica . nici nu mai stiu ce vroiam sa-ti spun. a , da asculta asta : Mark_Sherry_-_Outburst_Radioshow_191. este un mix aproape perfect. sau incepe bine. eu caut trance-mix-ul perfect. Emil Cioran-ul trance-ului. neajunsul de ma fi nascut sa caut trance. "
