User Type,Username,Date,Text
,muhammad15,2011-09-26T20:55Z,plz comment to my torrents. ur feedback is very valuable for me ;)
,dell-1525,2011-09-26T21:14Z,Kindly give me some screenshot.........by which i can get an idea that it is just a visuial theme or not.............
[T],djjlicious,2011-09-26T21:44Z,"Explain a bit more, what means the green version.
What's in it and what not??"
,muhammad15,2011-09-26T22:00Z,"ADDED:- VISTA SOUNDS,VISTA DRIVE ICON, DIRECTX, UPDATED TILL AUGUST 2011 ccleaner,winrar,firefox,vlc. Unlocker 1.8.5, ROCKETDOCK, INTERNET EXPLORER8

REMOVED:- GAMES,INTERNET GAMES,PINBALL,MSN,WINDOWS MESSENGER, AND TOUR
no need key, no error while installing ;) working awesome...
i m using it... i have made this by own... u can believe me ;)
its real torrent... "
,muhammad15,2011-09-26T22:08Z,http://www.hotimg.com/direct/aEP2AGV.jpg
[T],liluser,2011-09-26T22:19Z,"is it anything like mine.. ??

click on my name and see my torrents.."
,muhammad15,2011-09-26T22:34Z,"no its windows xp service pack 3 professional ;)
and i have mentioned the changes above this post ;)
download it... and seed it... so others also can download it ;) thanks for ur comments ;)"
[T],djjlicious,2011-09-27T02:12Z,"Thanks, looks great muhammad15!
Nice upload, + 1 for your rep!"
,user41263,2011-09-27T09:05Z,Are SATA  drivers there?
,muhammad15,2011-09-27T09:27Z,"there is not sata drivers..
but whats the use of it?"
,muhammad15,2011-09-27T16:49Z,"hey rossue3tne what u mean product key doesnt work? i m using it ;) dont say lie ok... plz others download it and use it, its working.. if any problem occured than i will leave this modifying windows ;) 

plz download and comment ;) 
@ALL dont lie okay..."
,xtra1979,2011-09-27T22:50Z,@muhammad15 can i burn image file to disk with this program of yours? Can I disable this: control panel> administrative tools> services> IMAPI CD-Burning COM Services..?
,xtra1979,2011-09-27T23:01Z,@muhhamad15 can i burn image files to disk with this program of your? can I disable: control panel> administrative tools> services> IMAPI CD-Burning COM Services...?
,muhammad15,2011-09-27T23:16Z,"@Xtra this was an untouch windows xp... Its genuine... I dont know what ur saying?
But yes u have to burn this image file for installing it... U can also double click on set up... But for that u need windows xp key... Okay... Burn at low speed as possible, x4 or little more than that.... ;) download and install.. I think u will enjoy this xp... Plz comment after installing also..."
,naeem42,2011-09-28T06:58Z,"MMMM hey bro can u tell me how to made that win and then pack it fo installation so i make it more good with more walls,drivers etc"
,muhammad15,2011-09-28T08:29Z,@Naeem have u used nlite ?????? i modify xp with that...
,roy2646,2011-09-28T12:08Z,"When I installed this version the appearance is the same as windows vista, computer properties registered to muhammad, when I set to auto.updates and press ok it is automatically returning to never check updates. Anybody can try to oracle vm virtualbox easily."
,muhammad15,2011-09-28T14:43Z,"@roy thanks for the comment... for updating ur windows xp goes to http://www.update.microsoft.com/windowsupdate/v6/default.aspx?ln=en-us
and what u think about ma windows xp? is it better?"
,muhammad15,2011-09-28T15:06Z,"Guzy, this was my first torrent as u can c... and my first windows xp mod... plz comments so i start my work continous?"
,naeem42,2011-09-29T04:38Z,yep i used nLite but how u add visual styles and wallpapers
,roy2646,2011-09-29T07:41Z,"yeah this is good and different than any other, my advise to the downloader if you had installed this, is to use the magic jelly bean (key finder/changer) to change the name of the owner from muhammad to any of your choice and put an organization of your own so that when you click the computer properties your on name will appear. Thanks for your great effort sir muhammad."
,roy2646,2011-09-29T07:44Z,"I'm sorry for the typographical error, what I mean is ""your OWN name"" will appear.. thanks again for the uploader"
,muhammad15,2011-09-29T10:35Z,"Roy thanks buddy... i know its good... but its more better to listen from another mouth ;)


naeem, bro use any addon ;)"
,muhammad15,2011-09-29T20:25Z,"hey friends i am going to upload my new windows xp after 1- 2 weeks... 
i m thinking to add 
windows mediaplayer 11, vi-start, and windows sidebar gadgets ;)
but gadgets make ur windows xp start up slow... what should i do??? i m taking ur opinions... plz reply fast?
and all of u, did u like my this xp???"
,dl_nicholas69,2011-09-30T13:52Z," Hello Muhammad15! I would like to add in your next Windows: Media Player 11, RocketDoc, UberIcon, All Net Framework, Silverlight, C + + runtimes 2005 & 2008 & 2010. You could do this muhammad15? Windows would be a very nice and super excellent! A further good day brother!"
,dl_nicholas69,2011-09-30T14:00Z,"muhammad15 ... and please throw in addition to those listed in my previous message and Rainmeter, Viglance, Thema Windows Seven! Still good luck bro!"
,muhammad15,2011-09-30T15:41Z,okay i ll try my best ;) next version will b with neon blue themes ;)
,muhammad15,2011-09-30T22:19Z,i m gonna release my new windows xp black with september 2011 updates... wait till tomorrow ;)
[T],liluser,2011-10-01T01:46Z,"so it is a bit like mine..

mine is 
windows xp professional sp3 student edition

ADDED TO THE INSTALL DISK

Framework all in one 2.0 - 4.0
Internet explorer 8 
Windows media player 11 
Directx 9 Runtimes 9.29.1974 April 2011
Directx Managed Code 1.1.0
Flash 11.0.1.129
Shockwave 11.6.1.629
Java 7.0.0.147
Winrar 4.0.1 regged 
Lclock 1.62b
c++ runtimes 2005 & 2008 & 2010
Msn Live Messenger 9.0.14.0.8117.416 web-setup on desktop
MassStorage 11.09 txt mode (sata + raid)


no need for any wga cracks with mine
passes online as fully Genuine 
(student edition based + proper student key)

click my name for my torrents ;-)"
,muhammad15,2011-10-01T14:28Z,"liluser, i m talking about d theme... that u dont have any way..... where do u got framework and c++
give me the link plzzzzzzz?"
,dl_nicholas69,2011-10-01T16:03Z,"Heloo muhammad15 ! I would like very much and not only me, I think this will ever be .... THEMA Windows 7, not neon blue tote ... plus others that you listed them in previous messages EAM that is ..... : WMP11, IE8, all framework, sidebar, ubericon, rocketDoc, theme Windows 7, Silverlight, C + + runtimes 2005 & 2008 & 2010, Viglance! Thousands of greetings brother!"
[T],liluser,2011-10-01T17:25Z,"you can always try my bigger dvd verion with lots added.. loads of themes.. driverpacks.. etc

http://thepiratebay.org/torrent/6314561/Windows.xp.sp3.student.edition.march.2011.with.driverpacks.iso"
[T],liluser,2011-10-01T17:26Z,ill make a fully updated dvd version soon.. ;-)
,muhammad15,2011-10-01T19:00Z,liluser give me netframework all in one link plzzz
,muhammad15,2011-10-01T19:33Z,"http://thepiratebay.org/torrent/6714709/WINDOWS_XP_3_BLACK_UPDATED

new edition released ;)"
,cbinau,2011-10-02T05:17Z,Its asking me for a stupid key? 25 character key! BLAH!
,muhammad15,2011-10-02T08:01Z,cbinau shut up liar
,muhammad15,2011-10-02T21:46Z,"http://thepiratebay.org/torrent/6716869/WINDOWS_XP_3_FOR_BEST_PERFORMANCE

New Version uploaded ;)"
,greatgeek,2011-10-05T17:27Z,muhammad15....every one is saying good things about this down load and I was wondering if it is 64bit? Thanks
,muhammad15,2011-10-05T19:14Z,greatgeek 32 bit system
,yugimuto,2011-10-08T00:45Z,"Heyo muhammad15, love this version, works like a charm! Would be great if you could tell me how to get the Luna theme back, thanks a bunch!"
,muhammad15,2011-10-08T07:20Z,"yugimuto, download any themes from net, and apply... ;) there is soo good themes available on net!!! i think u also can get luna theme.. ;)"
,dipo2much,2011-10-13T20:36Z,"muhammad, pls i tried to mount the iso file on power iso by rightclicking and selecting Power Iso then mount image on drive.....

After mounting, I tried to run the program just directly and it asked me for 25 digit key. Pls tell me what I am not doing correctly. Thanks"
,muhammad15,2011-10-15T22:57Z,burn all iso files in one cd and boot it... Dipo2much
,prepuce83,2011-10-20T08:18Z,"okay, which one should i download?
the green edition or the best perfomance, i'm confuse"
,prepuce83,2011-10-20T08:18Z,"and one more thing, which one had the repair option when booting"
,muhammad15,2011-10-20T18:19Z,"windows xp green is better.... Because xp performence is for low config pc... I think both will have repair option..... Okay....
Xp green is awesome... But its have windows media player9. And xp performance have media player11...."
,piratxx,2011-11-03T20:45Z,"wan`t boot , asking cd-key when I try to upgrade over existing windows?"
,muhammad15,2011-11-04T12:40Z,"piratxx hey boot with CD burn it on CD....
than boot it...
it will ask key for upgrading... ok...
better to Boot it... not a single question will ask during setup dont worry about key also... "
,muhammad15,2011-11-09T21:22Z,"windows xp black new november version is made! 
only upload is remaining ;) in 1-2 days i ll upload it ;)"
,muhammad15,2011-11-12T11:21Z,hey guyz.... plz say me... which one u like.? my XP GREEN? OR XP BLACK?
,nurkayevaa,2011-12-21T10:39Z,Is there any difference between GREEN and BLACK... other than look and feel? I liked GREEN btw
,samani27,2011-12-21T15:59Z,nothing difference between green and black... just black november is updated 1... go for that ;) if u like this than u can download this ;) after few days i will upload new green updated 1...
,Buxa072,2011-12-25T15:16Z,Can you put windows xp pink if you can...
,samani27,2011-12-25T19:37Z,"Buxa072 
hahaha...
windows xp pink...
r u a girl???"
,Buxa072,2011-12-27T12:39Z,"@samani
I'm not a girl,but I have a little girl who loves the color pink-I hope you understand...."
,Buxa072,2011-12-27T12:43Z,pity that no Croatian keyboard But I did I switched kbdcr.dll....thanks anyway..
,samani27,2011-12-27T20:43Z,"buxa i can make windows xp green,black,blue,neon blue, red,purple... :D tell me which one u want? i can make it for u ;)"
,Buxa072,2011-12-27T20:55Z,"I need windows pink,me interested in whether you doing it through nLite a and where downloading threads.I need a lightweight version of Windows approximately 450-500MB.Thanks in advance."
,samani27,2011-12-28T07:46Z,"Buxa072
sorry dude... Sorry... i cant make pink... i m not that much good....i google but i didnt get that theme.... :(
i can make lite version 500MB :D tell me what compopent u dont use... i ll remove it... and u get low Size XP... just contact me at mohammad_ali1994@yahoo.in
muhammad.alinice@gmail.com
yeah i make xp with help of nlite... "
,samani27,2011-12-28T08:31Z,"got updated
http://thepiratebay.org/torrent/6910902/WINDOWS_XP_3_GREEN_UPDATED_DECEMBER"
,Buxa072,2011-12-28T22:56Z,"@samani
I know, and I asked for pink theme,Can you then make a neon version.I am currently trying to make a vista blue.only difficult to make a light version of the 200-250MB.If you can make the neon version."
,samani27,2011-12-29T17:48Z,"buxa... i can make neon but size will b like this ;)
tell me which component u want to remove?"
,Buxa072,2011-12-29T21:18Z,"@samani
Set program access and defaults,help and support-It would be all.Only it does not exceed 300MB.Can you also make a??If you can not then make of your choice.But I need to it 3 January.THANK YOU IN ADVANCE."
,samani27,2011-12-30T11:49Z,"buxa
y u want small XP?????
have u used ever nlite?
add me in friend list 

mohammad_ali1994@yahoo.in
muhammad.alinice@gmail.com"
