User Type,Username,Date,Text
,deepflames,2011-10-03T11:41Z,is this the image of windows 7 & does it includes service pack 1
,dogman514,2011-10-03T13:40Z,"this is the restore for Extensa 5620 with Vista H.P. it brings the  computer back to day 1,you have to download service pack 1 and 2. this is a last resort when all else fails.i had  to  use it when my backup became corrupt,its a real pain to add all the programs."
,deepflames,2011-10-03T14:30Z,Highly thanks Dogman for the reply... well i've acer aspire laptop and am looking for Windows 7sp1. Pls upload if possible
,dogman514,2011-10-03T19:38Z,go to microsoft downloads you should be able to get it there.
,deepflames,2011-10-04T17:55Z,hahahaha the ask to pay for it there
