User Type,Username,Date,Text
,Mun60,2011-10-07T17:51Z,"Thank You Very Much Work Perfect.

Just One Guestion: 

Can I Update Or Upgrade With This Keygen In The Future."
,billy9861,2011-10-20T18:51Z,It worked on Zemana AntiLogger 1.9.2.799...thanks!!!
,roystone,2011-12-14T20:33Z,thanks perfect.like all you do.
,sexussex,2012-02-25T17:57Z,"excellent as always ;) , keep it up bro , works with latest version too btw "
,nevilkrad,2012-05-17T11:42Z,downloaded just the keygen. keygen works great! i used it on 1.9.3.158 which i downloaded just now.
