User Type,Username,Date,Text
,goodwood,2011-05-06T18:53Z,"Thanks Dannieloco

When I installed it, I didn't need to use the KeyGen. It picked up my Username and there was a Serial already there. 

Says expiration ""Never""
Think it's OK to phone home or should I be blocking this with Little Snitch?"
,Dannieloco,2011-05-07T08:38Z,"goodwood: If expiration says never, then you should have no problem ""phoning home"". 

If it deactivates for any reason, just run the keygen again.
"
,TNHTechnology,2011-05-10T12:21Z,"i was looking for this, See if it works.."
,TNHTechnology,2011-05-10T12:23Z,"Hey when i download the torrent my web browser says ""No File Specified"""
,Dannieloco,2011-05-10T22:47Z,^ do you have uTorrent or some torrent software installed? 
,virus.app,2011-05-14T06:15Z,tnhtechnology: just click the magnet link. 
,virus.app,2011-05-14T06:37Z,guys.. do something... i am stuck at 89%
,Dannieloco,2011-05-15T02:56Z,Im still seeding and I hope you guys are too!
,raul_fdz,2011-05-17T19:41Z,"For some reason the link to the file is not working, I get the same ""No File Specified"" message on my browser but the magnet link does work.
Thanks"
,Hmacrew,2011-05-20T21:27Z,"I already got this but I just want to say I love  CleanMyMac its a very good app to have and I love the uninstaller,Manage extensions and quick file erase is really cool I hope you guys enjoy it like I have. :]"
,Dannieloco,2011-05-23T19:33Z,Keep seeding guys! and yes this app is great. Its similar to Ccleaner for pcs.
,NORWAYFREAK97,2011-05-25T14:52Z,"it works! and it is great! speeded up my mac together with disk utility! 

i has seeded 24 hours now:)"
,Dannieloco,2011-07-25T16:00Z,This torrent is upgradeable. Feel free to update the software via the program's software update.
