User Type,Username,Date,Text
,sthasunil,2011-06-08T14:07Z,"There is no sound while playing pro file and warning appear it says ""some some sound track has no associate sound bank"". "
,sthasunil,2011-06-08T14:10Z,"There is no sound while playing pro file and warning appear it says "" some sound tracks has not associated sound banks"""
,xxxchromaticxxx,2011-07-15T11:37Z,@ the idiot above me: thats because sound is not included in this torrent. you need to download soundbanks (around 2 gigs) from another torrent
,xxxchromaticxxx,2011-07-15T14:53Z,"I dont think this works properly, you need to have a zip file which adds as support to the installation file. this sucks"
,Lestat57,2011-08-01T17:26Z,"Updated soundbanks would be great 

http://www.guitar-pro.com/en/index.php?pg=soundbanks"
