User Type,Username,Date,Text
,vandergraaf1000,2011-03-08T17:36Z,"There are two folders when you unrar this, one containing the album the other called extras. DONT OPEN THE EXTRAS ONE!!!! I did and it fucked my system up! Now Im getting regular malware alerts!"
,robbievega,2011-03-08T19:09Z,"dunno what the n00b above me is talkin about but this is a class upload, no virusses!!"
,vandergraaf1000,2011-03-08T19:58Z,Not a fuckin noob the file is infected I now have to reinstall windows!
,philly2169,2011-03-13T20:16Z,vandergraaf1000 don't know what you downloaded there are no rar files in this torrent just the songs thanks for the great upload
,philly2169,2011-03-13T20:18Z,Great upload thanks @ first post there are no rar files in this torrent
,ToddManning666,2011-03-20T00:27Z,"vandergraaf1000 is a f#$king douche. There are no .rar files. There are only Mp3 files and they are clean.  He probably works for the record company and is trying to stop us from sharing.
Thanks for the good up, will seed."
,thehype26,2011-03-26T23:49Z,"don't believe vandergraaf1000 cos there's no rar/virus in this torrent.

good download.  \m/"
,damnken,2011-04-09T14:30Z,"Don't know what Vandergraaf is smoking, but I gotta get me some of it... Dude it's clean, even if you're not confident just scan it... Good album, kept their old sound, but have some new twists."
,gaz105,2011-06-05T22:03Z,1st Class Download.. Thnx.. Scanned & Clean (No RAR files)
,avd17,2011-06-16T15:54Z,quality?
,avd17,2011-06-16T16:02Z,quality is 320kbps great. no rar's no virusses
,ethan.badass,2011-07-16T06:16Z,"vandergraaf1000 you nuts or what?

malware alerts, whatever dude..."
