User Type,Username,Date,Text
,pyrorob,2011-04-05T06:58Z,"yeah, what a bullshit torrent, obvious trojan, open the .bat file with any text editor and does that look like dos commands? no.. 
really hoping for a ""real"" 1.2 crysis 2 crack"
,31415926,2011-04-05T12:11Z,"If it is a trojan, than it is very well made one. Not a single detection by 40 AVs: http://www.virustotal.com/file-scan/report.html?id=058133f0d1d94c1a8e53f155ecdc1c3c202225c617412cf6f8ae11240d22ef1c-1301997758
Wonder what does all of this do. Anyone tried? Does it work?"
,crazy4logick,2011-04-05T16:16Z,"Works for me. As for the ""suspicious"" .bat it is coded in a non standard language that uses the batch prefix. I found it works best if you extract it first though"
,laitblade,2011-04-05T17:02Z,ye sorry this might be oke but i will wait til i know for shure that i can thrust it
,brssnkl,2011-04-05T19:05Z,"DONT DOWNLOAD
it disables the crysis2 multiplayer and makes it something like crysis2 demo"
,t3rmi17,2011-04-06T12:51Z,plz sm1 tell where can i get the cd/dvd key or keygen for crysis 2
,Kaikallon,2011-04-06T15:43Z,"Anyone that knows for sure if this works or not (multiplayer)? The bat-file look suspicious to me
"
,LaserTurken551,2011-04-07T16:22Z,"This DOES NOT WORK. The Crack and Patch is for **Patch 1.1**

Crysis 2 Latest patch is **Patch 1.2**

Would like to have the ""REAL! Crysis 2 Crack + MP 1.2"" on thepiratebay as soon as possible, damn i wanna play Crysis 2 again!"
,woody_76,2011-04-09T16:32Z,"t3rmi17 there is no keygen\ DVDkey to get dude, if u wanna play mp ur gonna hav to buy game or stick it out till patch 1.2 proper arrives, an thats not even for sure gonna happen yet dude, if u need mp so bad go buy the game !!!!!!"
,Bearded_One,2011-04-14T00:58Z,"Oh well, another 1.2 that doesn't work...
In other news, bad company 2 is cheap as hell at the moment, coz the 3rd one's coming out...
So be a cheapass like me and go buy that to play online till 1.2 comes out..."
