User Type,Username,Date,Text
[V],bigbluesea,2011-06-16T13:53Z,Crack does not work
,1TWISTED,2011-06-16T14:04Z,"thanks,.. nice upload,... well done,.. ; )"
,Virus_Cyrus,2011-10-04T00:06Z,"@bigbluesea 
Crack does work, just copy and paste it into where ever it is you installed it and then run as administrator - voila

It even works after you update it, just run it again. *this might change some time in the future if they get wise*"
,FackundoMexican,2011-10-10T03:53Z,IF THIS SHIT DOESNT WORK I DONT CARE IS FREE!
