User Type,Username,Date,Text
,LawnMowerKing,2011-07-25T00:21Z,im seeding this one too
,LawnMowerKing,2011-07-25T02:03Z,TAKING REQUESTS!!!!!!!!!!!!!!
,LawnMowerKing,2011-07-25T03:13Z,WARNING THIS IS A TRIAL!!!!!!!
,DarkVOX,2011-07-31T06:16Z,Why would you upload a trial...?
,jj423,2011-07-31T07:02Z,this shit doesnt even work...looks like a text spamming app...
,LawnMowerKing,2011-08-04T16:19Z,i found out it was a trial after i uploaded it  cause i hadn't actually played it thill then. sorry!
,daddy.pirate,2011-08-10T12:17Z,"avatar, f0r android please .. :)"
