User Type,Username,Date,Text
,david0327,2011-04-06T23:04Z,"Good Job Man!
1st Comment!"
,Terrorkonijntje,2011-05-10T13:58Z,"@David
u must feel very lucky, like u won the lotery or something like that."
,adambay,2011-05-14T03:39Z,"lol @ Terrorkonijntje 


anywho when will someone upload the movie????


Im dying for it!!!!"
,Cran593,2011-05-22T13:56Z,"Hahaha, I think so many people have downloaded it not reading the whole title."
,schweetlew,2011-05-24T09:32Z,"You gotta definately upload the movie bro, would be awesome ""extreme"""
,flo4president,2011-05-26T19:58Z,how long till you get the movie? hangover part II
