User Type,Username,Date,Text
,ImperatorI,2011-04-07T21:24Z,"This is exactly what I was looking for, thanks for putting this up, such a shame this isn't seeded though."
,base3,2011-04-11T10:59Z,looks like there are seeds now but will reseed for a while anyway
,opaleg,2012-04-22T06:55Z,can someone please seed this?
,pras92,2012-05-18T14:36Z,"Hi @base3 @ImperatorI please re-seed this. 
This content ought to be shared. 
Pleaseee. I request you all.
thanks for your work @base3 You have done a good work here."
