User Type,Username,Date,Text
,deandre1988,2011-08-20T10:15Z,"This is the full version of the game.
Fully updated, for use with all new classes, perks, weapons, and local or lan co-op."
,xplode15,2011-09-01T12:58Z,"can anyone confirm legitimacy? no?
DLing anyways"
,deandre1988,2011-10-14T00:01Z,"Its legit.
Let me know if you want the new version.
Its supposedly ""4 player coop"" but it seems bugged at least for me. "
,-miike3-,2011-12-24T04:29Z,"deandre1988, 多Can you upload the new version please? :D"
,barraccuda,2012-01-15T11:49Z,Is it possible to play LAN? 
,AddyTzu,2012-01-16T07:08Z,"works. thanks up and seeders.
Unrar files. Instal OpenAL (from oalinst.exe). Play the game."
,deadmanik93,2012-02-12T09:04Z,Hi please as I have to found what op lan game? I have two computers side by side. I can not click on host game. Please help me
,deadmanik93,2012-02-12T09:08Z,I would like to add that the newer version of the Prophet will not turn on me. Throws it to send an error report...send do not send :(
