User Type,Username,Date,Text
[V],Toilet_sniffer_V,2011-02-18T08:20Z,All 4 films DVDRip. Please seed.
,theadvocate,2011-02-18T09:15Z,no speeed..thats coz too many leechers and no seeders...i ll seed once done....thanks for the upload .......
[V],Toilet_sniffer_V,2011-02-18T09:25Z,"I had to do a force re-check so it went off for a but. It's back on now uploading at 750 Kb/s but it's a 10 meg upload speed so there's still plenty of capacity. You'll be done shortly, thanks for seeding."
,bebsebap,2011-04-13T21:10Z,"please seed, superslow speed"
,hapitots,2011-05-05T15:50Z,Many thanks uploader. Unfortunately i'm downloading at 20kbps tortoise/sloth net connection in the third world. lol! Promise to help seed. To all DL'ers if you want faster DL speed then you better seed. Just my 2 cents. Peace! 
,frode10,2011-08-22T21:10Z,good speed. Tanxs sniffer
,Kole97,2011-09-30T14:49Z,Thankyou so much for your effort A:09 V:09 
,Ashleynin,2011-10-08T07:46Z,Thankyou so much...for complete Collection (:
,Ashleynin,2011-10-08T07:47Z,Now i can add this to my Diary (:
,MrRiply,2011-10-12T18:56Z,"t sniffer v... you are the f------ man thnx one hundred. Myself and My son will truly enjoy,you made that possible,so pat yourself on the back :)"
,Metexie,2012-01-03T00:24Z,BitRate? Resolution?
,Bratserv,2012-01-11T20:09Z,Your Awesome i try to get only your Torrents because they work they are not all messed up or in the middle of the movie all way at the very beginning so thanks for the best stuff you do.
,mtnTiger,2012-03-31T16:09Z,Thanks!  Will see after download.
