User Type,Username,Date,Text
,haseeb471,2011-05-01T18:30Z,good shearing
,Jerkoroids,2011-05-12T14:35Z,new email address is now available Plz email me if yr having problems at:- mronson67@yahoo.com
,ssssiiiillllvvvviiiiuuuu,2011-08-07T00:34Z,thx for the game...and for the included video otherwise i couldnt play the game also i warn YOU ”This game is no easy”
,Omario27,2011-09-24T23:16Z,"Thanks, great game."
,hocunick,2012-01-14T22:57Z,"I cant say that this is the best game i ever played but i cant say that it isnt.Othervise,thank you for the torrent,NOW I HAVE TO DO SOMETHING AND NOT HANG OUT VITH MY BROTHER.tnx so much!!!!!!!!!!!!!!!!!!"
