Filename,Size,Unit
Foreign/epic pool orgy  orgie.flv,73.16,M
Foreign/Its all in the Family Mother Sister Father and Brother.flv,201.26,M
Foreign/Mom & Daughter Threesome 2.flv,123.08,M
Foreign/Mom Catches Babysitter Fucking and Joins In.flv,64.82,M
Foreign/She catches him sniffing her panties.mp4,41.39,M
Foreign/Stepsister Fucks Her Brother and doctor threesome after teasing.flv,92.57,M
Foreign/Wife Catches Her Husband Fucking His Punk.flv,49.91,M
Mega Desi/Amalya Gangbang.flv,46.51,M
Mega Desi/Babe threeway pussy fucked in a wild hot desi threeway.mp4,17.85,M
Mega Desi/Boy Fucking his GF clear audio & video.flv,13.53,M
Mega Desi/Desi Bhabi in saree.mpg,140.28,M
Mega Desi/Desi pornstar in my dad's hot girlfriend.avi,250.16,M
Mega Desi/Girl with boyfriend very clear.avi,27.82,M
Mega Desi/HOT indian Randi fuck hard with boyfriend and scream.flv,34.51,M
Mega Desi/HOT women excellent fuck in all holes.flv,32.82,M
Mega Desi/Jessica teen indian priness HOT fuck in pussy and ass.flv,110.36,M
Mega Desi/Women suck cock and fuck by husbanb.flv,22.84,M
Sunny Leone/Bigg Boss Sunny Leone - Fucked The Beauty In Pink/Bigg Boss Sunny Leone - Fucked The Beauty In Pink.wmv,112.19,M
Sunny Leone/Bigg Boss Sunny Leone POV/Bigg Boss Sunny Leone POV.avi,179.49,M
Sunny Leone/Sunny Leone.avi,108.42,M
