User Type,Username,Date,Text
,kittylez,2011-06-11T01:08Z,"This is a great post, but there's no way I could download all over 6,000 photos and retain the few fragments of sanity I have left!"
,brianxxx,2011-06-11T01:10Z,Thanks!
[T],thegreenfrog,2011-06-11T02:27Z,"All the other hairy are beautiful and sexy enough to lose yourself.

You graduate to Jessica after your mind is gone."
,brianxxx,2011-06-11T22:48Z,LOL Agreed!
,antinames,2011-11-15T10:10Z,Thanks. This set will boost any man's fertility.
