User Type,Username,Date,Text
,marathonofdestruction,2011-06-21T12:04Z,You are the man!  Thanks for uploading so fast!
,biafra84,2011-06-21T13:44Z,"That was pretty fast, thx dude !

Btw when do they start racing at curcuits again instead of ovals ?"
,marathonofdestruction,2011-06-22T13:53Z,@biafra84: IndyCar goes back to road courses on July 10 for the Honda Indy Toronto
,ezshare,2011-06-26T16:16Z,"@biafra84
click the wikipedia link included in the description and you will find season info, including the race schedule that lists the track type!"
