User Type,Username,Date,Text
,ecasmb,2011-01-26T22:10Z,"I am downloading it now, when it is finished ill upload it to my server and Seed it there on 100mpbs uplink"
,donkerinternet,2011-01-26T22:58Z,"The Speed now is 2MB/s because there are a lot of Fast Seeders now so its about 1 min. and 35 sec. so whats the point its not a big file just 175 MB
Works Nice Huh :)"
,Leechless,2011-01-27T06:50Z,"No hate, it never helps.
Forgive me for misreading if I have done so.
So this torrent is the ""Patch"" that allows your previous 3.41 Call of Duty B.O. game torrent to work on CFW 3.55+, correct?
If I'm right, which I could be wrong, then you should really put the description in terms that are more easily understandable to your viewers."
,RHM756,2011-01-27T08:42Z,Dont work  i get black screen no update help???
,zvennn,2011-01-27T15:40Z,Can anyone confirm it's working on 3.55?
,eddimurpi,2011-01-27T16:05Z,"Dankje voor het uploaden :)
(heb jouw versie 3.41 net verwijderd domme domme ik) haha tog bedankt hea!"
,donkerinternet,2011-01-27T16:52Z,"@ Leechless Maybe I typed it wrong but what I'm sayin' is that this is for My Patched 3.41 version to make it working again with higer FW for people who don't want to download the retail game over.

And Yes Confirmed to Work on 3.55"
,spd19,2011-01-27T18:47Z,"donkerinternet, kan je meer dan 4gb of usb speelen? of moet ik deze game naar de interne hd sturen?"
,spd19,2011-01-27T18:48Z,"donkerinternet, kan je meer dan 4gb of usb speelen? of moet ik deze game naar de interne hd sturen?
"
,donkerinternet,2011-01-27T20:26Z,Dit Spel kan gewoon Gespeeld worden vanaf Extern alleen bij niet iedereen werkt dat dan gewoon het spel naar de Interne Kopieren
,FluffykillerNL,2011-01-31T11:13Z,how do i install free ps3 games on my ps3 im really new to this i have an 600Gb USB harddrive in NTFS format so if somebody could tell me i appriciate it
,Ebay42,2011-01-31T15:04Z,Gran Turismo 5 Patched 3.55 plsss..u rock!!
,Ebay42,2011-01-31T23:31Z,can also seeds on Gran Turismo 5 Patched 3.41 Donkerinternet EU only 2.69gb lift..plzzz
,donkerinternet,2011-02-01T18:09Z,@Ebay42 I added the link to make my GT5 patched 3.41 work on 3.55 greats
,Ebay42,2011-02-01T20:50Z,"@donkerinternet hi,i c't find the link.pls can u add the link on here..Thanks"
,Ebay42,2011-02-02T22:28Z,Hi.Where is the link 4 GT5 Patched 3.55  Plzzz???I wanna Play  this Game So BAD:(( Pls let me No!!!
,donkerinternet,2011-02-11T18:46Z,@Ebay 42 just look at my torrents: http://thepiratebay.org/user/donkerinternet/
,edukiller,2011-03-11T14:48Z,Can I play this online? Or do I get banned?
,drydenm,2011-03-29T01:53Z,Doesn't work... Same black screen... Don't bother...
,pshulyin,2011-06-15T00:53Z,"didn't work for me...i followed the instructions but once I opened it, it brought me back to the main screen with error 80000..something. :( please help?!? it'll be greatly appreciated"
,wampyr,2011-07-03T11:39Z,"This patch works fine for Wmeaw 3.55 with Multiman...

DON'T UPDATE THE GAME."
,profyler,2011-07-03T19:57Z,WORKS TO ME WITH MULTIMAN 1.15 AND FW 3.55 ! just copy content to the torrent below http://thepiratebay.org/torrent/5952565/Call_Of_Duty_7_Black_Ops_Patched_3.41_PS3_Donkerinternet work with CFW 3.55 and higer/
,alaap988,2011-12-03T14:38Z,"hey downloaded the 3.41 torrent and then this and it works perfectly, thanks for the up man, and also zombie mode works like a charm

Also have 2 questions 
1) how to add more maps to zombie mode?
2)can i play online with this or do i need some patch to do this

sorry for such noob question"
,edumaneiro10,2012-03-28T17:06Z,"It really works!!!
thank you"
,Djole24,2012-05-13T15:35Z,Works fine.
,Djole24,2012-05-13T15:36Z,Works good with fix.On 3.55.
