User Type,Username,Date,Text
,stitts,2011-01-22T00:54Z,Thanks Dean. Have a great weekend!
,BRITGIRL,2011-01-22T02:22Z,Thanks again!!! Greatly appreciated..
,jaidi,2011-01-22T03:40Z,"Thanks Dean, hope you have a great weekend. X
A10 V10"
,smartchick_95,2011-01-22T04:06Z,thx Dean. have a great weekend xx
,inkypinky3,2011-01-22T10:07Z,Thanx so much. Have a great weekwnd
,snakebollo,2011-01-22T21:05Z,Thanks Dean. You are a star !
,Myra77,2011-01-24T01:39Z,Many thanks Dean from a grateful Canadian!!
