User Type,Username,Date,Text
[V],Anacondaz,2011-01-21T01:27Z,thanks for the nice and clean upload mate
,1TWISTED,2011-01-21T13:33Z,"thanks,.. nice upload,... well done,.. ; )"
[V],kentucky-kid,2011-01-24T01:13Z,remember to help me seed =)
,ggun,2011-01-26T20:55Z,Thank you KK. Your U/L's are amazing.
,Samuelthemad,2011-02-09T21:54Z,"Missing screen capture deucebag. Sorry, I just want screen capture really bad I'm so tired, and I need it now!"
,_Da_Haka_,2011-02-23T23:00Z,What versions are these?
,Jred1234,2011-03-09T19:40Z,Thanks...Works Great!
,dashivasss,2011-03-30T00:48Z,"An VERY big Thank you!!!

Works fantastic... as your stuff always does."
,rerxx,2011-05-12T08:49Z,it looks cool
,kizito91,2011-06-19T15:27Z,thanks a lot
