Filename,Size,Unit
Reign of Assassins [2010]-BRrip-720p-x264-StyLishSaLH.mp4,497.4,M
Reign of Assassins [2010]-BRrip-720p-x264-StyLishSaLH.jpg,74.64,K
Reign of Assassins [2010]-BRrip-720p-x264-StyLishSaLH.srt,69.23,K
Thanks.txt,552,B
Join us @ facebook.com.txt,286,B
Torrent downloaded from Ahashare.com.txt,66,B
Torrent downloaded from thepiratebay.org.txt,51,B
Torrent downloaded from ExtraTorrent.com.txt,51,B
Torrent downloaded from Puretorrents.cc.txt,50,B
Torrent downloaded from Demonoid.com.txt,47,B
Torrent downloaded from Bit-Byte.org.txt,47,B
Torrent downloaded from Deemtrack.in.txt,47,B
Torrent downloaded from Kingdom-kvcd.net.txt,47,B
Torrent downloaded from Sceneunderground.org.txt,44,B
Torrent downloaded from h33t.com.txt,43,B
Torrent downloaded from Kickasstorrents.com.txt,43,B
Torrent downloaded from 1337x.org.txt,24,B
