User Type,Username,Date,Text
,ratfarts,2011-02-03T09:07Z,"thanks for posting this up TvTeam.

on a side note...its amazing how many greedy leechers there are on this one.  a whopping 370mb file and you cant even seed it for just an hour?  selfishness abounds."
[T],Robston,2011-02-03T09:43Z,"Grabbed this from a private site, now seeding. Enjoy"
,omarstrollin,2011-02-03T14:51Z,is there any FNL with good quality coming up?
,buster723,2011-02-05T01:39Z,I'm afraid this was pretty poor picture quality. Hoping for a better upload soon.
,swwth,2011-02-10T01:22Z,PLEASE PLEASE IS IT POSSIBLE TO DOWNLOAD THIS AS SOON AS ITS OVER ..I AM CRUSHED TONIGHT IS THE LAST NIGHT
,TedLilly,2011-03-31T03:58Z,Thanks for the up 
,TedLilly,2011-04-01T17:32Z,thanks for the up
