User Type,Username,Date,Text
,rkrox88,2011-01-30T13:29Z,Please seed after downloading
,PaatPiriet,2011-01-30T16:48Z,Thanks man.
,PaatPiriet,2011-01-31T22:30Z,"This torrent stuck at 1,1% Download at this link works just great. http://torrentz.eu/13dfd11047815f4ef242d436d6e0c8e6981ea00d
Thanks anyway."
,501dee,2011-06-14T01:09Z,anyone who has the full file please seed it. I will help seed it if I can finish the download! It stuck at 54% and never continued. Thanks anyway.
,ronzmicz,2011-07-10T06:20Z,Plz seed i'm stuck at 56% . . . . .  
,ohidenny,2011-09-14T22:00Z,"My download is stuck at 53.9%. Please, seed this torrent. "
,MarioE,2011-10-26T16:41Z,"please seed?!! Stuck on 51,2% : ("
,MarioE,2011-10-26T16:42Z,"Please seed, stuck at 51,2%"
