User Type,Username,Date,Text
,balintbalint,2011-03-02T23:42Z,"Man, you're doing a great job.
Keep doing it! Thank you."
,rushy68,2011-03-07T09:39Z,I hoipe it's gonna work. 
,h-Bruun,2011-03-09T22:01Z,kan denne aura ikke bruges til dk sprog ?
,DrDamage,2011-03-19T20:56Z,"Works like a charm on an Ideos X5/U8800.
Maps are easily downloaded with the Aura Downloader after it's installed. Thanks for the up :)"
,KOHb13,2011-04-06T20:07Z,Here is 2.1.3 version http://thepiratebay.org/torrent/6300016/Sygic_Aura_Drive_Europe_2.1.3
,rushy68,2011-05-17T22:08Z,"Thanks! Dank je! 
Waiting for 3.0 "
,c00tjuh,2011-12-27T15:33Z,"Great woks fine for me..
Thanxs"
