User Type,Username,Date,Text
,boljshoi,2011-06-21T09:40Z,"wat een vuile propaganda film!!!
Georgiers hadden onschuldige Osetiers massaal vermoord en doen dat nog steeds met ABhaziers...
In afgelopen 5-6 jaar hadden Amerikanen 8-10 Miljard's dollars in de voorbereiding van deze oorloog geÃ¯nvesteerd...en nu nog dergelijke rotte  film! Saakashshvili word door eigen volk gehaat. Mensen weten niet hoe ze van deze maniac moten af. Hoewel het volk zelf best fascistisch is! Wie niet van Georgische bloed is, zijn gewoon derde of vierde soort mensen. Alle donkere mensen zijn gewoon negers en dergelijke. Het is een christelijk Iran en dit land word nu geprijsd!!! Dan weten we  hoe die al BenLadens ontstaan! Dezelfde bullshit!!! Geld en tijd insteken in monster die morgen gaan eigen baasjes bijten. Russen zijn heel ver van het ideale volkje, maar ze zijn open voor gelijke rechten en beschermen wel alle zwakken. In afgelopen 10 jaar Geroriers hebben Abhaziesche volk gehalveerd. Een kleine volkje is uitgeroeid. 
Het fiet dat Saakashvili's vrouw een Nederlandse is, maakt deze regering niet beter. Het is meer beschamend dat Nederlanders indirect betrokken zijn aan deze vuile etnische zuiveringen. 
Vergeet niet dat Gerogische legertje had best geavanceerde wapen en wat absoluut niet tot discussie komt in deze film: ze hadden oorlog begonnen!!!!!!!!. Middernacht word hoofdstad van Ossetie aangevallen door tanks en bombardement. Gewoon civiele wijken van groot stad worden genadeloos plaat gebombardeerd! De internationale rechtbank in Strasburg en Den Haag heeft Georgiers als schuldige gevonden. 
Het is echt heel raar dat Mladic moet in detentie en schurk als Saakashvili word vereert! 
Na dat alles geen schijn van vertrouw meer in de vuile spelletjes van VS en Nl!!!"
,puntmuts88,2011-06-21T11:05Z,"It's a movie and not a political statement! P.s if you don't like it , don't watch it!"
,bronco3,2011-06-21T16:25Z,"Why do you ”infect” TPB with all these films, with SUBS only in Dutch....? Do you even REMOVE the ones in English....?

And all the while you already do have your own site in Holland where you can DL all these film without have to take bandwidth from TPB.......?"
,de_spijker,2011-06-21T17:54Z,bedankt nlupper.
,HenkAjax,2011-06-21T19:12Z,Dank je NLUPPER002 !! And BTW. the green skull is there for a reason...
