User Type,Username,Date,Text
,beach.life,2011-02-11T15:03Z,"the one, the only.... thethingy..

thanks again.. u r without question the best uploader and we are very lucky to have u.."
,dannyb4,2011-02-11T17:39Z,I lost my copy of Dreamweaver CS3 Beyond the Basics. Can you find this to upload or if anyone else has it I would appreciate very much. You are the best uploader here bar none!!
,nedand,2011-03-10T14:59Z,Thank you very much!
,PaulieMia28,2011-05-15T08:42Z,You are proving to be the on e of the most reliable user's thank you and keep on doing what you do.
,jstabel,2012-01-16T09:35Z,"Hi thethingy!

I hope you can have a way of uploading the Charting In Depth and Financial Formulas in Depth tutorials.

THANK YOU FOR YOUR CONTINUED SHARING! :)"
,jstabel,2012-01-16T09:39Z,"Hi thethingy!

I hope you can have a way of uploading the Charting In Depth and Financial Formulas in Depth tutorials.

THANK YOU FOR YOUR CONTINUED SHARING! :)"
