User Type,Username,Date,Text
[T],nobody2007,2011-02-02T19:52Z,"Bob Marley, real name Robert Nesta Marley, [bÉ’b ËˆmÉ‘Ë(É¹)li] (* 6. Februar 1945 in Nine Miles, Jamaika; â€  11. Mai 1981 in Miami, Florida)

Concert Albums

    * Live! (1975)
    * Babylon by Bus (1978)
    * Live at the Roxy (2003) (recorded in California at 26. Mai 1976)

Thanks to the seeder for the donation.
However, if Wiki is right, Bob Marley has been dead for many many years. How can it be (once again) a (new?) live album? I think that all this was only collected from various old collections again.
Have I missed his last live performance?"
,Karee.11,2011-02-02T22:32Z,"nobody2007, it's not an Live recorded album, it's a verb: Live, Living... Bob Marley live forever :)"
,shwagtm,2011-02-03T07:13Z,"Recorded 30 years ago while Marley was touring in support of his album Uprising, Live Forever is Bob Marley’s last recorded concert. This never before released audio collection offers an incredible snapshot of one of music’s most influential performers."
,EazyEMV,2011-02-03T16:49Z,"I might be just a problem with my computer, but I downloaded it and it works and plays except it's not 20 tracks, It's two tracks, one for each cd. Anybody know why it's like this or is it supposed to be?"
,rastafari_,2011-02-03T18:50Z,Thank you for the upload! But I recommend everyone to buy this excellent CD to show the companies that we want MORE Marley released!
,LH-TAIMI,2011-02-05T22:12Z,"@EazyEMV
nothing on ur pc there is 2 files with all theese songs inside ;)"
,thenursepp,2011-09-08T13:37Z,"Thanks to the Musicos & thanks  for the Upload.
OK! Thanks! Ô¿Ô"
