User Type,Username,Date,Text
,petrifiedwood,2011-06-03T02:35Z,"That's why I love JAP porn, it's fucking real. She even cried at the end, sweet girl.

Thanks for the upload!"
,OwEnMeisTeR,2011-06-08T15:00Z,Thanks man. Nice upload and good quality. She's definitely a virgin. It could have been an excellent defloration movie if it's not censored! Fuck Jap mosaic!
,spifkitten99,2011-07-10T02:57Z,You guys are too gullible.
,pankaj2112,2012-04-21T12:57Z,where is the screen dude..???
,Mesiya,2012-05-20T03:27Z,are u guys for real upload those which contains interactions from both end i mean girls completely a stupid or have no idea in first place you shouldn't upload that kind shit to TPB how any one enjoy this dont you have woman in your homes she was innocent when she step in for this what a piece of nonsense its a rape TPB must not allow upload that kind of uploads complete waste of time. what kind of life in it to have a fun like that of this kind. brainless stuff. 
