User Type,Username,Date,Text
[H],HeroMaster,2011-04-07T21:31Z,ENJOY Collector's Edition of Gravely Silent house of Deadlock.
,hawkeseye,2011-04-08T07:25Z,thank you hero no1 great game and fast download.
,1TWISTED,2011-04-08T14:13Z,"thanks,.. nice upload,... well done,.. ; )"
,richsue617,2011-04-09T01:45Z,I orginally d/l from a different person. Should have know better. Will always d/l from Wendy from now on. Have never had a problem with your games. Thanks so much Wendy.
,teddybear77,2011-04-29T19:38Z,"I also got malware from this download... and from 5 otehrs of the newest games from Hero.
All games required unpacking... sorry to say this. I alwayes loved wendy games for their clean downloads. "
,realcomenter75,2012-02-15T11:34Z,@teddybear77 your so full of shit you got viruses from dowloading porn from the wrong places ha ha dont blame your gayness on heromaster  you turd burgaler !!!
