User Type,Username,Date,Text
,Scratzz,2011-04-25T06:10Z,"Bravo Snoopy.... 
Nu gjorde du helt rätt. Kvalité ok. 
Förslag = Fortsätt så här, för det kan du. 
Filmen är ganska rolig, och jag har den sen tidigare, fast i NTSC. Du har säkert mer bra att komma med.........."
,Scratzz,2011-04-25T11:01Z,"@Agentbay
I'm not on a lifetime vacation, just workin' in the dark with the things I love most. Makin' movies. Hunting for rare ones. If you'r smart you know my release channel. He's in training right now. 
Next up will be ""Forever Young""."
,Saffron,2011-04-25T18:00Z,You wouldn't happen to have 'Prozac Nation(2001)' with nordic subtitles?
