Filename,Size,Unit
The Man From Nowhere [2010]-480p-x264-StyLishSaLH.mkv,334.03,M
The Man From Nowhere [2010]-480p-x264-StyLishSaLH.jpg,253.15,K
The Man From Nowhere [2010]-480p-x264-StyLishSaLH.srt,59.11,K
Thanks.txt,552,B
Torrent downloaded from Ahashare.com.txt,66,B
Torrent downloaded from ExtraTorrent.com.txt,51,B
Torrent downloaded from thepiratebay.org.txt,51,B
Torrent downloaded from Demonoid.com.txt,47,B
Torrent downloaded from Darkbay.com.txt,46,B
Torrent downloaded from Sceneunderground.org.txt,44,B
Torrent downloaded from h33t.com.txt,43,B
Torrent downloaded from 1337x.org.txt,24,B
