User Type,Username,Date,Text
[V],gnice06,2011-04-04T01:01Z,The screens are up your grandmother's ass.
[V],gnice06,2011-04-04T09:54Z,Pathetic troll...
[V],gnice06,2011-04-04T12:41Z,Another temper tantrum?
[V],gnice06,2011-04-04T12:52Z,"Pitiful troll BEGGING for screens....

AHHHHH HA HA HA HA HA HA!!!"
[V],gnice06,2011-04-04T22:48Z,TROLL MONKEY still looking for screens...
[V],gnice06,2011-04-05T00:44Z,"No screens for the ASS QUEEN!!!

AHHHHHHH HA HA HA HA HA HA HA HA HA!!!!!"
[V],gnice06,2011-04-05T02:00Z,MONKEY ASS TRASH!!!
[V],gnice06,2011-04-05T23:44Z,"You pitiful, lonely monkey troll..."
[V],gnice06,2011-04-06T02:22Z,ALL TROLLS ARE BITCHES...
[V],gnice06,2011-04-06T21:55Z,I COMMAND you to perform monkey!
[V],gnice06,2011-04-07T14:21Z,"This clown LIVES on thepiratebay...

This shit is TOO FUNNY..."
[V],gnice06,2011-05-08T06:26Z,I know what it feels like inside of your grandmother.
[V],gnice06,2011-05-08T15:09Z,"I'm working the shit out of you, AREN'T I MONKEY????

""Negative ratings""?  

BWAAAAAAAAAAAAAH HA HA HA HA HA HA HA HA HA HA HA HA HA HA HA HA HA HA HA HA HA!!!!!

BITCH monkey being dragged around on a string for the whole world to seeâŚ

Sorry to ruin your day, but you have work to do SLAVE!

KEEP TYPING BITCH!!!!!!!"
[V],gnice06,2011-05-11T00:16Z,"This TROLL MONKEY has NO LIFE and can be found daily in The Pirate BAY porn section.


Keep waisting your time DUMBASS!

I OWN YOU MONKEY!

Keep typing MONKEY, you have work to do!

MOVE ASSHOLE!  NOW!!!!

World, this is how you work the shit out of a MONKEY."
[V],gnice06,2011-05-11T13:28Z,"Proof of OWNERSHIP!


BWAAAAAAAAAAAAAH HA HA HA HA HA HA HA HA HA HA HA HA HA HA HA HA HA HA HA HA HA!!!!!"
[V],gnice06,2011-05-13T16:47Z,"You wish you were having fun DUMBASS...

Stop fooling yourself. 

You don't believe that LIE yourself MONKEY.

You're very PISSED OFF. It's in your posts DUMBASS. Additionally, other members have pointed this out to you but you're too stupid to listen.

You're having fun alright... Keep dreaming...

I think I'll ** SPIT ** in your fucking face once again.


BWAAAAAAAAAAAAAH HA HA HA HA HA HA HA HA HA HA HA HA HA HA HA HA HA HA HA HA HA!!!!!

Be sure to waste HOURS checking every torrent for comments SLAVE! Of course you have NOTHING else better to do.

There has to be someone out there who wants to be friends with a MONKEY. 

Perhaps if you brush your teeth and stop eating your SHIT you will be able to make some friends and get a life. 

JUMP SLAVE JUMP!"
