User Type,Username,Date,Text
,doude422,2011-09-08T03:29Z,"for the first comment, WTF did you download teh file or did you thought it was fake, Its probably not fake cuz it a R5.LIne Quality there is like 10 and more files like this on pirate bay of this movie, if he put dvd rip in title then i would say its fake, But im pretty sure its not fake"
[V],Hackulus,2011-09-08T04:04Z,"@ doude422  thanks man that guy was just being dick he didnt even have the movie and almost got me banned for good, he done it to a few people and got them banned i reported him to the mods at http//forum.suprbay.org"
[V],Hackulus,2011-09-08T04:25Z,Please keep comment folks on quality and keep seeding to a ratio o at least 1.1
,houns339,2011-09-15T20:25Z,Anyone know how to bypass the cinavia protection on ps3?
,ctb58,2011-10-17T16:09Z,The audio goes out if sink! 
,Cram_073,2011-10-21T20:42Z,V:10 / A:8 Thanx @Hackulus
