User Type,Username,Date,Text
,jo4130,2011-07-06T18:19Z,Merci Champion
[V],les-stefs79,2011-07-07T08:53Z,de rien jo ;) ..
,sampiero,2011-07-09T10:29Z,"Merci pour ce film!
Pour un assaut, la scène dans l'avion est un peu trop longue pour des professionnels,quatre tirs auraient dus suffire.
Vous êtes les meilleurs en uploads!
Toujours amateur de bons films."
,Cavla,2011-07-16T06:39Z,Merci les amis! Plus de films FR (= d origine FR)!
,Dlurker,2012-01-19T10:22Z,"Merci beaucoup, c'est très apprécié!"
,siod09,2012-03-09T14:25Z,"depuis la france, il vaut mieux passer par un proxy pr ce genre de truc?"
