User Type,Username,Date,Text
,aidymun,2011-05-28T20:55Z,Can someone please seed for me?  I have been at 19.4 percent for ages.
,lorewill,2011-05-31T01:16Z,"I have been busy away from working with the computer, I hope it`s been faster now. "
,blacksidex6,2011-06-07T08:38Z,Please seed...and Thanks
,kptwench,2011-06-16T22:35Z,For the last 4 days this torrent is showing in utorrent as stuck at 95.4% with anywhere from 2-11 seeds (none at 100%)  and close to 50 of us stuck at the same 95.4%.    :(  
,lorewill,2011-06-25T11:24Z,"The torrent software I used to create this torrent has seemed unable to pack four books: partials of ""Muybridge"" and ""The Spirit"" and none of ""Nacked Man"" and ""Natural Way to Draw."" The reason I don`t know. It accounts for the left five percent which still missing from the torrent. "
