User Type,Username,Date,Text
,chuchin180,2011-02-28T04:10Z,Grasias Por La Pelicula-------------Grasias---------Se Mira -----Fenomenal-----
,jorge56,2011-03-01T04:04Z,De nada chuchin
,DonDyablo13,2011-03-05T05:18Z,pos aqui bajando e que tan bien se mira la pelicula ya la mire nomas pregunto por la calidad ya que nomas pesa 4gb
,JOR23,2011-03-16T04:39Z,gracias jorge
,DonDyablo13,2011-04-06T00:06Z,muy buena calidad gracias jorge me ahorraste unos cuantos dolares al no tener que comprar el bluray espero mas aportes tuyos
,DonDyablo13,2011-04-06T00:11Z,muchisimas gracias jorge me ahorraste unos cuantos dolares al no tener que comprar el bluray muy buena calidad y en dos idiomas que necesito espero mas aportes tuyos
