User Type,Username,Date,Text
,huzeno,2011-03-11T14:31Z,"i'm assuming a live action version of the anime, ""the girl who leapt through time""

if so, i hope it will be as amazing as the anime... still in my top 5!

thanks aoloffline!"
[V],GoodFilms,2011-03-11T17:09Z,"No, it's not a remake of the animated film."
,pirateman2,2011-03-11T17:20Z,"be aware, audio is in Japanese only..."
,vvuseful,2011-03-11T22:47Z,How is the audio video rating ?
,exocetkid1,2011-03-12T19:17Z,subs?
,brassN,2011-03-16T23:57Z,"english sub:
http://www.anysubs.com/subdetails.php?subid=130770

this turned out to be a good movie. a little sad and a little touchy. "
,SYNAESTHE5IA,2011-06-26T00:05Z,"I just watched the anime The Girl Who Leapt Through Time, and loved it. Although I know this isn't related to it, it put me in the mood for something similar, which is how I found this film. Thanks for the upload."
