Filename,Size,Unit
"01.Lota, Raquel, La Reina, Putifar, Gran Sacerdote, Faraon y coro.mp3",15.12,M
"05.La Reina, Sul y coros de esclavas (_Sones babilónicos_), Sul (_Ay va_).mp3",11.18,M
"03.Lota, Raquel, Jose y coro de viudas.mp3",9.71,M
"02.Lota, Raquel, La Reina, Putifar (_Salve Lota_), Gran Sacerdote, Faraon y coro.mp3",8.25,M
"06.Lota, La Reina y Jose (_Trio_).mp3",7.72,M
"04.Jose (_Yo soy el casto Jose_), Lota y Jose (_La capa de José_).mp3",5.16,M
"07.Jose, Faraon y Copero de S.M. (_Garrotin_).mp3",4.1,M
08.Orquesta y coro general.mp3,1.86,M
La Cortedel Faraon Carátula.jpg,78.29,K
