User Type,Username,Date,Text
,Allu00,2011-01-05T23:53Z,sitte kans apinat jaatte jos haluutte lisää näitä !
,Tuempsi,2011-01-06T00:07Z,"jepjep, heti kun alat itse jakamaan."
,Allu00,2011-01-06T00:30Z,"siellähän se on jaossa kokoajan ;D! 
ei vaan näy se vielä täälläkun on hieman hidas tuo piratebay päivittämään noita torrentin tietoja"
,krapo,2011-01-06T16:24Z,Kiitoksia! :)
,Mariomies,2011-01-17T14:27Z,Onko ensimmäistä ja toista jaksoa missään?
,Allu00,2011-01-17T23:47Z,Ensimmäisen jakson uppaan tiistai aamuna.
,Silsatykki,2011-01-18T01:50Z,"pakko se on tämäkin kommentoida.. .TÄYTTÄ KURAA!

loistavaa duunia kuitenkin uppia tätä koska joku tästäkin pitää ja suomikama on hakusessa täällä.. eli kai kiitos on kohdallaan ;)"
,Silsatykki,2011-01-18T01:54Z,"jatkampa edelliseeni: ""Täysi Kura"" maininta on vain oma mielipiteeni ko upin sisällöstä ei upin laadusta josta en sano sanaakaan, koska en edes katso moista.

eli lisää näitä suomiuppeja KIITOS!"
