User Type,Username,Date,Text
,Derderderr0o,2011-01-27T03:00Z,Would I be able to use a video converter to make this video iPhone Format? I'm just asking because I never did it with a 1080p video file.
,Tekuzumoto,2011-03-19T19:24Z,yes u can but the quality would drop
,bless_bless,2011-04-26T03:43Z,"hi..
i'll try to download this, but i want to play this at my HD Media player. should i convert this file type (iso to any video file) or can i directly copypaste this to my HD Media player?"
,druhklam_orbowetsch,2011-09-28T01:31Z,thanx!!!
