User Type,Username,Date,Text
,mattrageous4,2011-05-18T13:10Z,hey ppl i dl it and will comment on it.
,watbol,2011-05-24T23:02Z,"watchable, once the camera sits still :)~
Aidio is loud, All in all...
Very Good, Nice 16:10 Full-WideScreen movie.
Keep up the Good Werk¡!
------------------------------
¿¿¿:·}~ «-{Watbol}-»  * * *
(¥¿¥)"
,minilad13,2011-06-15T22:55Z,"froggie100 can you do me a favor and if you ever get any new releases and stuff can you send me an email on minilad13@hotmail.co.uk

can you get stuff like top gear, russel howard's good news or two pints of lager and packet of rips and white van man like seasons and episodes "
