User Type,Username,Date,Text
,footballmal,2011-03-07T02:39Z,"Match of the day 2- 
Liverpool vs Man Utd
Wolves Vs tottenham"
[S],velvet.,2011-03-07T05:48Z,Moved to Video Other
,pooloop,2011-03-07T06:00Z,"thanks albiondean,this fuck is just a robber that reposts"
[V],albiondean,2011-03-07T07:56Z,hey you little shit
,ockyilson,2011-03-08T04:51Z,"where did albiondean post it originally?

any chance anyone could upload a higher reslolution version of MOTD. it would be greatly appreciated by the community im sure.

thanks to the orignial poster."
