User Type,Username,Date,Text
,The Real Chicken,2011-07-11T11:35Z,"Oh, another one? So soon? Great!

It is coming down as I write so I have something to look forward to for the evening when I have finished with my ""Ernst""-impression of the day...

Thank you, and may the sun shine on you!"
[V],80zforever,2011-07-12T03:52Z,"super cool! I have got some new music to listen to tonigth thanks to the synthpop guru, papakeno. regards man"
,white_arcades,2011-07-17T19:36Z,"Sterling selections Pappy, you do right!!"
