Filename,Size,Unit
DVD Store/Its my favoutite/Old/TUMNEMUJHEDEKHA_TEESRIMANZI.wav,41.85,M
DVD Store/Its my favoutite/Old/005 FARZ = MAST BAHARON KA.mp3,7.23,M
DVD Store/Its my favoutite/Old/029 JHUK GAYA AASMAN = KON HAI JO SAPNO MAIN.mp3,6.4,M
DVD Store/Its my favoutite/Old/050 LOVE IN TOKYO = AAJA RE AA.mp3,5.63,M
DVD Store/Its my favoutite/Old/033 KALA BAZAR = KHOYA KHOYA CHAND.mp3,5.44,M
DVD Store/Its my favoutite/Old/117 PRINCE = BADAN PE SITARE.mp3,5.44,M
DVD Store/Its my favoutite/Old/027 HAMSAYA = DIL KI AAWAZ BHI SUN.mp3,5.26,M
DVD Store/Its my favoutite/Old/007 KANYADAAN = LIKHE JO KHAT TUJHE.mp3,5.24,M
DVD Store/Its my favoutite/Old/023 ARZOO = AE PHOOLON KI RANI.mp3,5.16,M
DVD Store/Its my favoutite/Old/105 AN EVENING IN PARIS = DIWANE KA NAAM TO PUCHHO.mp3,5.1,M
DVD Store/Its my favoutite/Old/055 JAHAN PYAR MILEY = DIL HAI KE DHADAKTA.mp3,5.03,M
DVD Store/Its my favoutite/Old/104 PRINCE = NAZAR MAIN BIJLI.mp3,4.92,M
DVD Store/Its my favoutite/Old/040 PHIR WOHI DIL LAYA HOON = LAKHON HAI NIGAH MEIN.mp3,4.89,M
DVD Store/Its my favoutite/Old/MERE_DUSHMAN.MP3,4.77,M
DVD Store/Its my favoutite/Old/080 TUM HASEEN MAIN JAWAN = CHEHRA TERA ALLAH.mp3,4.62,M
DVD Store/Its my favoutite/Old/013 AAP AAYE BAHAR AAYE = POOCHE JO KOI MUJH SE.mp3,4.48,M
DVD Store/Its my favoutite/Old/037 MERE SANAM = PUKARTA CHALA HOON MAIN.mp3,4.4,M
DVD Store/Its my favoutite/Old/121 JUNGLEE = CHAHE KOI MUJHE.mp3,4.38,M
DVD Store/Its my favoutite/Old/114 APRIL FOOL = APRIL FOOL BANAYA.mp3,4.35,M
DVD Store/Its my favoutite/Old/106 JANWAR = TUMSE ACHHA KAUN.mp3,4.3,M
DVD Store/Its my favoutite/Old/051 AAYE DIN BAHAAR KE = KHUDAYA KHAIR.mp3,4.19,M
DVD Store/Its my favoutite/Old/038 NEED HAMARI KHAWAB TUMHARE = YUN ROOTHON NA HASINA.mp3,4.07,M
DVD Store/Its my favoutite/Old/099 PYAR KA MAUSAM = TUM BIN JAAON KAHAN.mp3,3.93,M
DVD Store/Its my favoutite/Old/018 HASINA MAAN JAAYEGI = CHALE THE SAATH MILKAR.mp3,3.9,M
DVD Store/Its my favoutite/Old/042 SASURAL = TERI PYARI PYARI SURAT KO.mp3,3.83,M
DVD Store/Its my favoutite/Old/102 PROFESSOR = KHULI PALAK MAIN.mp3,3.72,M
DVD Store/Its my favoutite/Old/082 HAM KISI SE KAM NAHI = CHAND MERA DIL.mp3,3.7,M
DVD Store/Its my favoutite/Old/WADIYANMERADAMAN_G_.MP3,3.34,M
DVD Store/Its my favoutite/Old/Gulabi Ankhein.wma,3.06,M
DVD Store/Its my favoutite/Old/M. Rafi.wma,2.97,M
DVD Store/Its my favoutite/Others/Aishwarya Rai/06Kajra Re.mp3,7.4,M
DVD Store/Its my favoutite/Others/Aishwarya Rai/06Achchi Lagti Ho.mp3,5.78,M
DVD Store/Its my favoutite/Others/Aishwarya Rai/Salaam.MP3,4.12,M
DVD Store/Its my favoutite/Others/Akshay Kumar/02 pyar ka anjaam .mp3,6.69,M
DVD Store/Its my favoutite/Others/Akshay Kumar/01 ek dilruba hai .mp3,6.24,M
DVD Store/Its my favoutite/Others/Akshay Kumar/01AANKHEN_BANDH_KARKE.MP3,5.8,M
DVD Store/Its my favoutite/Others/Akshay Kumar/Phalak Dekhon.mp3,5.26,M
DVD Store/Its my favoutite/Others/Akshay Kumar/Track No02.mp3,4.92,M
DVD Store/Its my favoutite/Others/Akshay Kumar/Fanah.mp3,4.91,M
DVD Store/Its my favoutite/Others/Akshay Kumar/for your eyes.mp3,4.65,M
DVD Store/Its my favoutite/Others/Akshay Kumar/Ada.mp3,4.36,M
DVD Store/Its my favoutite/Others/Akshay Kumar/Track No01.mp3,4.25,M
DVD Store/Its my favoutite/Others/Albums/Sohni lagdi.mp3,7.16,M
DVD Store/Its my favoutite/Others/Albums/Teri deewani.mp3,4.94,M
DVD Store/Its my favoutite/Others/Albums/Tere Nal Pyar.mp3,4.77,M
DVD Store/Its my favoutite/Others/Albums/Preito.mp3,4.76,M
DVD Store/Its my favoutite/Others/Albums/Preito - Copy.mp3,4.76,M
DVD Store/Its my favoutite/Others/Albums/Sayonee.mp3,4.6,M
DVD Store/Its my favoutite/Others/Albums/Deewana G Remix.mp3,4.59,M
DVD Store/Its my favoutite/Others/Albums/Gal Karni Daddy nal.mp3,4.58,M
DVD Store/Its my favoutite/Others/Albums/EK CHARKHA GALI WICH (SARDOOL).mp3,4.55,M
DVD Store/Its my favoutite/Others/Albums/Sajna.mp3,4.52,M
DVD Store/Its my favoutite/Others/Albums/08KALA TIKA.mp3,4.43,M
DVD Store/Its my favoutite/Others/Albums/Bhal Vich Dil.mp3,4.37,M
DVD Store/Its my favoutite/Others/Albums/09 DIN.mp3,4.33,M
DVD Store/Its my favoutite/Others/Albums/Tere Bin.MP3,4.31,M
DVD Store/Its my favoutite/Others/Albums/01DIL_SUKSHINSER_.MP3,4.29,M
DVD Store/Its my favoutite/Others/Albums/098.MP3,4.13,M
DVD Store/Its my favoutite/Others/Albums/Nach Punjaban.mp3,4.1,M
DVD Store/Its my favoutite/Others/Albums/Meri Jaan.mp3,4.03,M
DVD Store/Its my favoutite/Others/Albums/Pavey Phulkari.wma,3.98,M
DVD Store/Its my favoutite/Others/Albums/Sexy Eyes.MP3,3.91,M
DVD Store/Its my favoutite/Others/Albums/01___GAL_SUN_JA.MP3,3.88,M
DVD Store/Its my favoutite/Others/Albums/05.MUNDIYAN  TO  BACH  KE   RAHI.mp3,3.86,M
DVD Store/Its my favoutite/Others/Albums/05Soniye.mp3,3.8,M
DVD Store/Its my favoutite/Others/Albums/07___AKH_MATKAVE.MP3,3.77,M
DVD Store/Its my favoutite/Others/Albums/Track 02.mp3,3.67,M
DVD Store/Its my favoutite/Others/Albums/100.MP3,3.66,M
DVD Store/Its my favoutite/Others/Albums/SOHNI KURI.mp3,3.66,M
DVD Store/Its my favoutite/Others/Albums/tauba- tauba.mp3,3.54,M
DVD Store/Its my favoutite/Others/Albums/Melne.mp3,3.52,M
DVD Store/Its my favoutite/Others/Albums/C21 - Stuck In My Heart.mp3,3.5,M
DVD Store/Its my favoutite/Others/Albums/07 MAHIYA VE SONIYA.MP3,3.35,M
DVD Store/Its my favoutite/Others/Albums/Tauba Tauba remix.mp3,3.3,M
DVD Store/Its my favoutite/Others/Albums/Adat Jal.mp3,3.11,M
DVD Store/Its my favoutite/Others/Albums/Abhijeet Sawant.mp3,3.06,M
DVD Store/Its my favoutite/Others/Albums/12 MAHIYA VE(SOUL MIX).MP3,2.72,M
DVD Store/Its my favoutite/Others/Ayesha Takia/Yaara Ve.MP3,4.72,M
DVD Store/Its my favoutite/Others/Emraan/01 - TU HI MERI SHAB HAI.mp3,5.95,M
DVD Store/Its my favoutite/Others/Emraan/Yaadan teriyan.MP3,5.09,M
DVD Store/Its my favoutite/Others/Emraan/Kashish.mp3,5.09,M
DVD Store/Its my favoutite/Others/Emraan/kaho na kaho.wma,4.83,M
DVD Store/Its my favoutite/Others/Emraan/04 - YA ALI.mp3,4.51,M
DVD Store/Its my favoutite/Others/Emraan/Kashish2.mp3,4.28,M
DVD Store/Its my favoutite/Others/Emraan/Agar tum .mp3,4.13,M
DVD Store/Its my favoutite/Others/Emraan/Jhalak.mp3,3.63,M
DVD Store/Its my favoutite/Others/Hritik Roshan/03Tu Fiza Hai.mp3,6.42,M
DVD Store/Its my favoutite/Others/Hritik Roshan/01Aaja Mahiya.mp3,6.15,M
DVD Store/Its my favoutite/Others/Hritik Roshan/09Ek Pal Ka Jeena.mp3,6.02,M
DVD Store/Its my favoutite/Others/Misc/01 - dhoom machale.mp3,5.72,M
DVD Store/Its my favoutite/Others/Misc/JUNOON.MP3,4.22,M
DVD Store/Its my favoutite/Others/Misc/Allah ke Bande.mp3,4.2,M
DVD Store/Its my favoutite/Others/Misc/Kya Mujhe Pyar Hai.MP3,3.75,M
DVD Store/Its my favoutite/Others/Misc/JHOOM JHOOM.mp3,3.75,M
DVD Store/Its my favoutite/Others/Priyanka Chopra/01 AAP KI KHATIR.MP3,4.77,M
DVD Store/Its my favoutite/Others/Saif Ali Khan/02-Chak De.mp3,10.65,M
DVD Store/Its my favoutite/Others/Salman Khan/SAAJAN - DEKHA HAI PEHLI - S P BALA & ALKA.mp3,5.7,M
DVD Store/Its my favoutite/Others/Salman Khan/02 soniye sun zara.mp3,5.62,M
DVD Store/Its my favoutite/Others/Salman Khan/09 SAU DARD.MP3,5.61,M
DVD Store/Its my favoutite/Others/Salman Khan/Aja sohniye.wma,4.58,M
DVD Store/Its my favoutite/Others/Shah Rukh/Dil se.wav,57.98,M
DVD Store/Its my favoutite/Others/Shah Rukh/Chala chal rahi.MP3,6.84,M
DVD Store/Its my favoutite/Others/Shah Rukh/Mitwa KANK.mp3,5.86,M
DVD Store/Its my favoutite/Others/Shah Rukh/MAIN HOON NA.mp3,5.52,M
DVD Store/Its my favoutite/Others/Shah Rukh/Tum Hi Dekho Na KANK.mp3,5.32,M
DVD Store/Its my favoutite/Others/Shah Rukh/KANK Music.mp3,5.31,M
DVD Store/Its my favoutite/Others/Shah Rukh/Tumse milke dilka jo haal .mp3,4.12,M
DVD Store/Its my favoutite/Others/Shah Rukh/DIL TO PAGAL HAI - BHOLI SI - UDIT & LATA.mp3,3.96,M
DVD Store/Its my favoutite/Others/Shah Rukh/Tumhen jo maine dekha .mp3,3.91,M
DVD Store/Its my favoutite/Others/Shahid Kapoor/Track No04.mp3,4.98,M
DVD Store/Its my favoutite/Others/Shahid Kapoor/Dil Vich.mp3,4.97,M
DVD Store/Its my favoutite/Others/Shahid Kapoor/GUSTAKH.mp3,4.72,M
DVD Store/Its my favoutite/Others/Shahid Kapoor/PYAR MEIN TERE.MP3,4.61,M
DVD Store/Its my favoutite/Others/Shahid Kapoor/TERI YAAD YAAD.MP3,4.53,M
DVD Store/Its my favoutite/Others/Shahid Kapoor/Ashqiu.mp3,4.49,M
DVD Store/Its my favoutite/PZ/Jiya Jale.wav,41.02,M
DVD Store/Its my favoutite/PZ/VZ.MP3,7.22,M
DVD Store/Its my favoutite/PZ/AJNABI SHEHAR.MP3,6.72,M
DVD Store/Its my favoutite/PZ/KINNA SOHNA DES HAI MERA.mp3,6.56,M
DVD Store/Its my favoutite/PZ/Kal Ho Naa Ho - Sonu Nigam.mp3,6.14,M
DVD Store/Its my favoutite/PZ/Where's the party tonight KANK.mp3,5.79,M
DVD Store/Its my favoutite/PZ/06 pretty woman.mp3,5.4,M
DVD Store/Its my favoutite/PZ/Rock 'n' Roll Sohniye KANK.mp3,5.23,M
DVD Store/Its my favoutite/PZ/My dil go.mp3,5.21,M
DVD Store/Its my favoutite/PZ/TERA LIYA.mp3,5.1,M
DVD Store/Its my favoutite/PZ/Bumbro.mp3,4.7,M
DVD Store/Its my favoutite/PZ/04 JAANE KE JAANE JA(CLUB MIX).MP3,4.58,M
DVD Store/Its my favoutite/PZ/MAIN YAHA HOO.mp3,4.54,M
DVD Store/Its my favoutite/PZ/Chupke Se Suun.mp3,4.52,M
DVD Store/Its my favoutite/PZ/Agar Main Kahoon.mp3,4.47,M
DVD Store/Its my favoutite/PZ/06 kyon hua .mp3,4.29,M
DVD Store/Its my favoutite/PZ/Maahi ve.mp3,4.16,M
DVD Store/Its my favoutite/PZ/05 DO PAL RUKA.mp3,4.09,M
DVD Store/Its my favoutite/PZ/Hum to bahi.MP3,3.96,M
DVD Store/Its my favoutite/PZ/its time to disco.mp3,3.82,M
DVD Store/Its my favoutite/PZ/05 kuch to hua hai.mp3,3.66,M
DVD Store/Its my favoutite/PZ/Tu Jahan.mp3,3.62,M
DVD Store/Its my favoutite/PZ/Salam namaste.mp3,3.18,M
DVD Store/Its my favoutite/PZ/SN Dhol Mix.mp3,2.69,M
DVD Store/Song collection 2/01 TU HI MERI SHAB HAI.mp3,7.44,M
DVD Store/Song collection 2/dekhte dekhte.mp3,6.84,M
DVD Store/Song collection 2/1) WOH LADKI JO.mp3,6.6,M
DVD Store/Song collection 2/Suraj Hua Maddham.mp3,6.54,M
DVD Store/Song collection 2/04DILNASHIN_DILNASHIN.MP3,5.98,M
DVD Store/Song collection 2/03 SAMJHO NA.mp3,5.89,M
DVD Store/Song collection 2/13.BATTIAN  BHUJAI  RAKHDI.mp3,5.79,M
DVD Store/Song collection 2/04 YA ALI.mp3,5.64,M
DVD Store/Song collection 2/10 JAANE KE JAANE JA.MP3,5.45,M
DVD Store/Song collection 2/05MAAT_SUTIYA-DEEWANE HUE PAGAL.MP3,5.35,M
DVD Store/Song collection 2/01. DIL DHARHKEY.mp3,5.31,M
DVD Store/Song collection 2/KoiKaheKahtaRahe.mp3,5.29,M
DVD Store/Song collection 2/11.KATIL   KOKA.mp3,5,M
DVD Store/Song collection 2/01 NA LAYO NA LAYO.mp3,4.9,M
DVD Store/Song collection 2/01 tauba tauba .mp3,4.66,M
DVD Store/Song collection 2/01JANEMAN.mp3,4.6,M
DVD Store/Song collection 2/05 SAU DARD(GROOVE MIX).MP3,4.59,M
DVD Store/Song collection 2/01YEH_KHUDA.MP3,4.56,M
DVD Store/Song collection 2/ISHQ_VICH_JOGI.MP3,4.49,M
DVD Store/Song collection 2/02 NAAM HAI TERA.mp3,4.46,M
DVD Store/Song collection 2/01 - GAIYA NA KAR NI.mp3,4.39,M
DVD Store/Song collection 2/Kabhi Milo.mp3,4.28,M
DVD Store/Song collection 2/02 ALLAH KARE.MP3,4.26,M
DVD Store/Song collection 2/aashiq.mp3,4.16,M
DVD Store/Song collection 2/Dil Mangdi.wma,4.09,M
DVD Store/Song collection 2/11 AKHIAN.mp3,4.01,M
DVD Store/Song collection 2/07 Dil De Rani.mp3,3.98,M
DVD Store/Song collection 2/Teri Lye Remix.mp3,3.86,M
DVD Store/Song collection 2/DILDARIAN.mp3,3.8,M
DVD Store/Song collection 2/02 sajna ve sajna .mp3,3.63,M
DVD Store/Song collection 2/04 I LOVE U.mp3,3.43,M
DVD Store/Song collection 2/02 Track 2.wma,3.32,M
DVD Store/Song collection 2/KANGNA TERA NE.mp3,2.98,M
DVD Store/JHOOM BARABAR JHOOM.mp3,8.47,M
DVD Store/SADAK HUM TERE BIN MANH.MP3,7.48,M
DVD Store/JHOOM.mp3,6.92,M
DVD Store/Ye Tara.MP3,6.61,M
DVD Store/AANKHEIN KHULI.mp3,6.54,M
DVD Store/Kisna-Hum Rahein.mp3,6.51,M
DVD Store/DHADKAN DIL NE YEH KAHA.MP3,6.48,M
DVD Store/HAAN MAINE.MP3,6.44,M
DVD Store/SALAAM E ISHQ.MP3,6.42,M
DVD Store/DEEWANA AISI DEEWANGI.MP3,6.37,M
DVD Store/PARDESH MERI MEHBOOBA.MP3,6.35,M
DVD Store/DIL HAI KE MANTA NAHIN.MP3,6.3,M
DVD Store/BARSAAT HUMKO SIRF TUMSE.MP3,6.27,M
DVD Store/PYAR KAR - UDIT & LATA.mp3,6.24,M
DVD Store/Tere ishq Ki.mp3,6.19,M
DVD Store/DIL HAI TUMHARA.MP3,6.12,M
DVD Store/SAAJAN JEEYE TO.MP3,6.1,M
DVD Store/KISS OF LOVE.mp3,6.02,M
DVD Store/Swades.MP3,5.93,M
DVD Store/SAAJAN___TOO_SHAYAR_HAI___A.MP3,5.92,M
DVD Store/ANDAAZ RABBA ISHQ NA HOVE.MP3,5.85,M
DVD Store/DEEWANA KOI NA KOI.MP3,5.84,M
DVD Store/Badalon Mein.MP3,5.73,M
DVD Store/SAAJAN DEKHA HAI PEHLI.MP3,5.7,M
DVD Store/Tere Dar Par.MP3,5.64,M
DVD Store/Apne jahan ke.mp3,5.6,M
DVD Store/Tumse milke.mp3,5.47,M
DVD Store/TU BIN BATAYE.mp3,5.46,M
DVD Store/ZARA SA ZOOM LAUN MEIN - ABHIJEET & ASHA.mp3,5.42,M
DVD Store/DIL HAI TUMHARA KASAM.MP3,5.39,M
DVD Store/Kisna Hai.mp3,5.39,M
DVD Store/HO GAYA HAI - UDIT & LATA.mp3,5.36,M
DVD Store/Kudi ne Mera.mp3,5.34,M
DVD Store/Beedi.mp3,5.34,M
DVD Store/Chak De Phattey.mp3,5.29,M
DVD Store/Meri Janejigar.mp3,5.25,M
DVD Store/SADAK TUMHEIN APNA BANANE.MP3,5.22,M
DVD Store/DIL HAI TUMHARA MOHABBAT.MP3,5.16,M
DVD Store/AA AB LAUT CHALE.MP3,5.14,M
DVD Store/Miraksam.mp3,5.13,M
DVD Store/Tere Bin.MP3,5.12,M
DVD Store/KOI LADKI - UDIT & LATA.mp3,5.1,M
DVD Store/Mitwa Remix.mp3,5.1,M
DVD Store/DILRUBA.MP3,5.09,M
DVD Store/RAAZ - AAPKE PYAR MAIN.MP3,5.04,M
DVD Store/SAAJAN MERA DIL BHI KITNA.MP3,5.02,M
DVD Store/O Jana.mp3,5.01,M
DVD Store/ANDAAZ - ALLAH KARE DIL NA.MP3,5,M
DVD Store/Jhup- Jhupke.mp3,5,M
DVD Store/Kahin Aag.mp3,4.98,M
DVD Store/Saaki.MP3,4.9,M
DVD Store/EK RISHTAA DIL LAGAANE KI.MP3,4.9,M
DVD Store/OMKARA.MP3,4.8,M
DVD Store/Ishq Khudai.mp3,4.79,M
DVD Store/HUM HAIN RAHI PYAR KE.MP3,4.77,M
DVD Store/TUJHE DEKHA TO - K SANU & LATA.mp3,4.67,M
DVD Store/Gumshuda.mp3,4.59,M
DVD Store/Dil Mangta.mp3,4.58,M
DVD Store/MEHNDI LAGA - UDIT & LATA.mp3,4.45,M
DVD Store/AANE CHAR AANE.MP3,4.44,M
DVD Store/Dus Remix.mp3,4.42,M
DVD Store/Ladki kyon.mp3,4.37,M
DVD Store/Just Chill Remix.mp3,4.35,M
DVD Store/Fanah remix.mp3,4.33,M
DVD Store/DIL KA RISHTAA DAYYA DAYY.MP3,4.32,M
DVD Store/PAL PAL HAR PAL.MP3,4.29,M
DVD Store/LAGE RAHO MUNNABHAI.MP3,4.29,M
DVD Store/CHAND SIFARISH.mp3,4.24,M
DVD Store/Dil de diya hai.mp3,4.21,M
DVD Store/TUMSE KAHEN YA HUM NA KAHEN.mp3,4.2,M
DVD Store/Nach Baliye.mp3,4.18,M
DVD Store/Zikar Karein.mp3,4.18,M
DVD Store/Main hoon na.mp3,4.14,M
DVD Store/DIL HAI TUMHARA DIL LAGA.MP3,4.14,M
DVD Store/Ishq Kario Na.MP3,4.12,M
DVD Store/SAAJAN-BAHUT PYAR KARTE.MP3,4.07,M
DVD Store/RAAZ KITNA PYAARA HAI.MP3,3.99,M
DVD Store/SHAKE IT.MP3,3.99,M
DVD Store/MERE KHWABON - LATA.mp3,3.95,M
DVD Store/Rafta Rafta Nazar.mp3,3.92,M
DVD Store/Cham Se.mp3,3.9,M
DVD Store/BALLE BALLE (PUNJABI WDDING SONGS ).mp3,3.86,M
DVD Store/Golmaal.mp3,3.83,M
DVD Store/kal ho na ho (mix).mp3,3.83,M
DVD Store/Hum tum.mp3,3.8,M
DVD Store/KEH RAHA MERA DIL.MP3,3.72,M
DVD Store/Ishq To Remix.mp3,3.7,M
DVD Store/Sajna Ve Sajna.mp3,3.65,M
DVD Store/KABUL FIZA.MP3,3.64,M
DVD Store/Gore gore.mp3,3.42,M
DVD Store/Kabhi neem neem.mp3,3.4,M
DVD Store/PAATHSHALA.mp3,3.36,M
DVD Store/Chain khuli ke main khuli.mp3,3.33,M
DVD Store/kali nagin ke jaise.mp3,3.24,M
DVD Store/Ye Hawayein.mp3,3.23,M
DVD Store/Gori gori.mp3,3.09,M
DVD Store/Yaar Yaar - Kaal.mp3,2.86,M
DVD Store/Kaisi Paheli Parineeta.mp3,2.8,M
DVD Store/ESEKYU T.mp3,2.51,M
DVD Store/U and I (mera dil vich ).mp3,2.5,M
My Songs/Gulam ali.MP3,8.88,M
My Songs/LAKH PARDESI.MP3,8.62,M
My Songs/PUNJEERI.MP3,7.79,M
My Songs/ISHQ DA GIDHA.mp3,7.24,M
My Songs/LONG GAVAIYAN.mp3,7.03,M
My Songs/SILA_MILA_HAI_MUJHKO.MP3,6.99,M
My Songs/Yaara O Dildara.mp3,6.91,M
My Songs/Gurdas Mann Manke.mp3,6.82,M
My Songs/SATRANGI RE.mp3,6.79,M
My Songs/TERA_MILNA_PAL_DO_PAL_KA.MP3,6.71,M
My Songs/GHAM KAHAN TAK.mp3,6.62,M
My Songs/BAS REHAN DE CHHED NA.MP3,6.5,M
My Songs/TU VEE BADAL JA.mp3,6.26,M
My Songs/GM - Challa.MP3,6.21,M
My Songs/main wari (folk song).mp3,6.2,M
My Songs/GULSHAN_KI_FAQAT.MP3,6.18,M
My Songs/Chamakti Shaam Hai.mp3,5.98,M
My Songs/AKHIYAAN.MP3,5.96,M
My Songs/PIND DIYAAN GALIYAAN.MP3,5.95,M
My Songs/SANU IK WARI.MP3,5.93,M
My Songs/AB_MUJHE_RAAT_DIN.MP3,5.92,M
My Songs/AS -Aage bhi jaane na tu (WAQT).mp3,5.92,M
My Songs/MUNDA JI JI BHOLDA.mp3,5.9,M
My Songs/APNA_PUNJAB_HOVE.MP3,5.88,M
My Songs/RUMAAL.mp3,5.84,M
My Songs/BHIJ GAYI KURTI.mp3,5.81,M
My Songs/HEER.MP3,5.76,M
My Songs/COLLEGE WICH.mp3,5.74,M
My Songs/IK PHULL.mp3,5.73,M
My Songs/GM - BABE BHANGRA  POUNDE NE.MP3,5.7,M
My Songs/JAG JEONDIYAN DE MELE.mp3,5.69,M
My Songs/MIRZAA.mp3,5.57,M
My Songs/Neeveen Dhoun Kasidaan Kadhee.mp3,5.52,M
My Songs/Bhear ma thaniea me.mp3,5.52,M
My Songs/Munda.mp3,5.51,M
My Songs/NACH LE GAA LE.mp3,5.47,M
My Songs/TAARIAN DI LOA.mp3,5.45,M
My Songs/O Sahiba O Sahiba.mp3,5.45,M
My Songs/WADA RAHA (SAD).mp3,5.43,M
My Songs/Mela.mp3,5.38,M
My Songs/TERA  MERA  RISHTA.MP3,5.36,M
My Songs/JANA DIL MA KAB SA HEA TU.mp3,5.32,M
My Songs/Shoney des punjab ton.mp3,5.32,M
My Songs/Panjabio.mp3,5.3,M
My Songs/KUDIYAN SHAHER DIYAN.mp3,5.3,M
My Songs/SANNU TE_AISA_MAHI.MP3,5.3,M
My Songs/Ishq Ni Chhupda Chhupaya Jag Ton.mp3,5.27,M
My Songs/Nigahen milane ko (DIL HI TO HAI).mp3,5.22,M
My Songs/RUT_HAI_MILAN_KI_.MP3,5.17,M
My Songs/Insha allah.mp3,5.16,M
My Songs/RAAT_KE_HUM_SAFAR_.MP3,5.11,M
My Songs/Khoya Khoya Chand.mp3,5.1,M
My Songs/Boli Mann.mp3,5.09,M
My Songs/Wajde Dhol.mp3,5.09,M
My Songs/PU -Chumunga.mp3,5.05,M
My Songs/SHOUNK HATHIYARAAN DA.mp3,5.04,M
My Songs/JATT RISKY.mp3,5.04,M
My Songs/RANG.mp3,5.04,M
My Songs/Tin Rang.mp3,5.03,M
My Songs/DIL AAPNA Punjabi.mp3,5.02,M
My Songs/Gabharu Jawaan.mp3,5.02,M
My Songs/ENNA PYAR NI.mp3,4.96,M
My Songs/GM - BEKADRAAN NAAL PYAAR.MP3,4.93,M
My Songs/BHARI_DUNIYA_MEIN_AKHIR_.MP3,4.92,M
My Songs/Laggi Wale.mp3,4.92,M
My Songs/PYAR KARLE.mp3,4.91,M
My Songs/GERHE DA HAZAAR MULL.mp3,4.9,M
My Songs/TUM BAITHE HO LEKIN.MP3,4.89,M
My Songs/PU -Ankhon mein.mp3,4.88,M
My Songs/TERI TAUN.mp3,4.88,M
My Songs/Nazar Lag Jaaye Naa.mp3,4.86,M
My Songs/AS -Aage bhi jaane na tu (2).mp3,4.86,M
My Songs/Mauj mastiyan.mp3,4.85,M
My Songs/Parde mein rahne do [SHIKAR].mp3,4.83,M
My Songs/MITRAN DA  NA.mp3,4.83,M
My Songs/KITANA_PYARA__CARAVAN_.MP3,4.81,M
My Songs/YEHDUNIYAYEHMEHFIL_HEERAANJ.MP3,4.81,M
My Songs/Roula pe ggaya.mp3,4.77,M
My Songs/MERE_DUSHMAN.MP3,4.77,M
My Songs/HUMTUMSE_JUDAHOKE__EKSAPERA.MP3,4.77,M
My Songs/Aasa dewana hoha.mp3,4.77,M
My Songs/NACHANE NU JEE KARDA.mp3,4.74,M
My Songs/SOHNIYE NI.mp3,4.74,M
My Songs/GM - Bekadra.MP3,4.74,M
My Songs/PIND PEHRA.mp3,4.71,M
My Songs/Yun To jate Huay.MP3,4.68,M
My Songs/Jawni jan-e-man [NAMAK HALAL].mp3,4.68,M
My Songs/Pindan Vichon Pind.mp3,4.64,M
My Songs/Jawab jinka.MP3,4.64,M
My Songs/Tera sarafa.mp3,4.61,M
My Songs/ALRHAN KUARIAN.mp3,4.61,M
My Songs/OYE HOYE.mp3,4.61,M
My Songs/Khoye khoye din hain.mp3,4.57,M
My Songs/DIL_TE.MP3,4.56,M
My Songs/RAHA_GARDISHON_MEIN__.MP3,4.53,M
My Songs/TERA  MERA  RISHTA     [REMIX ].MP3,4.52,M
My Songs/HAYE MARGAYE.mp3,4.52,M
My Songs/GORI GAL UTTE.mp3,4.49,M
My Songs/MAIN_GAON_BRAHMCHARI_.MP3,4.47,M
My Songs/Akh Larh Gayi.mp3,4.45,M
My Songs/YAAR BADNEETIYA.MP3,4.45,M
My Songs/MIRZA.mp3,4.42,M
My Songs/Tere Bgair Zindagi.MP3,4.42,M
My Songs/Surma ki.mp3,4.42,M
My Songs/DEKHAN WALI CHEEZ.mp3,4.41,M
My Songs/CHURA_LIYA_HAI_TUM_NE_.MP3,4.41,M
My Songs/CHAN DA TUKDA.mp3,4.37,M
My Songs/MEREHUZUR.MP3,4.36,M
My Songs/NA.mp3,4.35,M
My Songs/NACH LAI.mp3,4.35,M
My Songs/Rab ni chete.mp3,4.33,M
My Songs/Gadbad.mp3,4.32,M
My Songs/TUPKA TUPKA.mp3,4.31,M
My Songs/Piya tu ab to aaja [CARAVAN].mp3,4.31,M
My Songs/TERIGALIYONMEIN_HAWAS_.MP3,4.3,M
My Songs/LALKAARA.mp3,4.3,M
My Songs/NACHADI JAWANI.mp3,4.29,M
My Songs/Chori Hoi Gai.mp3,4.29,M
My Songs/Uncha lamba kad.mp3,4.27,M
My Songs/Jaan Jan Da Khatra.mp3,4.27,M
My Songs/Pehlaan Kehra Rab Ne.mp3,4.25,M
My Songs/Dhamalan Paingian.mp3,4.23,M
My Songs/KURTI LAAL.mp3,4.19,M
My Songs/PAGGAN POCHVIYAN.mp3,4.17,M
My Songs/Loki rah jhad de.MP3,4.16,M
My Songs/MAHIYA.MP3,4.13,M
My Songs/Adha Buha.mp3,4.1,M
My Songs/Dil Dol Giya.mp3,4.1,M
My Songs/Ishq.mp3,4.09,M
My Songs/Woh Jab Yaad Aaye=Parasmani.mp3,4.09,M
My Songs/SMILE.mp3,4.07,M
My Songs/DHAMAL.mp3,4.07,M
My Songs/AKHIYAAN UDEEK DIYAN.MP3,4.06,M
My Songs/DAKA.mp3,4.05,M
My Songs/Sardari.mp3,4.04,M
My Songs/DILJONAKEHSAKA_BHEEGEERAAT_.MP3,4.02,M
My Songs/DUPPATA BE..mp3,4.01,M
My Songs/KYA_HUA_TERA_WADA.MP3,4.01,M
My Songs/Duppata.mp3,3.97,M
My Songs/Sohna Munda.mp3,3.97,M
My Songs/Vekhin Dil Laa Na Baitheen.mp3,3.96,M
My Songs/PUNJABI MUNDE.mp3,3.95,M
My Songs/Welcome.mp3,3.94,M
My Songs/Akh.mp3,3.92,M
My Songs/MANKE.mp3,3.89,M
My Songs/MUNDE KEHNDE TITLEE.mp3,3.89,M
My Songs/Addi Vaje.mp3,3.89,M
My Songs/PAGRI.MP3,3.89,M
My Songs/Mauja hi mauja.MP3,3.89,M
My Songs/TERI_AAKHON_KE_SIVA___MOHD_.MP3,3.87,M
My Songs/Oa yaara dhol bajake(mika).MP3,3.86,M
My Songs/KHARKA DARKA.mp3,3.86,M
My Songs/DEEWANE MUNDE.mp3,3.82,M
My Songs/Tere Bhulekhe Jehe Paian.mp3,3.79,M
My Songs/Bande Desi.mp3,3.79,M
My Songs/Jiven Kahengi.mp3,3.77,M
My Songs/Hauli Nach.mp3,3.75,M
My Songs/Gera.mp3,3.71,M
My Songs/HUSN DA JADU.mp3,3.68,M
My Songs/GANNE.mp3,3.68,M
My Songs/Khushboo Sa.mp3,3.64,M
My Songs/LAK.mp3,3.52,M
My Songs/Sir Dukhda.mp3,3.49,M
My Songs/Hat pichhe.mp3,3.47,M
My Songs/NATUZAMIKELIYE.MP3,3.46,M
My Songs/Patola.mp3,3.44,M
My Songs/BOLIYAAN.MP3,3.39,M
My Songs/Pan khaye saiyan (TEESRI KASAM).mp3,3.33,M
My Songs/AS -Aage bhi jaane na tu (1).mp3,3.32,M
My Songs/JANEKAHANMERAJIGAR_MR_MRS55.MP3,3.32,M
My Songs/AISH.mp3,3.27,M
My Songs/Nachlai.mp3,3.26,M
My Songs/MERI MOHABBAT.MP3,3.25,M
My Songs/AAPKEPEHLOMEAKE.MP3,3.24,M
My Songs/EHSAANHOGAMUJHPAR__JUNGLEE_.MP3,3.23,M
My Songs/TEREDARPEAAYAHOON.MP3,3.21,M
My Songs/Ishq Remix.mp3,3.18,M
My Songs/GAR_TUM_BHULA_NA_DOGE__RAFI.MP3,3.14,M
My Songs/SAUBAARJANAMLENGE_USTADONKE.MP3,3.14,M
My Songs/Mele.mp3,3.14,M
My Songs/YAADON_KI_BAARAAT_.MP3,3.12,M
My Songs/PAGG.mp3,3.08,M
My Songs/TOOTE_HUE_KHWABON_NE.MP3,3.04,M
My Songs/GM - Dil Da Mamala.MP3,3,M
My Songs/SURMA.MP3,3,M
My Songs/LAK_GA.MP3,2.93,M
My Songs/BRAZIL.MP3,2.85,M
My Songs/Ina meena dika (ASHA).mp3,2.78,M
My Songs/Jhumkha gira re (MERA SAAYA).mp3,2.76,M
My Songs/babuji dheere chalna  aar paar.mp3,2.67,M
My Songs/koi vaada=jagdeep jubli.mp3,2.59,M
My Songs/Shaukh nazar ki (WOH KAUN THI).mp3,2.58,M
My Songs/GM - TUT_GEY_TRACK_KARKE.MP3,2.37,M
My Songs/AS -Aage bhi jaane na tu (3).mp3,2.06,M
PP/Chori chori.wav,73.91,M
PP/PAKKI KANAK.mp3,9.43,M
PP/KHUSHIYAN.mp3,9.21,M
PP/GALAN GORIA.mp3,9.14,M
PP/GHAR  AAJA  SOHNAYA.mp3,8.36,M
PP/NAYION.MP3,7.33,M
PP/Sohni lagdi.mp3,7.16,M
PP/MERA LAUNG VACHA.mp3,6.83,M
PP/Mehbooba mehbooba.mp3,6.82,M
PP/GORI NAAL ISHQ.mp3,6.72,M
PP/Maa.mp3,6.68,M
PP/PAISA.MP3,6.58,M
PP/Dil pagal hai.mp3,6.36,M
PP/Putt Sardaran Da.mp3,6.09,M
PP/nachi jo sade naal.mp3,6.09,M
PP/COLLABORATION.mp3,6.07,M
PP/KAUN   NACHDI.mp3,6.02,M
PP/AANKHIYAN  CH  PA  AAKHIYAN.mp3,6.02,M
PP/AAJA NACH LAY.mp3,5.99,M
PP/Unknown Artist - Unknown Album - 07. Track 7.mp3,5.97,M
PP/Unknown Artist - Unknown Album - 01. Track 1.mp3,5.96,M
PP/Babbu Mann.mp3,5.9,M
PP/Yaara mere yaara.mp3,5.75,M
PP/PUNJABIYAN DI.mp3,5.71,M
PP/Oye Hoye.mp3,5.64,M
PP/PANJEEBAN.mp3,5.64,M
PP/Ishq.mp3,5.61,M
PP/ISHQ VICH JOGI.MP3,5.61,M
PP/Harbhan Mann.mp3,5.52,M
PP/ISHQ DI MAAR.mp3,5.52,M
PP/GALLAN  GURIYAN.mp3,5.51,M
PP/dhai lakh di.mp3,5.46,M
PP/OH KHRI.mp3,5.44,M
PP/VAADEYAN TON MUKRI.mp3,5.4,M
PP/DIL.MP3,5.36,M
PP/naag.mp3,5.34,M
PP/Dhol vajda.mp3,5.25,M
PP/Billiyan Akhiyaan Bool Diyan.MP3,5.23,M
PP/lakk tunoo tunoo.mp3,5.22,M
PP/Unknown Artist - Unknown Album - 03. Track 3.mp3,5.22,M
PP/TOOTAK TOOTAK TOOTIYAN.mp3,5.21,M
PP/NIND NA AAVE.mp3,5.19,M
PP/Jhanjhar da chhankara.mp3,5.17,M
PP/CHARKHE.mp3,5.17,M
PP/BHANGRA PAUN NU.mp3,5.16,M
PP/DIL TOTE TOTE.mp3,5.16,M
PP/o vekho.mp3,5.07,M
PP/Nakhang mundya.mp3,5.05,M
PP/Saaun mahina.mp3,5.04,M
PP/PAAB CHACK DE.MP3,5.03,M
PP/Unknown Artist - Unknown Album - 08. Track 8.mp3,5.03,M
PP/Chal Hun.mp3,5.01,M
PP/MAIN NIKLA GADI LEKE.MP3,4.98,M
PP/CHANDIGHAR SHERE DI.mp3,4.97,M
PP/Mukhda tuhada.mp3,4.95,M
PP/Nachangeh sari raat (hindi+english).mp3,4.91,M
PP/RANG.mp3,4.9,M
PP/Ishak ne kamle karte.mp3,4.86,M
PP/Kihnu yaad kar kar hasdi.mp3,4.79,M
PP/Tere Nal Pyar.mp3,4.77,M
PP/Surma.mp3,4.77,M
PP/Unknown Artist - Unknown Album - 02. Track 2.mp3,4.76,M
PP/AASHQUI.mp3,4.75,M
PP/PIND PEHRA LAGDA.MP3,4.74,M
PP/Bolo Tara Ra Ra.mp3,4.73,M
PP/BOLI PA SARDARA.mp3,4.73,M
PP/Rehan de rehan de.mp3,4.72,M
PP/HAS BOL VE.mp3,4.71,M
PP/SAJAN MERE SATRANGIYA.mp3,4.7,M
PP/BILLO YAAR DI.MP3,4.7,M
PP/BILLO NI TERE DIL MANGDA.mp3,4.67,M
PP/SAJNA DE VEHRE.MP3,4.67,M
PP/DILKARE.MP3,4.67,M
PP/Aish karo.mp3,4.67,M
PP/Daler Mehndi- Na Na Na Na Re.mp3,4.64,M
PP/MELA.MP3,4.64,M
PP/Saun Di Jhadi.mp3,4.63,M
PP/NACHDIYAN ALLARHAN.mp3,4.61,M
PP/Kabza.mp3,4.6,M
PP/RUMAAL.mp3,4.6,M
PP/DAK BANGLA.mp3,4.59,M
PP/THUMKE  TE  THUMKA.mp3,4.58,M
PP/Gal Karni Daddy nal.mp3,4.58,M
PP/NANANE GORIYE.mp3,4.58,M
PP/Charkha.mp3,4.57,M
PP/Haaye sohniye.mp3,4.56,M
PP/ZULFAN WALE NAAG.mp3,4.56,M
PP/CHANOO.mp3,4.54,M
PP/Daaroo vich Pyar #.mp3,4.54,M
PP/Dil chori ho gaya.mp3,4.53,M
PP/CAPTAIN BHANGRE DA.mp3,4.52,M
PP/HAAYE MERI BILLO.mp3,4.51,M
PP/NEENDRANI.mp3,4.51,M
PP/Nachne nu kare mera ji.mp3,4.45,M
PP/BallySagoo-Hanji-BotallanSharabDiyan.mp3,4.44,M
PP/Daler Mehndi- Ho Jayegi Balle Balle.mp3,4.42,M
PP/NACHLAI.mp3,4.38,M
PP/Lal parande wali.mp3,4.37,M
PP/Bhal Vich Dil.mp3,4.37,M
PP/Nach Ni Shaam Kaure.mp3,4.33,M
PP/Jatt di pasand.mp3,4.33,M
PP/Dil mera nal.mp3,4.31,M
PP/GANDASIA.MP3,4.3,M
PP/DIL SUKSHINSER.MP3,4.29,M
PP/Morni Banke.mp3,4.27,M
PP/PYAR HO JAUGA.mp3,4.26,M
PP/Unknown Artist - Unknown Album - 09. Track 9.mp3,4.25,M
PP/Nehro Paar Bangla.mp3,4.25,M
PP/TERI TAKHNI NE DIL.mp3,4.21,M
