Filename,Size,Unit
Rammstein__Dër Single_s/01 Links 2 3 4 (Mutter (Limited Tour.mp3,8.51,M
Rammstein__Dër Single_s/02 Feuer Frei! (Mutter (Limited Tour.mp3,7.45,M
Rammstein__Dër Single_s/03 Ich Will (Mutter (Limited Tour Ed.mp3,8.51,M
"Rammstein__Dër Single_s/04 Keine Lust (Reise, Reise Limited.mp3",8.75,M
Rammstein__Dër Single_s/05 Benzin (Rosenrot 987 458-8 2005 U.mp3,8.86,M
Rammstein__Dër Single_s/06 Rosenrot (Rosenrot 987 458-8 2005.mp3,9.05,M
Rammstein__Dër Single_s/07 Mann Gegen Mann (Rosenrot 987 458.mp3,8.96,M
Rammstein__Dër Single_s/08 Mutter (Mutter (Limited Tour Edit.mp3,10.27,M
Rammstein__Dër Single_s/09 Du Riechst So Gut (Rmx By Faith N.mp3,4.7,M
Rammstein__Dër Single_s/10 Stirb Nicht Vor Mir (Don't Die Be.mp3,9.49,M
Rammstein__Dër Single_s/Rammstein__Dër Single‘s.jpg,78.11,K
