User Type,Username,Date,Text
,_WooW_,2011-10-05T18:48Z,wow thx wil binnekort gaan beginnen =D
,emiel1978,2011-10-06T12:51Z,"Bedankt voor deze geweldige upload.

heb je misschien ook VCA Examentraining ?"
,bldt,2011-10-09T21:41Z,Top !
,iycgtptyarvg,2011-12-28T12:44Z,Van welk jaar is dit?
,109860,2012-01-22T14:27Z,"Hartstikke bedankt , dit komt echt heel erg van pas . Jullie zijn mijn redders in nood! 3,1 Mb/s :D"
,kom94,2012-02-20T19:06Z,"@emiel1978
Ik heb ook gezocht nergens gevonden leren uit boek is gewoon weg het slims in eekeer gehaald sucses

@uploader
Thx!"
