Filename,Size,Unit
Acoustic Extravaganza/03 One Day.mp3,6.94,M
Acoustic Extravaganza/04 Golden Age.mp3,6.87,M
Acoustic Extravaganza/05 Boo Hoo.mp3,6.8,M
Acoustic Extravaganza/08 Miniature Disasters.mp3,6.24,M
Acoustic Extravaganza/09 Universe And U.mp3,6.22,M
Acoustic Extravaganza/02 Girl And The Ghost.mp3,5.82,M
Acoustic Extravaganza/06 Gone To The Dogs.mp3,5.49,M
Acoustic Extravaganza/07 Change.mp3,5.14,M
Acoustic Extravaganza/10 Throw Me a Rope.mp3,5.11,M
Acoustic Extravaganza/01 Ashes.mp3,4.91,M
Drastic Fantastic/12 Suddenly I See [live!].mp3,8.33,M
Drastic Fantastic/09 Beauty of Uncertainty.mp3,6.91,M
Drastic Fantastic/10 Someday Soon.mp3,5.34,M
Drastic Fantastic/07 I Don't Want You Now.mp3,5.24,M
Drastic Fantastic/02 If Only.mp3,5.18,M
Drastic Fantastic/06 Hopeless.mp3,5.07,M
Drastic Fantastic/08 Saving My Face.mp3,5.01,M
Drastic Fantastic/11 Paper Aeroplane.mp3,4.65,M
Drastic Fantastic/03 White Bird.mp3,4.43,M
Drastic Fantastic/01 Little Favours.mp3,4.35,M
Drastic Fantastic/05 Hold on.mp3,4.07,M
Drastic Fantastic/04 Funnyman.mp3,4.04,M
Eye To the Telescope/13 Immune [live!@Gaia Music - London.mp3,6.68,M
Eye To the Telescope/11 Heal Over.mp3,6.12,M
Eye To the Telescope/02 Another Place to Fall.mp3,5.76,M
Eye To the Telescope/10 Stoppin' the Love.mp3,5.56,M
Eye To the Telescope/07 Universe and U.mp3,5.52,M
Eye To the Telescope/12 Through the Dark.mp3,5.33,M
Eye To the Telescope/08 False Alarm.mp3,5.27,M
Eye To the Telescope/06 Silent Sea.mp3,5.22,M
Eye To the Telescope/03 Under the Weather.mp3,4.96,M
Eye To the Telescope/01 Other Side of the World.mp3,4.92,M
Eye To the Telescope/05 Miniature Disasters.mp3,4.85,M
Eye To the Telescope/09 Suddenly I See.mp3,4.62,M
Eye To the Telescope/04 Black Horse and the Cherry Tree.mp3,3.95,M
Have Yourself A Very KT Christmas/05 Fairytale Of New York.mp3,5.61,M
Have Yourself A Very KT Christmas/01 2000 Miles.mp3,5.34,M
Have Yourself A Very KT Christmas/03 Mele Kalikimaka (Christmas In Haw.mp3,4.72,M
Have Yourself A Very KT Christmas/06 Lonely This Christmas.mp3,4.41,M
Have Yourself A Very KT Christmas/04 Sleigh Ride.mp3,3.41,M
Have Yourself A Very KT Christmas/02 Christmas (Baby Please Come Home).mp3,2.98,M
Songs in July/07 Quiet.mp3,7.79,M
Songs in July/09 Leather.mp3,6.78,M
Songs in July/01 Paper Aeroplane.mp3,6.68,M
Songs in July/08 Night like pepper.mp3,6.17,M
Songs in July/10 Riptide.mp3,5.99,M
Songs in July/11 telephone bill.mp3,5.88,M
Songs in July/02 Gone to the dogs.mp3,5.87,M
Songs in July/05 Lay down low.mp3,5.77,M
Songs in July/06 The change.mp3,5.7,M
Songs in July/03 Trumpets.mp3,5.3,M
Songs in July/04 Little favours.mp3,5.11,M
Songs in July/12 Fall.mp3,4.76,M
Tiger Suit/04 Difficulty.mp3,8.03,M
Tiger Suit/06 Lost.mp3,6.44,M
Tiger Suit/11 The Entertainer.mp3,6.03,M
Tiger Suit/01 Uummannaq Song.mp3,5.51,M
"Tiger Suit/08 Come On, Get In.mp3",5.11,M
Tiger Suit/10 Madame Trudeaux.mp3,4.79,M
Tiger Suit/03 Push That Knot Away.mp3,4.78,M
Tiger Suit/02 Glamour Puss.mp3,4.76,M
Tiger Suit/07 Golden Frames.mp3,4.67,M
Tiger Suit/09 (Still A) Weirdo.mp3,4.4,M
Tiger Suit/05 Fade Like A Shadow.mp3,4.37,M
