User Type,Username,Date,Text
,neocc44,2011-09-28T10:17Z,May the force be with you!
,sonbol,2011-09-28T20:44Z,Those who finish please seed!
,rompwats,2011-09-29T00:03Z,"A 10/10
V 10/10

Seeding now..."
,blahblagh,2011-09-29T04:26Z,"If Lucas wasn't being an Ewok butt licker I would own these right now.  I can't enjoy his foolish endless changes, so I'm not spending any more of my money on his franchise."
,sonbol,2011-09-29T05:43Z,That's a good point.
,bobkos,2011-10-01T17:14Z,"I've let you leeches suck on my connection for 2 days now,with only 18% dl,could you please return the favor?"
,appmaster,2011-10-10T22:35Z,nearly same quality as the 12GB 1080p rips but only 2GB each!! no need to zoom in to watch full screen...  this is the best rip!!
