User Type,Username,Date,Text
,jhonnynewyork2011,2011-11-07T12:24Z,"plz upload today or tom Rise.of.the.Planet.of.the.Apes.2011 , its out on bluray , i hope this time u will do my request"
,whizzler,2011-11-08T16:08Z,"man u deserve a skull 

dont know why u havent got it till now

anyways +1"
,a212,2011-11-09T17:50Z,Mate can u upload it in english audio?
,santockz,2011-11-10T16:18Z,Amazing man...keeep it up!
,Dillin,2011-11-20T01:32Z,great torrents! thank you for the upload
,bluesborn,2012-01-02T08:45Z,An otherwise good film marred by a truly inept subtitle that at times renders the script almost unintelligible.Good luck finding a decently translated sub-I looked around and kept winding up with the same one.Argh.
