Filename,Size,Unit
CD1/01. The Phantom of the Opera (with Michael Crawford).mp3,9.94,M
"CD1/02. Anytime, anythere.mp3",7.39,M
CD1/03. Memory.mp3,8.99,M
CD1/04. Dust in the wind.mp3,8.35,M
CD1/05. Scarborough Fair.mp3,9.45,M
CD1/06. Scene D'amour.mp3,7.52,M
CD1/07. Don't cry for me Argentina.mp3,13.44,M
CD1/08. Something in the air (feat. Tom Jones).mp3,9.95,M
CD1/09. How fare this spot.mp3,4.77,M
CD1/10. Anything but lonely.mp3,6.68,M
CD1/11. Eden.mp3,9.04,M
CD1/12. Another suitcase in another hall.mp3,7.56,M
CD1/13. Gloomy Sunday.mp3,8.55,M
CD1/14. Pei Jesu (with Paul Miles-Kingston).mp3,8.88,M
CD1/15. She doesn't see him.mp3,10.12,M
CD1/16. Deliver me.mp3,9.09,M
CD1/17. Unexpected song.mp3,6.65,M
CD1/18. Lascia Ch'lo Plauga.mp3,7.91,M
CD1/19. In Paradisium.mp3,7.24,M
CD1/20. Nothing like you've ever known.mp3,7.15,M
CD1/21. Guardami (with one look-Italian version).mp3,8.32,M
CD1/22. First of may (live).mp3,6.78,M
CD1/front.jpg,2.34,M
CD1/tras.jpg,2.2,M
CD2/01. Time To Say Goodbye.mp3,9.33,M
CD2/02. Hijo De La Luna.mp3,10.19,M
CD2/03. All I Ask Of You.mp3,9.5,M
CD2/04. How Can Heaven Love Me (feat. Chris Thompson).mp3,8.42,M
CD2/05. Figlio Perduto.mp3,10.53,M
CD2/06. Everything's Alright.mp3,10.07,M
CD2/07. Wishing You Were Somehow Here Again.mp3,8,M
CD2/08. This Love.mp3,14.36,M
CD2/09. Love Changes Everything.mp3,8.05,M
CD2/10. La Califfa.mp3,6.07,M
CD2/11. Amigos Para Siempre (Friends For Life) (with Jose Carreras).mp3,10.45,M
CD2/12. So Many Things.mp3,6.77,M
CD2/13. Macavity The Mystery Cat.mp3,10.87,M
CD2/14. Solo Con Te.mp3,7.01,M
CD2/15. Tell Me On A Sunday.mp3,8.51,M
CD2/16. Murder In Marlgland Park.mp3,8.29,M
CD2/17. Surrender.mp3,7.06,M
CD2/18. Il Mio Cuore Va.mp3,10.32,M
CD2/19. Chanson D'enfance.mp3,8.95,M
CD2/20. The Phantom Of The Opera (with Steve Harley).mp3,10.46,M
