User Type,Username,Date,Text
[V],AUDI-A4,2011-07-16T05:24Z,if reg key not works use serial key BKH78A-8TBVKA-YAZVL4-M8LX7T-8RH2ME-N2WUZF
[V],AUDI-A4,2011-07-16T05:24Z,this version is 100% works
,wetnoodle64,2011-07-16T06:35Z,"Awesome, works perfectly :)"
,pafc,2011-07-16T09:55Z,works like a charm thnx
,onesmallfish,2011-07-16T11:03Z,Thanks ...working so far :) :)
[V],AUDI-A4,2011-07-16T16:44Z,"i already upload this version with serial but without crack but i have seen users having problem with registration so i upload it again with crack so registration problem will be fixed so users can enjoy
:D sharing is caring thanks for comments"
,kumarea,2011-07-16T17:43Z,thanks
,FixItt,2011-07-17T01:34Z,This program is superb! Thank you!
,waree,2011-07-17T21:46Z,"Thanks you for this. I trust your uploads and I'm not messing with you, just one question : on their website there's no ""pro"" version, only ""platinum"" and ""ultimate"". Is this one the cheaper (29.90$) version ? It is just to know which versio it is, and thanks you again."
,pharbach,2011-07-18T07:02Z,Works great with the patch provided! No other serial number required...Thanks! Will Keep Seeding!
[V],AUDI-A4,2011-07-18T08:12Z,waree no problem i will take a look which you are saying
,fightthenwofuckers,2011-07-19T08:08Z,May many virgins feed you grapes while praising your manhood fiesta569.
,TornLoader,2011-07-20T18:47Z,thanks for the serial...I only need this...
,ilocano1968,2011-07-21T19:27Z,"man no need the serial just use the crack...
the best part of having crack is you can update the database then copy paste the crack again to make it registered...
nice work blessed man"
,ilocano1968,2011-07-21T19:45Z,"you can update the driver database then paste back the crack again to work as registered
work nice"
,BrazilandStatesUnited,2011-07-28T21:11Z,Thanks!
,BrazilandStatesUnited,2011-07-28T21:12Z,"Thanks, fine!"
,jersson,2011-08-02T01:15Z,"I just read a rewiev and the no 1 driver update is Driver Detective, 2 is Driver Cure and 3 is Driver Genius. Any chance of uploading the no 1 or 2 ?"
,Henky56,2011-08-02T18:51Z,"Works Great, Thanks a Lot!"
,Malasky,2011-08-05T16:18Z,"Top upload, mate. Works a treat. Much gratitude."
,mrmusc,2011-08-28T07:59Z,"works like a charm, thanks a lot!"
,edzi07,2011-09-06T04:50Z,100% perfect!
,edog2009,2011-09-22T16:37Z,good torrent i downloaded and clean file and fast upload
,d3antheb3an,2011-10-11T08:55Z,"Why Thank You Kindly Sir =)
Keep Up The Great Work.
Long Live The Pirates :D"
,ebongny,2011-11-16T22:24Z,thanks AUDI-A4!! it works!
,jassoff,2011-11-29T20:43Z,"this is just evaliation version, try to ""unlock Auto Installer limitation"" then the program tell you that it is evaluation version
here try this one that can unlock what i mentioned above 
http://thepiratebay.org/torrent/6489977/Driver_Genius_Professional_v10.0.0.712__Serial_"
,Sphinx87,2011-12-03T15:37Z,"Works fine, Thx"
,mezmreise,2011-12-28T21:28Z,Works great ! Thanx !
,PauliusN,2012-02-05T13:42Z,"Thank You, it works with the patch."
,Celtic_Dragons,2012-03-17T16:12Z,"Awesome!! Works great! Fixed my USB  problems with this program. You are a lifesaver, AUDI-A4!!"
,Axle9513,2012-04-14T04:17Z,"OMG thank you, my brother had unistalled a bunch of my drivers and i rlly needed this. TY :DD"
