Filename,Size,Unit
Blitz.2011.1080p.MKV.AC3.Eng.NL.Subs.DMT/Blitz.2011.1080p.MKV.AC3.Eng.NL.Subs.DMT.mkv,6.56,G
"DMT NFO, Read before Playing.txt",1.38,K
Blitz.2011.1080p.MKV.AC3.Eng.NL.Subs.DMT.nfo,1.26,K
Torrent downloaded from AhaShare.com.txt,58,B
Torrent downloaded from Demonoid.me.txt,46,B
Torrent Downloaded from TorrentState.com.txt,46,B
Torrent_downloaded_from_www.puretorrents.cc.txt,36,B
Torrent downloaded from Rarbg.com.txt,33,B
Torrent downloaded from silvertorrents.me.txt,29,B
