Filename,Size,Unit
Taylor - Christians and the Holy Places; The Myth of Jewish-Christian Origins (1993).pdf,67.84,M
"Acharia - Suns of God; Krishna, Buddha, and Christ Unveiled (2004).pdf",32.35,M
Roberts - Antiquity Unveiled; Ancient Voices Proving Christianity to be of Heathen Origin (1894).djvu,20.87,M
Gardner - The Magdalene Legacy; The Jesus and Mary Bloodline Conspiracy (2005).pdf,19.77,M
Nickell - Relics of the Christ (2007).pdf,10.18,M
Warfield - Counterfeit Miracles (1918).pdf,9.63,M
Levy - Fixing God's Torah; The Accuracy of the Hebrew Bible Text in Jewish Law (2001).pdf,3.28,M
Levisee - Christianity vs. Orthodox Theology or the Deception Unmasked (1899).pdf,2.49,M
"Forbes & Kilde - Rapture, Revelation, and the End Times; Exploring the Left Behind Series (2004).pdf",2.09,M
"Burleigh - Unholy Business; A True Tale of Faith, Greed & Forgery (2008).pdf",1.78,M
Greenberg - 101 Myths of the Bible; How Ancient Scribes Invented Biblical History (2000).pdf,1.51,M
Wohlberg - End Time Delusions (2004).pdf,1.49,M
Foote & Wheeler - Crimes of Christianity (1885).pdf,1.38,M
Gribben - Writing the Rapture; Prophecy Fiction in Evangelical America (2009).pdf,1.38,M
"Thomas - Hidden Messages and The Bible Code (csicop.org, 1997).pdf",559.86,K
