User Type,Username,Date,Text
,yugroop,2011-08-20T08:57Z,"works great, thank you. 10/10 :) will seed"
[T],Tyr3ll,2011-08-20T22:50Z,"glad to see you happy then :)
and ty as well to help me to seed.
You will still be welcome ;
cheers mate"
,omerjawhar,2011-09-14T06:04Z,"Thanks for the torrent
I didn't downloaded yet but soonest I do, I will seed much I can.
I could buy it in Bazaar for 2$-3$ but it's 1 mile away :D"
,SLeePYG86,2011-09-21T06:34Z,Works awesome. I love you!
,xSBo,2011-10-13T04:32Z, downloading it now will seed for 10 hours
