User Type,Username,Date,Text
,hayesy316,2011-01-06T00:08Z,"Thanks as usual, j. Anyone know of a reliable source for Glenn Beck podcasts? eTorrents is still broken."
,UL.W.M,2011-01-06T01:56Z,"beck now has podcasts for free on his website, avaible for download"
,thefizdude,2011-01-06T02:27Z,"Hayesy316, It looks like Glenn is allowing free mp3 downloads of his radio show, from the new website.

Only the first 3 hours, but beggars can't be choosers."
,thefizdude,2011-01-06T02:28Z,Thank you J!!!
