User Type,Username,Date,Text
,Arno_Vermeulen,2011-07-31T19:31Z,Comments welcome
,freaki123,2011-08-02T17:30Z,Thx virri Upload. Kan jy asb seed!! :-)
,Quentin360SA,2011-08-02T20:55Z,"Hey dude, hoekom rip jy op 192kbps? (Het jy net WMP?) lol

Google Mediamonkey, eks n DJ, ek rip al my music met Mediamonkey (320kbps) en jy kan dan die IDTAGS ook invul as jy lus is :)

Quentin"
,freaki123,2011-08-02T21:43Z,Quintin het jy dalk enige cool nuwe afrikaanse musiek wat jy wil share?
,Arno_Vermeulen,2011-08-03T22:02Z,"@ Quentin360SA

Ek het die oorspronklike cd's. As jy net mooi gevra het kon ek dalk vir jou die 320kbps rips gegee het.

Klink my jy is die expert... so maak jy dan soos jy voel doos. "
,Christiaanbar,2011-09-09T18:56Z,Hey Arno thanks vir die upload. Regtig moeilik soms om afrikaanse musiek hier in Canada te kry.
,jbosch,2011-11-29T19:57Z,"Try this link. http://thepiratebay.org/torrent/6276235/Die_Heuwels_Fantasties-Wilder_As_Die_Wildtuin

Arno Vermeulen's cd has a few flaws."
,RebelS-DJ,2012-01-17T14:26Z,"Doos? 

Ag nee dude, rerig? 

Dis nie n pissing kompetisie nie, lees weer my vorige comment, sien jy die "":)"" in die post?

Glad nie doosagtig gewees nie, okay laat ons weer probeer.

Sal jy Asb n 320kbps weergawe oplaai?

Quentin"
,RebelS-DJ,2012-01-17T14:28Z,"@freaki123

Ek het heelwat Afrikaans (alles 320kbps) maar my upload speed is stadig so ek upload nie meer rerig nie, sal binnekort plan maak om weer te upload :)

Enige iets spesifieks wat jy graag sou wil he?"
