User Type,Username,Date,Text
,jer8585,2011-01-08T23:19Z,Sorry for the interruption. Back uploading again
,HMD3,2011-01-12T11:41Z,"Nice torrent, congrats on some of the rarer tracks, not criticizing, but 320 would be nice. And you can see my torrent of this for 1 album you're missing.

http://thepiratebay.org/torrent/6097365/10_Years_Complete_Discog_[_320kbps]_[HMD3]-fixed"
,jer8585,2011-01-13T06:15Z,"thanks HMD3. The rare tracks were a bitch to find but well worth it. Don't know why I haven't taken the time to download their discography in 320, but i will."
,jer8585,2011-01-13T06:24Z,"Actually after looking at the bitrates on all the tracks I realized that all but the last album (which is 320CBR) are 320 VBR. In the properties of the tracks, the bitrate that is listed is the average bitrate of the track. Heavier, more-complex tracks have a higher  bitrate than quiter, less-complex tracks"
