User Type,Username,Date,Text
,huvudverk,2010-12-27T13:20Z,"Thanks, but we like the femdom more! :)"
,Alf-turbo,2010-12-27T13:32Z,"Thxalot :-)
Looks like a nice one :-P
Cheers :-)"
,bastiendutemps,2010-12-27T16:52Z,"I Luv This Girl sH's So Hot Like Gia DiMarco

Thank"
,ChefEm,2010-12-27T22:18Z,"Thanks, this girl is really hot!"
,bakaonna,2010-12-27T23:37Z,Thanks for TTOO.
,Domitian,2010-12-28T01:39Z,"Every new TTO is welcome, Thanks"
,pennywinterr,2010-12-28T05:01Z,"Are they running out of suitable talent?  Bring back Lily!  As always, thanks!"
