Filename,Size,Unit
cd1/01. Visions Of Violet.mp3,4.98,M
cd1/02. Far Far Away.mp3,9.29,M
cd1/03. And The Love Is Easy.mp3,11.91,M
cd1/04. Junkyard Jevel.mp3,8.5,M
cd1/05. Continuando.mp3,8.21,M
cd1/06. Gospel With No Lord.mp3,8.2,M
cd1/07. Up The Mountain.mp3,9.28,M
cd1/08. Lullaby Of Birdland.mp3,6.63,M
cd1/09. I Adore You.mp3,14,M
cd1/10. Major Lake.mp3,11.15,M
cd1/11. Love All Over.mp3,9.64,M
cd1/12. Driving.mp3,7.19,M
cd1/13. I Like It Like That.mp3,14.9,M
cd1/14. La Fama No Me Cambiar.mp3,8.78,M
cd1/15. Una Noche Mas.mp3,11.15,M
cd1/16. Lamento.mp3,11.36,M
cd1/Ram Cafe 3.jpg,27.81,K
cd2/01. Au Cafй De La Paix.mp3,9.31,M
cd2/02. Samba De Mon Coeur Qui Bat.mp3,8.84,M
cd2/03. Her Morning Elegance.mp3,8.18,M
cd2/04. Too Much Water.mp3,7.93,M
cd2/05. Sweet About Me.mp3,7.6,M
cd2/06. I Get A Kick Out Of You.mp3,9.42,M
cd2/07. What Is Jazz.mp3,11.92,M
cd2/08. All The Years.mp3,10.74,M
cd2/09. In Space.mp3,7.92,M
cd2/10. Hearts A Mess.mp3,13.92,M
cd2/11. You'll Never Know.mp3,12.6,M
cd2/12. Not Just Rap.mp3,11.48,M
cd2/13. Love Theme from Spartacus.mp3,11.56,M
cd2/14. Miss You.mp3,9.27,M
cd2/15. The Holly River.mp3,15.44,M
