User Type,Username,Date,Text
[V],AliBaloch,2011-10-12T09:32Z,Enjoy.... one of the best Movie
,ramashu,2011-10-12T10:09Z,Thank you for doing my request... I was not expecting it so fast... u rock Al
[V],AliBaloch,2011-10-12T10:46Z,my pleasure ramashu
,whizzler,2011-10-12T12:01Z,"awesome work


a a a a ali"
,harrylala,2011-10-12T13:35Z,Beauty:-).... The Movie and your work
,jay33t3,2011-10-13T10:08Z,Can you plzz upload aaraakshan movie 720p with same sizeee
,shrivastavadarsh,2011-11-24T19:58Z,"nice job dude...
can u plz upload mughal-e-azam..."
,kill1192,2012-02-16T20:49Z,always wanted to watch this movie.... thnx ali :)-
