User Type,Username,Date,Text
,randyrhoads,2011-06-29T19:08Z,How did u get this? Or did u rip it off y-tube? fuck i wanna buy this..
,randyrhoads,2011-06-29T19:15Z,Suspecting malware... my computer is fucking up real bad. Be careful.
,Quispiam,2011-07-02T22:41Z,"It works fine for me, just one MP3 file that plays fine, correct song as well."
,f1dz,2011-07-04T07:19Z,Great yeaah...
,tjstyles,2011-07-06T14:36Z,"Works fine!
No viruses and good quality :)"
,StayPhrosty,2011-08-15T23:33Z,"fantastic torrent. fast dl, clean, great quality. ty :)"
