User Type,Username,Date,Text
,hagriddenrules,2011-09-13T08:54Z,Welcome back dear fren......it's great to see ur uploads again where i can download without thinking of anything.....cause it's all solid gold.
,boom777,2011-09-13T21:31Z,"Hey, HR. Could you advise on my issue commented in your 'Rango' upload?"
,torrentking64,2011-09-13T21:58Z,HR can you do the STAR WARS movies please?
,zqa10,2012-04-14T12:31Z,more people seed please i wanna watch it this year!
,zqa10,2012-04-14T12:58Z,been stuck on 39 % for ages please seed
