Filename,Size,Unit
Take.Me.Home.Tonight.2011.1080p.MKV.AC3.DTS.NL.Subs/Take.Me.Home.Tonight.2011.1080p.MKV.AC3.DTS.NL.Subs.mkv,10.5,G
"DMT NFO, Read before Playing.txt",1.38,K
Take.Me.Home.Tonight.2011.1080p.MKV.AC3.DTS.NL.Subs.nfo,1.2,K
Torrent downloaded from AhaShare.com.txt,58,B
Torrent downloaded from Demonoid.me.txt,46,B
Torrent Downloaded from TorrentState.com.txt,46,B
Torrent_downloaded_from_www.puretorrents.cc.txt,36,B
Torrent downloaded from Rarbg.com.txt,33,B
Torrent downloaded from silvertorrents.me.txt,29,B
