User Type,Username,Date,Text
,saurabhrock,2011-09-09T18:55Z,"kya baat hai sirjee..back with a bang..2 classics in a day..sirjee is garib ka kuch hua kya?
1.GAMAN 2.GHARONDA 3.KALA PANI(1996)
4.CHELUVI(1992)"
,saurabhrock,2011-09-09T18:55Z,another unknown vintage classic..i bow my head sirjee
,Robin5555,2011-09-11T02:55Z,"Again a classic one, thank you SIRJI.."
,Cool.boy07,2011-09-11T14:31Z,Malikjee i have been your fan from the inception of using The Pirate Bay. I would love to wait your uploads on daily basis
,velentine,2011-09-20T15:39Z,"it's a vary rare classic movie this is the movie 
M K RAINA WORK FIRST TIME IN CINEMA
MANY MANY THANKS SIR JI.........................."
