User Type,Username,Date,Text
,wintersbutterfly,2011-02-22T11:21Z,wintersbutterfly wordpress
,sarsapil,2011-02-22T15:22Z,"
Look, mate, since there is nothing you can do, just put on one of your sisters' dresses, lie back, enjoy what you can and think of America... Oh, those two guys in white have just come for your medication and to take you back to Bedlam... to be molested AGAIN, of course... What a life !"
,wintersbutterfly,2011-02-22T15:42Z,"You have nothing better to do?
If your are intimidating that I am crazy.
You are only showing that you are...worse that you are sick.
These things and the people involved are true...but I hesitate to waste my time with some one flaming whose entire intent in posting is to be an asshole."
,wintersbutterfly,2011-02-22T16:02Z,I have realized with the few downloaders that are trying to dl this. It basically just a textfile of the contents posted above. I am seeding at such a slow speed I wanted to let you know. I have been around file sharing since the bulletin board days...I'm that old. I am least trying to do something to stop these people from hurting another kid. If you cannot recognize that...please don't post.
,jOEcOOL0_2,2011-02-22T18:52Z,"Sad Story. My heart goes out to anyone who is a genuine victim of abuse.

I am aware though that false allegations are now widespread and many innocent peoples lives are destroyed by them. 

Would a normal police investigation not uncover the truth here. In cases of allegations of historical abuse, where there is rarely physical evidence, if there are a number of victims then they should be able to corroborate each others testimony. 
Was there ever such an investigation?"
,wintersbutterfly,2011-02-22T21:46Z,"No there has never been an investigation. That is my point. That is why I am here. I have contacted Dept. of Human Services repeatedly, the Tulsa Police Department, and from a refrence from the White House - the Oklahoma State Liason Officer. No one will or has ever responded. And yes these things are verifiable, through other involved. Cousins, nephews, and neighbors. If there had just once been anyone that responded. I contacted Drew Edmonson who at the time was OK AG. His response again was that I had merely used the wrong form (the only one available on the internet). I can not stress enough. I am certain it is because of the eople involved. There is simple no excuse whatsoever in not recieving any concern from agency responsible for the safety of children. Even if what I was saying is strange and hard to believe (and it is) when it involves children you simply do not take that risk. My sisters brother in law was an assistant to AL Gore in the Clinton Administartion and is back in DC under the new Administration. In Tulsa we are facing a barrage of alegation concerning Tulsa Police framing numerous individuals on drug charges...because the officers were involved in drug dealing themselves. There are people being rleased from charges that have over a decade already...wrongfuly. Oklhoma is corrupt Pat's friend David Hall was Oklahoma;s only indicted Governor. I worked for a time on the Obama campaign in Tulsa. I liked him tremendously. I used to believe in his values and what this country stood for. Now I am only confused. I am opening myself up here for retribution. And I am aware of this. I simply have no choice sometimes. I am not the monsters they are.
Thank for your comments. I hope you return to read this. I would never take the chance in indicting someone falsely. I have scars. I my fathers documents on his work history. I know who he hurt and much more...and it is simply that no one..no one...will respond."
,wintersbutterfly,2011-02-22T22:07Z,"And again...more important than ANYTHING. Ted has and STILL works with children. I walked in on my father over twelve years ago as he was molesting my nephew. If the agency that I attend for medical serves would have respond to my CONTINUED reports my nephews would not have been molested. Period. That infuriates me. I know what I have gone through as does my father and despite that he hurt his own grandchildren, knowing the Hell that he put me through. If this were historically retribution I would say hey lets kickback and wait for my Cymbalta and get over this. That isn't the case. I was driven at the time to save Eddie. I couldn't, that feeling drives me to this day for others. I just found Eddie's funeral records that had been altered...two boys with the same names do not die in what was a small town at the same ages excactly ten years apart. The records show Eddie was born in Aug 20th, 1950 and died in Oct 10th, 1964. I know those dates. I was born in 61. Eddie in 60. We were celebrating his birthday in Aug 20th in his brothers room when I was raped. He commited suicide a month later I thought it was nov. 11th in 74. Two children with the same name age and dates of birth and death do not die ten years apart...and I don't believ it was a typo on both dates and simply at this point can not get any more information. "
,wintersbutterfly,2011-02-22T23:14Z,"As an update. I have just recieved an email from one of the government agancies I contacted that  they are looking into this. That is ALL I have ever asked. I have kept relatively quiet for all this time thinking there most be somethig, some reason why no one is even so much respnding. And I just could no longer take that chance. All I have ever asked is for someone to investigate to look into the records of those who have been in Ted's care who are now adults and see if there is any reason for concern. That is all I have EVER asked. EVER. Is a response. You simply do not risk this being true. It never had to become public. It never had to get to this point. EVER.
Thank you TPB. I wasn't sure they'd leave this up. I will always leave this here as long as they do and will continue to seed, but again the contents are pretty much what can be copied from the txt. But I hope it stays in seeds.
I once said that I saw God in Eddie's eyes.
And when my brother brought me to his body...it was too much.
It was like seeing God himself give into the vileness of this world.
Eddie is a very special person. He has existed in me as a very special soul keeping me alive for years. I talk to him through the paino and guitar.
You should know this about him. It tears at me what he went through in those final moments.
Evryone should know he is very special.
And you should know I am aquatinces with the people I have contacted concerning Eddies brother Steven at MHAT I have worked with them as a volunteer on projects for years....some on the BOD, others who are high level program directors. They know me. THEY ARE NOT RESPONDING."
,jOEcOOL0_2,2011-02-24T01:24Z,"Hi Again

good to hear back from ya. Wandered if you have taken professional legal advice on this? if so what was it, and if not why not?"
,wintersbutterfly,2011-02-24T18:31Z,I am having GREAT difficulty getting TPB to respond to my attempts to comment on this POST for some reason. PLEASE check out my blog on worpress ..wintersbuttrfly where the contents of my last attempt to comment which is extremly important to me...I wish I could get it up here.
,wintersbutterfly,2011-02-24T18:55Z,"wintersbutterfly wordpress com

Again, they apparently are not letting me comment with the extent of my text.
PLEASE PLEASE read the first entry on my Blog. 
This is being looked into now by people I trust.
Out respect for my nephews and those involved if possible I would like this Torrent to stop being seeded so that it dies. If you want the contents of the Post it is mostly just what can be copied in the comments.
I am greatly and mostly concerned for the privacy of my nephews and others who have been hurt. Thx."
,wintersbutterfly,2011-03-06T00:11Z,"I have been told that I am no longer allowed to contact any one further about the abuse I suffered. 

I was told to drop it...or else, by someone that visited my apartment a few days ago.

There is no investigation. There never will be one. The people responsible for investigating this, once again are refusing to respond. 

Please understand in my failure to express myself well: when my 10 year old brother ripped my mouth open when I was 7 the result of the injuries also cracked my skull on the left side of my head.

It is simply difficult to express myself.

I wanted to explain. I was told there was an investigation. There wasn't. That evening instead in a visit at my front door...I was told to drop it.

And the persons responsible to investigate this stopped responding.

wintersbutterfly blogspot com"
,wintersbutterfly,2011-03-06T00:56Z,"And Please let me make clear in case I do not have the opportunity later.

I approached the OKlahoma State Liason Officer for DHS in email over 3 months after forwarded her email from WhitHouse staff through chidwelfare.gov.


I sent 4 emails to her. I never received a follow up until the day after I posted this torrent, 3 months later.

I contacted a friend on MHAT who assured me that there was a meeting the following day.

That evenings two officers came to my apartment and told me directly who I was allowed to email and who I wasn't. Limiting my emails to the SLO.

Who during the last week again does not respond. As MHAT also refuses to respond.


None of my emails can be interpreted as threatening or harassing anyone. I simply have been requesting an investigation for over twenty years.

These things are verifiable through neighbors and my cousins.

I have never once received an email from anyone asking me to stop emailing them. Ever.

I am not harassing anyone. I am not a threat to myself or anyone.

If the individuals involved in this want to file a liable suit against me or the sites hosting this information or my Blog, I will much more than welcome the opportunity to have them and my cousins and neighbors testify in court.

And that IS the proper channels for this.

It amazes me that in twenty years of ignoring this that the state cannot respond. But they can respond in one evening by informing me who I am allowed to email.

That IS NOT the proper channels."
,wintersbutterfly,2011-03-07T04:46Z,"Joe...I never got back to your comment.
I have recently attempted in an email to Tulsa University Law Schools attorney advocacy program to get an attorney on this issue.
I also contacted the head of Tulsa Bar Assoc Pres directly with the information I have provided here. The Bar Assoc. helps organize attorneys for people in Tulsa.
No one responds at all.
I contacted NAMI National and Local.
I recontacted Childwelfare.gov.
MHAT.
DHS.
The OK SLO.
And a couple of people on the board of MHAT with still no response after several weeks.
I have not wanted in the past to pursue this personally through an attorney.
I have only tried for twenty years to get DHS to respond.
I have reported these things directly and indirectly through Case Managers and doctors for twenty years.
If at any time I had received a single response in twenty years that my concerns would be investigated I would never have posted here.
Wether you believe I am right or wrong in this information, it can be verified through other people who were abused.
And it at least deserves that investigation.
That IS ALL I have asked for.
I am not trying to embarrass anyone. Simply no one responded until after I posted this.




"
,wintersbutterfly,2011-03-09T01:33Z,"My network is being flooded by requests to my utorrent port.
There is only 1 peer and 3 seeders and yet I am overwhelmed on my network by hundreds of cotact requests per minute. I have bever seeded before and am not aware if this is normal. I have read forums recently that people and organizarion who are unhappy with torrenting have found a awy to use the tracjers to flood seeders using the torrent system itsel. If I am not mistaken this is what I am seeing along with frequent BlueScreens and lose of connectivity in Win 7.
As a result I will stop seeding now."
,wintersbutterfly,2011-03-09T01:36Z,"I hope that this is continued and becoes more public as that is the only solution I see. I have verified information about my father through West Law while working at a University as a Computer Lab Manager.
These things concerned the law student that I was working with at the time.
They are true and in the names and details provided to ALL of the above emails listed they  ARE easily verifiable.
These are not delusions. Than can be proven through testimony of many of my fifty cousins, mey nephews, and the dozen children hurt in my neighborhood. "
,wintersbutterfly,2011-03-09T01:44Z,"I have recenlt provided every detail available but a few unrelated facts concerning my fathjer and his work and friends. I have provided this information in my last attempt to the ACLU local and national.
And currently they have not responded.
They also did not respond five years ago when I contacted them.
This is not what this country is supposed to stand for.
This country is not supposed to protect pedophiles because of their money, their position, their friends, or their secrets.
And yet, the opposite is too often true.
I cannot understand why anyone would fault me in trying to insist that thgese things become public.
To insist that do something not formyself or Eddie, but the kids now these people have access to.
I walked in on my father while he was abusing my 3 year old nephew 15 years ago. During the time I was trying to get someone to respond.
I cannot understand the lack of response.
I have never even been told by one person involved in this that this was being looked or had been looked itno. Or that I was crazy. The state liason officer for oklahoma made none of those statements. She did not ask me not to contat her again. She simply refuses to respond.
And as Iassume it my legal right I can discuss these publicly. And the facts and my email responses verify what I am sayin. Everything is documented. Most of my fathers contracts on CORN, White Sands, Scott Co. Are all documented as is Argent."
,wintersbutterfly,2011-03-09T01:47Z,"And in this I am closing these things. For now at least. I would have liked to have had closure in these things for myself. In that I wanted so very much to believe that this world was not worse than the monsters that rapped us as children.
And in that final realization is so much pain.
In these last comments I am encouraging anyone to make these as public as they can.
So that these words will stay and hold those accountable in History.
I may very well get another visit someday.
But these things are now documented on here and on my Blogspot for history.
I sincerely hope someone continues to maintain this post for me."
,wintersbutterfly,2011-03-09T02:09Z,"And finally I want to be extremely clear.
I contacted the organizitions I contacted out of concern not in an attempt to Bully, liable, or embarrass anyone ever in anyway.
My intent was not to harrass or threaten anyone. EVER.

If these are delusional, being delusional is not a crime.
I have never been a threat to myself or anyone.
My intent has always been to resolve the refusal of the organiztion ignoring these reports.
I went first through Casa Managers and Doctors. Then TPD and DHS. Then the Local News. Then the State AG. Then the Gov. Then the US AG. Then the WhiteHouse staff.
No one but Drew Edmonson responded in a refusal to investifate as did Gov. Henry.
I have Drew Edmonsons letter.
It is my right to email any government organization wether it is the Whitehouse or the state AG. It is my legal right. And those organizations never responded in asking me to stop contacting them. EVER.
And then I posted this and the SLO and MHAT responded. And then the local Police.
I have and would never harm or threaten anyone ever. It isn't in me. If you saw the things I have seen you would understand.
"
,wintersbutterfly,2011-03-09T02:10Z,"Bruce Edward Jacoby is not my neighbor Eddie Jacoby who did die in 1974. He is a relation of Eddie's from BA. I forwarded the info I recieved to the LSO. Eddie did die in 1974. There are no documents available on the internet concerning him or his sister, only Steven.
I have Eddie's 74 year book picture directly from the Junior High School.
And in looking things up Eddie had another relative with the same first family name who died at the age of 27 and lived around the corner about a mile away from us.
If the LSO, the ACLU, and the Obama Administration refuses to address this than there is simple nothing I can do but document into public record.
People should be aware of what happened and what is going on.
And please I am not crazy, my doctors and therapist believ me. That is not my diagnosis my diagnosis stems from severe sexual abuse as a child. My diagnosis contains nothing in regard to Delusinal thinking in anyway.
Thank you. Goodbye."
,wintersbutterfly,2011-03-09T05:48Z,"http://thepiratebay.org/torrent/6229344

Please if you have visit this torrent, it is my piano music. I have no knowledge of ever playing or learning just my father fondling when I was seven and he would teach me Jesus Loves Me."
,wintersbutterfly,2011-03-09T09:09Z,"The link above is useles. Something is blocking me from uploading any of these seeds and has been for days now. I am currently dl another torrent on TPB, as a matter of fact three of them with no problems at all. UL or DL. And yet these torrents will not seed. It has taken in the past 3 hours to seedon simple 23 kb file. My Router is being flooded through my upnp. I am recieving constant blue screens and I was jsut nocked off the net for two hours when my operating system refused to recognize my usb wireless. The other post referenced above has accepted 6 comments where I attempted to redirect anyone to my skydrive where the files are. 3 of the posts on my browser...the ones with the address are not being posted. Even after clearing my web cache and cookies.....so here it is here. maybe?

http://cid-a3969eb374aff071.office.live.com/browse.aspx/.Documents?sa=394321913"
,wintersbutterfly,2011-03-10T10:42Z,http://thepiratebay.org/torrent/6232324/wintersbutterfly__Of_Gorbachev_and_Peter_Max
,wintersbutterfly,2011-03-10T10:44Z,http://thepiratebay.org/torrent/6196691/Pedopiles_in_CIA_Comments
,wintersbutterfly,2011-03-12T03:08Z,"Anyone want the Genie out of the bottle. It is your choice.

I may simply at some point have to decide that everything needs to become public in documentation to get across that these are not simply rantings. If that's why I am getting NO response I am on the verge of resolving that. It is your choice.

I will soon release all documents I have concerning my fathers company and my sisters involvement in Argent.

My sister's brother-in-laws work with Al Gore and the Clintons. Everything.


I will not ever release the full names of victims in this whatsoever.

But if the reason no one is responding is that these are in way unbelievable I am soon going to make very clear the certainty and realty of what I have said about my father and my families involvement with the government and why they are being protected.
And at that point the Geni is not going back.
For either of us. I am starting to have no other option in this.
This is not in anyway a threat to anyone in anyway. I am simply saying I have tried to with hold certain documents and information but I now feel it is necessary to prove that what I am saying is true.
And whatever result may be in it for me, I have already been hurt and hurt more than anyone can ever hurt me again ever, in anyway, ever."
,wintersbutterfly,2011-03-12T03:30Z,"IAL


I have finished preparing a rar document to be tormented her where it will exist in the either between in this sub network on the trackers and can never be removed in anyway ever. 
It contains all of the documents concerning my family that I have made copies of for years upon years now. All of the documents that I have that are apparently necessary to get people who are responsible for protecting children, to understand that this is not made up crap in some lunatics mind.
Borderline by definition is an illness created by severe sexual abuse in early childhood. It does not include mania or delusions. It is a mood disorder similar to Bipolar that can be treated with similar medication. It is similar to Bipolar only in the extent of its symptoms in that it affects mood. It is however caused primarily by the result of early childhood sexual abuse, and is treated mostly by therapy. And Dissociative Identity Disorder, both Compartmentalization and blocking of emotions and detachment are directly associated with PTSD and abuse.
There is no other explanation for the scars I have. None.
And the documents concerning my family in detail will prove the facts I have presented for twenty years, at first in private, and now in public.
If you are wondering what prompted this it is simply one more organizations refusal to even respond. If they want all of the facts to prove this than I am going to release them.
I have the rar file on a thumb drive with a friend who has been asked to upload it here in the future.
"
,wintersbutterfly,2011-03-12T14:00Z,http://thepiratebay.org/torrent/6237530/Wintersbutterfly_Ochelata
,wintersbutterfly,2011-03-12T14:01Z,http://thepiratebay.org/torrent/6237443/Wintersbutterfly_Inland_Analytical_Lab
,wintersbutterfly,2011-03-15T14:00Z,"From my Porn Version:
I am switching to my blogspot wintersbutterfly.
I will also tweet new posts.
TheTwitsEnd

I have had no desire in the past to tweet.
U do not need follow

If interested u may want to scan the other posts

From my Porn Post:
Actually I just wanted an excuse to come in here to see the Porn Ad at the Top.... :)
If I am not mistaken my utorrent shows 385 ratio with a number of megabytes DL.
I really should have posted in here to begin with.
Anyway...thx..alot
And check out a post by clicking above on wintersbuttefly to see the directory of my posts. The new one is Cat's Eye.
It is just of random interest.
It contains references mention about OBrian....
The only thing in her otherwise is Chris Russos comment ot me after Eddie died that his family was in the New Orleans Mafia. They moved right after Eddie died. I have Chris' pictures through out my year books. He is real. And he didn't say hey I think I'm related to the guy in Jim Garrisons prosecution in New Orleans of Clay Shaw.
He said the New Orleans Mafia. I thought he was full crap at the time. I had never heard of it myself til many years later.
And Compare the name in my dad's work journal among other entries I posted that listed a Tom Rasso or Russo as a contact back in 64..."
,wintersbutterfly,2011-03-16T00:07Z,"It has now been over two weeks since the OK SLO's and a member on the board of MHAT responded in emails stating their desire to investigate these reports I have made. That afternoon instead two officers came to my apartment and informed me that I was no longer to email anyone but the OK SLO - who of course did not respond for three months after receiving her email from Childwelfare.gov, who is now also refusing to respond again.
I originally sent the OK SLO for DHS 4 emails in December detailing the extent of what was involved. For three months, until I posted these torrents she never responded further after requesting the information from me.
2 weeks since the officers responded, she again refuses to acknowledge this in email. She has not responded to my two or three emails since the officers came out. I have not emailed her in week.
There is no email concerning an investigation or a refusal to investigate. None. And neither has MHAT responded in any form. Not email or letter.
And Saturday I sent a 3rd email to ChildWelfare.gov asking who I could send email to when State Authorities refuse to respond. ChildWelfare.gov has not responded.

"
,wintersbutterfly,2011-03-16T00:09Z,No one has asked me to stop posting or seeding here or anything at all. They simply will not acknowledge these reports at all. All the way from the State to the Federal Level. Even the Obama Administration through White House staff have been informed of what is happening. No one will respond in anyway.
,wintersbutterfly,2011-03-16T00:14Z,"I have now seeded over four hundred downloads of one of the major posts cantaining at least most of the information and comments in these posts. I am receiving about 30 visits a day on my Blog.
I know have Graig list account which required 7 days of waiting to be able to Post.
I will now on Craig s List forums internationally in their Political Forums to increase the traffic here.
I feel it has become to document this publicly in the governments refusal at this point not only to fail to investigate but they will not in anyway respond. Except with Police Officers."
,wintersbutterfly,2011-03-16T00:34Z,"The State Level ACLU did not repsond in anyway. I did not recive a denial from them or anything. Not this time and not five years ago in my last attempt.
An update to my last email to ACLU who will not respond:


Now then as I brought forward in a second email: When these are finally investigated whether tomorrow or years from now, and they will be in the continue presence of these posts. Will it show if your agency or any of these agencies I have reported this to filled these reports with the Government or DHS as required by law."
