User Type,Username,Date,Text
,wintersbutterfly,2011-03-16T00:41Z,"An further an open response to the ACLU, again inconsideration of your resources and the limited size of the ACLU and its apparent priority's...I did not ask to sue anyone...to prosecute anyone...or investigate...I simply asked you to use your influence to get DHS or anyone in the government to investigate these reports which among other issues involve the work of a man with the Tulsa Police Dept as juvenile counselor.

And I would assume that would be within your limited realm of ability. And also I would have thought the protection of children in care by someone who works for the State who the State refuses to investigate would concern you.

Abd I hope it does someday in these posts when it becomes a concern of others...that the State level did not respond. The didnt say it sounded crazy so there was no need for them to report the concerns as again..is required by law. Not just the ones you chose to believe. It is required by law. 
"
,wintersbutterfly,2011-03-16T00:43Z,"I am beginning to think the title of this post is more accurate then I had once felt. I did not want to sound like a conspiracy nut.
Now I am thinking in everyone's refusal to ignore this by refusing to respond,
This may be more accurate than I realized at first."
,wintersbutterfly,2011-03-16T06:46Z,"I am on my way to bed now at a decent hour.
I only want to make one point I feel necessary. The OK SLO last email to  me acknowledged what I reported as ""horrific"" in her own words. She did not question what happened. She then asked me what I wanted in resolution. It threw me then and now. That is not a question for me. She is the SLO for DHS and as I stated in my return to her and want to make public here. I have never wanted to expose anyone in this ever. Or embarrass anyone in this ever. Or prosecute anyone in this ever. Or sue anyone in this ever.
My concern has been and will always be with the my nephews and other who were hurt. Period. It would have been nice if this would have been addressed in private for the privacy. It was not. And that is not my fault. I followed proper channels for twenty years until it became unbearable and clear no one would do anything. Ever.
I have made this public, not to be a jerk or get even o anything in anyway like that. I made that clear to her in my email. I did not make this public until it absolutely clear that it needed to be. Goodnight.
It is apparent to me nothing ever will be done. They have had every opportunity to respond. They never will. I hope these words document this in history."
,wintersbutterfly,2011-03-16T07:23Z," Why didn't they help Eddie the day his parents moved away, why did no one who new help? Why not?
These people had access to people in the government they could have stopped this for him and for me. Why not?
And why not know. My family destroyed my childhood and fifty years of my life with thirty five years spent in a dissociative Hell and they left me to suffer as they left Eddie to suffer.
But it is not in the reality of seeing Eddie that destroys me now, a reality that was so very severe that I couldn't deal with it. That every thing became unreal for thirty five years.
It is having to live in a world that is now in actuality unreal, that I cannot comprehend and cannot accept ever.
And I am left with going on. I delivered my self from those monster who hurt me then and resided in me for so very long."
,wintersbutterfly,2011-03-16T07:24Z,"And I no longer have any desire to hurt myself.
And yet I am left with existing, with being warehoused in an existence that is intolerable and always will be.
No one has ever come to me in twenty years and said, this is not what happened ever. Not once in twenty years has anyone ever explained that if my version of what happened is wrong, than why is Eddie dead? Where did these scars come from? Why does Cindy have that look in her eye? Why did my brother tell me what he did to her? Why does Rick have so many problems, Brian, Doug C. who died so long ago also, and the boy down the street now a man who is now Schizophrenic. Even my parents neighbor asked me in the front yard what happened in this neighborhood to hurt so many kids?
No one has ever offered any explanation to so many questions ever. They just do not respond. When your father's Executive Secretary asks your father why her 5 year old boy would ask her why people stick penises in their mouths. In the silence of all these response, I just have to assume the very worst, just because of the silence.
I have realized finally at fifty in some comfort. It was not God that hurt me which Ted wanted me so much to believe then and now. It is just people. Certain people and I have to hold onto those who are downloading here and that these words hold Eddie and I here forever. in this world.
I have thirty years now if they leave me alone. If they could not care about Eddie. I am sure they do not care about me though either."
,wintersbutterfly,2011-03-18T11:18Z,"Thank you again for supporting these. Believe it or not at least for now I have run out of things to say for awhile. Actually I am exhausted after trying for close to fifty years to get someone to listen. Now someone is listening, finally, even if those responsible do nothing, they will all be remembered for their parts in what they have done in this, forever. These words will never go away, ever, as will the memories of their actions.
I had to recuperate the last few days. I am bringing one of my computers back cause I can't afford it anymore. So I have been working on that today. Thx again in the people who I do not in keeping these up heer. Thx"
,wintersbutterfly,2011-03-19T05:15Z,Im so poor I just had to borrow a stamp :)
,wintersbutterfly,2011-03-20T23:26Z,So much for Craig's List Forums....there advice in their responses was that I take my friend's example...and kill myself...outstandingly nice people there. And as I have said if MHAT and DHS would do their job...I would not be forced to have to present this in this Venue.
,wintersbutterfly,2011-03-21T06:56Z,"As I have said...my sisters husband has now been reported to the IRS for forging my sisters signature to his income tax forms for over 20 years, my question she is and has been aware of that for 20 years and was considering using that knowledge as a bargaining chip in their upcoming divorce, and again my question is, he has broken the law in this, has she? "
,wintersbutterfly,2011-03-21T23:10Z,"It amazes me...on my Blog I have had 0ver 250 views. My Blog is not exactly light reading. And not to insult anyone who has visited or seeded these. Among 250 readers how does it not tear them apart in all this, as does me everyday, and always will. In an email I did just receive from on organization, their response was that it was outside their realm an that their 3 week pause before responding was understandable considering the volume of mail they receive. My question to myself, and only to myself because it is beyond their realm, considering the predicament of clients that do reach out to them...don't they consider a 3 week turnaround a little odd in that in 3 weeks, they just might not have a client to respond to. And it is outside their realm, it is also outside mine. did they offer any alternatives or forward it on to any organization at all, or report is as required by Law. No they just seemed concerned in defending their inaction."
,wintersbutterfly,2011-03-21T23:16Z,"So anyway, these are apparently dieing now, so be it. We are each of us an island. But in the certainty of my Bible Belt Area I hope they understand with clarity that God is watching and what is not addressed in this life will be addressed in the next. And in this, they should know as well as I , God will not turn away from this as they have. And if all the words on these torrents and such cannot dissuade the government representatives in this...then their really is nothing in this world but hypocrisy and lies. Goodbye the."
,wintersbutterfly,2011-03-21T23:29Z,"And as an after thought I must in actuality be crazy. I must. Cause I thought that someone somewhere somehow would feel the responsibility to do something.What I have presented here in the details...is accurate...what is crazy is to think it would change anything...And in that each I go one realizing not just the monster that raped me so brtutally, but the ones who are in charge of stopping this for others and wont. I do not know how anyone can go on each day knowing...it is pointless....why bring a child into this world...why have a career or anything. Seriously why go to Chrch or anything at all if this world can be so vile to protect pedophiles in the people that are supposed to protect. I go on everyday and will for years having reason in why I do it stripped from me by these monster. My family took my past, DHS and so many others have taken my future and left me in a hell worse than living with my family, because I have to live with people that don't care. And that hurts. And I cannot why it does not hurt others. I have nothing to lose in this, and if I don't than in reality neither does anyone, if the world is this bad, and these scrawling of mine here are a testament to that fact."
,wintersbutterfly,2011-03-21T23:37Z,"So I will crawl back under my rock and mind my place....and these will disappears someday. And twenty two thirty years from now when God gives me the Grace to escape this Hell. We will see what he has to say to this then.  
I am closing my account. This world is beyond me, I have my few friends and in that I leave the rest of u to deal with what this world truly is, not just for me, but I am trying in that last post to be specific, if this can happen to me...they can and will do it to whoever they chose....The news that is reported is a testament to that as well. This IS NOT just my situation, it should concern others, and they lack ...Goodbye then. It is just beyond me now."
,wintersbutterfly,2011-03-23T09:44Z,I am concentrating on uploading my piano music...I see people always in here attempting to dl....If you'd.. like the music is not bad...and for me it verifies what I have said. For 50 years none of my friends or even I - knew I could play like this til it came back last year in a rush of memories after one of my nephews was being hurt...again. Sometime I hte what I play and yet it is more than just plunking down chords...And yet I have no idea...even the chords I am choosing...no idea what I am playing in the chord structures at all.
,wintersbutterfly,2011-03-24T03:06Z,"This is Bullshit absolute Bullshit and it needs to stop. This is illegal. But WTF is also illegal for the government to protect Pedophiles. I am not going away as long as u fuc with me.


[DoS Attack: RST Scan] from source: 82.170.247.244, port 19712, Wednesday, March 23,2011 15:36:49
[DoS Attack: FIN Scan] from source: 187.3.114.87, port 18207, Wednesday, March 23,2011 15:36:12
[DoS Attack: FIN Scan] from source: 187.3.114.87, port 18206, Wednesday, March 23,2011 15:36:10
[DoS Attack: FIN Scan] from source: 187.3.114.87, port 18205, Wednesday, March 23,2011 15:35:52
[DoS Attack: FIN Scan] from source: 187.3.114.87, port 18201, Wednesday, March 23,2011 15:35:51
[DoS Attack: RST Scan] from source: 71.67.112.142, port 61470, Wednesday, March 23,2011 15:35:24
[DoS Attack: RST Scan] from source: 68.197.165.224, port 50877, Wednesday, March 23,2011 15:34:48
[DoS Attack: RST Scan] from source: 93.45.224.52, port 51971, Wednesday, March 23,2011 15:30:08
[DoS Attack: RST Scan] from source: 71.67.112.142, port 59710, Wednesday, March 23,2011 15:29:25
[DoS Attack: RST Scan] from source: 68.197.165.224, port 50776, Wednesday, March 23,2011 15:28:48
[DoS Attack: RST Scan] from source: 93.45.224.52, port 51665, Wednesday, March 23,2011 15:25:28
[DoS Attack: RST Scan] from source: 77.251.184.229, port 55060, Wednesday, March 23,2011 15:25:27
[DoS Attack: RST Scan] from source: 68.197.165.224, port 50541, Wednesday, March 23,2011 15:25:16"
,wintersbutterfly,2011-03-24T06:20Z,"I am attempting to seed these but as I have stated I am being knocked off constantly. And I am now tired of them focusing on me than doing something about this. I have posted my family's in Twitter with detailed information
TheTwitsEnd.
They need to stop this. I am not showing as seeding cause I am constantly losing connection. If they have a problem with this take me to court where Steven and Ted and so many others can testify. It is illegal to attack my network continuously. It is illegal, bu then again so is protecting pedophiles. And that doesn't seem to bother them."
,wintersbutterfly,2011-03-24T06:21Z,"To the Tulsa World:
And I am sure you will continue to not respond. And my question in the future someday when this IS addressed by someone that  does have to be listened to, have you personally fulfilled your legal requirements in this in forwarding these concerns to the State Government. 
These posts will never go away, ever they cannot be removed now, at what point will you acknowledge this, twenty more years down the line when your culpability is clearly evident, or now after only twenty years in which you have allowed my father time to molest my nephew who is now on an antipsychotic. I do not mind you questioning these things. But you do not have the legal right to dismiss them. Someday the Tulsa World will be held as liable in this as DHS is now in its failures.
And it will be evident in its continued failure to so much to as even respond. You are the representatives of the people as much as the state, and you have a responsibility in these things. 
Putting pressure on me to shut up by sending the police to my door as was done, and your failure to investigate this, is not the solution.
I am fifty years old I have in my records never once in fifty years needed the police to come to my door, and it is an insult. I deal with the symptoms of what was done to me. To us my illness as a leverage to suggest what would happen if I didnĂ˘âŹâ˘t drop this is criminal, and so is your failure to respond.
The police are representatives of the court. They are not the court. And they cannot come to my door and tell me who I can discuss this with.
Which is meaningless, because you simply will not respond. But again these words will never disappear and in someone someday you as DHS is now - will be required to answer your failure to respond.
In twenty years DHS cannot respond to my concerns in any form, even in denial. But they send the police in one day.
What exactly do you represent then, if not hypocrisy."
,wintersbutterfly,2011-03-29T07:21Z,"I am being forced of the network by constant DOS ATTACKS. The latest are from:
[DoS Attack: ACK Scan] from source: 205.128.92.126, port 80, Monday, March 28,2011 15:12:35
[DoS Attack: ACK Scan] from source: 8.26.206.126, port 80, Monday, March 28,2011 15:12:24
[DoS Attack: ACK Scan] from source: 206.33.36.126, port 80, Monday, March 28,2011 15:12:21
[DoS Attack: ACK Scan] from source: 8.26.206.126, port 80, Monday, March 28,2011 15:12:21 


Level 3 Network. I have been knocked of the net for over 6 hours today.

I cannot leave my ip visible anymore in seeding.

I wrote Micheal Mosre. Hotmail delayed the email fro 3 days and after 3 days reported my email undeliverable. I messaged on his wall...to no reply. Have fun y'all. I will keep posting on my Blog and puting music up there. But onlt there."
,wintersbutterfly,2011-03-29T07:23Z,"I am being forced of the network by constant 

Level 3 Network. I have been knocked of the net for over 6 hours today.

I cannot leave my ip visible anymore in seeding.

I wrote Micheal Mosre. Hotmail delayed the email fro 3 days and after 3 days reported my email undeliverable. I messaged on his wall...to no reply. Have fun y'all. I will keep posting on my Blog and puting music up there. But onlt there."
,wintersbutterfly,2011-03-30T09:48Z,"8.26.221.126

This is on the Network Level 3.
I do not think this is and ad stream from TPB.
It has been showing up for about 2 months in DOS Attacks in my router.
And just now as I visited TPB....my firewall reported a Port attack from them'
I have reported this in email to Level 3 ...three times now...and the do not stopping this IP on thier network from attacking me."
,wintersbutterfly,2011-03-31T02:01Z,"These are recently seeded by just 1 person now, thank you very much in that. I have posted my blogspot Blog Wintersbutterfly, everywhere. My tag wintersbutterfly links to all these things. And yet my Blog shows no visitors but two simultaneous response after I twitter an article and that is all and Blogger does not refresh the URL list from 2 weeks ago to show whee they are coming from"
,wintersbutterfly,2011-03-31T02:01Z,Lvel 3 has responded now and said they would investigate the source of the DOS attacks
,wintersbutterfly,2011-03-31T02:05Z,"I recently wrote email to Micheal Moore after writing a blog on Fahrenheit in which I explained his reference to Ray Bradbury's book - and the temperature at what books burn - Freedom of the Press.
After 5 days of Hotmail reporting nothing more than they emails were continuously ""delayed"" they have just now been returned as undeliverable. He has not responded to my Post on his Facebook. Or my submission through his web page."
,wintersbutterfly,2011-03-31T02:06Z,Even the new Church which I requested a ride to Church never responded. I am not sure if this is the actions of the Tulsa Police dept.s CyberCrime Unit..or what. But the TPD has come to my door and told me to drop this and not contact anyone.
,wintersbutterfly,2011-03-31T02:07Z,"As Janis and Kris once said...
Freedom is just another word...for nothing left to lose."
,wintersbutterfly,2011-03-31T02:11Z,"I have created a new email on Hush.com titled wintersbutterfly.
I at one time had 400 dl's on one of these torrents. Any one is welcome to contact me by email at hush. Please be kind."
,wintersbutterfly,2011-03-31T02:12Z,??????
,wintersbutterfly,2011-03-31T05:09Z,I ca not at this point to get TOR to load. It just does not progress. upnp is set...nothing is blocking it on my net....
,wintersbutterfly,2011-03-31T05:10Z,"I remember the old distinction, crazy people don't think they are crazy. I no longer think I am crazy in these things. My father was good Fred D Wampnar was close friends with Sen. Scoop Jackson from Washington State who served on the Defense Board in the Senate. Jackson was to attend Gov. Hall's birthday party in 74 but called my dad from St. Louis to inform him of the Saturday Night Massacre by Bork and Nixon, It was Oct 20, 1974.
We attended the Convention on June 5,1968 and I met Bobby the day before through Senator Jackson. I was 7. I was close to the kitchen to know that a write, Plimpton was there, and either Plimpton or Rosie placed something beneath Bobby's head. And that a man's hand was injured by forcing his thumb between the hammer of the gun. And that they were screaming to Break his thumb.
I know a lot of things, including my neighbor Chris Russo who afte my closest friend Eddie Jacoby committed suicide in 1974 from the sexual abuse we were suffering, before Chris's family got them the hell out of that neighborhood, Chris told me his father's family was involved in the New Orlean's Mafia. I thought he was full of shit. I never heard of it at the time. Chris did not say that he was related to the Russo in the then Garrison case of Clay Shaw, he said New Orleans Mafia."
,wintersbutterfly,2011-03-31T05:11Z,"I know more much much more. I can get in touch with you. My Hotmail failed after 4 days in limbo to email Mike@MichaelMoore.com.
My Blog reports only a handful of 2 immediate responses to any tweet I do on TheTwitsEnd. And I have links everywhere. I am receiving very little traffic that contain no referencing links. And my torrents on TPB that I have resorted to to find a decentralized server...show no only 1 seeder.
I can not seed. If I try Level 3 Network and other sources show DOS ATTACKS which knock me constantly off the net.
I once thought these were crazy things. They are. I once thought that made me crazy. It doesn't Please respond to my new hush email account. The Blogs and torrents are disjointed and go off on tangents.
My brother cracked my skull open when I was just 7 and it is very difficult to write. And Eddie's 19 year old brothers fingernail tracts are still into my scrotum and anus which was tore open in 74 and repaired in a neighbors house who was a doctor. I have been through Hell, no ever could fully ever comprehend, ever.
Please at least respond so that I know you may have received this. I have begun to realize the ONLY response I am getting in emails are through web form submissions away from Hotmail Thank you."
,wintersbutterfly,2011-03-31T05:16Z,Than I guess I resort again torrent trackers on TPB now and others. These things are true in the silence of response. I hope now they chose and chose to respond correctly.
