User Type,Username,Date,Text
,kamposhd,2011-03-10T00:44Z,"Marsh the 10th 00:43 Swedish time, Taking a Break for a couple of hours. seeding should be back up at around 10 o'clock at latest! most likley be4 that, "
,kamposhd,2011-03-10T09:10Z,seeding back up and running
,kamposhd,2011-03-14T11:29Z,"okay i see someone is at 85.4 % done with the file now, hope you seed, "
,MOVNGFWD,2011-06-01T10:46Z,"just a head's up: tried to download the .torrent file, but for whatever reason not linked properly... I'm guessing a TPB problem.  Magnet failed as well.  :(  "
,kamposhd,2011-06-16T15:57Z,"Yea some problem with TPB regarding the .Torrent download. tho ""MAGNET LINK"" should work great"
,AlKoOnT,2011-06-22T13:31Z,"hey.. i'm trying to download this torrent. but it seems that there is a problem.

I tried magnet link, opened in utorrent then the speed reached 100 KB/s then stopped.

1 of 4 connected seeds..

any ideas ?"
,king-samwise,2011-10-13T12:29Z,"wow, respect for seeding this "
