User Type,Username,Date,Text
,M0SHP1T,2011-06-13T19:10Z,"All Lesbians And Gays Should be Shot!!!

There a Decline on the world! 

And one of the reasons for Anal Inflicted Diseases(AIDS)!!!

Bi Chicks are fine tho, There Not Men Haters they just like Having fun with a man and woman at the same time.  And if your a male and don't enjoy 2 chicks then your a faggot go die."
,Redirect,2011-07-04T00:42Z,"Wow ! You're back Bachelorboy! (and you invited some crazy skinhead on your torrent!)

What's up with you ? Tell me what happened to your account by email if you want!

And sadly, I have absolutely no any idea who made this ""song"". Maybe you could tell us how you got it in the first place ?"
