User Type,Username,Date,Text
,critic89,2011-08-06T14:47Z,"@sunDox

MANN PLZZ REPLY ABOUT PRISON BREAK SEASON 3 AND 4 ???

WAITING IT FROM UR SIDE"
[H],sundox,2011-08-06T14:55Z,"@critic89
Starting on it now, will have it done in some hours. :)"
,rakiem,2011-08-06T15:14Z,"+1

plz sundox...many ppl r waiting for prison break s03 n s04 in small size...plz reply..:)

thanks for white collar"
[H],sundox,2011-08-06T15:42Z,"@rakiem
Will have all seasons uploaded in 1-2 hours, Size = 100-150MB/ep MKV :)"
,rakiem,2011-08-06T15:56Z,"+1 again

super!! !bro..ur gr8..thank u so much..:):)"
,l214l,2011-08-06T17:04Z,"Hello sunDox, if most shows are over a gig in size, is there any difference b/w your 720p shows and other 720p bigger file size shows on this site?  I watch the shows I download using a WD Live, so should I be able to see your shows through that device?  "
,dkhere,2011-08-06T18:36Z,Can you upload the compressed version of Dollhouse and Robinhood???
,dkhere,2011-08-06T18:36Z,Both tv shows???
,dkhere,2011-08-06T18:44Z,"You can upload BoB's version of Dollhouse season 1 and 2...
The thing is i can't download the files from the premium sites... :("
,khateer,2011-08-07T13:17Z,thnx a ton for all the episodes of White Collar.. :)
,KingsHuskerss,2011-08-12T19:01Z,thnx a ton for all the homos of White Collar.. :) 
,myzzbrat,2011-08-17T05:01Z,"sunDox - could you by chance do the seasons for ""Sons of Anarchy""?"
,down11loader,2011-10-21T04:45Z,"a/v 10.
hope u cud have 720p vampire diaries season episodes..thanks a lot.."
,32bithit,2012-01-30T10:30Z,"is there a reason why you didn't put these in one file? not that big of an issue, saves on dl times

thanks for the torrent +1"
,brianbernardo,2012-03-25T11:41Z,hey...thanks for the torrent but i was wondering....where are the episodes 10 to 16???
