User Type,Username,Date,Text
[V],malikjee4,2011-01-29T14:46Z,"Next Movie--------

Sparsh 1980.
shah g, shabana g, om puri
thanks "
,saurabhrock,2011-01-30T04:53Z,really rocking bro..grt classics.
,jasnagra,2012-04-04T16:17Z,dont download this only 10 min clip this is not complete movie
,jasnagra,2012-04-05T14:38Z,malikji this is only 10 min clip y this is happening plz tell me if you know something
,jasnagra,2012-04-06T17:18Z,no i am sorry its full movie & nice print also thank u malik sahab n once again sorry
,pinutu,2012-05-01T05:35Z,nice man.seeders are very less.slow download.its really a nice movie one.thanks.will definitely seed after download.
