User Type,Username,Date,Text
,Latin91,2011-02-27T05:47Z,Can you load Spanish audio and English Subs? Please
,Ichthus,2011-02-28T22:10Z,"Zowel DVDShrink als Nero weigeren om de DVD te branden omdat er klaarblijkelijk een error in de VTS-bestanden en/of DVD-structuur zit (is dit wellicht omdat het bestand VTS_01_0.VOB ontbreekt?). Dit is nog niet eerder gebeurd, enig idee hoe dit op te lossen??
Alvast dank voor je reactie."
,pet30,2011-03-01T19:44Z,"V=10, A=10

Only problem is the same as above. I cannot burn the movie because there seems to be an error at the end of the movie. I hope you folks will try again ? Thanks for making it possible. Your work is much appreciated."
,edveld,2011-03-08T19:57Z,"Geeft inderdaad een fout bij het branden. 
Jammer want kijk hem normaal via de dvd speler op de tv , maar kwaliteit is prima op de computer.
Thx "
