User Type,Username,Date,Text
,Delsher,2011-10-12T11:55Z,"Hello DownTYU can you please upload the blu-ray editon of Halloween 1 & 2 in 1080p?

http://www.imdb.com/title/tt0373883/

http://www.imdb.com/title/tt1311067/"
,gbussh01,2011-10-12T16:13Z,Tq for the 1080p version. 
,sgleder,2011-10-12T22:44Z,"Request: Max.Payne.UNRATED.720p.BluRay.x264-SEPTiC

Thanks! :)"
,inkyon,2011-10-13T02:36Z,request: There's first season out. 720p or 1080p for Twilight Zone series season 2 to 5. Nobody around has it.
,Ponyoo,2011-10-13T07:17Z,"What a bunch of mother fucker losers keep asking ""requests"" than saying  ""Thank you""   Fuck off.

@DownTYU  God bless you, man.  You rock! 
"
,bodgg77,2011-10-13T11:04Z,"Hey Poonyoo you fucking scabby cunt, why the hostility?
living up to the stereotype of the nasty pirate bay arrogance i see
You Fuck Off you piece of fucking excrement, let people ask for requests, whats so bad about that you cunt?
they arent asking for child porn just a blu ray of halloween you mental cocksucking hostile dick FUCK THE FUCK OFF AND CUNTS LIKE YOU"
[V],GoodFilms,2011-10-14T02:07Z,"I recommend not uploading Being John Malkovich just yet, as Criterion are releasing it in a few months, and the quality will be much better."
,Ponyoo,2011-10-14T10:57Z,"@bodgg77
I see....your mother is already fucked by retarded fat blob like you, and that's why you keep talking about yourself  AHAHAHAHA  MOTHER FUCKER!!  "
,SergeantSpoon,2011-10-14T22:09Z,"Dear god, I wish there was a report comment option. 
Don't mind the kiddies on this page. "
,voltaire64,2011-10-15T04:48Z,English subs with this?
,bodgg77,2011-10-15T19:03Z,"by the sounds of it you are one of those nutty yanks ponyoo you fucking scabby cocksucking maggot mutha fucker
either that or a 14 year old little turd over here masquerading as a pseudo yankee ass licking dick sucker
if people ask for requests heres some advice, keep your dirty maggot cunt mouth zipped you fat lump of shit 
"
,strangerbarry,2011-10-15T20:10Z,No kidding about the report comment option - anyone who would post comments like that on the Internet should have their account suspended
,Ponyoo,2011-10-17T06:42Z,@bodgg77 proved my view.   His mother is fucked by blobs and can't stop talking about your life:being a mother fucker cunt!  LOOOOOL    
,fredfan,2011-10-17T15:27Z,Any chance of a DVD-R version of this?  Any programs I have for conversion simply downmix sound to 2-channel/stereo. :(
,q8almutairi,2011-10-20T23:53Z,"Ponyoo and bodgg77 you really make me laughing and forget why i am her looooool
i find ponyoo right about requests this is not the place to put you requests , why you don't send to him and email or msg"
,iCORM,2011-10-22T14:20Z,You fucking imbecile faggots!! Did anyone notice its got 2 channel stereo audio instead of 5.1 DTS?
,Darkseid_BR,2011-12-26T20:46Z,"Great!!!!!

A/V: 10
M:8"
