User Type,Username,Date,Text
,AlyH,2011-10-12T16:34Z,THANK YOU!!!!!
,otterlad,2011-10-13T01:34Z,do you have ep 3..... i cant find it anywhere.... :o)  oh and thank you so much for this one.. :o)
,otterlad,2011-10-13T01:39Z,i found ep 3 .... sorry... and thanks again.. :o)
,dmster,2011-10-13T18:03Z,"If you have a prob with other torrents for episode 3, just ask me and I'll see if I can rip one for you guys here."
,AlyH,2011-10-18T07:57Z,"Can we get 5 up I know it is just played tonight, but you seem to be able to get them up before the others, so why wait right?

It would be greatly appreciated!!!"
,AlyH,2011-10-18T08:09Z,"Hm my reply didn't go let me try again.

Anyway you can do the last episode? 5 I think.. you seem to get them out faster then the others anyway, and the vids are great!

Thanks!!"
,AlyH,2011-10-18T08:10Z,"LOL Sorry for double comment - for some reason it didn't refresh properly, my bad!!"
,Dakota85,2011-10-18T13:15Z,"Thanks dmster - AlyH is right, you've done an amazing job! I still can't understand why nobody uploads the show yet they can upload some absolutely random, barely popular shows its not fair :( lol. Do you have Episode 5 at all? You're a legend! Thanks from a Singoff fan in Oz :)"
