User Type,Username,Date,Text
,f_stopblues,2011-03-13T20:50Z,If you download do everyone a favor and please seed for awhile thanks
,zapeterset,2011-08-07T23:12Z,"this is the real deal if you are looking for the 1998 white and black version like I did. 

Good video quality for a CD worth of bytes"
,yobar23,2011-08-21T19:14Z,"Thanks for the upload of this hard-to-find film!

Go raibh mĂ­le maith agat!!"
,LeBieque,2012-03-03T11:59Z,thanks for the rip; and all for seeding. How else do you get movies for the fastidious buff.
