User Type,Username,Date,Text
,bloodydemons,2011-10-17T13:28Z,does this include the live preshow that was on at 7:30 it was supposed to feature mexican america defending the tag titles against ink inc?
,diddle76,2011-10-17T15:42Z,you guys need to start seedin so slow
,banh_cam,2011-10-17T19:02Z,A YO FAGGOT ASS MOTHERFUCKER SCENE4ALL thanks for hookin this shit up for FREE i apperciate it....but your FAGGOT ASS will always be a FAGGOT little CUNT in my book....U FEEL ME.....LOL
[T],Coolguy33,2011-10-17T22:18Z,Wow...awesome quality dude and @60fps aswell. Fucking awesome! :)
,Dedward76,2011-10-18T04:10Z,"Thanks again...Seeded this one a few times, that will speed it up a little. 
RUDOS KING OF PPV...LONG LIVE THE KING!"
,wooboo,2011-10-18T18:00Z,"why make it 60 fps , can not convert it to dvd."
,Heather4201976,2011-10-20T22:03Z,i need a avi file of this can someone help me out? Please!!!
,mrukid,2011-10-27T13:14Z,i get tracker not registered with this torrent
