User Type,Username,Date,Text
,With_Blood_Skies,2011-01-08T04:45Z,"Lol geez, what system is it implemented on?"
,noblers,2011-01-18T23:38Z,will this work on r4 card and is it in english? 
,sexy13beast,2011-03-04T22:54Z,"v5, sounds like Japanese, but I'll test it out and comment after! Good luck, let's hope this is the UK version that released today!"
,jer0123,2011-03-11T18:27Z,what is the id 
,skidmarkstain,2011-03-18T19:43Z,before i download itdoes it actually work
,skidmarkstain,2011-03-18T19:46Z,does this games actually work 
,skidmarkstain,2011-03-18T19:51Z,"will this work
and hope it aint in japanese"
