User Type,Username,Date,Text
,h3ll4b0y,2011-01-23T17:20Z,no jtag my ass
,M4JOR,2011-01-24T20:08Z,"You don't need jtag for XBLA .. You need the profile that owns the DLC, player 1 signs in on the profile then starts game and player 2 signs in on whatever profile and enjoy."
,moh27,2011-03-07T02:54Z,cant download no input file :S
,sam609,2011-06-08T20:00Z,"Does it work ???
anybody ??!"
,remark.able,2011-08-24T17:03Z,"And the profile you need can be downloaded and you can be really really sure that its been blocked!
Anyone thinking this will work now, is just not verry smart..

THIS DOES NOT WORK ANYMORE NORE WILL IT EVER AGAIN!"
,remark.able,2011-08-31T14:46Z,"Oh and DeadManToker,

Remove this file! cuz it makes you look like one of Sony's minions. I bet a lot of people tried this and they are all flagged now, thanx DeadManToker. After that they will all be banned, thanx DeadManToker.  The profile was blocked a long time ago and anyone using it gets flagged.."
