User Type,Username,Date,Text
,ZeTomes,2011-05-16T19:31Z,"It was recorded from a portuguese tv channel (RTP2) and it has portuguese subtitles incorporated.

my net is very slow so you have to be a little patient, but it will worth the time. Continue seeding to increase the download ratio. Thank you. "
,ZeTomes,2011-06-16T17:27Z,I cannot afford to keep the movie on hard disk. Continue seeding. Thanks
,sunshinefiasco,2011-07-17T12:01Z,"other seeders, please seed!"
[V],sidbizkit,2012-01-27T11:09Z,please seed.. just started downloading
