User Type,Username,Date,Text
[V],mkvGOD,2011-04-24T08:53Z,"Follow me on Facebook for updates, requests, and comments

Search ""mkvGOD Torrents"" in Facebook"
,ankit280,2011-04-25T16:52Z,"One of the the best TV shows ever
Thanks +1
I'm sure quality is good just like your other torrents"
,shreeshm,2011-06-25T14:17Z,really bad video quality...mkvgod uploads are usually good but this one isn't!!
,lovefromIndia,2011-08-04T10:27Z,"Thanks, Quality is good
But there are no seeders, please seed guys"
,dope1212,2012-02-17T17:20Z,"dont bother trying to download this, torrent is pretty much dead. almost no seeders. f*** leechers"
