User Type,Username,Date,Text
,DSIN,2010-12-09T15:32Z,"sick movie ...
ty for the up :D"
,superdupercool11,2010-12-09T15:46Z,"sounds really cool, thanks :)"
,himansu_007,2010-12-09T17:07Z,"Thanks a million time 4 this up...
Cool movie..
 1"
[V],twentyforty,2010-12-09T17:10Z,"Thanks. Good one, strange but on a good way."
,madtown4,2010-12-09T18:26Z,i never heard of this movie....cant wait to watch it.thank you my friend...
,tylr,2010-12-09T19:51Z,"guess ill' see how this goes..
(Katie : best 1/4)

tHanks, wud this movie be similar to vantage point??"
[T],satos7889,2010-12-10T06:40Z,thanks bro.. :)
,DMVIN,2010-12-10T09:53Z,"Hi 20-40. Thanks for everything since I last thanked u :)

SOme time ago, you had uploaded BBC's ancient rome first episode. Is it possible to do the rest as well?"
,fossil44,2011-01-16T04:17Z,twentyforty thanks for all your ups great quality
