User Type,Username,Date,Text
,djmikeyc,2011-02-20T09:44Z,Downloaded it and it's real!
,djmikeyc,2011-02-20T09:44Z,It's Real
,dontjudgeme09,2011-02-20T15:07Z,"Is this legit guys?

I'm downloading it now anyways, I shall repost to let you all know!"
,begeezus,2011-02-21T07:13Z,its the episode after sammi leaves its legit
,glued2it,2011-02-25T18:14Z,It's legit
,bigbenwallace90,2011-03-06T20:08Z,is it legit? well just scroll back up to the top of the page youll see that little purple skull. anyways thanks
