User Type,Username,Date,Text
,Belsebub_666,2011-04-20T16:36Z,"En liten fråga bara. 

Är det bara jag som har problem med 39 st filer som ej går att spela upp ???"
,Belsebub_666,2011-04-20T16:39Z,"Glöm det. Funka efter en liten konventering.

Tack för uppladdningen"
,eksiaksi,2011-04-21T13:34Z,1gb.så stupidt
,Ronneholm,2011-04-22T12:53Z,Belsebub: Vad var det för liten konvertering du gjorde?
,Ronneholm,2011-04-22T19:10Z,"Äh, boken är paj. Ladda inte ner."
,Hampa_D,2011-04-25T09:53Z,"jag får nog hålla med om att den är lite trasig hackar till här och där, synd för den verkar riktigt bra"
