User Type,Username,Date,Text
,hempsader,2011-07-15T08:20Z,pls try to upload that games : Breath of Death VII and Cthulhu Saves the World 
,1TWISTED,2011-07-15T13:27Z,"thanks,.. nice upload,... well done,.. ; )"
,jomini,2011-07-15T16:46Z,i downloaded it works and i never seed in your face people who take weeks to download hahahaha i never sow seeds lololololooolololololol 
,Cerebral222,2011-07-16T14:38Z,"Game works perfectly, I mapped the keys to my gamepad using Xpadder & just kicked back, game play is good, thanx rjaa."
,Despodemonia,2011-07-16T23:16Z,"AVG flags the exe as virus ""WIN32/HEUR"""
