User Type,Username,Date,Text
,press2010,2011-07-08T23:25Z,Thanks for continuing to post. Do you have any new Queensnake upcoming?
[V],merzedes,2011-07-08T23:28Z,"""press2010""  I have coming later  :-) Cheerz"
,mefehc,2011-07-09T00:30Z,Thanks again for the femdom Merzedes
,philsfan5,2011-07-09T01:52Z,Thanks man!!!
,huvudverk,2011-07-09T15:10Z,"Love the femdom, nothing better than a black woman with a strapon giving it to her bitch boy! :D"
,ArtNinja,2011-08-30T03:10Z,Thank you so much merzedes! I am a dominant woman that LOVES dominant women! 
