Filename,Size,Unit
Espèce de Bonobo/01 Bonobo.mp3,3.6,M
Espèce de Bonobo/02 Le Mal des Soupirs.mp3,3.58,M
Espèce de Bonobo/03 Espèce de Fiancée.mp3,3.62,M
Espèce de Bonobo/04 Quéquette Blues.mp3,2.87,M
Espèce de Bonobo/05 L' Image de Toi.mp3,3.15,M
"Espèce de Bonobo/06 J'Éponge, Donc J'Essuie.mp3",1.12,M
Espèce de Bonobo/07 Bagatelle Time.mp3,3.45,M
Espèce de Bonobo/08 Le Bandit de Vos Nuits.mp3,3.53,M
Espèce de Bonobo/09 Les Nazes.mp3,3.29,M
Espèce de Bonobo/10 Le Blues des Rimes en 'Ouze'.mp3,3.05,M
Espèce de Bonobo/11 Belle des Champs - Le Retour.mp3,2.78,M
Espèce de Bonobo/12 Lunatique.mp3,3.52,M
Espèce de Bonobo/13 La Faute aux Filles.mp3,3.73,M
Espèce de Bonobo/14 Le Rock N' Roll de l'Existence.mp3,3.57,M
