Filename,Size,Unit
COVERS/FRONT.png,337.39,K
COVERS/BACK.png,302.28,K
Good Rocking Tonight/04 I Want My Fanny Brown.mp3,2.85,M
Good Rocking Tonight/14 Mr. Blues Is Coming to Town.mp3,2.75,M
Good Rocking Tonight/20 Keep on Churnin' (Till the Butter Comes).mp3,2.68,M
Good Rocking Tonight/18 Luscious Woman.mp3,2.62,M
Good Rocking Tonight/06 Lollipop Mama.mp3,2.58,M
Good Rocking Tonight/12 I Feel That Old Age Coming On.mp3,2.57,M
"Good Rocking Tonight/07 Baby, Shame on You.mp3",2.56,M
Good Rocking Tonight/01 Good Rockin' Tonight.mp3,2.54,M
Good Rocking Tonight/08 I Won't Like My Baby's Pudding.mp3,2.51,M
Good Rocking Tonight/03 Blow Your Brains Out.mp3,2.49,M
Good Rocking Tonight/11 Good Morning Judge.mp3,2.48,M
Good Rocking Tonight/17 Bloodshot Eyes.mp3,2.47,M
Good Rocking Tonight/16 Rock Mr. Blues.mp3,2.45,M
Good Rocking Tonight/09 Wynonie's Boogie.mp3,2.42,M
Good Rocking Tonight/10 Sittin' on It All the Time.mp3,2.41,M
Good Rocking Tonight/02 She Just Won't Sell No More.mp3,2.36,M
Good Rocking Tonight/05 All She Wants to Do Is Rock.mp3,2.33,M
Good Rocking Tonight/19 Down Boy Down.mp3,2.32,M
Good Rocking Tonight/15 Quiet Whiskey.mp3,2.26,M
Good Rocking Tonight/13 Lovin' Machine.mp3,2.25,M
