Filename,Size,Unit
CD1/01. The Christmas Song (Merry Christmas To You).mp3,4.84,M
CD1/02. White Christmas.mp3,2.98,M
CD1/03. Blue Christmas.mp3,2.36,M
CD1/04. Have Yourself A Merry Little Christmas.mp3,5.41,M
CD1/05. Winter Wonderland.mp3,4.01,M
CD1/06. Sleigh Ride.mp3,5.14,M
CD1/07. Let It Snow! Let It Snow! Let It Snow!.mp3,3.12,M
CD1/08. (There's No Place Like) Home For The Holidays.mp3,3.04,M
CD1/09. The Most Wonderful Time Of The Year.mp3,5.3,M
CD1/10. A Holly Jolly Christmas.mp3,4.33,M
"CD1/11. Rudolph, The Red-Nosed Reindeer.mp3",3.4,M
CD1/12. Grandma Got Run Over By A Reindeer.mp3,6.16,M
CD1/13. Rockin' Around The Christmas Tree.mp3,3.48,M
CD1/14. Jingle Bell Rock.mp3,3.83,M
CD1/15. Little Saint Nick.mp3,4.45,M
CD1/16. Merry Christmas Darling.mp3,4.84,M
CD1/17. Christmas Collage.mp3,5.22,M
CD1/18. Little Drummer Boy - Peace On Ear.mp3,3.34,M
CD2/01. Happy Xmas (War Is Over).mp3,6.62,M
CD2/02. Santa Claus Is Coming To Town.mp3,9.24,M
CD2/03. Do They Know It's Christmas.mp3,7.66,M
CD2/04. A Wonderful Christmas Time.mp3,7.22,M
CD2/05. Our Love Is Like A Holiday.mp3,6.05,M
CD2/06. (It Must Have Been Ol') Santa Claus.mp3,7.33,M
CD2/07. Jingle Bells.mp3,3.42,M
CD2/08. Away In A Manger.mp3,5.44,M
CD2/09. Deck The Halls.mp3,5.62,M
CD2/10. Love On Layaway.mp3,8.18,M
CD2/11. Don't Save It All For Christmas Day.mp3,8.6,M
CD2/12. This Christmas.mp3,5.76,M
CD2/13. Special Gift.mp3,7.1,M
CD2/14. All We Need Is Love (Christmas In The Yard).mp3,6.96,M
CD2/15. My Only Wish (This Year).mp3,7.74,M
CD2/16. You Don't Have To Be Alone (On Christmas).mp3,7.81,M
CD2/17. O Come All Ye Faithful.mp3,6.97,M
CD2/18. Silent Night.mp3,4.33,M
