Filename,Size,Unit
bluff city/01 my love is a monster.mp3,4.71,M
bluff city/02 x-ray eyes.mp3,4.3,M
bluff city/03 mystery girl.mp3,5.01,M
bluff city/04 pepper spray boogie.mp3,3.58,M
bluff city/05 i call you mine.mp3,5.88,M
bluff city/06 one-eyed girl.mp3,6.5,M
bluff city/07 i don't wanna laugh at you.mp3,6.43,M
bluff city/08 new romance.mp3,4.07,M
bluff city/09 you don't want me.mp3,6.3,M
bluff city/10 don't come looking for me now.mp3,5.23,M
bluff city/11 trouble.mp3,5.22,M
bluff city/12 don't haunt me.mp3,5.7,M
compulsive gamblers - outtakes/01 colt .45 (outtake).mp3,4.37,M
compulsive gamblers - outtakes/02 cage dancer (outtake).mp3,7.62,M
compulsive gamblers - outtakes/03 dirty mouth (outtake).mp3,6.53,M
"compulsive gamblers - outtakes/04 baby, gotta love you (outtake).mp3",7.47,M
crystal gazing luck amazing/03 Whole Lotta Woman.mp3,7.53,M
crystal gazing luck amazing/08 Your Happiness.mp3,5.82,M
crystal gazing luck amazing/the compulsive gamblers - i'm that guy.mp3,2.73,M
crystal gazing luck amazing/the compulsive gamblers - negative jerk.mp3,2.07,M
crystal gazing luck amazing/the compulsive gamblers - pepper spray boogie.mp3,2.2,M
crystal gazing luck amazing/the compulsive gamblers - rock & roll nurse.mp3,3.83,M
crystal gazing luck amazing/the compulsive gamblers - stop & think it over.mp3,3.05,M
crystal gazing luck amazing/the compulsive gamblers - the way i feel about you.mp3,2.29,M
crystal gazing luck amazing/the compulsive gamblers - two thieves.mp3,5.09,M
"crystal gazing luck amazing/the compulsive gamblers - wait a bit, joe.mp3",2.74,M
gambling days are over/01 telstar.m4a,4.51,M
gambling days are over/02 bad taste.m4a,6.65,M
gambling days are over/03 way down in the hole.m4a,5.68,M
gambling days are over/04 dead waltz.m4a,5.33,M
gambling days are over/05 sour and vicious man.m4a,4.45,M
gambling days are over/06 two wrongs don't make a right.m4a,5.7,M
gambling days are over/07 walking the balustrade.m4a,5.06,M
gambling days are over/08 scaring myself.m4a,5.72,M
gambling days are over/09 capone's finest.m4a,4.67,M
gambling days are over/10 they'll name a drink after you.m4a,6.78,M
gambling days are over/11 quit this town.m4a,10.61,M
gambling days are over/12 they call me names.m4a,6.41,M
gambling days are over/13 phoney lesbians.m4a,4.39,M
gambling days are over/14 gamblin' days are over.m4a,6.45,M
gambling days are over/15 i see you everywhere.m4a,7.8,M
gambling days are over/16 handful of burning sand.m4a,5.29,M
gambling days are over/17 devil in my back pocket.m4a,4.45,M
gambling days are over/18 feel good music.m4a,7.84,M
gambling days are over/19 good time.m4a,5.34,M
gambling days are over/20 my mind is in the gutter.m4a,6.2,M
live & deadly in memphis & chicago/01 bad taste.m4a,3.27,M
live & deadly in memphis & chicago/02 your happiness.m4a,2.21,M
live & deadly in memphis & chicago/03 way down in the hole.m4a,2.86,M
live & deadly in memphis & chicago/04 i'm that guy.m4a,2.88,M
live & deadly in memphis & chicago/05 don't come looking for me now.m4a,3.8,M
live & deadly in memphis & chicago/06 new romance.m4a,2.87,M
live & deadly in memphis & chicago/07 mind in the gutter.m4a,4.85,M
live & deadly in memphis & chicago/08 sour and vicious man.m4a,2.94,M
live & deadly in memphis & chicago/09 stop and think it over.m4a,3.14,M
live & deadly in memphis & chicago/10 two wrongs don't make a right.m4a,3.03,M
live & deadly in memphis & chicago/11 wait a bit joe.m4a,2.61,M
live & deadly in memphis & chicago/12 i don't want to laugh at you.m4a,3.13,M
live & deadly in memphis & chicago/13 name a drink after you.m4a,3.53,M
live & deadly in memphis & chicago/14 two thieves.m4a,5.41,M
live & deadly in memphis & chicago/15 pepper spray boogie.m4a,2.2,M
live & deadly in memphis & chicago/16 quit this town.m4a,6.94,M
