Filename,Size,Unit
Clone High 1x08 Raisin the Stakes; A Rock Opera in Three Acts.mp4,35.55,M
Clone High 1x07 Plane Crazy; Gate Expectations.mp4,32.64,M
Clone High 1x13 Changes; The Big Prom; The Sex Romp; The Season Finale.mp4,31.87,M
"Clone High 1x12 Makeover, Makeover, Makeover; The Makeover Episode.mp4",31.17,M
Clone High 1x09 A Room of One's Clone; The Pie of the Storm.mp4,30.88,M
Clone High 1x10 Litter Kills; Litterally.mp4,30.75,M
Clone High 1x06 Homecoming; A Shot in D'Arc.mp4,30.22,M
Clone High 1x03 A.D.D.; The Last 'D' is for Disorder.mp4,30.11,M
Clone High 1x02 Episode Two; Election Blu-Galoo.mp4,29.06,M
Clone High 1x04 Film Fest; Tears of a Clone.mp4,28.85,M
Clone High 1x11 Snowflake Day; A Very Special Holiday Episode.mp4,28.66,M
Clone High 1x05 Sleep of Faith; La Rue D'Awakening.mp4,27.98,M
Clone High 1x01 Escape to Beer Mountain; A Rope of Sand.mp4,27.87,M
