Filename,Size,Unit
AMAZING BIBLE FACTS!- PART II Something NEW for everyone here!.flv,29.42,M
The Story of Jesus - Dutch.avi,654.04,M
The Story of Jesus for Children - English - Dutch Subtitled.avi,615.45,M
Torrent downloaded from Ahashare.com.txt,47,B
Torrent downloaded from Conspiracyhub.com Demonoid.com - Ahashare.com - Conspiracyhub.com (2).txt,47,B
Torrent downloaded from Conspiracyhub.com.txt,47,B
Torrent downloaded from Demonoid.com.txt,47,B
WHAT IS IN A NAME - REALLY  - Barack Hussein Obama.flv,20,M
