User Type,Username,Date,Text
,GaryOakar,2011-01-17T03:37Z,"Because TPB blocks links for some reason. You can find the DDLs at rs.4chan.org. Just search ""Gary Oak"" and you should see them."
,GaryOakar,2011-01-18T08:03Z,"@Zakimar: Pictures. That's what the label says bro.

Oh, and a single .txt file. But you already read all the contents if you read the description. "
,ekarth22,2011-01-18T08:20Z,"i love pokemon porn but i donot like gay porn.

thanks Gary."
,GaryOakar,2011-01-19T00:18Z,"No problem.

v1.9 might see the addition of a gay section of the Archive. However sorting might be slightly different, as Kris will be doing the sorting."
,GaryOakar,2011-01-19T00:19Z,"Please note, it'll be in a separate torrent/DDL, so don't worry about seeing Lucario cocks all over the place.."
,GaryOakar,2011-02-18T04:09Z,"v1.9 soon going to be released.

All remaining leechers, finish up, I'll stop seeding once I send out v1.9 to pre-seeders.

See you on Wednesday! (Hopefully)"
,GaryOakar,2011-02-26T00:18Z,"v1.8 is no longer supported. You can find v1.9 here.

http://thepiratebay.org/torrent/6202722/Pokeporn_v1.9_-_Gary_Oak__ArcHIvEpAQ"
