Filename,Size,Unit
Matrix USSA with Jay (Thurs 18th Aug 2011).mp3,14.5,M
Globalism - The Full Spectrum with Travinyle1 (Sun Aug 14th 2011).mp3,14.11,M
The Social Dumpster Show with Skwint (Wed 17th Aug 2011) [Music Show].mp3,13.82,M
Wideshut Webcast with Keelan Balderson (Mon 15th Aug 2011).mp3,13.81,M
Reality Check with Bluebus67 (Mon 15th Aug 2011).mp3,13.79,M
ALLXCAST'S MINDWARS with Adonis King (Wed 17th Aug 2011).mp3,13.78,M
The ABC Show (Sat 13th Aug 2011).mp3,13.75,M
Radio Resistance with RWB (Fri 19th Aug 2011) [Music Show].mp3,13.73,M
The MistrBrit Show - BBC 911 Road Trip with Emily Church (Fri 19th Aug 2011).mp3,13.72,M
The Zak Locke Show (Tue 16th Aug 2011).mp3,13.68,M
The Eyevolution Continues - Lee Woudberg (Sun 14th Aug 2011).mp3,13.32,M
Resistance Radio.doc,30,K
