User Type,Username,Date,Text
,shub007,2011-10-29T05:35Z,cn u upload the kung fu panda 2 in 720p or in hindi
,rik9831,2011-11-11T19:59Z,hindi audio is taken from original?
,abdullshaikh1,2011-11-22T19:48Z,seeds please
,abdullshaikh1,2011-11-23T17:33Z,seed seeeds seeds plz plz i am getting very low speed plz seed
,DiabLeNo1,2011-12-02T04:25Z,PLEASE SEED SEED SEED
,dangerkid,2011-12-10T17:07Z,charXi... bhai kya hai?? seed to kar loo kaminay!!.... speed he nae dai rha hai...wtf!!..
,dadafarooq,2012-02-27T12:01Z,"yar fellowship of the king to nae chal rahi!.. us ka folder empty dekha rha hai yar!..
kya karo?"
