User Type,Username,Date,Text
,Jack0ff,2011-10-30T19:39Z,"warning, virus! do no download. says trojan in the name! besides if you watch this youre probably sooo old you have worse than a virus and almost dead anyway :)"
,mulface,2011-10-31T09:15Z,No one listen to this dick head Jackoff. As usual a perfect download. eztv and fqm get it right.
,Woogy,2011-10-31T10:20Z,LOL @ jackoff not with. A most appropriate name. 
,bodierock,2011-10-31T11:56Z,thats quite funny actually
,Lviv,2011-10-31T17:27Z,"jackoff thought he was in the porn section thinking he was downloading something to jerkoff.
as always, eztv has the best"
