User Type,Username,Date,Text
,zaiko2000,2011-04-26T17:38Z,"thnx a lot!

Is it possible to replace the cs5 by this cs5.5 and leave the rest unchanged ? "
,zaiko2000,2011-04-27T17:31Z,"thethingy thnx again !
Can I install dreamweaver cs5.5 and leave all the rest cs5 ? Or do i have to uninstall verything ?"
,.glum,2011-04-28T10:12Z,"Norton Internet Security has detected ""WS.Reputation.1"", is it still safe to install?"
[V],thethingy,2011-04-28T10:23Z,".glum, in what?, stop telling lies. "
,.glum,2011-04-28T10:43Z,"i found out that its not a virus, norton just quarantined it because there a fewer than 50 users in the Norton Community have used this file. anyway, i've already install it dude! really thanks!:D sorry 'bout that.
10/10!"
,tre.fire,2011-04-28T16:57Z,"thethingy, thank you for all your work. no doubt you have answered this before, but which UL has the instructions for this torrent (eg how to stop DW from checking the validity of the serial number every time), the patch, or serials. That probably comes off stupid, but I don't know it before I know it...as it were...Thanks again. "
[V],thethingy,2011-04-28T18:03Z,"tre.fire, this does, the exe file is a self extracting rar file. "
,tre.fire,2011-04-28T20:02Z,Groovy. Thanks again.
,xnzxassassinx,2011-04-29T10:12Z,I wish I could say how much I love you thethingy :)
,JackOhBoii,2011-04-29T21:01Z,"hey thingy, how do i stop dreamweaver saying that my trial is up? cuz now i cant use it :("
,JackOhBoii,2011-04-29T21:03Z,"sorry i meant to commetn on the cs5 version, if i donwoad this will it stop coming up as my trial has ended? im kinda new to torrent donloaded"
,zaiko2000,2011-04-30T17:57Z,@dwserials get off  this torrent you idiot !
,verodinges,2011-05-02T15:31Z,"I think I am blonde. I must have done something wrong or just do not get it....

I installed it all but he is asking for the code, where can I find that?

Can someone help me?

gr Veronique"
[V],thethingy,2011-05-05T13:39Z,^^I know something you dont. 
,verodinges,2011-05-07T22:47Z,"Well I am confused now... you know something I don't know... can you tell me what and help me?

please?
"
,verodinges,2011-05-07T22:48Z,"ok I am confused now. You know something I don't know but can you tell me what?

please?"
,advanzd,2011-05-09T13:44Z,Dude I love ur torrents! They all work just perfect! 12/10!
,plaximize,2011-05-10T09:41Z,"hey mr. thethingy! just like to ask if you have a plan to upload premium versions [design premium/web premium/...] ?

there are alot of torrents out there but i prefer yours. :D

tnx."
,atikrj,2011-05-11T22:06Z,"""thethingy"" is the best.......................

i love all of your works.........................

You got(10/10) every time.................

thx for all gr8 uploads........."
,Stereo9,2011-05-12T00:46Z,"great torret,

Thanks!"
,angie010,2011-05-12T11:18Z,"Hi
read all these messages but how do you stop the trial message coming up or is it meaningless"
,heckco,2011-05-12T20:18Z,Do i need a serial number for application
,Ianp,2011-05-13T01:33Z,Does this work with 64bit Win 7?
,jargoneer,2011-05-14T17:49Z,I 
,jargoneer,2011-05-14T17:52Z,Love the torrents and I love you.
,ingramtor,2011-05-22T12:26Z,REAL fast download onya mate
,ingramtor,2011-05-22T12:27Z,Great torrent
,OokamiShikonGirl,2011-06-05T01:21Z,"I'm kinda new at all this stuff, so I hope you can help me out. What do I do about the serial number thing?"
,OokamiShikonGirl,2011-06-05T01:23Z,"discard my last comment, i figured it out"
,ajtongurizi,2011-06-06T17:59Z,thanks works fine no problems i will seed thanks again
,Mathijs13,2011-06-06T18:46Z,"can you give me a serial, i have a very limit internet, and i have donwload DW in a other languan, i want only the serial please"
,johnregalado,2011-06-11T11:32Z,"The thingy, I really need Avida Xpress Pro... please upload ot. and pleas email me. johneboy_13@yahoo.com
thank you so much... hope you can help me.."
,Somaliland4Eva,2011-06-12T20:36Z,Great torrent! keep working thethingy.
,GigerDali,2011-06-16T10:54Z,"Hey Thank You 'TheThingy', this was my first EVER torrent and it worked PERFECTLY. The DLL and Hosts File instructions were so easy to understand and follow,  even for me as not a particularly bright novice(!) and it made my first Torrent experience a dream rather than a nightmare! Thank you so much again."
,suicide1202,2011-06-18T04:13Z,my pc picks up the issue of the dll file not being the same version and does not like it :/ have you got the new dll version (4.0.0.21)?
,rmaxsg,2011-06-18T21:15Z,"Dose anyone know where can i download Adobe dreamweaver cs5.5 for MAC version?  

-Can this application runs on windows on MAC like (Parallels)??

Thank you for any help>  "
,boardinggamer,2011-06-22T11:50Z,Works perfectly thank you very much for this!
,Enousc,2011-06-23T12:35Z,"This is overall a great torrent!

Downloaded extremely fast.
Installation was easy (with instructions).
Works like a charm.

10 out of 10.

Another great torrent from thethingy. 
Thanks! :-)"
,VirtualVE,2011-06-24T04:44Z,"Another AWESOME torrent!! THANK YOU, THINGY!!! xo"
,kvakaNA,2011-06-24T12:33Z,"thenks thenks. my inglish is bead. sory.
thenks very very much
very fast, very easy. very good works.
thenks for oll torent. evry torent from you is very good. thenks you
i love you"
,Djebsmallz,2011-06-27T19:11Z,"Hi all,

The download is superb! Any one know if I can patch a dutch language?

Thanks for the seeders and upper, much respect!"
,frod7600,2011-06-29T05:26Z,I really do need your help on this one. I've been able to install the illustrator and fireworks but this one is a bit trickier for me. I am lost when it comes to the DLL folder and what I'm suppose to do. I opened up the dreamweaver folder in programs/adobe but I don't know what to do after that. Could you please help me. My email address is currency2001@hotmail.com. Thank Thethingy
,samscmnt,2011-06-30T06:20Z,"Working like wow. Thingy, you are the best."
,samscmnt,2011-06-30T06:27Z,"@frod7600
It's not so difficult. Just copy the amtlib.dll from DLL FILE\32bit\ and replace one you have in your program folder (eg. Program Files\Adobe\Adobe Dreamweaver CS5.5). That's it.
P.S. Hope you've changed your host file as instructed."
,looloo1,2011-06-30T10:49Z,"You are like Picaso, only I jizz to your works of art! Keep up the good work ;)"
,fzmch,2011-07-02T18:21Z,I am little confused with DLL file there is two which one I should copy and paste I am running on windows 7 64bit
,wittos,2011-07-04T16:49Z,"Thanks, but my system restarts when I run it after installation.

DLL file has been replaced. 
I'm not connected using a proxy. 
Installation directory is C:\Program Files\Adobe\Adobe Dreamweaver CS5.5

Any clue? Guide me pls...."
,Plan9x128,2011-07-04T16:51Z,"Anyone have the latest Embrace, tam/CORE keygen for Adobe CS 5.1 or above products?"
,H4C3R,2011-07-07T02:30Z,great torrent
,fatrb38,2011-07-08T03:50Z,"Hey guys, I am installing this on my work laptop *but* my company has a way of remotely checking my computer to see if I have Adobe products installed on my laptop.  Is there a way of blocking this remote access/checking to my computer?

Any help would be appreciated.  I think I will eventually buy Dreamweaver but I gotta save some money first."
,thegodofthunder,2011-07-08T11:10Z,loving the torrent so far! can you update it though? 
,thegodofthunder,2011-07-08T11:11Z,can you update safely?
,ace3740,2011-07-09T06:26Z,Awsome torrent!!! Can you please confirm if it can be updated safely?? Thx thethingy!!!!
,lepra,2011-07-11T14:35Z,"you dont update pirate copies...
Stupiest Question ever ..."
,GlttrCnt,2011-07-11T14:39Z,"Thanks for the great torrent, I was confused on how to install for a second but I figured it out with the help of a friend who is more experienced in torrenting than I am. Nothing popped up on my virus scan and the program is working beautifully. Thanks again."
,WellBeSerious12,2011-07-13T01:11Z,"WORKS PERFECTLY!!!

Thank you!!!"
,the_one_one,2011-07-13T21:03Z,Thethingy = The Best of Both Worlds!
,delacruzb,2011-07-14T21:47Z,"Hi, the download worked and everything works perfectly. but i am new to all this so I don't know what to do when it says:

5) Copy the file 'amtlib.dll' into the install directory overwriting the exsisting file...
   (You will have to do this multiple times for each installed program in a suite)

every time i open dreamweaver it tells me that i used an invalid code and put in another the generator created and it works fine. but how can i make it so that i only have to use 1 code instead of having to put in a different code every single time i want to use dreamweaver?
pls get back to me anyone "
,woneo,2011-07-17T01:35Z,"Thanks very much. Very fast torrent, took a minute and half between 4mb/s and 9mb/s :D"
,kvakaNA,2011-07-19T00:47Z,thenks. is very good torrent
,adismas,2011-07-20T17:33Z,"I followed the instructions verbatim a la replacing the hosts file offline, flushing the DNS resolver cache, and replacing all instances of amtlib.dll in the trial install. This is pretty straightforward and I think a lot of people are probably familiar with this approach. I then booted up Wireshark to see if Dreamweaver would make any noise when starting and sure enough it still is able to contact Adobe and transmit some application data despite the measures provided. I used my firewall to block any remaining outbound connections not simply from the program itself but from my computer but it's still not entirely stopping it. I've seen it connect to 192.150.8.200, 192.150.16.60, 192.152.16.200, all Adobe. Not sure how to resolve this. Any suggestions?"
,bikerdaveb,2011-07-22T15:35Z,well probably going to make myself sound an idiot now but i have this installed on 32bit at moment but going to be changing to 64bit in next few days but i noticed there aint no dll file for 64 bit so how do i go about installing this on 64bit
,ultraG,2011-07-23T22:04Z,Awesome!  Thank you so much for this!  Everything worked perfectly.
,DumindaChamara,2011-07-24T12:11Z,This is a clean and very good torrent. Thanks for sharing!!!
,bikerdaveb,2011-07-27T19:55Z,ignore my last comment im an idiot not realising 32bit programs go into a seperate folder on 64bit windows
,jalukasim,2011-07-29T14:44Z,great download as usual from thethingy just one question does anybody have the HTML5 add on pack  for this program?
,Lyndger33,2011-07-31T18:01Z,Nikel !!! Merci thethingy.
,nicolaz_cano,2011-08-01T01:27Z,"Excelentes tus aportes, te comento en este espacio porque he descargado otros de tus productos y estan muy bien elaborados, se agradece !!!!!!!!!"
,vulcan_27,2011-08-02T17:42Z,"Dear Sir Thingy,

You are now knighted, and no longer need to refer to yourself as 'the'
'In the golden days of the internet Sir Thingy worked tirelessly to help the appreciative and the unappreciative, with little more than a thanks...' "
,jokers999,2011-08-06T09:38Z,Its 32bit only :/
,Quentin360SA,2011-08-16T23:13Z,"As usual, It works perfectly."
,Steerage,2011-08-18T04:49Z,I have DW 5.0. What if I install 5.5? Must I uninstall 5.0 first? Inc. extension manager and Extended Script Toolkit?
,gifventje,2011-08-19T01:29Z,"hej what DLL file should i copy  to replace, the 32bit or the original - 32bit ??????????? answer please!!!"
,Chessji,2011-08-19T03:13Z,"Thanks thethingy! I download before I made this account and had to come back and post a comment. I love all your torrents plus they are super easy to install. I did not have a problem install Dreamweaver CS5.5!

Regarding upgrading this torrent, and other Adobe CS5 torrents from thethingy, I updated them and everything still works fine."
,the_one_one,2011-08-20T21:45Z,Updated today and seems to be okay.
,utak123,2011-08-24T16:46Z,"anyone please help me, i've got a problem.. when I open the dreamweaver my PC is restarting... Help help..."
,amansomani,2011-08-27T12:42Z,Hell! My computer's getting restarted when I open Dreamweaver even though I followed your instructions carefully while installing. Please help!
,cmass,2011-08-28T10:40Z,cannot locate key gen in extracted files please advise?
,vuca89,2011-08-31T10:08Z,"1019 seeders,
fantastic,
very big download...
thank thethingy...~"
,Meteo80,2011-09-03T14:30Z,I followed your instructions and it says that it's still a trial -_-
,tijs14tijs,2011-09-04T01:30Z,You are awesome :D
,puffyellis,2011-09-04T15:06Z,hi there I try installing mine after downloading it keeps telling my trial version expires please render some help
,puffyellis,2011-09-05T02:53Z,i need help installing adobe dreamweaver
,g0d11c3,2011-09-15T23:59Z,Dude! This is the fastest download speed ever! 2.2 MB/s. Keep seeding guys!
,slthill12,2011-09-16T01:00Z,PLEASE UPLOAD The Foundry Nuke 6
,thePenahi,2011-09-17T11:34Z,"@thethingy
Why in this torrent doesn't have the full version installation choice that u give a serialnumbers and host files in the instructions txt file? I just can't foud them in the internet.."
,mrstef513,2011-09-20T13:18Z,Great download.  Clean and works great!  Thank you.
,nui2yx498j2i,2011-09-22T01:50Z,"This works fine. If you don't want to mess around with shitty DLL files then I'll give you some codes to use: (These all work with v11.5x)

1192-1440-1846-4034-6866-6805
1192-1573-2705-3152-0310-0977
1192-1726-5372-7034-8943-1212
1192-1709-8638-5286-9235-6274
1192-1615-0564-3518-2313-3427
1192-1908-9030-5005-0126-4752
1192-1898-4331-5452-4873-1442
1192-1851-3706-3672-4455-4221
1192-1952-2735-5666-7964-4342
1192-1489-0036-8985-5936-4689

You're welcome."
,nui2yx498j2i,2011-09-22T01:51Z,"This works fine. If you don't want to mess around with shitty DLL files then I'll give you some codes to use: (These all work with v11.5x)

0000-0000-0000-0000-6866-6805
0000-0000-0000-0000-0310-0977
0000-0000-0000-0000-8943-1212
0000-0000-0000-0000-9235-6274
0000-0000-0000-0000-2313-3427
0000-0000-0000-0000-0126-4752
0000-0000-0000-0000-4873-1442
0000-0000-0000-0000-4455-4221
0000-0000-0000-0000-7964-4342
0000-0000-0000-0000-5936-4689

You're welcome."
,adisyam,2011-09-25T10:58Z,Thanks thethingy for ur great works...
,pirateeverythingusee,2011-09-25T15:04Z,Works perfect. You r my HERO.
,arunace,2011-09-26T12:56Z,"followed the exact steps... experiencing the same problem wen i try to start dreamweaver computer gives me a blue screen (crashes) & then automatically restarts :( :( 

what do i do now to fix this...or is there something i forgot to do other than the instruction steps ?"
,dilinwe,2011-10-04T18:34Z,"8.5 mbs/s!!!!!! This is fucking insane!!!
Download in less than 1 minute!!!"
,CandyLips,2011-10-04T21:27Z,Thank you so much! You are the best!
,rollock123,2011-10-09T17:13Z,"Just want to say, your torrents are amazing, super easy to install, No shitty cracks that the majority of time don't work that well, no stupid files that you have to change....it's just there and it works. 

Thanks to the thingy for all of his hard work! "
,zavir,2011-10-10T20:09Z,"I downloaded 7 different torrents for Adobe Dreamweaver CS5, but none of them worked. some has trojan in their keygen and other's amtlib.dll wasnt working but ur torrent is the only one which is working. it is clean, norton didnt detect any viruses. thnx alot :) "
,aeristilheartly,2011-10-21T05:47Z,"You sir help me have a job online, if it wasn't for you I'd never have the tools I need to make my web designs, illustrations and animations.  You are the best, thank you so much for taking the time to upload these for those of us who can't afford to spend the $500 to $1000 for these programs :)"
,JohnJo,2011-10-22T10:50Z,Thanks. It works perfectly.
,dommels,2011-10-24T18:21Z,"+1 working, dunno for how long but is working now !"
,krispykim,2011-10-25T07:09Z,"My pc keeps on restarting whenever I try to launch it :( Sorry, im a newb in these things. Can someone pls help me?

I'm running win xp sp2, 3.2GB ram, 1Gb video card. Thanks in advance!"
,ksm933,2011-10-29T03:36Z,"Serial 1192-1440-1846-4034-6866-6805 works, thanks thethingy you are the best"
,Steerage,2011-11-03T09:41Z,Hi my dreamweaver CS5.5 has some lines missing. Can I just install it again over the top or must I uninstallit first. I seem to have trouble doing both of those.
,LvMary,2011-11-08T04:38Z,"Thanks thethingy for the upload, and thanks ksm933 for the serial. Seems to work great so far."
,LvMary,2011-11-08T07:26Z,"
I take back that comment, the serial is not working for me. It works better the way thethingy said to do it."
,sin30,2011-11-14T11:42Z,activation blocker for cs4 works.....
,Xarathos,2011-11-16T04:35Z,"Following the instructions every thing works except Adobe Device Central.  I get a message that reads ""The Adobe product that installed Adobe Device Central has not been activated.  Please launch and activate that Adobe product..."".  Any ideas?"
,dadarkdragon,2011-11-16T14:06Z,"Dear Noobies,

Please respect reliable sharing by not exposing serials. If the codes are exposed in comments, they get blocked very quickly. Then you're stuck with yet another software.

¬_¬""

Think again next time you take time to comment."
,pexxoo,2011-11-19T10:01Z,"__________________________________________

First of all thanx to THETHINGY. its working fine.

on first launch it showed THE 30 days trial message but then i copied the DLL file(remember if u r using genuine windows copy the DLL from original folder and if not, copy the DLL from other folder) and paste it in the path mentioned in the txt file. for me it was [C:\Program Files\Adobe\Adobe Dreamweaver CS5.5]. replace the previous dll file and now when i started DW, it doesn't shows trial message. rest wud b sure after 30 days only. 

thanx again uploader!!! i am having w7 pro 32bit, working fine for me

pexxoo
__________________________________________"
,badzok,2011-11-30T02:50Z,"@odesk 
 upgrade sp2 into sp3 . download sp3 . "
,siod09,2011-12-22T14:26Z,"Ive downloaded Thingy's Adobe Flash and PS, and this one contrary to the other ones mentioned don't have the update option, I'm I correct? Otherwise it don't matter, I won't do any updates, thanks mr. thingy."
,ashsohat,2011-12-24T15:50Z,Thanks ! It is working for me .
,ashsohat,2011-12-24T16:13Z,May i get some Help ? :)
,Nevodaniel,2011-12-25T06:47Z,Thank you for the horrible torrent. I am getting attacks for my computer and Kaspersky is tripping out. The exe obviously doesn't work and the Dreamweaver install never went through. You suck!
,ashsohat,2011-12-25T08:12Z,Okk ! Thanks to all for helping me :)
,torbot1,2011-12-25T14:36Z,Okk ! Thanks to all for helping me :)
,torbot1,2011-12-26T17:43Z,Track Down ! No SOAPA ! SOAPA Cabnya !
,torbot1,2011-12-27T15:36Z,LAdy Gaaga ! nad thats my chacha
,torbot1,2011-12-28T19:34Z,haha it gone !
,torbot1,2011-12-29T04:51Z,thanks to all !
,torbot1,2011-12-29T10:37Z,"Hello,

I tried many times some times it work and then it doesn't work ! please some one give a stable solution .

Thanks"
,grixxles,2012-01-01T04:19Z,"Thethingy, you are a Demi-Dod!

Hey, any idea if (and how) Adobe CS Live can be used, as it says invalid serial number, each time?

Thanks a lot."
,grixxles,2012-01-01T04:19Z,"Thethingy, you are a Demi-God!

Hey, any idea if (and how) Adobe CS Live can be used, as it says invalid serial number, each time?

Thanks a lot."
,grixxles,2012-01-01T04:21Z,"Thethingy, you are a Demi-God!

Hey, any idea if (and how) Adobe CS Live can be used, as it says invalid serial number, each time?

Thanks a lot."
,delta47,2012-01-10T15:46Z,"Hi guys does anyone know if I can this with the business catalyst extension? I have changed the hosts file and blocked activation and such, I just want to know weather or not adobe can tell that I have a pirated DW when im using a BC partner account. Right now I have a free account but want to upgrade and so will be giving them my bank details by paying and I dont want to get sued or something LOL. Also I live in the UK if that makes any difference. Thanks!"
,siod09,2012-01-12T15:21Z,"
can we update this thing ?"
,clsmoove,2012-01-14T18:30Z,"@delta47: DO NOT mix your bank details, occupation, adobe and pirated adobe software together. The hacks and torrents, especially by thethingy, work perfectly today, but you have no way of knowing how adobe will respond. If you work for a blue chip company, or one that has corporate clients, then get them to buy you a copy, don't risk your livelyhood.

I have an extensive number of blocks in place, in my host file and both firewalls, but if an adobe program needs to interact with adobe, like updating flash player, you can't be certain that adobe won't add an audit of their programs on your system as part of the update. 

The UK has similar laws to the US, and until our government grows a pair, and tells the US to fuck off, adobe can hack your system and take action against your employers. It's just not worth their time or expense, chasing individuals who only muck about with the programs at home. That's what the wankers in the US government do best."
,clsmoove,2012-01-14T18:35Z,Thanks to thethingy for another great torrent.
,clsmoove,2012-01-15T23:00Z,"I updated the hosts file first, DW installed perfectly, replaced the .dll. Works perfectly, no need for a serial number."
,tw330,2012-01-16T00:17Z,"Worked like a charm, no problems, Thanks!"
,Boagster,2012-01-16T06:12Z,@pbtr0ck Stop spamming your shit! Asshole. 
,walterarg,2012-01-16T18:06Z,"Thanks !!! it works perfect. thethingy, you are the man..."
,vicky05.nayak,2012-01-19T15:39Z,It works on win7 (64 bit) right???
,mojeeq,2012-01-24T08:29Z,"THETHINGY, EVEN THOUGH ADOBE PPLE HATE YOUR GUTS, WE LOVE YOU!!! LONG LIVE TPB!!!"
,bootblitz,2012-01-24T09:04Z,"thethingy , ur d best"
,jaaskocody15,2012-01-25T03:05Z,thx 2 u ive saved prbly around $1000 in adobe products!!!
,Gproton,2012-01-26T00:14Z,"Great torrent here, been using it for a long time.

I'm tempted to try out Adobe edge which is an official free preview available for download from Adobe. 

Question is: If i proceed with download & install will i put my adobe downloads from thethingy at risk of detection?"
,slightblue,2012-02-06T18:20Z,Thank you so much!!
,moderaator,2012-02-13T19:02Z,"Works only a week or smth, then you just have to get another key. Very disturbing. Has any1 figured out how to completely crack this thing?"
,tpirates,2012-02-16T04:48Z,"It works great! & just to let the noobs know, dont download any update after installing this, or your going to have to uninstall & reinstall Dreamweaver ALL OVER AGAIN!"
,tpirates,2012-02-16T04:51Z,works
,stebert2012,2012-02-16T23:56Z,"Hi i have transfered the dll file over and dreamweaver is still couting down the days.
should it still be doing this and if not what do i need to do?
anyhelp would be great."
,stebert2012,2012-02-16T23:59Z,"Hi i tranfered the dll file over and dreamweaver is still counting down the days should it stiill be counting down?
if not what should i do
any help would be appreciated.
Regards"
,stebert2012,2012-02-17T00:00Z,"Hi i tranfered the dll file over and dreamweaver is still counting down the days should it stiill be counting down?
if not what should i do.
Regards"
,DDPhase,2012-02-26T14:48Z,Download this soon. Shall post feedback.
,chickenbath,2012-02-26T18:44Z,"I have Windows 7, 64 bit, Would it work on it? :[ And Thanks TheThingy U be Awsome!"
,chickenbath,2012-02-26T18:53Z,"Hey i have windows 7 64bit, will it work? And TheThingy ur the BOMB"
,rachie10,2012-03-07T07:08Z,whats the serial# for this i cant find it.
,snowbirds,2012-03-09T04:44Z,"I followed the instructions, but they were bloody confusing, as you can see from all the posts.  The instructions say:

""Go to the DLL folder and copy the dll file and paste & replace the ones in the CS5.5 program directory""

The problem with this is that when you go to the DLL folder there are TWO folders in there, titled ""32bit"" and ""Original - 32bit"".  The uploader doesn't mention two folders.  So what the fuck? He says copy the DLL file, but there are TWO of those files, so which is it??  I tried both but neither worked.  I read a bunch of comments again and finally tried the first one again, and it worked for some reason.  Very confusing and annoying process.  Why, because the uploader has the English language skills of a 12 year old Slovakian boy.

Why go to the trouble of writing instructions, but write them like a fucking retard?  And then when dozens of people ask for help understanding your retard instructions, you ridicule them??  Sorry about your brain-stem hypoxia condition, dicktard.  Glad I figured out your confusing upload, but the only seed your going to get from me are the millions I shoot down you throat.
"
,snowbirds,2012-03-09T04:52Z,"and to make it more confusing he says grab the ONE file to replace the FILES in the DLL folder.  

So he's saying take ONE file and replace TWO+ files with it.

Singular ≠ Plural, dick-cheese.

The truth is you have to pick from TWO files to replace ONE with..."
,73437,2012-03-10T03:36Z,"Been looking for this for a while now, thanks a lot!"
,easyrider77,2012-03-11T11:21Z,Thanks thethingy! the best tools i find in tpb.
,scroller24324,2012-03-12T00:22Z,Anyone have any idea how I can get dreamweaver and ps for linux? Is it possible? Thanks
,Damien74,2012-03-17T12:27Z,"I pulled the internet wire before installing and overwriting the dll-file.
Blocked DW in the firewall before starting it. But even the first time with no internet still it was in trial mode. 
Did it all by the book, as instructed in the nfo in other words. :/"
