User Type,Username,Date,Text
,Damien74,2012-03-17T12:31Z,"snowbirds youre not very smart are you? You should be very appreciative that this site even exists so be more respectful or never come back here with your comments like that.
The file that says original is ORIGINAL, to be used if you need to go back from the cracked one. That is why theres 2 files.
So to make even you understand. Use the file in the folder that does not have the word ""ORIGINAL"" in it. Ok? Good boy."
,lmack002,2012-03-21T02:51Z,"Guys, please i need help. I had originally downloaded this torrent but then it expired. I then tried to place my dll into the directory like many of you are saying, but it doesn't work. I have a 64-bit Windows 7 Ultimate. What can i do now? I removed and downloaded it like 2 times already but nothing works. It still asks for a serial number and the one that rajanu provided, doesn't work."
,crimson85067,2012-03-24T22:56Z,"dose not work, no instructuions either, cioppied all the dll and still not working no serials posted here work either window 7 64"
,AsimOmer,2012-03-26T19:55Z,Can I remove the JDK and JVM folders from the C:Program FilesAdobeAdobe Dreamweaver CS5.5 folder as I already have the latest java development kit.
,Wellsj,2012-03-27T05:57Z,"Thanks again son.

Quality as usual."
,machinegunfunk,2012-04-03T03:13Z,you can always count on thethingy 
,Deeladeda,2012-04-14T07:21Z,Running Windows 7 Home Premium 64-bit and it was easy to install and runs perfectly. Thanks heaps! :)
,cool1919,2012-04-17T07:20Z,"i know this torrent works.
this has to be a problem in my pc. after i installed and used it for sometime, when i try to open dreamweaver again, it says ""This application has failed to start because the application configuration is incorrect. reinstalling the application may fix the problem.""
same thing happened in case of another similar torrent! can anyone help me? can you please answer ""thethingy""??"
,anybloodyid,2012-04-18T09:04Z,"Never had a problem yet with thethingy uploads.
This is no exception works like a Dream.

Cheers pal."
,YoungSilva,2012-04-28T02:08Z,"Sir @thethingy, could you please make a video, showing how to install it. Please do it as soon as possible, because I need this software to make my homeworks from my administration course. So I hope I can count on you! Thanks."
,LeoJan,2012-04-28T13:07Z,"Tnx thethingy! What shouls we do without you!
Grt. Leo"
[V],thethingy,2012-04-29T17:55Z,"Dreamweaver CS6;





https://thepiratebay.se/torrent/7227389"
,Mista.T,2012-05-05T15:35Z,"I am pretty sure i have followed all of the instructions about hosts file and DLL files, but whenever i try to open Dreamweaver, the loading Green logo screen freezes and requires me to stop the processes.
Anyone got any suggestions"
,bunganga8,2012-05-15T10:55Z,"Everytime I try to load the program, it restarts my computer. Any suggestions? I've already reinstalled the program and it does it whether I have replaced the dll file or not. Please help"
,Wheeelzz,2012-05-27T19:32Z,"Worked Perfectly! Downloaded in like 2 mins, installed, replaced the DLL (already had my host file modified from when I downloaded Photoshop and Soundbooth CS5.5 from thethingy) and it is up and running!"
,Wheeelzz,2012-05-27T19:34Z,Everything I have ever downloaded from thethingy worked great!
,dasjew,2012-05-31T22:29Z,"damn top notch torrent, super easy install, and works like a charm. thanks a lot bud, i owe you, well, a shit ton of money. thanks"
,gmacor2,2012-06-03T11:57Z,A great torrent. Thank you very much.
,darkanomaly88,2012-06-17T15:52Z,This works perfectly but watch out someone who is seeding is also DoS attacking 
