User Type,Username,Date,Text
[V],sujaidr,2011-10-16T16:35Z,"i have included a sample,so you could check for quality :-)

@suneelsahu  your request is done dude,enjoy :-)"
,suneelsahu,2011-10-16T18:08Z,"oooo that was fast :D ... tyvm,quality looks good too,jus one suggestion for fast movies over 2hrs i think u can go upto 700-800 mb,but no offence......ty again for ur efforts"
,suneelsahu,2011-10-16T18:10Z,this is one of my all time favorite
[V],sujaidr,2011-10-16T20:28Z,will upload crazy stupid love as soon as i finish seeding this torrent
,john_doe_doh,2011-11-24T22:07Z,"ty m8, much appreciated :)"
,Bensparrow,2011-11-29T18:46Z,Thanks.
,muzhaq,2012-04-02T21:00Z,Thanks man...the main thing I like in this torrent is the end credits!!
