User Type,Username,Date,Text
,Ravaner,2011-05-23T21:36Z,"There is a Naruto Wii game called dragon blade but none called blade dragoon, your synopsis doesn't really describe what this is very well and your picture is from a calendar. All these points would lead me to think that this is ether a severely miss labeled collection of calendars and manga or a really pathetically faked pc game."
[T],rjaa,2011-05-24T08:47Z,this is Naruto Shippuden-Dragon Blade PC version
,blacksidex6,2011-05-24T19:28Z,anyone tried
,bran180,2011-05-24T21:41Z,its does work it runs on a emulator
,bran180,2011-05-24T21:42Z,"thanks for upload works awesome,"
,bran180,2011-05-24T21:43Z,"works well runs on an emulator,
thanks "
,love2as1,2011-05-25T13:51Z,"bran180

what the emulator do you use to run this?

I'm currently downloading this...

thanks..."
,Ishtiyaque,2011-06-08T18:10Z,"This is a wii game called naruto shippuden dragon blade , dolphin emu included :}"
,nic25magg,2011-07-13T16:23Z,Game Works Perfectly   Thanks rjaa
,nisse427obo,2011-07-16T22:14Z,how can i install it ?
,lanjimsdk,2011-07-28T12:09Z,"naruto.exe virus detacted......y?

is this virus...or sometingg..

rjaa... plsss explain"
,ssjgt,2011-07-28T17:45Z,"plzz rjaa tell me how to install and play when i click on the file on the start page it just pops out a emulator ( i think ) and i cant click play or any other buttons.
 plzz help and sorry for my bad english."
,chanLan88,2011-08-13T04:21Z,is this working or not? answer me!!
,Saurav986,2011-10-08T21:40Z,what are the minimum system requirements???
,freshibi,2011-10-29T23:29Z,"can someone help me Whenever I run it,it says framebuff manager create failed, dunno what to do !"
,NOR3CA,2011-11-01T15:02Z,i play this on PC how can iďťż move or grab the box from 1st screne.. i try holding action button letter A.. but naruto keeps attacking??
,frostiiiii,2012-02-16T14:58Z,what emulator you use. pllz answer me. :) 
,yahiko1992,2012-06-09T11:39Z,"if u need a emulator 



http://www.dolphin-emulator.com/download.html"
