User Type,Username,Date,Text
,jersson,2011-09-01T13:43Z,Works very well. Thank You
,ilocano1968,2011-09-01T14:47Z,somebody praise than him
[T],grimreaper420,2011-11-15T05:29Z,"I decided to grab this torrent based on the reviews of ""2012 Best DVD Copy Software Review"" (ranked#1) and installed it, copied the crack over in [Win 7 ultimate x32] works perfectly.
I'm impressed, thank you scuba-doo:)"
,Skaway,2011-11-15T13:58Z,"Thank you very much for this. Do you know what can we do with the ""Open DVD ripper"" ? The DVD Cloner claims that its free if you have the dvd cloner 8..but do you know if is it going to work?"
,CarmelQT,2011-11-27T20:50Z,Y is this not working for me? When I click download torrent only an rar file appears.
,nightelff,2011-12-04T02:10Z,Thank you works perfect
,red_black,2011-12-22T15:09Z,Well done! It works
,astroashart25,2012-01-17T00:31Z,Thanks a lot
,Vimala,2012-01-23T02:39Z,Please upload DVD Cloner 9. Thanks
