Filename,Size,Unit
Jackass.3.5.2011.UNRATED.PAL.Retail.MultiSubs.DMT/Jackass_DVD5.iso,4.29,G
Jackass 3.5.jpg,5.78,M
"DMT NFO, Read before Playing.txt",1.38,K
Jackass.3.5.2011.UNRATED.PAL.Retail.MultiSubs.DMT.nfo,625,B
Torrent downloaded from AhaShare.com.txt,58,B
Torrent downloaded from Demonoid.me.txt,46,B
Torrent Downloaded from TorrentState.com.txt,46,B
Torrent_downloaded_from_www.puretorrents.cc.txt,36,B
Torrent downloaded from Rarbg.com.txt,33,B
Torrent downloaded from silvertorrents.me.txt,29,B
