User Type,Username,Date,Text
,anton1209,2011-01-14T20:02Z,"NoDVD; 100% Clean:
http://www.virustotal.com/file-scan/report.html?id=13b44147b27394b2a7d5feea202c5352e223bd69bc7256871ea55e3666debfcb-1295031730"
,tullowman,2011-01-14T22:42Z,is a 1 hour trail version. don't bother with this
,tullowman,2011-01-14T22:45Z,plus it crashes when you open it
,anton1209,2011-01-15T05:24Z,"No. This is the last version and is full.
tullowman, try to update the drivers."
,anton1209,2011-01-15T11:14Z,"Known problem: launcher may does not work.
Solution: go to Program Files \Bus Driver \bin \win_x86 and run busdriver.exe "
,anton1209,2011-01-15T17:44Z,Solution #2: right click the shortcut and select Run As Administrator.
,nakkiz,2011-04-28T12:20Z,"It took a bit of fiddling to get this to run on the first try, but other than that, it works perfectly.

If you install this over the previous version of Bus Driver, then do -not- try to run the executables in the Bus Driver folder. The proper ones are in Bus Driver\bin\win_x86.

Before installing the crack, run launcher.exe, edit your settings and then launch the game from there. Then quit and install the crack.

These steps worked perfectly for me, ymmv."
,nakkiz,2011-04-28T12:24Z,"(You need to edit your settings to overwrite the configuration files for the previous version. If you don't do it, you'll get an annoying warning dialog when you run the game.)"
,ultimateguy,2011-05-17T03:55Z,seed plz
,Zgbguy,2011-09-14T11:44Z,"I do not understand anything and no matter what you write ...
Obviously it's just you, manage .. I tried to run from any folder zero points -
removed from the crack gamecopyworld.com
not start
Do not install the game because it does not work"
,rematy07,2012-01-29T17:06Z,"is full game?????????????is not full game fuckyou
!!!!!!!!!!"
,GIjoe346,2012-04-05T11:32Z,"Doesn't work sorry mate. tried everything, run launcher normally and as administrator, and xp sp2 compatibility mode, the same for the application in the x86 folder. nothing works sorry..."
,akki143,2012-04-29T18:07Z,thanks uploader it works
