User Type,Username,Date,Text
,berttes,2011-09-28T15:39Z,"hey petey85, 
ik kan jou aflevering van oh oh cherso en de villa niet leechen. ik weet er niet veel van af maar zou dat kunne omdat het in avi formaat is? torrents van progemist kan ik bv wel downloaden.
alvast bedankt"
[V],Petey85,2011-09-28T15:49Z,"vreemd probleem.. 
aan het formaat/bestand kan het niet liggen, want onze uploads zijn allemaal .avi bestanden in xvid-formaat, misschien wil ProGemist ze nogmaals voor je uploaden maar ik neem aan dat het probleem niet bij mij ligt..
zoals je ziet zijn er seeders en leechers genoeg, 
succes in ieder geval :)"
,berttes,2011-09-28T19:08Z,"idd, hier zie ik 9 seeders en 3 leechers
maar volgens vuze zijn het er 0...
raar, zeker omdat de afl van vorige week zonder problemen lukt.
toch bedankt voor de snelle reactie!
grtz"
,berttes,2011-09-28T19:14Z,"hier zie ik 9 seeders en 3 leechers
maar volgens vuze zijn het er 0...
raar, zeker omdat de afl van vorige week zonder problemen lukt.
toch bedankt!"
[V],Petey85,2011-09-28T20:13Z,"ik gebruik zelf ook Vuze, misschien toch iets met je instellingen?
ik weet het echt niet.."
,ProGemist,2011-09-28T22:00Z,"petey85 

doet prima werk, we nemen elkaars werk over zodat ik samen met Petey85 een leuk overzicht kunnen plaatsen voor mensen die wel eens een programma missen..
en er is dan ook geen verschil met plaatsen zo als ik doe,
Maar als mensen die hebberig zijn en alleen komen halen en te lui zijn om te delen..Tja ..
Het blijven Hollanders.

Dus SEED zet niet gelijk de pc uit?????

Good luck All

@ProGemist
"
[V],Petey85,2011-09-28T22:26Z,"ik denk niet dat het aan seeders/leechers ligt, maar dat Berttes echt een probleempje heeft, Oh Oh Cherso heeft namelijk meer dan 50 seeders en hij ziet er 0..

aangezien ik verder nergens klachten lees denk ik dat er iets met zn instellingen is"
,berttes,2011-09-28T23:32Z,"het lag idd aan vuze.
heb het terug geinstalleerd en het probleem is verholpen. tnx
blijf zo verder doen!
zal zeker blijven seeden!
grtz"
[V],Petey85,2011-09-29T00:37Z,"fijn te lezen dat alles opgelost is!
ik wens je veel plezier met onze programma's en snelle downloads! :)"
,heuts,2011-10-06T19:26Z,waarom is de villa S01E05 nog niet op de site ?
,noliteonit,2011-10-07T16:40Z,"Ook aan jouw m'n complimenten Petey85! Geniet elke week weer van de series en programma's die worden upgeload, toch een genot om vanuit Zweden veel te kunnen blijven volgen. Gelukkig heb ik een geweldige verbinding hier dus deel de meeste programma's 2-10gb door.. Ik weet niet of dat dan ten kosten gaat van andere?

En wat heuts zei, kan niet wachten op de nieuwe afleveringen zoals de villa, of holland in tha hood! lachen is dat! Nou succes d'r mee"
,heuts,2011-10-09T14:46Z,kerel fijn dat jij wel doorgaat.er zal wel heel veel vraag na je zijn nu progemist is gekapt.wil niet al te lastig zijn maar wil jij aub DE VILLA en HOLLAND IN THA HOOD op de site zetten!?!?!
