User Type,Username,Date,Text
,Sciguy77,2011-10-02T15:09Z, – all safe!  Download with confidence.
,nyder,2011-10-02T23:05Z,"thanks, lost a harddrive that had all my doctor who on it, got the old stuff back, but hadn't started looking for the 720p of the new stuff.  you rock!"
,ArdentCustodian,2011-10-08T05:38Z,"Initial seeding will be done within 12 hours, thank you to everyone who helped seed off the 2010 torrent."
,Peanuts16,2011-10-15T14:02Z,"Downloading now, thanks!"
,Maggy2040,2011-10-19T17:20Z,"Awesome, thanks for making this compilation. Downloading."
,Kingman_Arizona,2011-12-14T06:45Z,Happy Holiday's for 2011
,Sprout,2011-12-26T01:46Z,isnt complete. doesnt have the 2011 christmas special. Other than that. GREAT!!!! I love Doctor Who!!! Thanks for uploading!!!!
,sbrideau,2011-12-28T00:03Z,Can this be seeded more? I have 93% downloaded and it is downloading at 
,sbrideau,2011-12-28T00:04Z,"Ending of my comment, I guess validation fails on tpb comments ... 

It's downloading slower than 5 kB/s. I'll be seeding for a while on my 15Mb/s upload."
,motherofthelost,2012-01-01T07:25Z,"Please seed, it's so close!"
,RazorRape,2012-03-05T12:51Z,"Fantastic! The only things missing were some Children in Need specials, such as the one before Christmas Invasion, and DVD extras like the preludes from season 6."
,Brave-Knight-99,2012-03-25T19:41Z,This Torrent Seems Really Good...But It Doesn't Work For Me...Any Suggestions..
,Fezman92,2012-04-11T23:26Z,I am having glitches with various episodes. They just cut to black and end randomly.
,polarbearable,2012-04-16T15:30Z,"Many thanks for this. I've never worked out why the download speed for this torrent is so slow. I'm averaging 70kB/s with 17 seeds and 43 peers. I've had other torrent downloads reach 1MB/s, which is my maximum ""real world"" download connection speed."
