User Type,Username,Date,Text
[V],gatasalvaje,2011-04-28T19:08Z,gracias a vosotr@s x agradecerlo saludos 
,FackundoMexican,2011-10-25T02:56Z,nunca lo he utilizado! probemos haber que tal gracias
,FackundoMexican,2011-10-25T06:34Z,ya lo utilize! muy sencillo de usar se bajo en chinga! no lo conocia y valio la pena! gracias por esta aportacion Gatasalvaje! im seeding..
,HAGO,2012-04-07T00:33Z,it gives an error message on win7 32.. any help?
,HAGO,2012-04-07T00:43Z,"LOL.now i noticed it for 64x in ""Hardware Support"""
