Filename,Size,Unit
And More/Signs of the Times/20 Translations Call Jesus a Liar Do You Care  John 7 8.flv,88.05,M
And More/Signs of the Times/A Visitor at the Front Lines  Read by Sam Gipp - YouTube.flv,9.88,M
And More/Signs of the Times/Age of Illiteracy  Shocking 20pct UK youths struggle to read - YouTube.flv,12.82,M
And More/Signs of the Times/And God Created  III - YouTube.flv,41.52,M
And More/Signs of the Times/Antidepressants Facts  The Truth about Psychiatry Depression Drugs.flv,8.46,M
And More/Signs of the Times/ARAB SPRING or BIBLICAL END-TIME PROPHECY  DAVID RUBIN - I told you so.flv,11.29,M
And More/Signs of the Times/Big Brother Watching - New RT America Promo  - YouTube.flv,7.37,M
And More/Signs of the Times/BLOCKBUSTER REVELATION - Illegal Obama Propped Up By Congress.flv,50.77,M
And More/Signs of the Times/Capital of Scrap  Dying Detroit looting itself - YouTube.flv,19.07,M
And More/Signs of the Times/Childrens Heart Attacks in Fukushima 6 month anniversary - YouTube.flv,26.61,M
And More/Signs of the Times/CHRISTIAN PROTESTERS ATTACKED IN EGYPT  - YouTubed.flv,7.53,M
And More/Signs of the Times/Clip - WILLIAM COOPER-The New Age Conspiracy.avi,11.26,M
And More/Signs of the Times/David Garibaldi Portrait of Christ   Inspiration Manifestation.mp4,18.87,M
And More/Signs of the Times/Social Security Able To Pay ALL Benefits thru 2037 Unconstitutional Super Congress Closer To Dictatorship.flv,5.38,M
And More/SIN-ister Clips/8-22-2011 - News - Freedom of Fascism - Economic Disaster - YouTube.flv,21.03,M
And More/SIN-ister Clips/Alex Jones Special Report  Wall Street Occupation - YouTube.flv,211.45,M
And More/SIN-ister Clips/The Fight is Not Over Dont Let Lock Boxes into Your Town Another Voice Rev. 18 4.flv,30.81,M
And More/SIN-ister Clips/The History of 2012 Theories  - YouTube.flv,45.01,M
And More/SIN-ister Clips/The Nephilim.flv,11.51,M
And More/SIN-ister Clips/The shocking video Muslims dont want you to see  - YouTube.flv,11.18,M
And More/SIN-ister Clips/The Vitamin Water Deception - exposes truth behind this non-healthy beverage - YouTube.mp4,84.36,M
And More/SIN-ister Clips/THIRD BARACK OBAMA VIDEO BANNED BY GODTUBE 1 2 09 - YouTube.flv,40.29,M
And More/SIN-ister Clips/This is really happening in the US - Make Viral - YouTube.flv,7.3,M
And More/SIN-ister Clips/Tribulation and a Palestinian state USA Betrays Israel  1967 Israeli War Borders Obama End times.flv,55.71,M
And More/SIN-ister Clips/UK marching banned  Police call the tune - YouTube.flv,20.76,M
And More/SIN-ister Clips/US corporations sacrifice people - Press TV News - YouTube.flv,11.27,M
And More/SIN-ister Clips/Weather Modification Being Used to Ease Texas Drought - YouTube.flv,17.63,M
And More/SIN-ister Clips/What They Read in US Mosques  81pct Advocate Violent Jihad US Muslim Beheads Wife Sharia Law Honor.flv,13.11,M
And More/SIN-ister Clips/What Transformed the WTC Buildings to DUST on 9 11  - YouTube.flv,3.65,M
And More/SIN-ister Clips/WILLIAM COOPER IDENTIFIES SATAN THE DEVIL HIMSELF.flv,37.05,M
And More/The Holy Spirit/AWESOME GOD  - YouTube2.flv,12.67,M
And More/The Holy Spirit/Better Never to Have Been Born - Steve Lawson - YouTube.mp4,54.02,M
And More/The Holy Spirit/Brandon Heath - The Light  - YouTubewf.flv,13.75,M
And More/The Holy Spirit/Chris Tomlin - Indescribable with Lyrics.flv,5.22,M
And More/The Holy Spirit/Christian Persecution - YouTube.flv,55.49,M
And More/The Holy Spirit/David Garibaldi - Jesus Painting - YouTube.flv,10.49,M
And More/The Holy Spirit/Go Light Your World - Be a Beacon - Chris Rice HD - YouTube.mp4,125.53,M
And More/The Holy Spirit/God is Good Humans Are Not - YouTube.flv,8.07,M
And More/The Holy Spirit/Healing Begins - Tenth Avenue North - w lyrics  - YouTube.flv,8.84,M
And More/The Holy Spirit/i can only imagine mercy me.flv,14.45,M
And More/The Holy Spirit/Let Your Fire Fall  - YouTube.flv,11.86,M
And More/The Holy Spirit/My Savior My God By Aaron Shust  - YouTube.flv,12.41,M
And More/The Holy Spirit/open the eyes of my heart lord.flv,10.12,M
And More/The Holy Spirit/Satanic Ministers 2 Corinthians 11 14-15 - YouTube.flv,103.78,M
And More/The Holy Spirit/Some OF My Favorite Songs From The Past 7  - YouTube.flv,26.22,M
And More/The Holy Spirit/Switchfoot - This is Your Life.flv,13.13,M
And More/The Holy Spirit/The Assyrian Antichrist - Book of Revelation.avi,76.13,M
And More/The Holy Spirit/There You Go - Caedmons Call.flv,11.58,M
And More/The Holy Spirit/Until the whole world hears  - YouTube.mp4,79.94,M
And More/The Holy Spirit/You Alone Are God - Hillsong  - YouTube.flv,17.25,M
And More/The Holy Spirit/Your Grace Still Amazes Me Phillips Craig   Dean  - YouTube.flv,17.45,M
A Lamp In The Dark - The Untold History Of The Bible 2010.avi,1.67,G
A Lamp in the Dark.jpg,19.74,K
Description.txt,1.03,K
POtHS - Why We Do What We Do.txt,7.89,K
Torrent downloaded from Ahashare.com.txt,47,B
Torrent downloaded from Conspiracyhub.com.txt,47,B
Torrent downloaded from Demonoid.com.txt,47,B
