User Type,Username,Date,Text
,sinner77,2011-08-07T12:55Z,u shld do more movies in this size
[V],_F1_,2011-08-08T21:24Z,"What movie exactly you want in that size?
I've stopped encoding way back for some reasons and only encode now on request."
,sinner77,2011-08-10T00:09Z,"can u do the movie Wall street(the original one) in small size
No hurry u can do it whenever u get the time
thks"
,1KalozAr,2011-08-13T08:42Z,"Please upload,if You can,Jorge Grau's ""La Siesta"",1980;the size does not matter...Thank you..."
,suraz.619,2011-12-19T13:58Z,"Admin, please seed. I am having problem to download this film. I cant wait so much longer to watch this film."
