Filename,Size,Unit
Tlingit Indians.pdf,233.07,M
Northern Maidu.pdf,88.35,M
Haida texts - Masset dialect.pdf,79.02,M
Shuswap.pdf,69.88,M
The Heta Indians. Fish in a Dry Pond.pdf,67.93,M
Basketry of the Papago and Pima.pdf,62.95,M
Chilkat Blanket.pdf,52.43,M
Yakut.pdf,52.36,M
Havasupai ethnography.pdf,49.42,M
Basketry of the Tlingit.pdf,46.42,M
Kwakiutl texts. Second series.pdf,45.72,M
Canadian Dakota.pdf,44.84,M
Shasta.pdf,40.74,M
Kwakiutl texts1.pdf,40.28,M
Basketry designs of the Indians of northern California.pdf,40.12,M
Folklore of the Menomini Indians.pdf,36.47,M
Myths and traditions of the Crow Indians.pdf,36.06,M
Notes on the Hidatsa Indians.pdf,34.96,M
Lillooet Indians.pdf,33.48,M
Assiniboine.pdf,33.42,M
Hidatsa earthlodge.pdf,33.13,M
White Mountain Apache Texts.pdf,31.91,M
Material Culture of the Blackfoot Indians.pdf,31.68,M
Horse and the Dog in Hidatsa Culture.pdf,31.35,M
Plains Cree.pdf,31.2,M
Ceremonial Bundles of the Blackfoot Indians.pdf,29.76,M
Kwakiutl string figures.pdf,29.48,M
"Societies of the Crow, Hidatsa and Mandan Indians.pdf",29.2,M
Notes on the Eastern Cree and Northern Saulteaux.pdf,27.64,M
Symbolism in Penobscot Art.pdf,26.51,M
Decorative art of the Sioux Indians.pdf,26.24,M
Zuni Kin and Clan.pdf,26.22,M
Ethnology of the Gros Ventre.pdf,25.34,M
Social Life and Ceremonial Bundles of the Menomini Indians.pdf,25.3,M
Jicarilla Apache texts.pdf,24.74,M
Arapaho2.pdf,23.89,M
Basketry of the San Carlos Apache.pdf,23.21,M
Kwakiutl texts2.pdf,23.19,M
Notes on Shoshonean Ethnography.pdf,22.67,M
San Carlos Apache Texts.pdf,22.28,M
Mythology of the Bella Coola Indians.pdf,21.18,M
Religion of the Crow Indians.pdf,21.04,M
Navajo Texts.pdf,20.75,M
Northern Shoshone.pdf,20.39,M
Kwakiutl texts3.pdf,20.12,M
Riding Gear of the North American Indians.pdf,18.53,M
Mythology of the Blackfoot Indians.pdf,18.48,M
Sun Dance and Other Ceremonies of the Oglala.pdf,18.16,M
Shell Bead and Ornament Exchange Networks Between California and the Western Great Basin.pdf,18.1,M
Beaver Indians.pdf,17.7,M
Beaver Texts.pdf,17.67,M
Notes on the Sun Dance of the Sarsi.pdf,16.17,M
Plains Indians Age Societies.pdf,16.08,M
"Tales of Yukaghir, Lamut, and Russanized Natives of Eastern Siberia.pdf",16.05,M
Material Culture of the Crow Indians.pdf,15.95,M
INDIANS OF GREATER NEW YORK AND THE LOWER HUDSON.pdf,15.5,M
Whale House of the Chilkat.pdf,15.18,M
Harpoons and darts in the Stefánsson collection.pdf,14.72,M
"Societies of the Iowa, Kansa, and Ponca Indians.pdf",14.41,M
Tobacco Societies of the Crow Indians.pdf,14.12,M
Societies and Dance Associations of the Blackfoot Indians.pdf,13.88,M
Arapaho.pdf,13.07,M
Myths and Tales of the San Carlos Apache.pdf,12.47,M
Crow Indian Art.pdf,11.96,M
Societies and Ceremonial Associations in the Oglala Division of the Teton-Dakota.pdf,11.73,M
NOTES ON THE INDIANS OF THE FORT APACHE REGION.pdf,11.46,M
Social Life of the Crow Indians.pdf,11.42,M
Maidu Myths.pdf,11.25,M
Decorative art of the Indians of the North Pacific coast.pdf,11.13,M
Pawnee Indian Societies.pdf,10.65,M
Costums of the Plains Indians.pdf,10,M
MINOR CEREMONIES OF THE CROW INDIANS.pdf,9.72,M
"NOTES ON THE SOCIAL ORGANIZATION AND CUSTOMS OF THE MANDAN, HIDATSA, AND CROW INDIANS.pdf",9.63,M
Basket designs of the mission Indians of California.pdf,8.97,M
SOME PROTECTIVE DESIGNS OF THE DAKOTA.pdf,8.81,M
NOTES ON HOPI CLANS.pdf,8.61,M
Associations and ceremonies of the Menomini Indians.pdf,8.51,M
"SUN DANCE OF THE SHOSHONI, UTE, AND HIDATSA.pdf",8.39,M
Gros Ventre myths and tales.pdf,8.37,M
SUN DANCE OF THE PLAINS INDIANS.pdf,8.24,M
SOCIAL ORGANIZATION AND RITUALISTIC CEREMONIES OF THE BLACKFOOT INDIANS.pdf,7.36,M
HOPI KINSHIP.pdf,7.28,M
TEXTILE FIBERS USED IN EASTERN ABORIGINAL NORTH AMERICA.pdf,6.54,M
NOTES ON THE KIOWA SUN DANCE.pdf,6.49,M
"POLITICAL ORGANIZATION, CULTS, AND CEREMONIES OF THE PLAINS-OJIBWAY AND PLAINS-CREE INDIANS.pdf",6.1,M
HUICHOL INDIANS OF MEXICO..pdf,5.92,M
Chipewyan Texts.pdf,5.57,M
MYTHS AND TALES FROM THE WHITE MOUNTAIN APACHE.pdf,4.92,M
SUN DANCE OF THE BLACKFOOT INDIANS.pdf,4.68,M
HOUSE OF THE GREAT KIVA AT THE AZTEC RUIN.pdf,4.62,M
Dance associations of the Eastern Dakota.pdf,4.02,M
Dances and societies of the Plains Shoshone.pdf,3.74,M
STRUCTURAL BASIS TO THE DECORATION OF COSTUMES AMONG THE PLAINS INDIANS.pdf,3.73,M
SOCIETIES OF THE ARIKARA INDIANS.pdf,2.98,M
SYMBOLISM OF THE ARAPAHO INDIANS.pdf,2.84,M
Chipewyan Tales.pdf,2.77,M
Distribution of moccasin decorations among the Plains tribes.pdf,2.69,M
General discussion of shamanistic and dancing societies.pdf,2.14,M
SOCIETIES OF THE KIOWA.pdf,1.12,M
Dancing societies of the Sarsi Indians.pdf,1.12,M
IROQUOIS SILVERWORK.pdf,614.29,K
