User Type,Username,Date,Text
,eightballr187,2011-07-02T04:15Z,ty my kids love this show
,tyecita,2011-07-02T04:23Z,"I've added NEW episodes and most are from season 2. Search on pirate bay ---> Team Umizoomi or click on my screen name to get all my uploads.

Glad you enjoy and PLEASE keep seeding!!!"
,tyecita,2011-08-21T02:41Z,"Stop downloading this low quality videos and download some great ones here

http://thepiratebay.org/torrent/6608060/Team_Umizoomi-S1xE8_The_Dinosaur_Museum_Mishap.avi

http://thepiratebay.org/torrent/6615068/Team_Umizoomi-S1xE12_The_Butterfly_Dance_Show.avi"
