Filename,Size,Unit
Information/1337x.org.txt,20,B
Information/HDScene - sceneunderground.org.txt,160,B
Information/Torrent downloaded from AhaShare.com.txt,59,B
Information/Torrent Downloaded From ExtraTorrent.txt,95,B
Information/Torrent downloaded from Sceneunderground.org.txt,44,B
Information/Torrent Downloaded from TorrentState.com.txt,46,B
sample/sample.mp4,13.53,M
sample/SceneUnderground.nfo,6.88,K
Lord of the Rings Fellowship of the Ring 2001 BRRip mHD(576p) x264 AAC-GokU61(HDScene-Release).mp4,1.76,G
Lord of the Rings Fellowship of the Ring 2001 BRRip mHD(576p) x264 AAC-GokU61(HDScene-Release).srt,102.76,K
