User Type,Username,Date,Text
,satanlunar,2011-05-20T05:11Z,thanks!!!
[V],RR-NE,2011-05-20T08:58Z,can you please tell me how you get so many seeds on your torrents?
,LilRock18,2011-05-20T10:15Z,"Hey HR, can you upload Daredevil? The one with Ben Affleck?"
,defeatedsanity,2011-05-20T17:51Z,"Will not play on PS3 due to the stupid Cinavia Watermarking. Plays great on ipod/iphone but if your hoping to watch on a ps3 don't bother downloading. 

For those that are not aware what Cinavia is: http://en.wikipedia.org/wiki/Cinavia#List_of_Known_Digital_Releases_with_Cinavia_Watermarking"
,bptboy,2011-05-20T23:27Z,"I dont know if you do request or not, but could you please do make a torrent for futurama (all season) in psp, ipod, zune format?

Also great torrent, been looking forward to watching this movie."
,LilRock18,2011-05-22T06:07Z,"Can you upload Sucker Punch or Beastly? thanks, no pressure"
,satanlunar,2011-05-22T08:09Z,hey hr how do u use subs for these movies?
,DexMorgan,2011-05-23T18:39Z,"Could you please upload Arrested Development (Complete) there aren't any torrents in iPod format, it would be greatly appreciated. Thanks."
,gaaraisgod,2011-05-23T21:18Z,"@bptboy: There's already a couple of Futurama uploads: 
01. http://thepiratebay.org/torrent/6215262/Futurama_Seasons_1-6_mkv_compression_mkvGOD
02. http://thepiratebay.org/torrent/5669027/Futurama_Season_1-5_%28Ipod_touch_-_Zune%29

Try those?"
,bptboy,2011-05-23T22:35Z,"@gaaraisgod

thanks but I tried those already and they dont work on video ipod unfortunately."
,Alliteration,2011-05-24T05:05Z,"Keep up the awesome work, HR! Any chance we could get ""The Graduate"" (1967)? You rock!"
,bowmanxenocide,2011-05-24T13:21Z,"HR, reserve your seat on Mt Olympus. Do the complete series of Fresh Prince of Bel-Air for handheld. The throne will be yours"
,pspmala,2011-05-24T15:59Z,HolyRoses please do some porn for ipod touch  .
,bi0sh0ck,2011-06-01T19:37Z,Just wanted to know whether Samsung Galaxy (android platform) would support this movie format or not ?
[V],HolyRoses,2011-06-01T22:03Z,my guess is that it would work.  don't see why you bother to ask.  you would know answer in like 15 minutes if you download file.
,WhatDontBreak24,2011-06-08T00:52Z,"great upload, fast download, good quality movie :)"
,An_Armenian,2011-06-17T03:18Z,"Appreciate the upload, HolyRoses."
,drowned0725,2011-06-25T13:06Z,Thank you so much!
,Dermbet,2011-07-30T01:10Z,TY for the great upload!!!!! 
,nitin_mittal62,2011-10-22T17:59Z,vry gud print guys...
,snbois100,2012-04-19T23:36Z,HolyRoses... for ever and ever the best
