User Type,Username,Date,Text
[T],FatFreddy777,2011-02-08T19:57Z,"Ah,,,Love Lenka & I can't help but notice you got these from the Archives site,so I have to take advantage & ask a request of you & ask if you can post the ATK Super-bush Queen Katerina's sets,I lost her sets in a nasty crash a few years ago."
[V],bestec1234,2011-02-08T20:31Z,"Gladly.  Which Katerina?  There are 93,234 of them."
[T],FatFreddy777,2011-02-08T21:52Z,"I was gonna say the hairiest one till I saw how many are there LOL,,,,this is the ATK Queen Of Bush,,,
http://www.scaryhairypussy.com/models/katerina01/index.html"
[V],bestec1234,2011-02-09T00:28Z,Ah... yes that's Katerina 019.  I'll see if I can get her sets up after Lenka is done.
,jjchucho,2011-08-20T01:52Z,seed please...
