User Type,Username,Date,Text
,thegooch666,2011-10-23T20:29Z,"Damn it, started DL'ing at 433kbps and dropped to 2.3kpbs. Please seed!!"
,JonathanX95,2011-10-23T20:45Z,"is this the legit one now? not having to fill out god damn surveys to get a password to unlock the video file, but actually legit?"
,.EzDL,2011-10-23T21:02Z,"Yes this is real, always look at the uploader's status next to there name to see if they have a pink or green skull, it mean's there a trusted uploader. This is real!"
,thegooch666,2011-10-23T21:55Z,"Downloaded the sample. Looks of decent quality, especially for a TS."
,Exphailure,2011-10-24T00:02Z,"When are you guys going to learn to stop posting the screenvshots @ Imageshack, not only does the loading suck but half the time the 'effin images are taken down due to violations."
