User Type,Username,Date,Text
[V],gnice06,2011-05-08T07:11Z,The MONKEY has been put on display for the whole world to see.
[V],gnice06,2011-05-10T23:47Z,"This TROLL MONKEY has NO LIFE and can be found daily in The Pirate BAY porn section.


""Negative ratings""? 

BWAAAAAAAAAAAAAH HA HA HA HA HA HA HA HA HA HA HA HA HA HA HA HA HA HA HA HA HA!!!!!

Keep waisting your time DUMBASS!

I OWN YOU MONKEY!

Keep typing MONKEY, you have work to do!

MOVE ASSHOLE!  NOW!!!!

World, this is how you work the shit out of a MONKEY."
[V],gnice06,2011-05-12T05:18Z,Anyone want to buy a slave MONKEY?
