User Type,Username,Date,Text
,jobinmat,2011-09-09T06:50Z,hi buddy will u be uploding the 6.7&8th season of this show....
,lionmark77,2011-09-10T09:50Z,"hi 
sunDox
when r u going to upload ep 10 of White Collar season 3 "
[H],sundox,2011-09-11T00:49Z,"@jobinmat
Will get all seasons up. Rest will be up tomorrow :)"
,murzar,2011-09-11T11:17Z,"hey buddy.. been requesting the 7th season of house. 

Just atleast let me know if you'll consider or not."
[V],sujaidr,2011-09-11T13:22Z,"nice one,can you please upload   A Little Bit of Heaven  http://www.imdb.com/title/tt1440161/  ,scorp rip is available,can u please do it"
,ipodctrl,2011-09-14T11:23Z,"Please consider uploading One Tree Hill. Since it's been running for a lot of seasons already, there are only a few uploaders of the past seasons, and sadly there are no good torrents available (small file size with excellent quality) of the show. I would really appreciate it if you could upload the show but I would understand as well if you have other requests to attend to. Thank you for all the uploads. :)"
