User Type,Username,Date,Text
,lttwinkie,2011-10-30T22:47Z,thanks this is what i needed.  i'll help seed for a few days
,Taz1982,2011-10-30T23:25Z,glad it worked mate
,Taz1982,2011-10-30T23:28Z,"If you are using older generation non Tegra 2 Android phone like HTC Desire HD, Samsung Galaxy S, ShadowGun might not able to load properly. In order to play ShadowGun, you need to turn on ‘Reduce texture quality’ and ‘Reduce texture size’ in Chainfire3D. This will help to reduce memory usage and improve performance on older Android phone. Guess what? These help to fix force close issue on Samsung Galaxy S2 when trying to loading another level after finished level 1. But the graphics quality will be reduced, right? No worry, just turn off those after you manage to go pass the loading."
,design.s,2011-12-07T08:03Z,Shot 4 the upload dude...wat version of the game is this 4?...1.0.2/3/4?
,Baguett,2011-12-17T20:51Z,"great, but in what folder do i put these? guess i just dont put the folder called ""files"" in android-data ?"
