User Type,Username,Date,Text
[V],SAFCukO09,2011-06-13T07:07Z,Cant help the file size 2hrs extra this week cos of rain
,hynix-semicon,2011-06-13T07:51Z,"wow... 8.3GB...

if it is 1080, that's hell...."
[V],SAFCukO09,2011-06-13T09:07Z,I know that this is the HD
,EdMaN8883,2011-06-13T09:31Z,Thanks for the HD file!! Looking forward to 1080
,H311,2011-06-13T10:03Z,"i confess that i love when rain during GPs but that was to much for me lol

also that's a hell of work so thanks very much man"
,DMWill,2011-06-13T10:04Z,thanks a ton for the race coverage
,123f1,2011-06-13T10:51Z,please seeeed!!!!!
,giffo5,2011-06-13T14:30Z,"Thanks for the awesome effort !!
I can only imagine the file size is coz of the length?

Sorry...im not reading the comments incase someone writes a spoiler...lol"
,jorrell0733,2011-06-13T23:39Z,"Thankyou for this nan, my pvr missed pretty much have of the coverage as it ended up 2 hrs over the scheduled time slot. Appreciate your effort in HD. Quick question, What software/app do you use for your HD Recode from TS format?"
,EdoSensei,2011-06-14T00:52Z,"caradecus:
there is a 3.08 GB golficus/thebox upload of the race

Caradecus, where? On Piratebay? How do you search file size or golficus/thebox ???  I can't find it."
,Cock_Pushup,2011-06-15T07:16Z,Thanks!! Worth every GB!!
,monkman2112,2011-06-15T08:14Z,"Thx!

The Race in German:  http://thepiratebay.org/torrent/6464887/F1_2011_Kanada_Rennen_deutsch_Teil_1_von_2_korrigiert

http://thepiratebay.org/torrent/6464803/F1_2011_Kanada_Rennen_deutsch_Teil_2"
,MaccaInOz,2011-06-15T08:30Z,Many thanks from Australia! ;-)
,bginz,2011-06-15T16:52Z,"Thanks, good video and sound, nice to get f1 in HD"
,j5five,2011-06-16T22:10Z,you're the man for upping this whole thing. reps!
,God77,2011-07-31T13:15Z,EVERYTHING CANADIAN SUCKS
,brother.momas,2012-01-20T22:43Z,"Thanks very much, I've been after this for ages!  Only thing is, it appears I've got no sound..?  Have I done something wrong?"
