User Type,Username,Date,Text
,raj888,2011-03-22T17:35Z,"I DOWNLOADED ALMOST ALL U'R  UPOADS, U'R CLARITY IS AWESOME,PLZ TRY TO UPLOAD NARNIA 1,2 ALSO AS U UPLOADED THE 3RD PART IN HDLITE,WAITING FOR U'R RIP  PLZZZZZZZZZ DONT IGNORE MY REQUEST ATLEAST REPLY ABOUT UR DECISION"
[V],neon,2011-03-22T17:53Z,Hi raj....i dont pick the movies ..i only upload them....Release-Lounge have a great team of people who encode... as do HDLITE... so i cant answer your question...if they decide to do them they will be hopefully be uploaded on piratebay :)
,raj888,2011-03-22T18:24Z,thanks for ur reply r u on 1337x.org
,raj888,2011-03-22T18:27Z,"just now noticed same ur upload chronicels of narina dawn of the voyager uploaded in 1337x.org by the uploader name DEAFTONE i saw previous uploads then i found narnia  1,2 also anyhow thanskss especially ur animated movies clarity rockzzzzzzzz"
[V],neon,2011-03-22T18:53Z,deaftone is one of HDLITES encoders...its thanks to him and lifechanger for the great HDLITE torrents 
,billylopez,2011-03-23T14:21Z,"hey neon any chance u could download HIGH SCHOOL 2010???

http://www.imdb.com/title/tt1247667/"
,billylopez,2011-03-23T14:35Z,"Hey neonrainbow

Any chance u could upload ""High School""????

http://www.imdb.com/title/tt1247667/

Can't find it anywhere  :("
,hah024,2011-03-23T20:24Z,don´t spam
