User Type,Username,Date,Text
[S],velvet.,2011-08-11T18:19Z,"Do not upload the same item more than once.
Your previous upload of this has been deleted."
,Blind Pew,2011-08-11T18:47Z,"Sorry, thanks!"
,CandyKing666,2011-08-15T08:43Z,"velvet: This is NOT the same as the other. The two before is Audiobooks, this one is Radio Theater from Swedish Radio!"
,Blind Pew,2011-09-07T18:34Z,"No, velvet is right. I uploaded this again when I discovered som minor errors in the info-file.

And, yes! This is the SR-version, the one and only!
;)"
