User Type,Username,Date,Text
,camos1,2011-07-31T10:23Z,"Love your work son. Sick torrent !!!!!!!!!!!!!!!!!!!
Can you please let me know how you captured it from i tunes been trying but can't work it out.
Thanks Heaps."
,Black_Iceee,2011-08-04T00:05Z,"Hi there
Is it possible that you can upload the Chase and status set @ iTunes festival? I can't because I have a down- and upload limitation.. -.-'
Thanks a lot!! ;)

btw: this is a nice one! what program do you use?"
,deeps17,2011-08-05T09:43Z,wowww.... fast download and thanks a lot for the upload....!
,mikaLOG,2011-08-05T21:04Z,thankyou for sharing this! it's absolutely brilliant!
,minhduong,2011-08-12T14:05Z,I captured with Replay AV. Search Google for how to use it :)
,drxoox,2011-08-21T04:29Z,"thank you for uploading this, i have a big smile on my face and can't wipe it off:)"
,mrbean1905,2011-08-24T15:58Z,Great quality! Thanks for sharing. I am hoping to find the iTunes Festival Foo Figters with a similar quality.
