User Type,Username,Date,Text
,ferdie82x,2011-07-02T12:43Z,this must be whats on 1080p not a cam ts copy
,oracle00,2011-07-02T13:17Z,any screenshot for this movie??
,Strayng3r,2011-07-02T13:23Z,a ? v ??
,sneak_shot,2011-07-02T13:25Z,iz there any cut like in the previous 1 . it had 13min cut!!!!!
,Zanda777,2011-07-02T13:54Z,"Fuck off Fullcoolmul, i've seen someone post that link on another torrent page. Its a fucking survey site."
,rcr29budcar,2011-07-02T14:14Z,"Fullcoolmul, it is NOT whats there! We've told you people that we don't need and DON'T want your shit here! Stop advertising for your stupid spam sites! Do the right thing and go away. We know what you are doing and its not WANTED! LEAVE!  And cad40, thank you and the other skulls for providing people with what they want. It is appreciated."
,dinosaur58,2011-07-02T18:20Z,The NFO is an exact copy of other versions. I guess TS doesn't always mean LINE audio. @sneak_shot: I would assume it is the same as others unless specifically mentions NEW video source. Other versions using this NFO are missing the Narrated setup [~10 min] at the beginning AND the last lines of dialog are in Russian. They're still pretty watchable though.
,vaikou15,2011-07-02T21:40Z,Seeders but no comments weird  i m downloading comment back later good speed
,kjuricic,2011-07-02T22:06Z,this is a fake. dont donload
[T],cad40,2011-07-02T23:14Z,@kjuricic go fuck with your stupid comments arsehole
,JOCOM1945,2011-07-03T01:07Z,any true comment?
,7gary7,2011-07-03T05:04Z,why r u guys takin so much risk in downloadin....der are so much other links download this movie from it
,seeloa81,2011-07-03T09:27Z,i cant play this movie.......how to play
,rampage007,2011-07-04T10:08Z,"Thanks cad40, this is awesome. I'll be shadowing you for more torrents XD."
,Boojie97,2011-07-04T16:35Z,hope this is good O.o
,ish0017,2011-07-05T12:25Z,"cad40 well done man...thank u for uploading this...
to the people who claimed this to be fake...go fuck urselves...
a=7
v=8
overall=outsatnding "
