User Type,Username,Date,Text
,Iztok1967,2011-07-20T10:55Z,"Download torrent and magnet link dosent work for me :(.

Is there some other way or place where i can download thise?

Thank you.

I apologise for my english, it is not my native language."
,tande89,2011-10-26T15:48Z,"iztok

do you have a torrent program like utorrent ? 

if then i would advise to google fallout 2 download

and best of luck. one of the best games in history if you ask me."
,tande89,2011-10-26T15:49Z,"haha. as it seems i tried to dl this one to. and it seems the torrent has been removed. error 404.
try another fallout 2 torrent."
