User Type,Username,Date,Text
,gmerz2011,2011-05-10T18:29Z,Dont ask me y no seeds ..Coz.i dont know to seed !!
,gmerz2011,2011-05-11T07:38Z,"Hey guys dont worry abt seeds ...there will be no problem ,,,in download speed!!!"
,mtn1996,2011-05-25T20:15Z,needs a really powerfull machin to expirence at the fullist
,gmerz2011,2011-06-03T18:19Z,@mtn1996: They say that it needs but It needs just a 512 mb grapics card and 2gb ram to enjoy ..But to be a pro Need atleast 1gb grapics card a 5gb ram ...any way ENjoy !
,KILR153,2011-06-18T05:01Z,is this an FLT???
,Plymith,2011-07-13T21:31Z,"Not a single seeder...wow. Still has a great download speed though, on par with some of the oneswith like 40 seeds. Time to see how this works out..."
,Plymith,2011-07-13T21:56Z,I spoke too soon x_x the speed went down to 0.1 kb/s...at only 5%.
,vivek776,2012-03-20T16:59Z,"this is copressed he he he
i have crysis of 4 gb approx."
