User Type,Username,Date,Text
,Ponyoo,2011-05-24T12:20Z,Thanks. 
,Ponyoo,2011-05-24T13:37Z,"Actually, right now,  there's no seeder..and everyone struck on 0.00%.... Uploader, please seed... "
,Ponyoo,2011-05-24T18:24Z,Five hours....no seed.... ARE YOU FUCKING KIDDING US??? 
,Tufa_911,2011-05-24T19:03Z,"I'll back now, and there is no seeding !!!
Strange, there is a connection ..."
,Ponyoo,2011-05-24T19:06Z,"
F   U  C  K        Y O U 


F   U  C  K   YOU  

F  U  C  K   Y  O U  
"
,Tufa_911,2011-05-24T20:07Z,In the above post you now see that the upload is now working. The estimated upload time is 70 hours.
,Tufa_911,2011-05-25T20:00Z,"Now, I see--  ""Ponyoo"" was possibly not connected among the 3-4 first peers. The there was an outage -- unknown reason. Next time I back-up with another seeder!"
,Tufa_911,2011-05-27T15:20Z,"This video is, of course, for editing!
If you want to play it, the http://www.videolan.org/ player works better than the microsoft as it is easy to adjust the aspect ratio."
,Tufa_911,2011-05-28T21:18Z,"Must share this with you!

http://hot-file-search.com/tv-file/Japan-2011-03-11-TVrecording-Tufa-MP2_612200821.html"
