Filename,Size,Unit
It's A Wonderful Life [1946] 480p BRrip SmartGuy Silver RG.mp4,423.36,M
Sample - It's A Wonderful Life [1946] 480p BRrip SmartGuy Silver RG.mp4,2.61,M
Subtitles/Vietnamese.srt,346.73,K
Subtitles/English.srt,177.06,K
SilverRG NFO Read it.nfo,8.46,K
READ THIS!!.txt,188,B
Links/Torrent downloaded from Sceneunderground.org.txt,55,B
Links/Torrent downloaded from Silvertorrents.me.txt,52,B
Links/Torrent downloaded from thepiratebay.org.txt,51,B
Links/Torrent downloaded from ExtraTorrent.com.txt,51,B
Links/Torrent downloaded from Puretorrents.cc.txt,50,B
Links/Torrent downloaded from Demonoid.me.txt,46,B
Links/Torrent downloaded from h33t.com.txt,43,B
Links/Torrent downloaded from Kickasstorrents.com.txt,43,B
Links/Torrent downloaded from Limetorrents.com.txt,40,B
Links/Torrent downloaded from 1337x.org.txt,24,B
